{
    "Report Type": "Corporate Financial Report",
    "Report Time": "2019",
    "Company Information": {
        "Name": "Energen Solutions Ltd",
        "Establishment Date": "March 10, 2005",
        "Main Business": "Energen Solutions is a leading provider of renewable energy solutions, specializing in solar and wind power projects. The company designs, installs, and maintains sustainable energy systems for residential, commercial, and industrial clients.",
        "Registration Location": "Seattle, Washington",
        "Listing Status": "Publicly Listed",
        "Industry": "Energy"
    },
    "Report Content": [
        {
            "Type": "Financial Information",
            "Significant Events": [
                {
                    "Event": "Asset Restructuring",
                    "Time": "January, 2019",
                    "Description": "The company underwent an asset restructuring, consolidating its wind power division and divesting non-performing solar power assets.",
                    "Impact": "Improved operational efficiency, increased company value.",
                    "Sub Events": [
                        {
                            "Event": "Change in Senior Management",
                            "Time": "February, 2019",
                            "Description": "Energen Solutions Ltd appointed a new CEO and CFO, bringing in experienced executives with a track record of successfully leading companies in the renewable energy sector.",
                            "Impact": "Boosted investor confidence, improved strategic decision-making."
                        },
                        {
                            "Event": "Strategic Partnership with a Construction Firm",
                            "Time": "April, 2019",
                            "Description": "Energen Solutions Ltd entered into a strategic partnership with a well-known construction firm specializing in renewable energy projects. The partnership aimed to leverage the construction firm's expertise in project execution and streamline the development process.",
                            "Impact": "Strengthened project execution capabilities, accelerated project timelines."
                        },
                        {
                            "Event": "Expansion into New Geographic Markets",
                            "Time": "June, 2019",
                            "Description": "Energen Solutions Ltd identified and entered new geographic markets with favorable renewable energy policies and high demand for solar and wind power solutions.",
                            "Impact": "Increased customer base, diversified revenue streams."
                        },
                        {
                            "Event": "Successful Completion of Large-Scale Wind Farm Project",
                            "Time": "September, 2019",
                            "Description": "Energen Solutions Ltd successfully completed the construction and commissioning of a large-scale wind farm project, significantly expanding its renewable energy generation capacity.",
                            "Impact": "Increased revenue, enhanced reputation in the market."
                        },
                        {
                            "Event": "Launch of Innovative Solar Panel Technology",
                            "Time": "November, 2019",
                            "Description": "Energen Solutions Ltd launched a revolutionary solar panel technology that improved efficiency, durability, and aesthetics. The innovative panels gained attention from both residential and commercial customers.",
                            "Impact": "Increased sales, competitive advantage in the market."
                        }
                    ]
                },
                {
                    "Event": "Large-scale Financing",
                    "Time": "February, 2019",
                    "Description": "The company conducted a large-scale financing activity, raising $500 million of funds through a successful bond issuance.",
                    "Impact": "Strengthened the company's financial strength, supported expansion and development."
                },
                {
                    "Event": "Debt Restructuring",
                    "Time": "May, 2019",
                    "Description": "To optimize capital structure, the company underwent debt restructuring, reducing liabilities by $200 million through debt refinancing and negotiating better terms with lenders.",
                    "Impact": "Improved the company's financial condition, reduced financial costs."
                },
                {
                    "Event": "Significant Equity Acquisition",
                    "Time": "June, 2019",
                    "Description": "The company completed the acquisition of 30% equity of SunPower Corp, a leading solar energy company, for $350 million.",
                    "Impact": "Further expanded the company's market share, enhanced the company's control."
                },
                {
                    "Event": "Major Investment",
                    "Time": "August, 2019",
                    "Description": "The company invested $80 million in Project Solaris, a large-scale solar power project in California, positioning itself for significant revenue growth in the solar sector.",
                    "Impact": "Further broadened the company's business areas, enhanced profitability."
                },
                {
                    "Event": "Project Delay",
                    "Time": "September, 2019",
                    "Description": "Due to unforeseen regulatory challenges, Project Solaris experienced a delay in construction, resulting in higher than projected costs and revenue deferral.",
                    "Impact": "Temporarily impacted profitability and cash flow."
                },
                {
                    "Event": "Major Asset Acquisition",
                    "Time": "October, 2019",
                    "Description": "The company completed the asset acquisition of WindTech Inc, a leading wind turbine manufacturer, for $250 million, consolidating its position in the wind power industry.",
                    "Impact": "Expanded the company's business scope, enhanced market competitiveness."
                },
                {
                    "Event": "Dividend Distribution",
                    "Time": "November, 2019",
                    "Description": "The company decided to distribute $25 million of dividends to shareholders, reflecting its strong financial performance and commitment to shareholder returns.",
                    "Impact": "Returned to the investors, enhanced shareholder returns."
                }
            ],
            "Involved Indicators": [
                {
                    "Indicator": "Operating Income",
                    "Description": "The total amount of main business income and other business income within a certain accounting period.",
                    "Influencing Factors": [
                        "Market Demand",
                        "Changes in Product Prices"
                    ],
                    "Value": "$650 million"
                },
                {
                    "Indicator": "Net Profit",
                    "Description": "The net income of the company within a certain accounting period, i.e., total income minus total costs and taxes.",
                    "Influencing Factors": [
                        "Operating Income",
                        "Cost Control",
                        "Non-recurring Gains and Losses"
                    ],
                    "Value": "$120 million"
                },
                {
                    "Indicator": "Total Assets",
                    "Description": "The total amount of assets owned by the company at the end of the accounting period.",
                    "Influencing Factors": [
                        "Asset Acquisition",
                        "Asset Disposal",
                        "Asset Revaluation"
                    ],
                    "Value": "$2.3 billion"
                },
                {
                    "Indicator": "Total Liabilities",
                    "Description": "The total amount of debts the company is obligated to repay at the end of the accounting period.",
                    "Influencing Factors": [
                        "New Debt Issuance",
                        "Debt Repayment",
                        "Debt Restructuring"
                    ],
                    "Value": "$800 million"
                },
                {
                    "Indicator": "Shareholder Equity",
                    "Description": "The total amount of equity belonging to shareholders at the end of the accounting period.",
                    "Influencing Factors": [
                        "Net Profit",
                        "Dividend Distribution",
                        "Capital Reserves"
                    ],
                    "Value": "$1.5 billion"
                },
                {
                    "Indicator": "Cash Flow",
                    "Description": "The total cash inflows and outflows of the company within a certain accounting period.",
                    "Influencing Factors": [
                        "Operating Activities",
                        "Investment Activities",
                        "Financing Activities"
                    ],
                    "Value": "$300 million"
                },
                {
                    "Indicator": "Debt Ratio",
                    "Description": "The ratio of total liabilities to total assets, reflecting the company's debt level.",
                    "Influencing Factors": [
                        "Changes in Total Liabilities",
                        "Changes in Total Assets"
                    ],
                    "Value": "34.78%"
                },
                {
                    "Indicator": "Debt to Assets Ratio",
                    "Description": "The percentage of total liabilities to total assets, a measure of the company's financial leverage.",
                    "Influencing Factors": [
                        "Increases or decreases in assets and liabilities"
                    ],
                    "Value": "35.56%"
                },
                {
                    "Indicator": "Return on Equity",
                    "Description": "Reflects the operational efficiency of shareholder equity, namely the ratio of net profit to average shareholder equity.",
                    "Influencing Factors": [
                        "Change in Net Profit",
                        "Change in Shareholder Equity"
                    ],
                    "Value": "8.00%"
                }
            ]
        }
    ],
    "Additional Information": [
        {
            "Name": "Future Outlook",
            "Content": [
                {
                    "Name": "Financial Strategy",
                    "Description": "Energen Solutions aims to strengthen its financial position through cost control measures and effective capital management. The company plans to optimize operational expenses and diversify funding sources to support future growth."
                },
                {
                    "Name": "Investment Plans",
                    "Description": "The company's future investment plans include expanding its renewable energy project portfolio through targeted acquisitions and strategic partnerships. Energen Solutions will focus on developing innovative technologies and entering new markets to capture emerging opportunities."
                },
                {
                    "Name": "Risk Management",
                    "Description": "Energen Solutions has identified major financial risks, such as regulatory changes, project delays, and cybersecurity threats. The company will implement robust risk mitigation strategies, including comprehensive monitoring systems, contingency plans, and continuous staff training."
                }
            ]
        }
    ],
    "Generated Outline": "Outline for Corporate Financial Report - Energen Solutions Ltd - 2019\n\nI. Introduction\n    A. Company Information\n        1. Name: Energen Solutions Ltd\n        2. Establishment Date: March 10, 2005\n        3. Main Business: Provider of renewable energy solutions specializing in solar and wind power projects\n        4. Registration Location: Seattle, Washington\n        5. Listing Status: Publicly Listed\n        6. Industry: Energy\n\nII. Financial Information - 2019\n    A. Significant Events\n        1. Asset Restructuring (January, 2019)\n            a. Consolidated wind power division and divested non-performing solar power assets\n            b. Impact: Improved operational efficiency and increased company value\n            \n            - Change in Senior Management (February, 2019)\n                i. Appointment of new CEO and CFO with renewable energy sector expertise\n                ii. Impact: Boosted investor confidence and improved strategic decision-making\n\n            - Strategic Partnership with a Construction Firm (April, 2019)\n                i. Collaboration with a construction firm specializing in renewable energy projects\n                ii. Impact: Strengthened project execution capabilities and accelerated project timelines\n\n            - Expansion into New Geographic Markets (June, 2019)\n                i. Entry into favorable markets with high demand for renewable energy solutions\n                ii. Impact: Increased customer base and diversified revenue streams\n\n            - Successful Completion of Large-Scale Wind Farm Project (September, 2019)\n                i. Construction and commissioning of a large-scale wind farm project\n                ii. Impact: Increased revenue and enhanced market reputation\n\n            - Launch of Innovative Solar Panel Technology (November, 2019)\n                i. Introduction of revolutionary solar panel technology with improved efficiency, durability, and aesthetics\n                ii. Impact: Increased sales and competitive advantage\n\n        2. Large-scale Financing (February, 2019)\n            a. Raised $500 million through successful bond issuance\n            b. Impact: Strengthened financial strength and supported expansion\n\n        3. Debt Restructuring (May, 2019)\n            a. Reduced liabilities by $200 million through debt refinancing and better terms with lenders\n            b. Impact: Improved financial condition and reduced financial costs\n\n        4. Significant Equity Acquisition (June, 2019)\n            a. Acquired 30% equity of SunPower Corp for $350 million\n            b. Impact: Expanded market share and enhanced control\n\n        5. Major Investment (August, 2019)\n            a. Invested $80 million in Project Solaris, a large-scale solar power project in California\n            b. Impact: Broadened business areas and enhanced profitability\n\n        6. Project Delay (September, 2019)\n            a. Delay in construction of Project Solaris due to unforeseen regulatory challenges\n            b. Impact: Temporarily impacted profitability and cash flow\n\n        7. Major Asset Acquisition (October, 2019)\n            a. Completed asset acquisition of WindTech Inc, a leading wind turbine manufacturer, for $250 million\n            b. Impact: Expanded business scope and enhanced market competitiveness\n\n        8. Dividend Distribution (November, 2019)\n            a. Decided to distribute $25 million of dividends to shareholders\n            b. Impact: Enhanced shareholder returns\n\n    B. Involved Indicators\n        1. Operating Income ($650 million)\n            - Influencing factors: Market demand and changes in product prices\n\n        2. Net Profit ($120 million)\n            - Influencing factors: Operating income, cost control, and non-recurring gains and losses\n\n        3. Total Assets ($2.3 billion)\n            - Influencing factors: Asset acquisition, asset disposal, and asset revaluation\n\n        4. Total Liabilities ($800 million)\n            - Influencing factors: New debt issuance, debt repayment, and debt restructuring\n\n        5. Shareholder Equity ($1.5 billion)\n            - Influencing factors: Net profit, dividend distribution, and capital reserves\n\n        6. Cash Flow ($300 million)\n            - Influencing factors: Operating activities, investment activities, and financing activities\n\n        7. Debt Ratio (34.78%)\n            - Influencing factors: Changes in total liabilities and total assets\n\n        8. Debt to Assets Ratio (35.56%)\n            - Influencing factors: Increases or decreases in assets and liabilities\n\n        9. Return on Equity (8.00%)\n            - Influencing factors: Change in net profit and change in shareholder equity\n\nIII. Future Outlook\n    A. Financial Strategy\n        - Aim to strengthen financial position through cost control measures and effective capital management\n        - Optimize operational expenses and diversify funding sources to support future growth\n\n    B. Investment Plans\n        - Expand renewable energy project portfolio through targeted acquisitions and strategic partnerships\n        - Focus on developing innovative technologies and entering new markets to capture emerging opportunities\n\n    C. Risk Management\n        - Identify major financial risks such as regulatory changes, project delays, and cybersecurity threats\n        - Implement robust risk mitigation strategies, including monitoring systems, contingency plans, and staff training\n\nIV. Conclusion\n\nNote: This outline includes all the time points and events mentioned in the JSON, as well as the indicators and additional information provided.",
    "Generated Summary": "Energen Solutions Ltd, established on March 10, 2005, is a publicly listed renewable energy company based in Seattle, Washington that specializes in designing, installing, and maintaining solar and wind power systems for residential, commercial, and industrial clients.",
    "Generated Article": "In 2019, Energen Solutions Ltd experienced several significant events that shaped its financial performance and strategic direction. Firstly, the company underwent an asset restructuring in January, consolidating its wind power division and divesting non-performing solar power assets. This move improved operational efficiency and increased the company's overall value. Additionally, in February, Energen Solutions Ltd raised $500 million through a successful bond issuance, strengthening its financial position and supporting future expansion.\n\nIn February, the company also experienced a change in senior management, with the appointment of a new CEO and CFO who brought extensive expertise in the renewable energy sector. This change boosted investor confidence and improved strategic decision-making within the company. Furthermore, in April, Energen Solutions Ltd formed a strategic partnership with a construction firm specializing in renewable energy projects. This collaboration strengthened the company's project execution capabilities and accelerated project timelines.\n\nIn June, Energen Solutions Ltd expanded into new geographic markets that had a high demand for renewable energy solutions. This strategic move increased the company's customer base and diversified its revenue streams. Later in September, the company successfully completed a large-scale wind farm project, which not only increased its revenue but also enhanced its market reputation.\n\nIn November, Energen Solutions Ltd launched an innovative solar panel technology with improved efficiency, durability, and aesthetics. This introduction of revolutionary technology resulted in increased sales and provided the company with a competitive advantage in the market. Additionally, in the same month, the company decided to distribute $25 million of dividends to its shareholders, enhancing shareholder returns.\n\nThroughout the year, Energen Solutions Ltd made significant investments and acquisitions. In June, the company acquired 30% equity of SunPower Corp for $350 million, expanding its market share and enhancing its control. In August, Energen Solutions Ltd invested $80 million in Project Solaris, a large-scale solar power project in California, which broadened its business areas and enhanced profitability. In October, the company completed the asset acquisition of WindTech Inc, a leading wind turbine manufacturer, for $250 million. This acquisition expanded the company's business scope and enhanced its market competitiveness.\n\nWhile Energen Solutions Ltd experienced several positive events in 2019, it also faced challenges. In September, the construction of Project Solaris was delayed due to unforeseen regulatory challenges, which temporarily impacted profitability and cash flow. However, the company's overall financial performance remained strong.\n\nIn terms of financial indicators, Energen Solutions Ltd reported an operating income of $650 million in 2019. This was influenced by market demand and changes in product prices. The company's net profit for the year was $120 million, which was influenced by factors such as operating income, cost control, and non-recurring gains and losses. Energen Solutions Ltd's total assets stood at $2.3 billion, influenced by asset acquisition, disposal, and revaluation. The company's total liabilities were $800 million, influenced by new debt issuance, debt repayment, and debt restructuring. Shareholder equity amounted to $1.5 billion, influenced by net profit, dividend distribution, and capital reserves. The company generated a cash flow of $300 million, influenced by operating activities, investment activities, and financing activities. Energen Solutions Ltd maintained a debt ratio of 34.78% and a debt to assets ratio of 35.56%, indicating a healthy financial position. The company's return on equity was 8.00%, influenced by changes in net profit and shareholder equity.\n\nLooking ahead, Energen Solutions Ltd aims to strengthen its financial position through cost control measures and effective capital management. The company plans to optimize operational expenses and diversify funding sources to support future growth. Additionally, Energen Solutions Ltd intends to expand its renewable energy project portfolio through targeted acquisitions and strategic partnerships. The company will focus on developing innovative technologies and entering new markets to capture emerging opportunities. To mitigate financial risks, Energen Solutions Ltd will identify and address major risks such as regulatory changes, project delays, and cybersecurity threats. The company will implement robust risk mitigation strategies, including monitoring systems, contingency plans, and staff training.\n\nIn conclusion, Energen Solutions Ltd had a transformative year in 2019, marked by significant events that shaped its financial performance and strategic direction. The company's asset restructuring, strategic partnerships, acquisitions, and investments contributed to its growth and enhanced market competitiveness. Despite challenges faced, Energen Solutions Ltd maintained a strong financial position and remains focused on strengthening its financial position, expanding its project portfolio, and mitigating risks in the future."
}