{
    "报告类型": "公司治理报告",
    "报告时间": "2021年度",
    "公司信息": {
        "名称": "阳光传媒集团有限公司",
        "成立日期": "2005年6月15日",
        "主营业务": "一家集电视剧制作、演艺活动、广告代理和影视投资为一体的媒体公司",
        "注册地": "北京市",
        "上市情况": "已在香港交易所上市",
        "行业": "媒体"
    },
    "报告内容": [
        {
            "类型": "治理结构",
            "重要事件": [
                {
                    "事件": "股东大会决议",
                    "时间": "2021年2月",
                    "描述": "公司召开了年度股东大会，通过了一项重要决议，将以发行股份的方式收购一家电视剧制作公司。",
                    "影响": "此次决议将拓展公司的主营业务，加强对电视剧制作领域的控制力，有助于提升公司市场竞争力和盈利能力。",
                    "子事件": [
                        {
                            "事件": "收购目标公司的尽职调查",
                            "时间": "2021年1月",
                            "描述": "阳光传媒集团有限公司开始对目标电视剧制作公司进行详尽的尽职调查。此次调查包括对目标公司的财务状况、运营情况、知识产权、合同与协议等方面进行全面评估。",
                            "影响": "尽职调查结果将为公司提供重要决策的依据，确保收购交易的合理性和可行性。"
                        },
                        {
                            "事件": "股东大会提议",
                            "时间": "2021年1月",
                            "描述": "董事会向股东大会提议收购目标公司。提议中包括股份发行方案、目标公司估值、收购目的与战略等内容。",
                            "影响": "股东大会对收购提议的通过为后续收购交易的进行提供了必要的法律依据和授权。"
                        },
                        {
                            "事件": "出具独立评估报告",
                            "时间": "2021年1月",
                            "描述": "公司委托独立机构对目标公司进行评估，出具独立评估报告。该报告将目标公司的估值带入收购交易的谈判和决策过程。",
                            "影响": "独立评估报告为收购交易提供了公正客观的估值依据，确保交易的公平性和合理性。"
                        }
                    ]
                },
                {
                    "事件": "高级管理层变动",
                    "时间": "2021年3月",
                    "描述": "公司任命了一位新任首席执行官，他具有丰富的媒体产业经验和创新思维。",
                    "影响": "新任CEO将带领公司制定更为务实的经营策略，并加强与合作伙伴的合作，为公司的长期发展提供强有力的支持。"
                },
                {
                    "事件": "可持续性与社会责任倡议",
                    "时间": "2021年5月",
                    "描述": "公司发布了一份可持续性报告，并承诺加强对环境保护和社会责任的投入。",
                    "影响": "公司积极履行企业公民责任，提升了公众形象和客户信任，为公司未来的可持续发展奠定了基础。"
                },
                {
                    "事件": "董事会变更",
                    "时间": "2021年7月",
                    "描述": "公司董事会迎来新的成员，其中包括了著名电影导演张伟。",
                    "影响": "此次董事会变更将为公司带来丰富的创意和战略指导，有助于进一步提升公司在影视行业的影响力。"
                },
                {
                    "事件": "合规与监管更新",
                    "时间": "2021年8月",
                    "描述": "公司对最新的证券法和公司法的变化进行了适应，并更新了公司合规标准。",
                    "影响": "通过更新合规标准，公司确保了自身在法律法规方面的合规性，降低了法律风险，并加强了对股东利益的保护。"
                },
                {
                    "事件": "风险管理举措",
                    "时间": "2021年9月",
                    "描述": "公司强化了风险管理框架，提升了新风险的识别能力，并制定了相应的缓解策略。",
                    "影响": "通过优化风险管理举措，公司提高了对内外部风险的应对能力，保障了公司的持续健康发展。"
                },
                {
                    "事件": "公司治理政策修订",
                    "时间": "2021年10月",
                    "描述": "公司进行了治理政策的修订，加强了对高级管理层行为的监督和问责机制。",
                    "影响": "通过修订公司治理政策，公司进一步提高了决策的透明度和内部控制的效果，增强了对投资者的吸引力。"
                },
                {
                    "事件": "道德与诚信事件",
                    "时间": "2021年11月",
                    "描述": "公司发生了一起道德与诚信事件，相关负责人因涉嫌利益冲突进行了调查，并进行了妥善处理。",
                    "影响": "公司通过及时而妥善的处理方式，维护了公司声誉和客户信任，进一步提升了公司的道德标准和诚信形象。"
                }
            ],
            "涉及的指标": [
                {
                    "指标": "信息披露",
                    "描述": "公司积极主动披露公司治理、重大决策和财务情况，信息准确、全面、及时。",
                    "值": "公司每季度披露财报，并定期发布公司治理报告，信息披露覆盖股东、投资者、媒体等利益相关者。"
                },
                {
                    "指标": "关联交易",
                    "描述": "公司设立关联交易审批流程，并确保关联交易的公正性和合规性。",
                    "值": "公司设立专门的关联交易审批委员会，严格审核所有关联交易，并根据相关法律法规进行公示和披露。"
                },
                {
                    "指标": "内部控制",
                    "描述": "公司建立完善的内部控制制度，确保财务和运营风险的有效管理。",
                    "值": "公司每年进行内部控制自评，并聘请独立的审计机构对内部控制的有效性进行审计，确保内部控制的适当性和有效性。"
                }
            ]
        }
    ],
    "额外信息": [
        {
            "名称": "治理改进计划",
            "内容": [
                {
                    "名称": "加强董事会和监事会功能",
                    "描述": "公司将增加独立董事的比例，并定期组织董事会和监事会的培训，提升其在公司治理中的效率和效果。",
                    "补充描述": "公司还将优化决策过程，加强董事会和监事会之间的协作和沟通，确保高效的公司治理。"
                },
                {
                    "名称": "提升透明度和信息披露质量",
                    "描述": "公司将进一步改进信息披露流程和标准，确保及时、准确、全面地向所有利益相关者报告公司情况。",
                    "补充描述": "公司将加大投入，提升信息披露的质量和透明度，通过多种渠道与利益相关者进行有效的沟通和交流。"
                }
            ]
        },
        {
            "名称": "风险管理策略",
            "内容": [
                {
                    "名称": "内部控制系统强化",
                    "描述": "公司将进一步建立和完善内部控制系统，加强财务和运营风险的识别、评估、监控和报告。",
                    "补充描述": "公司将采用先进的技术手段，提升内部控制的自动化程度，确保内部控制的全面性和准确性。"
                },
                {
                    "名称": "可持续发展和社会责任整合",
                    "描述": "公司将将可持续发展和社会责任纳入公司战略，并识别相关风险和机会，促进长期价值创造。",
                    "补充描述": "公司将积极开展可持续发展项目，积极履行企业公民责任，为社会发展和环境保护作出更大贡献。"
                }
            ]
        }
    ],
    "生成大纲": "公司治理报告大纲\n\n一、治理结构\n1. 股东大会决议\n    - 描述：公司通过股东大会决议，决定通过发行股份的方式收购一家电视剧制作公司。\n    - 影响：此次决议将拓展公司的主营业务，加强对电视剧制作领域的控制力，有助于提升公司市场竞争力和盈利能力。\n    - 子事件：\n        - 收购目标公司的尽职调查：2021年1月，进行了对目标公司的尽职调查，确定收购交易的合理性和可行性。\n        - 股东大会提议：2021年1月，董事会向股东大会提议收购目标公司，为后续交易提供法律授权。\n        - 出具独立评估报告：2021年1月，公司委托独立机构对目标公司进行评估，提供公正客观的估值依据。\n\n2. 高级管理层变动\n    - 描述：公司任命了一位具有丰富媒体产业经验和创新思维的新任首席执行官。\n    - 影响：新任CEO将带领公司制定更为务实的经营策略，并加强与合作伙伴的合作，为公司的长期发展提供强有力的支持。\n\n3. 可持续性与社会责任倡议\n    - 描述：公司发布了一份可持续性报告，并承诺加强对环境保护和社会责任的投入。\n    - 影响：公司积极履行企业公民责任，提升了公众形象和客户信任，为公司未来的可持续发展奠定了基础。\n\n4. 董事会变更\n    - 描述：公司董事会迎来新成员，其中包括了著名电影导演张伟。\n    - 影响：此次董事会变更将为公司带来丰富的创意和战略指导，有助于进一步提升公司在影视行业的影响力。\n\n5. 合规与监管更新\n    - 描述：公司对最新的证券法和公司法的变化进行了适应，并更新了公司合规标准。\n    - 影响：通过更新合规标准，公司确保了自身在法律法规方面的合规性，降低了法律风险，并加强了对股东利益的保护。\n\n6. 风险管理举措\n    - 描述：公司强化了风险管理框架，提升了新风险的识别能力，并制定了相应的缓解策略。\n    - 影响：通过优化风险管理举措，公司提高了对内外部风险的应对能力，保障了公司的持续健康发展。\n\n7. 公司治理政策修订\n    - 描述：公司进行了治理政策的修订，加强了对高级管理层行为的监督和问责机制。\n    - 影响：通过修订公司治理政策，公司进一步提高了决策的透明度和内部控制的效果，增强了对投资者的吸引力。\n\n8. 道德与诚信事件\n    - 描述：公司发生了一起道德与诚信事件，并进行了妥善处理。\n    - 影响：公司通过及时而妥善的处理方式，维护了公司声誉和客户信任，进一步提升了公司的道德标准和诚信形象。\n\n二、涉及的指标\n1. 信息披露\n    - 描述：公司积极主动披露公司治理、重大决策和财务情况，信息准确、全面、及时。\n    - 值：公司每季度披露财报，并定期发布公司治理报告，信息披露覆盖股东、投资者、媒体等利益相关者。\n\n2. 关联交易\n    - 描述：公司设立关联交易审批流程，并确保关联交易的公正性和合规性。\n    - 值：公司设立专门的关联交易审批委员会，严格审核所有关联交易，并根据相关法律法规进行公示和披露。\n\n3. 内部控制\n    - 描述：公司建立完善的内部控制制度，确保财务和运营风险的有效管理。\n    - 值：公司每年进行内部控制自评，并聘请独立的审计机构对内部控制的有效性进行审计，确保内部控制的适当性和有效性。\n\n三、治理改进计划\n1. 加强董事会和监事会功能\n    - 描述：公司将增加独立董事的比例，并定期组织董事会和监事会的培训，提升其在公司治理中的效率和效果。\n    - 补充描述：公司还将优化决策过程，加强董事会和监事会之间的协作和沟通，确保高效的公司治理。\n\n2. 提升透明度和信息披露质量\n    - 描述：公司将进一步改进信息披露流程和标准，确保及时、准确、全面地向所有利益相关者报告公司情况。\n    - 补充描述：公司将加大投入，提升信息披露的质量和透明度，通过多种渠道与利益相关者进行有效的沟通和交流。\n\n四、风险管理策略\n1. 内部控制系统强化\n    - 描述：公司将进一步建立和完善内部控制系统，加强财务和运营风险的识别、评估、监控和报告。\n    - 补充描述：公司将采用先进的技术手段，提升内部控制的自动化程度，确保内部控制的全面性和准确性。\n\n2. 可持续发展和社会责任整合\n    - 描述：公司将将可持续发展和社会责任纳入公司战略，并识别相关风险和机会，促进长期价值创造。\n    - 补充描述：公司将积极开展可持续发展项目，积极履行企业公民责任，为社会发展和环境保护作出更大贡献。",
    "生成总结": "阳光传媒集团有限公司是一家成立于2005年6月15日的北京市注册的媒体公司，主要从事电视剧制作、演艺活动、广告代理和影视投资业务，并已在香港交易所上市。",
    "生成文章": "公司治理结构方面，股东大会决议是公司治理的重要环节之一。在2021年，公司通过股东大会决议，决定通过发行股份的方式收购一家电视剧制作公司。这一决议的影响是拓展公司的主营业务，加强对电视剧制作领域的控制力，有助于提升公司市场竞争力和盈利能力。在此次决议之前，公司进行了对目标公司的尽职调查，并出具了独立评估报告，以确保收购交易的合理性和可行性。\n\n高级管理层变动也是公司治理结构的重要组成部分。公司任命了一位具有丰富媒体产业经验和创新思维的新任首席执行官。这一任命将带领公司制定更为务实的经营策略，并加强与合作伙伴的合作，为公司的长期发展提供强有力的支持。\n\n在可持续性与社会责任方面，公司发布了一份可持续性报告，并承诺加强对环境保护和社会责任的投入。这一举措有助于公司积极履行企业公民责任，提升了公众形象和客户信任，为公司未来的可持续发展奠定了基础。\n\n董事会变更也是公司治理结构的重要调整。公司董事会迎来了新成员，其中包括了著名电影导演张伟。这一变更将为公司带来丰富的创意和战略指导，有助于进一步提升公司在影视行业的影响力。\n\n合规与监管更新是公司治理结构中不可忽视的一环。公司对最新的证券法和公司法的变化进行了适应，并更新了公司合规标准。通过更新合规标准，公司确保了自身在法律法规方面的合规性，降低了法律风险，并加强了对股东利益的保护。\n\n风险管理举措是公司治理结构中的重要环节。公司强化了风险管理框架，提升了新风险的识别能力，并制定了相应的缓解策略。通过优化风险管理举措，公司提高了对内外部风险的应对能力，保障了公司的持续健康发展。\n\n公司治理政策的修订是为了加强对高级管理层行为的监督和问责机制。公司进行了治理政策的修订，进一步提高了决策的透明度和内部控制的效果，增强了对投资者的吸引力。\n\n在道德与诚信方面，公司发生了一起道德与诚信事件，并进行了妥善处理。通过及时而妥善的处理方式，公司维护了公司声誉和客户信任，进一步提升了公司的道德标准和诚信形象。\n\n信息披露是公司治理中的重要指标之一。公司积极主动披露公司治理、重大决策和财务情况，信息准确、全面、及时。公司每季度披露财报，并定期发布公司治理报告，信息披露覆盖股东、投资者、媒体等利益相关者。\n\n关联交易是公司治理中需要关注的指标之一。公司设立了关联交易审批流程，并确保关联交易的公正性和合规性。公司设立了专门的关联交易审批委员会，严格审核所有关联交易，并根据相关法律法规进行公示和披露。\n\n内部控制是公司治理中的重要指标之一。公司建立了完善的内部控制制度，确保财务和运营风险的有效管理。公司每年进行内部控制自评，并聘请独立的审计机构对内部控制的有效性进行审计，确保内部控制的适当性和有效性。\n\n为了进一步加强公司治理，公司制定了一系列治理改进计划。其中包括加强董事会和监事会功能，提升透明度和信息披露质量。公司将增加独立董事的比例，并定期组织董事会和监事会的培训，提升其在公司治理中的效率和效果。公司还将进一步改进信息披露流程和标准，确保及时、准确、全面地向所有利益相关者报告公司情况。\n\n在风险管理策略方面，公司将进一步强化内部控制系统，加强财务和运营风险的识别、评估、监控和报告。公司将采用先进的技术手段，提升内部控制的自动化程度，确保内部控制的全面性和准确性。同时，公司将将可持续发展和社会责任纳入公司战略，并识别相关风险和机会，促进长期价值创造。公司将积极开展可持续发展项目，积极履行企业公民责任，为社会发展和环境保护作出更大贡献。\n\n综上所述，阳光传媒集团有限公司在公司治理方面采取了一系列重要举措，包括股东大会决议、高级管理层变动、可持续性与社会责任倡议、董事会变更、合规与监管更新、风险管理举措、公司治理政策修订、道德与诚信事件的处理等。这些举措有助于提升公司的市场竞争力和盈利能力，加强公司在影视行业的影响力，确保公司的持续健康发展。公司还注重信息披露、关联交易和内部控制等指标的管理，以提高公司治理的透明度和有效性。未来，公司将继续加强董事会和监事会功能，提升透明度和信息披露质量，强化内部控制系统，整合可持续发展和社会责任，以进一步提升公司治理水平和长期价值创造能力。"
}