{
    "报告类型": "公司财务报告",
    "报告时间": "2021年度",
    "公司信息": {
        "名称": "阳光传媒集团有限公司",
        "成立日期": "2005年6月15日",
        "主营业务": "一家集电视剧制作、演艺活动、广告代理和影视投资为一体的媒体公司",
        "注册地": "北京市",
        "上市情况": "已在香港交易所上市",
        "行业": "媒体"
    },
    "报告内容": [
        {
            "类型": "财务信息",
            "重要事件": [
                {
                    "事件": "债务重组",
                    "时间": "2021年1月",
                    "描述": "为优化资本结构，公司进行了债务重组，减少了10亿元负债。",
                    "影响": "改善了公司的财务状况，降低了财务成本。",
                    "子事件": [
                        {
                            "事件": "签订债务重组协议",
                            "时间": "2020年11月",
                            "描述": "阳光传媒集团有限公司与债权机构达成协议，开始进行债务重组的谈判。",
                            "影响": "启动了债务重组的过程，为2021年的重要事件奠定了基础。"
                        },
                        {
                            "事件": "债务重组方案制定",
                            "时间": "2020年12月",
                            "描述": "阳光传媒集团有限公司制定了债务重组方案，包括减少10亿元负债。",
                            "影响": "明确了债务重组的目标和具体减少负债的数额。"
                        },
                        {
                            "事件": "债务重组协议签署",
                            "时间": "2021年1月",
                            "描述": "阳光传媒集团有限公司与债权机构正式签署了债务重组协议。",
                            "影响": "债务重组正式生效，公司负债减少10亿元。"
                        }
                    ]
                },
                {
                    "事件": "分发股利",
                    "时间": "2021年2月",
                    "描述": "公司决定向股东分发8亿元股利。",
                    "影响": "回报给股东们的投资，提升了股东的收益。"
                },
                {
                    "事件": "资产重组",
                    "时间": "2021年3月",
                    "描述": "公司进行了一次资产重组，优化了公司的业务结构。",
                    "影响": "提高了公司的运营效率，增加了公司的价值。"
                },
                {
                    "事件": "重大资产收购",
                    "时间": "2021年4月",
                    "描述": "公司完成了对阳光影视有限公司的资产收购，总价值20亿元。",
                    "影响": "扩大公司业务范围，增强市场竞争力。"
                },
                {
                    "事件": "重大股权收购",
                    "时间": "2021年7月",
                    "描述": "公司完成了对精英艺人经纪有限公司的股权收购，获得了70%的股权。",
                    "影响": "进一步扩大了公司的市场份额，提升了公司的控制力。"
                },
                {
                    "事件": "大规模融资",
                    "时间": "2021年9月",
                    "描述": "公司进行了一次大规模的融资活动，募集了15亿元资金。",
                    "影响": "加强了公司的资金实力，支持了公司的扩张和发展。"
                },
                {
                    "事件": "重大投资",
                    "时间": "2021年12月",
                    "描述": "公司投资了星光影业有限公司的新电视剧制作项目，投资金额为5亿元。",
                    "影响": "进一步拓宽了公司的业务领域，提升了公司的盈利能力。"
                }
            ],
            "涉及的指标": [
                {
                    "指标": "营业收入",
                    "描述": "公司在一定会计期间内的主营业务收入和其他业务收入总额。",
                    "影响因素": [
                        "市场需求",
                        "产品价格变化"
                    ],
                    "值": "238亿元"
                },
                {
                    "指标": "净利润",
                    "描述": "公司在一定会计期间的净收入，即总收入减去总成本和所得税费用后的金额。",
                    "影响因素": [
                        "营业收入",
                        "成本控制",
                        "非经常性损益"
                    ],
                    "值": "38亿元"
                },
                {
                    "指标": "总资产",
                    "描述": "会计期末，公司所拥有的资产总额。",
                    "影响因素": [
                        "资产收购",
                        "资产处置",
                        "资产重估"
                    ],
                    "值": "168亿元"
                },
                {
                    "指标": "总负债",
                    "描述": "会计期末，公司所承担并需要偿还的债务总额。",
                    "影响因素": [
                        "新债发行",
                        "债务偿还",
                        "债务重组"
                    ],
                    "值": "78亿元"
                },
                {
                    "指标": "股东权益",
                    "描述": "会计期末，归属于股东的权益总额。",
                    "影响因素": [
                        "净利润",
                        "股利发放",
                        "资本公积"
                    ],
                    "值": "90亿元"
                },
                {
                    "指标": "现金流量",
                    "描述": "公司在一定会计期间内的现金流入和流出总和。",
                    "影响因素": [
                        "经营活动",
                        "投资活动",
                        "筹资活动"
                    ],
                    "值": "46亿元"
                },
                {
                    "指标": "负债比率",
                    "描述": "公司总负债与总资产的比率，反映公司的债务水平。",
                    "影响因素": [
                        "总负债的变化",
                        "总资产的变化"
                    ],
                    "值": "46.43%"
                },
                {
                    "指标": "资产负债率",
                    "描述": "公司总负债占总资产的百分比，衡量公司财务杠杆的一个指标。",
                    "影响因素": [
                        "资产和负债的增减变化"
                    ],
                    "值": "46.43%"
                },
                {
                    "指标": "净资产收益率",
                    "描述": "反映公司股东权益的经营效益，即净利润与平均股东权益的比率。",
                    "影响因素": [
                        "净利润的变化",
                        "股东权益的变化"
                    ],
                    "值": "29.41%"
                }
            ]
        }
    ],
    "额外信息": [
        {
            "名称": "未来展望",
            "内容": [
                {
                    "名称": "财务策略",
                    "描述": "公司未来计划实施的财务策略，包括更加精细化的成本控制、优化资本运营等，以提升经营效益和盈利能力。"
                },
                {
                    "名称": "投资计划",
                    "描述": "公司将加大对高质量电视剧的投资，同时加强自有知识产权的研发投入，以进一步巩固在媒体行业的领先地位。"
                },
                {
                    "名称": "风险管理",
                    "描述": "公司将严格把控项目风险，加强市场变化的监测和预警，积极应对可能出现的财务风险，并制定有效的风险管理策略，以保障公司的稳健发展。"
                }
            ]
        }
    ],
    "生成大纲": "公司财务报告大纲\n\n报告类型: 公司财务报告\n报告时间: 2021年度\n\n财务信息\n- 重要事件:\n   1. 债务重组 (2021年1月):\n      - 描述: 为优化资本结构，公司进行了债务重组，减少了10亿元负债。\n      - 影响: 改善了公司的财务状况，降低了财务成本。\n      - 子事件:\n         - 签订债务重组协议 (2020年11月): 启动了债务重组的过程，为2021年的重要事件奠定了基础。\n         - 债务重组方案制定 (2020年12月): 明确了债务重组的目标和具体减少负债的数额。\n         - 债务重组协议签署 (2021年1月): 债务重组正式生效，公司负债减少10亿元。\n         \n   2. 分发股利 (2021年2月):\n      - 描述: 公司决定向股东分发8亿元股利。\n      - 影响: 回报给股东们的投资，提升了股东的收益。\n\n   3. 资产重组 (2021年3月):\n      - 描述: 公司进行了一次资产重组，优化了公司的业务结构。\n      - 影响: 提高了公司的运营效率，增加了公司的价值。\n\n   4. 重大资产收购 (2021年4月):\n      - 描述: 公司完成了对阳光影视有限公司的资产收购，总价值20亿元。\n      - 影响: 扩大公司业务范围，增强市场竞争力。\n\n   5. 重大股权收购 (2021年7月):\n      - 描述: 公司完成了对精英艺人经纪有限公司的股权收购，获得了70%的股权。\n      - 影响: 进一步扩大了公司的市场份额，提升了公司的控制力。\n\n   6. 大规模融资 (2021年9月):\n      - 描述: 公司进行了一次大规模的融资活动，募集了15亿元资金。\n      - 影响: 加强了公司的资金实力，支持了公司的扩张和发展。\n\n   7. 重大投资 (2021年12月):\n      - 描述: 公司投资了星光影业有限公司的新电视剧制作项目，投资金额为5亿元。\n      - 影响: 进一步拓宽了公司的业务领域，提升了公司的盈利能力。\n\n- 涉及的指标:\n   1. 营业收入: 238亿元\n      - 描述: 公司在一定会计期间内的主营业务收入和其他业务收入总额。\n      - 影响因素: 市场需求、产品价格变化\n\n   2. 净利润: 38亿元\n      - 描述: 公司在一定会计期间的净收入，即总收入减去总成本和所得税费用后的金额。\n      - 影响因素: 营业收入、成本控制、非经常性损益\n\n   3. 总资产: 168亿元\n      - 描述: 会计期末，公司所拥有的资产总额。\n      - 影响因素: 资产收购、资产处置、资产重估\n\n   4. 总负债: 78亿元\n      - 描述: 会计期末，公司所承担并需要偿还的债务总额。\n      - 影响因素: 新债发行、债务偿还、债务重组\n\n   5. 股东权益: 90亿元\n      - 描述: 会计期末，归属于股东的权益总额。\n      - 影响因素: 净利润、股利发放、资本公积\n\n   6. 现金流量: 46亿元\n      - 描述: 公司在一定会计期间内的现金流入和流出总和。\n      - 影响因素: 经营活动、投资活动、筹资活动\n\n   7. 负债比率: 46.43%\n      - 描述: 公司总负债与总资产的比率，反映公司的债务水平。\n      - 影响因素: 总负债的变化、总资产的变化\n\n   8. 资产负债率: 46.43%\n      - 描述: 公司总负债占总资产的百分比，衡量公司财务杠杆的一个指标。\n      - 影响因素: 资产和负债的增减变化\n\n   9. 净资产收益率: 29.41%\n      - 描述: 反映公司股东权益的经营效益，即净利润与平均股东权益的比率。\n      - 影响因素: 净利润的变化、股东权益的变化\n\n额外信息\n- 未来展望:\n   1. 财务策略:\n      - 描述: 公司未来计划实施的财务策略，包括更加精细化的成本控制、优化资本运营等，以提升经营效益和盈利能力.\n\n    2. 投资计划:\n      - 描述: 公司将加大对高质量电视剧的投资，同时加强自有知识产权的研发投入，以进一步巩固在媒体行业的领先地位.\n\n    3. 风险管理:\n      - 描述: 公司将严格把控项目风险，加强市场变化的监测和预警，积极应对可能出现的财务风险，并制定有效的风险管理策略，以保障公司的稳健发展。",
    "生成总结": "阳光传媒集团有限公司是一家成立于2005年6月15日的媒体公司，主营业务包括电视剧制作、演艺活动、广告代理和影视投资，注册地为北京市，已在香港交易所上市。",
    "生成文章": "在2021年度的公司财务报告中，我们将重点关注公司的重要事件和涉及的指标。首先，公司在2021年1月进行了债务重组，成功减少了10亿元的负债。这一重要事件对公司的财务状况产生了积极影响，降低了财务成本。在债务重组过程中，公司先是在2020年11月签订了债务重组协议，为整个过程奠定了基础。随后，在2020年12月，公司制定了债务重组方案，明确了减少负债的目标和数额。最终，在2021年1月，公司正式签署了债务重组协议，使债务重组生效，负债减少了10亿元。\n\n另外一个重要事件是公司在2021年2月决定向股东分发8亿元的股利。这一举措是对股东投资的回报，提升了股东的收益。\n\n在2021年3月，公司进行了一次资产重组，优化了公司的业务结构。这一举措提高了公司的运营效率，增加了公司的价值。\n\n进一步扩大公司业务范围的重大事件是公司在2021年4月完成了对阳光影视有限公司的资产收购，总价值为20亿元。这一收购使得公司的市场竞争力得到了增强。\n\n在2021年7月，公司完成了对精英艺人经纪有限公司的股权收购，获得了70%的股权。这一举措进一步扩大了公司的市场份额，提升了公司的控制力。\n\n为了支持公司的扩张和发展，公司在2021年9月进行了一次大规模的融资活动，募集了15亿元资金。这一举措加强了公司的资金实力。\n\n最后，在2021年12月，公司投资了星光影业有限公司的新电视剧制作项目，投资金额为5亿元。这一投资进一步拓宽了公司的业务领域，提升了公司的盈利能力。\n\n以上重要事件对公司的财务指标产生了影响。营业收入为238亿元，净利润为38亿元。总资产为168亿元，总负债为78亿元，股东权益为90亿元。现金流量为46亿元。负债比率和资产负债率均为46.43%。净资产收益率为29.41%。\n\n这些指标的变化受到多个因素的影响。营业收入的变化受市场需求和产品价格变化的影响。净利润的变化受营业收入、成本控制和非经常性损益的影响。总资产和总负债的变化受资产收购、资产处置和资产重估的影响。股东权益的变化受净利润、股利发放和资本公积的影响。现金流量的变化受经营活动、投资活动和筹资活动的影响。负债比率和资产负债率的变化受总负债和总资产的变化影响。净资产收益率的变化受净利润和股东权益的变化影响。\n\n展望未来，公司计划实施更加精细化的成本控制和优化资本运营等财务策略，以提升经营效益和盈利能力。公司将加大对高质量电视剧的投资，并加强自有知识产权的研发投入，以进一步巩固在媒体行业的领先地位。公司还将严格把控项目风险，加强市场变化的监测和预警，积极应对可能出现的财务风险，并制定有效的风险管理策略，以保障公司的稳健发展。\n\n综上所述，阳光传媒集团有限公司在2021年度取得了积极的财务成果，并通过重要事件的发生和指标的变化展示了公司的发展动力和潜力。公司将继续努力实施财务策略，加大投资力度，强化风险管理，以实现更好的业绩和长期可持续发展。"
}