{
    "住院病历": {
        "基本信息": {
            "姓名": "贝某某",
            "性别": "男",
            "年龄": "66岁",
            "民族": "汉族",
            "婚姻状况": "已婚",
            "职业": "退休职工",
            "住址": "紫陌市铁桥街13号",
            "入院时间": "6月25日",
            "记录时间": "6月25日",
            "病史陈述者": "患者本人",
            "医院名称": "紫陌市人民医院"
        },
        "主诉": "视力模糊，头痛，恶心3天",
        "现病史": {
            "发病情况": "发病时间为3天前，于家中，起病较急。患者在发病前曾有过剧烈头痛但未在意，症状在黑暗环境下加重。",
            "主要症状特点": "患者3天前开始出现视力模糊，右眼明显，伴有剧烈头痛，恶心，症状持续且逐渐加重。患者描述视力模糊呈蒙雾状，眼胀，眼痛。",
            "伴随症状": "伴有恶心、呕吐，眼睛看东西模糊，坐下休息时有轻微缓解，但剧烈头痛影响持续。",
            "诊疗经过及结果": "患者前往当地诊所就诊，诊所给予口服止痛药及止吐药，但症状未见好转，视力继续下降，遂来我院就诊。",
            "一般情况变化": "患者精神疲惫，睡眠差，食欲不佳，小便正常，大便略稀，体重无明显变化。"
        },
        "既往史": {
            "一般健康状况": "一般",
            "疾病史": "高血压病史5年，糖尿病史3年",
            "传染病史": "无",
            "预防接种史": "无特别",
            "手术外伤史": "无",
            "输血史": "无",
            "过敏史": "对青霉素过敏"
        },
        "个人史": {
            "出生地": "紫陌市",
            "居留地": "紫陌市",
            "生活习惯": "不吸烟，偶尔饮酒",
            "职业及工作条件": "退休前在工厂工作",
            "接触史": "无工业毒物、粉尘、放射性物质等接触史",
            "冶游史": "无"
        },
        "婚育史及家族史": {
            "婚育史": {
                "婚姻状况": "已婚",
                "结婚年龄": "28岁",
                "配偶健康状况": "良好",
                "子女情况": "育有一子一女，健康"
            },
            "家族史": "父母均健在，无心血管疾病及类似眼部疾病家族史，兄弟姐妹健康"
        },
        "体格检查": {
            "一般情况": {
                "体温": "36.5°C",
                "脉搏": "80次/分",
                "呼吸": "20次/分",
                "血压": "150/90 mmHg"
            },
            "系统检查": {
                "皮肤": "无黄疸、皮疹",
                "粘膜": "正常",
                "淋巴结": "无肿大",
                "头部及器官": "头部压痛，右眼球明显触痛",
                "颈部": "无肿块",
                "胸部": "胸廓无畸形，双肺呼吸音清，未闻及干湿啰音，心前区无异常",
                "腹部": "腹软，无压痛，肝脾肋下未触及",
                "直肠肛门": "未检查",
                "外生殖器": "未检查",
                "脊柱": "无畸形",
                "四肢": "无浮肿，活动自如",
                "神经系统": "无明显异常"
            }
        },
        "专科检查": "眼科检查：右眼视力0.2，左眼视力1.0，右眼眼压升高，前房变浅，角膜轻度水肿",
        "辅助检查": "眼压测定: 右眼32 mmHg，左眼18 mmHg，眼底检查显示视神经乳头轻度凹陷",
        "初步诊断": "右眼急性闭角型青光眼",
        "诊断依据": "患者有视力模糊、眼痛、头痛、恶心呕吐等症状，眼压明显升高，前房变浅，眼科检查符合青光眼的表现。",
        "鉴别诊断": "急性胃肠炎：主要症状为恶心呕吐，但无眼部症状，可排除。急性虹膜睫状体炎：虽有眼痛但无明显眼压升高及视力明显下降。急性结膜炎：通常无眼压升高，症状为红肿、分泌物多。",
        "入院记录": {
            "医师签名": "李医生"
        },
        "入院后病程记录": {
            "首次病程记录": "患者贝某某，男，66岁。主诉：视力模糊伴头痛3天。患者3天前出现视力模糊，右眼为主，伴有剧烈头痛和恶心呕吐，尤其在黑暗环境下加重。查体：右眼视力0.2，左眼视力1.0，右眼眼压32 mmHg，前房变浅，角膜轻度水肿，初步诊断：右眼急性闭角型青光眼。诊疗计划：控制眼压，缓解症状，进一步检查明确病因。",
            "日常病程记录": "6月26日，患者右眼疼痛有所缓解，但视力仍模糊，复测眼压右眼28 mmHg，继续予以降眼压治疗。",
            "上级医师查房记录": "6月26日，上级医师王教授查房，复核诊断无误，建议继续降眼压治疗，密切观察视力变化。",
            "疑难病例讨论记录": "无",
            "交（接）班记录": "6月27日，交班记录：患者情况稳定，右眼压控制在28 mmHg，继续治疗。",
            "转科记录": "无",
            "阶段小结": "患者入院3天，右眼急性闭角型青光眼诊断明确，眼压已从32 mmHg降至28 mmHg，视力仍模糊，需继续治疗监测。",
            "抢救记录": "无",
            "有创诊疗操作记录": "无",
            "会诊记录": "无",
            "出院记录": "无",
            "病重（病危）患者护理记录": "无"
        },
        "医嘱": {
            "长期医嘱单": "降眼压药物（噻吗洛尔），每天2次",
            "临时医嘱单": "复查眼压，每天2次"
        },
        "辅助检查报告单": "眼压测定报告、眼底检查报告",
        "体温单": "体温36.5°C，脉搏80次/分，呼吸20次/分，血压150/90 mmHg",
        "输血治疗知情同意书": "无",
        "特殊检查同意书": "未做",
        "病危（重）通知书": "无"
    },
    "病种": {
        "眼及附器疾病": {
            "名称": "青光眼",
            "症状": "视力模糊、头痛、眼胀，眼痛、恶心、呕吐、视物呈蒙雾状、两眼大小不等，视力降低",
            "鉴别诊断": "急性闭角型青光眼急性发作时，伴有剧烈头痛、恶心、呕吐等，可能误诊为急性胃肠炎和神经系统疾病；急性虹膜睫状体炎、急性结膜炎"
        }
    },
    "生成文章": "紫陌市人民医院\n住院病历\n\n基本信息:\n姓名: 贝某某\n性别: 男\n年龄: 66岁\n民族: 汉族\n婚姻状况: 已婚\n职业: 退休职工\n住址: 紫陌市铁桥街13号\n入院时间: 6月25日\n记录时间: 6月25日\n病史陈述者: 患者本人\n医院名称: 紫陌市人民医院\n\n主诉:\n视力模糊，头痛，恶心3天\n\n现病史:\n发病情况: 发病时间为3天前，于家中，起病较急。患者在发病前曾有过剧烈头痛但未在意，症状在黑暗环境下加重。\n主要症状特点: 患者3天前开始出现视力模糊，右眼明显，伴有剧烈头痛，恶心，症状持续且逐渐加重。患者描述视力模糊呈蒙雾状，眼胀，眼痛。\n伴随症状: 伴有恶心、呕吐，眼睛看东西模糊，坐下休息时有轻微缓解，但剧烈头痛影响持续。\n诊疗经过及结果: 患者前往当地诊所就诊，诊所给予口服止痛药及止吐药，但症状未见好转，视力继续下降，遂来我院就诊。\n一般情况变化: 患者精神疲惫，睡眠差，食欲不佳，小便正常，大便略稀，体重无明显变化。\n\n既往史:\n一般健康状况: 一般\n疾病史: 高血压病史5年，糖尿病史3年\n传染病史: 无\n预防接种史: 无特别\n手术外伤史: 无\n输血史: 无\n过敏史: 对青霉素过敏\n\n个人史:\n出生地: 紫陌市\n居留地: 紫陌市\n生活习惯: 不吸烟，偶尔饮酒\n职业及工作条件: 退休前在工厂工作\n接触史: 无工业毒物、粉尘、放射性物质等接触史\n冶游史: 无\n\n婚育史及家族史:\n婚育史:\n婚姻状况: 已婚\n结婚年龄: 28岁\n配偶健康状况: 良好\n子女情况: 育有一子一女，健康\n家族史: 父母均健在，无心血管疾病及类似眼部疾病家族史，兄弟姐妹健康\n\n体格检查:\n一般情况:\n体温: 36.5°C\n脉搏: 80次/分\n呼吸: 20次/分\n血压: 150/90 mmHg\n\n系统检查:\n皮肤: 无黄疸、皮疹\n粘膜: 正常\n淋巴结: 无肿大\n头部及器官: 头部压痛，右眼球明显触痛\n颈部: 无肿块\n胸部: 胸廓无畸形，双肺呼吸音清，未闻及干湿啰音，心前区无异常\n腹部: 腹软，无压痛，肝脾肋下未触及\n直肠肛门: 未检查\n外生殖器: 未检查\n脊柱: 无畸形\n四肢: 无浮肿，活动自如\n神经系统: 无明显异常\n\n专科检查:\n眼科检查：右眼视力0.2，左眼视力1.0，右眼眼压升高，前房变浅，角膜轻度水肿\n\n辅助检查:\n眼压测定: 右眼32 mmHg，左眼18 mmHg，眼底检查显示视神经乳头轻度凹陷\n\n初步诊断:\n右眼急性闭角型青光眼\n\n诊断依据:\n患者有视力模糊、眼痛、头痛、恶心呕吐等症状，眼压明显升高，前房变浅，眼科检查符合青光眼的表现。\n\n鉴别诊断:\n急性胃肠炎：主要症状为恶心呕吐，但无眼部症状，可排除。\n急性虹膜睫状体炎：虽有眼痛但无明显眼压升高及视力明显下降。\n急性结膜炎：通常无眼压升高，症状为红肿、分泌物多。\n\n入院记录:\n李医生\n\n入院后病程记录:\n首次病程记录:\n患者贝某某，男，66岁。主诉：视力模糊伴头痛3天。患者3天前出现视力模糊，右眼为主，伴有剧烈头痛和恶心呕吐，尤其在黑暗环境下加重。查体：右眼视力0.2，左眼视力1.0，右眼眼压32 mmHg，前房变浅，角膜轻度水肿，初步诊断：右眼急性闭角型青光眼。诊疗计划：控制眼压，缓解症状，进一步检查明确病因。\n日常病程记录:\n6月26日，患者右眼疼痛有所缓解，但视力仍模糊，复测眼压右眼28 mmHg，继续予以降眼压治疗。\n上级医师查房记录:\n6月26日，上级医师王教授查房，复核诊断无误，建议继续降眼压治疗，密切观察视力变化。\n疑难病例讨论记录:\n无\n交（接）班记录:\n6月27日，交班记录：患者情况稳定，右眼压控制在28 mmHg，继续治疗。\n转科记录:\n无\n阶段小结:\n患者入院3天，右眼急性闭角型青光眼诊断明确，眼压已从32 mmHg降至28 mmHg，视力仍模糊，需继续治疗监测。\n抢救记录:\n无\n有创诊疗操作记录:\n无\n会诊记录:\n无\n出院记录:\n无\n病重（病危）患者护理记录:\n无\n\n医嘱:\n长期医嘱单: 降眼压药物（噻吗洛尔），每天2次\n临时医嘱单: 复查眼压，每天2次\n\n辅助检查报告单:\n眼压测定报告、眼底检查报告\n\n体温单:\n体温36.5°C，脉搏80次/分，呼吸20次/分，血压150/90 mmHg\n\n输血治疗知情同意书:\n无\n\n特殊检查同意书:\n未做\n\n病危（重）通知书:\n无",
    "qa_fact_based": [
        {
            "问题类型": "事实性问题",
            "问题": "根据紫陌市人民医院的住院病历，贝某某的入院时间是什么时候？",
            "答案": "6月25日",
            "ref": [
                "入院时间: 6月25日"
            ]
        },
        {
            "问题类型": "事实性问题",
            "问题": "根据紫陌市人民医院的住院病历，贝某某的病史陈述者是谁？",
            "答案": "患者本人",
            "ref": [
                "病史陈述者: 患者本人"
            ]
        },
        {
            "问题类型": "事实性问题",
            "问题": "根据紫陌市人民医院的住院病历，贝某某的主诉是什么？",
            "答案": "视力模糊，头痛，恶心3天",
            "ref": [
                "主诉:",
                "视力模糊，头痛，恶心3天"
            ]
        },
        {
            "问题类型": "事实性问题",
            "问题": "根据紫陌市人民医院的住院病历，贝某某的既往疾病史包括哪些？",
            "答案": "高血压病史5年，糖尿病史3年",
            "ref": [
                "疾病史: 高血压病史5年，糖尿病史3年"
            ]
        },
        {
            "问题类型": "事实性问题",
            "问题": "根据紫陌市人民医院的住院病历，贝某某的初步诊断结果是什么？",
            "答案": "右眼急性闭角型青光眼",
            "ref": [
                "初步诊断:",
                "查体：右眼视力0.2，左眼视力1.0，右眼眼压32 mmHg，前房变浅，角膜轻度水肿，初步诊断：右眼急性闭角型青光眼。"
            ]
        }
    ],
    "qa_multi_hop": [
        {
            "问题类型": "多跳推理问题",
            "问题": "根据紫陌市人民医院的住院病历，贝某某的诊断依据有几项？",
            "答案": "根据病历，贝某某的诊断依据有三项，分别为视力模糊、眼压升高和前房变浅。",
            "ref": [
                "诊断依据:",
                "患者有视力模糊、眼痛、头痛、恶心呕吐等症状，眼压明显升高，前房变浅，眼科检查符合青光眼的表现。"
            ]
        },
        {
            "问题类型": "多跳推理问题",
            "问题": "根据紫陌市人民医院的住院病历，贝某某进行了几项辅助检查？",
            "答案": "根据病历，贝某某进行了2项辅助检查，分别为眼压测定和眼底检查。",
            "ref": [
                "辅助检查:",
                "眼压测定: 右眼32 mmHg，左眼18 mmHg，眼底检查显示视神经乳头轻度凹陷",
                "眼压测定报告、眼底检查报告"
            ]
        },
        {
            "问题类型": "多跳推理问题",
            "问题": "根据紫陌市人民医院的住院病历，贝某某的初步诊断是什么？",
            "答案": "根据病历，贝某某的初步诊断是右眼急性闭角型青光眼。",
            "ref": [
                "初步诊断:",
                "右眼急性闭角型青光眼",
                "查体：右眼视力0.2，左眼视力1.0，右眼眼压32 mmHg，前房变浅，角膜轻度水肿，初步诊断：右眼急性闭角型青光眼。"
            ]
        },
        {
            "问题类型": "多跳推理问题",
            "问题": "根据紫陌市人民医院的住院病历，贝某某的鉴别诊断有哪些？",
            "答案": "根据病历，贝某某的鉴别诊断有急性胃肠炎、急性虹膜睫状体炎和急性结膜炎。",
            "ref": [
                "鉴别诊断:",
                "急性胃肠炎：主要症状为恶心呕吐，但无眼部症状，可排除。",
                "急性虹膜睫状体炎：虽有眼痛但无明显眼压升高及视力明显下降。",
                "急性结膜炎：通常无眼压升高，症状为红肿、分泌物多。"
            ]
        }
    ],
    "qa_summary": [
        {
            "问题类型": "总结性问题",
            "问题": "根据紫陌市人民医院的住院病历，总结贝某某的病史。",
            "答案": "贝某某，男，66岁，主诉视力模糊、头痛、恶心3天。现病史显示患者3天前在家中急性发病，症状包括右眼视力模糊、剧烈头痛、恶心呕吐，症状在黑暗环境下加重。既往史包括高血压病史5年，糖尿病史3年，对青霉素过敏。个人史显示患者不吸烟，偶尔饮酒，退休前在工厂工作，无工业毒物、粉尘、放射性物质等接触史。婚育史显示已婚，育有一子一女，健康。家族史无心血管疾病及类似眼部疾病家族史。",
            "ref": [
                "姓名: 贝某某",
                "性别: 男",
                "年龄: 66岁",
                "视力模糊，头痛，恶心3天",
                "发病情况: 发病时间为3天前，于家中，起病较急。",
                "患者在发病前曾有过剧烈头痛但未在意，症状在黑暗环境下加重。",
                "主要症状特点: 患者3天前开始出现视力模糊，右眼明显，伴有剧烈头痛，恶心，症状持续且逐渐加重。",
                "伴随症状: 伴有恶心、呕吐，眼睛看东西模糊，坐下休息时有轻微缓解，但剧烈头痛影响持续。",
                "疾病史: 高血压病史5年，糖尿病史3年",
                "过敏史: 对青霉素过敏",
                "生活习惯: 不吸烟，偶尔饮酒",
                "职业及工作条件: 退休前在工厂工作",
                "接触史: 无工业毒物、粉尘、放射性物质等接触史",
                "婚姻状况: 已婚",
                "子女情况: 育有一子一女，健康",
                "家族史: 父母均健在，无心血管疾病及类似眼部疾病家族史，兄弟姐妹健康"
            ]
        },
        {
            "问题类型": "总结性问题",
            "问题": "根据紫陌市人民医院的住院病历，总结贝某某的诊断。",
            "答案": "贝某某的初步诊断为右眼急性闭角型青光眼。诊断依据包括患者有视力模糊、眼痛、头痛、恶心呕吐等症状，眼压明显升高，前房变浅，眼科检查符合青光眼的表现。鉴别诊断排除了急性胃肠炎、急性虹膜睫状体炎和急性结膜炎。",
            "ref": [
                "右眼急性闭角型青光眼",
                "诊断依据:",
                "患者有视力模糊、眼痛、头痛、恶心呕吐等症状，眼压明显升高，前房变浅，眼科检查符合青光眼的表现。",
                "鉴别诊断:",
                "急性胃肠炎：主要症状为恶心呕吐，但无眼部症状，可排除。",
                "急性虹膜睫状体炎：虽有眼痛但无明显眼压升高及视力明显下降。",
                "急性结膜炎：通常无眼压升高，症状为红肿、分泌物多。"
            ]
        },
        {
            "问题类型": "总结性问题",
            "问题": "根据紫陌市人民医院的住院病历，总结贝某某的治疗方案。",
            "答案": "贝某某的治疗方案包括控制眼压和缓解症状。具体措施为使用降眼压药物（噻吗洛尔），每天2次，并每天2次复查眼压。入院后病程记录显示，患者右眼疼痛有所缓解，但视力仍模糊，眼压从32 mmHg降至28 mmHg，继续予以降眼压治疗。上级医师查房建议继续降眼压治疗，密切观察视力变化。",
            "ref": [
                "诊疗计划：控制眼压，缓解症状，进一步检查明确病因。",
                "6月26日，患者右眼疼痛有所缓解，但视力仍模糊，复测眼压右眼28 mmHg，继续予以降眼压治疗。",
                "6月26日，上级医师王教授查房，复核诊断无误，建议继续降眼压治疗，密切观察视力变化。",
                "6月27日，交班记录：患者情况稳定，右眼压控制在28 mmHg，继续治疗。",
                "患者入院3天，右眼急性闭角型青光眼诊断明确，眼压已从32 mmHg降至28 mmHg，视力仍模糊，需继续治疗监测。",
                "医嘱:",
                "临时医嘱单: 复查眼压，每天2次"
            ]
        },
        {
            "问题类型": "总结性问题",
            "问题": "根据紫陌市人民医院的住院病历，总结贝某某的体格检查结果。",
            "答案": "贝某某的体格检查结果显示：体温36.5°C，脉搏80次/分，呼吸20次/分，血压150/90 mmHg。系统检查结果为皮肤无黄疸、皮疹，粘膜正常，淋巴结无肿大，头部压痛，右眼球明显触痛，颈部无肿块，胸部双肺呼吸音清，心前区无异常，腹部腹软无压痛，肝脾肋下未触及，四肢无浮肿，活动自如，神经系统无明显异常。专科检查显示右眼视力0.2，左眼视力1.0，右眼眼压升高，前房变浅，角膜轻度水肿。",
            "ref": [
                "体温: 36.5°C",
                "脉搏: 80次/分",
                "呼吸: 20次/分",
                "血压: 150/90 mmHg",
                "皮肤: 无黄疸、皮疹",
                "粘膜: 正常",
                "淋巴结: 无肿大",
                "头部及器官: 头部压痛，右眼球明显触痛",
                "颈部: 无肿块",
                "胸部: 胸廓无畸形，双肺呼吸音清，未闻及干湿啰音，心前区无异常",
                "腹部: 腹软，无压痛，肝脾肋下未触及",
                "四肢: 无浮肿，活动自如",
                "神经系统: 无明显异常",
                "眼科检查：右眼视力0.2，左眼视力1.0，右眼眼压升高，前房变浅，角膜轻度水肿"
            ]
        },
        {
            "问题类型": "总结性问题",
            "问题": "根据紫陌市人民医院的住院病历，总结贝某某的辅助检查结果。",
            "答案": "贝某某的辅助检查结果包括眼压测定和眼底检查。眼压测定结果为右眼32 mmHg，左眼18 mmHg。眼底检查显示视神经乳头轻度凹陷。",
            "ref": [
                "眼压测定: 右眼32 mmHg，左眼18 mmHg，眼底检查显示视神经乳头轻度凹陷",
                "眼压测定报告、眼底检查报告"
            ]
        }
    ]
}