{
    "报告类型": "公司财务报告",
    "报告时间": "2020年度",
    "公司信息": {
        "名称": "建业集团有限公司",
        "成立日期": "2005年5月",
        "主营业务": "建筑工程设计与施工",
        "注册地": "北京市",
        "上市情况": "非上市",
        "行业": "建筑"
    },
    "报告内容": [
        {
            "类型": "财务信息",
            "重要事件": [
                {
                    "事件": "债务重组",
                    "时间": "2020年3月",
                    "描述": "为优化资本结构，公司进行了债务重组，减少了2亿元负债。",
                    "影响": "改善了公司的财务状况，降低了财务成本。",
                    "子事件": [
                        {
                            "事件": "债务违约",
                            "时间": "2020年1月",
                            "描述": "由于经营困难和资金紧张，公司无法按时偿还债务，发生了债务违约情况。",
                            "影响": "加剧了公司的债务问题，导致公司资本结构不合理和财务风险增加。"
                        },
                        {
                            "事件": "贷款协商",
                            "时间": "2020年2月",
                            "描述": "公司与主要债权人进行了贷款协商，寻求延期还款或减少利息的方案。",
                            "影响": "为债务重组奠定了基础，为后续的债务重组提供了借鉴和依据。"
                        }
                    ]
                },
                {
                    "事件": "大规模融资",
                    "时间": "2020年4月",
                    "描述": "公司进行了一次大规模的融资活动，募集了5亿元资金。",
                    "影响": "加强了公司的资金实力，支持了公司的扩张和发展。"
                },
                {
                    "事件": "重大资产收购",
                    "时间": "2020年6月",
                    "描述": "公司完成了对华夏地产公司的资产收购，总价值8亿元。",
                    "影响": "扩大公司业务范围，增强市场竞争力。"
                },
                {
                    "事件": "重大投资",
                    "时间": "2020年7月",
                    "描述": "公司投资了智能建筑项目，投资金额为3亿元。",
                    "影响": "进一步拓宽了公司的业务领域，提升了公司的盈利能力。"
                },
                {
                    "事件": "分发股利",
                    "时间": "2020年9月",
                    "描述": "公司决定向股东分发5000万元股利。",
                    "影响": "回报给股东们的投资，提升了股东的收益。"
                },
                {
                    "事件": "重大股权收购",
                    "时间": "2020年11月",
                    "描述": "公司完成了对长城建设股份有限公司的股权收购，获得了30%的股权。",
                    "影响": "进一步扩大了公司的市场份额，提升了公司的控制力。"
                },
                {
                    "事件": "资产重组",
                    "时间": "2020年12月",
                    "描述": "公司进行了一次资产重组，优化了公司的业务结构。",
                    "影响": "提高了公司的运营效率，增加了公司的价值。"
                }
            ],
            "涉及的指标": [
                {
                    "指标": "营业收入",
                    "描述": "公司在一定会计期间内的主营业务收入和其他业务收入总额。",
                    "影响因素": [
                        "市场需求",
                        "产品价格变化"
                    ],
                    "值": "31亿元"
                },
                {
                    "指标": "净利润",
                    "描述": "公司在一定会计期间的净收入，即总收入减去总成本和所得税费用后的金额。",
                    "影响因素": [
                        "营业收入",
                        "成本控制",
                        "非经常性损益"
                    ],
                    "值": "1.5亿元"
                },
                {
                    "指标": "总资产",
                    "描述": "会计期末，公司所拥有的资产总额。",
                    "影响因素": [
                        "资产收购",
                        "资产处置",
                        "资产重估"
                    ],
                    "值": "16亿元"
                },
                {
                    "指标": "总负债",
                    "描述": "会计期末，公司所承担并需要偿还的债务总额。",
                    "影响因素": [
                        "新债发行",
                        "债务偿还",
                        "债务重组"
                    ],
                    "值": "8亿元"
                },
                {
                    "指标": "股东权益",
                    "描述": "会计期末，归属于股东的权益总额。",
                    "影响因素": [
                        "净利润",
                        "股利发放",
                        "资本公积"
                    ],
                    "值": "8亿元"
                },
                {
                    "指标": "现金流量",
                    "描述": "公司在一定会计期间内的现金流入和流出总和。",
                    "影响因素": [
                        "经营活动",
                        "投资活动",
                        "筹资活动"
                    ],
                    "值": "2.5亿元"
                },
                {
                    "指标": "负债比率",
                    "描述": "公司总负债与总资产的比率，反映公司的债务水平。",
                    "影响因素": [
                        "总负债的变化",
                        "总资产的变化"
                    ],
                    "值": "50%"
                },
                {
                    "指标": "资产负债率",
                    "描述": "公司总负债占总资产的百分比，衡量公司财务杠杆的一个指标。",
                    "影响因素": [
                        "资产和负债的增减变化"
                    ],
                    "值": "50%"
                },
                {
                    "指标": "净资产收益率",
                    "描述": "反映公司股东权益的经营效益，即净利润与平均股东权益的比率。",
                    "影响因素": [
                        "净利润的变化",
                        "股东权益的变化"
                    ],
                    "值": "20%"
                }
            ]
        }
    ],
    "额外信息": [
        {
            "名称": "未来展望",
            "内容": [
                {
                    "名称": "财务策略",
                    "描述": "公司未来计划加强成本控制，提高资本运营效率，以确保财务稳定和持续增长。"
                },
                {
                    "名称": "投资计划",
                    "描述": "公司计划增加对绿色建筑、智能建筑等领域的投资，以适应市场需求和技术创新。同时，加大对研发和创新的投入，推动企业技术升级。"
                },
                {
                    "名称": "风险管理",
                    "描述": "公司将加强对市场风险、信用风险和工程风险的管理，建立完善的内部控制机制和风险防范体系，以确保公司稳步发展。"
                }
            ]
        }
    ],
    "生成大纲": "公司财务报告大纲\n\n报告类型: 公司财务报告\n报告时间: 2020年度\n\n重要事件:\n1. 债务重组\n   - 时间: 2020年3月\n   - 描述: 为优化资本结构，公司进行了债务重组，减少了2亿元负债。\n   - 影响: 改善了公司的财务状况，降低了财务成本。\n   - 子事件:\n     - 债务违约\n       - 时间: 2020年1月\n       - 描述: 由于经营困难和资金紧张，公司无法按时偿还债务，发生了债务违约情况。\n       - 影响: 加剧了公司的债务问题，导致公司资本结构不合理和财务风险增加。\n     - 贷款协商\n       - 时间: 2020年2月\n       - 描述: 公司与主要债权人进行了贷款协商，寻求延期还款或减少利息的方案。\n       - 影响: 为债务重组奠定了基础，为后续的债务重组提供了借鉴和依据。\n\n2. 大规模融资\n   - 时间: 2020年4月\n   - 描述: 公司进行了一次大规模的融资活动，募集了5亿元资金。\n   - 影响: 加强了公司的资金实力，支持了公司的扩张和发展。\n\n3. 重大资产收购\n   - 时间: 2020年6月\n   - 描述: 公司完成了对华夏地产公司的资产收购，总价值8亿元。\n   - 影响: 扩大公司业务范围，增强市场竞争力。\n\n4. 重大投资\n   - 时间: 2020年7月\n   - 描述: 公司投资了智能建筑项目，投资金额为3亿元。\n   - 影响: 进一步拓宽了公司的业务领域，提升了公司的盈利能力。\n\n5. 分发股利\n   - 时间: 2020年9月\n   - 描述: 公司决定向股东分发5000万元股利。\n   - 影响: 回报给股东们的投资，提升了股东的收益。\n\n6. 重大股权收购\n   - 时间: 2020年11月\n   - 描述: 公司完成了对长城建设股份有限公司的股权收购，获得了30%的股权。\n   - 影响: 进一步扩大了公司的市场份额，提升了公司的控制力。\n\n7. 资产重组\n   - 时间: 2020年12月\n   - 描述: 公司进行了一次资产重组，优化了公司的业务结构。\n   - 影响: 提高了公司的运营效率，增加了公司的价值。\n\n涉及的指标:\n1. 营业收入\n   - 描述: 公司在一定会计期间内的主营业务收入和其他业务收入总额。\n   - 影响因素: 市场需求, 产品价格变化\n   - 值: 31亿元\n\n2. 净利润\n   - 描述: 公司在一定会计期间的净收入，即总收入减去总成本和所得税费用后的金额。\n   - 影响因素: 营业收入, 成本控制, 非经常性损益\n   - 值: 1.5亿元\n\n3. 总资产\n   - 描述: 会计期末，公司所拥有的资产总额。\n   - 影响因素: 资产收购, 资产处置, 资产重估\n   - 值: 16亿元\n\n4. 总负债\n   - 描述: 会计期末，公司所承担并需要偿还的债务总额。\n   - 影响因素: 新债发行, 债务偿还, 债务重组\n   - 值: 8亿元\n\n5. 股东权益\n   - 描述: 会计期末，归属于股东的权益总额。\n   - 影响因素: 净利润, 股利发放, 资本公积\n   - 值: 8亿元\n\n6. 现金流量\n   - 描述: 公司在一定会计期间内的现金流入和流出总和。\n   - 影响因素: 经营活动, 投资活动, 筹资活动\n   - 值: 2.5亿元\n\n7. 负债比率\n   - 描述: 公司总负债与总资产的比率，反映公司的债务水平。\n   - 影响因素: 总负债的变化, 总资产的变化\n   - 值: 50%\n\n8. 资产负债率\n   - 描述: 公司总负债占总资产的百分比，衡量公司财务杠杆的一个指标。\n   - 影响因素: 资产和负债的增减变化\n   - 值: 50%\n\n9. 净资产收益率\n   - 描述: 反映公司股东权益的经营效益，即净利润与平均股东权益的比率。\n   - 影响因素: 净利润的变化, 股东权益的变化\n   - 值: 20%\n\n额外信息:\n- 未来展望:\n  - 财务策略: 公司未来计划加强成本控制，提高资本运营效率，以确保财务稳定和持续增长。\n  - 投资计划: 公司计划增加对绿色建筑、智能建筑等领域的投资，以适应市场需求和技术创新。同时，加大对研发和创新的投入，推动企业技术升级。\n  - 风险管理: 公司将加强对市场风险、信用风险和工程风险的管理，建立完善的内部控制机制和风险防范体系，以确保公司稳步发展。",
    "生成总结": "北京市建业集团有限公司成立于2005年5月，是一家专注于建筑工程设计与施工的非上市企业。",
    "生成文章": "2020年是建业集团有限公司发展历程中的关键一年。在这一年，公司经历了多个重要事件，对公司的财务状况和业务发展产生了深远的影响。\n\n首先，公司在2020年3月进行了债务重组，成功减少了2亿元的负债。这一举措优化了公司的资本结构，降低了财务成本。然而，在此之前，公司曾经发生了债务违约的情况，由于经营困难和资金紧张，公司无法按时偿还债务。这一事件加剧了公司的债务问题，导致公司资本结构不合理和财务风险增加。随后，公司与主要债权人进行了贷款协商，寻求延期还款或减少利息的方案。这为债务重组奠定了基础，为后续的债务重组提供了借鉴和依据。\n\n在2020年4月，公司进行了一次大规模的融资活动，募集了5亿元资金。这一举措加强了公司的资金实力，支持了公司的扩张和发展。\n\n在2020年6月，公司完成了对华夏地产公司的资产收购，总价值达到8亿元。这一重大资产收购扩大了公司的业务范围，增强了公司的市场竞争力。\n\n随后，在2020年7月，公司投资了智能建筑项目，投资金额为3亿元。这一投资进一步拓宽了公司的业务领域，提升了公司的盈利能力。\n\n在2020年9月，公司决定向股东分发5000万元股利，回报给股东们的投资，提升了股东的收益。\n\n另外，在2020年11月，公司完成了对长城建设股份有限公司的股权收购，获得了30%的股权。这一重大股权收购进一步扩大了公司的市场份额，提升了公司的控制力。\n\n最后，在2020年12月，公司进行了一次资产重组，优化了公司的业务结构。这一举措提高了公司的运营效率，增加了公司的价值。\n\n以上重要事件对公司的财务状况产生了重要影响。根据报告指标，公司在2020年度的营业收入达到了31亿元，净利润为1.5亿元。总资产为16亿元，总负债为8亿元，股东权益为8亿元。现金流量为2.5亿元。负债比率为50%，资产负债率也为50%。净资产收益率为20%。\n\n这些指标的变化反映了公司在2020年度的经营状况和财务表现。营业收入的增加主要受到市场需求和产品价格变化的影响。净利润的增长则得益于营业收入的增加、成本控制的改善以及非经常性损益的影响。总资产的增加主要是由于资产收购和资产重估等因素。总负债的增加主要是由于新债发行和债务重组等原因。股东权益的变化受到净利润的影响，同时也受到股利发放和资本公积的影响。现金流量的变化主要受到经营活动、投资活动和筹资活动的影响。\n\n综合来看，建业集团有限公司在2020年度取得了较好的财务表现。然而，公司仍面临着一些挑战和风险，如市场风险、信用风险和工程风险等。为了确保公司的稳步发展，公司计划加强成本控制，提高资本运营效率。同时，公司还计划增加对绿色建筑、智能建筑等领域的投资，以适应市场需求和技术创新。此外，公司还将加强对市场风险、信用风险和工程风险的管理，建立完善的内部控制机制和风险防范体系。\n\n总之，建业集团有限公司在2020年度取得了较好的财务表现，并制定了相应的发展策略和风险管理措施，以确保公司的稳步发展。公司将继续努力提高经营效益，拓展业务领域，为股东创造更大的价值。"
}