{
    "courtAndProcuratorate": {
        "court": "Summerville, Windsor, Court",
        "procuratorate": "Summerville, Windsor, Procuratorate"
    },
    "chiefJudge": "H. Lopez",
    "judge": "Q. Lewis",
    "clerk": "G. Hernandez",
    "defendant": {
        "name": "F. James",
        "gender": "female",
        "birthdate": "27th, April, 1960",
        "residence": "39, Knoxville street, Windsor",
        "ethnicity": "Caucasian",
        "occupation": "Retail Store Manager"
    },
    "defenseLawyer": {
        "name": "Q. Collins",
        "lawFirm": "Collins & Associates Law Firm"
    },
    "caseProcess": [
        {
            "event": "Case Filing and Investigation",
            "date": "12th March, 2023",
            "description": "The case was formally filed and an investigation initiated after multiple complaints were received by local law enforcement regarding disturbances allegedly caused by the defendant, F. James."
        },
        {
            "event": "Detention Measures Taken",
            "date": "15th March, 2023",
            "description": "The defendant was placed under surveillance due to the escalating nature of the complaints and the perceived threat to public order."
        },
        {
            "event": "Criminal Detention",
            "date": "20th March, 2023",
            "description": "F. James was taken into criminal detention after a particularly disruptive incident at a local park, involving multiple witnesses and substantial evidence of provocative behavior."
        },
        {
            "event": "Arrest",
            "date": "25th March, 2023",
            "description": "An arrest warrant was issued, and the defendant was formally arrested based on the accumulation of evidence indicating repeated acts of picking quarrels and provoking trouble."
        }
    ],
    "criminalFacts": [
        {
            "crimeName": "Crime of Picking Quarrels and Provoking Trouble",
            "details": [
                {
                    "timePeriod": "10th March, 2023, 14:00 - 15:00",
                    "behavior": "The defendant, F. James, was seen loudly arguing with customers and physically pushing products off the shelves in her retail store, causing significant distress among patrons.",
                    "evidence": "Surveillance footage from the store, testimonies from three customers, and a written statement from a store employee."
                },
                {
                    "timePeriod": "13th March, 2023, 17:30 - 18:00",
                    "behavior": "The defendant forcibly entered a neighboring property, damaging the fence and verbally intimidating the resident, demanding the removal of perceived encroachments.",
                    "evidence": "Photos of the damaged fence, a security camera recording, and a police report filed by the neighbor."
                },
                {
                    "timePeriod": "18th March, 2023, 21:00 - 21:30",
                    "behavior": "F. James was seen at a local park, shouting obscenities and threats at families gathered there, leading to widespread panic and several parents rushing their children away.",
                    "evidence": "Witness testimonies from five park visitors, a recorded video from a bystander's smartphone, and an official police incident report."
                },
                {
                    "timePeriod": "20th March, 2023, 16:00 - 16:30",
                    "behavior": "The defendant vandalized a parked vehicle by scratching its surface with a metal object and breaking a side mirror, following an argument with the vehicle’s owner over a parking space.",
                    "evidence": "Photographs of the damaged vehicle, a repair estimate, and the vehicle owner’s sworn testimony."
                }
            ]
        }
    ],
    "legalProcedure": {
        "judgmentDate": "1st May, 2023",
        "judgmentResult": [
            {
                "crimeName": "Crime of Picking Quarrels and Provoking Trouble",
                "sentence": "Three years of fixed-term imprisonment",
                "sentencingConsiderations": "The sentencing took into account the repeated nature of the offenses, the substantial distress caused to multiple victims, and the evidence showing premeditation and deliberate intent."
            }
        ],
        "probation": {
            "applicable": false,
            "probationPeriod": null
        }
    },
    "Generated Article": "**In the Summerville, Windsor Court**\n\n**Criminal Judgment**\n\n**Case Reference No. XXXXXXX**\n\n**Court and Prosecutor Information:**\n- **Court:** Summerville, Windsor Court\n- **Procuratorate:** Summerville, Windsor Procuratorate\n- **Chief Judge:** H. Lopez\n- **Judge:** Q. Lewis\n- **Clerk:** G. Hernandez\n\n**Defendant and Defense Lawyer Information:**\n- **Defendant:** F. James (Female, born on 27th April 1960, residing at 39 Knoxville Street, Windsor; Retail Store Manager, Caucasian)\n- **Defense Lawyer:** Q. Collins (Collins & Associates Law Firm)\n\n---\n\n**Case Procedures:**\n\n1. **Case Filing and Investigation (12th March 2023)**:\n   The case was formally filed following multiple complaints received by local law enforcement regarding disturbances allegedly caused by the defendant, F. James. These complaints included public altercations, property damage, and harassment, initiating a thorough investigation to ascertain the extent and nature of these disturbances.\n   \n2. **Detention Measures Taken (15th March 2023)**:\n   Given the escalating nature and frequency of the disturbances, the defendant was placed under surveillance by law enforcement. The surveillance was a precautionary measure in response to the perceived threat to public order and was deemed necessary to prevent further incidents.\n\n3. **Criminal Detention (20th March 2023)**:\n   After a particularly disruptive incident at a local park on the evening of 18th March 2023, F. James was taken into criminal detention. This incident involved shouting obscenities and threats at families, leading to fear and chaos. The decision to detain the defendant was based on substantial evidence of provocative behavior and testimonies from multiple witnesses.\n\n4. **Arrest (25th March 2023)**:\n   An arrest warrant was formally issued, and F. James was arrested. This move followed the accumulation of evidence from various incidents showcasing a pattern of picking quarrels and provoking trouble, leading to the determination that formal arrest was warranted to uphold public order.\n\n---\n\n**Case Statement:**\n\nThe defendant, F. James, engaged in a series of disruptive behaviors that posed a significant threat to public order and peace. These behaviors were not isolated incidents but rather a pattern of conduct that caused considerable distress and fear among the community members of Summerville. The court examined each incident meticulously, considering the details, evidence, and impact on the victims involved.\n\nThe defendant, F. James, has been a resident of 39 Knoxville Street, Windsor, and is employed as a Retail Store Manager. Despite her professional responsibilities, the investigation revealed a troubling pattern of conduct indicative of a disregard for social norms and legal boundaries.\n\nThe investigation records highlight that on 10th March 2023, between 14:00 and 15:00, the defendant was seen engaging in a loud altercation with customers in her retail store. The incident escalated to physical actions, where F. James was reported to have pushed products off the shelves, causing significant distress among the patrons present. Surveillance footage from the store, coupled with testimonies from three customers and a written statement from an employee, corroborated the events, leaving no room for ambiguity regarding the defendant's actions.\n\nSubsequently, on 13th March 2023, from 17:30 to 18:00, the defendant forcibly entered a neighboring property, causing damage to a fence and verbally intimidating the resident. The catalyst for this behavior was a perceived encroachment on her property. The neighbor filed a police report, supported by photos of the damaged fence and security camera footage depicting the defendant's actions. This deliberate and unprovoked invasion of private property underscored a pattern of hostility and confrontational behavior.\n\nThe most alarming incident occurred on 18th March 2023, between 21:00 and 21:30, at a local park. F. James was noted for her aggressive behavior, where she shouted obscenities and threats at families. This incident led to widespread panic, with several parents rushing to protect their children. The severity of this behavior is evidenced by testimonies from five park visitors, a video recorded by a bystander, and an official police incident report.\n\nFinally, on 20th March 2023, between 16:00 and 16:30, the defendant vandalized a parked vehicle. Following an argument over a parking space, she used a metal object to scratch the vehicle’s surface and break a side mirror. Photographs of the damage, a repair estimate, and a sworn testimony from the vehicle owner provided clear evidence of the defendant’s intent and actions.\n\nThe recurrent nature of these incidents, characterized by public disturbances, property damage, and intimidation, led to F. James' criminal detention and subsequent arrest.\n\n---\n\n**Charge:**\n\nThe court charges F. James with the crime of Picking Quarrels and Provoking Trouble, in accordance with Article 293 of the criminal law. The specifics of this charge encompass a series of aggressive and unprovoked actions aimed at disturbing public peace.\n\n---\n\n**Evidence Description:**\n\n1. **Incident on 10th March 2023:**\n   The evidence includes surveillance footage clearly showing F. James engaged in a loud argument with customers, escalating to her physically pushing products off the shelves. The footage provides a visual record of the defendant's aggressive behavior. Additionally, testimonies from three customers who witnessed the incident firsthand and a written statement from a store employee further substantiate the nature of the defendant's actions. The distress caused to patrons is evident from their testimonies, which describe feelings of fear and discomfort.\n\n2. **Incident on 13th March 2023:**\n   The evidence comprises photos of the damaged fence, which exhibit signs of forceful entry and destruction. The security camera recording from the neighboring property captures the defendant forcibly damaging the fence and confronting the resident in a volatile manner. Moreover, the police report filed by the neighbor provides a detailed account of the incident, emphasizing the unprovoked aggression and property damage inflicted by the defendant.\n\n3. **Incident on 18th March 2023:**\n   The evidence for this incident is extensive and includes multiple witness testimonies from five park visitors who directly observed the defendant's disruptive behavior. The testimonies describe the defendant shouting obscenities and threats, creating an environment of fear and panic. A video recorded by a bystander's smartphone vividly captures the scene, showing F. James's aggressive demeanor and the resultant chaos. An official police incident report provides additional context, confirming the defendant's presence at the park and detailing the immediate response of law enforcement.\n\n4. **Incident on 20th March 2023:**\n   The evidence includes photographs of the damaged vehicle, highlighting the scratch marks and broken side mirror caused by the defendant. A repair estimate offers a monetary value for the damages, underscoring the financial impact on the vehicle owner. The owner's sworn testimony provides a first-hand account of the argument over the parking space and the subsequent vandalism by the defendant, painting a clear picture of the intentional and destructive nature of her actions.\n\n---\n\n**Sentencing Considerations:**\n\nIn determining the appropriate sentence for F. James, this court has taken into account several crucial factors. Firstly, the repeated nature of the defendant's offenses indicates a persistent disregard for public order and the well-being of others. Each incident involved deliberate actions that caused significant distress and fear among multiple victims. The accumulation of evidence, including surveillance footage, witness testimonies, and written statements, unmistakably points to a pattern of behavior characterized by aggression and intimidation.\n\nSecondly, the substantial distress caused to multiple victims cannot be overlooked. The testimonies and evidence presented illustrate the emotional and psychological impact on individuals subjected to the defendant's behavior. The park incident, in particular, resulted in widespread panic and fear, affecting numerous families and young children. This court recognizes the lasting impact such actions can have on a community, further accentuating the gravity of the offenses.\n\nLastly, the evidence suggests premeditation and deliberate intent in the defendant's actions. The manner in which F. James persisted in her confrontational behavior, despite previous complaints and interventions by law enforcement, indicates a willful disregard for legal and social norms. This court finds it necessary to impose a sentence that reflects the seriousness of these offenses and serves as a deterrent to similar conduct in the future.\n\n---\n\n**Judgment Result:**\n\nUpon careful consideration of the evidence and the repeated nature of the offenses committed by F. James, this court finds the defendant guilty of the Crime of Picking Quarrels and Provoking Trouble according to Article 293 of the criminal law. The defendant is hereby sentenced to three years of fixed-term imprisonment.\n\n---\n\n**Appeal Rights Explanation:**\n\nThe defendant, F. James, maintains the right to appeal this judgment. Should the defendant wish to challenge the court's decision, an appeal must be filed within the statutory period, in accordance with legal provisions. The appeal should be submitted to the appropriate higher court for review. It is advised that the defendant consult her defense lawyer, Q. Collins, from Collins & Associates Law Firm, to discuss the grounds and procedures for filing an appeal.\n\nThis court has fulfilled its duty in evaluating the evidence presented, ensuring a fair and just trial process. The judgment rendered is based on a comprehensive analysis of the facts, testimonies, and legal provisions pertaining to the case. The imposed sentence endeavors to address the severity of the offenses and uphold the principles of justice and public order.\n\nSo ordered, this 1st day of May, 2023.\n\n**Chief Judge:** H. Lopez  \n**Judge:** Q. Lewis\n\n---\n\n**Signed:**\n\n**Court Clerk:** G. Hernandez\n\nReference Article is below：\nArticle 293\nAnyone who commits any of the following acts of picking quarrels and provoking trouble, disrupting social order, shall be sentenced to fixed-term imprisonment of not more than five years, criminal detention, or control:\n(a) Randomly beating others, with serious circumstances;\n(b) Chasing, intercepting, insulting, or intimidating others, with serious circumstances;\n(c) Forcibly taking or arbitrarily destroying or occupying public or private property, with serious circumstances;\n(d) Making trouble in a public place, causing serious disorder in the public place.\nIf one gathers others to repeatedly commit the aforementioned acts, seriously disrupting social order, they shall be sentenced to fixed-term imprisonment of more than five years but not more than ten years, and may also be fined.",
    "qa_fact_based": [
        {
            "question type": "Factual Question",
            "question": "According to the court judgment of Summerville, Windsor, Court, when was the judgment delivered?",
            "answer": "1st May, 2023",
            "ref": [
                "So ordered, this 1st day of May, 2023."
            ]
        },
        {
            "question type": "Factual Question",
            "question": "According to the court judgment of Summerville, Windsor, Court, who was the chief judge?",
            "answer": "H. Lopez",
            "ref": [
                "- **Chief Judge:** H. Lopez",
                "**Chief Judge:** H. Lopez"
            ]
        },
        {
            "question type": "Factual Question",
            "question": "According to the court judgment of Summerville, Windsor, Court, what was the sentence for F. James?",
            "answer": "Three years of fixed-term imprisonment",
            "ref": [
                "The defendant is hereby sentenced to three years of fixed-term imprisonment."
            ]
        },
        {
            "question type": "Factual Question",
            "question": "According to the court judgment of Summerville, Windsor, Court, which law firm represented the defense lawyer Q. Collins?",
            "answer": "Collins & Associates Law Firm",
            "ref": [
                "- **Defense Lawyer:** Q. Collins (Collins & Associates Law Firm)",
                "It is advised that the defendant consult her defense lawyer, Q. Collins, from Collins & Associates Law Firm, to discuss the grounds and procedures for filing an appeal."
            ]
        }
    ],
    "qa_multi_hop": [
        {
            "question type": "Multi-hop Reasoning Question",
            "question": "According to the judgment of Summerville, Windsor, Court, how many incidents of picking quarrels and provoking trouble did F. James commit?",
            "answer": "According to the judgment, F. James committed a total of four incidents of picking quarrels and provoking trouble: arguing with customers and pushing products on March 10, 2023, damaging a fence and intimidating a resident on March 13, 2023, shouting obscenities and threats at a park on March 18, 2023, and vandalizing a parked vehicle on March 20, 2023.",
            "ref": [
                "The investigation records highlight that on 10th March 2023, between 14:00 and 15:00, the defendant was seen engaging in a loud altercation with customers in her retail store.",
                "The incident escalated to physical actions, where F. James was reported to have pushed products off the shelves, causing significant distress among the patrons present.",
                "Subsequently, on 13th March 2023, from 17:30 to 18:00, the defendant forcibly entered a neighboring property, causing damage to a fence and verbally intimidating the resident.",
                "The neighbor filed a police report, supported by photos of the damaged fence and security camera footage depicting the defendant's actions.",
                "The most alarming incident occurred on 18th March 2023, between 21:00 and 21:30, at a local park.",
                "This incident led to widespread panic, with several parents rushing to protect their children.",
                "Finally, on 20th March 2023, between 16:00 and 16:30, the defendant vandalized a parked vehicle.",
                "Photographs of the damage, a repair estimate, and a sworn testimony from the vehicle owner provided clear evidence of the defendant’s intent and actions.",
                "The recurrent nature of these incidents, characterized by public disturbances, property damage, and intimidation, led to F. James' criminal detention and subsequent arrest."
            ]
        },
        {
            "question type": "Multi-hop Reasoning Question",
            "question": "According to the judgment of Summerville, Windsor, Court, what is the total number of incidents involving F. James's disruptive behavior?",
            "answer": "According to the judgment, F. James was involved in a total of four incidents of disruptive behavior: arguing with customers and pushing products on March 10, 2023, damaging a fence and intimidating a resident on March 13, 2023, shouting obscenities and threats at a park on March 18, 2023, and vandalizing a parked vehicle on March 20, 2023.",
            "ref": [
                "The investigation records highlight that on 10th March 2023, between 14:00 and 15:00, the defendant was seen engaging in a loud altercation with customers in her retail store.",
                "The incident escalated to physical actions, where F. James was reported to have pushed products off the shelves, causing significant distress among the patrons present.",
                "Subsequently, on 13th March 2023, from 17:30 to 18:00, the defendant forcibly entered a neighboring property, causing damage to a fence and verbally intimidating the resident.",
                "The neighbor filed a police report, supported by photos of the damaged fence and security camera footage depicting the defendant's actions.",
                "The most alarming incident occurred on 18th March 2023, between 21:00 and 21:30, at a local park.",
                "This incident led to widespread panic, with several parents rushing to protect their children.",
                "Finally, on 20th March 2023, between 16:00 and 16:30, the defendant vandalized a parked vehicle.",
                "Photographs of the damage, a repair estimate, and a sworn testimony from the vehicle owner provided clear evidence of the defendant’s intent and actions.",
                "The recurrent nature of these incidents, characterized by public disturbances, property damage, and intimidation, led to F. James' criminal detention and subsequent arrest."
            ]
        },
        {
            "question type": "Multi-hop Reasoning Question",
            "question": "According to the judgment of Summerville, Windsor, Court, how many pieces of evidence were presented for the incidents involving F. James?",
            "answer": "According to the judgment, a total of twelve pieces of evidence were presented for the incidents involving F. James: surveillance footage, three customer testimonies, and a written statement from a store employee for the March 10, 2023 incident; photos of the damaged fence, a security camera recording, and a police report for the March 13, 2023 incident; five witness testimonies and a recorded video for the March 18, 2023 incident; and photographs of the damaged vehicle, a repair estimate, and the vehicle owner’s sworn testimony for the March 20, 2023 incident.",
            "ref": [
                "The evidence includes surveillance footage clearly showing F. James engaged in a loud argument with customers, escalating to her physically pushing products off the shelves.",
                "The footage provides a visual record of the defendant's aggressive behavior.",
                "Additionally, testimonies from three customers who witnessed the incident firsthand and a written statement from a store employee further substantiate the nature of the defendant's actions.",
                "The distress caused to patrons is evident from their testimonies, which describe feelings of fear and discomfort.",
                "The evidence comprises photos of the damaged fence, which exhibit signs of forceful entry and destruction.",
                "The security camera recording from the neighboring property captures the defendant forcibly damaging the fence and confronting the resident in a volatile manner.",
                "Moreover, the police report filed by the neighbor provides a detailed account of the incident, emphasizing the unprovoked aggression and property damage inflicted by the defendant.",
                "The evidence for this incident is extensive and includes multiple witness testimonies from five park visitors who directly observed the defendant's disruptive behavior.",
                "The testimonies describe the defendant shouting obscenities and threats, creating an environment of fear and panic.",
                "A video recorded by a bystander's smartphone vividly captures the scene, showing F. James's aggressive demeanor and the resultant chaos.",
                "An official police incident report provides additional context, confirming the defendant's presence at the park and detailing the immediate response of law enforcement.",
                "The evidence includes photographs of the damaged vehicle, highlighting the scratch marks and broken side mirror caused by the defendant.",
                "A repair estimate offers a monetary value for the damages, underscoring the financial impact on the vehicle owner.",
                "The owner's sworn testimony provides a first-hand account of the argument over the parking space and the subsequent vandalism by the defendant, painting a clear picture of the intentional and destructive nature of her actions."
            ]
        }
    ],
    "qa_summary": [
        {
            "question type": "Summarization Question",
            "question": "According to the judgment of Summerville, Windsor, Court, summarize the facts of F. James's crimes.",
            "answer": "F. James committed multiple acts of picking quarrels and provoking trouble. On 10th March, 2023, from 14:00 to 15:00, she argued loudly with customers and pushed products off the shelves in her retail store. On 13th March, 2023, from 17:30 to 18:00, she forcibly entered a neighboring property, damaged the fence, and verbally intimidated the resident. On 18th March, 2023, from 21:00 to 21:30, she shouted obscenities and threats at families in a local park, causing panic. On 20th March, 2023, from 16:00 to 16:30, she vandalized a parked vehicle by scratching its surface and breaking a side mirror after an argument with the vehicle’s owner.",
            "ref": [
                "The investigation records highlight that on 10th March 2023, between 14:00 and 15:00, the defendant was seen engaging in a loud altercation with customers in her retail store.",
                "The incident escalated to physical actions, where F. James was reported to have pushed products off the shelves, causing significant distress among the patrons present.",
                "Subsequently, on 13th March 2023, from 17:30 to 18:00, the defendant forcibly entered a neighboring property, causing damage to a fence and verbally intimidating the resident.",
                "The catalyst for this behavior was a perceived encroachment on her property.",
                "The most alarming incident occurred on 18th March 2023, between 21:00 and 21:30, at a local park.",
                "F. James was noted for her aggressive behavior, where she shouted obscenities and threats at families.",
                "This incident led to widespread panic, with several parents rushing to protect their children.",
                "Finally, on 20th March 2023, between 16:00 and 16:30, the defendant vandalized a parked vehicle.",
                "Following an argument over a parking space, she used a metal object to scratch the vehicle’s surface and break a side mirror."
            ]
        },
        {
            "question type": "Summarization Question",
            "question": "According to the judgment of Summerville, Windsor, Court, summarize the evidence of F. James's crimes.",
            "answer": "The evidence includes surveillance footage from the store, testimonies from three customers, a written statement from a store employee, photos of the damaged fence, a security camera recording, a police report filed by the neighbor, witness testimonies from five park visitors, a recorded video from a bystander's smartphone, an official police incident report, photographs of the damaged vehicle, a repair estimate, and the vehicle owner’s sworn testimony.",
            "ref": [
                "Surveillance footage from the store, coupled with testimonies from three customers and a written statement from an employee, corroborated the events, leaving no room for ambiguity regarding the defendant's actions.",
                "The neighbor filed a police report, supported by photos of the damaged fence and security camera footage depicting the defendant's actions.",
                "The severity of this behavior is evidenced by testimonies from five park visitors, a video recorded by a bystander, and an official police incident report.",
                "Photographs of the damage, a repair estimate, and a sworn testimony from the vehicle owner provided clear evidence of the defendant’s intent and actions.",
                "The evidence includes surveillance footage clearly showing F. James engaged in a loud argument with customers, escalating to her physically pushing products off the shelves.",
                "The footage provides a visual record of the defendant's aggressive behavior.",
                "Additionally, testimonies from three customers who witnessed the incident firsthand and a written statement from a store employee further substantiate the nature of the defendant's actions.",
                "The distress caused to patrons is evident from their testimonies, which describe feelings of fear and discomfort.",
                "The evidence comprises photos of the damaged fence, which exhibit signs of forceful entry and destruction.",
                "The security camera recording from the neighboring property captures the defendant forcibly damaging the fence and confronting the resident in a volatile manner.",
                "Moreover, the police report filed by the neighbor provides a detailed account of the incident, emphasizing the unprovoked aggression and property damage inflicted by the defendant.",
                "The evidence for this incident is extensive and includes multiple witness testimonies from five park visitors who directly observed the defendant's disruptive behavior.",
                "The testimonies describe the defendant shouting obscenities and threats, creating an environment of fear and panic.",
                "A video recorded by a bystander's smartphone vividly captures the scene, showing F. James's aggressive demeanor and the resultant chaos.",
                "An official police incident report provides additional context, confirming the defendant's presence at the park and detailing the immediate response of law enforcement.",
                "The evidence includes photographs of the damaged vehicle, highlighting the scratch marks and broken side mirror caused by the defendant.",
                "A repair estimate offers a monetary value for the damages, underscoring the financial impact on the vehicle owner.",
                "The owner's sworn testimony provides a first-hand account of the argument over the parking space and the subsequent vandalism by the defendant, painting a clear picture of the intentional and destructive nature of her actions."
            ]
        },
        {
            "question type": "Summarization Question",
            "question": "According to the judgment of Summerville, Windsor, Court, summarize the case process of F. James.",
            "answer": "The case process began with the formal filing and initiation of an investigation on 12th March, 2023, after multiple complaints were received. On 15th March, 2023, F. James was placed under surveillance due to the escalating nature of the complaints. On 20th March, 2023, she was taken into criminal detention following a disruptive incident at a local park. Finally, on 25th March, 2023, an arrest warrant was issued, and she was formally arrested based on accumulated evidence of repeated acts of picking quarrels and provoking trouble.",
            "ref": [
                "1. **Case Filing and Investigation (12th March 2023)**:",
                "The case was formally filed following multiple complaints received by local law enforcement regarding disturbances allegedly caused by the defendant, F. James.",
                "These complaints included public altercations, property damage, and harassment, initiating a thorough investigation to ascertain the extent and nature of these disturbances.",
                "Given the escalating nature and frequency of the disturbances, the defendant was placed under surveillance by law enforcement.",
                "The surveillance was a precautionary measure in response to the perceived threat to public order and was deemed necessary to prevent further incidents.",
                "After a particularly disruptive incident at a local park on the evening of 18th March 2023, F. James was taken into criminal detention.",
                "This incident involved shouting obscenities and threats at families, leading to fear and chaos.",
                "The decision to detain the defendant was based on substantial evidence of provocative behavior and testimonies from multiple witnesses.",
                "An arrest warrant was formally issued, and F. James was arrested.",
                "This move followed the accumulation of evidence from various incidents showcasing a pattern of picking quarrels and provoking trouble, leading to the determination that formal arrest was warranted to uphold public order."
            ]
        },
        {
            "question type": "Summarization Question",
            "question": "According to the judgment of Summerville, Windsor, Court, summarize the judgment result for F. James.",
            "answer": "F. James was found guilty of the crime of picking quarrels and provoking trouble and was sentenced to three years of fixed-term imprisonment. The sentencing took into account the repeated nature of the offenses, the substantial distress caused to multiple victims, and the evidence showing premeditation and deliberate intent.",
            "ref": [
                "**Judgment Result:**",
                "Upon careful consideration of the evidence and the repeated nature of the offenses committed by F. James, this court finds the defendant guilty of the Crime of Picking Quarrels and Provoking Trouble according to Article 293 of the criminal law.",
                "The defendant is hereby sentenced to three years of fixed-term imprisonment.",
                "Firstly, the repeated nature of the defendant's offenses indicates a persistent disregard for public order and the well-being of others.",
                "Each incident involved deliberate actions that caused significant distress and fear among multiple victims.",
                "The accumulation of evidence, including surveillance footage, witness testimonies, and written statements, unmistakably points to a pattern of behavior characterized by aggression and intimidation.",
                "Secondly, the substantial distress caused to multiple victims cannot be overlooked.",
                "The testimonies and evidence presented illustrate the emotional and psychological impact on individuals subjected to the defendant's behavior.",
                "The park incident, in particular, resulted in widespread panic and fear, affecting numerous families and young children.",
                "Lastly, the evidence suggests premeditation and deliberate intent in the defendant's actions.",
                "The manner in which F. James persisted in her confrontational behavior, despite previous complaints and interventions by law enforcement, indicates a willful disregard for legal and social norms."
            ]
        }
    ]
}