{
    "报告类型": "公司环境与社会责任报告",
    "报告时间": "2020年度",
    "公司信息": {
        "名称": "旅游乐园有限公司",
        "成立日期": "2000年1月",
        "主营业务": "旅游景区的开发和运营",
        "注册地": "中国",
        "上市情况": "未上市",
        "行业": "旅游"
    },
    "报告内容": [
        {
            "类型": "环境责任",
            "重要事件": [
                {
                    "事件": "采用环境管理系统",
                    "时间": "2020年2月",
                    "描述": "公司实施环境管理系统（EMS），以提高环境绩效，减少废物产生，并确保合规。",
                    "影响": "增强了公司的环境管理能力和持续改进，提升了合规性和市场认可度。"
                },
                {
                    "事件": "绿色产品开发",
                    "时间": "2020年5月",
                    "描述": "公司开发了一种名为“翡翠绿”的环保型游乐项目，减少了对环境的影响。",
                    "影响": "提升了产品的市场竞争力和品牌形象，同时减少了环境影响。"
                },
                {
                    "事件": "投资于碳抵消项目",
                    "时间": "2020年7月",
                    "描述": "公司通过投资林业项目来抵消其碳排放，努力实现碳中和目标。",
                    "影响": "通过碳抵消证书，公司能够向利益相关者展示其对环境的承诺和责任。"
                },
                {
                    "事件": "雨水回收利用项目",
                    "时间": "2020年9月",
                    "描述": "公司在景区内建设了雨水收集设施，并用于景区绿化和公共卫生设施的供水，提高了资源利用效率。",
                    "影响": "减少了对自来水的依赖，节约了水资源，同时改善了景区的环境质量。"
                },
                {
                    "事件": "防止污染设施的建设",
                    "时间": "2020年10月",
                    "描述": "公司在旗下旅游景区“碧水乐园”中建立了新的污染防治设施，如废水处理系统和排放控制设备，以减少环境污染。",
                    "影响": "显著降低了公司的环境污染水平，增强了合规性和社会责任感。"
                },
                {
                    "事件": "节能减排项目实施",
                    "时间": "2020年12月",
                    "描述": "公司投资实施的节能减排项目，旨在减少能源消耗和温室气体排放。",
                    "影响": "直接减少了公司的能源消耗和碳足迹，提高了能效和环境绩效。"
                }
            ],
            "涉及的指标": [
                {
                    "指标": "二氧化碳排放量",
                    "描述": "公司在生产过程中产生的二氧化碳总量。",
                    "影响因素": [
                        "生产规模的变化",
                        "节能技术的应用"
                    ],
                    "值": "5000吨"
                },
                {
                    "指标": "能源消耗",
                    "描述": "公司在运营过程中消耗的能源总量。",
                    "影响因素": [
                        "生产效率的提高",
                        "能源管理措施的实施"
                    ],
                    "值": "1000万千瓦时"
                }
            ]
        },
        {
            "类型": "社会责任",
            "重要事件": [
                {
                    "事件": "员工职业成长和人才发展计划",
                    "时间": "2020年3月",
                    "描述": "公司提供各类培训和发展项目，支持员工职业成长，包括在线课程、工作坊、导师计划等。",
                    "影响": "提高了员工的专业技能和工作满意度，促进了人才的留存和发展。"
                },
                {
                    "事件": "社区支持和发展项目",
                    "时间": "2020年4月",
                    "描述": "公司投资于当地社区，支持教育、健康和社会发展项目。",
                    "影响": "加深了公司与社区的联系，促进了社区的整体福祉和发展。"
                },
                {
                    "事件": "公益基金设立",
                    "时间": "2020年6月",
                    "描述": "公司设立了名为“旅途之爱”的公益基金，支持教育、环保、贫困减轻等公益项目。",
                    "影响": "通过基金的投入，帮助解决了一系列社会问题，提升了公司的社会影响力。"
                },
                {
                    "事件": "参与慈善活动",
                    "时间": "2020年8月",
                    "描述": "公司参与或资助慈善活动和慈善机构，以支持教育、健康、减贫等领域。",
                    "影响": "提高了公司的社会形象和品牌认知，加强了与社区的联系和支持。"
                },
                {
                    "事件": "员工健康与安全计划",
                    "时间": "2020年11月",
                    "描述": "公司实施的旨在提升员工健康与安全的措施。",
                    "影响": "显著改善了工作环境，减少了工伤事故，提高了员工的健康与安全水平。"
                },
                {
                    "事件": "参与公共服务项目",
                    "时间": "2020年12月",
                    "描述": "公司投资或参与公共服务项目，如城市绿化、公共卫生改善项目，以提升社区生活质量。",
                    "影响": "促进了社区的可持续发展，增强了公众对公司的积极感知。"
                }
            ],
            "涉及的指标": [
                {
                    "指标": "员工满意度",
                    "描述": "通过调查得到的员工对公司环境和政策满意度的度量。",
                    "影响因素": [
                        "工作环境的改善",
                        "员工福利政策的调整"
                    ],
                    "值": "85%"
                },
                {
                    "指标": "社区投资额",
                    "描述": "公司在社区发展项目上的投资总额。",
                    "影响因素": [
                        "公司的财务状况",
                        "社会责任战略的变化"
                    ],
                    "值": "500万元"
                }
            ]
        }
    ],
    "额外信息": [
        {
            "名称": "未来展望",
            "内容": [
                {
                    "名称": "环境保护计划",
                    "描述": "公司将继续采取一系列措施减少其运营对环境的影响，包括使用更多的可再生能源、提高能源利用效率、优化废物处理等措施。"
                },
                {
                    "名称": "社会责任战略",
                    "描述": "公司将继续在业务实践中积极履行社会责任，包括促进社区发展、改善员工福利、提供公平就业机会和参与公益活动。"
                },
                {
                    "名称": "可持续发展目标",
                    "描述": "通过整合可持续性原则到业务模型和决策过程中，公司致力于实现联合国可持续发展目标（SDGs），包括减少碳排放、保护生态环境、促进经济发展等方面的目标。"
                }
            ]
        }
    ],
    "生成大纲": "报告大纲：\n\nI. 公司信息\n- 公司名称：旅游乐园有限公司\n- 成立日期：2000年1月\n- 主营业务：旅游景区的开发和运营\n- 注册地：中国\n- 上市情况：未上市\n- 行业：旅游\n\nII. 环境责任\n- 重要事件：\n  1. 采用环境管理系统(2020年2月)\n    - 描述: 公司实施环境管理系统（EMS），以提高环境绩效，减少废物产生，并确保合规。\n    - 影响: 增强了公司的环境管理能力和持续改进，提升了合规性和市场认可度。\n  2. 绿色产品开发(2020年5月)\n    - 描述: 公司开发了一种名为“翡翠绿”的环保型游乐项目，减少了对环境的影响。\n    - 影响: 提升了产品的市场竞争力和品牌形象，同时减少了环境影响。\n  3. 投资于碳抵消项目(2020年7月)\n    - 描述: 公司通过投资林业项目来抵消其碳排放，努力实现碳中和目标。\n    - 影响: 通过碳抵消证书，公司能够向利益相关者展示其对环境的承诺和责任。\n  4. 雨水回收利用项目(2020年9月)\n    - 描述: 公司在景区内建设了雨水收集设施，并用于景区绿化和公共卫生设施的供水，提高了资源利用效率。\n    - 影响: 减少了对自来水的依赖，节约了水资源，同时改善了景区的环境质量。\n  5. 防止污染设施的建设(2020年10月)\n    - 描述: 公司在旗下旅游景区“碧水乐园”中建立了新的污染防治设施，如废水处理系统和排放控制设备，以减少环境污染。\n    - 影响: 显著降低了公司的环境污染水平，增强了合规性和社会责任感。\n  6. 节能减排项目实施(2020年12月)\n    - 描述: 公司投资实施的节能减排项目，旨在减少能源消耗和温室气体排放。\n    - 影响: 直接减少了公司的能源消耗和碳足迹，提高了能效和环境绩效。\n\n- 涉及的指标：\n  1. 二氧化碳排放量：5000吨\n    - 描述: 公司在生产过程中产生的二氧化碳总量。\n    - 影响因素: 生产规模的变化, 节能技术的应用\n  2. 能源消耗：1000万千瓦时\n    - 描述: 公司在运营过程中消耗的能源总量。\n    - 影响因素: 生产效率的提高, 能源管理措施的实施\n\nIII. 社会责任\n- 重要事件：\n  1. 员工职业成长和人才发展计划(2020年3月)\n    - 描述: 公司提供各类培训和发展项目，支持员工职业成长，包括在线课程、工作坊、导师计划等。\n    - 影响: 提高了员工的专业技能和工作满意度，促进了人才的留存和发展。\n  2. 社区支持和发展项目(2020年4月)\n    - 描述: 公司投资于当地社区，支持教育、健康和社会发展项目。\n    - 影响: 加深了公司与社区的联系，促进了社区的整体福祉和发展。\n  3. 公益基金设立(2020年6月)\n    - 描述: 公司设立了名为“旅途之爱”的公益基金，支持教育、环保、贫困减轻等公益项目。\n    - 影响: 通过基金的投入，帮助解决了一系列社会问题，提升了公司的社会影响力。\n  4. 参与慈善活动(2020年8月)\n    - 描述: 公司参与或资助慈善活动和慈善机构，以支持教育、健康、减贫等领域。\n    - 影响: 提高了公司的社会形象和品牌认知，加强了与社区的联系和支持。\n  5. 员工健康与安全计划(2020年11月)\n    - 描述: 公司实施的旨在提升员工健康与安全的措施。\n    - 影响: 显著改善了工作环境，减少了工伤事故，提高了员工的健康与安全水平。\n  6. 参与公共服务项目(2020年12月)\n    - 描述: 公司投资或参与公共服务项目，如城市绿化、公共卫生改善项目，以提升社区生活质量。\n    - 影响: 促进了社区的可持续发展，增强了公众对公司的积极感知。\n\n- 涉及的指标：\n  1. 员工满意度：85%\n    - 描述: 通过调查得到的员工对公司环境和政策满意度的度量。\n    - 影响因素: 工作环境的改善, 员工福利政策的调整\n  2. 社区投资额：500万元\n    - 描述: 公司在社区发展项目上的投资总额。\n    - 影响因素: 公司的财务状况, 社会责任战略的变化\n\nIV. 额外信息\n- 未来展望：\n  1. 环境保护计划: 公司将继续采取一系列措施减少其运营对环境的影响，包括使用更多的可再生能源、提高能源利用效率、优化废物处理等措施。\n  2. 社会责任战略: 公司将继续在业务实践中积极履行社会责任，包括促进社区发展、改善员工福利、提供公平就业机会和参与公益活动。\n  3. 可持续发展目标: 通过整合可持续性原则到业务模型和决策过程中，公司致力于实现联合国可持续发展目标（SDGs），包括减少碳排放、保护生态环境、促进经济发展等方面的目标。",
    "生成总结": "旅游乐园有限公司是一家成立于2000年1月，在中国注册的旅游景区开发和运营公司，尚未上市。",
    "生成文章": "旅游乐园有限公司一直致力于环境责任和社会责任的履行。在2020年，公司采取了一系列重要事件来提高其环境绩效和社会影响力。\n\n首先，公司于2020年2月采用了环境管理系统（EMS），以提高环境绩效，减少废物产生，并确保合规。这一举措增强了公司的环境管理能力和持续改进，提升了合规性和市场认可度。\n\n其次，公司在2020年5月开发了一种名为“翡翠绿”的环保型游乐项目，减少了对环境的影响。这一举措提升了产品的市场竞争力和品牌形象，同时减少了环境影响。\n\n在2020年7月，公司通过投资林业项目来抵消其碳排放，努力实现碳中和目标。通过碳抵消证书，公司能够向利益相关者展示其对环境的承诺和责任。\n\n为了提高资源利用效率，公司在2020年9月在景区内建设了雨水收集设施，并用于景区绿化和公共卫生设施的供水。这一举措减少了对自来水的依赖，节约了水资源，同时改善了景区的环境质量。\n\n为了减少环境污染，公司在旗下旅游景区“碧水乐园”中建立了新的污染防治设施，如废水处理系统和排放控制设备。这一举措显著降低了公司的环境污染水平，增强了合规性和社会责任感。\n\n最后，在2020年12月，公司投资实施了节能减排项目，旨在减少能源消耗和温室气体排放。这一举措直接减少了公司的能源消耗和碳足迹，提高了能效和环境绩效。\n\n以上重要事件对公司的指标产生了积极影响。二氧化碳排放量从5000吨减少到了未来的未知数值，能源消耗从1000万千瓦时减少到了未来的未知数值。这些变化是由于公司采取了节能技术的应用、生产效率的提高和能源管理措施的实施等因素所导致的。\n\n除了环境责任，旅游乐园有限公司还积极履行社会责任。公司于2020年3月推出了员工职业成长和人才发展计划，提供各类培训和发展项目，支持员工职业成长。这一举措提高了员工的专业技能和工作满意度，促进了人才的留存和发展。\n\n公司还投资于当地社区，支持教育、健康和社会发展项目。在2020年4月，公司投资了500万元用于社区发展项目。这一举措加深了公司与社区的联系，促进了社区的整体福祉和发展。\n\n为了更好地履行社会责任，公司于2020年6月设立了名为“旅途之爱”的公益基金，支持教育、环保、贫困减轻等公益项目。通过基金的投入，公司帮助解决了一系列社会问题，提升了公司的社会影响力。\n\n此外，公司还参与或资助慈善活动和慈善机构，以支持教育、健康、减贫等领域。这一举措提高了公司的社会形象和品牌认知，加强了与社区的联系和支持。\n\n为了提升员工的健康与安全水平，公司于2020年11月实施了员工健康与安全计划。这一举措显著改善了工作环境，减少了工伤事故，提高了员工的健康与安全水平。\n\n最后，在2020年12月，公司投资或参与公共服务项目，如城市绿化、公共卫生改善项目，以提升社区生活质量。这一举措促进了社区的可持续发展，增强了公众对公司的积极感知。\n\n以上重要事件对公司的指标产生了积极影响。员工满意度从85%提高到了未来的未知数值，社区投资额从500万元增加到了未来的未知数值。这些变化是由于公司工作环境的改善、员工福利政策的调整和社会责任战略的变化等因素所导致的。\n\n旅游乐园有限公司将继续致力于环境保护和社会责任的履行。公司将继续采取一系列措施减少其运营对环境的影响，包括使用更多的可再生能源、提高能源利用效率、优化废物处理等措施。同时，公司将继续在业务实践中积极履行社会责任，包括促进社区发展、改善员工福利、提供公平就业机会和参与公益活动。通过整合可持续性原则到业务模型和决策过程中，公司致力于实现联合国可持续发展目标（SDGs），包括减少碳排放、保护生态环境、促进经济发展等方面的目标。\n\n旅游乐园有限公司在环境责任和社会责任方面的努力将进一步提升其在旅游行业的竞争力和可持续发展能力。"
}