{
    "报告类型": "公司财务报告",
    "报告时间": "2020年度",
    "公司信息": {
        "名称": "旅游乐园有限公司",
        "成立日期": "2000年1月",
        "主营业务": "旅游景区的开发和运营",
        "注册地": "中国",
        "上市情况": "未上市",
        "行业": "旅游"
    },
    "报告内容": [
        {
            "类型": "财务信息",
            "重要事件": [
                {
                    "事件": "大规模融资",
                    "时间": "2020年2月",
                    "描述": "公司进行了一次大规模的融资活动，募集了5000万元资金。",
                    "影响": "加强了公司的资金实力，支持了公司的扩张和发展。"
                },
                {
                    "事件": "疫情影响",
                    "时间": "2020年3月",
                    "描述": "新冠疫情爆发导致旅游业受到严重冲击，公司的游客数量大幅下降。",
                    "影响": "公司营收锐减，利润受到影响，迫使公司加大市场推广和产品创新力度。"
                },
                {
                    "事件": "重大资产收购",
                    "时间": "2020年4月",
                    "描述": "公司完成了对魔幻世界乐园的资产收购，总价值1亿元。",
                    "影响": "扩大公司业务范围，增强市场竞争力。"
                },
                {
                    "事件": "资产重组",
                    "时间": "2020年5月",
                    "描述": "公司进行了一次资产重组，优化了公司的业务结构。",
                    "影响": "提高了公司的运营效率，增加了公司的价值。"
                },
                {
                    "事件": "重大投资",
                    "时间": "2020年6月",
                    "描述": "公司投资了欢乐水世界项目，投资金额为5000万元。",
                    "影响": "进一步拓宽了公司的业务领域，提升了公司的盈利能力。"
                },
                {
                    "事件": "景区升级",
                    "时间": "2020年7月",
                    "描述": "公司对旗下的乐园进行升级改造，增加了更多的游乐设施和表演项目。",
                    "影响": "吸引了更多的游客，提升了公司的收入和市场竞争力。"
                },
                {
                    "事件": "重大股权收购",
                    "时间": "2020年8月",
                    "描述": "公司完成了对乐园酒店集团的股权收购，获得了60%的股权。",
                    "影响": "进一步扩大了公司的市场份额，提升了公司的控制力。"
                },
                {
                    "事件": "债务重组",
                    "时间": "2020年10月",
                    "描述": "为优化资本结构，公司进行了债务重组，减少了2000万元负债。",
                    "影响": "改善了公司的财务状况，降低了财务成本。"
                },
                {
                    "事件": "分发股利",
                    "时间": "2020年11月",
                    "描述": "公司决定向股东分发1000万元股利。",
                    "影响": "回报给股东们的投资，提升了股东的收益。"
                }
            ],
            "涉及的指标": [
                {
                    "指标": "营业收入",
                    "描述": "公司在一定会计期间内的主营业务收入和其他业务收入总额。",
                    "影响因素": [
                        "市场需求",
                        "产品价格变化"
                    ],
                    "值": "2000万元"
                },
                {
                    "指标": "净利润",
                    "描述": "公司在一定会计期间的净收入，即总收入减去总成本和所得税费用后的金额。",
                    "影响因素": [
                        "营业收入",
                        "成本控制",
                        "非经常性损益"
                    ],
                    "值": "500万元"
                },
                {
                    "指标": "总资产",
                    "描述": "会计期末，公司所拥有的资产总额。",
                    "影响因素": [
                        "资产收购",
                        "资产处置",
                        "资产重估"
                    ],
                    "值": "5000万元"
                },
                {
                    "指标": "总负债",
                    "描述": "会计期末，公司所承担并需要偿还的债务总额。",
                    "影响因素": [
                        "新债发行",
                        "债务偿还",
                        "债务重组"
                    ],
                    "值": "3000万元"
                },
                {
                    "指标": "股东权益",
                    "描述": "会计期末，归属于股东的权益总额。",
                    "影响因素": [
                        "净利润",
                        "股利发放",
                        "资本公积"
                    ],
                    "值": "2000万元"
                },
                {
                    "指标": "现金流量",
                    "描述": "公司在一定会计期间内的现金流入和流出总和。",
                    "影响因素": [
                        "经营活动",
                        "投资活动",
                        "筹资活动"
                    ],
                    "值": "1000万元"
                },
                {
                    "指标": "负债比率",
                    "描述": "公司总负债与总资产的比率，反映公司的债务水平。",
                    "影响因素": [
                        "总负债的变化",
                        "总资产的变化"
                    ],
                    "值": "60%"
                },
                {
                    "指标": "资产负债率",
                    "描述": "公司总负债占总资产的百分比，衡量公司财务杠杆的一个指标。",
                    "影响因素": [
                        "资产和负债的增减变化"
                    ],
                    "值": "60%"
                },
                {
                    "指标": "净资产收益率",
                    "描述": "反映公司股东权益的经营效益，即净利润与平均股东权益的比率。",
                    "影响因素": [
                        "净利润的变化",
                        "股东权益的变化"
                    ],
                    "值": "25%"
                }
            ]
        }
    ],
    "额外信息": [
        {
            "名称": "未来展望",
            "内容": [
                {
                    "名称": "财务策略",
                    "描述": "公司未来计划实施的财务策略，包括提高成本控制效率，加强资金管理和投资回报率优化等。"
                },
                {
                    "名称": "投资计划",
                    "描述": "公司面向未来的投资计划，将继续加大对乐园的升级改造投入，并拓展自有景区的开发。"
                },
                {
                    "名称": "风险管理",
                    "描述": "公司识别了市场竞争风险、自然灾害风险和政策风险等，将加强市场调研，建立紧急应急机制，并制定完善的风险防控策略。"
                }
            ]
        }
    ],
    "生成大纲": "报告大纲：\n\n一、公司概况\n    1. 公司简介\n    2. 财务报告类型及时间\n    3. 报告内容概述\n\n二、重要事件分析\n    1. 大规模融资（2020年2月）\n        - 事件描述：公司进行了一次大规模的融资活动，募集了5000万元资金。\n        - 影响：加强了公司的资金实力，支持了公司的扩张和发展。\n    2. 疫情影响（2020年3月）\n        - 事件描述：新冠疫情爆发导致旅游业受到严重冲击，公司的游客数量大幅下降。\n        - 影响：公司营收锐减，利润受到影响，迫使公司加大市场推广和产品创新力度。\n    3. 重大资产收购（2020年4月）\n        - 事件描述：公司完成了对魔幻世界乐园的资产收购，总价值1亿元。\n        - 影响：扩大公司业务范围，增强市场竞争力。\n    4. 资产重组（2020年5月）\n        - 事件描述：公司进行了一次资产重组，优化了公司的业务结构。\n        - 影响：提高了公司的运营效率，增加了公司的价值。\n    5. 重大投资（2020年6月）\n        - 事件描述：公司投资了欢乐水世界项目，投资金额为5000万元。\n        - 影响：进一步拓宽了公司的业务领域，提升了公司的盈利能力。\n    6. 景区升级（2020年7月）\n        - 事件描述：公司对旗下的乐园进行升级改造，增加了更多的游乐设施和表演项目。\n        - 影响：吸引了更多的游客，提升了公司的收入和市场竞争力。\n    7. 重大股权收购（2020年8月）\n        - 事件描述：公司完成了对乐园酒店集团的股权收购，获得了60%的股权。\n        - 影响：进一步扩大了公司的市场份额，提升了公司的控制力。\n    8. 债务重组（2020年10月）\n        - 事件描述：为优化资本结构，公司进行了债务重组，减少了2000万元负债。\n        - 影响：改善了公司的财务状况，降低了财务成本。\n    9. 分发股利（2020年11月）\n        - 事件描述：公司决定向股东分发1000万元股利。\n        - 影响：回报给股东们的投资，提升了股东的收益。\n\n三、涉及指标分析\n    1. 营业收入\n        - 描述：公司在一定会计期间内的主营业务收入和其他业务收入总额。\n        - 影响因素：市场需求、产品价格变化\n        - 值：2000万元\n    2. 净利润\n        - 描述：公司在一定会计期间的净收入，即总收入减去总成本和所得税费用后的金额。\n        - 影响因素：营业收入、成本控制、非经常性损益\n        - 值：500万元\n    3. 总资产\n        - 描述：会计期末，公司所拥有的资产总额。\n        - 影响因素：资产收购、资产处置、资产重估\n        - 值：5000万元\n    4. 总负债\n        - 描述：会计期末，公司所承担并需要偿还的债务总额。\n        - 影响因素：新债发行、债务偿还、债务重组\n        - 值：3000万元\n    5. 股东权益\n        - 描述：会计期末，归属于股东的权益总额。\n        - 影响因素：净利润、股利发放、资本公积\n        - 值：2000万元\n    6. 现金流量\n        - 描述：公司在一定会计期间内的现金流入和流出总和。\n        - 影响因素：经营活动、投资活动、筹资活动\n        - 值：1000万元\n    7. 负债比率\n        - 描述：公司总负债与总资产的比率，反映公司的债务水平。\n        - 影响因素：总负债的变化、总资产的变化\n        - 值：60%\n    8. 资产负债率\n        - 描述：公司总负债占总资产的百分比，衡量公司财务杠杆的一个指标。\n        - 影响因素：资产和负债的增减变化\n        - 值：60%\n    9. 净资产收益率\n        - 描述：反映公司股东权益的经营效益，即净利润与平均股东权益的比率。\n        - 影响因素：净利润的变化、股东权益的变化\n        - 值：25%\n\n四、未来展望\n    1. 财务策略\n        - 描述：公司未来计划实施的财务策略，包括提高成本控制效率，加强资金管理和投资回报率优化等。\n    2. 投资计划\n        - 描述：公司面向未来的投资计划，将继续加大对乐园的升级改造投入，并拓展自有景区的开发。\n    3. 风险管理\n        - 描述：公司识别了市场竞争风险、自然灾害风险和政策风险等，将加强市场调研，建立紧急应急机制，并制定完善的风险防控策略。\n\n五、结论\n\n注意：以上事件和指标影响的描述中，需要体现所有时间点和子事件。",
    "生成总结": "旅游乐园有限公司是一家成立于2000年的中国旅游景区开发和运营公司，尚未上市。",
    "生成文章": "公司的财务报告类型包括年度财务报告和季度财务报告，报告时间为2020年。本报告将对公司的重要事件进行分析，并对涉及的指标进行详细分析和解读。\n\n首先，公司在2020年2月进行了一次大规模的融资活动，募集了5000万元资金。这次融资活动加强了公司的资金实力，为公司的扩张和发展提供了支持。这一事件对公司的营业收入、净利润、总资产、总负债和股东权益等指标产生了影响。\n\n接下来，疫情爆发导致旅游业受到严重冲击，公司的游客数量大幅下降。这一事件对公司的营业收入和净利润产生了负面影响，迫使公司加大市场推广和产品创新力度，以应对市场变化。\n\n在2020年4月，公司完成了对魔幻世界乐园的资产收购，总价值1亿元。这一重大资产收购扩大了公司的业务范围，增强了公司的市场竞争力。\n\n随后，在2020年5月，公司进行了一次资产重组，优化了公司的业务结构。这一事件提高了公司的运营效率，增加了公司的价值。\n\n在2020年6月，公司投资了欢乐水世界项目，投资金额为5000万元。这一重大投资进一步拓宽了公司的业务领域，提升了公司的盈利能力。\n\n在2020年7月，公司对旗下的乐园进行了升级改造，增加了更多的游乐设施和表演项目。这一举措吸引了更多的游客，提升了公司的收入和市场竞争力。\n\n在2020年8月，公司完成了对乐园酒店集团的股权收购，获得了60%的股权。这一重大股权收购进一步扩大了公司的市场份额，提升了公司的控制力。\n\n在2020年10月，为优化资本结构，公司进行了债务重组，减少了2000万元负债。这一债务重组改善了公司的财务状况，降低了财务成本。\n\n最后，在2020年11月，公司决定向股东分发1000万元股利，回报给股东们的投资，提升了股东的收益。\n\n以上事件对公司的营业收入、净利润、总资产、总负债和股东权益等指标产生了影响。根据财务报告显示，公司的营业收入为2000万元，净利润为500万元，总资产为5000万元，总负债为3000万元，股东权益为2000万元。此外，公司的现金流量为1000万元。负债比率为60%，资产负债率为60%，净资产收益率为25%。\n\n根据以上分析，可以看出公司在2020年经历了一系列重要事件，这些事件对公司的财务状况和业务发展产生了积极影响。未来，公司将继续实施财务策略，提高成本控制效率，加强资金管理和投资回报率优化。同时，公司将继续加大对乐园的升级改造投入，并拓展自有景区的开发。公司还将加强风险管理，建立紧急应急机制，并制定完善的风险防控策略。\n\n综上所述，旅游乐园有限公司在2020年经历了一系列重要事件，这些事件对公司的财务状况和业务发展产生了积极影响。公司将继续实施财务策略，加大投资力度，加强风险管理，以保持持续稳定的发展。"
}