{
    "courtAndProcuratorate": {
        "court": "Northwood, Richmond, Court",
        "procuratorate": "Northwood, Richmond, Procuratorate"
    },
    "chiefJudge": "B. Miller",
    "judge": "R. Jackson",
    "clerk": "O. Edwards",
    "defendant": {
        "name": "S. Taylor",
        "gender": "male",
        "birthdate": "27th, October, 1985",
        "residence": "32, Eagleton street, Richmond",
        "ethnicity": "Caucasian",
        "occupation": "Graphic Designer"
    },
    "defenseLawyer": {
        "name": "U. Cooper",
        "lawFirm": "Richmond Defenders LLP"
    },
    "caseProcess": [
        {
            "event": "Case Filing and Investigation",
            "date": "10th January, 2023"
        },
        {
            "event": "Detention Measures Taken",
            "date": "15th January, 2023"
        },
        {
            "event": "Criminal Detention",
            "date": "18th January, 2023"
        },
        {
            "event": "Arrest",
            "date": "25th January, 2023"
        }
    ],
    "criminalFacts": [
        {
            "crimeName": "Crime of Counterfeiting Currency",
            "details": [
                {
                    "timePeriod": "November 2022",
                    "behavior": "S. Taylor acquired high-quality paper and inks resembling those used in genuine banknotes and began producing counterfeit $100 bills in his home studio.",
                    "evidence": "Confiscated counterfeiting equipment including a high-resolution printer, specialized inks, and paper similar to currency stock. Testimonies from two expert witnesses confirming the materials match those used in genuine currency production."
                },
                {
                    "timePeriod": "December 2022",
                    "behavior": "S. Taylor distributed counterfeit $100 bills at local businesses, targeting small grocery stores and gas stations where cash transactions were frequent.",
                    "evidence": "Surveillance footage recovered from affected businesses showing S. Taylor transacting with counterfeit $100 bills. Analysis reports confirming approximately $5,000 in counterfeit notes were passed during this period."
                },
                {
                    "timePeriod": "Early January 2023",
                    "behavior": "S. Taylor recruited an accomplice, M. Johnson, to help distribute the counterfeit currency across different locations in the city to avoid detection.",
                    "evidence": "Text message exchanges between S. Taylor and M. Johnson detailing the distribution plan. Seized counterfeit currency worth $3,000 found in M. Johnson's possession during arrest."
                }
            ]
        }
    ],
    "legalProcedure": {
        "judgmentDate": "25th March, 2023",
        "judgmentResult": [
            {
                "crimeName": "Crime of Counterfeiting Currency",
                "sentence": "7 years of fixed-term imprisonment, fine of $50,000",
                "sentencingConsiderations": "Considering the defendant’s role in organizing the counterfeit operation, the significant amount of counterfeit currency produced, and the extensive distribution effort."
            }
        ]
    },
    "Generated Article": "---\n\n**In the Northwood, Richmond, Court**\n\n---\n\n**CRIMINAL JUDGMENT**\n\n**Court and Prosecutor Information**\n\nCourt:\nNorthwood, Richmond, Court\n\nProsecutor:\nNorthwood, Richmond, Procuratorate\n\nChief Judge:\nThe Honourable B. Miller\n\nJudge:\nThe Honourable R. Jackson\n\nClerk:\nO. Edwards\n\n---\n\n**Defendant and Defense Lawyer Information**\n\nDefendant:\nName: S. Taylor\nGender: Male\nDate of Birth: 27th October, 1985\nResidence: 32, Eagleton Street, Richmond\nEthnicity: Caucasian\nOccupation: Graphic Designer\n\nDefense Lawyer:\nName: U. Cooper\nLaw Firm: Richmond Defenders LLP\n\n---\n\n**Case Procedures**\n\nThis court hereby records the procedural history of the case involving the defendant, S. Taylor, who stands accused of the Crime of Counterfeiting Currency in violation of Article 170 of the Criminal Code.\n\n**1. Case Filing and Investigation:**\nOn the 10th of January 2023, the Northwood, Richmond, Procuratorate received a complaint regarding suspicious counterfeit currency circulated in local businesses. An official investigation was commenced soon after to gather critical evidence and identify potential suspects.\n\n**2. Detention Measures Taken:**\nOn the 15th of January 2023, following preliminary inquiries and collection of physical and testimonial evidence pointing towards S. Taylor, law enforcement agencies executed a detention measure to limit the movement of the defendant and prevent possible tampering with evidence.\n\n**3. Criminal Detention:**\nOn the 18th of January 2023, S. Taylor was placed under formal criminal detention pending further investigation and judicial proceedings.\n\n**4. Arrest:**\nOn the 25th of January 2023, an arrest warrant was issued based on substantial evidence implicating S. Taylor in the counterfeit operation. The defendant was thereby taken into custody and duly informed of his rights.\n\n---\n\n**Case Statement**\n\nThe case at bar centers upon the activities of the defendant, S. Taylor, who from November 2022 through early January 2023, engaged in the manufacture and distribution of counterfeit currency, specifically $100 bills. The case encapsulates various instances of premeditated and calculated endeavors by the defendant to produce and disseminate fraudulent banknotes within the local economy, thereby undermining public confidence in the monetary system.\n\nIn November 2022, S. Taylor, leveraging his expertise and capabilities as a graphic designer, acquired specialized materials, including high-quality paper and inks, mirroring those used in genuine currency. Using this assemblage of resources and sophisticated printing technology, the defendant successfully fabricated counterfeit $100 bills in his personal workshop located at his residence, 32, Eagleton Street, Richmond.\n\nThe scope of this forensic inquiry expanded as it was revealed that in December 2022, S. Taylor initiated a distribution scheme targeting minor commerce establishments such as small grocery stores and gas stations, relying on frequent cash transactions as a cover for passing off the counterfeit notes.\n\nIn a calculated move to evade detection and exacerbate the reach of the counterfeit operation, early January 2023 saw S. Taylor enlist the assistance of M. Johnson, an accomplice, orchestrating a broader range of distribution zones across different city locales.\n\n---\n\n**Charge**\n\nThis court finds the collective actions of the defendant, S. Taylor, constitute the Crime of Counterfeiting Currency as per Article 170 of the Criminal Code.\n\n---\n\n**Evidence Description**\n\nUpon detailed examination, the collage of evidence substantiating the charge against the defendant comprises:\n\n- **Physical Evidence:**\nSeized items from S. Taylor's residence include counterfeiting apparatus— a high-resolution printer, specialized inks, and high-quality paper crafted to mimic currency stock. Analysis from expert witnesses conclusively validated these materials against those employed in genuine currency production.\n\n- **Expert Testimonies:**\nTwo currency production specialists testified, affirming that the confiscated materials and artifacts were capable of producing counterfeit banknotes indistinguishable from authentic currency without advanced forensic methods.\n\n- **Surveillance Footage:**\nVideo recordings retrieved from affected businesses incontrovertibly identify S. Taylor engaging in transactions with counterfeit $100 bills. Footage dated December 2022 demonstrates multiple instances of the defendant disseminating the counterfeit currency across various cash-dependent establishments.\n\n- **Financial Analysis Reports:**\nEvidence reports compiled by forensic accountants indicate a sum total of approximately $5,000 in counterfeit currency circulated through the economic channels during December 2022.\n\n- **Text Message Exchanges:**\nRecovered telecommunications between S. Taylor and his accomplice M. Johnson extensively detail the stratagem for distributing counterfeit banknotes. The correspondence depicts an intricate plan to disperse counterfeit currency, capitalizing on M. Johnson’s extended reach across different locations to elude concentrated scrutiny.\n\n- **Seized Counterfeit Currency:**\nIn possession of M. Johnson at the time of arrest, law enforcement seized counterfeit notes summing to $3,000. Further examination corroborated these notes matched the counterfeit specimens produced by S. Taylor.\n\n---\n\n**Sentencing Considerations**\n\nIn rendering the judgment, this court weighed several pivotal elements governing the sentencing outcome:\n\n1. **Nature and Seriousness of the Offense:**\nThe operations orchestrated by the defendant exhibited premeditation and resourcefulness, substantively amplifying the scale and impact of the counterfeiting scheme.\n\n2. **Role and Leadership:**\nS. Taylor emerged not merely as a participant but as a key organizer and principal architect of the counterfeit operation, implicating severe fault in the financial misconduct magnifying the culpability.\n\n3. **Extent and Reach of Distribution:**\nThe voluminous production and extensive distribution scheme of the counterfeit currency involved sophisticated logistics effectuating wide dispersal and heightened difficulty in detection, exerting substantial negative influence on both local commerce and consumer trust.\n\n4. **Economic Impact:**\nThe financial ramifications arising from the distribution of approximately $8,000 in counterfeit currency within a short timeframe precipitated tangible economic distortion and trickle-down financial distress within the community.\n\n5. **Degree of Planning and Deliberation:**\nThe calculated procurement of counterfeiting materials, studied methodology in fabrication, and the deliberate recruitment of an accomplice underscore a high degree of planning and premeditated criminal behavior.\n\n---\n\n**Judgment Result**\n\nIn light of the aforementioned considerations, this court adjudges the defendant, S. Taylor, guilty of the Crime of Counterfeiting Currency in violation of Article 170 of the Criminal Code. The sentence pronounced is as follows:\n\n**Sentence:**\nSeven (7) years of fixed-term imprisonment.\nFine: $50,000.\n\n---\n\n**Appeal Rights Explanation**\n\nThe defendant, S. Taylor, is hereby informed of the right to appeal this judgment. Pursuant to the provisions contained within the relevant legal framework, the defendant holds the entitlement to file an appeal within a stipulated time period from the date of receipt of this judgment. The appellate process ensures that the higher judicial authority will re-examine the factual and legal matters pertinent to the case should an appeal be lodged.\n\n---\n\nThis document is thus prepared and endorsed in the Northwood, Richmond, Court on this 25th day of March, 2023.\n\n---\n\n**Signatures:**\n\nChief Judge: ______________________\n\nJudge: ______________________\n\nCourt Clerk: ______________________\n\n---\n\n**End of Document**\n\n---\n\nReference Article is below：\nArticle 170\nThose who counterfeit currency shall be sentenced to fixed-term imprisonment of more than three years but not more than ten years, and shall also be fined; if any of the following circumstances apply, they shall be sentenced to fixed-term imprisonment of more than ten years or life imprisonment, and shall also be fined or have their property confiscated:\n(a) Principal members of a counterfeiting currency group;\n(b) Counterfeiting currency in particularly large amounts;\n(c) Other particularly serious circumstances.",
    "qa_fact_based": [
        {
            "question type": "Factual Question",
            "question": "According to the court judgment of Northwood, Richmond, Court, what was the judgment date?",
            "answer": "25th March, 2023",
            "ref": [
                "This document is thus prepared and endorsed in the Northwood, Richmond, Court on this 25th day of March, 2023."
            ]
        },
        {
            "question type": "Factual Question",
            "question": "According to the court judgment of Northwood, Richmond, Court, who was the chief judge?",
            "answer": "B. Miller",
            "ref": [
                "Chief Judge:"
            ]
        },
        {
            "question type": "Factual Question",
            "question": "According to the court judgment of Northwood, Richmond, Court, what was the fine imposed on S. Taylor?",
            "answer": "$50,000",
            "ref": [
                "Fine: $50,000."
            ]
        }
    ],
    "qa_multi_hop": [
        {
            "question type": "Multi-hop Reasoning Question",
            "question": "According to the judgment of Northwood, Richmond, Court, how many distinct periods of criminal activity were S. Taylor's counterfeiting crimes divided into?",
            "answer": "According to the judgment, S. Taylor's counterfeiting crimes were divided into three distinct periods: November 2022, December 2022, and early January 2023.",
            "ref": [
                "The case at bar centers upon the activities of the defendant, S. Taylor, who from November 2022 through early January 2023, engaged in the manufacture and distribution of counterfeit currency, specifically $100 bills.",
                "The scope of this forensic inquiry expanded as it was revealed that in December 2022, S. Taylor initiated a distribution scheme targeting minor commerce establishments such as small grocery stores and gas stations, relying on frequent cash transactions as a cover for passing off the counterfeit notes.",
                "In a calculated move to evade detection and exacerbate the reach of the counterfeit operation, early January 2023 saw S. Taylor enlist the assistance of M. Johnson, an accomplice, orchestrating a broader range of distribution zones across different city locales."
            ]
        },
        {
            "question type": "Multi-hop Reasoning Question",
            "question": "According to the judgment of Northwood, Richmond, Court, what is the total value of the counterfeit currency produced and distributed by S. Taylor and his accomplice?",
            "answer": "In November 2022, S. Taylor began producing counterfeit $100 bills, in December 2022 he distributed approximately $5,000 in counterfeit notes, and in early January 2023, an additional $3,000 worth of counterfeit currency was found in his accomplice's possession. The total value is approximately $8,000.",
            "ref": [
                "The case at bar centers upon the activities of the defendant, S. Taylor, who from November 2022 through early January 2023, engaged in the manufacture and distribution of counterfeit currency, specifically $100 bills.",
                "Evidence reports compiled by forensic accountants indicate a sum total of approximately $5,000 in counterfeit currency circulated through the economic channels during December 2022.",
                "In possession of M. Johnson at the time of arrest, law enforcement seized counterfeit notes summing to $3,000.",
                "The financial ramifications arising from the distribution of approximately $8,000 in counterfeit currency within a short timeframe precipitated tangible economic distortion and trickle-down financial distress within the community."
            ]
        }
    ],
    "qa_summary": [
        {
            "question type": "Summarization Question",
            "question": "According to the judgment of Northwood, Richmond, Court, summarize the facts of S. Taylor's crime.",
            "answer": "S. Taylor engaged in counterfeiting currency in three main phases: In November 2022, he acquired high-quality materials and began producing counterfeit $100 bills in his home studio. In December 2022, he distributed counterfeit bills at local businesses, particularly small grocery stores and gas stations. In early January 2023, he recruited an accomplice, M. Johnson, to help distribute the counterfeit currency across different city locations.",
            "ref": [
                "The case at bar centers upon the activities of the defendant, S. Taylor, who from November 2022 through early January 2023, engaged in the manufacture and distribution of counterfeit currency, specifically $100 bills.",
                "The case encapsulates various instances of premeditated and calculated endeavors by the defendant to produce and disseminate fraudulent banknotes within the local economy, thereby undermining public confidence in the monetary system.",
                "In November 2022, S. Taylor, leveraging his expertise and capabilities as a graphic designer, acquired specialized materials, including high-quality paper and inks, mirroring those used in genuine currency.",
                "Using this assemblage of resources and sophisticated printing technology, the defendant successfully fabricated counterfeit $100 bills in his personal workshop located at his residence, 32, Eagleton Street, Richmond.",
                "The scope of this forensic inquiry expanded as it was revealed that in December 2022, S. Taylor initiated a distribution scheme targeting minor commerce establishments such as small grocery stores and gas stations, relying on frequent cash transactions as a cover for passing off the counterfeit notes.",
                "In a calculated move to evade detection and exacerbate the reach of the counterfeit operation, early January 2023 saw S. Taylor enlist the assistance of M. Johnson, an accomplice, orchestrating a broader range of distribution zones across different city locales."
            ]
        },
        {
            "question type": "Summarization Question",
            "question": "According to the judgment of Northwood, Richmond, Court, summarize the evidence presented in S. Taylor's case.",
            "answer": "The evidence against S. Taylor includes confiscated counterfeiting equipment like a high-resolution printer, specialized inks, and currency-like paper. Expert witness testimonies confirmed the materials used matched genuine currency. Surveillance footage from affected businesses showed S. Taylor transacting with counterfeit $100 bills, and analysis reports indicate approximately $5,000 in counterfeit notes were passed in December 2022. Additionally, text messages between S. Taylor and his accomplice, M. Johnson, outlined their distribution plan, and $3,000 in counterfeit currency was found with M. Johnson during his arrest.",
            "ref": [
                "Seized items from S. Taylor's residence include counterfeiting apparatus— a high-resolution printer, specialized inks, and high-quality paper crafted to mimic currency stock.",
                "Analysis from expert witnesses conclusively validated these materials against those employed in genuine currency production.",
                "Two currency production specialists testified, affirming that the confiscated materials and artifacts were capable of producing counterfeit banknotes indistinguishable from authentic currency without advanced forensic methods.",
                "- **Surveillance Footage:**",
                "Video recordings retrieved from affected businesses incontrovertibly identify S. Taylor engaging in transactions with counterfeit $100 bills.",
                "Footage dated December 2022 demonstrates multiple instances of the defendant disseminating the counterfeit currency across various cash-dependent establishments.",
                "Evidence reports compiled by forensic accountants indicate a sum total of approximately $5,000 in counterfeit currency circulated through the economic channels during December 2022.",
                "Recovered telecommunications between S. Taylor and his accomplice M. Johnson extensively detail the stratagem for distributing counterfeit banknotes.",
                "The correspondence depicts an intricate plan to disperse counterfeit currency, capitalizing on M. Johnson’s extended reach across different locations to elude concentrated scrutiny.",
                "In possession of M. Johnson at the time of arrest, law enforcement seized counterfeit notes summing to $3,000.",
                "Further examination corroborated these notes matched the counterfeit specimens produced by S. Taylor."
            ]
        },
        {
            "question type": "Summarization Question",
            "question": "According to the judgment of Northwood, Richmond, Court, detail the case process from filing to arrest in S. Taylor's case.",
            "answer": "The case process began with Case Filing and Investigation on 10th January 2023, followed by Detention Measures Taken on 15th January 2023. S. Taylor was then subject to Criminal Detention on 18th January 2023, and finally, he was arrested on 25th January 2023.",
            "ref": [
                "On the 10th of January 2023, the Northwood, Richmond, Procuratorate received a complaint regarding suspicious counterfeit currency circulated in local businesses.",
                "An official investigation was commenced soon after to gather critical evidence and identify potential suspects.",
                "On the 15th of January 2023, following preliminary inquiries and collection of physical and testimonial evidence pointing towards S. Taylor, law enforcement agencies executed a detention measure to limit the movement of the defendant and prevent possible tampering with evidence.",
                "On the 18th of January 2023, S. Taylor was placed under formal criminal detention pending further investigation and judicial proceedings.",
                "On the 25th of January 2023, an arrest warrant was issued based on substantial evidence implicating S. Taylor in the counterfeit operation.",
                "The defendant was thereby taken into custody and duly informed of his rights."
            ]
        },
        {
            "question type": "Summarization Question",
            "question": "According to the judgment of Northwood, Richmond, Court, summarize the judgment result and sentencing considerations for S. Taylor's case.",
            "answer": "On 25th March 2023, the court sentenced S. Taylor for the Crime of Counterfeiting Currency to 7 years of fixed-term imprisonment and a fine of $50,000. The sentencing considerations included his role in organizing the counterfeit operation, the significant amount of counterfeit currency produced, and the extensive distribution effort.",
            "ref": [
                "1. **Nature and Seriousness of the Offense:**",
                "The operations orchestrated by the defendant exhibited premeditation and resourcefulness, substantively amplifying the scale and impact of the counterfeiting scheme.",
                "2. **Role and Leadership:**",
                "S. Taylor emerged not merely as a participant but as a key organizer and principal architect of the counterfeit operation, implicating severe fault in the financial misconduct magnifying the culpability.",
                "3. **Extent and Reach of Distribution:**",
                "The voluminous production and extensive distribution scheme of the counterfeit currency involved sophisticated logistics effectuating wide dispersal and heightened difficulty in detection, exerting substantial negative influence on both local commerce and consumer trust.",
                "4. **Economic Impact:**",
                "The financial ramifications arising from the distribution of approximately $8,000 in counterfeit currency within a short timeframe precipitated tangible economic distortion and trickle-down financial distress within the community.",
                "The calculated procurement of counterfeiting materials, studied methodology in fabrication, and the deliberate recruitment of an accomplice underscore a high degree of planning and premeditated criminal behavior.",
                "In light of the aforementioned considerations, this court adjudges the defendant, S. Taylor, guilty of the Crime of Counterfeiting Currency in violation of Article 170 of the Criminal Code.",
                "The sentence pronounced is as follows:",
                "Seven (7) years of fixed-term imprisonment.",
                "Fine: $50,000."
            ]
        }
    ]
}