{
    "courtAndProcuratorate": {
        "court": "Vandalia, Bayside, Court",
        "procuratorate": "Vandalia, Bayside, Procuratorate"
    },
    "chiefJudge": "D. Jimenez",
    "judge": "J. Scott",
    "clerk": "M. Scott",
    "defendant": {
        "name": "G. Torres",
        "gender": "female",
        "birthdate": "11th, November, 1960",
        "residence": "10, Ashton street, Bayside",
        "ethnicity": "Hispanic",
        "occupation": "Elementary School Teacher"
    },
    "defenseLawyer": {
        "name": "U. Cox",
        "lawFirm": "Cox & Hamilton Law Offices"
    },
    "caseProcess": [
        {
            "event": "Case Filing and Investigation",
            "date": "15th, March, 2023"
        },
        {
            "event": "Detention Measures Taken",
            "date": "20th, March, 2023"
        },
        {
            "event": "Criminal Detention",
            "date": "25th, March, 2023"
        },
        {
            "event": "Arrest",
            "date": "30th, March, 2023"
        }
    ],
    "criminalFacts": [
        {
            "crimeName": "Crime of Traffic Accident",
            "details": [
                {
                    "timePeriod": "10:15 AM, 10th, March, 2023",
                    "behavior": "While driving a 2018 Toyota Camry, license plate ABC123, defendant G. Torres ran a red light at the intersection of Elm Street and Main Avenue, colliding with a pedestrian, Mr. J. Smith, causing severe injuries to Mr. Smith.",
                    "evidence": "Traffic camera footage, eyewitness testimony from Ms. L. Johnson, medical reports from Bayside General Hospital showcasing Mr. Smith's injuries."
                },
                {
                    "timePeriod": "10:20 AM, 10th, March, 2023",
                    "behavior": "Following the initial collision, G. Torres failed to stop and render aid as required by law, fleeing the scene instead.",
                    "evidence": "Traffic camera footage showing G. Torres leaving the scene, GPS data from G. Torres' vehicle, witness testimony from Mr. K. Wu."
                },
                {
                    "timePeriod": "11:00 AM, 10th, March, 2023",
                    "behavior": "G. Torres attempted to conceal involvement by parking the damaged vehicle in a remote garage and booking a repair appointment without informing police of the accident.",
                    "evidence": "Repair service records from Jet Auto Repair, surveillance footage from garage, statements from repair shop technician, Mr. R. Lee."
                }
            ]
        }
    ],
    "legalProcedure": {
        "judgmentDate": "20th, April, 2023",
        "judgmentResult": [
            {
                "crimeName": "Crime of Traffic Accident",
                "sentence": "Four years of fixed-term imprisonment",
                "sentencingConsiderations": "Severity of the pedestrian’s injuries, failure to stop and render aid, attempt to conceal involvement; no prior criminal record, shown remorse during trial."
            }
        ]
    },
    "Generated Article": "# Vandalia, Bayside Court\n\n## Criminal Case Judgment\n\n### Court and Prosecutor Information\n**Court:** Vandalia, Bayside Court  \n**Procuratorate:** Vandalia, Bayside Procuratorate  \n**Chief Judge:** D. Jimenez  \n**Judge:** J. Scott  \n**Clerk:** M. Scott  \n\n### Defendant and Defense Lawyer Information\n**Defendant:**\n- **Name:** G. Torres\n- **Gender:** Female\n- **Birthdate:** 11th, November, 1960\n- **Residence:** 10, Ashton Street, Bayside\n- **Ethnicity:** Hispanic\n- **Occupation:** Elementary School Teacher\n\n**Defense Lawyer:**  \n- **Name:** U. Cox  \n- **Law Firm:** Cox & Hamilton Law Offices  \n\n### Case Procedures\nThe proceedings of this case began on the 15th of March, 2023, when the case was filed and an investigation was initiated. Subsequently, on the 20th of March, 2023, detention measures were enforced to ensure the presence of the defendant during the investigative process. On the 25th of March, 2023, G. Torres was placed under criminal detention. Formal arrest followed on the 30th of March, 2023.\n\n### Case Statement\nThe events leading to this prosecution began at approximately 10:15 AM on the 10th of March, 2023, when the defendant, G. Torres, was operating a 2018 Toyota Camry with the license plate number ABC123. While driving along Elm Street approaching the intersection of Main Avenue, Torres failed to observe the traffic signal indicating a red light. Consequently, she proceeded through the intersection without stopping. During this time, pedestrian Mr. J. Smith was lawfully crossing the street at the designated crosswalk.\n\nThe collision between G. Torres’ vehicle and Mr. Smith was severe, resulting in life-threatening injuries to Mr. Smith, including multiple fractures and significant blood loss. Despite the conspicuousness and the severity of the incident, G. Torres chose not to stop and provide assistance, detailing events indicative of clear conscious avoidance of responsibility. Surveillance footage corroborates that she continued to drive away from the scene towards an undetermined location.\n\nAt approximately 10:20 AM, G. Torres hastened away from the accident site, failing in her legal obligation to render aid or await law enforcement’s arrival. This act of fleeing the scene evidenced an attempt to elude accountability for the occurring accident and its grave repercussions.\n\nNot long after, at roughly 11:00 AM the same day, G. Torres executed further measures to obscure her complicity in the incident. She parked the damaged Toyota Camry in a remote and less frequented garage, subsequently making arrangements to have the car repaired, purposefully neglecting to report the accident to the police. Records from Jet Auto Repair where she scheduled the repair and a technician's testimony align to substantiate this claim. Surveillance footage from the garage further elucidates her actions.\n\n### Charges\nThe charges levied against G. Torres comprise violation of traffic regulations resulting in severe bodily harm to a pedestrian, criminal negligence, fleeing the scene of an accident, and deliberate attempts to conceal involvement in the aforementioned crime. These infractions contravene the stipulations under Article No. 133.\n\n### Evidence Description\n1. **Traffic Camera Footage**:\n   The traffic camera footage at the intersection of Elm Street and Main Avenue provides explicit evidence of the defendant ignoring the red light and continuing through the intersection, leading directly to the collision with Mr. J. Smith. This footage vividly captures the sequence of events, establishing a timeline consistent with the incident reported.\n\n2. **Eyewitness Testimony from Ms. L. Johnson**:\n   Ms. L. Johnson, a bystander at the scene, provided a detailed account of observing the defendant's vehicle running the red light and striking Mr. Smith. Her testimony highlighted the immediate aftermath, describing Torres' failure to stop and rendering the required aid.\n\n3. **Medical Reports from Bayside General Hospital**:\n   Medical documentation reflects the extent of injuries sustained by Mr. Smith, noting severe fractures, internal injuries, and considerable blood loss, specify the negated necessity for emergency medical intervention and subsequent long-term treatment for recovery.\n\n4. **GPS Data from G. Torres' Vehicle**:\n   Analysis of the vehicle’s GPS data demonstrates Torres’ movements post-incident, reaffirming her departure from the site without stopping. This spatial information corroborates her attempts to evade further scrutiny.\n\n5. **Witness Testimony from Mr. K. Wu**:\n   Mr. K. Wu, another witness, confirmed sighting the proceeding actions of Torres driving away in haste post-collision. Wu was able to provide descriptive details about the vehicle and its direction of travel.\n\n6. **Repair Service Records from Jet Auto Repair**:\n   Upon investigation, the records from Jet Auto Repair showcase G. Torres' repair booking and her communication regarding damages to the front end of her vehicle, notably the actions taken to mitigate the visual evidence of her involvement.\n\n7. **Surveillance Footage from the Garage**:\n   Footage obtained from the garage where Torres parked her vehicle elucidates the concealment efforts and further interactions pertinent to the attempted repair arrangements.\n\n8. **Statements from Repair Shop Technician, Mr. R. Lee**:\n   Mr. R. Lee provided valuable insights into his interaction with G. Torres, confirming her reluctance to disclose the actual circumstances of the damages and her subsequent booking for vehicular repairs.\n\n### Sentencing Considerations\nIn determining the appropriate sentence for the crime of Traffic Accident under Article No. 133, this court has weighed the following factors:\n\n1. **Severity of the Pedestrian’s Injuries**:\n   The court acknowledges the extensive and grievous nature of Mr. Smith’s injuries, which necessitated immediate and ongoing medical treatment and fundamentally impacted his quality of life.\n\n2. **Failure to Stop and Render Aid**:\n   The defendant's failure to comply with the obligation to stop and assist the injured party demonstrates a blatant disregard for human life and legal responsibilities, meriting severe punitive measures.\n\n3. **Attempt to Conceal Involvement**:\n   The proactive steps taken by G. Torres to obfuscate her involvement – including parking the vehicle in a remote location and scheduling repairs without notifying authorities – illustrate a conscious endeavor to avert justice.\n\n4. **Remorse Exhibited During Trial**:\n   Despite the gravity of her actions, G. Torres exhibited signs of remorse during the trial proceedings. She expressed regret and acknowledged her negligence and its consequences.\n\n5. **Absence of Prior Criminal Record**:\n   The court has taken into account that G. Torres maintains no prior criminal history, which traditionally might suggest a likelihood of reform and absence of habitual criminal behavior.\n\n### Judgment Result\nBased on the evidence presented and the legal arguments made, this court finds G. Torres guilty of the Crime of Traffic Accident as per Article No. 133. Consequently, this court sentences G. Torres to four years of fixed-term imprisonment. \n\n### Appeal Rights Explanation\nThis court informs G. Torres of her right to appeal this judgment. In accordance with legal statutes, the defendant has the right to file an appeal within ten days from this date if she believes the judgment to be erroneous or unjust. The appeal must be comprehensively justified and submitted to the appropriate appellate court within the stipulated period. Failure to appeal within the provided timeframe shall render this judgment final and binding.\n\nThis concludes the formal judgment for the case involving G. Torres. All parties have been duly notified of their rights and obligations henceforth.\n\n**Dated:** 20th, April, 2023  \n**Chief Judge:** D. Jimenez  \n**Judge:** J. Scott  \n**Court Clerk:** M. Scott  \n**Vandalia, Bayside Court**\n\nReference Article is below：\nArticle 133\nViolating traffic and transportation management regulations, resulting in a major accident, causing serious injury, death, or significant property damage, shall be sentenced to fixed-term imprisonment of not more than three years or criminal detention; if they escape after a traffic accident or have other particularly egregious circumstances, they shall be sentenced to fixed-term imprisonment of more than three years but not more than seven years; if the escape causes death, they shall be sentenced to fixed-term imprisonment of more than seven years.",
    "qa_fact_based": [
        {
            "question type": "Factual Question",
            "question": "According to the court judgment of Vandalia, Bayside, Court, what crime did G. Torres commit?",
            "answer": "Crime of Traffic Accident",
            "ref": [
                "Based on the evidence presented and the legal arguments made, this court finds G. Torres guilty of the Crime of Traffic Accident as per Article No. 133."
            ]
        },
        {
            "question type": "Factual Question",
            "question": "According to the court judgment of Vandalia, Bayside, Court, what was the sentence for G. Torres?",
            "answer": "Four years of fixed-term imprisonment",
            "ref": [
                "Consequently, this court sentences G. Torres to four years of fixed-term imprisonment."
            ]
        },
        {
            "question type": "Factual Question",
            "question": "According to the court judgment of Vandalia, Bayside, Court, who was the chief judge?",
            "answer": "D. Jimenez",
            "ref": [
                "**Chief Judge:** D. Jimenez"
            ]
        },
        {
            "question type": "Factual Question",
            "question": "According to the court judgment of Vandalia, Bayside, Court, what was the license plate of the vehicle driven by G. Torres?",
            "answer": "ABC123",
            "ref": [
                "The events leading to this prosecution began at approximately 10:15 AM on the 10th of March, 2023, when the defendant, G. Torres, was operating a 2018 Toyota Camry with the license plate number ABC123."
            ]
        }
    ],
    "qa_multi_hop": [
        {
            "question type": "Multi-hop Reasoning Question",
            "question": "According to the judgment of Vandalia, Bayside, Court, how many criminal actions did G. Torres commit in the traffic accident case?",
            "answer": "According to the judgment, G. Torres committed a total of four criminal actions: running a red light, failing to stop and render aid, fleeing the scene, and attempting to conceal involvement.",
            "ref": [
                "While driving along Elm Street approaching the intersection of Main Avenue, Torres failed to observe the traffic signal indicating a red light.",
                "Despite the conspicuousness and the severity of the incident, G. Torres chose not to stop and provide assistance, detailing events indicative of clear conscious avoidance of responsibility.",
                "This act of fleeing the scene evidenced an attempt to elude accountability for the occurring accident and its grave repercussions.",
                "The charges levied against G. Torres comprise violation of traffic regulations resulting in severe bodily harm to a pedestrian, criminal negligence, fleeing the scene of an accident, and deliberate attempts to conceal involvement in the aforementioned crime."
            ]
        },
        {
            "question type": "Multi-hop Reasoning Question",
            "question": "According to the judgment of Vandalia, Bayside, Court, how many pieces of evidence were presented in the traffic accident case involving G. Torres?",
            "answer": "According to the judgment, there were a total of eight pieces of evidence presented: traffic camera footage, eyewitness testimony from Ms. L. Johnson, medical reports from Bayside General Hospital, GPS data from G. Torres' vehicle, witness testimony from Mr. K. Wu, repair service records from Jet Auto Repair, surveillance footage from the garage, and statements from repair shop technician, Mr. R. Lee.",
            "ref": [
                "1. **Traffic Camera Footage**:",
                "The traffic camera footage at the intersection of Elm Street and Main Avenue provides explicit evidence of the defendant ignoring the red light and continuing through the intersection, leading directly to the collision with Mr. J. Smith.",
                "This footage vividly captures the sequence of events, establishing a timeline consistent with the incident reported.",
                "2. **Eyewitness Testimony from Ms. L. Johnson**:",
                "Ms. L. Johnson, a bystander at the scene, provided a detailed account of observing the defendant's vehicle running the red light and striking Mr. Smith.",
                "Her testimony highlighted the immediate aftermath, describing Torres' failure to stop and rendering the required aid.",
                "3. **Medical Reports from Bayside General Hospital**:",
                "Medical documentation reflects the extent of injuries sustained by Mr. Smith, noting severe fractures, internal injuries, and considerable blood loss, specify the negated necessity for emergency medical intervention and subsequent long-term treatment for recovery.",
                "4. **GPS Data from G. Torres' Vehicle**:",
                "Analysis of the vehicle’s GPS data demonstrates Torres’ movements post-incident, reaffirming her departure from the site without stopping.",
                "This spatial information corroborates her attempts to evade further scrutiny.",
                "5. **Witness Testimony from Mr. K. Wu**:",
                "Mr. K. Wu, another witness, confirmed sighting the proceeding actions of Torres driving away in haste post-collision.",
                "Wu was able to provide descriptive details about the vehicle and its direction of travel.",
                "6. **Repair Service Records from Jet Auto Repair**:",
                "Upon investigation, the records from Jet Auto Repair showcase G. Torres' repair booking and her communication regarding damages to the front end of her vehicle, notably the actions taken to mitigate the visual evidence of her involvement.",
                "7. **Surveillance Footage from the Garage**:",
                "Footage obtained from the garage where Torres parked her vehicle elucidates the concealment efforts and further interactions pertinent to the attempted repair arrangements.",
                "8. **Statements from Repair Shop Technician, Mr. R. Lee**:",
                "Mr. R. Lee provided valuable insights into his interaction with G. Torres, confirming her reluctance to disclose the actual circumstances of the damages and her subsequent booking for vehicular repairs."
            ]
        }
    ],
    "qa_summary": [
        {
            "question type": "Summarization Question",
            "question": "According to the judgment of Vandalia, Bayside, Court, summarize the facts of G. Torres' crimes.",
            "answer": "On March 10, 2023, at 10:15 AM, G. Torres, while driving a 2018 Toyota Camry with license plate ABC123, ran a red light at the intersection of Elm Street and Main Avenue, colliding with a pedestrian, Mr. J. Smith, causing severe injuries to Mr. Smith. At 10:20 AM, G. Torres failed to stop and render aid, fleeing the scene instead. At 11:00 AM, G. Torres attempted to conceal involvement by parking the damaged vehicle in a remote garage and booking a repair appointment without informing the police of the accident.",
            "ref": [
                "The events leading to this prosecution began at approximately 10:15 AM on the 10th of March, 2023, when the defendant, G. Torres, was operating a 2018 Toyota Camry with the license plate number ABC123.",
                "While driving along Elm Street approaching the intersection of Main Avenue, Torres failed to observe the traffic signal indicating a red light.",
                "Consequently, she proceeded through the intersection without stopping.",
                "During this time, pedestrian Mr. J. Smith was lawfully crossing the street at the designated crosswalk.",
                "The collision between G. Torres’ vehicle and Mr. Smith was severe, resulting in life-threatening injuries to Mr. Smith, including multiple fractures and significant blood loss.",
                "Despite the conspicuousness and the severity of the incident, G. Torres chose not to stop and provide assistance, detailing events indicative of clear conscious avoidance of responsibility.",
                "Surveillance footage corroborates that she continued to drive away from the scene towards an undetermined location.",
                "At approximately 10:20 AM, G. Torres hastened away from the accident site, failing in her legal obligation to render aid or await law enforcement’s arrival.",
                "This act of fleeing the scene evidenced an attempt to elude accountability for the occurring accident and its grave repercussions.",
                "Not long after, at roughly 11:00 AM the same day, G. Torres executed further measures to obscure her complicity in the incident.",
                "She parked the damaged Toyota Camry in a remote and less frequented garage, subsequently making arrangements to have the car repaired, purposefully neglecting to report the accident to the police."
            ]
        },
        {
            "question type": "Summarization Question",
            "question": "According to the judgment of Vandalia, Bayside, Court, summarize the evidence of G. Torres' crimes.",
            "answer": "The evidence includes traffic camera footage, eyewitness testimony from Ms. L. Johnson, medical reports from Bayside General Hospital showcasing Mr. Smith's injuries, GPS data from G. Torres' vehicle, witness testimony from Mr. K. Wu, repair service records from Jet Auto Repair, surveillance footage from the garage, and statements from repair shop technician, Mr. R. Lee.",
            "ref": [
                "1. **Traffic Camera Footage**:",
                "The traffic camera footage at the intersection of Elm Street and Main Avenue provides explicit evidence of the defendant ignoring the red light and continuing through the intersection, leading directly to the collision with Mr. J. Smith.",
                "This footage vividly captures the sequence of events, establishing a timeline consistent with the incident reported.",
                "2. **Eyewitness Testimony from Ms. L. Johnson**:",
                "Ms. L. Johnson, a bystander at the scene, provided a detailed account of observing the defendant's vehicle running the red light and striking Mr. Smith.",
                "Her testimony highlighted the immediate aftermath, describing Torres' failure to stop and rendering the required aid.",
                "3. **Medical Reports from Bayside General Hospital**:",
                "Medical documentation reflects the extent of injuries sustained by Mr. Smith, noting severe fractures, internal injuries, and considerable blood loss, specify the negated necessity for emergency medical intervention and subsequent long-term treatment for recovery.",
                "4. **GPS Data from G. Torres' Vehicle**:",
                "Analysis of the vehicle’s GPS data demonstrates Torres’ movements post-incident, reaffirming her departure from the site without stopping.",
                "This spatial information corroborates her attempts to evade further scrutiny.",
                "5. **Witness Testimony from Mr. K. Wu**:",
                "Mr. K. Wu, another witness, confirmed sighting the proceeding actions of Torres driving away in haste post-collision.",
                "Wu was able to provide descriptive details about the vehicle and its direction of travel.",
                "6. **Repair Service Records from Jet Auto Repair**:",
                "Upon investigation, the records from Jet Auto Repair showcase G. Torres' repair booking and her communication regarding damages to the front end of her vehicle, notably the actions taken to mitigate the visual evidence of her involvement.",
                "7. **Surveillance Footage from the Garage**:",
                "Footage obtained from the garage where Torres parked her vehicle elucidates the concealment efforts and further interactions pertinent to the attempted repair arrangements.",
                "8. **Statements from Repair Shop Technician, Mr. R. Lee**:",
                "Mr. R. Lee provided valuable insights into his interaction with G. Torres, confirming her reluctance to disclose the actual circumstances of the damages and her subsequent booking for vehicular repairs."
            ]
        },
        {
            "question type": "Summarization Question",
            "question": "According to the judgment of Vandalia, Bayside, Court, summarize the case process of G. Torres.",
            "answer": "The case process began with the filing and investigation on March 15, 2023. Detention measures were taken on March 20, 2023, followed by criminal detention on March 25, 2023. G. Torres was arrested on March 30, 2023.",
            "ref": [
                "The proceedings of this case began on the 15th of March, 2023, when the case was filed and an investigation was initiated.",
                "Subsequently, on the 20th of March, 2023, detention measures were enforced to ensure the presence of the defendant during the investigative process.",
                "On the 25th of March, 2023, G. Torres was placed under criminal detention.",
                "Formal arrest followed on the 30th of March, 2023."
            ]
        },
        {
            "question type": "Summarization Question",
            "question": "According to the judgment of Vandalia, Bayside, Court, summarize the judgment result for G. Torres.",
            "answer": "G. Torres was found guilty of the crime of traffic accident and sentenced to four years of fixed-term imprisonment. The sentencing considerations included the severity of the pedestrian’s injuries, failure to stop and render aid, attempt to conceal involvement, no prior criminal record, and shown remorse during the trial.",
            "ref": [
                "Based on the evidence presented and the legal arguments made, this court finds G. Torres guilty of the Crime of Traffic Accident as per Article No. 133.",
                "Consequently, this court sentences G. Torres to four years of fixed-term imprisonment.",
                "1. **Severity of the Pedestrian’s Injuries**:",
                "The court acknowledges the extensive and grievous nature of Mr. Smith’s injuries, which necessitated immediate and ongoing medical treatment and fundamentally impacted his quality of life.",
                "2. **Failure to Stop and Render Aid**:",
                "The defendant's failure to comply with the obligation to stop and assist the injured party demonstrates a blatant disregard for human life and legal responsibilities, meriting severe punitive measures.",
                "3. **Attempt to Conceal Involvement**:",
                "The proactive steps taken by G. Torres to obfuscate her involvement – including parking the vehicle in a remote location and scheduling repairs without notifying authorities – illustrate a conscious endeavor to avert justice.",
                "4. **Remorse Exhibited During Trial**:",
                "Despite the gravity of her actions, G. Torres exhibited signs of remorse during the trial proceedings.",
                "She expressed regret and acknowledged her negligence and its consequences.",
                "5. **Absence of Prior Criminal Record**:",
                "The court has taken into account that G. Torres maintains no prior criminal history, which traditionally might suggest a likelihood of reform and absence of habitual criminal behavior."
            ]
        }
    ]
}