{
    "Hospitalization Record": {
        "Basic Information": {
            "Name": "Y. Mendoza",
            "Gender": "male",
            "Age": "8 hours after birth",
            "Ethnicity": "",
            "Marital Status": "",
            "Occupation": "",
            "Address": "32, Riverside street, Victoria",
            "Admission Time": "10th, March",
            "Record Time": "10th, March",
            "Historian": "Mother",
            "Hospital Name": "Victoria General Hospital"
        },
        "Chief Complaint": "Crying, limited mouth opening, difficulty sucking for 8 hours",
        "Present Illness": {
            "Onset": "Symptoms noted immediately after birth in the delivery room.",
            "Main Symptoms": "Crying, limited mouth opening, difficulty sucking which have been persistent since onset.",
            "Accompanying Symptoms": "No other noticeable symptoms.",
            "Diagnosis and Treatment History": "No treatment before admission.",
            "General Condition Changes": "Appears irritable, difficulties with feeding, reduced sleep, normal urination and defecation, no weight change evident yet."
        },
        "Past History": {
            "General Health Condition": "Newborn",
            "Disease History": "None",
            "Infectious Disease History": "None",
            "Immunization History": "None",
            "Surgery and Trauma History": "None",
            "Blood Transfusion History": "None",
            "Allergy History": "None"
        },
        "Personal History": {
            "Birthplace": "Victoria",
            "Residence": "Victoria",
            "Living Habits": "Newborn",
            "Occupation and Working Conditions": "Newborn",
            "Exposure History": "None",
            "Travel History": "None"
        },
        "Marital and Family History": {
            "Marital History": {
                "Marital Status": "N/A",
                "Marriage Age": "N/A",
                "Spouse's Health Condition": "N/A",
                "Children's Condition": "N/A"
            },
            "Family History": "Parents healthy, no similar diseases reported in family history."
        },
        "Physical Examination": {
            "General Condition": {
                "Temperature": "36.8°C",
                "Pulse": "140 bpm",
                "Respiration": "45 breaths/min",
                "Blood Pressure": "Not measured"
            },
            "Systematic Examination": {
                "Skin": "Normal, no rashes or lesions",
                "Mucous Membranes": "Pale",
                "Lymph Nodes": "Not enlarged",
                "Head and Organs": "Head normal, no sign of trauma, fontanelles soft and flat",
                "Neck": "Supple, no masses or abnormalities",
                "Chest": "Clear lungs bilaterally, no wheezes or crackles, heart sounds regular, no murmurs",
                "Abdomen": "Soft, non-tender, no organomegaly",
                "Rectum and Anus": "Normal",
                "External Genitalia": "Normal male genitalia",
                "Spine": "No deformities noted",
                "Limbs": "Normal movement, no contractures",
                "Nervous System": "Hypertonicity noted, limited mouth opening"
            }
        },
        "Specialist Examination": "Suspected neonatal tetanus based on symptoms and hypertonicity.",
        "Auxiliary Examination": "CBC normal, CRP slightly elevated. Blood cultures pending. CSF examination pending.",
        "Preliminary Diagnosis": "Neonatal Tetanus",
        "Diagnostic Basis": "Based on history of perinatal period, physical exam showing hypertonicity, difficulty feeding, limited mouth opening, and crying.",
        "Differential Diagnosis": "Purulent meningitis (ruled out by current lack of fever or neck stiffness), neonatal convulsions (no seizure activity observed), tetany (less likely due to normal calcium levels).",
        "Admission Records": {
            "Physician's Signature": "Dr. John Smith"
        },
        "Post-Admission Course Records": {
            "First Course Record": "8 hours old male with symptoms of crying, limited mouth opening, and difficulty sucking. Suspected neonatal tetanus. Blood work initiated, monitoring for signs of progression. Started on empirical antibiotic therapy pending confirmation of diagnosis.",
            "Daily Course Records": "Day 1: Continues to show hypertonicity and difficulty feeding. Remains stable, no seizure activity, continued monitoring and supportive care.",
            "Senior Physician Rounds Records": "Reviewed by senior pediatrician: Agreed with suspected diagnosis of neonatal tetanus, continued empirical antibiotics and supportive measures. Advised close monitoring.",
            "Difficult Case Discussion Records": "Not applicable.",
            "Handover Records": "Shift handover: Monitored patient stability, emphasis on respiratory status and feeding difficulties.",
            "Transfer Records": "Not applicable.",
            "Stage Summary": "8-hour old male presenting with symptoms consistent with neonatal tetanus, stable after initial management, supportive and empirical antibiotic therapy ongoing.",
            "Emergency Records": "None",
            "Invasive Procedure Records": "None",
            "Consultation Records": "Infectious disease consultation: Pending.",
            "Discharge Records": "Not applicable.",
            "Critically Ill Patient Care Records": "None"
        },
        "Medical Orders": {
            "Long-term Orders": "Monitor vital signs every 2 hours. Continue empirical antibiotic therapy. Provide IV fluids and nutrition support.",
            "Temporary Orders": "Draw blood cultures and CBC. Prepare for lumbar puncture if signs of meningeal involvement appear. Administer tetanus immunoglobulin if necessary."
        },
        "Auxiliary Examination Reports": "Pending CSF results and blood culture.",
        "Temperature Chart": "Temp: 36.8°C, Pulse: 140 bpm, Resp: 45 breaths/min, BP: Not measured.",
        "Blood Transfusion Consent": "Not applicable.",
        "Special Examination Consent": "Consent obtained for all required investigations.",
        "Critical Condition Notice": "Parents informed about the critical nature of the condition and the need for close monitoring."
    },
    "DiseaseType": {
        "Conditions Originating in the Perinatal Period": {
            "Name": "Neonatal Tetanus",
            "Symptoms": "Crying, limited mouth opening, difficulty sucking",
            "Differential Diagnosis": "Purulent meningitis, neonatal convulsions, tetany."
        }
    },
    "Generated Article": "Hospitalization Record:\n\nBasic Information:\nName: Y. Mendoza\nGender: male\nAge: 8 hours after birth\nEthnicity: \nMarital Status: \nOccupation: \nAddress: 32, Riverside street, Victoria\nAdmission Time: 10th, March\nRecord Time: 10th, March\nHistorian: Mother\nHospital Name: Victoria General Hospital\n\nChief Complaint:\nCrying, limited mouth opening, difficulty sucking for 8 hours.\n\nPresent Illness:\nOnset: Symptoms noted immediately after birth in the delivery room.\nMain Symptoms: Crying, limited mouth opening, difficulty sucking which have been persistent since onset.\nAccompanying Symptoms: No other noticeable symptoms.\nDiagnosis and Treatment History: No treatment before admission.\nGeneral Condition Changes: Appears irritable, difficulties with feeding, reduced sleep, normal urination and defecation, no weight change evident yet.\n\nPast History:\nGeneral Health Condition: Newborn\nDisease History: None\nInfectious Disease History: None\nImmunization History: None\nSurgery and Trauma History: None\nBlood Transfusion History: None\nAllergy History: None\n\nPersonal History:\nBirthplace: Victoria\nResidence: Victoria\nLiving Habits: Newborn\nOccupation and Working Conditions: Newborn\nExposure History: None\nTravel History: None\n\nMarital and Family History:\nMarital History:\nMarital Status: N/A\nMarriage Age: N/A\nSpouse's Health Condition: N/A\nChildren's Condition: N/A\nFamily History: Parents healthy, no similar diseases reported in family history.\n\nPhysical Examination:\nGeneral Condition:\nTemperature: 36.8°C\nPulse: 140 bpm\nRespiration: 45 breaths/min\nBlood Pressure: Not measured\nSystematic Examination:\nSkin: Normal, no rashes or lesions\nMucous Membranes: Pale\nLymph Nodes: Not enlarged\nHead and Organs: Head normal, no sign of trauma, fontanelles soft and flat\nNeck: Supple, no masses or abnormalities\nChest: Clear lungs bilaterally, no wheezes or crackles, heart sounds regular, no murmurs\nAbdomen: Soft, non-tender, no organomegaly\nRectum and Anus: Normal\nExternal Genitalia: Normal male genitalia\nSpine: No deformities noted\nLimbs: Normal movement, no contractures\nNervous System: Hypertonicity noted, limited mouth opening\n\nSpecialist Examination:\nSuspected neonatal tetanus based on symptoms and hypertonicity.\n\nAuxiliary Examination:\nCBC normal, CRP slightly elevated. Blood cultures pending. CSF examination pending.\n\nPreliminary Diagnosis:\nNeonatal Tetanus\n\nDiagnostic Basis:\nBased on history of perinatal period, physical exam showing hypertonicity, difficulty feeding, limited mouth opening, and crying.\n\nDifferential Diagnosis:\nPurulent meningitis (ruled out by current lack of fever or neck stiffness), neonatal convulsions (no seizure activity observed), tetany (less likely due to normal calcium levels).\n\nAdmission Records:\nPhysician's Signature: Dr. John Smith\n\nPost-Admission Course Records:\nFirst Course Record: 8 hours old male with symptoms of crying, limited mouth opening, and difficulty sucking. Suspected neonatal tetanus. Blood work initiated, monitoring for signs of progression. Started on empirical antibiotic therapy pending confirmation of diagnosis.\nDaily Course Records: Day 1: Continues to show hypertonicity and difficulty feeding. Remains stable, no seizure activity, continued monitoring and supportive care.\nSenior Physician Rounds Records: Reviewed by senior pediatrician: Agreed with suspected diagnosis of neonatal tetanus, continued empirical antibiotics and supportive measures. Advised close monitoring.\nDifficult Case Discussion Records: Not applicable.\nHandover Records: Shift handover: Monitored patient stability, emphasis on respiratory status and feeding difficulties.\nTransfer Records: Not applicable.\nStage Summary: 8-hour old male presenting with symptoms consistent with neonatal tetanus, stable after initial management, supportive and empirical antibiotic therapy ongoing.\nEmergency Records: None\nInvasive Procedure Records: None\nConsultation Records: Infectious disease consultation: Pending.\nDischarge Records: Not applicable.\nCritically Ill Patient Care Records: None\n\nMedical Orders:\nLong-term Orders: Monitor vital signs every 2 hours. Continue empirical antibiotic therapy. Provide IV fluids and nutrition support.\nTemporary Orders: Draw blood cultures and CBC. Prepare for lumbar puncture if signs of meningeal involvement appear. Administer tetanus immunoglobulin if necessary.\n\nAuxiliary Examination Reports:\nPending CSF results and blood culture.\n\nTemperature Chart:\nTemp: 36.8°C, Pulse: 140 bpm, Resp: 45 breaths/min, BP: Not measured.\n\nBlood Transfusion Consent:\nNot applicable.\n\nSpecial Examination Consent:\nConsent obtained for all required investigations.\n\nCritical Condition Notice:\nParents informed about the critical nature of the condition and the need for close monitoring.",
    "qa_fact_based": [
        {
            "question type": "Factual Question",
            "question": "According to the hospitalization records of Victoria General Hospital, what is Y. Mendoza's chief complaint?",
            "answer": "Crying, limited mouth opening, difficulty sucking for 8 hours.",
            "ref": [
                "Chief Complaint:",
                "Crying, limited mouth opening, difficulty sucking for 8 hours."
            ]
        },
        {
            "question type": "Factual Question",
            "question": "According to the hospitalization records of Victoria General Hospital, what is Y. Mendoza's preliminary diagnosis?",
            "answer": "Neonatal Tetanus.",
            "ref": [
                "Preliminary Diagnosis:",
                "Neonatal Tetanus"
            ]
        },
        {
            "question type": "Factual Question",
            "question": "According to the hospitalization records of Victoria General Hospital, what is the temperature of Y. Mendoza?",
            "answer": "36.8°C.",
            "ref": [
                "Temperature: 36.8°C",
                "Temp: 36.8°C, Pulse: 140 bpm, Resp: 45 breaths/min, BP: Not measured."
            ]
        },
        {
            "question type": "Factual Question",
            "question": "According to the hospitalization records of Victoria General Hospital, what is the pulse rate of Y. Mendoza?",
            "answer": "140 bpm.",
            "ref": [
                "Pulse: 140 bpm",
                "Temp: 36.8°C, Pulse: 140 bpm, Resp: 45 breaths/min, BP: Not measured."
            ]
        }
    ],
    "qa_multi_hop": [],
    "qa_summary": [
        {
            "question type": "Summarization Question",
            "question": "According to the hospitalization records of Victoria General Hospital, summarize the basic information of Y. Mendoza.",
            "answer": "Y. Mendoza is a male newborn, 8 hours after birth, residing at 32, Riverside street, Victoria. He was admitted on 10th March, and the record was made on the same day. The historian is his mother.",
            "ref": [
                "Name: Y. Mendoza",
                "Gender: male",
                "Age: 8 hours after birth",
                "Address: 32, Riverside street, Victoria",
                "Admission Time: 10th, March",
                "Record Time: 10th, March",
                "Historian: Mother"
            ]
        },
        {
            "question type": "Summarization Question",
            "question": "According to the hospitalization records of Victoria General Hospital, summarize the present illness of Y. Mendoza.",
            "answer": "Y. Mendoza's symptoms started immediately after birth in the delivery room. He has been crying, has limited mouth opening, and difficulty sucking since onset. There are no other noticeable symptoms. He has not received any treatment before admission. He appears irritable, has difficulties with feeding, reduced sleep, normal urination and defecation, and no evident weight change.",
            "ref": [
                "Present Illness:",
                "Onset: Symptoms noted immediately after birth in the delivery room.",
                "Main Symptoms: Crying, limited mouth opening, difficulty sucking which have been persistent since onset.",
                "Accompanying Symptoms: No other noticeable symptoms.",
                "Diagnosis and Treatment History: No treatment before admission.",
                "General Condition Changes: Appears irritable, difficulties with feeding, reduced sleep, normal urination and defecation, no weight change evident yet."
            ]
        }
    ]
}