{
    "Report Type": "Corporate Governance Report",
    "Report Time": "2018",
    "Company Information": {
        "Name": "CleanCo Housekeeping Services",
        "Establishment Date": "April 1, 2013",
        "Main Business": "Providing professional housekeeping and cleaning services to residential and commercial clients",
        "Registration Location": "New York, United States",
        "Listing Status": "Not listed on any stock exchange",
        "Industry": "Housekeeping"
    },
    "Report Content": [
        {
            "Type": "Governance Structure",
            "Significant Events": [
                {
                    "Event": "Corporate Governance Policy Revision",
                    "Time": "January, 2018",
                    "Description": "Revision of the corporate governance framework to enhance transparency, accountability, and stakeholder engagement. The policies now include regular board evaluations, strengthened codes of ethics, and increased shareholder communication programs.",
                    "Impact": "Enhances corporate governance transparency and accountability, boosting stakeholder confidence.",
                    "Sub Events": [
                        {
                            "Event": "Appointment of independent board members",
                            "Time": "March, 2018",
                            "Description": "CleanCo Housekeeping Services appoints three independent board members with diverse backgrounds and expertise to strengthen the board's independence and enhance transparency in decision-making processes.",
                            "Impact": "Increases board's diversity and expertise, improving governance and decision-making."
                        },
                        {
                            "Event": "Implementation of whistle-blower program",
                            "Time": "June, 2018",
                            "Description": "CleanCo Housekeeping Services establishes a whistle-blower program to allow employees, clients, and other stakeholders to report any unethical behavior, fraud, or violations of corporate governance policies anonymously and with protection from retaliation.",
                            "Impact": "Creates a mechanism to detect and address unethical behavior, strengthening corporate governance practices."
                        },
                        {
                            "Event": "Introduction of board evaluation process",
                            "Time": "September, 2018",
                            "Description": "CleanCo Housekeeping Services implements a comprehensive board evaluation process to assess the effectiveness of the board, its committees, and individual directors. The evaluation includes self-assessment and external evaluation to identify areas for improvement in corporate governance practices.",
                            "Impact": "Identifies weaknesses and areas for improvement in corporate governance, facilitating better decision-making and accountability."
                        }
                    ]
                },
                {
                    "Event": "Sustainability and Social Responsibility Initiatives",
                    "Time": "February, 2018",
                    "Description": "CleanCo Housekeeping Services achieved significant progress in its sustainability and social responsibility efforts. The company implemented eco-friendly cleaning practices, reduced water and energy consumption, and actively participated in community outreach programs.",
                    "Impact": "Enhances the company’s public image and market competitiveness, promoting long-term sustainable development."
                },
                {
                    "Event": "Risk Management Measures",
                    "Time": "May, 2018",
                    "Description": "CleanCo Housekeeping Services updated its risk management framework to identify new risks and implemented enhanced mitigation strategies. This includes conducting regular risk assessments, strengthening internal controls, and providing risk awareness training to employees.",
                    "Impact": "Improves the company’s ability to respond to internal and external risks, ensuring continuous operation and stable development."
                },
                {
                    "Event": "Ethics and Integrity Incidents",
                    "Time": "June, 2018",
                    "Description": "In response to a reported conflict of interest involving a senior executive, CleanCo Housekeeping Services conducted a thorough internal investigation. Appropriate disciplinary actions were taken, including termination, to maintain the company's integrity and reputation.",
                    "Impact": "May damage the company's reputation and brand value, affecting relationships with investors, customers, and partners."
                },
                {
                    "Event": "Shareholders' Meeting Resolution",
                    "Time": "August, 2018",
                    "Description": "During the annual shareholders' meeting, the resolution to update the company's charter was approved unanimously. The revised charter empowers the board to make certain strategic decisions without requiring shareholder approval, enabling swift actions and streamlining decision-making processes.",
                    "Impact": "Directly affects the company's governance structure, future operational strategies, and shareholder rights."
                },
                {
                    "Event": "Senior Management Changes",
                    "Time": "October, 2018",
                    "Description": "Mr. David Anderson, the CEO of CleanCo Housekeeping Services, completed his tenure in October 2018. The position has been succeeded by Ms. Amanda Wilson, an experienced industry professional with a proven track record of leading and expanding housekeeping companies. This transition in leadership will drive operational focus and priorities towards innovative service offerings and customer satisfaction.",
                    "Impact": "May lead to adjustments in operational focus and strategic priorities, affecting short-term performance and long-term development."
                },
                {
                    "Event": "Board of Directors Change",
                    "Time": "November, 2018",
                    "Description": "Resignation of Ms. Emily Carter as a board member due to personal reasons. Appointment of Mr. Michael Evans as the new board member with extensive experience in the housekeeping industry. The change in the board's composition will provide fresh insights and positively impact the company's strategic direction.",
                    "Impact": "May lead to strategic adjustments, affecting the company’s long-term development direction and shareholder interests."
                },
                {
                    "Event": "Compliance and Regulatory Updates",
                    "Time": "December, 2018",
                    "Description": "The company has proactively adapted to changes in compliance and regulatory requirements. Notably, CleanCo Housekeeping Services has trained its staff on new OSHA regulations to ensure full compliance with health and safety standards in the housekeeping industry.",
                    "Impact": "Ensures compliance with the latest laws and regulations, reducing legal risk, protecting the company and shareholder interests."
                }
            ],
            "Involved Indicators": [
                {
                    "Indicator": "Information Disclosure",
                    "Description": "CleanCo Housekeeping Services follows a stringent policy for information disclosure. All financial reports and key corporate information are timely and accurately disclosed on the company website, as well as through regulatory filings and social media platforms.",
                    "Value": "CleanCo Housekeeping Services believes in ensuring transparency and easy access to information for all stakeholders."
                },
                {
                    "Indicator": "Related Transactions",
                    "Description": "CleanCo Housekeeping Services has established comprehensive policies, procedures, and measures to ensure fairness and compliance in related transactions. The company maintains a dedicated internal audit team that monitors and reviews all related transactions to prevent any conflicts of interest.",
                    "Value": "CleanCo Housekeeping Services strictly adheres to ethical business practices in all related transactions."
                },
                {
                    "Indicator": "Internal Control",
                    "Description": "CleanCo Housekeeping Services has a robust internal control system in place to safeguard assets, ensure financial accuracy, and maintain compliance. The company regularly evaluates and tests the effectiveness of its internal controls to identify areas for improvement and prevent any fraudulent activities.",
                    "Value": "CleanCo Housekeeping Services places great emphasis on maintaining strong internal controls for reliable financial reporting and risk management."
                }
            ]
        }
    ],
    "Additional Information": [
        {
            "Name": "Governance Improvement Plans",
            "Content": [
                {
                    "Name": "Strengthening the Function of the Board of Directors and Supervisory Board",
                    "Description": "CleanCo Housekeeping Services aims to enhance the efficiency and effectiveness of the board of directors and the supervisory board in corporate governance. The company plans to provide regular training and development opportunities to board members, increase the proportion of independent directors, and optimize decision-making processes through technological advancements.",
                    "Status": "In progress"
                },
                {
                    "Name": "Enhancing Transparency and Quality of Information Disclosure",
                    "Description": "CleanCo Housekeeping Services is committed to improving the information disclosure process and standards. The company will implement advanced information management systems to ensure timely, accurate, and comprehensive reporting to all stakeholders. Additionally, it will engage in regular feedback sessions with stakeholders to understand their information needs and preferences.",
                    "Status": "Upcoming"
                }
            ]
        },
        {
            "Name": "Risk Management Strategy",
            "Content": [
                {
                    "Name": "Strengthening the Internal Control System",
                    "Description": "CleanCo Housekeeping Services aims to establish and improve its internal control system to identify, assess, monitor, and report financial and operational risks more effectively. The company plans to implement board-level oversight, develop risk mitigation strategies for identified risks, and enhance reporting mechanisms for early risk detection.",
                    "Status": "In progress"
                },
                {
                    "Name": "Integrating Sustainable Development and Social Responsibility",
                    "Description": "CleanCo Housekeeping Services seeks to further integrate sustainable development and social responsibility into its corporate strategy. The company will conduct regular assessments to identify related risks and opportunities, develop action plans to mitigate environmental impacts, and engage with stakeholders to promote collective responsibility.",
                    "Status": "Upcoming"
                }
            ]
        }
    ],
    "Generated Outline": "I. Introduction\n- Report Type: Corporate Governance Report\n- Report Time: 2018\n- Company Information:\n    - Name: CleanCo Housekeeping Services\n    - Establishment Date: April 1, 2013\n    - Main Business: Providing professional housekeeping and cleaning services to residential and commercial clients\n    - Registration Location: New York, United States\n    - Listing Status: Not listed on any stock exchange\n    - Industry: Housekeeping\n \nII. Governance Structure\n- Significant Events:\n    1. [Corporate Governance Policy Revision](January, 2018)\n        - Description: Revision of the corporate governance framework to enhance transparency, accountability, and stakeholder engagement. The policies now include regular board evaluations, strengthened codes of ethics, and increased shareholder communication programs.\n        - Impact: Enhances corporate governance transparency and accountability, boosting stakeholder confidence.\n        - Sub Events:\n            - [Appointment of independent board members](March, 2018)\n                - Description: CleanCo Housekeeping Services appoints three independent board members with diverse backgrounds and expertise to strengthen the board's independence and enhance transparency in decision-making processes.\n                - Impact: Increases board's diversity and expertise, improving governance and decision-making.\n            - [Implementation of whistle-blower program](June, 2018)\n                - Description: CleanCo Housekeeping Services establishes a whistle-blower program to allow employees, clients, and other stakeholders to report any unethical behavior, fraud, or violations of corporate governance policies anonymously and with protection from retaliation.\n                - Impact: Creates a mechanism to detect and address unethical behavior, strengthening corporate governance practices.\n            - [Introduction of board evaluation process](September, 2018)\n                - Description: CleanCo Housekeeping Services implements a comprehensive board evaluation process to assess the effectiveness of the board, its committees, and individual directors. The evaluation includes self-assessment and external evaluation to identify areas for improvement in corporate governance practices.\n                - Impact: Identifies weaknesses and areas for improvement in corporate governance, facilitating better decision-making and accountability.\n\n    2. [Sustainability and Social Responsibility Initiatives](February, 2018)\n        - Description: CleanCo Housekeeping Services achieved significant progress in its sustainability and social responsibility efforts. The company implemented eco-friendly cleaning practices, reduced water and energy consumption, and actively participated in community outreach programs.\n        - Impact: Enhances the company’s public image and market competitiveness, promoting long-term sustainable development.\n\n    3. [Risk Management Measures](May, 2018)\n        - Description: CleanCo Housekeeping Services updated its risk management framework to identify new risks and implemented enhanced mitigation strategies. This includes conducting regular risk assessments, strengthening internal controls, and providing risk awareness training to employees.\n        - Impact: Improves the company’s ability to respond to internal and external risks, ensuring continuous operation and stable development.\n\n    4. [Ethics and Integrity Incidents](June, 2018)\n        - Description: In response to a reported conflict of interest involving a senior executive, CleanCo Housekeeping Services conducted a thorough internal investigation. Appropriate disciplinary actions were taken, including termination, to maintain the company's integrity and reputation.\n        - Impact: May damage the company's reputation and brand value, affecting relationships with investors, customers, and partners.\n\n    5. [Shareholders' Meeting Resolution](August, 2018)\n        - Description: During the annual shareholders' meeting, the resolution to update the company's charter was approved unanimously. The revised charter empowers the board to make certain strategic decisions without requiring shareholder approval, enabling swift actions and streamlining decision-making processes.\n        - Impact: Directly affects the company's governance structure, future operational strategies, and shareholder rights.\n\n    6. [Senior Management Changes](October, 2018)\n        - Description: Mr. David Anderson, the CEO of CleanCo Housekeeping Services, completed his tenure in October 2018. The position has been succeeded by Ms. Amanda Wilson, an experienced industry professional with a proven track record of leading and expanding housekeeping companies. This transition in leadership will drive operational focus and priorities towards innovative service offerings and customer satisfaction.\n        - Impact: May lead to adjustments in operational focus and strategic priorities, affecting short-term performance and long-term development.\n\n    7. [Board of Directors Change](November, 2018)\n        - Description: Resignation of Ms. Emily Carter as a board member due to personal reasons. Appointment of Mr. Michael Evans as the new board member with extensive experience in the housekeeping industry. The change in the board's composition will provide fresh insights and positively impact the company's strategic direction.\n        - Impact: May lead to strategic adjustments, affecting the company’s long-term development direction and shareholder interests.\n\n    8. [Compliance and Regulatory Updates](December, 2018)\n        - Description: The company has proactively adapted to changes in compliance and regulatory requirements. Notably, CleanCo Housekeeping Services has trained its staff on new OSHA regulations to ensure full compliance with health and safety standards in the housekeeping industry.\n        - Impact: Ensures compliance with the latest laws and regulations, reducing legal risk, protecting the company and shareholder interests.\n\n- Involved Indicators:\n    1. [Information Disclosure](value)\n        - Description: CleanCo Housekeeping Services follows a stringent policy for information disclosure. All financial reports and key corporate information are timely and accurately disclosed on the company website, as well as through regulatory filings and social media platforms.\n        - Value: CleanCo Housekeeping Services believes in ensuring transparency and easy access to information for all stakeholders.\n\n    2. [Related Transactions](value)\n        - Description: CleanCo Housekeeping Services has established comprehensive policies, procedures, and measures to ensure fairness and compliance in related transactions. The company maintains a dedicated internal audit team that monitors and reviews all related transactions to prevent any conflicts of interest.\n        - Value: CleanCo Housekeeping Services strictly adheres to ethical business practices in all related transactions.\n\n    3. [Internal Control](value)\n        - Description: CleanCo Housekeeping Services has a robust internal control system in place to safeguard assets, ensure financial accuracy, and maintain compliance. The company regularly evaluates and tests the effectiveness of its internal controls to identify areas for improvement and prevent any fraudulent activities.\n        - Value: CleanCo Housekeeping Services places great emphasis on maintaining strong internal controls for reliable financial reporting and risk management.\n\nIII. Additional Information\n- Governance Improvement Plans:\n    - [Strengthening the Function of the Board of Directors and Supervisory Board](In progress)\n        - Description: CleanCo Housekeeping Services aims to enhance the efficiency and effectiveness of the board of directors and the supervisory board in corporate governance. The company plans to provide regular training and development opportunities to board members, increase the proportion of independent directors, and optimize decision-making processes through technological advancements.\n    - [Enhancing Transparency and Quality of Information Disclosure](Upcoming)\n        - Description: CleanCo Housekeeping Services is committed to improving the information disclosure process and standards. The company will implement advanced information management systems to ensure timely, accurate, and comprehensive reporting to all stakeholders. Additionally, it will engage in regular feedback sessions with stakeholders to understand their information needs and preferences.\n\n- Risk Management Strategy:\n    - [Strengthening the Internal Control System](In progress)\n        - Description: CleanCo Housekeeping Services aims to establish and improve its internal control system to identify, assess, monitor, and report financial and operational risks more effectively. The company plans to implement board-level oversight, develop risk mitigation strategies for identified risks, and enhance reporting mechanisms for early risk detection.\n    - [Integrating Sustainable Development and Social Responsibility](Upcoming)\n        - Description: CleanCo Housekeeping Services seeks to further integrate sustainable development and social responsibility into its corporate strategy. The company will conduct regular assessments to identify related risks and opportunities, develop action plans to mitigate environmental impacts, and engage with stakeholders to promote collective responsibility.",
    "Generated Summary": "CleanCo Housekeeping Services is a New York-based company established on April 1, 2013, specializing in providing professional housekeeping and cleaning services to residential and commercial clients.",
    "Generated Article": "In 2018, CleanCo Housekeeping Services underwent several significant events that had a profound impact on its corporate governance structure and practices. Firstly, in January 2018, the company revised its corporate governance policies to enhance transparency, accountability, and stakeholder engagement. This revision included the implementation of regular board evaluations, strengthened codes of ethics, and increased shareholder communication programs. These changes aimed to improve corporate governance transparency and accountability, ultimately boosting stakeholder confidence.\n\nAs part of the policy revision, CleanCo Housekeeping Services appointed three independent board members in March 2018. These board members brought diverse backgrounds and expertise to the company, strengthening the board's independence and enhancing transparency in decision-making processes. The appointment of independent board members increased the board's diversity and expertise, leading to improved governance and decision-making.\n\nIn June 2018, CleanCo Housekeeping Services introduced a whistle-blower program to allow employees, clients, and other stakeholders to report any unethical behavior, fraud, or violations of corporate governance policies anonymously and with protection from retaliation. This program created a mechanism to detect and address unethical behavior, further strengthening the company's corporate governance practices.\n\nAnother important event in September 2018 was the implementation of a comprehensive board evaluation process. This process aimed to assess the effectiveness of the board, its committees, and individual directors. The evaluation included self-assessment and external evaluation to identify areas for improvement in corporate governance practices. This initiative played a crucial role in identifying weaknesses and areas for improvement, facilitating better decision-making and accountability within the company.\n\nIn February 2018, CleanCo Housekeeping Services achieved significant progress in its sustainability and social responsibility efforts. The company implemented eco-friendly cleaning practices, reduced water and energy consumption, and actively participated in community outreach programs. These initiatives not only enhanced the company's public image but also improved its market competitiveness, promoting long-term sustainable development.\n\nTo address potential risks, CleanCo Housekeeping Services updated its risk management framework in May 2018. This update involved conducting regular risk assessments, strengthening internal controls, and providing risk awareness training to employees. These measures improved the company's ability to respond to internal and external risks, ensuring continuous operation and stable development.\n\nHowever, in June 2018, CleanCo Housekeeping Services faced an ethics and integrity incident involving a senior executive. The company conducted a thorough internal investigation and took appropriate disciplinary actions, including termination, to maintain its integrity and reputation. While this incident may have temporarily damaged the company's reputation and brand value, it demonstrated the company's commitment to upholding ethical standards.\n\nDuring the annual shareholders' meeting in August 2018, a resolution to update the company's charter was approved unanimously. The revised charter empowered the board to make certain strategic decisions without requiring shareholder approval, enabling swift actions and streamlining decision-making processes. This resolution directly affected the company's governance structure, future operational strategies, and shareholder rights.\n\nIn October 2018, CleanCo Housekeeping Services experienced a change in senior management as Mr. David Anderson, the CEO, completed his tenure. He was succeeded by Ms. Amanda Wilson, an experienced industry professional with a proven track record of leading and expanding housekeeping companies. This transition in leadership aimed to drive operational focus and priorities towards innovative service offerings and customer satisfaction.\n\nIn November 2018, there was also a change in the board of directors with the resignation of Ms. Emily Carter and the appointment of Mr. Michael Evans. Mr. Evans brought extensive experience in the housekeeping industry, providing fresh insights and positively impacting the company's strategic direction.\n\nLastly, in December 2018, CleanCo Housekeeping Services proactively adapted to changes in compliance and regulatory requirements. The company trained its staff on new OSHA regulations to ensure full compliance with health and safety standards in the housekeeping industry. This commitment to compliance and regulatory updates reduced legal risk, protecting the company and shareholder interests.\n\nOverall, CleanCo Housekeeping Services demonstrated a strong commitment to corporate governance, sustainability, and risk management in 2018. Through policy revisions, the appointment of independent board members, the implementation of a whistle-blower program, and the introduction of a board evaluation process, the company enhanced transparency, accountability, and stakeholder engagement. Additionally, the company's sustainability initiatives, risk management measures, and compliance efforts further solidified its commitment to responsible business practices. These events and initiatives have positioned CleanCo Housekeeping Services as a reputable and trustworthy player in the housekeeping industry."
}