{
    "报告类型": "公司财务报告",
    "报告时间": "2017年度",
    "公司信息": {
        "名称": "媒体之星有限公司",
        "成立日期": "2005年3月",
        "主营业务": "媒体传媒服务",
        "注册地": "上海市",
        "上市情况": "在纽约证券交易所挂牌上市",
        "行业": "媒体"
    },
    "报告内容": [
        {
            "类型": "财务信息",
            "重要事件": [
                {
                    "事件": "资产重组",
                    "时间": "2017年1月",
                    "描述": "公司进行了一次资产重组，优化了公司的业务结构。具体而言，公司对子公司XYZ传媒进行了合并，整合了相关业务资源，实现了成本的优化与协同效应的提升。",
                    "影响": "提高了公司的运营效率，增加了公司的价值。"
                },
                {
                    "事件": "大规模融资",
                    "时间": "2017年2月",
                    "描述": "公司进行了一次大规模的融资活动，募集了10亿元资金。这笔资金将用于新媒体平台的研发和市场推广，以进一步增强公司的竞争力。",
                    "影响": "加强了公司的资金实力，支持了公司的扩张和发展。"
                },
                {
                    "事件": "重大资产收购",
                    "时间": "2017年5月",
                    "描述": "公司完成了对致力于在线视频直播的ABC网络公司的资产收购，总价值15亿元。这一举措不仅在业务上拓宽了公司的发展领域，同时也在市场上提升了公司的品牌影响力。",
                    "影响": "扩大公司业务范围，增强市场竞争力。"
                },
                {
                    "事件": "债务重组",
                    "时间": "2017年8月",
                    "描述": "为优化资本结构，公司进行了债务重组，减少了5亿元负债。通过协商债权人和发行新的债券，公司成功实现了债务负担的减轻。",
                    "影响": "改善了公司的财务状况，降低了财务成本。"
                },
                {
                    "事件": "分发股利",
                    "时间": "2017年9月",
                    "描述": "公司决定向股东分发1亿元股利，回报给股东们的投资，提升了股东的收益。",
                    "影响": "回报给股东们的投资，提升了股东的收益。"
                },
                {
                    "事件": "重大股权收购",
                    "时间": "2017年10月",
                    "描述": "公司完成了对电视节目制作公司XYZ传媒有限公司的股权收购，获得了80%的股权。这一收购将进一步提高公司在电视节目制作领域的产能和市场份额。",
                    "影响": "进一步扩大了公司的市场份额，提升了公司的控制力。"
                },
                {
                    "事件": "重大投资",
                    "时间": "2017年11月",
                    "描述": "公司投资了D项目，投资金额为2亿元。该项目是一次重要的战略性投资，将进一步拓宽公司的业务领域，提升公司的盈利能力。",
                    "影响": "进一步拓宽了公司的业务领域，提升了公司的盈利能力。"
                }
            ],
            "涉及的指标": [
                {
                    "指标": "营业收入",
                    "描述": "公司在一定会计期间内的主营业务收入和其他业务收入总额。",
                    "影响因素": [
                        "市场需求上升",
                        "公司推出的新产品成功上市"
                    ],
                    "值": "12亿元"
                },
                {
                    "指标": "净利润",
                    "描述": "公司在一定会计期间的净收入，即总收入减去总成本和所得税费用后的金额。",
                    "影响因素": [
                        "营业收入的增长",
                        "公司有效控制成本",
                        "并购收益的贡献"
                    ],
                    "值": "3亿元"
                },
                {
                    "指标": "总资产",
                    "描述": "会计期末，公司所拥有的资产总额。",
                    "影响因素": [
                        "资产收购",
                        "资产处置",
                        "资产重估"
                    ],
                    "值": "50亿元"
                },
                {
                    "指标": "总负债",
                    "描述": "会计期末，公司所承担并需要偿还的债务总额。",
                    "影响因素": [
                        "新债发行",
                        "债务偿还",
                        "债务重组"
                    ],
                    "值": "30亿元"
                },
                {
                    "指标": "股东权益",
                    "描述": "会计期末，归属于股东的权益总额。",
                    "影响因素": [
                        "净利润",
                        "股利发放",
                        "资本公积"
                    ],
                    "值": "20亿元"
                },
                {
                    "指标": "现金流量",
                    "描述": "公司在一定会计期间内的现金流入和流出总和。",
                    "影响因素": [
                        "经营活动",
                        "投资活动",
                        "筹资活动"
                    ],
                    "值": "5亿元"
                },
                {
                    "指标": "负债比率",
                    "描述": "公司总负债与总资产的比率，反映公司的债务水平。",
                    "影响因素": [
                        "总负债的增减变化",
                        "总资产的变化"
                    ],
                    "值": "60%"
                },
                {
                    "指标": "资产负债率",
                    "描述": "公司总负债占总资产的百分比，衡量公司财务杠杆的一个指标。",
                    "影响因素": [
                        "资产和负债的增减变化"
                    ],
                    "值": "60%"
                },
                {
                    "指标": "净资产收益率",
                    "描述": "反映公司股东权益的经营效益，即净利润与平均股东权益的比率。",
                    "影响因素": [
                        "净利润的变化",
                        "股东权益的变化"
                    ],
                    "值": "15%"
                }
            ]
        }
    ],
    "额外信息": [
        {
            "名称": "未来展望",
            "内容": [
                {
                    "名称": "财务策略",
                    "描述": "公司未来计划实施的财务策略，包括成本控制、资本运营等。公司将进一步加强对成本的控制和运营成效的提升，通过提高管理效率、降低运营成本来优化公司的财务结构。"
                },
                {
                    "名称": "投资计划",
                    "描述": "公司面向未来的投资计划，如新项目投资、研发投入等。公司计划在下一年度投资5亿元用于新媒体平台的研发、市场推广和技术创新，以提升公司创新能力和市场竞争力。"
                },
                {
                    "名称": "风险管理",
                    "描述": "公司识别的主要财务风险以及应对这些风险的策略。公司将建立完善的风险管理体系，加强风险监测和预警，制定相应的应对策略，以降低业务风险对公司财务状况的影响。"
                }
            ]
        }
    ],
    "生成大纲": "公司财务报告大纲\n\n报告时间: 2017年度\n\n报告内容: \n\n财务信息:\n\n1. 资产重组(2017年1月)：公司进行了一次资产重组，优化了公司的业务结构。具体而言，公司对子公司XYZ传媒进行了合并，整合了相关业务资源，实现了成本的优化与协同效应的提升。这一事件提高了公司的运营效率，增加了公司的价值。\n\n2. 大规模融资(2017年2月)：公司进行了一次大规模的融资活动，募集了10亿元资金。这笔资金将用于新媒体平台的研发和市场推广，以进一步增强公司的竞争力。此次融资活动加强了公司的资金实力，支持了公司的扩张和发展。\n\n3. 重大资产收购(2017年5月)：公司完成了对致力于在线视频直播的ABC网络公司的资产收购，总价值15亿元。这一举措不仅在业务上拓宽了公司的发展领域，同时也在市场上提升了公司的品牌影响力。这一事件扩大了公司业务范围，增强了市场竞争力。\n\n4. 债务重组(2017年8月)：为优化资本结构，公司进行了债务重组，减少了5亿元负债。通过协商债权人和发行新的债券，公司成功实现了债务负担的减轻。这一事件改善了公司的财务状况，降低了财务成本。\n\n5. 分发股利(2017年9月)：公司决定向股东分发1亿元股利，回报给股东们的投资，提升了股东的收益。这一事件回报给股东们的投资，提升了股东的收益。\n\n6. 重大股权收购(2017年10月)：公司完成了对电视节目制作公司XYZ传媒有限公司的股权收购，获得了80%的股权。这一收购将进一步提高公司在电视节目制作领域的产能和市场份额。此事件进一步扩大了公司的市场份额，提升了公司的控制力。\n\n7. 重大投资(2017年11月)：公司投资了D项目，投资金额为2亿元。该项目是一次重要的战略性投资，将进一步拓宽公司的业务领域，提升公司的盈利能力。此事件进一步拓宽了公司的业务领域，提升了公司的盈利能力。\n\n涉及的指标：\n\n1. 营业收入: 12亿元\n   - 市场需求上升\n   - 公司推出的新产品成功上市\n\n2. 净利润: 3亿元\n   - 营业收入的增长\n   - 公司有效控制成本\n   - 并购收益的贡献\n\n3. 总资产: 50亿元\n   - 资产收购\n   - 资产处置\n   - 资产重估\n\n4. 总负债: 30亿元\n   - 新债发行\n   - 债务偿还\n   - 债务重组\n\n5. 股东权益: 20亿元\n   - 净利润\n   - 股利发放\n   - 资本公积\n\n6. 现金流量: 5亿元\n   - 经营活动\n   - 投资活动\n   - 筹资活动\n\n7. 负债比率: 60%\n   - 总负债的增减变化\n   - 总资产的变化\n\n8. 资产负债率: 60%\n   - 资产和负债的增减变化\n\n9. 净资产收益率: 15%\n   - 净利润的变化\n   - 股东权益的变化\n\n额外信息:\n\n未来展望:\n1. 财务策略: 公司将进一步加强对成本的控制和运营成效的提升，通过提高管理效率、降低运营成本来优化公司的财务结构。\n\n2. 投资计划: 公司计划在下一年度投资5亿元用于新媒体平台的研发、市场推广和技术创新，以提升公司创新能力和市场竞争力。\n\n3. 风险管理: 公司将建立完善的风险管理体系，加强风险监测和预警，制定相应的应对策略，以降低业务风险对公司财务状况的影响。",
    "生成总结": "媒体之星有限公司是一家成立于2005年3月，总部位于上海市的媒体传媒服务公司，目前在纽约证券交易所挂牌上市，主要经营媒体业务。",
    "生成文章": "在2017年度，媒体之星有限公司经历了一系列重要的财务事件，这些事件对公司的财务状况和业务发展产生了深远的影响。\n\n首先，在2017年1月，公司进行了一次资产重组，将子公司XYZ传媒进行了合并。这一举措优化了公司的业务结构，整合了相关业务资源，实现了成本的优化与协同效应的提升。资产重组提高了公司的运营效率，增加了公司的价值。\n\n其次，在2017年2月，公司进行了一次大规模的融资活动，募集了10亿元资金。这笔资金将用于新媒体平台的研发和市场推广，以进一步增强公司的竞争力。大规模融资活动加强了公司的资金实力，支持了公司的扩张和发展。\n\n接着，在2017年5月，公司完成了对致力于在线视频直播的ABC网络公司的资产收购，总价值15亿元。这一举措不仅在业务上拓宽了公司的发展领域，同时也在市场上提升了公司的品牌影响力。资产收购扩大了公司业务范围，增强了市场竞争力。\n\n在2017年8月，为优化资本结构，公司进行了债务重组，减少了5亿元负债。通过协商债权人和发行新的债券，公司成功实现了债务负担的减轻。债务重组改善了公司的财务状况，降低了财务成本。\n\n在2017年9月，公司决定向股东分发1亿元股利，回报给股东们的投资，提升了股东的收益。\n\n在2017年10月，公司完成了对电视节目制作公司XYZ传媒有限公司的股权收购，获得了80%的股权。这一收购将进一步提高公司在电视节目制作领域的产能和市场份额。此事件进一步扩大了公司的市场份额，提升了公司的控制力。\n\n在2017年11月，公司投资了D项目，投资金额为2亿元。该项目是一次重要的战略性投资，将进一步拓宽公司的业务领域，提升公司的盈利能力。此事件进一步拓宽了公司的业务领域，提升了公司的盈利能力。\n\n这些重要事件对公司的财务指标产生了显著影响。首先，公司的营业收入达到了12亿元，这主要归因于市场需求的上升和公司推出的新产品成功上市。其次，公司的净利润达到了3亿元，这是由于营业收入的增长、公司有效控制成本以及并购收益的贡献。此外，公司的总资产达到了50亿元，这是由于资产收购、资产处置和资产重估的影响。然而，公司的总负债也相应增加到了30亿元，这主要是由于新债发行和债务偿还。股东权益达到了20亿元，这是由于净利润、股利发放和资本公积的影响。公司的现金流量达到了5亿元，这是由于经营活动、投资活动和筹资活动的影响。负债比率为60%，资产负债率为60%，净资产收益率为15%。\n\n展望未来，媒体之星有限公司将进一步加强对成本的控制和运营成效的提升，通过提高管理效率、降低运营成本来优化公司的财务结构。公司计划在下一年度投资5亿元用于新媒体平台的研发、市场推广和技术创新，以提升公司创新能力和市场竞争力。此外，公司将建立完善的风险管理体系，加强风险监测和预警，制定相应的应对策略，以降低业务风险对公司财务状况的影响。\n\n综上所述，媒体之星有限公司在2017年度经历了一系列重要的财务事件，这些事件对公司的财务状况和业务发展产生了积极的影响。公司将继续努力优化财务结构，加强创新能力和市场竞争力，以实现可持续发展。"
}