{
    "courtAndProcuratorate": {
        "court": "Brighton, Sterling, Court",
        "procuratorate": "Brighton, Sterling, Procuratorate"
    },
    "chiefJudge": "I. Ward",
    "judge": "M. Adams",
    "clerk": "Y. Scott",
    "defendant": {
        "name": "N. Adams",
        "gender": "male",
        "birthdate": "16th, November, 1964",
        "residence": "10, Huntington Street, Sterling",
        "ethnicity": "Caucasian",
        "occupation": "Accountant at Sterling Public Works Department"
    },
    "defenseLawyer": {
        "name": "N. Kelly",
        "lawFirm": "Sterling Legal Associates"
    },
    "caseProcess": [
        {
            "event": "Case Filing and Investigation",
            "date": "10th, January, 2023",
            "description": "The Brighton, Sterling Procuratorate received a report regarding suspicious financial activities within the Sterling Public Works Department. An official investigation was initiated."
        },
        {
            "event": "Detention Measures Taken",
            "date": "15th, February, 2023",
            "description": "Initial evidence was collected and reviewed. The procuratorate decided to detain Mr. Adams to prevent any tampering with records."
        },
        {
            "event": "Criminal Detention",
            "date": "20th, February, 2023",
            "description": "Mr. Adams was placed under formal criminal detention following confirmation of substantial evidence against him."
        },
        {
            "event": "Arrest",
            "date": "25th, February, 2023",
            "description": "An arrest order was issued and Mr. Adams was officially arrested under the charge of embezzlement."
        }
    ],
    "criminalFacts": [
        {
            "crimeName": "Crime of Embezzlement",
            "details": [
                {
                    "timePeriod": "March 2022 - December 2022",
                    "behavior": "Mr. Adams used his position as an accountant to transfer public funds into a private account opened under a false name.",
                    "evidence": "Bank statements showing multiple transfers from the Sterling Public Works Department's account to a private account; audit records indicating discrepancies between reported and actual fund disbursals."
                },
                {
                    "timePeriod": "April 2022",
                    "behavior": "Solicited fictitious invoices from non-existent suppliers to channel funds for personal use.",
                    "evidence": "Copies of fraudulent invoices obtained from Mr. Adams' office; testimonial evidence from colleagues who noted irregular supplier activity."
                },
                {
                    "timePeriod": "July 2022",
                    "behavior": "Embezzled a lump sum of $30,000 from the disaster relief budget to fund a private real estate purchase.",
                    "evidence": "Transaction record showing the transfer from the disaster relief budget; title deed of the property purchased under Mr. Adams' name."
                },
                {
                    "timePeriod": "November 2022",
                    "behavior": "Transferred $15,000 from an emergency rescue fund to settle personal credit card debts.",
                    "evidence": "Credit card statements matching the exact amount transferred; internal transfer authorization signed by Mr. Adams."
                }
            ]
        }
    ],
    "legalProcedure": {
        "judgmentDate": "3rd, March, 2023",
        "judgmentResult": [
            {
                "crimeName": "Crime of Embezzlement",
                "sentence": "12 years of fixed-term imprisonment and a fine of $100,000",
                "sentencingConsiderations": "The offender embezzled a large amount of public funds, explicitly from disaster relief and emergency rescue budgets, constituting severe circumstances under Article 384 of the Penal Code. No probation is applicable due to the gravity of the offense."
            }
        ]
    },
    "Generated Article": "### Brighton, Sterling Court \n\n#### Criminal Judgment\n\n**Court and Prosecutor Information:**\n\n**Court:** Brighton, Sterling Court\\\n**Prosecutorate:** Brighton, Sterling Procuratorate\\\n**Chief Judge:** I. Ward\\\n**Judge:** M. Adams\\\n**Clerk:** Y. Scott\n\n**Defendant and Defense Lawyer Information:**\n\n**Defendant:**\n- **Name:** N. Adams\n- **Gender:** Male\n- **Birthdate:** 16th November 1964\n- **Residence:** 10 Huntington Street, Sterling\n- **Ethnicity:** Caucasian\n- **Occupation:** Accountant at Sterling Public Works Department\n\n**Defense Lawyer:**\n- **Name:** N. Kelly\n- **Law Firm:** Sterling Legal Associates\n\n## Case Procedures\n\n**Case Filing and Investigation (10th January 2023):**\\\nThe Brighton, Sterling Procuratorate received a report from an anonymous whistleblower regarding suspicious financial activities within the Sterling Public Works Department. The initial report suggested irregularities in the department's financial transactions, particularly concerning funds meant for public projects and emergency relief efforts. The Procuratorate then initiated an official investigation to delve into these allegations.\n\n**Detention Measures Taken (15th February 2023):**\\\nAfter conducting a preliminary review and collecting initial evidence, the procuratorate discerned substantial discrepancies in the financial records managed by Mr. N. Adams. To forestall any potential tampering with financial records and to secure further evidence, it was deemed necessary to detain Mr. Adams. This step was also taken to prevent possible flight risks or collusion with potential accomplices.\n\n**Criminal Detention (20th February 2023):**\\\nFollowing the detention measures, Mr. Adams was officially placed under formal criminal detention. The action followed the confirmation of substantial evidence pointing towards embezzlement activities. The evidentiary materials obtained included bank statements, internal audit records, and various incriminating documents recovered from Mr. Adams's office.\n\n**Arrest (25th February 2023):**\\\nAfter thorough scrutiny of the accumulated evidence, an arrest order was issued against Mr. Adams. He was formally arrested and charged with the crime of embezzlement under the pertinent legal provisions. He was informed of the charges and his rights as an accused individual. His arrest was executed without any resistance, and he was subsequently held for trial.\n\n## Case Statement\n\nThe Brighton, Sterling Procuratorate charged Mr. N. Adams with the crime of embezzlement under Article 384 of the Penal Code. Mr. Adams, in his capacity as an accountant at the Sterling Public Works Department, misused his official position to illicitly divert public funds for personal gain. The specific allegations and evidence presented against him are elaborated as follows:\n\nThe court finds that between March 2022 and December 2022, Mr. Adams systematically engaged in activities that constituted gross misuse and misappropriation of public funds entrusted to his department. Mr. Adams's position within the department endowed him with access to significant financial resources, which he manipulatwavively used to siphon funds into private accounts.\n\n**March 2022 - December 2022:**\\\nThroughout this period, Mr. Adams methodically transferred funds allocated for public works into a private bank account. This account was opened under a false name to obfuscate any direct association with himself. Detailed bank statements presented to the court clearly demonstrate multiple unauthorized transfers. Public accounts showed discrepancies between the reported disbursals and the actual funds remaining, corroborated by thorough internal and external audit records.\n\n**April 2022:**\\\nIn April 2022, Mr. Adams further complicated his embezzlement scheme by soliciting fictitious invoices from non-existent suppliers. These invoices were used to justify the channelling of substantially large sums of money for supposed projects and services that never materialized. Copies of these fraudulent invoices, retrieved from Mr. Adamsâ€™s office, alongside testimonial evidence from colleagues who noted the irregular activity, fortified the accusations against him.\n\n**July 2022:**\\\nIn an act of blatant embezzlement, Mr. Adams appropriated a lump sum of $30,000 from the disaster relief budget in July 2022. This sum was used to fund a private real estate purchase, under Mr. Adams's name. Transaction records detailing the transfer indicate a clear diversion of funds intended for disaster relief. Furthermore, the title deed of the purchased property was found in Mr. Adams's name, establishing a direct link to the misappropriated funds.\n\n**November 2022:**\\\nIn November 2022, a further incident occurred where Mr. Adams embezzled $15,000 from the emergency rescue fund. These funds were transferred to settle his personal credit card debts. The consistency of the amounts transferred with Mr. Adams's personal credit card statements establishes compelling evidence of personal gain derived from public resources. Internal transfer authorization signed by Mr. Adams himself further corroborates this offense.\n\nThroughout the trial, Mr. Adams displayed a variety of demeanors. Initially, he cooperated fully with the investigation, perhaps in the hope that his cooperative attitude might favorably influence his sentencing. However, once the weight of the evidence became undeniable, his cooperation waned, and he adopted a defensive stance, often citing external pressures and questioning his sole accountability. Despite his subsequent reluctant confession, this court considered all relevant factors, including the severe betrayal of public trust and the substantial financial detriment to the community. \n\n## Charge\n\nThe charge brought against Mr. N. Adams is recognized as the Crime of Embezzlement under Article 384 of the Penal Code. The gravity of the offense stems from not just the act of embezzlement but the specific targeting of funds meant for disaster relief and emergency rescue, reflecting a heightened degree of moral and legal culpability.\n\n## Evidence Description\n\nThe court heard testimonies from multiple witnesses, including colleagues, financial auditors, and forensic accountants, whose accounts were integral to piecing together the full extent of Mr. Adams's embezzlement activities. These testimonies provided insights into the department's internal control mechanisms, or lack thereof, and painted a clear picture of Mr. Adams's modus operandi.\n\n- **Bank Statements:**\\\nThe bank statements were among the primary pieces of evidence. These documents displayed a series of unauthorized transfers from the Sterling Public Works Departmentâ€™s account to several accounts under false names. Transaction logs and timestamps provided a comprehensive trail of Mr. Adams's fraudulent activities.\n\n- **Audit Records:**\\\nInternal and external audit reports revealed significant discrepancies between the reported expenditures and the actual disbursements. These audits uncovered a pattern of overstatement in project budgets and discrepancies in fund utilization.\n\n- **Fraudulent Invoices:**\\\nThe court meticulously examined the fraudulent invoices found in Mr. Adams's office. Verification attempts showed that the suppliers listed on these invoices did not exist, and the supposed services rendered were never performed. This evidence dispelled any notion of legitimate contractor engagements.\n\n- **Testimonies from Colleagues:**\\\nColleagues testified noticing unusual activities concerning supplier interactions and financial adjustments made by Mr. Adams. Their observations provided a contextual backdrop to the documentary evidence, highlighting the deviations from normative procurement and accounting procedures.\n\n- **Transaction Records:**\\\nThe transaction record showing the $30,000 transfer from the disaster relief budget elucidated the appropriation of these funds that ultimately financed Mr. Adams's private real estate purchase. \n\n- **Title Deed:**\\\nThe title deed registered in Mr. Adams's name unequivocally tied the embezzled funds to his benefit. This property transaction undermined any arguments suggesting alternative explanations for the missing funds.\n\n- **Credit Card Statements:**\\\nMr. Adams's credit card statements matched precisely the amounts transferred from the emergency rescue fund, negating his claims of personal financing from lawful sources. These records critically illustrated his misuse of funds intended for urgent, life-saving activities.\n\n## Sentencing Considerations\n\nIn deliberating the sentence, this court considered several key factors:\n\n- The considerable amount of funds embezzled by Mr. Adams, particularly funds designated for disaster relief and emergency rescue, aggravates the seriousness of the offense. These funds were allocated for critical public services, emphasizing the gravity of their misappropriation.\n\n- Mr. Adams's breach of trust placed in him by his official position as an accountant mandated a severe stance. His actions not only resulted in financial losses but also eroded public confidence in the financial integrity of public institutions.\n\n- The court took into account Mr. Adamsâ€™s initial cooperation during the investigation but also weighed his subsequent reluctance and attempts to mitigate accountability, which indicated a partial acknowledgment of wrongdoing.\n\n- Mr. Adams's professional background and knowledge of accounting regulations heighten his criminal liabilities. He executed these fraudulent schemes with a level of sophistication that underscored his intentionality and cognizance of the illegality of his actions.\n\n- The societal impact of the crime, encompassing both the immediate fiscal harm and the long-term erosion of trust in public services and governance, demands a proportionate judicial response.\n\nTherefore, the severity of Mr. Adams's crimes, combined with the need for deterrence and upholding public trust, necessitated a stringent sentence.\n\n## Judgment Result\n\nThis court pronounces the following judgment:\n\nGiven the severity of the crime, Mr. N. Adams is found guilty of the Crime of Embezzlement under Article 384 of the Penal Code. Accordingly, he is sentenced to:\n\n- **12 years of fixed-term imprisonment.**\\\nThe nature and extent of his embezzlement activities warrant this term to reflect the gravity of the offense and serve as a deterrent to similar acts by others entrusted with public funds.\n\n- **A fine of $100,000.**\\\nThe imposed fine is commensurate with the appropriated amounts and serves as partial restitution for the financial damage incurred by the community.\n\nProbation is deemed inapplicable due to the aggravated circumstances surrounding Mr. Adams's actions. His misuse of disaster relief and emergency funds signifies a particularly heinous breach of fiduciary duties, precluding leniency considerations.\n\n## Appeal Rights Explanation\n\nMr. N. Adams is advised that he retains the right to appeal this judgment. Should he choose to exercise this right, he must file a formal notice of appeal within ten days of the verdict being handed down. The notice of appeal must be submitted to this court, clearly stating the grounds on which the appeal is being made.\n\nMr. Adams is entitled to representation during the appeal process and can seek the counsel of his defense lawyer, N. Kelly, or opt for alternative legal representation if so desired. The appeal process will reassess the facts of the case, the adjudicated legal principles, and the proportionality of the sentence.\n\nThis document hereby concludes the judicial proceedings concerning this case in the Brighton, Sterling Court. Let it be recorded and enforced as mandated by the laws governing such matters.\n\n**Issued by:** Brighton, Sterling Court\\\n**Date:** 3rd March 2023\\\n**Signature:** [Court Seal and Signatures of Judging Officials]\n\nReference Article is belowï¼š\nArticle 384\nState personnel who take advantage of their position to embezzle public funds for personal use, engage in illegal activities, or embezzle public funds in large amounts for profit-making activities, or embezzle large amounts of public funds for more than three months without returning them, commit the crime of embezzlement, and shall be sentenced to fixed-term imprisonment of not more than five years or criminal detention; if the circumstances are serious, they shall be sentenced to fixed-term imprisonment of more than five years. If the embezzled amount is huge and not returned, they shall be sentenced to fixed-term imprisonment of more than ten years or life imprisonment.\nEmbezzlement of funds for disaster relief, emergency rescue, flood control, preferential treatment, poverty alleviation, immigration, or relief for personal use shall be punished more severely.",
    "qa_fact_based": [
        {
            "question type": "Factual Question",
            "question": "According to the court judgment of Brighton, Sterling, Court, who was the chief judge?",
            "answer": "I. Ward.",
            "ref": [
                "**Chief Judge:** I. Ward\\"
            ]
        },
        {
            "question type": "Factual Question",
            "question": "According to the court judgment of Brighton, Sterling, Court, what was the occupation of N. Adams?",
            "answer": "Accountant at Sterling Public Works Department.",
            "ref": [
                "- **Occupation:** Accountant at Sterling Public Works Department"
            ]
        },
        {
            "question type": "Factual Question",
            "question": "According to the court judgment of Brighton, Sterling, Court, what was the amount embezzled by N. Adams in July 2022?",
            "answer": "$30,000.",
            "ref": [
                "In an act of blatant embezzlement, Mr. Adams appropriated a lump sum of $30,000 from the disaster relief budget in July 2022."
            ]
        },
        {
            "question type": "Factual Question",
            "question": "According to the court judgment of Brighton, Sterling, Court, what was the fine imposed on N. Adams?",
            "answer": "$100,000.",
            "ref": [
                "- **A fine of $100,000.**\\"
            ]
        }
    ],
    "qa_multi_hop": [
        {
            "question type": "Multi-hop Reasoning Question",
            "question": "According to the judgment of Brighton, Sterling, Court, how many distinct embezzlement activities did N. Adams commit?",
            "answer": "According to the judgment of Brighton, Sterling, Court, N. Adams committed four distinct embezzlement activities: transferring public funds into a private account, soliciting fictitious invoices, embezzling from the disaster relief budget, and transferring funds from the emergency rescue fund to settle personal debts.",
            "ref": [
                "Throughout this period, Mr. Adams methodically transferred funds allocated for public works into a private bank account.",
                "In April 2022, Mr. Adams further complicated his embezzlement scheme by soliciting fictitious invoices from non-existent suppliers.",
                "In an act of blatant embezzlement, Mr. Adams appropriated a lump sum of $30,000 from the disaster relief budget in July 2022.",
                "In November 2022, a further incident occurred where Mr. Adams embezzled $15,000 from the emergency rescue fund."
            ]
        },
        {
            "question type": "Multi-hop Reasoning Question",
            "question": "According to the judgment of Brighton, Sterling, Court, how many pieces of evidence were presented against N. Adams?",
            "answer": "According to the judgment of Brighton, Sterling, Court, seven pieces of evidence were presented against N. Adams: bank statements, internal and external audit reports, fraudulent invoices, testimonies from colleagues, a transaction record, a title deed, and credit card statements.",
            "ref": [
                "- **Bank Statements:**\\",
                "The bank statements were among the primary pieces of evidence.",
                "- **Audit Records:**\\",
                "Internal and external audit reports revealed significant discrepancies between the reported expenditures and the actual disbursements.",
                "The court meticulously examined the fraudulent invoices found in Mr. Adams's office.",
                "Verification attempts showed that the suppliers listed on these invoices did not exist, and the supposed services rendered were never performed.",
                "- **Testimonies from Colleagues:**\\",
                "Colleagues testified noticing unusual activities concerning supplier interactions and financial adjustments made by Mr. Adams.",
                "- **Transaction Records:**\\",
                "The transaction record showing the $30,000 transfer from the disaster relief budget elucidated the appropriation of these funds that ultimately financed Mr. Adams's private real estate purchase.",
                "The title deed registered in Mr. Adams's name unequivocally tied the embezzled funds to his benefit.",
                "- **Credit Card Statements:**\\",
                "Mr. Adams's credit card statements matched precisely the amounts transferred from the emergency rescue fund, negating his claims of personal financing from lawful sources."
            ]
        }
    ],
    "qa_summary": [
        {
            "question type": "Summarization Question",
            "question": "According to the judgment of Brighton, Sterling Court, summarize the facts of N. Adams' crimes.",
            "answer": "N. Adams committed the crime of embezzlement by using his position as an accountant at the Sterling Public Works Department to transfer public funds into a private account. Specific incidents include transferring funds between March 2022 and December 2022 to a private account, soliciting fictitious invoices in April 2022, embezzling $30,000 from the disaster relief budget in July 2022, and transferring $15,000 from an emergency rescue fund in November 2022 to settle personal credit card debts.",
            "ref": [
                "Mr. Adams, in his capacity as an accountant at the Sterling Public Works Department, misused his official position to illicitly divert public funds for personal gain.",
                "The court finds that between March 2022 and December 2022, Mr. Adams systematically engaged in activities that constituted gross misuse and misappropriation of public funds entrusted to his department.",
                "Mr. Adams's position within the department endowed him with access to significant financial resources, which he manipulatwavively used to siphon funds into private accounts.",
                "Throughout this period, Mr. Adams methodically transferred funds allocated for public works into a private bank account.",
                "This account was opened under a false name to obfuscate any direct association with himself.",
                "Detailed bank statements presented to the court clearly demonstrate multiple unauthorized transfers.",
                "Public accounts showed discrepancies between the reported disbursals and the actual funds remaining, corroborated by thorough internal and external audit records.",
                "In April 2022, Mr. Adams further complicated his embezzlement scheme by soliciting fictitious invoices from non-existent suppliers.",
                "These invoices were used to justify the channelling of substantially large sums of money for supposed projects and services that never materialized.",
                "Copies of these fraudulent invoices, retrieved from Mr. Adamsâ€™s office, alongside testimonial evidence from colleagues who noted the irregular activity, fortified the accusations against him.",
                "In an act of blatant embezzlement, Mr. Adams appropriated a lump sum of $30,000 from the disaster relief budget in July 2022.",
                "This sum was used to fund a private real estate purchase, under Mr. Adams's name.",
                "Transaction records detailing the transfer indicate a clear diversion of funds intended for disaster relief.",
                "Furthermore, the title deed of the purchased property was found in Mr. Adams's name, establishing a direct link to the misappropriated funds.",
                "In November 2022, a further incident occurred where Mr. Adams embezzled $15,000 from the emergency rescue fund.",
                "These funds were transferred to settle his personal credit card debts.",
                "The consistency of the amounts transferred with Mr. Adams's personal credit card statements establishes compelling evidence of personal gain derived from public resources.",
                "Internal transfer authorization signed by Mr. Adams himself further corroborates this offense."
            ]
        },
        {
            "question type": "Summarization Question",
            "question": "According to the judgment of Brighton, Sterling Court, summarize the evidence of N. Adams' crimes.",
            "answer": "Evidence includes bank statements showing transfers from the Sterling Public Works Department's account to a private account, audit records indicating discrepancies, copies of fraudulent invoices, testimonial evidence from colleagues, transaction records for the purchase of property, a title deed under N. Adams' name, credit card statements matching embezzled amounts, and internal transfer authorization signed by N. Adams.",
            "ref": [
                "The evidentiary materials obtained included bank statements, internal audit records, and various incriminating documents recovered from Mr. Adams's office.",
                "Detailed bank statements presented to the court clearly demonstrate multiple unauthorized transfers.",
                "Public accounts showed discrepancies between the reported disbursals and the actual funds remaining, corroborated by thorough internal and external audit records.",
                "Copies of these fraudulent invoices, retrieved from Mr. Adamsâ€™s office, alongside testimonial evidence from colleagues who noted the irregular activity, fortified the accusations against him.",
                "- **Bank Statements:**\\",
                "The bank statements were among the primary pieces of evidence.",
                "These documents displayed a series of unauthorized transfers from the Sterling Public Works Departmentâ€™s account to several accounts under false names.",
                "Transaction logs and timestamps provided a comprehensive trail of Mr. Adams's fraudulent activities.",
                "- **Audit Records:**\\",
                "Internal and external audit reports revealed significant discrepancies between the reported expenditures and the actual disbursements.",
                "These audits uncovered a pattern of overstatement in project budgets and discrepancies in fund utilization.",
                "- **Fraudulent Invoices:**\\",
                "The court meticulously examined the fraudulent invoices found in Mr. Adams's office.",
                "Verification attempts showed that the suppliers listed on these invoices did not exist, and the supposed services rendered were never performed.",
                "This evidence dispelled any notion of legitimate contractor engagements.",
                "- **Testimonies from Colleagues:**\\",
                "Colleagues testified noticing unusual activities concerning supplier interactions and financial adjustments made by Mr. Adams.",
                "- **Transaction Records:**\\",
                "The transaction record showing the $30,000 transfer from the disaster relief budget elucidated the appropriation of these funds that ultimately financed Mr. Adams's private real estate purchase.",
                "- **Title Deed:**\\",
                "The title deed registered in Mr. Adams's name unequivocally tied the embezzled funds to his benefit.",
                "This property transaction undermined any arguments suggesting alternative explanations for the missing funds.",
                "- **Credit Card Statements:**\\",
                "Mr. Adams's credit card statements matched precisely the amounts transferred from the emergency rescue fund, negating his claims of personal financing from lawful sources.",
                "These records critically illustrated his misuse of funds intended for urgent, life-saving activities."
            ]
        },
        {
            "question type": "Summarization Question",
            "question": "According to the judgment of Brighton, Sterling Court, outline the major events in the case process against N. Adams.",
            "answer": "The case process included several key events: the Brighton, Sterling Procuratorate received a report on January 10, 2023, initiating an investigation; initial evidence led to N. Adams' detention on February 15, 2023; formal criminal detention was enacted on February 20, 2023; and finally, an official arrest was made on February 25, 2023 based on substantial evidence.",
            "ref": [
                "**Case Filing and Investigation (10th January 2023):**\\",
                "The Brighton, Sterling Procuratorate received a report from an anonymous whistleblower regarding suspicious financial activities within the Sterling Public Works Department.",
                "The initial report suggested irregularities in the department's financial transactions, particularly concerning funds meant for public projects and emergency relief efforts.",
                "The Procuratorate then initiated an official investigation to delve into these allegations.",
                "**Detention Measures Taken (15th February 2023):**\\",
                "After conducting a preliminary review and collecting initial evidence, the procuratorate discerned substantial discrepancies in the financial records managed by Mr. N. Adams.",
                "To forestall any potential tampering with financial records and to secure further evidence, it was deemed necessary to detain Mr. Adams.",
                "This step was also taken to prevent possible flight risks or collusion with potential accomplices.",
                "**Criminal Detention (20th February 2023):**\\",
                "Following the detention measures, Mr. Adams was officially placed under formal criminal detention.",
                "The action followed the confirmation of substantial evidence pointing towards embezzlement activities.",
                "**Arrest (25th February 2023):**\\",
                "After thorough scrutiny of the accumulated evidence, an arrest order was issued against Mr. Adams.",
                "He was formally arrested and charged with the crime of embezzlement under the pertinent legal provisions.",
                "He was informed of the charges and his rights as an accused individual.",
                "His arrest was executed without any resistance, and he was subsequently held for trial."
            ]
        },
        {
            "question type": "Summarization Question",
            "question": "According to the judgment of Brighton, Sterling Court, describe the legal procedure and the result of the judgment for N. Adams.",
            "answer": "The judgment was rendered on March 3, 2023. N. Adams was convicted of the crime of embezzlement and sentenced to 12 years of fixed-term imprisonment and fined $100,000. The sentencing was based on the large amount of public funds embezzled, particularly from disaster relief and emergency rescue budgets, constituting severe circumstances under Article 384 of the Penal Code. Due to the gravity of the offense, no probation was granted.",
            "ref": [
                "## Judgment Result",
                "This court pronounces the following judgment:",
                "Given the severity of the crime, Mr. N. Adams is found guilty of the Crime of Embezzlement under Article 384 of the Penal Code.",
                "Accordingly, he is sentenced to:",
                "- **12 years of fixed-term imprisonment.",
                "**\\",
                "The nature and extent of his embezzlement activities warrant this term to reflect the gravity of the offense and serve as a deterrent to similar acts by others entrusted with public funds.",
                "- **A fine of $100,000.**\\",
                "The imposed fine is commensurate with the appropriated amounts and serves as partial restitution for the financial damage incurred by the community.",
                "Probation is deemed inapplicable due to the aggravated circumstances surrounding Mr. Adams's actions.",
                "His misuse of disaster relief and emergency funds signifies a particularly heinous breach of fiduciary duties, precluding leniency considerations."
            ]
        }
    ]
}