{
    "Report Type": "Corporate Governance Report",
    "Report Time": "2017",
    "Company Information": {
        "Name": "Stellar Entertainment Holdings Ltd.",
        "Establishment Date": "April 1, 2005",
        "Main Business": "Stellar Entertainment Holdings Ltd. is a diversified entertainment company engaged in the production, distribution, and licensing of films, television shows, and digital content. The company also operates theme parks and manages live entertainment events.",
        "Registration Location": "Los Angeles, California, United States",
        "Listing Status": "Publicly Listed",
        "Industry": "Entertainment"
    },
    "Report Content": [
        {
            "Type": "Governance Structure",
            "Significant Events": [
                {
                    "Event": "Sustainability and Social Responsibility Initiatives",
                    "Time": "January, 2017",
                    "Description": "Significant progress in sustainability, environmental protection, social responsibility, and corporate citizenship.",
                    "Impact": "Enhances the company’s public image and market competitiveness, promoting long-term sustainable development.",
                    "Sub Events": [
                        {
                            "Event": "Expansion of Theme Park Operations",
                            "Time": "June, 2017",
                            "Description": "Stellar Entertainment Holdings Ltd. announces plans to expand its theme park operations by opening a new park in a popular tourist destination. The company has secured suitable land for the park and is in the process of obtaining necessary permits and licenses.",
                            "Impact": "Increases the company's revenue streams and diversifies its entertainment offerings, providing a competitive advantage in the industry."
                        },
                        {
                            "Event": "Strategic Partnership with Digital Streaming Platform",
                            "Time": "August, 2017",
                            "Description": "Stellar Entertainment Holdings Ltd. enters into a strategic partnership with a leading digital streaming platform. The partnership aims to leverage the company's extensive content library and the platform's wide user base to enhance digital distribution and monetization of its films and television shows. Both parties will collaborate on exclusive content production as well.",
                            "Impact": "Expands the company's reach and distribution channels, leading to increased digital revenue and access to a larger audience."
                        },
                        {
                            "Event": "Acquisition of Film Production Studio",
                            "Time": "October, 2017",
                            "Description": "Stellar Entertainment Holdings Ltd. acquires a renowned film production studio known for its award-winning content. The acquisition includes all intellectual properties, ongoing projects, and the studio's talented workforce. The integration process has begun to ensure a smooth transition and maximize synergies.",
                            "Impact": "Enhances the company's content creation capabilities, strengthens its position in the film industry, and enables greater control over the production process."
                        },
                        {
                            "Event": "Release of Blockbuster Film Franchise",
                            "Time": "December, 2017",
                            "Description": "Stellar Entertainment Holdings Ltd. releases the highly anticipated latest installment of its successful blockbuster film franchise. The film surpasses box office expectations, becoming a global sensation and achieving record-breaking revenues within its opening weekend.",
                            "Impact": "Generates substantial box office revenue, positive critical reception, heightened brand visibility, and increased market value for the company."
                        }
                    ]
                },
                {
                    "Event": "Ethics and Integrity Incidents",
                    "Time": "April, 2017",
                    "Description": "Significant ethical or integrity violations, such as fraud, corruption, or conflicts of interest, and the measures taken by the company in response.",
                    "Impact": "May damage the company's reputation and brand value, affecting relationships with investors, customers, and partners."
                },
                {
                    "Event": "Shareholders' Meeting Resolution",
                    "Time": "May, 2017",
                    "Description": "Key decisions made at the annual or extraordinary shareholders’ meeting, including changes to the company’s charter, major corporate actions, and voting results.",
                    "Impact": "Directly affects the company’s governance structure, future operational strategies, and shareholder rights."
                },
                {
                    "Event": "Corporate Governance Policy Revision",
                    "Time": "June, 2017",
                    "Description": "Revision of the corporate governance framework or policies to enhance transparency, accountability, or stakeholder engagement.",
                    "Impact": "Enhances corporate governance transparency and accountability, boosting stakeholder confidence."
                },
                {
                    "Event": "Risk Management Measures",
                    "Time": "August, 2017",
                    "Description": "Updates to the company's risk management framework, including identification of new risks and implementation of mitigation strategies.",
                    "Impact": "Improves the company’s ability to respond to internal and external risks, ensuring continuous operation and stable development."
                },
                {
                    "Event": "Senior Management Changes",
                    "Time": "October, 2017",
                    "Description": "Changes in the company’s senior management, including the CEO or other key positions, and its impact on the company's operational focus and priorities.",
                    "Impact": "May lead to adjustments in operational focus and strategic priorities, affecting short-term performance and long-term development."
                },
                {
                    "Event": "Board of Directors Change",
                    "Time": "November, 2017",
                    "Description": "The appointment or resignation of board members, and its impact on the company's strategic direction.",
                    "Impact": "May lead to strategic adjustments, affecting the company’s long-term development direction and shareholder interests."
                },
                {
                    "Event": "Compliance and Regulatory Updates",
                    "Time": "December, 2017",
                    "Description": "Updates to new regulations or compliance standards affecting corporate governance practices, including changes in securities law, corporate law, or specific industry regulations.",
                    "Impact": "Ensures compliance with the latest laws and regulations, reducing legal risk, protecting the company and shareholder interests."
                }
            ],
            "Involved Indicators": [
                {
                    "Indicator": "Information Disclosure",
                    "Description": "Principles, methods, and implementation status of company information disclosure.",
                    "Value": "The company has a comprehensive information disclosure framework in place. It follows international standards and ensures timely and accurate reporting to shareholders and stakeholders."
                },
                {
                    "Indicator": "Related Transactions",
                    "Description": "Policies, procedures, and measures to ensure fairness and compliance of related transactions.",
                    "Value": "The company has established strict policies and procedures to govern related transactions. These measures ensure fairness, transparency, and compliance in all business activities."
                },
                {
                    "Indicator": "Internal Control",
                    "Description": "Architecture, implementation, and effectiveness assessment of internal controls.",
                    "Value": "The company has a robust internal control system in place to safeguard its assets and mitigate operational risks. Regular assessments ensure the system's effectiveness."
                }
            ]
        }
    ],
    "Additional Information": [
        {
            "Name": "Governance Improvement Plans",
            "Content": [
                {
                    "Name": "Strengthening the Function of the Board of Directors and Supervisory Board",
                    "Description": "The company is committed to enhancing the efficiency and effectiveness of the board of directors and supervisory board in corporate governance. This includes regular training for board members, increasing the proportion of independent directors, and optimizing decision-making processes."
                },
                {
                    "Name": "Enhancing Transparency and Quality of Information Disclosure",
                    "Description": "To ensure stakeholders receive timely, accurate, and comprehensive information, the company aims to improve the information disclosure process and standards. This includes robust reporting mechanisms and adherence to international best practices."
                }
            ]
        },
        {
            "Name": "Risk Management Strategy",
            "Content": [
                {
                    "Name": "Strengthening the Internal Control System",
                    "Description": "The company is focused on establishing and improving its internal control system. This system enables the identification, assessment, monitoring, and reporting of financial and operational risks, enhancing the company's ability to withstand risks."
                },
                {
                    "Name": "Integrating Sustainable Development and Social Responsibility",
                    "Description": "Recognizing the importance of sustainable development and social responsibility, the company has integrated these aspects into its strategy. It identifies related risks and opportunities, aiming to promote long-term value creation."
                }
            ]
        }
    ],
    "Generated Outline": "I. Introduction\n   A. Company Information\n      1. Name: Stellar Entertainment Holdings Ltd.\n      2. Establishment Date: April 1, 2005\n      3. Main Business: Diversified entertainment company engaged in the production, distribution, and licensing of films, television shows, and digital content. Also operates theme parks and manages live entertainment events.\n      4. Registration Location: Los Angeles, California, United States\n      5. Listing Status: Publicly Listed\n      6. Industry: Entertainment\n  \nII. Governance Structure\n   A. Sustainability and Social Responsibility Initiatives\n      - January, 2017\n      1. Significant progress in sustainability, environmental protection, social responsibility, and corporate citizenship. [Sustainability and Social Responsibility Initiatives](January, 2017)\n      2. Enhanced company's public image and market competitiveness, promoting long-term sustainable development. [Sustainability and Social Responsibility Initiatives](January, 2017)\n      3. Expansion of Theme Park Operations\n         - June, 2017\n         - Stellar Entertainment Holdings Ltd. announced plans to expand theme park operations by opening a new park in a popular tourist destination.\n         - Secured suitable land for the park and in the process of obtaining necessary permits and licenses.\n         - Impact: Increased company's revenue streams and diversified entertainment offerings, providing a competitive advantage in the industry. [Expansion of Theme Park Operations](June, 2017)\n      4. Strategic Partnership with Digital Streaming Platform\n         - August, 2017\n         - Stellar Entertainment Holdings Ltd. entered into a strategic partnership with a leading digital streaming platform.\n         - Aims to leverage extensive content library and platform's wide user base for enhanced digital distribution and monetization of films and television shows.\n         - Collaboration on exclusive content production.\n         - Impact: Expanded company's reach and distribution channels, leading to increased digital revenue and access to a larger audience. [Strategic Partnership with Digital Streaming Platform](August, 2017)\n      5. Acquisition of Film Production Studio\n         - October, 2017\n         - Stellar Entertainment Holdings Ltd. acquired renowned film production studio.\n         - Acquisition includes intellectual properties, ongoing projects, and talented workforce.\n         - Integration process initiated for a smooth transition and to maximize synergies.\n         - Impact: Enhanced company's content creation capabilities, strengthened position in the film industry, and enabled greater control over production process. [Acquisition of Film Production Studio](October, 2017)\n      6. Release of Blockbuster Film Franchise\n         - December, 2017\n         - Stellar Entertainment Holdings Ltd. released highly anticipated latest installment of successful blockbuster film franchise.\n         - Film surpassed box office expectations, becoming a global sensation and achieving record-breaking revenues within opening weekend.\n         - Impact: Generated substantial box office revenue, positive critical reception, heightened brand visibility, and increased market value for the company. [Release of Blockbuster Film Franchise](December, 2017)\n   B. Ethics and Integrity Incidents\n      - April, 2017\n      1. Significant ethical or integrity violations, measures taken by the company in response.\n      2. Impact: May damage company's reputation and brand value, affecting relationships with investors, customers, and partners. [Ethics and Integrity Incidents](April, 2017)\n   C. Shareholders' Meeting Resolution\n      - May, 2017\n      1. Key decisions made at annual or extraordinary shareholders' meeting, including changes to company's charter, major corporate actions, and voting results.\n      2. Impact: Directly affects company's governance structure, future operational strategies, and shareholder rights. [Shareholders' Meeting Resolution](May, 2017)\n   D. Corporate Governance Policy Revision\n      - June, 2017\n      1. Revision of corporate governance framework or policies to enhance transparency, accountability, or stakeholder engagement.\n      2. Impact: Enhances corporate governance transparency and accountability, boosting stakeholder confidence. [Corporate Governance Policy Revision](June, 2017)\n   E. Risk Management Measures\n      - August, 2017\n      1. Updates to company's risk management framework, identification of new risks, and implementation of mitigation strategies.\n      2. Impact: Improves company's ability to respond to internal and external risks, ensuring continuous operation and stable development. [Risk Management Measures](August, 2017)\n   F. Senior Management Changes\n      - October, 2017\n      1. Changes in company's senior management positions, including CEO or other key positions, and their impact on company's operational focus and priorities.\n      2. Impact: May lead to adjustments in operational focus and strategic priorities, affecting short-term performance and long-term development. [Senior Management Changes](October, 2017)\n   G. Board of Directors Change\n      - November, 2017\n      1. Appointment or resignation of board members and their impact on company's strategic direction.\n      2. Impact: May lead to strategic adjustments, affecting company's long-term development direction and shareholder interests. [Board of Directors Change](November, 2017)\n   H. Compliance and Regulatory Updates\n      - December, 2017\n      1. Updates to new regulations or compliance standards affecting corporate governance practices, including changes in securities law, corporate law, or specific industry regulations.\n      2. Impact: Ensures compliance with latest laws and regulations, reducing legal risk and protecting the company and shareholder interests. [Compliance and Regulatory Updates](December, 2017)\n  \nIII. Involved Indicators\n   A. Information Disclosure\n      - The company has a comprehensive information disclosure framework in place.\n      - It follows international standards and ensures timely and accurate reporting to shareholders and stakeholders. [Information Disclosure](value)\n   B. Related Transactions\n      - The company has established strict policies and procedures to govern related transactions.\n      - These measures ensure fairness, transparency, and compliance in all business activities. [Related Transactions](value)\n   C. Internal Control\n      - The company has a robust internal control system in place.\n      - Regular assessments ensure the system's effectiveness in safeguarding assets and mitigating operational risks. [Internal Control](value)\n  \nIV. Additional Information\n   A. Governance Improvement Plans\n      1. Strengthening the Function of the Board of Directors and Supervisory Board\n         - Regular training for board members\n         - Increasing proportion of independent directors\n         - Optimizing decision-making processes\n      2. Enhancing Transparency and Quality of Information Disclosure\n         - Improvement of information disclosure process and standards\n         - Robust reporting mechanisms\n         - Adherence to international best practices\n   B. Risk Management Strategy\n      1. Strengthening the Internal Control System\n         - Establishment and improvement of internal control system\n         - Identification, assessment, monitoring, and reporting of financial and operational risks\n      2. Integrating Sustainable Development and Social Responsibility\n         - Recognition of importance of sustainable development and social responsibility\n         - Identification of related risks and opportunities\n         - Promotion of long-term value creation",
    "Generated Summary": "Stellar Entertainment Holdings Ltd. is a publicly listed entertainment company, established in April 2005 in Los Angeles, California, specializing in the production, distribution, and licensing of films, television shows, and digital content, as well as operating theme parks and managing live entertainment events.",
    "Generated Article": "In January 2017, Stellar Entertainment Holdings Ltd. made significant progress in sustainability, environmental protection, social responsibility, and corporate citizenship. These initiatives not only enhanced the company's public image but also strengthened its market competitiveness, promoting long-term sustainable development. This commitment to sustainability and social responsibility aligns with the company's industry, where environmental and social considerations are increasingly important.\n\nIn June 2017, Stellar Entertainment Holdings Ltd. announced plans to expand its theme park operations by opening a new park in a popular tourist destination. The company secured suitable land for the park and is in the process of obtaining necessary permits and licenses. This strategic move is expected to increase the company's revenue streams and diversify its entertainment offerings, providing a competitive advantage in the industry.\n\nIn August 2017, Stellar Entertainment Holdings Ltd. entered into a strategic partnership with a leading digital streaming platform. This partnership aims to leverage the company's extensive content library and the platform's wide user base for enhanced digital distribution and monetization of films and television shows. Additionally, the collaboration includes exclusive content production. This strategic partnership expands the company's reach and distribution channels, leading to increased digital revenue and access to a larger audience.\n\nIn October 2017, Stellar Entertainment Holdings Ltd. made a significant acquisition by acquiring a renowned film production studio. This acquisition includes intellectual properties, ongoing projects, and a talented workforce. The integration process was initiated to ensure a smooth transition and maximize synergies. This acquisition enhances the company's content creation capabilities, strengthens its position in the film industry, and enables greater control over the production process.\n\nIn December 2017, Stellar Entertainment Holdings Ltd. released the highly anticipated latest installment of a successful blockbuster film franchise. The film surpassed box office expectations, becoming a global sensation and achieving record-breaking revenues within its opening weekend. This release generated substantial box office revenue, positive critical reception, heightened brand visibility, and increased market value for the company.\n\nHowever, in April 2017, Stellar Entertainment Holdings Ltd. faced significant ethical or integrity violations. The company took measures to address these violations, but they may still damage the company's reputation and brand value, affecting relationships with investors, customers, and partners.\n\nIn May 2017, the company made key decisions at its annual shareholders' meeting, including changes to the company's charter, major corporate actions, and voting results. These decisions directly impact the company's governance structure, future operational strategies, and shareholder rights.\n\nIn June 2017, Stellar Entertainment Holdings Ltd. revised its corporate governance policies to enhance transparency, accountability, and stakeholder engagement. This revision enhances corporate governance transparency and accountability, boosting stakeholder confidence.\n\nIn August 2017, the company updated its risk management framework, identified new risks, and implemented mitigation strategies. These measures improve the company's ability to respond to internal and external risks, ensuring continuous operation and stable development.\n\nIn October 2017, there were changes in the company's senior management positions, including the CEO or other key positions. These changes may lead to adjustments in operational focus and strategic priorities, affecting short-term performance and long-term development.\n\nIn November 2017, Stellar Entertainment Holdings Ltd. witnessed a change in its board of directors, including the appointment or resignation of board members. These changes may lead to strategic adjustments, affecting the company's long-term development direction and shareholder interests.\n\nIn December 2017, there were updates to new regulations or compliance standards affecting corporate governance practices. These updates ensure compliance with the latest laws and regulations, reducing legal risk and protecting the company and shareholder interests.\n\nStellar Entertainment Holdings Ltd. has a comprehensive information disclosure framework in place, following international standards and ensuring timely and accurate reporting to shareholders and stakeholders. This commitment to information disclosure enhances transparency and builds trust with investors and other stakeholders.\n\nThe company has also established strict policies and procedures to govern related transactions, ensuring fairness, transparency, and compliance in all business activities. This commitment to related transactions safeguards the company's reputation and protects shareholder interests.\n\nFurthermore, Stellar Entertainment Holdings Ltd. has a robust internal control system in place, regularly assessing its effectiveness in safeguarding assets and mitigating operational risks. This commitment to internal control ensures the company's financial stability and operational efficiency.\n\nLooking ahead, Stellar Entertainment Holdings Ltd. has outlined governance improvement plans. These plans include strengthening the function of the board of directors and supervisory board through regular training, increasing the proportion of independent directors, and optimizing decision-making processes. The company also aims to enhance transparency and the quality of information disclosure by improving the information disclosure process and standards, implementing robust reporting mechanisms, and adhering to international best practices.\n\nIn terms of risk management, Stellar Entertainment Holdings Ltd. plans to strengthen its internal control system by establishing and improving its internal control framework. The company will focus on identifying, assessing, monitoring, and reporting financial and operational risks. Additionally, the company recognizes the importance of sustainable development and social responsibility, and aims to integrate these considerations into its risk management strategy. This includes identifying related risks and opportunities and promoting long-term value creation.\n\nOverall, Stellar Entertainment Holdings Ltd. has made significant strides in its governance structure, sustainability and social responsibility initiatives, and risk management measures. While facing challenges such as ethics and integrity incidents, the company has taken proactive steps to address them and improve its governance policies. With its expansion plans, strategic partnerships, and acquisitions, Stellar Entertainment Holdings Ltd. is well-positioned for continued growth and success in the entertainment industry."
}