{
    "Report Type": "Corporate Financial Report",
    "Report Time": "2017",
    "Company Information": {
        "Name": "Stellar Entertainment Holdings Ltd.",
        "Establishment Date": "April 1, 2005",
        "Main Business": "Stellar Entertainment Holdings Ltd. is a diversified entertainment company engaged in the production, distribution, and licensing of films, television shows, and digital content. The company also operates theme parks and manages live entertainment events.",
        "Registration Location": "Los Angeles, California, United States",
        "Listing Status": "Publicly Listed",
        "Industry": "Entertainment"
    },
    "Report Content": [
        {
            "Type": "Financial Information",
            "Significant Events": [
                {
                    "Event": "Large-scale Financing",
                    "Time": "January, 2017",
                    "Description": "The company conducted a large-scale financing activity, raising $200 million of funds.",
                    "Impact": "Strengthened the company's financial strength, supported expansion and development.",
                    "Sub Events": [
                        {
                            "Event": "Film Production Agreement",
                            "Time": "March 2017",
                            "Description": "Stellar Entertainment Holdings Ltd. signed a film production agreement with a major production studio, securing the rights to produce and distribute a highly anticipated blockbuster film.",
                            "Impact": "Enhanced the company's film production portfolio, increasing potential revenue and market share."
                        },
                        {
                            "Event": "Theme Park Acquisition",
                            "Time": "May 2017",
                            "Description": "Stellar Entertainment Holdings Ltd. acquired a renowned theme park located in a popular tourist destination, expanding its theme park portfolio.",
                            "Impact": "Diversified the company's revenue streams, providing opportunities for increased attendance and visitor spending."
                        },
                        {
                            "Event": "Strategic Partnership Announcement",
                            "Time": "September 2017",
                            "Description": "Stellar Entertainment Holdings Ltd. announced a strategic partnership with a leading technology company to develop innovative digital content and entertainment experiences.",
                            "Impact": "Strengthened the company's position in the digital content market, allowing for the creation of new revenue streams."
                        },
                        {
                            "Event": "International Expansion",
                            "Time": "November 2017",
                            "Description": "Stellar Entertainment Holdings Ltd. opened its first international office in a key global market, facilitating expansion and market penetration efforts.",
                            "Impact": "Increased presence in international markets, allowing for greater distribution and licensing opportunities."
                        }
                    ]
                },
                {
                    "Event": "Significant Equity Acquisition",
                    "Time": "February, 2017",
                    "Description": "The company completed the acquisition of 60% equity of Alpha Productions Inc.",
                    "Impact": "Further expanded the company's market share, enhanced the company's control."
                },
                {
                    "Event": "Dividend Distribution",
                    "Time": "March, 2017",
                    "Description": "The company decided to distribute $50 million of dividends to shareholders.",
                    "Impact": "Returned to the investors, enhanced shareholder returns."
                },
                {
                    "Event": "Debt Restructuring",
                    "Time": "May, 2017",
                    "Description": "To optimize capital structure, the company underwent debt restructuring, reducing liabilities by $100 million.",
                    "Impact": "Improved the company's financial condition, reduced financial costs."
                },
                {
                    "Event": "Major Asset Acquisition",
                    "Time": "June, 2017",
                    "Description": "The company completed the asset acquisition of XYZ Films, with a total value of $150 million.",
                    "Impact": "Expanded the company's business scope, enhanced market competitiveness."
                },
                {
                    "Event": "Major Investment",
                    "Time": "September, 2017",
                    "Description": "The company invested in Project Delta, with an investment amount of $80 million.",
                    "Impact": "Further broadened the company's business areas, enhanced profitability."
                },
                {
                    "Event": "Asset Restructuring",
                    "Time": "October, 2017",
                    "Description": "The company underwent an asset restructuring, optimizing its business structure.",
                    "Impact": "Improved operational efficiency, increased company value."
                }
            ],
            "Involved Indicators": [
                {
                    "Indicator": "Operating Income",
                    "Description": "The total amount of main business income and other business income within a certain accounting period.",
                    "Influencing Factors": [
                        "Market Demand",
                        "Changes in Product Prices"
                    ],
                    "Value": "$500 million"
                },
                {
                    "Indicator": "Net Profit",
                    "Description": "The net income of the company within a certain accounting period, i.e., total income minus total costs and taxes.",
                    "Influencing Factors": [
                        "Operating Income",
                        "Cost Control",
                        "Non-recurring Gains and Losses"
                    ],
                    "Value": "$120 million"
                },
                {
                    "Indicator": "Total Assets",
                    "Description": "The total amount of assets owned by the company at the end of the accounting period.",
                    "Influencing Factors": [
                        "Asset Acquisition",
                        "Asset Disposal",
                        "Asset Revaluation"
                    ],
                    "Value": "$1.2 billion"
                },
                {
                    "Indicator": "Total Liabilities",
                    "Description": "The total amount of debts the company is obligated to repay at the end of the accounting period.",
                    "Influencing Factors": [
                        "New Debt Issuance",
                        "Debt Repayment",
                        "Debt Restructuring"
                    ],
                    "Value": "$600 million"
                },
                {
                    "Indicator": "Shareholder Equity",
                    "Description": "The total amount of equity belonging to shareholders at the end of the accounting period.",
                    "Influencing Factors": [
                        "Net Profit",
                        "Dividend Distribution",
                        "Capital Reserves"
                    ],
                    "Value": "$600 million"
                },
                {
                    "Indicator": "Cash Flow",
                    "Description": "The total cash inflows and outflows of the company within a certain accounting period.",
                    "Influencing Factors": [
                        "Operating Activities",
                        "Investment Activities",
                        "Financing Activities"
                    ],
                    "Value": "$250 million"
                },
                {
                    "Indicator": "Debt Ratio",
                    "Description": "The ratio of total liabilities to total assets, reflecting the company's debt level.",
                    "Influencing Factors": [
                        "Changes in Total Liabilities",
                        "Changes in Total Assets"
                    ],
                    "Value": "0.5"
                },
                {
                    "Indicator": "Debt to Assets Ratio",
                    "Description": "The percentage of total liabilities to total assets, a measure of the company's financial leverage.",
                    "Influencing Factors": [
                        "Increases or decreases in assets and liabilities"
                    ],
                    "Value": "50%"
                },
                {
                    "Indicator": "Return on Equity",
                    "Description": "Reflects the operational efficiency of shareholder equity, namely the ratio of net profit to average shareholder equity.",
                    "Influencing Factors": [
                        "Change in Net Profit",
                        "Change in Shareholder Equity"
                    ],
                    "Value": "20%"
                }
            ]
        }
    ],
    "Additional Information": [
        {
            "Name": "Future Outlook",
            "Content": [
                {
                    "Name": "Financial Strategy",
                    "Description": "Stellar Entertainment Holdings Ltd. intends to focus on cost control measures to improve profitability and ensure a sustainable financial position. The company also plans to explore strategic capital operations to optimize its financial structure."
                },
                {
                    "Name": "Investment Plans",
                    "Description": "The company has laid out ambitious investment plans for the future, including the development of new theme parks, acquisitions of intellectual property rights, and investments in cutting-edge digital technologies."
                },
                {
                    "Name": "Risk Management",
                    "Description": "To mitigate financial risks, Stellar Entertainment Holdings Ltd. has identified potential risks such as changes in consumer preferences, regulatory challenges, and unforeseen disruptions in the entertainment industry. The company will proactively implement risk management strategies including diversification of revenue streams and the establishment of contingency plans."
                }
            ]
        }
    ],
    "Generated Outline": "I. Introduction\n    A. Company Information\n        1. Name: Stellar Entertainment Holdings Ltd.\n        2. Establishment Date: April 1, 2005\n        3. Main Business: Diversified entertainment company engaged in production, distribution, and licensing of films, television shows, and digital content. Also operates theme parks and manages live entertainment events.\n        4. Registration Location: Los Angeles, California, United States\n        5. Listing Status: Publicly Listed\n        6. Industry: Entertainment\n    \nII. Financial Information for 2017\n    A. Significant Events\n        1. Large-scale Financing (January, 2017)\n            a. Description: Raised $200 million of funds.\n            b. Impact: Strengthened financial strength, supported expansion and development.\n            c. Sub Events:\n                i. Film Production Agreement (March 2017)\n                    - Description: Signed agreement with major production studio to produce and distribute a highly anticipated blockbuster film.\n                    - Impact: Enhanced film production portfolio, increased potential revenue and market share.\n                ii. Theme Park Acquisition (May 2017)\n                    - Description: Acquired renowned theme park in popular tourist destination.\n                    - Impact: Diversified revenue streams, increased attendance and visitor spending.\n                iii. Strategic Partnership Announcement (September 2017)\n                    - Description: Announced partnership with leading technology company to develop innovative digital content and entertainment experiences.\n                    - Impact: Strengthened position in digital content market, creation of new revenue streams.\n                iv. International Expansion (November 2017)\n                    - Description: Opened first international office in key global market.\n                    - Impact: Increased presence in international markets, greater distribution and licensing opportunities.\n        2. Significant Equity Acquisition (February, 2017)\n            a. Description: Completed acquisition of 60% equity of Alpha Productions Inc.\n            b. Impact: Further expanded market share, enhanced control.\n        3. Dividend Distribution (March, 2017)\n            a. Description: Distributed $50 million of dividends to shareholders.\n            b. Impact: Enhanced shareholder returns.\n        4. Debt Restructuring (May, 2017)\n            a. Description: Underwent debt restructuring, reducing liabilities by $100 million.\n            b. Impact: Improved financial condition, reduced financial costs.\n        5. Major Asset Acquisition (June, 2017)\n            a. Description: Completed asset acquisition of XYZ Films with total value of $150 million.\n            b. Impact: Expanded business scope, enhanced market competitiveness.\n        6. Major Investment (September, 2017)\n            a. Description: Invested in Project Delta with investment amount of $80 million.\n            b. Impact: Broadened business areas, enhanced profitability.\n        7. Asset Restructuring (October, 2017)\n            a. Description: Underwent asset restructuring, optimizing business structure.\n            b. Impact: Improved operational efficiency, increased company value.\n            \n    B. Involved Indicators\n        1. Operating Income\n            - Description: The total amount of main business income and other business income within a certain accounting period.\n            - Influencing Factors: Market Demand, Changes in Product Prices\n            - Value: $500 million\n        2. Net Profit\n            - Description: The net income of the company within a certain accounting period, i.e., total income minus total costs and taxes.\n            - Influencing Factors: Operating Income, Cost Control, Non-recurring Gains and Losses\n            - Value: $120 million\n        3. Total Assets\n            - Description: The total amount of assets owned by the company at the end of the accounting period.\n            - Influencing Factors: Asset Acquisition, Asset Disposal, Asset Revaluation\n            - Value: $1.2 billion\n        4. Total Liabilities\n            - Description: The total amount of debts the company is obligated to repay at the end of the accounting period.\n            - Influencing Factors: New Debt Issuance, Debt Repayment, Debt Restructuring\n            - Value: $600 million\n        5. Shareholder Equity\n            - Description: The total amount of equity belonging to shareholders at the end of the accounting period.\n            - Influencing Factors: Net Profit, Dividend Distribution, Capital Reserves\n            - Value: $600 million\n        6. Cash Flow\n            - Description: The total cash inflows and outflows of the company within a certain accounting period.\n            - Influencing Factors: Operating Activities, Investment Activities, Financing Activities\n            - Value: $250 million\n        7. Debt Ratio\n            - Description: The ratio of total liabilities to total assets, reflecting the company's debt level.\n            - Influencing Factors: Changes in Total Liabilities, Changes in Total Assets\n            - Value: 0.5\n        8. Debt to Assets Ratio\n            - Description: The percentage of total liabilities to total assets, a measure of the company's financial leverage.\n            - Influencing Factors: Increases or decreases in assets and liabilities\n            - Value: 50%\n        9. Return on Equity\n            - Description: Reflects the operational efficiency of shareholder equity, namely the ratio of net profit to average shareholder equity.\n            - Influencing Factors: Change in Net Profit, Change in Shareholder Equity\n            - Value: 20%\n            \nIII. Additional Information\n    A. Future Outlook\n        1. Financial Strategy\n            - Description: Focus on cost control measures to improve profitability and ensure sustainable financial position. Explore strategic capital operations to optimize financial structure.\n        2. Investment Plans\n            - Description: Ambitious investment plans including development of new theme parks, acquisitions of intellectual property rights, and investments in cutting-edge digital technologies.\n        3. Risk Management\n            - Description: Identify potential risks such as changes in consumer preferences, regulatory challenges, and unforeseen disruptions in the entertainment industry. Implement risk management strategies including diversification of revenue streams and establishment of contingency plans.\n\nNote: All events, indicators, and sub-events listed above are included in the report outline.",
    "Generated Summary": "Stellar Entertainment Holdings Ltd., established in April 2005 and based in Los Angeles, California, is a publicly listed entertainment company involved in film and television production, content distribution, licensing, theme park operations, and live entertainment event management.",
    "Generated Article": "In 2017, Stellar Entertainment Holdings Ltd. experienced several significant events that had a profound impact on its financial performance and market position. Firstly, the company successfully raised $200 million in large-scale financing, which greatly strengthened its financial strength and supported its expansion and development efforts. This financing allowed Stellar Entertainment to embark on a series of strategic initiatives that enhanced its market competitiveness and revenue potential.\n\nOne of the key sub-events resulting from the large-scale financing was the signing of a film production agreement with a major production studio. This agreement enabled Stellar Entertainment to produce and distribute a highly anticipated blockbuster film, thereby enhancing its film production portfolio and increasing its potential revenue and market share. Additionally, the company made a strategic move in May 2017 by acquiring a renowned theme park in a popular tourist destination. This acquisition diversified Stellar Entertainment's revenue streams and led to increased attendance and visitor spending.\n\nIn September 2017, Stellar Entertainment announced a strategic partnership with a leading technology company to develop innovative digital content and entertainment experiences. This partnership further strengthened the company's position in the digital content market and created new revenue streams. Moreover, in November 2017, Stellar Entertainment expanded its international presence by opening its first international office in a key global market. This move increased the company's distribution and licensing opportunities, allowing it to tap into new markets and reach a wider audience.\n\nAnother significant event in 2017 was the acquisition of 60% equity of Alpha Productions Inc. This acquisition not only expanded Stellar Entertainment's market share but also enhanced its control over the acquired company. Furthermore, the company distributed $50 million in dividends to its shareholders in March 2017, which enhanced shareholder returns and demonstrated its commitment to delivering value to its investors.\n\nStellar Entertainment also underwent debt restructuring in May 2017, reducing its liabilities by $100 million. This restructuring improved the company's financial condition and reduced its financial costs. In June 2017, the company completed the asset acquisition of XYZ Films with a total value of $150 million. This acquisition expanded Stellar Entertainment's business scope and further enhanced its market competitiveness.\n\nIn September 2017, Stellar Entertainment made a major investment of $80 million in Project Delta, broadening its business areas and enhancing its profitability. The company also underwent asset restructuring in October 2017, optimizing its business structure. This restructuring improved operational efficiency and increased the overall value of the company.\n\nNow let's delve into the financial indicators for 2017. Stellar Entertainment reported an operating income of $500 million, which represents the total amount of main business income and other business income within the accounting period. This figure is influenced by market demand and changes in product prices. The company's net profit for 2017 was $120 million, which is the net income after deducting total costs and taxes from total income. The net profit is influenced by factors such as operating income, cost control, and non-recurring gains and losses.\n\nStellar Entertainment's total assets at the end of 2017 amounted to $1.2 billion, reflecting the total amount of assets owned by the company. The value of total assets is influenced by factors such as asset acquisition, asset disposal, and asset revaluation. The company's total liabilities stood at $600 million, representing the total amount of debts the company is obligated to repay. The debt ratio, which is the ratio of total liabilities to total assets, was 0.5, indicating a moderate level of debt. The debt to assets ratio, which is the percentage of total liabilities to total assets, was 50%, reflecting the company's financial leverage.\n\nStellar Entertainment's shareholder equity at the end of 2017 was $600 million, representing the total amount of equity belonging to shareholders. The shareholder equity is influenced by factors such as net profit, dividend distribution, and capital reserves. The company reported a cash flow of $250 million, which represents the total cash inflows and outflows within the accounting period. The cash flow is influenced by operating activities, investment activities, and financing activities.\n\nFinally, the return on equity for Stellar Entertainment in 2017 was 20%, reflecting the operational efficiency of shareholder equity. This ratio is calculated by dividing the net profit by the average shareholder equity. The return on equity is influenced by changes in net profit and changes in shareholder equity.\n\nLooking ahead, Stellar Entertainment has outlined a financial strategy focused on cost control measures to improve profitability and ensure a sustainable financial position. The company also has ambitious investment plans, including the development of new theme parks, acquisitions of intellectual property rights, and investments in cutting-edge digital technologies. To mitigate potential risks, Stellar Entertainment is actively identifying and managing risks such as changes in consumer preferences, regulatory challenges, and unforeseen disruptions in the entertainment industry. The company is implementing risk management strategies that include diversification of revenue streams and the establishment of contingency plans.\n\nIn conclusion, Stellar Entertainment Holdings Ltd. has demonstrated strong financial performance and strategic growth in 2017. Through a series of significant events and strategic initiatives, the company has expanded its market presence, diversified its revenue streams, and enhanced its financial position. With a focus on cost control, ambitious investment plans, and effective risk management, Stellar Entertainment is well-positioned for continued success in the entertainment industry."
}