{
    "Report Type": "Corporate Financial Report",
    "Report Time": "2021",
    "Company Information": {
        "Name": "Green Fields Agriculture Ltd.",
        "Establishment Date": "April 1, 2005",
        "Main Business": "Green Fields Agriculture Ltd. is engaged in the cultivation and distribution of high-quality organic fruits and vegetables. The company owns large farmlands and state-of-the-art facilities for efficient production.",
        "Registration Location": "Sunnydale, California",
        "Listing Status": "Listed on NASDAQ",
        "Industry": "Agriculture"
    },
    "Report Content": [
        {
            "Type": "Financial Information",
            "Significant Events": [
                {
                    "Event": "Significant Equity Acquisition",
                    "Time": "January, 2021",
                    "Description": "The company completed the acquisition of 40% equity of Green Harvest Farm, a leading organic farm that specializes in heirloom tomatoes and unique salad greens.",
                    "Impact": "Further expanded the company's market share, enhanced the company's control.",
                    "Sub Events": [
                        {
                            "Event": "Expansion of Farmland",
                            "Time": "January, 2021",
                            "Description": "Green Fields Agriculture Ltd. purchased an additional 500 acres of farmland adjacent to its existing holdings in order to expand its cultivation operations.",
                            "Impact": "Increased the company's production capacity and allowed for the cultivation of a wider variety of organic fruits and vegetables."
                        },
                        {
                            "Event": "Refurbishment of Facilities",
                            "Time": "February, 2021",
                            "Description": "The company invested in refurbishing its existing facilities, including upgrading irrigation systems and implementing advanced technologies for sustainable farming practices.",
                            "Impact": "Improved operational efficiency, reduced water usage, and ensured compliance with organic farming standards."
                        },
                        {
                            "Event": "Product Development Partnership",
                            "Time": "March, 2021",
                            "Description": "Green Fields Agriculture Ltd. entered into a strategic partnership with a leading agricultural research institution to develop new varieties of organic crops with improved yield and disease resistance.",
                            "Impact": "Enhanced the company's product portfolio, increased competitiveness, and positioned the company as a pioneer in organic crop innovation."
                        }
                    ]
                },
                {
                    "Event": "Asset Restructuring",
                    "Time": "April, 2021",
                    "Description": "The company underwent an asset restructuring, optimizing its farmland allocation and divesting non-core assets.",
                    "Impact": "Improved operational efficiency, increased company value."
                },
                {
                    "Event": "Major Asset Acquisition",
                    "Time": "June, 2021",
                    "Description": "The company completed the asset acquisition of FreshPro, a leading distributor of premium organic produce, with a total value of $20 million.",
                    "Impact": "Expanded the company's business scope, enhanced market competitiveness."
                },
                {
                    "Event": "Debt Restructuring",
                    "Time": "August, 2021",
                    "Description": "To optimize capital structure, the company underwent debt restructuring, reducing liabilities by $5 million through refinancing at lower interest rates.",
                    "Impact": "Improved the company's financial condition, reduced financial costs."
                },
                {
                    "Event": "Dividend Distribution",
                    "Time": "September, 2021",
                    "Description": "The company decided to distribute $2 million of dividends to shareholders, reflecting the company's strong financial performance and commitment to shareholder returns.",
                    "Impact": "Returned to the investors, enhanced shareholder returns."
                },
                {
                    "Event": "Large-scale Financing",
                    "Time": "October, 2021",
                    "Description": "The company conducted a large-scale financing activity, raising $30 million through a bond issuance, attracting high-profile institutional investors.",
                    "Impact": "Strengthened the company's financial strength, supported expansion and development."
                },
                {
                    "Event": "Major Investment",
                    "Time": "December, 2021",
                    "Description": "The company invested $15 million in Project Greenhouse, a state-of-the-art facility for year-round organic produce cultivation using advanced vertical farming technology.",
                    "Impact": "Further broadened the company's business areas, enhanced profitability."
                }
            ],
            "Involved Indicators": [
                {
                    "Indicator": "Operating Income",
                    "Description": "The total amount of main business income and other business income within a certain accounting period.",
                    "Influencing Factors": [
                        "Market Demand",
                        "Changes in Product Prices"
                    ],
                    "Value": "Please Fill In"
                },
                {
                    "Indicator": "Net Profit",
                    "Description": "The net income of the company within a certain accounting period, i.e., total income minus total costs and taxes.",
                    "Influencing Factors": [
                        "Operating Income",
                        "Cost Control",
                        "Non-recurring Gains and Losses"
                    ],
                    "Value": "Please Fill In"
                },
                {
                    "Indicator": "Total Assets",
                    "Description": "The total amount of assets owned by the company at the end of the accounting period.",
                    "Influencing Factors": [
                        "Asset Acquisition",
                        "Asset Disposal",
                        "Asset Revaluation"
                    ],
                    "Value": "Please Fill In"
                },
                {
                    "Indicator": "Total Liabilities",
                    "Description": "The total amount of debts the company is obligated to repay at the end of the accounting period.",
                    "Influencing Factors": [
                        "New Debt Issuance",
                        "Debt Repayment",
                        "Debt Restructuring"
                    ],
                    "Value": "Please Fill In"
                },
                {
                    "Indicator": "Shareholder Equity",
                    "Description": "The total amount of equity belonging to shareholders at the end of the accounting period.",
                    "Influencing Factors": [
                        "Net Profit",
                        "Dividend Distribution",
                        "Capital Reserves"
                    ],
                    "Value": "Please Fill In"
                },
                {
                    "Indicator": "Cash Flow",
                    "Description": "The total cash inflows and outflows of the company within a certain accounting period.",
                    "Influencing Factors": [
                        "Operating Activities",
                        "Investment Activities",
                        "Financing Activities"
                    ],
                    "Value": "Please Fill In"
                },
                {
                    "Indicator": "Debt Ratio",
                    "Description": "The ratio of total liabilities to total assets, reflecting the company's debt level.",
                    "Influencing Factors": [
                        "Changes in Total Liabilities",
                        "Changes in Total Assets"
                    ],
                    "Value": "Please Fill In"
                },
                {
                    "Indicator": "Debt to Assets Ratio",
                    "Description": "The percentage of total liabilities to total assets, a measure of the company's financial leverage.",
                    "Influencing Factors": [
                        "Increases or decreases in assets and liabilities"
                    ],
                    "Value": "Please Fill In"
                },
                {
                    "Indicator": "Return on Equity",
                    "Description": "Reflects the operational efficiency of shareholder equity, namely the ratio of net profit to average shareholder equity.",
                    "Influencing Factors": [
                        "Change in Net Profit",
                        "Change in Shareholder Equity"
                    ],
                    "Value": "Please Fill In"
                }
            ]
        }
    ],
    "Additional Information": [
        {
            "Name": "Future Outlook",
            "Content": [
                {
                    "Name": "Financial Strategy",
                    "Description": "The company plans to implement a comprehensive financial strategy to optimize cost structures and streamline capital operations, resulting in improved profitability and sustainable growth."
                },
                {
                    "Name": "Investment Plans",
                    "Description": "Green Fields Agriculture Ltd. aims to invest in cutting-edge technology for precision farming, expand its product portfolio to include exotic tropical fruits, and explore potential mergers and acquisitions for rapid market expansion."
                },
                {
                    "Name": "Risk Management",
                    "Description": "The company has identified key financial risks such as adverse weather conditions, pricing fluctuations, and changes in government regulations. In response, Green Fields Agriculture Ltd. will implement risk mitigation strategies such as diversification of cultivation locations, hedging programs for commodity price stability, and regular communication with regulatory bodies for proactive compliance."
                }
            ]
        }
    ],
    "Generated Outline": "I. Introduction\n   A. Company Information\n      1. Name: Green Fields Agriculture Ltd.\n      2. Establishment Date: April 1, 2005\n      3. Main Business: Cultivation and distribution of high-quality organic fruits and vegetables\n      4. Registration Location: Sunnydale, California\n      5. Listing Status: Listed on NASDAQ\n   B. Industry: Agriculture\n\nII. Financial Information\n   A. Significant Events\n      1. Significant Equity Acquisition (January, 2021)\n         a. Description: Acquisition of 40% equity of Green Harvest Farm\n         b. Impact: Expanded market share, enhanced control\n         c. Sub Events:\n            - Expansion of Farmland (January, 2021)\n               - Description: Purchase of additional 500 acres of farmland\n               - Impact: Increased production capacity, cultivation of wider variety of organic fruits and vegetables\n            - Refurbishment of Facilities (February, 2021)\n               - Description: Investment in refurbishment of facilities\n               - Impact: Improved operational efficiency, reduced water usage, compliance with organic farming standards\n            - Product Development Partnership (March, 2021)\n               - Description: Strategic partnership with agricultural research institution\n               - Impact: Enhanced product portfolio, increased competitiveness, position as pioneer in organic crop innovation\n      2. Asset Restructuring (April, 2021)\n         - Description: Restructuring of company assets, optimization of farmland allocation, divestment of non-core assets\n         - Impact: Improved operational efficiency, increased company value\n      3. Major Asset Acquisition (June, 2021)\n         - Description: Acquisition of FreshPro, a leading distributor of premium organic produce\n         - Impact: Expanded business scope, enhanced market competitiveness\n      4. Debt Restructuring (August, 2021)\n         - Description: Debt restructuring, reduction of liabilities by $5 million through refinancing at lower interest rates\n         - Impact: Improved financial condition, reduced financial costs\n      5. Dividend Distribution (September, 2021)\n         - Description: Distribution of $2 million dividends to shareholders\n         - Impact: Enhanced shareholder returns\n      6. Large-scale Financing (October, 2021)\n         - Description: Financing activity, raised $30 million through bond issuance\n         - Impact: Strengthened financial strength, supported expansion and development\n      7. Major Investment (December, 2021)\n         - Description: $15 million investment in Project Greenhouse\n         - Impact: Broadened business areas, enhanced profitability\n   \n   B. Involved Indicators\n      1. Operating Income\n         - Description: Total amount of main business income and other business income\n         - Influencing Factors: Market Demand, Changes in Product Prices\n         - Value: Please Fill In\n      2. Net Profit\n         - Description: Net income of the company within a certain accounting period\n         - Influencing Factors: Operating Income, Cost Control, Non-recurring Gains and Losses\n         - Value: Please Fill In\n      3. Total Assets\n         - Description: Total amount of assets owned by the company at the end of the accounting period\n         - Influencing Factors: Asset Acquisition, Asset Disposal, Asset Revaluation\n         - Value: Please Fill In\n      4. Total Liabilities\n         - Description: Total amount of debts the company is obligated to repay at the end of the accounting period\n         - Influencing Factors: New Debt Issuance, Debt Repayment, Debt Restructuring\n         - Value: Please Fill In\n      5. Shareholder Equity\n         - Description: Total amount of equity belonging to shareholders at the end of the accounting period\n         - Influencing Factors: Net Profit, Dividend Distribution, Capital Reserves\n         - Value: Please Fill In\n      6. Cash Flow\n         - Description: Total cash inflows and outflows of the company within a certain accounting period\n         - Influencing Factors: Operating Activities, Investment Activities, Financing Activities\n         - Value: Please Fill In\n      7. Debt Ratio\n         - Description: Ratio of total liabilities to total assets\n         - Influencing Factors: Changes in Total Liabilities, Changes in Total Assets\n         - Value: Please Fill In\n      8. Debt to Assets Ratio\n         - Description: Percentage of total liabilities to total assets\n         - Influencing Factors: Increases or decreases in assets and liabilities\n         - Value: Please Fill In\n      9. Return on Equity\n         - Description: Ratio of net profit to average shareholder equity\n         - Influencing Factors: Change in Net Profit, Change in Shareholder Equity\n         - Value: Please Fill In\n\nIII. Future Outlook\n   A. Financial Strategy\n      - Description: Implementation of comprehensive financial strategy to optimize cost structures and streamline capital operations, resulting in improved profitability and sustainable growth\n   B. Investment Plans\n      - Description: Investment in cutting-edge technology for precision farming, expansion of product portfolio to include exotic tropical fruits, exploration of potential mergers and acquisitions for rapid market expansion\n   C. Risk Management\n      - Description: Identification of financial risks such as adverse weather conditions, pricing fluctuations, and changes in government regulations; implementation of risk mitigation strategies including diversification of cultivation locations, hedging programs for commodity price stability, and regular communication with regulatory bodies for proactive compliance.",
    "Generated Summary": "Green Fields Agriculture Ltd., established on April 1, 2005 in Sunnydale, California, is a listed company on NASDAQ and specializes in the cultivation and distribution of high-quality organic fruits and vegetables.",
    "Generated Article": "In January 2021, Green Fields Agriculture Ltd. made a significant equity acquisition by acquiring 40% equity of Green Harvest Farm. This acquisition expanded their market share and enhanced their control over the industry. As part of this acquisition, Green Fields Agriculture Ltd. also purchased an additional 500 acres of farmland, expanding their production capacity and allowing them to cultivate a wider variety of organic fruits and vegetables. The company further invested in the refurbishment of their facilities in February 2021, resulting in improved operational efficiency, reduced water usage, and compliance with organic farming standards.\n\nIn March 2021, Green Fields Agriculture Ltd. entered into a strategic partnership with an agricultural research institution for product development. This partnership has not only enhanced their product portfolio but also increased their competitiveness in the market, positioning them as pioneers in organic crop innovation.\n\nIn April 2021, the company underwent asset restructuring, optimizing their farmland allocation and divesting non-core assets. This restructuring has led to improved operational efficiency and increased the overall value of the company.\n\nIn June 2021, Green Fields Agriculture Ltd. made a major asset acquisition by acquiring FreshPro, a leading distributor of premium organic produce. This acquisition has expanded their business scope and enhanced their market competitiveness.\n\nTo improve their financial condition, the company underwent debt restructuring in August 2021, reducing their liabilities by $5 million through refinancing at lower interest rates. This has resulted in improved financial stability and reduced financial costs.\n\nIn September 2021, Green Fields Agriculture Ltd. distributed $2 million in dividends to their shareholders, enhancing shareholder returns and demonstrating their commitment to delivering value to their investors.\n\nIn October 2021, the company raised $30 million through a bond issuance, strengthening their financial strength and providing support for future expansion and development.\n\nIn December 2021, Green Fields Agriculture Ltd. made a major investment of $15 million in Project Greenhouse. This investment has broadened their business areas and is expected to enhance profitability in the long run.\n\nThese significant events have had a direct impact on various financial indicators of Green Fields Agriculture Ltd. The operating income of the company has been influenced by market demand and changes in product prices. The net profit has been affected by the operating income, cost control, and non-recurring gains and losses. The total assets have been influenced by asset acquisition, asset disposal, and asset revaluation. The total liabilities have been influenced by new debt issuance, debt repayment, and debt restructuring. The shareholder equity has been affected by the net profit, dividend distribution, and capital reserves. The cash flow has been influenced by operating activities, investment activities, and financing activities. The debt ratio and debt to assets ratio have been impacted by changes in total liabilities and total assets. Finally, the return on equity has been influenced by changes in net profit and shareholder equity.\n\nLooking ahead, Green Fields Agriculture Ltd. has outlined a comprehensive financial strategy to optimize cost structures and streamline capital operations, aiming to improve profitability and achieve sustainable growth. The company plans to invest in cutting-edge technology for precision farming and expand their product portfolio to include exotic tropical fruits. They are also exploring potential mergers and acquisitions to further expand their market presence. To mitigate financial risks, Green Fields Agriculture Ltd. has identified potential risks such as adverse weather conditions, pricing fluctuations, and changes in government regulations. They plan to implement risk mitigation strategies, including diversification of cultivation locations, hedging programs for commodity price stability, and regular communication with regulatory bodies for proactive compliance.\n\nIn conclusion, Green Fields Agriculture Ltd. has experienced significant growth and expansion through strategic acquisitions, partnerships, and investments. These events have had a direct impact on various financial indicators, positioning the company for future success. With a comprehensive financial strategy and a focus on innovation and risk management, Green Fields Agriculture Ltd. is well-positioned to capitalize on opportunities in the agriculture industry and deliver sustainable growth in the years to come."
}