{
    "报告类型": "公司财务报告",
    "报告时间": "2019年度",
    "公司信息": {
        "名称": "云翼航空有限公司",
        "成立日期": "2003年6月",
        "主营业务": "航空运输服务，包括客运和货运",
        "注册地": "中国北京市",
        "上市情况": "未上市",
        "行业": "航空"
    },
    "报告内容": [
        {
            "类型": "财务信息",
            "重要事件": [
                {
                    "事件": "重大股权收购",
                    "时间": "2019年1月",
                    "描述": "云翼航空有限公司完成了对翱翔航空有限公司的股权收购，获得了70%的股权。",
                    "影响": "进一步扩大了云翼航空的市场份额，提升了公司的控制力。"
                },
                {
                    "事件": "债务重组",
                    "时间": "2019年4月",
                    "描述": "为优化资本结构，云翼航空有限公司进行了债务重组，减少了10亿元负债。",
                    "影响": "改善了公司的财务状况，降低了财务成本。"
                },
                {
                    "事件": "大规模融资",
                    "时间": "2019年6月",
                    "描述": "云翼航空有限公司进行了一次大规模的融资活动，募集了30亿元资金。",
                    "影响": "加强了公司的资金实力，支持了公司的扩张和发展。"
                },
                {
                    "事件": "分发股利",
                    "时间": "2019年7月",
                    "描述": "云翼航空有限公司决定向股东分发6亿元股利。",
                    "影响": "回报给股东们的投资，提升了股东的收益。"
                },
                {
                    "事件": "燃油价格上涨",
                    "时间": "2019年7月",
                    "描述": "燃油价格上涨导致云翼航空有限公司的成本上升。",
                    "影响": "净利润下降，增加了公司的经营风险。"
                },
                {
                    "事件": "重大投资",
                    "时间": "2019年9月",
                    "描述": "云翼航空有限公司投资了南方航空蓝天项目，投资金额为20亿元。",
                    "影响": "进一步拓宽了云翼航空的业务领域，提升了公司的盈利能力。"
                },
                {
                    "事件": "重大资产收购",
                    "时间": "2019年11月",
                    "描述": "云翼航空有限公司完成了对东方航空物流有限公司的资产收购，总价值30亿元。",
                    "影响": "扩大云翼航空的业务范围，增强市场竞争力。"
                },
                {
                    "事件": "航班取消",
                    "时间": "2019年11月",
                    "描述": "由于天气影响和航空管制原因，云翼航空有限公司取消了多个航班。",
                    "影响": "导致公司的营业收入下降，增加了航司的航班延误率。"
                },
                {
                    "事件": "资产重组",
                    "时间": "2019年12月",
                    "描述": "云翼航空有限公司进行了一次资产重组，优化了公司的业务结构。",
                    "影响": "提高了公司的运营效率，增加了公司的价值。"
                }
            ],
            "涉及的指标": [
                {
                    "指标": "营业收入",
                    "描述": "公司在一定会计期间内的主营业务收入和其他业务收入总额。",
                    "影响因素": [
                        "市场需求",
                        "产品价格变化"
                    ],
                    "值": "500亿元"
                },
                {
                    "指标": "净利润",
                    "描述": "公司在一定会计期间的净收入，即总收入减去总成本和所得税费用后的金额。",
                    "影响因素": [
                        "营业收入",
                        "成本控制",
                        "非经常性损益"
                    ],
                    "值": "30亿元"
                },
                {
                    "指标": "总资产",
                    "描述": "会计期末，公司所拥有的资产总额。",
                    "影响因素": [
                        "资产收购",
                        "资产处置",
                        "资产重估"
                    ],
                    "值": "700亿元"
                },
                {
                    "指标": "总负债",
                    "描述": "会计期末，公司所承担并需要偿还的债务总额。",
                    "影响因素": [
                        "新债发行",
                        "债务偿还",
                        "债务重组"
                    ],
                    "值": "400亿元"
                },
                {
                    "指标": "股东权益",
                    "描述": "会计期末，归属于股东的权益总额。",
                    "影响因素": [
                        "净利润",
                        "股利发放",
                        "资本公积"
                    ],
                    "值": "300亿元"
                },
                {
                    "指标": "现金流量",
                    "描述": "公司在一定会计期间内的现金流入和流出总和。",
                    "影响因素": [
                        "经营活动",
                        "投资活动",
                        "筹资活动"
                    ],
                    "值": "100亿元"
                },
                {
                    "指标": "负债比率",
                    "描述": "公司总负债与总资产的比率，反映公司的债务水平。",
                    "影响因素": [
                        "总负债的变化",
                        "总资产的变化"
                    ],
                    "值": "57.14%"
                },
                {
                    "指标": "资产负债率",
                    "描述": "公司总负债占总资产的百分比，衡量公司财务杠杆的一个指标。",
                    "影响因素": [
                        "资产和负债的增减变化"
                    ],
                    "值": "57.14%"
                },
                {
                    "指标": "净资产收益率",
                    "描述": "反映公司股东权益的经营效益，即净利润与平均股东权益的比率。",
                    "影响因素": [
                        "净利润的变化",
                        "股东权益的变化"
                    ],
                    "值": "10%"
                }
            ]
        }
    ],
    "额外信息": [
        {
            "名称": "未来展望",
            "内容": [
                {
                    "名称": "财务策略",
                    "描述": "云翼航空有限公司将进一步加强成本控制，提高财务效率，优化资本运营，以保持财务稳健。",
                    "目标": "降低成本，提高利润率，增加现金流"
                },
                {
                    "名称": "投资计划",
                    "描述": "云翼航空有限公司将继续加大对新飞机和设备的投资，加强技术研发，提升航空运输服务水平。",
                    "目标": "扩大航空运输规模，提供更优质的服务"
                },
                {
                    "名称": "风险管理",
                    "描述": "云翼航空有限公司将通过积极的风险管理措施，识别并应对市场竞争、燃油价格波动、政策变化等风险。",
                    "目标": "降低风险影响，保障公司稳定运营"
                }
            ]
        }
    ],
    "生成大纲": "公司财务报告大纲：\n\n1. 概述\n   a. 报告时间：2019年度\n   b. 报告类型：公司财务报告\n   c. 报告内容：包括财务信息和未来展望\n\n2. 财务信息\n   a. 资金融通\n      - 重大股权收购(2019年1月)：云翼航空有限公司完成了对翱翔航空有限公司的股权收购，获得了70%的股权。进一步扩大了云翼航空的市场份额，提升了公司的控制力。\n      - 债务重组(2019年4月)：云翼航空有限公司进行了债务重组，减少了10亿元负债。改善了公司的财务状况，降低了财务成本。\n      - 大规模融资(2019年6月)：云翼航空有限公司进行了一次大规模的融资活动，募集了30亿元资金。加强了公司的资金实力，支持了公司的扩张和发展。\n      - 分发股利(2019年7月)：云翼航空有限公司决定向股东分发6亿元股利。回报给股东们的投资，提升了股东的收益。\n      - 燃油价格上涨(2019年7月)：燃油价格上涨导致云翼航空有限公司的成本上升。净利润下降，增加了公司的经营风险。\n      - 重大投资(2019年9月)：云翼航空有限公司投资了南方航空蓝天项目，投资金额为20亿元。进一步拓宽了云翼航空的业务领域，提升了公司的盈利能力。\n      - 重大资产收购(2019年11月)：云翼航空有限公司完成了对东方航空物流有限公司的资产收购，总价值30亿元。扩大云翼航空的业务范围，增强市场竞争力。\n      - 航班取消(2019年11月)：由于天气影响和航空管制原因，云翼航空有限公司取消了多个航班。导致公司的营业收入下降，增加了航司的航班延误率。\n      - 资产重组(2019年12月)：云翼航空有限公司进行了一次资产重组，优化了公司的业务结构。提高了公司的运营效率，增加了公司的价值。\n\n   b. 关键指标\n      - 营业收入：500亿元\n         - 影响因素：\n            - 市场需求\n            - 产品价格变化\n      - 净利润：30亿元\n         - 影响因素：\n            - 营业收入\n            - 成本控制\n            - 非经常性损益\n      - 总资产：700亿元\n         - 影响因素：\n            - 资产收购\n            - 资产处置\n            - 资产重估\n      - 总负债：400亿元\n         - 影响因素：\n            - 新债发行\n            - 债务偿还\n            - 债务重组\n      - 股东权益：300亿元\n         - 影响因素：\n            - 净利润\n            - 股利发放\n            - 资本公积\n      - 现金流量：100亿元\n         - 影响因素：\n            - 经营活动\n            - 投资活动\n            - 筹资活动\n      - 负债比率：57.14%\n         - 影响因素：\n            - 总负债的变化\n            - 总资产的变化\n      - 资产负债率：57.14%\n         - 影响因素：\n            - 资产和负债的增减变化\n      - 净资产收益率：10%\n         - 影响因素：\n            - 净利润的变化\n            - 股东权益的变化\n\n3. 未来展望\n   a. 财务策略\n      - 描述：云翼航空有限公司将进一步加强成本控制，提高财务效率，优化资本运营，以保持财务稳健。\n      - 目标：降低成本，提高利润率，增加现金流\n\n   b. 投资计划\n      - 描述：云翼航空有限公司将继续加大对新飞机和设备的投资，加强技术研发，提升航空运输服务水平。\n      - 目标：扩大航空运输规模，提供更优质的服务\n\n   c. 风险管理\n      - 描述：云翼航空有限公司将通过积极的风险管理措施，识别并应对市场竞争、燃油价格波动、政策变化等风险。\n      - 目标：降低风险影响，保障公司稳定运营",
    "生成总结": "云翼航空有限公司是一家成立于2003年6月、总部位于中国北京市的航空公司，主要从事航空运输服务，包括客运和货运。",
    "生成文章": "该公司在2019年度取得了一系列重要的财务成果和里程碑事件。首先，在2019年1月，云翼航空完成了对翱翔航空的股权收购，获得了70%的股权。这一举措进一步扩大了云翼航空的市场份额，提升了公司的控制力。\n\n为了改善财务状况，云翼航空在2019年4月进行了债务重组，成功减少了10亿元的负债。这一举措不仅改善了公司的财务状况，还降低了财务成本。\n\n为了支持公司的扩张和发展，云翼航空在2019年6月进行了一次大规模的融资活动，募集了30亿元资金。这次融资活动加强了公司的资金实力，为公司的未来发展提供了充足的支持。\n\n为了回报股东的投资，云翼航空在2019年7月决定向股东分发6亿元股利。这一举措提升了股东的收益，增强了股东对公司的信心。\n\n然而，2019年7月燃油价格上涨导致云翼航空的成本上升，净利润下降。这一事件增加了公司的经营风险，需要公司采取相应的措施来应对。\n\n为了进一步拓宽业务领域，云翼航空在2019年9月投资了南方航空蓝天项目，投资金额为20亿元。这一举措进一步提升了公司的盈利能力，为公司的未来发展奠定了坚实的基础。\n\n在2019年11月，云翼航空完成了对东方航空物流的资产收购，总价值30亿元。这一举措扩大了云翼航空的业务范围，增强了公司的市场竞争力。\n\n然而，由于天气影响和航空管制原因，云翼航空在2019年11月取消了多个航班。这一事件导致公司的营业收入下降，增加了航司的航班延误率。\n\n为了优化业务结构，云翼航空在2019年12月进行了一次资产重组。这一举措提高了公司的运营效率，增加了公司的价值。\n\n在财务指标方面，云翼航空在2019年度取得了一系列关键指标的积极变化。营业收入达到了500亿元，这主要受到市场需求和产品价格变化的影响。净利润达到了30亿元，这受到营业收入、成本控制和非经常性损益的影响。总资产达到了700亿元，这主要受到资产收购、资产处置和资产重估的影响。总负债达到了400亿元，这受到新债发行、债务偿还和债务重组的影响。股东权益达到了300亿元，这受到净利润、股利发放和资本公积的影响。现金流量达到了100亿元，这受到经营活动、投资活动和筹资活动的影响。负债比率为57.14%，这受到总负债的变化和总资产的变化的影响。资产负债率为57.14%，这受到资产和负债的增减变化的影响。净资产收益率为10%，这受到净利润的变化和股东权益的变化的影响。\n\n展望未来，云翼航空将继续加强成本控制，提高财务效率，优化资本运营，以保持财务稳健。公司计划继续加大对新飞机和设备的投资，加强技术研发，提升航空运输服务水平。同时，公司将通过积极的风险管理措施，识别并应对市场竞争、燃油价格波动、政策变化等风险，降低风险影响，保障公司稳定运营。\n\n综上所述，云翼航空有限公司在2019年度取得了一系列重要的财务成果和里程碑事件。公司将继续努力，保持财务稳健，加强投资和风险管理，为公司的未来发展奠定坚实基础。"
}