{
    "Hospitalization Record": {
        "Basic Information": {
            "Name": "C. Cruz",
            "Gender": "female",
            "Age": "65",
            "Ethnicity": "Hispanic",
            "MaritalStatus": "Widowed",
            "Occupation": "Retired",
            "Address": "7, Ashland street, Indianola",
            "AdmissionTime": "17th, February",
            "RecordTime": "17th, February, 14:30",
            "Historian": "C. Cruz",
            "Hospital Name": "Indianola General Hospital"
        },
        "ChiefComplaint": "Fever, chills, back pain for 2 days",
        "PresentIllness": {
            "Onset": "Symptoms started abruptly 2 days ago with high fever and chills while at home.",
            "MainSymptoms": "Unilateral back pain on the right side, severe and constant, not relieved by rest, accompanied by nausea and vomiting.",
            "AccompanyingSymptoms": "Fever (38.8°C), urgency, frequent urination with burning sensation.",
            "DiagnosisAndTreatmentHistory": "Took acetaminophen with minimal relief. No previous treatments or hospital visits for this episode.",
            "GeneralConditionChanges": "Decreased appetite, normal bowel movements, increased urinary frequency, disturbed sleep due to pain."
        },
        "PastHistory": {
            "GeneralHealthCondition": "Generally healthy, with well-managed hypertension.",
            "DiseaseHistory": "Hypertension for 10 years",
            "InfectiousDiseaseHistory": "Chickenpox during childhood",
            "ImmunizationHistory": "Up to date with routine vaccinations",
            "SurgeryAndTraumaHistory": "Appendectomy at age 30",
            "BloodTransfusionHistory": "No history of blood transfusion",
            "AllergyHistory": "No known allergies"
        },
        "PersonalHistory": {
            "Birthplace": "Indianola, Iowa",
            "Residence": "Indianola, Iowa",
            "LivingHabits": "Non-smoker, occasional alcohol consumer",
            "OccupationAndWorkingConditions": "Former teacher, retired for 5 years",
            "ExposureHistory": "No known exposure to industrial toxins, dust, or radioactive substances.",
            "TravelHistory": "No recent travel history."
        },
        "MaritalAndFamilyHistory": {
            "MaritalHistory": {
                "MaritalStatus": "Widowed",
                "MarriageAge": "25",
                "Spouse'sHealthCondition": "Deceased",
                "Children'sCondition": "Two children, both in good health."
            },
            "MenstrualHistory": {
                "MenarcheAge": "13",
                "MenstruationDuration": "5 days",
                "MenstruationInterval": "28 days",
                "LastMenstruation": "Menopause at age 50",
                "MenstrualVolume": "Normal",
                "Dysmenorrhea": "Mild"
            },
            "FamilyHistory": "Father had hypertension and heart disease, mother had diabetes. No family history of similar diseases or genetic tendencies."
        },
        "PhysicalExamination": {
            "GeneralCondition": {
                "Temperature": "38.8°C",
                "Pulse": "90 bpm",
                "Respiration": "18 breaths/min",
                "BloodPressure": "140/85 mmHg"
            },
            "SystematicExamination": {
                "Skin": "No rashes or lesions",
                "MucousMembranes": "Moist, no pallor, cyanosis, or jaundice",
                "LymphNodes": "No enlargement detected",
                "HeadAndOrgans": "No abnormalities",
                "Neck": "Supple, no jugular vein distention",
                "Chest": "Clear breath sounds, normal heart sounds",
                "Abdomen": "Soft, non-tender, no organomegaly",
                "RectumAndAnus": "Not examined",
                "ExternalGenitalia": "No abnormalities",
                "Spine": "Tenderness over the right lumbar area",
                "Limbs": "No edema, normal range of motion",
                "NervousSystem": "No focal neurological deficits"
            }
        },
        "SpecialistExamination": "Costovertebral angle tenderness on the right side.",
        "AuxiliaryExamination": "Urinalysis shows pyuria and bacteriuria, urine culture pending. CBC shows elevated WBC count.",
        "PreliminaryDiagnosis": "Acute Pyelonephritis",
        "DiagnosticBasis": "History of fever, chills, unilateral back pain, frequent urination, and burning sensation; physical examination consistent with right-sided costovertebral angle tenderness; supportive lab findings (WBC, urinalysis).",
        "DifferentialDiagnosis": "Ruled out acute cystitis due to the presence of systemic symptoms (fever and chills) and costovertebral angle tenderness, cholecystitis, and pancreatitis based on lack of upper abdominal pain and relevant laboratory findings; pelvic inflammatory disease ruled out due to lack of pelvic pain and discharge; ruled out febrile diseases based on urine findings and localized back pain.",
        "AdmissionRecords": {
            "Physician'sSignature": "Dr. Emily Watson"
        },
        "Post-AdmissionCourseRecords": {
            "FirstCourseRecord": "Patient admitted with acute pyelonephritis. Initiated intravenous antibiotics (Ceftriaxone). Symptomatic treatment with antipyretics and analgesics. Monitor vitals, fluid intake, and output closely.",
            "DailyCourseRecords": "Day 1: Patient's fever reduced, still experiencing back pain, urine culture positive for E. coli, continue antibiotics. Day 2: Marked improvement, pain significantly reduced, continue current treatment.",
            "SeniorPhysicianRoundsRecords": "Reviewed case, agrees with treatment plan, continue current management.",
            "DifficultCaseDiscussionRecords": "No difficult case discussions conducted.",
            "HandoverRecords": "Handover to night shift, patient's vitals stable, continue monitoring.",
            "TransferRecords": "No transfers.",
            "StageSummary": "Patient showing significant improvement after 2 days of treatment, continue antibiotics, reevaluate after 3 more days.",
            "EmergencyRecords": "No emergency events.",
            "InvasiveProcedureRecords": "Not applicable.",
            "ConsultationRecords": "Not applicable.",
            "DischargeRecords": "To be completed upon discharge.",
            "CriticallyIllPatientCareRecords": "Not applicable."
        },
        "MedicalOrders": {
            "Long-termOrders": "Ceftriaxone 1g IV q24h, Antipyretics PRN, Maintain strict I/O charting, Monitor vitals q4h.",
            "TemporaryOrders": "IV fluids (Normal Saline) at 75ml/hr, Acetaminophen 500mg q6h PRN for fever."
        },
        "AuxiliaryExaminationReports": "CBC: WBC 15,000/uL, Urinalysis: Positive for WBCs, Positive for bacteria. Urine culture: E. coli.",
        "TemperatureChart": "Day 1: Temp 38.8°C, Pulse 90 bpm, Resp 18/min, BP 140/85 mmHg. Day 2: Temp 37.5°C, Pulse 84 bpm, Resp 18/min, BP 135/80 mmHg.",
        "BloodTransfusionConsent": "Not applicable.",
        "SpecialExaminationConsent": "Not applicable.",
        "CriticalConditionNotice": "Not applicable."
    },
    "DiseaseType": {
        "Diseases of the Genitourinary System": {
            "Name": "Acute Pyelonephritis",
            "Symptoms": "Fever and chills, nausea and vomiting, unilateral or bilateral back pain, frequent urination, urgency, and pain",
            "Differential Diagnosis": "Acute cystitis, cholecystitis, pancreatitis, pelvic inflammatory disease; in cases with high fever but no obvious urinary symptoms, differentiation should be made from various febrile diseases"
        }
    },
    "Generated Article": "**Hospitalization Record**\n\n**Basic Information:**\nName: C. Cruz\nGender: female\nAge: 65\nEthnicity: Hispanic\nMarital Status: Widowed\nOccupation: Retired\nAddress: 7, Ashland street, Indianola\nAdmission Time: 17th, February\nRecord Time: 17th, February, 14:30\nHistorian: C. Cruz\nHospital Name: Indianola General Hospital\n\n**Chief Complaint:**\nFever, chills, back pain for 2 days\n\n**Present Illness:**\nOnset: Symptoms started abruptly 2 days ago with high fever and chills while at home.\nMain Symptoms: Unilateral back pain on the right side, severe and constant, not relieved by rest, accompanied by nausea and vomiting.\nAccompanying Symptoms: Fever (38.8°C), urgency, frequent urination with burning sensation.\nDiagnosis and Treatment History: Took acetaminophen with minimal relief. No previous treatments or hospital visits for this episode.\nGeneral Condition Changes: Decreased appetite, normal bowel movements, increased urinary frequency, disturbed sleep due to pain.\n\n**Past History:**\nGeneral Health Condition: Generally healthy, with well-managed hypertension.\nDisease History: Hypertension for 10 years.\nInfectious Disease History: Chickenpox during childhood.\nImmunization History: Up to date with routine vaccinations.\nSurgery and Trauma History: Appendectomy at age 30.\nBlood Transfusion History: No history of blood transfusion.\nAllergy History: No known allergies.\n\n**Personal History:**\nBirthplace: Indianola, Iowa.\nResidence: Indianola, Iowa.\nLiving Habits: Non-smoker, occasional alcohol consumer.\nOccupation and Working Conditions: Former teacher, retired for 5 years.\nExposure History: No known exposure to industrial toxins, dust, or radioactive substances.\nTravel History: No recent travel history.\n\n**Marital and Family History:**\nMarital History: \n- Marital Status: Widowed.\n- Marriage Age: 25.\n- Spouse’s Health Condition: Deceased.\n- Children’s Condition: Two children, both in good health.\n\nMenstrual History:\n- Menarche Age: 13.\n- Menstruation Duration: 5 days.\n- Menstruation Interval: 28 days.\n- Last Menstruation: Menopause at age 50.\n- Menstrual Volume: Normal.\n- Dysmenorrhea: Mild.\n\nFamily History: \n- Father had hypertension and heart disease.\n- Mother had diabetes.\n- No family history of similar diseases or genetic tendencies.\n\n**Physical Examination:**\nGeneral Condition:\n- Temperature: 38.8°C\n- Pulse: 90 bpm\n- Respiration: 18 breaths/min\n- Blood Pressure: 140/85 mmHg\n\nSystematic Examination:\n- Skin: No rashes or lesions.\n- Mucous Membranes: Moist, no pallor, cyanosis, or jaundice.\n- Lymph Nodes: No enlargement detected.\n- Head and Organs: No abnormalities.\n- Neck: Supple, no jugular vein distention.\n- Chest: Clear breath sounds, normal heart sounds.\n- Abdomen: Soft, non-tender, no organomegaly.\n- Rectum and Anus: Not examined.\n- External Genitalia: No abnormalities.\n- Spine: Tenderness over the right lumbar area.\n- Limbs: No edema, normal range of motion.\n- Nervous System: No focal neurological deficits.\n\n**Specialist Examination:**\nCostovertebral angle tenderness on the right side.\n\n**Auxiliary Examination:**\n- Urinalysis: Shows pyuria and bacteriuria. Urine culture pending.\n- CBC: Shows elevated WBC count.\n\n**Preliminary Diagnosis:**\nAcute Pyelonephritis\n\n**Diagnostic Basis:**\nHistory of fever, chills, unilateral back pain, frequent urination, and burning sensation; physical examination consistent with right-sided costovertebral angle tenderness; supportive lab findings (WBC, urinalysis).\n\n**Differential Diagnosis:**\n- Ruled out acute cystitis due to the presence of systemic symptoms (fever and chills) and costovertebral angle tenderness.\n- Ruled out cholecystitis and pancreatitis based on lack of upper abdominal pain and relevant laboratory findings.\n- Ruled out pelvic inflammatory disease due to lack of pelvic pain and discharge.\n- Ruled out febrile diseases based on urine findings and localized back pain.\n\n**Admission Records:**\nPhysician's Signature: Dr. Emily Watson\n\n**Post-Admission Course Records:**\nFirst Course Record: Patient admitted with acute pyelonephritis. Initiated intravenous antibiotics (Ceftriaxone). Symptomatic treatment with antipyretics and analgesics. Monitor vitals, fluid intake, and output closely.\nDaily Course Records:\n- Day 1: Patient's fever reduced, still experiencing back pain, urine culture positive for E. coli, continue antibiotics.\n- Day 2: Marked improvement, pain significantly reduced, continue current treatment.\nSenior Physician Rounds Records: Reviewed case, agrees with treatment plan, continue current management.\nDifficult Case Discussion Records: No difficult case discussions conducted.\nHandover Records: Handover to night shift, patient's vitals stable, continue monitoring.\nTransfer Records: No transfers.\nStage Summary: Patient showing significant improvement after 2 days of treatment, continue antibiotics, reevaluate after 3 more days.\nEmergency Records: No emergency events.\nInvasive Procedure Records: Not applicable.\nConsultation Records: Not applicable.\nDischarge Records: To be completed upon discharge.\nCritically Ill Patient Care Records: Not applicable.\n\n**Medical Orders:**\nLong-term Orders:\n- Ceftriaxone 1g IV q24h\n- Antipyretics PRN\n- Maintain strict I/O charting\n- Monitor vitals q4h\n\nTemporary Orders:\n- IV fluids (Normal Saline) at 75ml/hr\n- Acetaminophen 500mg q6h PRN for fever\n\n**Auxiliary Examination Reports:**\n- CBC: WBC 15,000/uL\n- Urinalysis: Positive for WBCs, Positive for bacteria\n- Urine culture: E. coli\n\n**Temperature Chart:**\n- Day 1: Temp 38.8°C, Pulse 90 bpm, Resp 18/min, BP 140/85 mmHg.\n- Day 2: Temp 37.5°C, Pulse 84 bpm, Resp 18/min, BP 135/80 mmHg.\n\n**Blood Transfusion Consent:**\nNot applicable.\n\n**Special Examination Consent:**\nNot applicable.\n\n**Critical Condition Notice:**\nNot applicable.",
    "qa_fact_based": [
        {
            "question type": "Factual Question",
            "question": "According to the hospitalization records of Indianola General Hospital, what is C. Cruz's initial diagnosis?",
            "answer": "Acute Pyelonephritis.",
            "ref": [
                "**Preliminary Diagnosis:**",
                "Acute Pyelonephritis"
            ]
        },
        {
            "question type": "Factual Question",
            "question": "According to the hospitalization records of Indianola General Hospital, what is C. Cruz's chief complaint?",
            "answer": "Fever, chills, back pain for 2 days.",
            "ref": [
                "**Chief Complaint:**",
                "Fever, chills, back pain for 2 days"
            ]
        },
        {
            "question type": "Factual Question",
            "question": "According to the hospitalization records of Indianola General Hospital, what is C. Cruz's age?",
            "answer": "65.",
            "ref": [
                "Age: 65"
            ]
        },
        {
            "question type": "Factual Question",
            "question": "According to the hospitalization records of Indianola General Hospital, what is C. Cruz's gender?",
            "answer": "Female.",
            "ref": [
                "Gender: female"
            ]
        }
    ],
    "qa_multi_hop": [
        {
            "question type": "Multi-hop Reasoning Question",
            "question": "According to the hospitalization records of Indianola General Hospital, how many auxiliary examinations did C. Cruz undergo?",
            "answer": "According to the records, C. Cruz underwent 2 auxiliary examinations, namely urinalysis and CBC.",
            "ref": [
                "**Auxiliary Examination:**",
                "- Urinalysis: Shows pyuria and bacteriuria.",
                "- CBC: Shows elevated WBC count."
            ]
        }
    ],
    "qa_summary": [
        {
            "question type": "Summarization Question",
            "question": "According to the hospitalization records of Indianola General Hospital, summarize the present illness of C. Cruz.",
            "answer": "C. Cruz's symptoms started abruptly 2 days ago with high fever and chills while at home. She has severe and constant unilateral back pain on the right side, not relieved by rest, accompanied by nausea and vomiting. She also has fever (38.8°C), urgency, frequent urination with a burning sensation. She took acetaminophen with minimal relief and has no previous treatments or hospital visits for this episode. Her general condition changes include decreased appetite, normal bowel movements, increased urinary frequency, and disturbed sleep due to pain.",
            "ref": [
                "Onset: Symptoms started abruptly 2 days ago with high fever and chills while at home.",
                "Main Symptoms: Unilateral back pain on the right side, severe and constant, not relieved by rest, accompanied by nausea and vomiting.",
                "Accompanying Symptoms: Fever (38.8°C), urgency, frequent urination with burning sensation.",
                "Diagnosis and Treatment History: Took acetaminophen with minimal relief.",
                "No previous treatments or hospital visits for this episode.",
                "General Condition Changes: Decreased appetite, normal bowel movements, increased urinary frequency, disturbed sleep due to pain."
            ]
        },
        {
            "question type": "Summarization Question",
            "question": "According to the hospitalization records of Indianola General Hospital, summarize the past history of C. Cruz.",
            "answer": "C. Cruz is generally healthy with well-managed hypertension for 10 years. She had chickenpox during childhood and is up to date with routine vaccinations. She had an appendectomy at age 30 and has no history of blood transfusion or known allergies.",
            "ref": [
                "General Health Condition: Generally healthy, with well-managed hypertension.",
                "Disease History: Hypertension for 10 years.",
                "Infectious Disease History: Chickenpox during childhood.",
                "Immunization History: Up to date with routine vaccinations.",
                "Surgery and Trauma History: Appendectomy at age 30.",
                "Blood Transfusion History: No history of blood transfusion.",
                "Allergy History: No known allergies."
            ]
        },
        {
            "question type": "Summarization Question",
            "question": "According to the hospitalization records of Indianola General Hospital, summarize the physical examination findings of C. Cruz.",
            "answer": "C. Cruz's general condition includes a temperature of 38.8°C, pulse of 90 bpm, respiration of 18 breaths/min, and blood pressure of 140/85 mmHg. Systematic examination findings include no rashes or lesions on the skin, moist mucous membranes with no pallor, cyanosis, or jaundice, no enlargement of lymph nodes, no abnormalities in the head and organs, a supple neck with no jugular vein distention, clear breath sounds, normal heart sounds, a soft and non-tender abdomen with no organomegaly, tenderness over the right lumbar area of the spine, no edema in the limbs, normal range of motion, and no focal neurological deficits.",
            "ref": [
                "General Condition:",
                "- Temperature: 38.8°C",
                "- Pulse: 90 bpm",
                "- Respiration: 18 breaths/min",
                "- Blood Pressure: 140/85 mmHg",
                "Systematic Examination:",
                "- Skin: No rashes or lesions.",
                "- Mucous Membranes: Moist, no pallor, cyanosis, or jaundice.",
                "- Lymph Nodes: No enlargement detected.",
                "- Head and Organs: No abnormalities.",
                "- Neck: Supple, no jugular vein distention.",
                "- Chest: Clear breath sounds, normal heart sounds.",
                "- Abdomen: Soft, non-tender, no organomegaly.",
                "- Spine: Tenderness over the right lumbar area.",
                "- Limbs: No edema, normal range of motion.",
                "- Nervous System: No focal neurological deficits."
            ]
        }
    ]
}