{
    "Hospitalization Record": {
        "Basic Information": {
            "Name": "G. Gonzalez",
            "Gender": "female",
            "Age": "42",
            "Ethnicity": "Hispanic",
            "Marital Status": "married",
            "Occupation": "teacher",
            "Address": "5, Belmont street, Oxford",
            "Admission Time": "24th, July",
            "Record Time": "24th, July",
            "Historian": "self",
            "Hospital Name": "Oxford General Hospital"
        },
        "Chief Complaint": "Severe left-sided back pain and hematuria for 2 days",
        "Present Illness": {
            "Onset": "Started 2 days ago at home; sudden onset; no identifiable triggers; progressive worsening of pain",
            "Main Symptoms": "Severe sharp pain in left lower back; radiating to the groin; persistent and unrelenting; worsened by movement; partially alleviated by lying still",
            "Accompanying Symptoms": "Frequent urination, urgency, and visible blood in urine; low-grade fever; occasional chills",
            "Diagnosis and Treatment History": "Visited primary care physician; urinalysis showed hematuria; initial analgesics provided with minimal effect",
            "General Condition Changes": "Reduced appetite and insomnia due to pain; regular bowel movements; slight increase in frequency of urination"
        },
        "Past History": {
            "General Health Condition": "Generally healthy",
            "Disease History": "History of urinary tract infections; no history of chronic diseases",
            "Infectious Disease History": "No significant infectious diseases",
            "Immunization History": "Up-to-date",
            "Surgery and Trauma History": "Appendectomy at age 25",
            "Blood Transfusion History": "None",
            "Allergy History": "No known allergies"
        },
        "Personal History": {
            "Birthplace": "Madrid, Spain",
            "Residence": "Oxford, UK",
            "Living Habits": "Non-smoker, occasional alcohol consumption, balanced diet, regular exercise",
            "Occupation and Working Conditions": "High school teacher; moderate stress environment",
            "Exposure History": "No known exposure to industrial toxins, dust, or radioactive substances",
            "Travel History": "Visited Spain last month; no recent travel to areas with high risk of infections"
        },
        "Marital and Family History": {
            "Marital History": {
                "Marital Status": "Married",
                "Marriage Age": "30",
                "Spouse's Health Condition": "Good health",
                "Children's Condition": "Two children, both in good health"
            },
            "Menstrual History": {
                "Menarche Age": "13",
                "Menstruation Duration": "5 days",
                "Menstruation Interval": "28 days",
                "Last Menstruation": "15th, July",
                "Menstrual Volume": "Normal",
                "Dysmenorrhea": "Occasional mild"
            },
            "Family History": "Father has hypertension; mother has diabetes; no family history of urinary tract stones"
        },
        "Physical Examination": {
            "General Condition": {
                "Temperature": "37.6°C",
                "Pulse": "90 bpm",
                "Respiration": "18 breaths/min",
                "Blood Pressure": "130/85 mmHg"
            },
            "Systematic Examination": {
                "Skin": "Normal, no rashes",
                "Mucous Membranes": "Moist, no pallor or jaundice",
                "Lymph Nodes": "No enlargement detected",
                "Head and Organs": "Normal, no abnormalities",
                "Neck": "Supple, no masses",
                "Chest": "Normal heart sounds, no murmurs; clear lungs on auscultation",
                "Abdomen": "Tenderness in left flank; no hepatosplenomegaly",
                "Rectum and Anus": "Not examined",
                "External Genitalia": "Normal",
                "Spine": "Normal alignment, no tenderness",
                "Limbs": "No edema, full range of motion",
                "Nervous System": "Alert and oriented, normal reflexes"
            }
        },
        "Specialist Examination": "Costovertebral angle tenderness noted on left side",
        "Auxiliary Examination": "CT scan of abdomen shows left renal calculi; urinalysis shows hematuria and pyuria",
        "Preliminary Diagnosis": "1. Urinary Tract Stones (Left Renal Calculi) 2. Hematuria",
        "Diagnostic Basis": "History of severe back pain radiating to groin, hematuria, fever, and objective findings from urinalysis and CT scan",
        "Differential Diagnosis": "Peritonitis - ruled out by lack of rebound tenderness and guarding; Cholecystitis - no right upper quadrant pain or gallstones; Intestinal obstruction - no distention or typical bowel sounds; Pancreatitis - no epigastric pain or elevated serum lipase/amylase",
        "Admission Records": {
            "Physician's Signature": "Dr. J. Smith"
        },
        "Post-Admission Course Records": {
            "First Course Record": "Patient admitted for severe left back pain and hematuria. CT scan confirmed left renal calculi. Initial treatment includes hydration, analgesics, and monitoring. Differential diagnosis considers urinary tract stones as primary, further tests to rule out other conditions.",
            "Daily Course Records": "Patient's pain managed with analgesics, adequate hydration maintained. Monitoring urine output and hematuria. No new symptoms. Plan is to continue conservative management and reassess.",
            "Senior Physician Rounds Records": "Senior physician concurs with management. Plan includes continued hydration, pain management, and possible urology consult if no improvement.",
            "Difficult Case Discussion Records": "",
            "Handover Records": "Patient stable, pain managed, hematuria present, continue monitoring and conservative treatment.",
            "Transfer Records": "",
            "Stage Summary": "Patient’s condition stable, pain under control with medication, no signs of infection. Hematuria persists but improving.",
            "Emergency Records": "",
            "Invasive Procedure Records": "",
            "Consultation Records": "Urology consult recommended if pain and hematuria persist beyond 72 hours.",
            "Discharge Records": "",
            "Critically Ill Patient Care Records": ""
        },
        "Medical Orders": {
            "Long-term Orders": "1. Hydration therapy 2. Analgesics as needed 3. Monitor urine output and hematuria 4. CT scan if no improvement",
            "Temporary Orders": "1. Urinalysis daily 2. Blood work to monitor renal function"
        },
        "Auxiliary Examination Reports": "Urinalysis shows persistent hematuria. CT scan confirmed left renal calculi measuring 5mm.",
        "Temperature Chart": "Temperature consistently between 37.5°C and 37.8°C; pulse and respiration within normal ranges; blood pressure stable.",
        "Blood Transfusion Consent": "",
        "Special Examination Consent": "",
        "Critical Condition Notice": ""
    },
    "DiseaseType": {
        "Diseases of the Genitourinary System": {
            "Name": "Urinary Tract Stones",
            "Symptoms": "Pain, hematuria, frequent urination, urgency, fever, chills",
            "Differential Diagnosis": "Peritonitis, cholecystitis, intestinal obstruction, pancreatitis."
        }
    },
    "Generated Article": "Hospitalization Record\n\nBasic Information:\nName: G. Gonzalez\nGender: female\nAge: 42\nEthnicity: Hispanic\nMarital Status: married\nOccupation: teacher\nAddress: 5, Belmont street, Oxford\nAdmission Time: 24th, July\nRecord Time: 24th, July\nHistorian: self\nHospital Name: Oxford General Hospital\n\nChief Complaint:\nSevere left-sided back pain and hematuria for 2 days\n\nPresent Illness:\nOnset: Started 2 days ago at home; sudden onset; no identifiable triggers; progressive worsening of pain\nMain Symptoms: Severe sharp pain in left lower back; radiating to the groin; persistent and unrelenting; worsened by movement; partially alleviated by lying still\nAccompanying Symptoms: Frequent urination, urgency, and visible blood in urine; low-grade fever; occasional chills\nDiagnosis and Treatment History: Visited primary care physician; urinalysis showed hematuria; initial analgesics provided with minimal effect\nGeneral Condition Changes: Reduced appetite and insomnia due to pain; regular bowel movements; slight increase in frequency of urination\n\nPast History:\nGeneral Health Condition: Generally healthy\nDisease History: History of urinary tract infections; no history of chronic diseases\nInfectious Disease History: No significant infectious diseases\nImmunization History: Up-to-date\nSurgery and Trauma History: Appendectomy at age 25\nBlood Transfusion History: None\nAllergy History: No known allergies\n\nPersonal History:\nBirthplace: Madrid, Spain\nResidence: Oxford, UK\nLiving Habits: Non-smoker, occasional alcohol consumption, balanced diet, regular exercise\nOccupation and Working Conditions: High school teacher; moderate stress environment\nExposure History: No known exposure to industrial toxins, dust, or radioactive substances\nTravel History: Visited Spain last month; no recent travel to areas with high risk of infections\n\nMarital and Family History:\nMarital History:\nMarital Status: Married\nMarriage Age: 30\nSpouse's Health Condition: Good health\nChildren's Condition: Two children, both in good health\nMenstrual History:\nMenarche Age: 13\nMenstruation Duration: 5 days\nMenstruation Interval: 28 days\nLast Menstruation: 15th, July\nMenstrual Volume: Normal\nDysmenorrhea: Occasional mild\nFamily History: Father has hypertension; mother has diabetes; no family history of urinary tract stones\n\nPhysical Examination:\nGeneral Condition:\nTemperature: 37.6°C\nPulse: 90 bpm\nRespiration: 18 breaths/min\nBlood Pressure: 130/85 mmHg\nSystematic Examination:\nSkin: Normal, no rashes\nMucous Membranes: Moist, no pallor or jaundice\nLymph Nodes: No enlargement detected\nHead and Organs: Normal, no abnormalities\nNeck: Supple, no masses\nChest: Normal heart sounds, no murmurs; clear lungs on auscultation\nAbdomen: Tenderness in left flank; no hepatosplenomegaly\nRectum and Anus: Not examined\nExternal Genitalia: Normal\nSpine: Normal alignment, no tenderness\nLimbs: No edema, full range of motion\nNervous System: Alert and oriented, normal reflexes\n\nSpecialist Examination:\nCostovertebral angle tenderness noted on left side\n\nAuxiliary Examination:\nCT scan of abdomen shows left renal calculi; urinalysis shows hematuria and pyuria\n\nPreliminary Diagnosis:\n1. Urinary Tract Stones (Left Renal Calculi)\n2. Hematuria\n\nDiagnostic Basis:\nHistory of severe back pain radiating to groin, hematuria, fever, and objective findings from urinalysis and CT scan\n\nDifferential Diagnosis:\nPeritonitis - ruled out by lack of rebound tenderness and guarding;\nCholecystitis - no right upper quadrant pain or gallstones;\nIntestinal obstruction - no distention or typical bowel sounds;\nPancreatitis - no epigastric pain or elevated serum lipase/amylase\n\nAdmission Records:\nPhysician's Signature: Dr. J. Smith\n\nPost-Admission Course Records:\nFirst Course Record: Patient admitted for severe left back pain and hematuria. CT scan confirmed left renal calculi. Initial treatment includes hydration, analgesics, and monitoring. Differential diagnosis considers urinary tract stones as primary, further tests to rule out other conditions.\nDaily Course Records: Patient's pain managed with analgesics, adequate hydration maintained. Monitoring urine output and hematuria. No new symptoms. Plan is to continue conservative management and reassess.\nSenior Physician Rounds Records: Senior physician concurs with management. Plan includes continued hydration, pain management, and possible urology consult if no improvement.\nDifficult Case Discussion Records:\nHandover Records: Patient stable, pain managed, hematuria present, continue monitoring and conservative treatment.\nTransfer Records:\nStage Summary: Patient’s condition stable, pain under control with medication, no signs of infection. Hematuria persists but improving.\nEmergency Records:\nInvasive Procedure Records:\nConsultation Records: Urology consult recommended if pain and hematuria persist beyond 72 hours.\nDischarge Records:\nCritically Ill Patient Care Records:\n\nMedical Orders:\nLong-term Orders:\n1. Hydration therapy\n2. Analgesics as needed\n3. Monitor urine output and hematuria\n4. CT scan if no improvement\nTemporary Orders:\n1. Urinalysis daily\n2. Blood work to monitor renal function\n\nAuxiliary Examination Reports:\nUrinalysis shows persistent hematuria. CT scan confirmed left renal calculi measuring 5mm.\n\nTemperature Chart:\nTemperature consistently between 37.5°C and 37.8°C; pulse and respiration within normal ranges; blood pressure stable.\n\nBlood Transfusion Consent:\nSpecial Examination Consent:\nCritical Condition Notice:",
    "qa_fact_based": [
        {
            "question type": "Factual Question",
            "question": "According to the hospitalization records of Oxford General Hospital, what is G. Gonzalez's chief complaint?",
            "answer": "Severe left-sided back pain and hematuria for 2 days",
            "ref": [
                "Chief Complaint:",
                "Severe left-sided back pain and hematuria for 2 days"
            ]
        },
        {
            "question type": "Factual Question",
            "question": "According to the hospitalization records of Oxford General Hospital, what is the temperature of G. Gonzalez during the physical examination?",
            "answer": "37.6°C",
            "ref": [
                "Temperature: 37.6°C"
            ]
        },
        {
            "question type": "Factual Question",
            "question": "According to the hospitalization records of Oxford General Hospital, what is the result of the CT scan of G. Gonzalez's abdomen?",
            "answer": "Left renal calculi",
            "ref": [
                "CT scan of abdomen shows left renal calculi; urinalysis shows hematuria and pyuria",
                "CT scan confirmed left renal calculi.",
                "CT scan confirmed left renal calculi measuring 5mm."
            ]
        },
        {
            "question type": "Factual Question",
            "question": "According to the hospitalization records of Oxford General Hospital, what is the marital status of G. Gonzalez?",
            "answer": "married",
            "ref": [
                "Marital Status: married"
            ]
        }
    ],
    "qa_multi_hop": [
        {
            "question type": "Multi-hop Reasoning Question",
            "question": "According to the hospitalization records of Oxford General Hospital, how many auxiliary examinations did G. Gonzalez undergo?",
            "answer": "According to the records, G. Gonzalez underwent 2 auxiliary examinations, namely urinalysis and a CT scan of the abdomen.",
            "ref": [
                "CT scan of abdomen shows left renal calculi; urinalysis shows hematuria and pyuria",
                "CT scan confirmed left renal calculi.",
                "Urinalysis shows persistent hematuria.",
                "CT scan confirmed left renal calculi measuring 5mm."
            ]
        }
    ],
    "qa_summary": [
        {
            "question type": "Summarization Question",
            "question": "According to the hospitalization records of Oxford General Hospital, summarize the present illness of G. Gonzalez.",
            "answer": "The illness started 2 days ago at home with a sudden onset and no identifiable triggers. The main symptoms include severe sharp pain in the left lower back radiating to the groin, persistent and unrelenting, worsened by movement, and partially alleviated by lying still. Accompanying symptoms are frequent urination, urgency, visible blood in urine, low-grade fever, and occasional chills. She visited a primary care physician, where urinalysis showed hematuria, and initial analgesics provided minimal effect. Her general condition includes reduced appetite and insomnia due to pain, regular bowel movements, and a slight increase in the frequency of urination.",
            "ref": [
                "Present Illness:",
                "Onset: Started 2 days ago at home; sudden onset; no identifiable triggers; progressive worsening of pain",
                "Main Symptoms: Severe sharp pain in left lower back; radiating to the groin; persistent and unrelenting; worsened by movement; partially alleviated by lying still",
                "Accompanying Symptoms: Frequent urination, urgency, and visible blood in urine; low-grade fever; occasional chills",
                "Diagnosis and Treatment History: Visited primary care physician; urinalysis showed hematuria; initial analgesics provided with minimal effect",
                "General Condition Changes: Reduced appetite and insomnia due to pain; regular bowel movements; slight increase in frequency of urination"
            ]
        },
        {
            "question type": "Summarization Question",
            "question": "According to the hospitalization records of Oxford General Hospital, summarize the past medical history of G. Gonzalez.",
            "answer": "G. Gonzalez is generally healthy with a history of urinary tract infections and no chronic diseases. She has no significant infectious diseases and is up-to-date on immunizations. She had an appendectomy at age 25 and has no history of blood transfusions or known allergies.",
            "ref": [
                "Past History:",
                "General Health Condition: Generally healthy",
                "Disease History: History of urinary tract infections; no history of chronic diseases",
                "Infectious Disease History: No significant infectious diseases",
                "Immunization History: Up-to-date",
                "Surgery and Trauma History: Appendectomy at age 25",
                "Blood Transfusion History: None",
                "Allergy History: No known allergies"
            ]
        },
        {
            "question type": "Summarization Question",
            "question": "According to the hospitalization records of Oxford General Hospital, summarize the physical examination findings of G. Gonzalez.",
            "answer": "G. Gonzalez's general condition includes a temperature of 37.6°C, pulse of 90 bpm, respiration of 18 breaths/min, and blood pressure of 130/85 mmHg. Systematic examination shows normal skin, moist mucous membranes, no lymph node enlargement, normal head and organs, supple neck, normal heart sounds, clear lungs, tenderness in the left flank, normal external genitalia, normal spine alignment, no limb edema, and normal nervous system reflexes. Specialist examination noted costovertebral angle tenderness on the left side.",
            "ref": [
                "Physical Examination:",
                "General Condition:",
                "Temperature: 37.6°C",
                "Pulse: 90 bpm",
                "Respiration: 18 breaths/min",
                "Blood Pressure: 130/85 mmHg",
                "Systematic Examination:",
                "Skin: Normal, no rashes",
                "Mucous Membranes: Moist, no pallor or jaundice",
                "Lymph Nodes: No enlargement detected",
                "Head and Organs: Normal, no abnormalities",
                "Neck: Supple, no masses",
                "Chest: Normal heart sounds, no murmurs; clear lungs on auscultation",
                "Abdomen: Tenderness in left flank; no hepatosplenomegaly",
                "External Genitalia: Normal",
                "Spine: Normal alignment, no tenderness",
                "Limbs: No edema, full range of motion",
                "Nervous System: Alert and oriented, normal reflexes",
                "Costovertebral angle tenderness noted on left side"
            ]
        }
    ]
}