{
    "报告类型": "公司环境与社会责任报告",
    "报告时间": "2020年度",
    "公司信息": {
        "名称": "真实制造有限公司",
        "成立日期": "1998年6月15日",
        "主营业务": "生产高品质家电产品",
        "注册地": "中国上海",
        "上市情况": "已在A股市场上市",
        "行业": "制造"
    },
    "报告内容": [
        {
            "类型": "环境责任",
            "重要事件": [
                {
                    "事件": "采用环境管理系统",
                    "时间": "2020年1月",
                    "描述": "公司实施了环境管理系统（EMS），以提高环境绩效，减少废物产生，并确保合规。",
                    "影响": "增强了公司的环境管理能力和持续改进，提升了合规性和市场认可度。"
                },
                {
                    "事件": "节能减排项目实施",
                    "时间": "2020年3月",
                    "描述": "公司投资实施的节能减排项目，旨在减少能源消耗和温室气体排放。",
                    "影响": "直接减少了公司的能源消耗和碳足迹，提高了能效和环境绩效。"
                },
                {
                    "事件": "投资于碳抵消项目",
                    "时间": "2020年5月",
                    "描述": "公司通过投资林业项目和风力发电项目来抵消其碳排放，努力实现碳中和目标。",
                    "影响": "通过碳抵消证书，公司能够向利益相关者展示其对环境的承诺和责任。"
                },
                {
                    "事件": "绿色产品开发",
                    "时间": "2020年7月",
                    "描述": "公司开发了一款名为“绿能之家”的环保型家电产品，减少对环境的影响。",
                    "影响": "提升了产品的市场竞争力和品牌形象，同时减少了环境影响。"
                },
                {
                    "事件": "环境漏油事故",
                    "时间": "2020年9月",
                    "描述": "公司生产车间发生了一起意外漏油事故，造成环境污染。",
                    "影响": "公司要承担环境污染治理和赔偿责任，对其声誉和财务状况产生一定影响。"
                },
                {
                    "事件": "防止污染设施的建设",
                    "时间": "2020年12月",
                    "描述": "公司在已有基础上，建立起了全新的废水处理系统和排放控制设备，以减少环境污染。",
                    "影响": "显著降低了公司的环境污染水平，增强了合规性和社会责任感。"
                }
            ],
            "涉及的指标": [
                {
                    "指标": "二氧化碳排放量",
                    "描述": "公司在生产过程中产生的二氧化碳总量。",
                    "影响因素": [
                        "生产规模的变化",
                        "节能技术的应用"
                    ],
                    "值": "100万吨"
                },
                {
                    "指标": "能源消耗",
                    "描述": "公司在运营过程中消耗的能源总量。",
                    "影响因素": [
                        "生产效率的提高",
                        "能源管理措施的实施"
                    ],
                    "值": "5000万立方米天然气"
                }
            ]
        },
        {
            "类型": "社会责任",
            "重要事件": [
                {
                    "事件": "参与慈善活动",
                    "时间": "2020年3月",
                    "描述": "公司资助当地的福利院，为贫困老人和孤儿提供食物和生活用品等帮助。",
                    "影响": "提高了公司的社会形象和品牌认知，加强了与社区的联系和支持。"
                },
                {
                    "事件": "员工健康与安全计划",
                    "时间": "2020年6月",
                    "描述": "公司加强了工作场所的卫生和安全管理，提供个人防护装备和健康检查等措施。",
                    "影响": "显著改善了工作环境，减少了工伤事故，提高了员工的健康与安全水平。"
                },
                {
                    "事件": "参与公共服务项目",
                    "时间": "2020年8月",
                    "描述": "公司投资建设公园绿化，改善城市环境，提升居民的生活质量。",
                    "影响": "促进了社区的可持续发展，增强了公众对公司的积极感知。"
                },
                {
                    "事件": "劳资纠纷",
                    "时间": "2020年10月",
                    "描述": "公司与员工发生劳资纠纷，导致员工罢工要求提高工资和改善待遇。",
                    "影响": "公司需要与工会进行谈判，调整员工福利待遇，可能对公司财务状况造成压力。"
                },
                {
                    "事件": "社区支持和发展项目",
                    "时间": "2020年11月",
                    "描述": "公司投资当地的学校和医院建设，促进教育和医疗水平的提升。",
                    "影响": "加深了公司与社区的联系，促进了社区的整体福祉和发展。"
                },
                {
                    "事件": "员工职业成长和人才发展计划",
                    "时间": "2020年12月",
                    "描述": "公司开展了一系列培训项目，包括技能提升、管理能力培养等，支持员工职业发展。",
                    "影响": "提高了员工的专业技能和工作满意度，促进了人才的留存和发展。"
                }
            ],
            "涉及的指标": [
                {
                    "指标": "员工满意度",
                    "描述": "通过调查得到的员工对公司环境和政策满意度的度量。",
                    "影响因素": [
                        "工作环境的改善",
                        "员工福利政策的调整"
                    ],
                    "值": "85%"
                },
                {
                    "指标": "社区投资额",
                    "描述": "公司在社区发展项目上的投资总额。",
                    "影响因素": [
                        "公司的财务状况",
                        "社会责任战略的变化"
                    ],
                    "值": "1000万元"
                }
            ]
        }
    ],
    "额外信息": [
        {
            "名称": "未来展望",
            "内容": [
                {
                    "名称": "环境保护计划",
                    "描述": "采取一系列措施减少其运营对环境的影响，包括进一步提高能源利用效率、推广绿色工艺等。",
                    "影响": ""
                },
                {
                    "名称": "社会责任战略",
                    "描述": "在业务实践中积极履行社会责任，包括促进社区发展、改善员工福利、提供公平就业机会和参与公益活动。",
                    "影响": ""
                },
                {
                    "名称": "可持续发展目标",
                    "描述": "通过整合可持续性原则到业务模型和决策过程中，致力于实现联合国可持续发展目标（SDGs）。",
                    "影响": ""
                }
            ]
        }
    ],
    "生成大纲": "公司环境与社会责任报告大纲\n\n1. 简介\n   - 公司信息\n     - 名称: 真实制造有限公司\n     - 成立日期: 1998年6月15日\n     - 主营业务: 生产高品质家电产品\n     - 注册地: 中国上海\n     - 上市情况: 已在A股市场上市\n     - 行业: 制造\n\n2. 环境责任\n   - 采用环境管理系统\n     - 时间点：2020年1月\n     - 描述：公司实施了环境管理系统（EMS），以提高环境绩效，减少废物产生，并确保合规。\n     - 影响：增强了公司的环境管理能力和持续改进，提升了合规性和市场认可度。\n\n   - 节能减排项目实施\n     - 时间点：2020年3月\n     - 描述：公司投资实施的节能减排项目，旨在减少能源消耗和温室气体排放。\n     - 影响：直接减少了公司的能源消耗和碳足迹，提高了能效和环境绩效。\n\n   - 投资于碳抵消项目\n     - 时间点：2020年5月\n     - 描述：公司通过投资林业项目和风力发电项目来抵消其碳排放，努力实现碳中和目标。\n     - 影响：通过碳抵消证书，公司能够向利益相关者展示其对环境的承诺和责任。\n\n   - 绿色产品开发\n     - 时间点：2020年7月\n     - 描述：公司开发了一款名为“绿能之家”的环保型家电产品，减少对环境的影响。\n     - 影响：提升了产品的市场竞争力和品牌形象，同时减少了环境影响。\n\n   - 环境漏油事故\n     - 时间点：2020年9月\n     - 描述：公司生产车间发生了一起意外漏油事故，造成环境污染。\n     - 影响：公司需要承担环境污染治理和赔偿责任，对其声誉和财务状况产生一定影响。\n\n   - 防止污染设施的建设\n     - 时间点：2020年12月\n     - 描述：公司在已有基础上，建立起了全新的废水处理系统和排放控制设备，以减少环境污染。\n     - 影响：显著降低了公司的环境污染水平，增强了合规性和社会责任感。\n\n   - 涉及的指标：\n     - 二氧化碳排放量：时间点：2020年度，值：100万吨\n     - 能源消耗：时间点：2020年度，值：5000万立方米天然气\n\n3. 社会责任\n   - 参与慈善活动\n     - 时间点：2020年3月\n     - 描述：公司资助当地的福利院，为贫困老人和孤儿提供食物和生活用品等帮助。\n     - 影响：提高了公司的社会形象和品牌认知，加强了与社区的联系和支持。\n\n   - 员工健康与安全计划\n     - 时间点：2020年6月\n     - 描述：公司加强了工作场所的卫生和安全管理，提供个人防护装备和健康检查等措施。\n     - 影响：显著改善了工作环境，减少了工伤事故，提高了员工的健康与安全水平。\n\n   - 参与公共服务项目\n     - 时间点：2020年8月\n     - 描述：公司投资建设公园绿化，改善城市环境，提升居民的生活质量。\n     - 影响：促进了社区的可持续发展，增强了公众对公司的积极感知。\n\n   - 劳资纠纷\n     - 时间点：2020年10月\n     - 描述：公司与员工发生劳资纠纷，导致员工罢工要求提高工资和改善待遇。\n     - 影响：公司需要与工会进行谈判，调整员工福利待遇，可能对公司财务状况造成压力。\n\n   - 社区支持和发展项目\n     - 时间点：2020年11月\n     - 描述：公司投资当地的学校和医院建设，促进教育和医疗水平的提升。\n     - 影响：加深了公司与社区的联系，促进了社区的整体福祉和发展。\n\n   - 员工职业成长和人才发展计划\n     - 时间点：2020年12月\n     - 描述：公司开展了一系列培训项目，包括技能提升、管理能力培养等，支持员工职业发展。\n     - 影响：提高了员工的专业技能和工作满意度，促进了人才的留存和发展。\n\n   - 涉及的指标：\n     - 员工满意度：时间点：2020年度，值：85%\n     - 社区投资额：时间点：2020年度，值：1000万元\n\n4. 未来展望\n   - 环境保护计划\n     - 描述：采取一系列措施减少其运营对环境的影响，包括进一步提高能源利用效率、推广绿色工艺等。\n     - 影响：未给出具体影响。\n\n   - 社会责任战略\n     - 描述：在业务实践中积极履行社会责任，包括促进社区发展、改善员工福利、提供公平就业机会和参与公益活动。\n     - 影响：未给出具体影响。\n\n   - 可持续发展目标\n     - 描述：通过整合可持续性原则到业务模型和决策过程中，致力于实现联合国可持续发展目标（SDGs）。\n     - 影响：未给出具体影响。\n\n以上是真实制造有限公司2020年度公司环境与社会责任报告的大纲，涵盖了重要事件和指标的影响，并展示了公司在环境责任和社会责任方面所取得的成就以及未来的展望。",
    "生成总结": "真实制造有限公司是一家成立于1998年6月15日的中国上海制造公司，主要生产高品质家电产品，已在A股市场上市。",
    "生成文章": "在环境责任方面，公司采用了环境管理系统（EMS）来提高环境绩效，减少废物产生，并确保合规。该系统于2020年1月实施，增强了公司的环境管理能力和持续改进，提升了合规性和市场认可度。\n\n为了减少能源消耗和温室气体排放，公司于2020年3月投资实施了节能减排项目。这一举措直接减少了公司的能源消耗和碳足迹，提高了能效和环境绩效。此外，公司还于2020年5月投资于碳抵消项目，通过投资林业项目和风力发电项目来抵消其碳排放，努力实现碳中和目标。通过碳抵消证书，公司能够向利益相关者展示其对环境的承诺和责任。\n\n公司还注重绿色产品的开发，于2020年7月推出了一款名为“绿能之家”的环保型家电产品，减少对环境的影响。这一举措不仅提升了产品的市场竞争力和品牌形象，同时也减少了环境影响。\n\n然而，公司在2020年9月发生了一起意外漏油事故，造成了环境污染。公司需要承担环境污染治理和赔偿责任，对其声誉和财务状况产生了一定影响。为了防止类似事件再次发生，公司在2020年12月建立起了全新的废水处理系统和排放控制设备，以减少环境污染。这一举措显著降低了公司的环境污染水平，增强了合规性和社会责任感。\n\n在社会责任方面，公司积极参与慈善活动，于2020年3月资助当地的福利院，为贫困老人和孤儿提供食物和生活用品等帮助。这一举措提高了公司的社会形象和品牌认知，加强了与社区的联系和支持。\n\n为了保障员工的健康与安全，公司于2020年6月加强了工作场所的卫生和安全管理，提供个人防护装备和健康检查等措施。这一举措显著改善了工作环境，减少了工伤事故，提高了员工的健康与安全水平。\n\n公司还积极参与公共服务项目，于2020年8月投资建设公园绿化，改善城市环境，提升居民的生活质量。这一举措促进了社区的可持续发展，增强了公众对公司的积极感知。\n\n然而，公司在2020年10月与员工发生劳资纠纷，导致员工罢工要求提高工资和改善待遇。公司需要与工会进行谈判，调整员工福利待遇，可能对公司财务状况造成压力。\n\n为了促进社区的整体福祉和发展，公司于2020年11月投资当地的学校和医院建设，提升教育和医疗水平。这一举措加深了公司与社区的联系，促进了社区的整体福祉和发展。\n\n为了支持员工的职业成长和人才发展，公司于2020年12月开展了一系列培训项目，包括技能提升、管理能力培养等。这一举措提高了员工的专业技能和工作满意度，促进了人才的留存和发展。\n\n在未来展望方面，公司将进一步采取措施减少其运营对环境的影响，包括进一步提高能源利用效率、推广绿色工艺等。公司还将在业务实践中积极履行社会责任，包括促进社区发展、改善员工福利、提供公平就业机会和参与公益活动。通过整合可持续性原则到业务模型和决策过程中，公司致力于实现联合国可持续发展目标（SDGs）。\n\n综上所述，真实制造有限公司在2020年度在环境责任和社会责任方面取得了一系列成就。公司通过采用环境管理系统、实施节能减排项目、投资碳抵消项目和开发绿色产品等措施，提高了环境绩效和合规性。同时，公司积极参与慈善活动、关注员工健康与安全、参与公共服务项目和支持社区发展等，履行了社会责任。未来，公司将继续致力于环境保护和社会责任，实现可持续发展目标。"
}