{
    "报告类型": "公司财务报告",
    "报告时间": "2017年度",
    "公司信息": {
        "名称": "能源巨星有限公司",
        "成立日期": "2005年7月",
        "主营业务": "能源开发与销售",
        "注册地": "美国得克萨斯州",
        "上市情况": "在纽约证券交易所上市",
        "行业": "能源"
    },
    "报告内容": [
        {
            "类型": "财务信息",
            "重要事件": [
                {
                    "事件": "重大资产收购",
                    "时间": "2017年2月",
                    "描述": "公司完成了对绿色新能源公司的资产收购，总价值1亿美元。",
                    "影响": "扩大公司业务范围，增强市场竞争力。",
                    "子事件": [
                        {
                            "事件": "筹备资产收购",
                            "时间": "2016年10月",
                            "描述": "能源巨星公司开始筹备对绿色新能源公司的资产收购。在进行了充分的市场调研和尽职调查后，公司确定了收购目标，并开始商讨收购条件和交易结构。",
                            "影响": "为后续的资产收购奠定了基础，准备了收购所需的信息和方案。"
                        },
                        {
                            "事件": "谈判与交易达成",
                            "时间": "2016年12月",
                            "描述": "能源巨星公司与绿色新能源公司开始正式的谈判，讨论收购价格、交易条款和文件准备等事项。经过几个月的谈判，双方最终达成了一致。",
                            "影响": "确保了双方在交易细节上的相互认可，并且为最终的资产收购实施打下基础。"
                        },
                        {
                            "事件": "法律和财务审查",
                            "时间": "2017年1月",
                            "描述": "能源巨星公司委托专业律师和会计师对绿色新能源公司的法律和财务状况进行全面审查。审查涵盖了公司合规性、财务报表、税务情况、负债和风险等方面。",
                            "影响": "确定了收购目标的法律和财务风险，并为后续交易的决策提供了重要依据。"
                        },
                        {
                            "事件": "内部审批和决策",
                            "时间": "2017年1月",
                            "描述": "能源巨星公司的高层管理层就资产收购事宜进行了内部审批和决策。他们评估了收购对公司战略和财务目标的契合度，并对交易进行了全面的商业和财务分析。",
                            "影响": "确保了收购是符合公司长期战略和利益的重要决策。"
                        },
                        {
                            "事件": "达成资产收购协议",
                            "时间": "2017年2月",
                            "描述": "能源巨星公司与绿色新能源公司正式达成资产收购协议。该协议明确了双方的权益和义务，交易条款和条件，以及交易完成的时间表和程序。",
                            "影响": "为后续的交易程序提供明确的法律依据，并为正式完成资产收购做好准备。"
                        }
                    ]
                },
                {
                    "事件": "大规模融资",
                    "时间": "2017年3月",
                    "描述": "公司进行了一次大规模的融资活动，募集了5亿美元资金。",
                    "影响": "加强了公司的资金实力，支持了公司的扩张和发展。"
                },
                {
                    "事件": "重大股权收购",
                    "时间": "2017年6月",
                    "描述": "公司完成了对太阳能科技有限公司的股权收购，获得了45%的股权。",
                    "影响": "进一步扩大了公司的市场份额，提升了公司的控制力。"
                },
                {
                    "事件": "重大投资",
                    "时间": "2017年8月",
                    "描述": "公司投资了新一期核电站项目，投资金额为2亿美元。",
                    "影响": "进一步拓宽了公司的业务领域，提升了公司的盈利能力。"
                },
                {
                    "事件": "分发股利",
                    "时间": "2017年9月",
                    "描述": "公司决定向股东分发8千万美元股利。",
                    "影响": "回报给股东们的投资，提升了股东的收益。"
                },
                {
                    "事件": "重大亏损",
                    "时间": "2017年10月",
                    "描述": "由于原材料价格上涨和市场需求下滑，公司在某项目上遭受了2亿美元的巨额亏损。",
                    "影响": "影响了公司的盈利能力和业绩表现，需要进一步调整经营策略。"
                },
                {
                    "事件": "资产重组",
                    "时间": "2017年11月",
                    "描述": "公司进行了一次资产重组，优化了公司的业务结构。",
                    "影响": "提高了公司的运营效率，增加了公司的价值。"
                },
                {
                    "事件": "债务重组",
                    "时间": "2017年12月",
                    "描述": "为优化资本结构，公司进行了债务重组，减少了1亿美元负债。",
                    "影响": "改善了公司的财务状况，降低了财务成本。"
                }
            ],
            "涉及的指标": [
                {
                    "指标": "营业收入",
                    "描述": "公司在一定会计期间内的主营业务收入和其他业务收入总额。",
                    "影响因素": [
                        "市场需求",
                        "产品价格变化"
                    ],
                    "值": "2.5亿美元"
                },
                {
                    "指标": "净利润",
                    "描述": "公司在一定会计期间的净收入，即总收入减去总成本和所得税费用后的金额。",
                    "影响因素": [
                        "营业收入",
                        "成本控制",
                        "非经常性损益"
                    ],
                    "值": "4000万美元"
                },
                {
                    "指标": "总资产",
                    "描述": "会计期末，公司所拥有的资产总额。",
                    "影响因素": [
                        "资产收购",
                        "资产处置",
                        "资产重估"
                    ],
                    "值": "10亿美元"
                },
                {
                    "指标": "总负债",
                    "描述": "会计期末，公司所承担并需要偿还的债务总额。",
                    "影响因素": [
                        "新债发行",
                        "债务偿还",
                        "债务重组"
                    ],
                    "值": "5亿美元"
                },
                {
                    "指标": "股东权益",
                    "描述": "会计期末，归属于股东的权益总额。",
                    "影响因素": [
                        "净利润",
                        "股利发放",
                        "资本公积"
                    ],
                    "值": "5亿美元"
                },
                {
                    "指标": "现金流量",
                    "描述": "公司在一定会计期间内的现金流入和流出总和。",
                    "影响因素": [
                        "经营活动",
                        "投资活动",
                        "筹资活动"
                    ],
                    "值": "1000万美元"
                },
                {
                    "指标": "负债比率",
                    "描述": "公司总负债与总资产的比率，反映公司的债务水平。",
                    "影响因素": [
                        "总负债的变化",
                        "总资产的变化"
                    ],
                    "值": "50%"
                },
                {
                    "指标": "资产负债率",
                    "描述": "公司总负债占总资产的百分比，衡量公司财务杠杆的一个指标。",
                    "影响因素": [
                        "资产和负债的增减变化"
                    ],
                    "值": "50%"
                },
                {
                    "指标": "净资产收益率",
                    "描述": "反映公司股东权益的经营效益，即净利润与平均股东权益的比率。",
                    "影响因素": [
                        "净利润的变化",
                        "股东权益的变化"
                    ],
                    "值": "8%"
                }
            ]
        }
    ],
    "额外信息": [
        {
            "名称": "未来展望",
            "内容": [
                {
                    "名称": "财务策略",
                    "描述": "公司未来计划实施的财务策略，包括加强成本控制、提高资本运营效率等。"
                },
                {
                    "名称": "投资计划",
                    "描述": "公司面向未来的投资计划，如加大对新能源技术研发的投入、开拓国际市场等。"
                },
                {
                    "名称": "风险管理",
                    "描述": "公司识别的主要财务风险包括原材料价格波动、行业政策变动等，将通过建立稳健的风险管理体系来应对。"
                }
            ]
        }
    ],
    "生成大纲": "公司财务报告大纲：\n1. 公司概况\n   - 报告类型：公司财务报告\n   - 报告时间：2017年度\n\n2. 财务信息\n   - 营业收入：\n     - 描述：公司在一定会计期间内的主营业务收入和其他业务收入总额。\n     - 影响因素：市场需求、产品价格变化\n     - 值：2.5亿美元\n\n   - 净利润：\n     - 描述：公司在一定会计期间的净收入，即总收入减去总成本和所得税费用后的金额。\n     - 影响因素：营业收入、成本控制、非经常性损益\n     - 值：4000万美元\n\n   - 总资产：\n     - 描述：会计期末，公司所拥有的资产总额。\n     - 影响因素：资产收购、资产处置、资产重估\n     - 值：10亿美元\n\n   - 总负债：\n     - 描述：会计期末，公司所承担并需要偿还的债务总额。\n     - 影响因素：新债发行、债务偿还、债务重组\n     - 值：5亿美元\n\n   - 股东权益：\n     - 描述：会计期末，归属于股东的权益总额。\n     - 影响因素：净利润、股利发放、资本公积\n     - 值：5亿美元\n\n   - 现金流量：\n     - 描述：公司在一定会计期间内的现金流入和流出总和。\n     - 影响因素：经营活动、投资活动、筹资活动\n     - 值：1000万美元\n\n   - 负债比率：\n     - 描述：公司总负债与总资产的比率，反映公司的债务水平。\n     - 影响因素：总负债的变化、总资产的变化\n     - 值：50%\n\n   - 资产负债率：\n     - 描述：公司总负债占总资产的百分比，衡量公司财务杠杆的一个指标。\n     - 影响因素：资产和负债的增减变化\n     - 值：50%\n\n   - 净资产收益率：\n     - 描述：反映公司股东权益的经营效益，即净利润与平均股东权益的比率。\n     - 影响因素：净利润的变化、股东权益的变化\n     - 值：8%\n\n3. 重要事件\n   - 重大资产收购：\n     - 时间：2017年2月\n     - 描述：公司完成了对绿色新能源公司的资产收购，总价值1亿美元。\n     - 影响：扩大公司业务范围，增强市场竞争力。\n\n     - 筹备资产收购：\n       - 时间：2016年10月\n       - 描述：能源巨星公司开始筹备对绿色新能源公司的资产收购。\n       - 影响：为后续的资产收购奠定了基础，准备了收购所需的信息和方案。\n\n     - 谈判与交易达成：\n       - 时间：2016年12月\n       - 描述：能源巨星公司与绿色新能源公司开始正式的谈判。\n       - 影响：确保了双方在交易细节上的相互认可，并为最终的资产收购实施打下基础。\n\n     - 法律和财务审查：\n       - 时间：2017年1月\n       - 描述：能源巨星公司委托专业律师和会计师对绿色新能源公司进行全面审查。\n       - 影响：确定了收购目标的法律和财务风险，并为后续交易的决策提供了重要依据。\n\n     - 内部审批和决策：\n       - 时间：2017年1月\n       - 描述：能源巨星公司的高层管理层就资产收购事宜进行了内部审批和决策。\n       - 影响：确保了收购是符合公司长期战略和利益的重要决策。\n\n     - 达成资产收购协议：\n       - 时间：2017年2月\n       - 描述：能源巨星公司与绿色新能源公司正式达成资产收购协议。\n       - 影响：为后续的交易程序提供明确的法律依据，并为正式完成资产收购做好准备。\n\n   - 其他重要事件：\n     - 大规模融资：\n       - 时间：2017年3月\n       - 描述：公司进行了一次大规模的融资活动，募集了5亿美元资金。\n       - 影响：加强了公司的资金实力，支持了公司的扩张和发展。\n\n     - 重大股权收购：\n       - 时间：2017年6月\n       - 描述：公司完成了对太阳能科技有限公司的股权收购，获得了45%的股权。\n       - 影响：进一步扩大了公司的市场份额，提升了公司的控制力。\n\n     - 重大投资：\n       - 时间：2017年8月\n       - 描述：公司投资了新一期核电站项目，投资金额为2亿美元。\n       - 影响：进一步拓宽了公司的业务领域，提升了公司的盈利能力。\n\n     - 分发股利：\n       - 时间：2017年9月\n       - 描述：公司决定向股东分发8千万美元股利。\n       - 影响：回报给股东们的投资，提升了股东的收益。\n\n     - 重大亏损：\n       - 时间：2017年10月\n       - 描述：由于原材料价格上涨和市场需求下滑，公司在某项目上遭受了2亿美元的巨额亏损。\n       - 影响：影响了公司的盈利能力和业绩表现，需要进一步调整经营策略。\n\n     - 资产重组：\n       - 时间：2017年11月\n       - 描述：公司进行了一次资产重组，优化了公司的业务结构。\n       - 影响：提高了公司的运营效率，增加了公司的价值。\n\n     - 债务重组：\n       - 时间：2017年12月\n       - 描述：为优化资本结构，公司进行了债务重组，减少了1亿美元负债。\n       - 影响：改善了公司的财务状况，降低了财务成本。\n\n4. 未来展望\n   - 财务策略：\n     - 描述：公司未来计划实施的财务策略，包括加强成本控制、提高资本运营效率等。\n\n   - 投资计划：\n     - 描述：公司面向未来的投资计划，如加大对新能源技术研发的投入、开拓国际市场等。\n\n   - 风险管理：\n     - 描述：公司识别的主要财务风险包括原材料价格波动、行业政策变动等，将通过建立稳健的风险管理体系来应对。",
    "生成总结": "能源巨星有限公司是一家成立于2005年7月，总部位于美国得克萨斯州，主营业务为能源开发与销售的能源公司。该公司已在纽约证券交易所上市。",
    "生成文章": "2017年度，能源巨星有限公司的财务表现稳健。营业收入达到2.5亿美元，这主要归因于市场需求的增长和产品价格的变化。公司的净利润为4000万美元，这得益于营业收入的增加、成本的控制以及非经常性损益的影响。总资产达到10亿美元，这是由于公司进行了资产收购、资产处置和资产重估等因素的影响。总负债为5亿美元，这是由于新债发行、债务偿还和债务重组等因素的影响。股东权益为5亿美元，这是由于净利润的增加、股利发放和资本公积的影响。现金流量为1000万美元，这是由于经营活动、投资活动和筹资活动的影响。负债比率为50%，资产负债率为50%，净资产收益率为8%。\n\n在2017年的重要事件中，能源巨星有限公司完成了对绿色新能源公司的资产收购。这次资产收购的总价值为1亿美元，使得公司的业务范围得到了扩大，市场竞争力得到了增强。此外，公司还进行了一次大规模的融资活动，募集了5亿美元资金，加强了公司的资金实力，支持了公司的扩张和发展。公司还完成了对太阳能科技有限公司的股权收购，获得了45%的股权，进一步扩大了公司的市场份额，提升了公司的控制力。此外，公司还投资了新一期核电站项目，投资金额为2亿美元，进一步拓宽了公司的业务领域，提升了公司的盈利能力。\n\n然而，公司也面临着一些挑战。由于原材料价格上涨和市场需求下滑，公司在某项目上遭受了2亿美元的巨额亏损。为了应对这一挑战，公司进行了资产重组，优化了公司的业务结构，提高了公司的运营效率，增加了公司的价值。此外，公司还进行了债务重组，减少了1亿美元负债，改善了公司的财务状况，降低了财务成本。\n\n展望未来，能源巨星有限公司计划实施一系列财务策略，包括加强成本控制、提高资本运营效率等，以进一步提升公司的盈利能力和财务状况。公司还计划加大对新能源技术研发的投入，开拓国际市场，以寻求更多的增长机会。同时，公司也意识到财务风险的存在，主要包括原材料价格波动和行业政策变动等因素，将建立稳健的风险管理体系，以应对可能的风险和挑战。\n\n综上所述，能源巨星有限公司在2017年度取得了稳健的财务表现，并通过资产收购、融资活动和股权收购等重大事件，进一步扩大了业务范围，增强了市场竞争力。公司未来将继续实施财务策略，加大投资力度，并建立稳健的风险管理体系，以保持持续的发展和增长。"
}