{
    "Report Type": "Corporate Financial Report",
    "Report Time": "2017",
    "Company Information": {
        "Name": "Advanced Manufacturing Solutions Inc.",
        "Establishment Date": "August 15, 2005",
        "Main Business": "Advanced Manufacturing Solutions Inc. specializes in the design, development, and manufacturing of high-tech precision tools and equipment for various industries.",
        "Registration Location": "Cityville, Techland",
        "Listing Status": "Publicly Listed",
        "Industry": "Manufacturing"
    },
    "Report Content": [
        {
            "Type": "Financial Information",
            "Significant Events": [
                {
                    "Event": "Asset Restructuring",
                    "Time": "January, 2017",
                    "Description": "Advanced Manufacturing Solutions Inc. successfully underwent an extensive asset restructuring process, strategically optimizing its business structure, and consolidating its operations.",
                    "Impact": "The asset restructuring initiative significantly improved operational efficiency and increased the company's overall value in the market.",
                    "Sub Events": [
                        {
                            "Event": "Expansion into new market",
                            "Time": "March, 2017",
                            "Description": "Advanced Manufacturing Solutions Inc. identified a new market with growth potential and made the strategic decision to expand its operations into this market. The company conducted thorough market research and analysis, identified the target customers, and developed a comprehensive market entry strategy.",
                            "Impact": "The expansion into the new market allowed Advanced Manufacturing Solutions Inc. to tap into a previously untapped customer base and diversify its revenue streams, leading to increased sales and profitability."
                        },
                        {
                            "Event": "Strategic partnership with leading technology firm",
                            "Time": "May, 2017",
                            "Description": "Advanced Manufacturing Solutions Inc. entered into a strategic partnership agreement with a leading technology firm. This partnership aimed to leverage the respective strengths of both companies, including technology expertise, manufacturing capabilities, and market reach. The partnership involved collaboration on research and development projects, joint marketing initiatives, and access to each other's distribution networks.",
                            "Impact": "The strategic partnership strengthened Advanced Manufacturing Solutions Inc.'s position in the market by enhancing its technological capabilities, expanding its product offerings, and increasing its market reach through the network of the technology firm. This resulted in improved competitiveness and growth prospects."
                        },
                        {
                            "Event": "Acquisition of a competitor",
                            "Time": "September, 2017",
                            "Description": "Advanced Manufacturing Solutions Inc. completed the acquisition of one of its competitors. The acquisition aimed to consolidate the market share, eliminate competition, and gain access to the competitor's customer base and intellectual property. Advanced Manufacturing Solutions Inc. conducted thorough due diligence, negotiated the terms of the acquisition, and successfully integrated the acquired company into its operations.",
                            "Impact": "The acquisition of the competitor allowed Advanced Manufacturing Solutions Inc. to expand its market presence, increase its customer base, and benefit from economies of scale. The synergy between the two companies resulted in improved efficiency, reduced costs, and enhanced market position."
                        },
                        {
                            "Event": "Introduction of new product line",
                            "Time": "November, 2017",
                            "Description": "Advanced Manufacturing Solutions Inc. introduced a new product line that catered to a growing market demand. The company invested in research and development, product design, and production facilities to bring the new product line to the market. A comprehensive marketing and advertising campaign was launched to create awareness and generate customer interest.",
                            "Impact": "The introduction of the new product line allowed Advanced Manufacturing Solutions Inc. to capture a larger market share, attract new customers, and generate additional revenue streams. The expansion of the product portfolio also enhanced the company's competitive advantage and strengthened its position in the industry."
                        }
                    ]
                },
                {
                    "Event": "Major Investment",
                    "Time": "March, 2017",
                    "Description": "In March 2017, Advanced Manufacturing Solutions Inc. made a substantial investment in Project Automate, a groundbreaking automated manufacturing technology, totaling $50 million.",
                    "Impact": "This major investment expanded the company's business areas, strengthened its market position, and resulted in enhanced profitability."
                },
                {
                    "Event": "Major Asset Acquisition",
                    "Time": "April, 2017",
                    "Description": "The completion of the asset acquisition of Tech Tools Ltd. in April 2017 marked a significant milestone for Advanced Manufacturing Solutions Inc. with a total value of $80 million.",
                    "Impact": "This acquisition substantially expanded the company's business scope, increased operational capabilities, and enhanced market competitiveness."
                },
                {
                    "Event": "Debt Restructuring",
                    "Time": "June, 2017",
                    "Description": "In alignment with its long-term financial optimization strategy, Advanced Manufacturing Solutions Inc. successfully executed a debt restructuring process in June 2017, reducing liabilities by $30 million.",
                    "Impact": "This strategic decision improved the company's financial condition, reduced financial costs, and enhanced its ability to pursue growth opportunities."
                },
                {
                    "Event": "Dividend Distribution",
                    "Time": "July, 2017",
                    "Description": "To reward its loyal shareholders, Advanced Manufacturing Solutions Inc. declared a dividend distribution of $0.50 per share in July 2017, distributing a total of $20 million to its investors.",
                    "Impact": "The dividend distribution boosted shareholder returns and reflected the company's strong financial performance."
                },
                {
                    "Event": "Significant Equity Acquisition",
                    "Time": "October, 2017",
                    "Description": "Advanced Manufacturing Solutions Inc. successfully completed the acquisition of 30% equity of Precision Components Ltd., a renowned manufacturer of high-precision components.",
                    "Impact": "This substantial equity acquisition further expanded the company's market share, enhanced its control over market dynamics, and strengthened its overall market position."
                },
                {
                    "Event": "Large-scale Financing",
                    "Time": "December, 2017",
                    "Description": "In December 2017, Advanced Manufacturing Solutions Inc. conducted a highly successful large-scale financing activity, successfully raising $100 million in funds through the issuance of corporate bonds.",
                    "Impact": "The large-scale financing significantly bolstered the company's financial strength, providing ample resources to support its expansion and development plans."
                }
            ],
            "Involved Indicators": [
                {
                    "Indicator": "Operating Income",
                    "Description": "The total amount of main business income and other business income within a certain accounting period.",
                    "Influencing Factors": [
                        "Market Demand",
                        "Changes in Product Prices"
                    ],
                    "Value": "$450 million"
                },
                {
                    "Indicator": "Net Profit",
                    "Description": "The net income of the company within a certain accounting period, i.e., total income minus total costs and taxes.",
                    "Influencing Factors": [
                        "Operating Income",
                        "Cost Control",
                        "Non-recurring Gains and Losses"
                    ],
                    "Value": "$60 million"
                },
                {
                    "Indicator": "Total Assets",
                    "Description": "The total amount of assets owned by the company at the end of the accounting period.",
                    "Influencing Factors": [
                        "Asset Acquisition",
                        "Asset Disposal",
                        "Asset Revaluation"
                    ],
                    "Value": "$800 million"
                },
                {
                    "Indicator": "Total Liabilities",
                    "Description": "The total amount of debts the company is obligated to repay at the end of the accounting period.",
                    "Influencing Factors": [
                        "New Debt Issuance",
                        "Debt Repayment",
                        "Debt Restructuring"
                    ],
                    "Value": "$300 million"
                },
                {
                    "Indicator": "Shareholder Equity",
                    "Description": "The total amount of equity belonging to shareholders at the end of the accounting period.",
                    "Influencing Factors": [
                        "Net Profit",
                        "Dividend Distribution",
                        "Capital Reserves"
                    ],
                    "Value": "$500 million"
                },
                {
                    "Indicator": "Cash Flow",
                    "Description": "The total cash inflows and outflows of the company within a certain accounting period.",
                    "Influencing Factors": [
                        "Operating Activities",
                        "Investment Activities",
                        "Financing Activities"
                    ],
                    "Value": "$80 million"
                },
                {
                    "Indicator": "Debt Ratio",
                    "Description": "The ratio of total liabilities to total assets, reflecting the company's debt level.",
                    "Influencing Factors": [
                        "Changes in Total Liabilities",
                        "Changes in Total Assets"
                    ],
                    "Value": "0.375"
                },
                {
                    "Indicator": "Debt to Assets Ratio",
                    "Description": "The percentage of total liabilities to total assets, a measure of the company's financial leverage.",
                    "Influencing Factors": [
                        "Increases or decreases in assets and liabilities"
                    ],
                    "Value": "37.5%"
                },
                {
                    "Indicator": "Return on Equity",
                    "Description": "Reflects the operational efficiency of shareholder equity, namely the ratio of net profit to average shareholder equity.",
                    "Influencing Factors": [
                        "Change in Net Profit",
                        "Change in Shareholder Equity"
                    ],
                    "Value": "12%"
                }
            ]
        }
    ],
    "Additional Information": [
        {
            "Name": "Future Outlook",
            "Content": [
                {
                    "Name": "Financial Strategy",
                    "Description": "Advanced Manufacturing Solutions Inc. plans to implement a comprehensive financial strategy focused on effective cost control measures and prudent capital operations to drive sustainable growth and increased profitability."
                },
                {
                    "Name": "Investment Plans",
                    "Description": "The company is committed to ongoing investment in research and development initiatives to drive product innovation and market expansion. Additionally, Advanced Manufacturing Solutions Inc. plans to invest in advanced production technologies to remain at the forefront of the manufacturing industry."
                },
                {
                    "Name": "Risk Management",
                    "Description": "Advanced Manufacturing Solutions Inc. has identified potential financial risks and implemented proactive risk management strategies. These include diversifying its customer base, closely monitoring market trends, and maintaining adequate cash reserves to mitigate any adverse impacts."
                }
            ]
        }
    ],
    "Generated Outline": "I. Introduction\n   A. Background information about Advanced Manufacturing Solutions Inc.\n      1. Name: Advanced Manufacturing Solutions Inc.\n      2. Establishment Date: August 15, 2005\n      3. Main Business: Design, development, and manufacturing of high-tech precision tools and equipment\n      4. Registration Location: Cityville, Techland\n      5. Listing Status: Publicly Listed\n      6. Industry: Manufacturing\n\nII. Financial Information (2017)\n   A. Asset Restructuring (January, 2017)\n      1. Event description: Extensive asset restructuring process to consolidate operations\n      2. Impact: Improved operational efficiency and increased overall value\n      3. Expansion into new market (March, 2017)\n         - Market research, target customer identification, and market entry strategy development\n         - Impact: Tapped into a new customer base and diversified revenue streams\n      4. Strategic partnership with leading technology firm (May, 2017)\n         - Collaboration on R&D projects, joint marketing initiatives, and access to distribution networks\n         - Impact: Strengthened position in the market with enhanced technological capabilities, expanded product offerings, and increased market reach\n      5. Acquisition of a competitor (September, 2017)\n         - Due diligence, negotiation, and successful integration of the acquired company\n         - Impact: Expanded market presence, increased customer base, and improved efficiency\n      6. Introduction of new product line (November, 2017)\n         - Investment in R&D, product design, and production facilities\n         - Impact: Captured a larger market share, attracted new customers, and enhanced competitiveness\n\n   B. Major Investment (March, 2017)\n      - Investment in Project Automate, a groundbreaking automated manufacturing technology ($50 million)\n      - Impact: Expanded business areas, strengthened market position, and enhanced profitability\n\n   C. Major Asset Acquisition (April, 2017)\n      - Asset acquisition of Tech Tools Ltd. ($80 million)\n      - Impact: Expanded business scope, increased operational capabilities, and enhanced market competitiveness\n\n   D. Debt Restructuring (June, 2017)\n      - Successful execution of debt restructuring process reducing liabilities by $30 million\n      - Impact: Improved financial condition, reduced financial costs, and enhanced growth opportunities\n\n   E. Dividend Distribution (July, 2017)\n      - Declaration of dividend distribution of $0.50 per share, totaling $20 million\n      - Impact: Boosted shareholder returns and reflected strong financial performance\n\n   F. Significant Equity Acquisition (October, 2017)\n      - Acquisition of 30% equity of Precision Components Ltd., a renowned manufacturer\n      - Impact: Expanded market share, enhanced control over market dynamics, and strengthened overall market position\n\n   G. Large-scale Financing (December, 2017)\n      - Successful raising of $100 million through corporate bond issuance\n      - Impact: Strengthened financial strength to support expansion and development plans\n\nIII. Involved Indicators\n   A. Operating Income ($450 million)\n      - Description: Total amount of main business income and other business income\n      - Influencing Factors: Market demand, changes in product prices\n\n   B. Net Profit ($60 million)\n      - Description: Net income of the company within a certain accounting period\n      - Influencing Factors: Operating income, cost control, non-recurring gains and losses\n\n   C. Total Assets ($800 million)\n      - Description: Total amount of assets owned by the company at the end of the accounting period\n      - Influencing Factors: Asset acquisition, asset disposal, asset revaluation\n\n   D. Total Liabilities ($300 million)\n      - Description: Total amount of debts the company is obligated to repay\n      - Influencing Factors: New debt issuance, debt repayment, debt restructuring\n\n   E. Shareholder Equity ($500 million)\n      - Description: Total amount of equity belonging to shareholders at the end of the accounting period\n      - Influencing Factors: Net profit, dividend distribution, capital reserves\n\n   F. Cash Flow ($80 million)\n      - Description: Total cash inflows and outflows within a certain accounting period\n      - Influencing Factors: Operating activities, investment activities, financing activities\n\n   G. Debt Ratio (0.375)\n      - Description: Ratio of total liabilities to total assets\n      - Influencing Factors: Changes in total liabilities, changes in total assets\n\n   H. Debt to Assets Ratio (37.5%)\n      - Description: Percentage of total liabilities to total assets\n      - Influencing Factors: Increases or decreases in assets and liabilities\n\n   I. Return on Equity (12%)\n      - Description: Ratio of net profit to average shareholder equity\n      - Influencing Factors: Change in net profit, change in shareholder equity\n\nIV. Future Outlook\n   A. Financial Strategy\n      - Implementing comprehensive financial strategy focused on cost control and prudent capital operations for sustainable growth and increased profitability\n\n   B. Investment Plans\n      - Commitment to ongoing investment in R&D to drive product innovation and market expansion\n      - Investments in advanced production technologies to remain at the forefront of the manufacturing industry\n\n   C. Risk Management\n      - Identifying potential financial risks and implementing proactive risk management strategies\n      - Diversifying customer base, monitoring market trends, and maintaining adequate cash reserves\n\nNote: The provided outline covers all the mentioned events, sub-events, indicators, and their related data points as requested.",
    "Generated Summary": "Advanced Manufacturing Solutions Inc., established in August 15, 2005 in Cityville, Techland, is a publicly listed manufacturing company specializing in the design, development, and manufacturing of high-tech precision tools and equipment for various industries.",
    "Generated Article": "In 2017, Advanced Manufacturing Solutions Inc. underwent significant financial developments and strategic initiatives that propelled the company towards growth and success. The year started with an extensive asset restructuring process, aimed at consolidating operations and improving operational efficiency. This restructuring had a positive impact on the company's financial indicators, including operating income, net profit, total assets, and shareholder equity.\n\nIn March 2017, the company made a major investment of $50 million in Project Automate, a groundbreaking automated manufacturing technology. This investment expanded the company's business areas, strengthened its market position, and enhanced profitability. Additionally, in April 2017, Advanced Manufacturing Solutions Inc. acquired Tech Tools Ltd. for $80 million, further expanding its business scope, increasing operational capabilities, and enhancing market competitiveness.\n\nThe company successfully executed a debt restructuring process in June 2017, reducing liabilities by $30 million. This debt restructuring had a significant impact on the company's financial condition, resulting in improved financial strength, reduced financial costs, and enhanced growth opportunities. Furthermore, in July 2017, the company declared a dividend distribution of $0.50 per share, totaling $20 million. This dividend distribution not only boosted shareholder returns but also reflected the company's strong financial performance.\n\nIn October 2017, Advanced Manufacturing Solutions Inc. acquired a 30% equity stake in Precision Components Ltd., a renowned manufacturer. This acquisition expanded the company's market share, enhanced its control over market dynamics, and strengthened its overall market position. Finally, in December 2017, the company successfully raised $100 million through corporate bond issuance, further strengthening its financial strength to support expansion and development plans.\n\nThese financial developments and strategic initiatives had a significant impact on the company's financial indicators. The operating income for 2017 reached $450 million, driven by market demand and changes in product prices. The net profit amounted to $60 million, influenced by the company's operating income, cost control measures, and non-recurring gains and losses. The total assets of the company stood at $800 million, reflecting the impact of asset acquisition, disposal, and revaluation. The total liabilities amounted to $300 million, influenced by new debt issuance, debt repayment, and debt restructuring. The shareholder equity reached $500 million, influenced by the net profit, dividend distribution, and capital reserves. The company generated a cash flow of $80 million, resulting from its operating activities, investment activities, and financing activities.\n\nThe company's debt ratio stood at 0.375, indicating a healthy financial position with a favorable ratio of total liabilities to total assets. The debt to assets ratio was 37.5%, reflecting the percentage of total liabilities to total assets. The return on equity for the company was 12%, indicating a satisfactory return on investment for shareholders.\n\nLooking ahead, Advanced Manufacturing Solutions Inc. is committed to implementing a comprehensive financial strategy focused on cost control and prudent capital operations to ensure sustainable growth and increased profitability. The company plans to continue investing in research and development to drive product innovation and market expansion. Additionally, investments in advanced production technologies will enable the company to remain at the forefront of the manufacturing industry. Risk management will also be a priority, with the company actively identifying potential financial risks and implementing proactive risk management strategies. This includes diversifying the customer base, monitoring market trends, and maintaining adequate cash reserves.\n\nIn conclusion, Advanced Manufacturing Solutions Inc. has experienced significant financial developments and strategic initiatives in 2017, positioning the company for continued growth and success. The company's strong financial indicators, coupled with its commitment to ongoing investment and risk management, bode well for its future prospects in the manufacturing industry."
}