{
    "住院病历": {
        "基本信息": {
            "姓名": "臧某某",
            "性别": "女",
            "年龄": "64岁",
            "民族": "汉族",
            "婚姻状况": "已婚",
            "职业": "退休",
            "住址": "杨柳市珠港街80号",
            "入院时间": "3月3日",
            "记录时间": "3月3日",
            "病史陈述者": "本人",
            "医院名称": "杨柳市人民医院"
        },
        "主诉": "高血压、双下肢水肿1周+蛋白尿2天",
        "现病史": {
            "发病情况": "患者于1周前无明显诱因出现头痛、头晕，自测血压升高（160/100 mmHg），休息后症状无明显缓解。2天前出现双下肢水肿，尿检发现蛋白尿，遂来我院就诊。",
            "主要症状特点": "持续性高血压（160/100 mmHg），双下肢明显水肿，蛋白尿（+++）。症状随时间加重，无明显缓解因素。",
            "伴随症状": "偶尔头晕、头痛，伴轻度乏力。",
            "诊疗经过及结果": "在当地诊所使用降压药物治疗后效果不显，水肿及蛋白尿未见明显好转，故来我院进一步诊治。",
            "一般情况变化": "精神稍差，睡眠欠佳，食欲中等，尿频但无尿急、尿痛，大便正常，近期体重增加约2公斤。"
        },
        "既往史": {
            "一般健康状况": "平素身体健康。",
            "疾病史": "无慢性疾病史。",
            "传染病史": "无传染病史。",
            "预防接种史": "儿时按时接种疫苗。",
            "手术外伤史": "无重大手术及伤残史。",
            "输血史": "无。",
            "过敏史": "无药物及食物过敏史。"
        },
        "个人史": {
            "出生地": "杨柳市",
            "居留地": "杨柳市",
            "生活习惯": "作息规律，饮食清淡，但喜食咸。",
            "职业及工作条件": "退休前在工厂工作，环境较为嘈杂。",
            "接触史": "无有害化学物质、粉尘或放射性物质接触史。",
            "冶游史": "无"
        },
        "婚育史及家族史": {
            "婚育史": {
                "婚姻状况": "已婚",
                "结婚年龄": "26岁",
                "配偶健康状况": "健康",
                "子女情况": "一子一女，健康"
            },
            "月经史": {
                "初潮年龄": "14岁",
                "行经期天数": "5天",
                "间隔天数": "28天",
                "末次月经时间": "52岁",
                "月经量": "中等",
                "痛经情况": "无"
            },
            "家族史": "父母均有高血压史，无其他遗传性疾病。"
        },
        "体格检查": {
            "一般情况": {
                "体温": "36.7℃",
                "脉搏": "78次/分",
                "呼吸": "18次/分",
                "血压": "160/100 mmHg"
            },
            "系统检查": {
                "皮肤": "腻滑，无皮疹",
                "粘膜": "色淡红，无溃疡",
                "淋巴结": "未触及肿大淋巴结",
                "头部及器官": "正常",
                "颈部": "软，无颈静脉怒张",
                "胸部": {
                    "胸廓": "正常",
                    "肺部": "无罗音",
                    "心脏": "心音有力，无杂音",
                    "血管": "无异常"
                },
                "腹部": {
                    "肝": "肝区无压痛",
                    "脾": "未触及肿大"
                },
                "直肠肛门": "未见异常",
                "外生殖器": "无异常",
                "脊柱": "无畸形",
                "四肢": "双下肢轻度水肿",
                "神经系统": "无异常"
            }
        },
        "专科检查": "妇科检查未见明显异常。",
        "辅助检查": "血常规：正常，尿常规：蛋白尿（+++），肾功能：正常，血清电解质：正常，心电图：窦性心律。",
        "初步诊断": "妊娠高血压综合症",
        "诊断依据": "1. 患者有高血压病史，160/100 mmHg；2. 双下肢水肿；3. 尿常规示蛋白尿（+++）。",
        "鉴别诊断": "1. 慢性高血压：患者无高血压史，故排除；2. 子痫前期：无症状提示子痫；3. 慢性高血压合并子痫前期：无慢性高血压史。",
        "入院记录": {
            "医师签名": "张医生"
        },
        "入院后病程记录": {
            "首次病程记录": "患者臧某某，女性，64岁。因“高血压、双下肢水肿1周+蛋白尿2天”入院。初步诊断为妊娠高血压综合症。患者于1周前无明显诱因出现头痛、头晕，自测血压升高，2天前出现双下肢水肿，尿检发现蛋白尿。入院后检查血压160/100 mmHg，尿常规显示蛋白尿（+++）。诊疗计划：控制血压，利尿减轻水肿，监测尿蛋白。",
            "日常病程记录": "患者入院后给予降压治疗，血压控制较平稳，双下肢水肿有所减轻，蛋白尿监测中。",
            "上级医师查房记录": "查房意见：继续密切监测血压及尿蛋白变化，调整治疗方案。",
            "疑难病例讨论记录": "",
            "交（接）班记录": "夜班交班：患者生命体征平稳，无特殊事件发生。",
            "转科记录": "",
            "阶段小结": "患者入院5天，血压已基本控制，双下肢水肿减轻，蛋白尿（+），继续治疗观察。",
            "抢救记录": "",
            "有创诊疗操作记录": "",
            "会诊记录": "",
            "出院记录": "",
            "病重（病危）患者护理记录": ""
        },
        "医嘱": {
            "长期医嘱单": "1. 每日测量血压；2. 控盐饮食；3. 低蛋白饮食。",
            "临时医嘱单": "1. 口服洛沙坦50mg每日一次；2. 口服螺内酯20mg每日一次。"
        },
        "辅助检查报告单": "尿常规、血常规、肾功能、血清电解质、心电图",
        "体温单": "体温：36.7℃、脉搏：78次/分、呼吸：18次/分、血压：160/100 mmHg",
        "输血治疗知情同意书": "",
        "特殊检查同意书": "",
        "病危（重）通知书": ""
    },
    "病种": {
        "妊娠、分娩病及产褥期并发症": {
            "名称": "妊娠高血压综合症",
            "症状": "高血压、水肿、蛋白尿",
            "鉴别诊断": "慢性高血压、子痫前期、慢性高血压合并子痫前期"
        }
    },
    "生成文章": "杨柳市人民医院\n住院病历\n\n基本信息：\n姓名：臧某某\n性别：女\n年龄：64岁\n民族：汉族\n婚姻状况：已婚\n职业：退休\n住址：杨柳市珠港街80号\n入院时间：3月3日\n记录时间：3月3日\n病史陈述者：本人\n医院名称：杨柳市人民医院\n\n主诉：高血压、双下肢水肿1周+蛋白尿2天\n\n现病史：\n患者于1周前无明显诱因出现头痛、头晕，自测血压升高（160/100 mmHg），休息后症状无明显缓解。2天前出现双下肢水肿，尿检发现蛋白尿，遂来我院就诊。\n主要症状特点：持续性高血压（160/100 mmHg），双下肢明显水肿，蛋白尿（+++）。症状随时间加重，无明显缓解因素。\n伴随症状：偶尔头晕、头痛，伴轻度乏力。\n诊疗经过及结果：在当地诊所使用降压药物治疗后效果不显，水肿及蛋白尿未见明显好转，故来我院进一步诊治。\n一般情况变化：精神稍差，睡眠欠佳，食欲中等，尿频但无尿急、尿痛，大便正常，近期体重增加约2公斤。\n\n既往史：\n一般健康状况：平素身体健康。\n疾病史：无慢性疾病史。\n传染病史：无传染病史。\n预防接种史：儿时按时接种疫苗。\n手术外伤史：无重大手术及伤残史。\n输血史：无。\n过敏史：无药物及食物过敏史。\n\n个人史：\n出生地：杨柳市\n居留地：杨柳市\n生活习惯：作息规律，饮食清淡，但喜食咸。\n职业及工作条件：退休前在工厂工作，环境较为嘈杂。\n接触史：无有害化学物质、粉尘或放射性物质接触史。\n冶游史：无\n\n婚育史及家族史：\n婚育史：\n- 婚姻状况：已婚\n- 结婚年龄：26岁\n- 配偶健康状况：健康\n- 子女情况：一子一女，健康\n月经史：\n- 初潮年龄：14岁\n- 行经期天数：5天\n- 间隔天数：28天\n- 末次月经时间：52岁\n- 月经量：中等\n- 痛经情况：无\n家族史：父母均有高血压史，无其他遗传性疾病。\n\n体格检查：\n一般情况：\n- 体温：36.7℃\n- 脉搏：78次/分\n- 呼吸：18次/分\n- 血压：160/100 mmHg\n系统检查：\n- 皮肤：腻滑，无皮疹\n- 粘膜：色淡红，无溃疡\n- 淋巴结：未触及肿大淋巴结\n- 头部及器官：正常\n- 颈部：软，无颈静脉怒张\n- 胸部：\n  - 胸廓：正常\n  - 肺部：无罗音\n  - 心脏：心音有力，无杂音\n  - 血管：无异常\n- 腹部：\n  - 肝：肝区无压痛\n  - 脾：未触及肿大\n- 直肠肛门：未见异常\n- 外生殖器：无异常\n- 脊柱：无畸形\n- 四肢：双下肢轻度水肿\n- 神经系统：无异常\n\n专科检查：妇科检查未见明显异常。\n\n辅助检查：血常规：正常，尿常规：蛋白尿（+++），肾功能：正常，血清电解质：正常，心电图：窦性心律。\n\n初步诊断：妊娠高血压综合症\n诊断依据：\n1. 患者有高血压病史，160/100 mmHg；\n2. 双下肢水肿；\n3. 尿常规示蛋白尿（+++）。\n鉴别诊断：\n1. 慢性高血压：患者无高血压史，故排除；\n2. 子痫前期：无症状提示子痫；\n3. 慢性高血压合并子痫前期：无慢性高血压史。\n\n入院记录：\n医师签名：张医生\n\n入院后病程记录：\n首次病程记录：\n患者臧某某，女性，64岁。因“高血压、双下肢水肿1周+蛋白尿2天”入院。初步诊断为妊娠高血压综合症。患者于1周前无明显诱因出现头痛、头晕，自测血压升高，2天前出现双下肢水肿，尿检发现蛋白尿。入院后检查血压160/100 mmHg，尿常规显示蛋白尿（+++）。诊疗计划：控制血压，利尿减轻水肿，监测尿蛋白。\n日常病程记录：\n患者入院后给予降压治疗，血压控制较平稳，双下肢水肿有所减轻，蛋白尿监测中。\n上级医师查房记录：\n查房意见：继续密切监测血压及尿蛋白变化，调整治疗方案。\n疑难病例讨论记录：\n交（接）班记录：\n夜班交班：患者生命体征平稳，无特殊事件发生。\n转科记录：\n阶段小结：\n患者入院5天，血压已基本控制，双下肢水肿减轻，蛋白尿（+），继续治疗观察。\n抢救记录：\n有创诊疗操作记录：\n会诊记录：\n出院记录：\n病重（病危）患者护理记录：\n\n医嘱：\n长期医嘱单：\n1. 每日测量血压；\n2. 控盐饮食；\n3. 低蛋白饮食。\n临时医嘱单：\n1. 口服洛沙坦50mg每日一次；\n2. 口服螺内酯20mg每日一次。\n\n辅助检查报告单：尿常规、血常规、肾功能、血清电解质、心电图\n\n体温单：体温：36.7℃、脉搏：78次/分、呼吸：18次/分、血压：160/100 mmHg\n\n输血治疗知情同意书：\n特殊检查同意书：\n病危（重）通知书：\n\n病种：\n妊娠、分娩病及产褥期并发症：\n- 名称：妊娠高血压综合症\n- 症状：高血压、水肿、蛋白尿\n- 鉴别诊断：慢性高血压、子痫前期、慢性高血压合并子痫前期\n\n以上病历由张医生于3月3日记录。",
    "qa_fact_based": [
        {
            "问题类型": "事实性问题",
            "问题": "根据杨柳市人民医院的住院病历，臧某某的入院时间是什么时候？",
            "答案": "3月3日",
            "ref": [
                "入院时间：3月3日"
            ]
        },
        {
            "问题类型": "事实性问题",
            "问题": "根据杨柳市人民医院的住院病历，臧某某的病史陈述者是谁？",
            "答案": "本人",
            "ref": [
                "病史陈述者：本人"
            ]
        },
        {
            "问题类型": "事实性问题",
            "问题": "根据杨柳市人民医院的住院病历，臧某某的主诉是什么？",
            "答案": "高血压、双下肢水肿1周+蛋白尿2天",
            "ref": [
                "主诉：高血压、双下肢水肿1周+蛋白尿2天"
            ]
        },
        {
            "问题类型": "事实性问题",
            "问题": "根据杨柳市人民医院的住院病历，臧某某的初步诊断结果是什么？",
            "答案": "妊娠高血压综合症",
            "ref": [
                "初步诊断：妊娠高血压综合症",
                "初步诊断为妊娠高血压综合症。"
            ]
        }
    ],
    "qa_multi_hop": [
        {
            "问题类型": "多跳推理问题",
            "问题": "根据杨柳市人民医院的住院病历，臧某某的诊断依据有几项？",
            "答案": "根据病历，臧某某的诊断依据有3项，分别为高血压病史（160/100 mmHg）、双下肢水肿和尿常规示蛋白尿（+++）。",
            "ref": [
                "诊断依据：",
                "1. 患者有高血压病史，160/100 mmHg；",
                "2. 双下肢水肿；",
                "3. 尿常规示蛋白尿（+++）。"
            ]
        },
        {
            "问题类型": "多跳推理问题",
            "问题": "根据杨柳市人民医院的住院病历，臧某某进行了几项辅助检查？",
            "答案": "根据病历，臧某某进行了5项辅助检查，分别为尿常规、血常规、肾功能、血清电解质和心电图。",
            "ref": [
                "辅助检查：血常规：正常，尿常规：蛋白尿（+++），肾功能：正常，血清电解质：正常，心电图：窦性心律。",
                "辅助检查报告单：尿常规、血常规、肾功能、血清电解质、心电图"
            ]
        }
    ],
    "qa_summary": [
        {
            "问题类型": "总结性问题",
            "问题": "根据杨柳市人民医院的住院病历，总结臧某某的病史。",
            "答案": "臧某某，女，64岁，因高血压、双下肢水肿1周及蛋白尿2天入院。患者1周前无明显诱因出现头痛、头晕，自测血压升高（160/100 mmHg），2天前出现双下肢水肿，尿检发现蛋白尿。既往身体健康，无慢性疾病史、传染病史、重大手术及伤残史，无药物及食物过敏史。",
            "ref": [
                "姓名：臧某某",
                "性别：女",
                "年龄：64岁",
                "主诉：高血压、双下肢水肿1周+蛋白尿2天",
                "患者于1周前无明显诱因出现头痛、头晕，自测血压升高（160/100 mmHg），休息后症状无明显缓解。",
                "2天前出现双下肢水肿，尿检发现蛋白尿，遂来我院就诊。",
                "主要症状特点：持续性高血压（160/100 mmHg），双下肢明显水肿，蛋白尿（+++）。",
                "一般健康状况：平素身体健康。",
                "疾病史：无慢性疾病史。",
                "传染病史：无传染病史。",
                "手术外伤史：无重大手术及伤残史。",
                "过敏史：无药物及食物过敏史。"
            ]
        },
        {
            "问题类型": "总结性问题",
            "问题": "根据杨柳市人民医院的住院病历，总结臧某某的诊断。",
            "答案": "臧某某的初步诊断为妊娠高血压综合症。诊断依据包括：1. 患者有高血压病史，血压160/100 mmHg；2. 双下肢水肿；3. 尿常规示蛋白尿（+++）。鉴别诊断排除了慢性高血压、子痫前期及慢性高血压合并子痫前期。",
            "ref": [
                "初步诊断：妊娠高血压综合症",
                "诊断依据：",
                "1. 患者有高血压病史，160/100 mmHg；",
                "2. 双下肢水肿；",
                "3. 尿常规示蛋白尿（+++）。",
                "鉴别诊断：",
                "1. 慢性高血压：患者无高血压史，故排除；",
                "2. 子痫前期：无症状提示子痫；",
                "3. 慢性高血压合并子痫前期：无慢性高血压史。"
            ]
        },
        {
            "问题类型": "总结性问题",
            "问题": "根据杨柳市人民医院的住院病历，总结臧某某的治疗方案。",
            "答案": "臧某某的治疗方案包括：1. 控制血压，使用口服洛沙坦50mg每日一次；2. 利尿减轻水肿，使用口服螺内酯20mg每日一次；3. 监测尿蛋白；4. 控盐饮食和低蛋白饮食；5. 每日测量血压。",
            "ref": [
                "诊疗计划：控制血压，利尿减轻水肿，监测尿蛋白。",
                "患者入院后给予降压治疗，血压控制较平稳，双下肢水肿有所减轻，蛋白尿监测中。",
                "查房意见：继续密切监测血压及尿蛋白变化，调整治疗方案。",
                "患者入院5天，血压已基本控制，双下肢水肿减轻，蛋白尿（+），继续治疗观察。",
                "长期医嘱单：",
                "1. 每日测量血压；",
                "2. 控盐饮食；",
                "3. 低蛋白饮食。",
                "临时医嘱单：",
                "1. 口服洛沙坦50mg每日一次；",
                "2. 口服螺内酯20mg每日一次。"
            ]
        },
        {
            "问题类型": "总结性问题",
            "问题": "根据杨柳市人民医院的住院病历，总结臧某某的体格检查结果。",
            "答案": "臧某某的体格检查结果显示：体温36.7℃，脉搏78次/分，呼吸18次/分，血压160/100 mmHg。系统检查结果为皮肤腻滑无皮疹，粘膜色淡红无溃疡，未触及肿大淋巴结，头部及器官正常，颈部软无颈静脉怒张，胸廓正常，肺部无罗音，心音有力无杂音，血管无异常，肝区无压痛，未触及肿大脾脏，直肠肛门未见异常，外生殖器无异常，脊柱无畸形，双下肢轻度水肿，神经系统无异常。",
            "ref": [
                "一般情况：",
                "- 体温：36.7℃",
                "- 脉搏：78次/分",
                "- 呼吸：18次/分",
                "- 血压：160/100 mmHg",
                "- 皮肤：腻滑，无皮疹",
                "- 粘膜：色淡红，无溃疡",
                "- 淋巴结：未触及肿大淋巴结",
                "- 头部及器官：正常",
                "- 颈部：软，无颈静脉怒张",
                "- 胸廓：正常",
                "- 肺部：无罗音",
                "- 心脏：心音有力，无杂音",
                "- 血管：无异常",
                "- 肝：肝区无压痛",
                "- 脾：未触及肿大",
                "- 直肠肛门：未见异常",
                "- 外生殖器：无异常",
                "- 脊柱：无畸形",
                "- 四肢：双下肢轻度水肿",
                "- 神经系统：无异常"
            ]
        },
        {
            "问题类型": "总结性问题",
            "问题": "根据杨柳市人民医院的住院病历，总结臧某某的辅助检查结果。",
            "答案": "臧某某的辅助检查结果显示：血常规正常，尿常规显示蛋白尿（+++），肾功能正常，血清电解质正常，心电图显示窦性心律。",
            "ref": [
                "辅助检查：血常规：正常，尿常规：蛋白尿（+++），肾功能：正常，血清电解质：正常，心电图：窦性心律。"
            ]
        },
        {
            "问题类型": "总结性问题",
            "问题": "根据杨柳市人民医院的住院病历，总结臧某某的入院后病程记录。",
            "答案": "臧某某入院后初步诊断为妊娠高血压综合症，给予降压治疗，血压控制较平稳，双下肢水肿有所减轻，蛋白尿监测中。上级医师查房意见为继续密切监测血压及尿蛋白变化，调整治疗方案。患者入院5天后，血压已基本控制，双下肢水肿减轻，蛋白尿（+），继续治疗观察。",
            "ref": [
                "因“高血压、双下肢水肿1周+蛋白尿2天”入院。",
                "初步诊断为妊娠高血压综合症。",
                "患者于1周前无明显诱因出现头痛、头晕，自测血压升高，2天前出现双下肢水肿，尿检发现蛋白尿。",
                "入院后检查血压160/100 mmHg，尿常规显示蛋白尿（+++）。",
                "诊疗计划：控制血压，利尿减轻水肿，监测尿蛋白。",
                "患者入院后给予降压治疗，血压控制较平稳，双下肢水肿有所减轻，蛋白尿监测中。",
                "查房意见：继续密切监测血压及尿蛋白变化，调整治疗方案。",
                "患者入院5天，血压已基本控制，双下肢水肿减轻，蛋白尿（+），继续治疗观察。"
            ]
        }
    ]
}