{
    "住院病历": {
        "基本信息": {
            "姓名": "于某某",
            "性别": "女",
            "年龄": "79岁",
            "民族": "汉族",
            "婚姻状况": "已婚",
            "职业": "退休教师",
            "住址": "香山市丝路街66号",
            "入院时间": "1月23日",
            "记录时间": "1月23日",
            "病史陈述者": "患者本人",
            "医院名称": "香山市人民医院"
        },
        "主诉": "心悸、心动过速、多汗3月，加重2周",
        "现病史": {
            "发病情况": "患者于3个月前无明显诱因出现心悸、心动过速、多汗，未予重视，2周前症状加重，遂来我院就诊",
            "主要症状特点": "患者心悸、心动过速，多汗且多于夜间发作，伴有性情急躁、食欲亢进、疲乏",
            "伴随症状": "甲状腺肿大，突眼情况",
            "诊疗经过及结果": "经门诊检查，初步怀疑为妊娠合并甲状腺功能亢进，收住入院进一步诊治",
            "一般情况变化": "精神状态欠佳，睡眠不深易醒，食欲尚可，大小便正常，体重明显减轻"
        },
        "既往史": {
            "一般健康状况": "平素身体健康",
            "疾病史": "无重大疾病史",
            "传染病史": "否认",
            "预防接种史": "已按时接种",
            "手术外伤史": "否认手术及严重外伤史",
            "输血史": "否认",
            "过敏史": "否认药物及食物过敏史"
        },
        "个人史": {
            "出生地": "香山市",
            "居留地": "香山市",
            "生活习惯": "规律饮食，喜欢运动",
            "职业及工作条件": "退休教师，环境良好",
            "接触史": "否认",
            "冶游史": "无"
        },
        "婚育史及家族史": {
            "婚育史": {
                "婚姻状况": "已婚",
                "结婚年龄": "25岁",
                "配偶健康状况": "良好",
                "子女情况": "一子一女，健康"
            },
            "月经史": {
                "初潮年龄": "14岁",
                "行经期天数": "5天",
                "间隔天数": "28天",
                "末次月经时间": "45岁",
                "月经量": "中等",
                "痛经情况": "无"
            },
            "家族史": "父母及兄弟姐妹健康，否认类似疾病及明显遗传倾向"
        },
        "体格检查": {
            "一般情况": {
                "体温": "36.5°C",
                "脉搏": "108次/分",
                "呼吸": "20次/分",
                "血压": "130/85 mmHg"
            },
            "系统检查": {
                "皮肤": "无黄疸、无出血点、无皮疹",
                "粘膜": "无苍白、无黄染",
                "淋巴结": "无触及肿大",
                "头部及器官": "无异常情况",
                "颈部": "甲状腺II度肿大",
                "胸部": "心律齐，未闻及杂音",
                "腹部": "平软，无压痛，肝脾未触及",
                "直肠肛门": "无异常",
                "外生殖器": "无特殊",
                "脊柱": "无畸形",
                "四肢": "无水肿",
                "神经系统": "无明显异常"
            }
        },
        "专科检查": "甲状腺II度肿大，触痛明显",
        "辅助检查": "血T3、T4偏高",
        "初步诊断": "1. 妊娠合并甲状腺功能亢进 2. 甲状腺肿大",
        "诊断依据": "患者症状，体格检查及血T3、T4结果",
        "鉴别诊断": {
            "妊娠期单纯甲状腺肿大": "无明显甲亢症状，T3、T4正常",
            "亚急性甲状腺炎": "主要表现为甲状腺疼痛，炎症性指标升高",
            "桥本(Hashimoto)病": "慢性甲状腺炎，甲状腺抗体阳性"
        },
        "入院记录": {
            "医师签名": "张医生"
        },
        "入院后病程记录": {
            "首次病程记录": "患者长期心悸、多汗；体征：甲状腺肿大、突眼；试验室检查：血T3、T4高；诊断：妊娠合并甲状腺功能亢进；鉴别：无甲状腺明显疼痛，甲状腺抗体阴性，排除亚急性甲状腺炎及Hashimoto病；诊疗计划：调整甲亢药物，监测病情.",
            "日常病程记录": "患者情况稳定，症状有所缓解，继续药物治疗",
            "上级医师查房记录": "患者入院后症状控制良好，病情稳定",
            "疑难病例讨论记录": "无",
            "交（接）班记录": "无异常交接情况",
            "转科记录": "无",
            "阶段小结": "患者目前症状控制稳定，病情明显好转",
            "抢救记录": "无",
            "有创诊疗操作记录": "无",
            "会诊记录": "无",
            "出院记录": "拟于2023年2月1日出院，出院时病情稳定",
            "病重（病危）患者护理记录": "无"
        },
        "医嘱": {
            "长期医嘱单": "继续服用抗甲亢药物，每日监测脉搏血压",
            "临时医嘱单": "若病情变化，立即通知主治医师"
        },
        "辅助检查报告单": "血T3：8.5 nmol/L，血T4：220 nmol/L，血TSH：0.02 uIU/mL",
        "体温单": "体温36.5°C，脉搏108次/分，呼吸20次/分，血压130/85 mmHg",
        "输血治疗知情同意书": "无",
        "特殊检查同意书": "无",
        "病危（重）通知书": "无"
    },
    "病种": {
        "妊娠、分娩病及产褥期并发症": {
            "名称": "妊娠合并甲状腺功能亢进",
            "症状": "心悸、心动过速、多汗、性情急躁、食欲亢进、疲乏、甲状腺肿大、突眼等",
            "鉴别诊断": "妊娠期单纯甲状腺肿大、亚急性甲状腺炎、桥本(Hashimoto)病"
        }
    },
    "生成文章": "香山市人民医院\n住 院 记 录 本\n姓  名：于某某          性  别：女          年    龄：79岁       \n婚姻状况：已婚          职  业：退休教师          住    址：香山市丝路街66号\n\n时间：1月23日\n\n                                                          香山市人民医院\n                                                          住院病历\n                                                          记录时间：1月23日\n病史陈述者：患者本人\n医院名称：香山市人民医院\n\n主诉：心悸、心动过速、多汗3月，加重2周。\n\n现病史：\n患者于3个月前无明显诱因出现心悸、心动过速、多汗，未予重视。2周前症状加重，遂来我院就诊。主要症状特点为心悸、心动过速，多汗，且多于夜间发作，伴有性情急躁、食欲亢进、疲乏。伴随症状为甲状腺肿大，突眼情况。经门诊检查，初步怀疑为妊娠合并甲状腺功能亢进，收住入院进一步诊治。患者精神状态欠佳，睡眠不深易醒，食欲尚可，大小便正常，体重明显减轻。\n\n既往史：\n一般健康状况良好，无重大疾病史。否认传染病史，已按时接种预防接种。否认手术及严重外伤史，无输血史。否认药物及食物过敏史。\n\n个人史：\n出生地为香山市，居留地也在香山市。患者生活习惯规律，饮食有节制，喜欢运动。退休教师，工作环境良好。否认接触史，无冶游史。\n\n婚育史及家族史：\n婚姻状况为已婚，结婚年龄为25岁。配偶健康状况良好，子女情况为一子一女，均健康。患者初潮年龄为14岁，行经期天数为5天，间隔天数为28天。末次月经时间为45岁，月经量为中等，无痛经情况。父母及兄弟姐妹健康，否认类似疾病及明显遗传倾向。\n\n体格检查：\n一般情况：体温36.5°C，脉搏108次/分，呼吸20次/分，血压130/85 mmHg。\n系统检查：皮肤无黄疸、无出血点、无皮疹。粘膜无苍白、无黄染。淋巴结无触及肿大。头部及器官无异常情况。颈部甲状腺II度肿大。胸部心律齐，未闻及杂音。腹部平软，无压痛，肝脾未触及。直肠肛门无异常。外生殖器无特殊。脊柱无畸形。四肢无水肿。神经系统无明显异常。\n\n专科检查：甲状腺II度肿大，触痛明显。\n\n辅助检查：血T3、T4偏高。\n\n初步诊断：\n1. 妊娠合并甲状腺功能亢进；\n2. 甲状腺肿大。\n\n诊断依据：\n患者症状，体格检查及血T3、T4结果。\n\n鉴别诊断：\n妊娠期单纯甲状腺肿大：无明显甲亢症状，T3、T4正常。\n亚急性甲状腺炎：主要表现为甲状腺疼痛，炎症性指标升高。\n桥本(Hashimoto)病：慢性甲状腺炎，甲状腺抗体阳性。\n\n入院记录：\n患者长期心悸、多汗，甲状腺肿大，突眼。试验室检查血T3、T4高。初步诊断为妊娠合并甲状腺功能亢进。鉴别为无甲状腺明显疼痛，甲状腺抗体阴性，排除亚急性甲状腺炎及Hashimoto病。诊疗计划为调整甲亢药物，监测病情。\n\n入院后病程记录：\n首次病程记录：患者情况稳定，症状有所缓解，继续药物治疗。\n日常病程记录：患者情况稳定，继续药物治疗。\n上级医师查房记录：患者入院后症状控制良好，病情稳定。\n疑难病例讨论记录：无。\n交（接）班记录：无异常交接情况。\n转科记录：无。\n阶段小结：患者目前症状控制稳定，病情明显好转。\n抢救记录：无。\n有创诊疗操作记录：无。\n会诊记录：无。\n出院记录：拟于2023年2月1日出院，出院时病情稳定。\n病重（病危）患者护理记录：无。\n\n医嘱：\n长期医嘱单：继续服用抗甲亢药物，每日监测脉搏血压。\n临时医嘱单：若病情变化，立即通知主治医师。\n\n辅助检查报告单：血T3：8.5 nmol/L，血T4：220 nmol/L，血TSH：0.02 uIU/mL。\n\n体温单：体温36.5°C，脉搏108次/分，呼吸20次/分，血压130/85 mmHg。\n\n输血治疗知情同意书：无。\n\n特殊检查同意书：无。\n\n病危（重）通知书：无。\n\n医师签名：张医生",
    "qa_fact_based": [
        {
            "问题类型": "事实性问题",
            "问题": "根据香山市人民医院的住院病历，于某某的主诉是什么？",
            "答案": "心悸、心动过速、多汗3月，加重2周",
            "ref": [
                "主诉：心悸、心动过速、多汗3月，加重2周。"
            ]
        },
        {
            "问题类型": "事实性问题",
            "问题": "根据香山市人民医院的住院病历，于某某的体温是多少？",
            "答案": "36.5°C",
            "ref": [
                "一般情况：体温36.5°C，脉搏108次/分，呼吸20次/分，血压130/85 mmHg。",
                "体温单：体温36.5°C，脉搏108次/分，呼吸20次/分，血压130/85 mmHg。"
            ]
        },
        {
            "问题类型": "事实性问题",
            "问题": "根据香山市人民医院的住院病历，于某某的脉搏是多少次/分？",
            "答案": "108次/分",
            "ref": [
                "一般情况：体温36.5°C，脉搏108次/分，呼吸20次/分，血压130/85 mmHg。",
                "体温单：体温36.5°C，脉搏108次/分，呼吸20次/分，血压130/85 mmHg。"
            ]
        },
        {
            "问题类型": "事实性问题",
            "问题": "根据香山市人民医院的住院病历，于某某的血压是多少？",
            "答案": "130/85 mmHg",
            "ref": [
                "一般情况：体温36.5°C，脉搏108次/分，呼吸20次/分，血压130/85 mmHg。",
                "体温单：体温36.5°C，脉搏108次/分，呼吸20次/分，血压130/85 mmHg。"
            ]
        }
    ],
    "qa_multi_hop": [
        {
            "问题类型": "多跳推理问题",
            "问题": "根据香山市人民医院的住院病历，于某某的诊断依据有几项？",
            "答案": "根据病历，于某某的诊断依据有3项，分别为患者症状、体格检查及血T3、T4结果。",
            "ref": [
                "患者症状，体格检查及血T3、T4结果。"
            ]
        },
        {
            "问题类型": "多跳推理问题",
            "问题": "根据香山市人民医院的住院病历，于某某进行了几项辅助检查？",
            "答案": "根据病历，于某某进行了3项辅助检查，分别为血T3、血T4和血TSH。",
            "ref": [
                "辅助检查：血T3、T4偏高。",
                "试验室检查血T3、T4高。",
                "辅助检查报告单：血T3：8.5 nmol/L，血T4：220 nmol/L，血TSH：0.02 uIU/mL。"
            ]
        }
    ],
    "qa_summary": [
        {
            "问题类型": "总结性问题",
            "问题": "根据香山市人民医院的住院病历，总结于某某的病史。",
            "答案": "于某某于3个月前无明显诱因出现心悸、心动过速、多汗，未予重视，2周前症状加重，遂来我院就诊。患者心悸、心动过速，多汗且多于夜间发作，伴有性情急躁、食欲亢进、疲乏。甲状腺肿大，突眼情况。经门诊检查，初步怀疑为妊娠合并甲状腺功能亢进，收住入院进一步诊治。",
            "ref": [
                "患者于3个月前无明显诱因出现心悸、心动过速、多汗，未予重视。",
                "2周前症状加重，遂来我院就诊。",
                "主要症状特点为心悸、心动过速，多汗，且多于夜间发作，伴有性情急躁、食欲亢进、疲乏。",
                "伴随症状为甲状腺肿大，突眼情况。",
                "经门诊检查，初步怀疑为妊娠合并甲状腺功能亢进，收住入院进一步诊治。"
            ]
        },
        {
            "问题类型": "总结性问题",
            "问题": "根据香山市人民医院的住院病历，总结于某某的诊断。",
            "答案": "于某某的初步诊断为妊娠合并甲状腺功能亢进和甲状腺肿大，诊断依据为患者症状，体格检查及血T3、T4结果。",
            "ref": [
                "1. 妊娠合并甲状腺功能亢进；",
                "2. 甲状腺肿大。",
                "患者症状，体格检查及血T3、T4结果。"
            ]
        },
        {
            "问题类型": "总结性问题",
            "问题": "根据香山市人民医院的住院病历，总结于某某的治疗方案。",
            "答案": "于某某的治疗方案为继续服用抗甲亢药物，每日监测脉搏血压。若病情变化，立即通知主治医师。",
            "ref": [
                "诊疗计划为调整甲亢药物，监测病情。",
                "长期医嘱单：继续服用抗甲亢药物，每日监测脉搏血压。",
                "临时医嘱单：若病情变化，立即通知主治医师。"
            ]
        }
    ]
}