{
    "报告类型": "公司环境与社会责任报告",
    "报告时间": "2019年度",
    "公司信息": {
        "名称": "盈利家居服务有限公司",
        "成立日期": "2000年4月15日",
        "主营业务": "提供高质量的家政服务，包括保洁、家庭烹饪、陪伴照料等",
        "注册地": "上海市浦东新区",
        "上市情况": "未上市",
        "行业": "家政"
    },
    "报告内容": [
        {
            "类型": "环境责任",
            "重要事件": [
                {
                    "事件": "防止污染设施的建设",
                    "时间": "2019年2月",
                    "描述": "公司建立新的污染防治设施，如废水处理系统和排放控制设备，以减少环境污染。",
                    "影响": "显著降低了公司的环境污染水平，增强了合规性和社会责任感。"
                },
                {
                    "事件": "推广可持续性原则",
                    "时间": "2019年3月",
                    "描述": "公司在工作中推广可持续性原则，包括资源的合理利用、废物的循环利用等。",
                    "影响": "树立了公司在可持续发展方面的领导地位，提高了业界对公司的认可度。"
                },
                {
                    "事件": "采用环境管理系统",
                    "时间": "2019年4月",
                    "描述": "公司实施环境管理系统（EMS），以提高环境绩效，减少废物产生，并确保合规。",
                    "影响": "增强了公司的环境管理能力和持续改进，提升了合规性和市场认可度。"
                },
                {
                    "事件": "投资于碳抵消项目",
                    "时间": "2019年8月",
                    "描述": "公司通过投资林业项目或可再生能源项目来抵消其碳排放，努力实现碳中和目标。",
                    "影响": "通过碳抵消证书，公司能够向利益相关者展示其对环境的承诺和责任。"
                },
                {
                    "事件": "绿色产品开发",
                    "时间": "2019年9月",
                    "描述": "公司开发的环保型产品，减少对环境的影响。",
                    "影响": "提升了产品的市场竞争力和品牌形象，同时减少了环境影响。"
                },
                {
                    "事件": "节能减排项目实施",
                    "时间": "2019年10月",
                    "描述": "公司投资实施的节能减排项目，旨在减少能源消耗和温室气体排放。",
                    "影响": "直接减少了公司的能源消耗和碳足迹，提高了能效和环境绩效。"
                }
            ],
            "涉及的指标": [
                {
                    "指标": "二氧化碳排放量",
                    "描述": "公司在生产过程中产生的二氧化碳总量。",
                    "影响因素": [
                        "生产规模的变化",
                        "节能技术的应用"
                    ],
                    "值": "1500吨"
                },
                {
                    "指标": "能源消耗",
                    "描述": "公司在运营过程中消耗的能源总量。",
                    "影响因素": [
                        "生产效率的提高",
                        "能源管理措施的实施"
                    ],
                    "值": "8000吉瓦时"
                }
            ]
        },
        {
            "类型": "社会责任",
            "重要事件": [
                {
                    "事件": "参与公共服务项目",
                    "时间": "2019年2月",
                    "描述": "公司投资或参与公共服务项目，如城市绿化、公共卫生改善项目，以提升社区生活质量。",
                    "影响": "促进了社区的可持续发展，增强了公众对公司的积极感知。"
                },
                {
                    "事件": "参与慈善活动",
                    "时间": "2019年4月",
                    "描述": "公司参与或资助慈善活动和慈善机构，以支持教育、健康、减贫等领域。",
                    "影响": "提高了公司的社会形象和品牌认知，加强了与社区的联系和支持。"
                },
                {
                    "事件": "员工职业成长和人才发展计划",
                    "时间": "2019年6月",
                    "描述": "公司提供各类培训和发展项目，支持员工职业成长，包括在线课程、工作坊、导师计划等。",
                    "影响": "提高了员工的专业技能和工作满意度，促进了人才的留存和发展。"
                },
                {
                    "事件": "员工健康与安全计划",
                    "时间": "2019年7月",
                    "描述": "公司实施的旨在提升员工健康与安全的措施。",
                    "影响": "显著改善了工作环境，减少了工伤事故，提高了员工的健康与安全水平。"
                },
                {
                    "事件": "社区反馈项目",
                    "时间": "2019年11月",
                    "描述": "公司定期与社区居民进行沟通和交流，以了解他们的需求和意见，进一步改善公司的服务和质量。",
                    "影响": "增进了公司与社区的互动，提高了公司的形象和社会责任感。"
                },
                {
                    "事件": "社区支持和发展项目",
                    "时间": "2019年12月",
                    "描述": "公司投资于当地社区，支持教育、健康和社会发展项目。",
                    "影响": "加深了公司与社区的联系，促进了社区的整体福祉和发展。"
                }
            ],
            "涉及的指标": [
                {
                    "指标": "员工满意度",
                    "描述": "通过调查得到的员工对公司环境和政策满意度的度量。",
                    "影响因素": [
                        "工作环境的改善",
                        "员工福利政策的调整"
                    ],
                    "值": "85%"
                },
                {
                    "指标": "社区投资额",
                    "描述": "公司在社区发展项目上的投资总额。",
                    "影响因素": [
                        "公司的财务状况",
                        "社会责任战略的变化"
                    ],
                    "值": "200万元"
                }
            ]
        }
    ],
    "额外信息": [
        {
            "名称": "未来展望",
            "内容": [
                {
                    "名称": "环境保护计划",
                    "描述": "采取一系列措施减少其运营对环境的影响，包括更新能效设备、提升废物回收利用率等。",
                    "时间": "2020-2025年"
                },
                {
                    "名称": "社会责任战略",
                    "描述": "在业务实践中积极履行社会责任，包括促进社区发展、改善员工福利、提供公平就业机会和参与公益活动。",
                    "时间": "2020-2025年"
                },
                {
                    "名称": "可持续发展目标",
                    "描述": "通过整合可持续性原则到业务模型和决策过程中，致力于实现联合国可持续发展目标（SDGs）。",
                    "时间": "2020-2030年"
                }
            ]
        }
    ],
    "生成大纲": "# 公司环境与社会责任报告大纲\n\n## 1. 公司简介\n- 公司名称：盈利家居服务有限公司\n- 成立日期：2000年4月15日\n- 主营业务：提供高质量的家政服务，包括保洁、家庭烹饪、陪伴照料等\n- 注册地：上海市浦东新区\n- 上市情况：未上市\n- 行业：家政\n\n## 2. 报告概述\n- 报告类型：公司环境与社会责任报告\n- 报告时间：2019年度\n\n## 3. 环境责任\n### 3.1 重要事件\n- [防止污染设施的建设](2019年2月)\n  - 描述：公司建立新的污染防治设施，如废水处理系统和排放控制设备，以减少环境污染。\n  - 影响：显著降低了公司的环境污染水平，增强了合规性和社会责任感。\n- [推广可持续性原则](2019年3月)\n  - 描述：公司在工作中推广可持续性原则，包括资源的合理利用、废物的循环利用等。\n  - 影响：树立了公司在可持续发展方面的领导地位，提高了业界对公司的认可度。\n- [采用环境管理系统](2019年4月)\n  - 描述：公司实施环境管理系统（EMS），以提高环境绩效，减少废物产生，并确保合规。\n  - 影响：增强了公司的环境管理能力和持续改进，提升了合规性和市场认可度。\n- [投资于碳抵消项目](2019年8月)\n  - 描述：公司通过投资林业项目或可再生能源项目来抵消其碳排放，努力实现碳中和目标。\n  - 影响：通过碳抵消证书，公司能够向利益相关者展示其对环境的承诺和责任。\n- [绿色产品开发](2019年9月)\n  - 描述：公司开发的环保型产品，减少对环境的影响。\n  - 影响：提升了产品的市场竞争力和品牌形象，同时减少了环境影响。\n- [节能减排项目实施](2019年10月)\n  - 描述：公司投资实施的节能减排项目，旨在减少能源消耗和温室气体排放。\n  - 影响：直接减少了公司的能源消耗和碳足迹，提高了能效和环境绩效。\n\n### 3.2 涉及的指标\n- 二氧化碳排放量：\n  - 描述：公司在生产过程中产生的二氧化碳总量。\n  - 影响因素：生产规模的变化，节能技术的应用。\n  - 值：1500吨\n- 能源消耗：\n  - 描述：公司在运营过程中消耗的能源总量。\n  - 影响因素：生产效率的提高，能源管理措施的实施。\n  - 值：8000吉瓦时\n\n## 4. 社会责任\n### 4.1 重要事件\n- [参与公共服务项目](2019年2月)\n  - 描述：公司投资或参与公共服务项目，如城市绿化、公共卫生改善项目，以提升社区生活质量。\n  - 影响：促进了社区的可持续发展，增强了公众对公司的积极感知。\n- [参与慈善活动](2019年4月)\n  - 描述：公司参与或资助慈善活动和慈善机构，以支持教育、健康、减贫等领域。\n  - 影响：提高了公司的社会形象和品牌认知，加强了与社区的联系和支持。\n- [员工职业成长和人才发展计划](2019年6月)\n  - 描述：公司提供各类培训和发展项目，支持员工职业成长，包括在线课程、工作坊、导师计划等。\n  - 影响：提高了员工的专业技能和工作满意度，促进了人才的留存和发展。\n- [员工健康与安全计划](2019年7月)\n  - 描述：公司实施的旨在提升员工健康与安全的措施。\n  - 影响：显著改善了工作环境，减少了工伤事故，提高了员工的健康与安全水平。\n- [社区反馈项目](2019年11月)\n  - 描述：公司定期与社区居民进行沟通和交流，以了解他们的需求和意见，进一步改善公司的服务和质量。\n  - 影响：增进了公司与社区的互动，提高了公司的形象和社会责任感。\n- [社区支持和发展项目](2019年12月)\n  - 描述：公司投资于当地社区，支持教育、健康和社会发展项目。\n  - 影响：加深了公司与社区的联系，促进了社区的整体福祉和发展。\n\n### 4.2 涉及的指标\n- 员工满意度：\n  - 描述：通过调查得到的员工对公司环境和政策满意度的度量。\n  - 影响因素：工作环境的改善，员工福利政策的调整。\n  - 值：85%\n- 社区投资额：\n  - 描述：公司在社区发展项目上的投资总额。\n  - 影响因素：公司的财务状况，社会责任战略的变化。\n  - 值：200万元\n\n## 5. 未来展望\n### 5.1 环境保护计划\n- 描述：采取一系列措施减少公司运营对环境的影响，包括更新能效设备、提升废物回收利用率等。\n- 时间：2020-2025年\n\n### 5.2 社会责任战略\n- 描述：在业务实践中积极履行社会责任，包括促进社区发展、改善员工福利、提供公平就业机会和参与公益活动。\n- 时间：2020-2025年\n\n### 5.3 可持续发展目标\n- 描述：通过整合可持续性原则到业务模型和决策过程中，致力于实现联合国可持续发展目标（SDGs）。\n- 时间：2020-2030年",
    "生成总结": "盈利家居服务有限公司是一家成立于2000年4月15日的家政公司，主要提供高质量的家政服务，包括保洁、家庭烹饪、陪伴照料等，注册地在上海市浦东新区，目前未上市。",
    "生成文章": "本报告是关于盈利家居服务有限公司的环境与社会责任报告，涵盖了2019年度的相关信息和未来展望。\n\n在环境责任方面，盈利家居服务有限公司在2019年度采取了一系列重要事件来降低对环境的影响。首先，在2019年2月，公司建立了新的污染防治设施，包括废水处理系统和排放控制设备，以减少环境污染。这一举措显著降低了公司的环境污染水平，增强了合规性和社会责任感。其次，在2019年3月，公司推广可持续性原则，包括资源的合理利用和废物的循环利用等。这一举措树立了公司在可持续发展方面的领导地位，提高了业界对公司的认可度。在2019年4月，公司实施了环境管理系统（EMS），以提高环境绩效，减少废物产生，并确保合规。这一举措增强了公司的环境管理能力和持续改进，提升了合规性和市场认可度。在2019年8月，公司通过投资碳抵消项目来抵消其碳排放，努力实现碳中和目标。通过碳抵消证书，公司能够向利益相关者展示其对环境的承诺和责任。此外，在2019年9月，公司开发了环保型产品，减少对环境的影响，提升了产品的市场竞争力和品牌形象。最后，在2019年10月，公司投资实施了节能减排项目，减少能源消耗和温室气体排放，提高了能效和环境绩效。\n\n在社会责任方面，盈利家居服务有限公司也采取了一系列重要事件来履行社会责任。在2019年2月，公司投资或参与公共服务项目，如城市绿化、公共卫生改善项目，以提升社区生活质量。这一举措促进了社区的可持续发展，增强了公众对公司的积极感知。在2019年4月，公司参与或资助慈善活动和慈善机构，以支持教育、健康、减贫等领域。这一举措提高了公司的社会形象和品牌认知，加强了与社区的联系和支持。在2019年6月，公司提供各类培训和发展项目，支持员工职业成长，包括在线课程、工作坊、导师计划等。这一举措提高了员工的专业技能和工作满意度，促进了人才的留存和发展。在2019年7月，公司实施了旨在提升员工健康与安全的计划，显著改善了工作环境，减少了工伤事故，提高了员工的健康与安全水平。在2019年11月，公司定期与社区居民进行沟通和交流，以了解他们的需求和意见，进一步改善公司的服务和质量。这一举措增进了公司与社区的互动，提高了公司的形象和社会责任感。最后，在2019年12月，公司投资于当地社区，支持教育、健康和社会发展项目，加深了公司与社区的联系，促进了社区的整体福祉和发展。\n\n在环境责任方面，盈利家居服务有限公司的二氧化碳排放量为1500吨，能源消耗为8000吉瓦时。这些指标的变化受到生产规模的变化、节能技术的应用、生产效率的提高和能源管理措施的实施等因素的影响。\n\n在社会责任方面，盈利家居服务有限公司的员工满意度为85%，社区投资额为200万元。员工满意度的提高与工作环境的改善和员工福利政策的调整有关。社区投资额的变化受到公司的财务状况和社会责任战略的变化等因素的影响。\n\n未来展望方面，盈利家居服务有限公司将继续致力于环境保护计划，采取一系列措施减少公司运营对环境的影响，包括更新能效设备、提升废物回收利用率等。同时，公司将继续推进社会责任战略，积极履行社会责任，包括促进社区发展、改善员工福利、提供公平就业机会和参与公益活动。此外，公司还将通过整合可持续性原则到业务模型和决策过程中，致力于实现联合国可持续发展目标（SDGs）。\n\n综上所述，盈利家居服务有限公司在2019年度在环境责任和社会责任方面取得了显著的进展。公司通过一系列重要事件和措施，降低了对环境的影响，提高了环境管理能力和持续改进，增强了合规性和市场认可度。同时，公司积极履行社会责任，促进了社区的可持续发展，提高了员工满意度和社会形象。未来，公司将继续致力于环境保护和社会责任，实现可持续发展目标。"
}