{
    "Report Type": "Corporate Governance Report",
    "Report Time": "2020",
    "Company Information": {
        "Name": "Retail Emporium",
        "Establishment Date": "December 1, 2005",
        "Main Business": "Retail sales of clothing, accessories, and home goods",
        "Registration Location": "New York, USA",
        "Listing Status": "Publicly traded on the New York Stock Exchange",
        "Industry": "Retail"
    },
    "Report Content": [
        {
            "Type": "Governance Structure",
            "Significant Events": [
                {
                    "Event": "Sustainability and Social Responsibility Initiatives",
                    "Time": "January, 2020",
                    "Description": "Retail Emporium achieved significant milestones in its sustainability efforts, including reducing carbon emissions by 20% through energy-efficient practices, implementing fair trade partnerships with suppliers, and donating 10% of profits to local community development.",
                    "Impact": "The company's commendable strides in sustainability, environmental protection, social responsibility, and corporate citizenship cultivate its public image, augmenting market competitiveness and promoting long-term sustainable development.",
                    "Sub Events": [
                        {
                            "Event": "Expansion of Sustainability Department",
                            "Time": "February, 2020",
                            "Description": "Retail Emporium established a dedicated Sustainability Department to oversee and implement sustainability initiatives. The department is responsible for developing and implementing strategies to reduce the company's carbon footprint, promote fair trade practices, and support local community development.",
                            "Impact": "The establishment of the Sustainability Department demonstrates Retail Emporium's commitment to sustainability and strengthens its ability to monitor and improve its corporate citizenship practices."
                        },
                        {
                            "Event": "Integration of Energy-Efficient Practices",
                            "Time": "March, 2020",
                            "Description": "Retail Emporium implemented energy-efficient practices across its operations, including optimizing lighting systems, upgrading HVAC systems, and installing solar panels on select stores and distribution centers. These initiatives resulted in a 20% reduction in carbon emissions compared to the previous year.",
                            "Impact": "The integration of energy-efficient practices significantly contributed to Retail Emporium's achievement of reducing carbon emissions by 20%, enhancing its environmental stewardship and sustainability efforts."
                        },
                        {
                            "Event": "Establishment of Fair Trade Partnerships",
                            "Time": "April, 2020",
                            "Description": "Retail Emporium formed fair trade partnerships with suppliers, ensuring that their products are produced under fair labor conditions, with fair wages and without exploiting workers. The partnerships also aim to support local communities, promoting sustainable economic development.",
                            "Impact": "The establishment of fair trade partnerships enhances Retail Emporium's commitment to ethical sourcing practices, contributing to improved labor conditions in its supply chain and bolstering its reputation as a socially responsible retailer."
                        },
                        {
                            "Event": "Implementation of Profit Donation Program",
                            "Time": "May, 2020",
                            "Description": "Retail Emporium introduced a profit donation program, whereby 10% of its annual profits are allocated to local community development initiatives. These funds are used to support education, healthcare, environmental conservation, and other community-driven projects.",
                            "Impact": "The implementation of the profit donation program demonstrates Retail Emporium's dedication to supporting local communities and achieving sustainable development goals, further enhancing its corporate citizenship and societal impact."
                        }
                    ]
                },
                {
                    "Event": "Shareholders' Meeting Resolution",
                    "Time": "March, 2020",
                    "Description": "During the annual shareholders' meeting, Retail Emporium implemented changes to its charter, resulting in the appointment of two independent directors and receiving unanimous voting support from shareholders.",
                    "Impact": "The resolution significantly affects the company's governance structure, shaping its future operational strategies, and reinforcing shareholder rights."
                },
                {
                    "Event": "Risk Management Measures",
                    "Time": "April, 2020",
                    "Description": "Retail Emporium updated its risk management framework by identifying emerging risks, deploying proactive mitigation strategies, and fostering a culture of risk awareness throughout the organization.",
                    "Impact": "The enhanced risk management measures strengthen the company's ability to address internal and external risks, ensuring uninterrupted operations and stable development."
                },
                {
                    "Event": "Ethics and Integrity Incidents",
                    "Time": "May, 2020",
                    "Description": "Retail Emporium confronted an isolated insider trading incident by promptly conducting an internal investigation, terminating the involved employee, and implementing stringent control measures to prevent recurrence.",
                    "Impact": "Although the incident challenged the company's reputation, Retail Emporium's decisive actions demonstrate its commitment to maintaining ethical and transparent practices, reinforcing investor, customer, and partner relationships."
                },
                {
                    "Event": "Board of Directors Change",
                    "Time": "July, 2020",
                    "Description": "The appointment of Ms. Sarah Johnson as a new board member, bringing her extensive retail experience and strategic insights to impact the company's future direction positively.",
                    "Impact": "The addition of Ms. Sarah Johnson to the board is expected to lead to strategic adjustments, benefitting the company's long-term development direction and shareholder interests."
                },
                {
                    "Event": "Senior Management Changes",
                    "Time": "August, 2020",
                    "Description": "Retail Emporium's Chief Executive Officer, Mr. David Anderson, stepped down from his position due to personal reasons. The company appointed Mr. Robert Thompson, an experienced retail executive, as the new CEO responsible for driving operational focus and strategic priorities.",
                    "Impact": "The change in senior management necessitates adjustments in operational focus and strategic priorities, influencing both short-term performance and long-term development."
                },
                {
                    "Event": "Corporate Governance Policy Revision",
                    "Time": "September, 2020",
                    "Description": "Retail Emporium undertakes a comprehensive review of its corporate governance policies, incorporating new regulations, aiming to enhance transparency, accountability, and stakeholder engagement.",
                    "Impact": "The revised corporate governance policies bolster transparency and accountability, instilling heightened stakeholder confidence in the company."
                },
                {
                    "Event": "Compliance and Regulatory Updates",
                    "Time": "October, 2020",
                    "Description": "Retail Emporium proactively adapts to new regulations, such as the Consumer Protection Act, by amending its compliance policies, ensuring adherence to the latest standards and industry regulations.",
                    "Impact": "Stringent compliance with the prevailing laws and regulations reduces legal risk, thus safeguarding the company and shareholder interests."
                }
            ],
            "Involved Indicators": [
                {
                    "Indicator": "Information Disclosure",
                    "Description": "Retail Emporium has a robust information disclosure system that ensures timely and accurate reporting of financial and non-financial information to stakeholders.",
                    "Value": "Retail Emporium consistently achieves a high level of information disclosure, with its annual reports, financial statements, and corporate announcements readily available to the public."
                },
                {
                    "Indicator": "Related Transactions",
                    "Description": "Retail Emporium maintains stringent policies and procedures to ensure the fairness and compliance of all related transactions, preventing conflicts of interest and unethical practices.",
                    "Value": "The company employs an independent review committee to oversee related transactions, ensuring transparency and protecting the best interests of the company and its shareholders."
                },
                {
                    "Indicator": "Internal Control",
                    "Description": "Retail Emporium has a comprehensive internal control system in place, encompassing internal policies, processes, and regular audits to assess the effectiveness of internal controls.",
                    "Value": "The company's robust internal control system ensures the accuracy of financial reporting, safeguards assets, and mitigates risks effectively."
                }
            ]
        }
    ],
    "Additional Information": [
        {
            "Name": "Governance Improvement Plans",
            "Content": [
                {
                    "Name": "Strengthening the Function of the Board of Directors and Supervisory Board",
                    "Description": "Retail Emporium aims to enhance the efficiency and effectiveness of its board of directors and supervisory board by implementing regular training programs, increasing the proportion of independent directors, and optimizing decision-making processes."
                },
                {
                    "Name": "Enhancing Transparency and Quality of Information Disclosure",
                    "Description": "Retail Emporium is committed to improving its information disclosure process and standards to ensure timely, accurate, and comprehensive reporting to all stakeholders. The company plans to leverage technology and digital platforms to enhance accessibility and transparency."
                }
            ]
        },
        {
            "Name": "Risk Management Strategy",
            "Content": [
                {
                    "Name": "Strengthening the Internal Control System",
                    "Description": "Retail Emporium aims to establish and strengthen its internal control system, enabling the identification, assessment, monitoring, and reporting of financial and operational risks. The company will invest in advanced risk management tools and conduct regular risk assessments to enhance its ability to withstand risks."
                },
                {
                    "Name": "Integrating Sustainable Development and Social Responsibility",
                    "Description": "Retail Emporium recognizes the importance of sustainable development and social responsibility. The company plans to integrate these elements into its strategy, conducting comprehensive risk assessments to identify related risks and opportunities. By integrating sustainable practices into its operations, Retail Emporium aims to promote long-term value creation for its stakeholders."
                }
            ]
        }
    ],
    "Generated Outline": "I. Introduction\n   A. Report Type: Corporate Governance Report\n   B. Report Time: 2020\n   C. Company Information\n      1. Name: Retail Emporium\n      2. Establishment Date: December 1, 2005\n      3. Main Business: Retail sales of clothing, accessories, and home goods\n      4. Registration Location: New York, USA\n      5. Listing Status: Publicly traded on the New York Stock Exchange\n      6. Industry: Retail\n\nII. Governance Structure\n   A. Significant Events\n      1. Sustainability and Social Responsibility Initiatives (January, 2020)\n         a. Description: Retail Emporium achieved significant milestones in its sustainability efforts, including reducing carbon emissions by 20% through energy-efficient practices, implementing fair trade partnerships with suppliers, and donating 10% of profits to local community development.\n         b. Impact: The company's commendable strides in sustainability, environmental protection, social responsibility, and corporate citizenship cultivate its public image, augmenting market competitiveness and promoting long-term sustainable development.\n         c. Sub Events\n            - Expansion of Sustainability Department (February, 2020)\n               - Description: Retail Emporium established a dedicated Sustainability Department to oversee and implement sustainability initiatives. The department is responsible for developing and implementing strategies to reduce the company's carbon footprint, promote fair trade practices, and support local community development.\n               - Impact: The establishment of the Sustainability Department demonstrates Retail Emporium's commitment to sustainability and strengthens its ability to monitor and improve its corporate citizenship practices.\n            - Integration of Energy-Efficient Practices (March, 2020)\n               - Description: Retail Emporium implemented energy-efficient practices across its operations, including optimizing lighting systems, upgrading HVAC systems, and installing solar panels on select stores and distribution centers. These initiatives resulted in a 20% reduction in carbon emissions compared to the previous year.\n               - Impact: The integration of energy-efficient practices significantly contributed to Retail Emporium's achievement of reducing carbon emissions by 20%, enhancing its environmental stewardship and sustainability efforts.\n            - Establishment of Fair Trade Partnerships (April, 2020)\n               - Description: Retail Emporium formed fair trade partnerships with suppliers, ensuring that their products are produced under fair labor conditions, with fair wages and without exploiting workers. The partnerships also aim to support local communities, promoting sustainable economic development.\n               - Impact: The establishment of fair trade partnerships enhances Retail Emporium's commitment to ethical sourcing practices, contributing to improved labor conditions in its supply chain and bolstering its reputation as a socially responsible retailer.\n            - Implementation of Profit Donation Program (May, 2020)\n               - Description: Retail Emporium introduced a profit donation program, whereby 10% of its annual profits are allocated to local community development initiatives. These funds are used to support education, healthcare, environmental conservation, and other community-driven projects.\n               - Impact: The implementation of the profit donation program demonstrates Retail Emporium's dedication to supporting local communities and achieving sustainable development goals, further enhancing its corporate citizenship and societal impact.\n      2. Shareholders' Meeting Resolution (March, 2020)\n         - Description: During the annual shareholders' meeting, Retail Emporium implemented changes to its charter, resulting in the appointment of two independent directors and receiving unanimous voting support from shareholders.\n         - Impact: The resolution significantly affects the company's governance structure, shaping its future operational strategies, and reinforcing shareholder rights.\n      3. Risk Management Measures (April, 2020)\n         - Description: Retail Emporium updated its risk management framework by identifying emerging risks, deploying proactive mitigation strategies, and fostering a culture of risk awareness throughout the organization.\n         - Impact: The enhanced risk management measures strengthen the company's ability to address internal and external risks, ensuring uninterrupted operations and stable development.\n      4. Ethics and Integrity Incidents (May, 2020)\n         - Description: Retail Emporium confronted an isolated insider trading incident by promptly conducting an internal investigation, terminating the involved employee, and implementing stringent control measures to prevent recurrence.\n         - Impact: Although the incident challenged the company's reputation, Retail Emporium's decisive actions demonstrate its commitment to maintaining ethical and transparent practices, reinforcing investor, customer, and partner relationships.\n      5. Board of Directors Change (July, 2020)\n         - Description: The appointment of Ms. Sarah Johnson as a new board member, bringing her extensive retail experience and strategic insights to impact the company's future direction positively.\n         - Impact: The addition of Ms. Sarah Johnson to the board is expected to lead to strategic adjustments, benefitting the company's long-term development direction and shareholder interests.\n      6. Senior Management Changes (August, 2020)\n         - Description: Retail Emporium's Chief Executive Officer, Mr. David Anderson, stepped down from his position due to personal reasons. The company appointed Mr. Robert Thompson, an experienced retail executive, as the new CEO responsible for driving operational focus and strategic priorities.\n         - Impact: The change in senior management necessitates adjustments in operational focus and strategic priorities, influencing both short-term performance and long-term development.\n      7. Corporate Governance Policy Revision (September, 2020)\n         - Description: Retail Emporium undertakes a comprehensive review of its corporate governance policies, incorporating new regulations, aiming to enhance transparency, accountability, and stakeholder engagement.\n         - Impact: The revised corporate governance policies bolster transparency and accountability, instilling heightened stakeholder confidence in the company.\n      8. Compliance and Regulatory Updates (October, 2020)\n         - Description: Retail Emporium proactively adapts to new regulations, such as the Consumer Protection Act, by amending its compliance policies, ensuring adherence to the latest standards and industry regulations.\n         - Impact: Stringent compliance with the prevailing laws and regulations reduces legal risk, thus safeguarding the company and shareholder interests.\n   \n   B. Involved Indicators\n      1. Information Disclosure\n         - Description: Retail Emporium has a robust information disclosure system that ensures timely and accurate reporting of financial and non-financial information to stakeholders.\n         - Value: Retail Emporium consistently achieves a high level of information disclosure, with its annual reports, financial statements, and corporate announcements readily available to the public.\n      2. Related Transactions\n         - Description: Retail Emporium maintains stringent policies and procedures to ensure the fairness and compliance of all related transactions, preventing conflicts of interest and unethical practices.\n         - Value: The company employs an independent review committee to oversee related transactions, ensuring transparency and protecting the best interests of the company and its shareholders.\n      3. Internal Control\n         - Description: Retail Emporium has a comprehensive internal control system in place, encompassing internal policies, processes, and regular audits to assess the effectiveness of internal controls.\n         - Value: The company's robust internal control system ensures the accuracy of financial reporting, safeguards assets, and mitigates risks effectively.\n   \nIII. Additional Information\n   A. Governance Improvement Plans\n      1. Strengthening the Function of the Board of Directors and Supervisory Board\n         - Description: Retail Emporium aims to enhance the efficiency and effectiveness of its board of directors and supervisory board by implementing regular training programs, increasing the proportion of independent directors, and optimizing decision-making processes.\n      2. Enhancing Transparency and Quality of Information Disclosure\n         - Description: Retail Emporium is committed to improving its information disclosure process and standards to ensure timely, accurate, and comprehensive reporting to all stakeholders. The company plans to leverage technology and digital platforms to enhance accessibility and transparency.\n   \n   B. Risk Management Strategy\n      1. Strengthening the Internal Control System\n         - Description: Retail Emporium aims to establish and strengthen its internal control system, enabling the identification, assessment, monitoring, and reporting of financial and operational risks. The company will invest in advanced risk management tools and conduct regular risk assessments to enhance its ability to withstand risks.\n      2. Integrating Sustainable Development and Social Responsibility\n         - Description: Retail Emporium recognizes the importance of sustainable development and social responsibility. The company plans to integrate these elements into its strategy, conducting comprehensive risk assessments to identify related risks and opportunities. By integrating sustainable practices into its operations, Retail Emporium aims to promote long-term value creation for its stakeholders.",
    "Generated Summary": "Retail Emporium is a publicly traded retail company based in New York, USA, specializing in clothing, accessories, and home goods.",
    "Generated Article": "In 2020, Retail Emporium made significant strides in corporate governance, sustainability, and social responsibility, solidifying its position as a socially responsible retailer. The company's commitment to sustainability was evident through various initiatives implemented throughout the year. In January, Retail Emporium achieved remarkable milestones in sustainability, including a 20% reduction in carbon emissions through energy-efficient practices. This was made possible by the integration of energy-efficient practices in March, such as optimizing lighting systems, upgrading HVAC systems, and installing solar panels on select stores and distribution centers. These initiatives not only contributed to the reduction in carbon emissions but also showcased the company's dedication to environmental stewardship.\n\nFurthermore, Retail Emporium established fair trade partnerships with suppliers in April, ensuring that their products are produced under fair labor conditions and without exploiting workers. These partnerships not only promote ethical sourcing practices but also support local communities, fostering sustainable economic development. In May, the company introduced a profit donation program, allocating 10% of its annual profits to local community development initiatives. This program demonstrates Retail Emporium's commitment to supporting education, healthcare, and environmental conservation, further enhancing its corporate citizenship and societal impact.\n\nIn addition to its sustainability efforts, Retail Emporium also made significant governance changes in 2020. During the annual shareholders' meeting in March, the company implemented changes to its charter, resulting in the appointment of two independent directors. This resolution reinforced shareholder rights and shaped the company's future operational strategies. The appointment of Ms. Sarah Johnson as a new board member in July brought extensive retail experience and strategic insights to the company, positively impacting its future direction.\n\nHowever, Retail Emporium also faced challenges in ethics and integrity in May when an isolated insider trading incident occurred. The company promptly conducted an internal investigation, terminated the involved employee, and implemented stringent control measures to prevent recurrence. While this incident challenged the company's reputation, Retail Emporium's decisive actions demonstrated its commitment to maintaining ethical and transparent practices, reinforcing investor, customer, and partner relationships.\n\nThroughout the year, Retail Emporium consistently prioritized information disclosure, related transactions, and internal control. The company maintained a robust information disclosure system, ensuring timely and accurate reporting of financial and non-financial information to stakeholders. This commitment to transparency and accountability was further exemplified by the company's stringent policies and procedures regarding related transactions, preventing conflicts of interest and unethical practices. Retail Emporium's comprehensive internal control system, encompassing internal policies, processes, and regular audits, effectively safeguarded assets and mitigated risks.\n\nLooking ahead, Retail Emporium has outlined governance improvement plans to strengthen the function of its board of directors and supervisory board. This includes implementing regular training programs, increasing the proportion of independent directors, and optimizing decision-making processes. The company also aims to enhance transparency and the quality of information disclosure by leveraging technology and digital platforms to improve accessibility and transparency.\n\nIn terms of risk management, Retail Emporium plans to strengthen its internal control system by investing in advanced risk management tools and conducting regular risk assessments. The company recognizes the importance of integrating sustainable development and social responsibility into its strategy and will conduct comprehensive risk assessments to identify related risks and opportunities. By doing so, Retail Emporium aims to promote long-term value creation for its stakeholders.\n\nOverall, Retail Emporium's commitment to corporate governance, sustainability, and social responsibility has positioned the company as a leader in the retail industry. Through its various initiatives and governance improvements, Retail Emporium continues to enhance its reputation, strengthen stakeholder confidence, and drive long-term sustainable development."
}