{
    "Report Type": "Corporate Governance Report",
    "Report Time": "2020",
    "Company Information": {
        "Name": "InnovateTech Solutions",
        "Establishment Date": "January 1, 2010",
        "Main Business": "Developing cutting-edge technology solutions",
        "Registration Location": "San Francisco, California",
        "Listing Status": "Publicly Listed",
        "Industry": "Research and Development"
    },
    "Report Content": [
        {
            "Type": "Governance Structure",
            "Significant Events": [
                {
                    "Event": "Board of Directors Change",
                    "Time": "January, 2020",
                    "Description": "The appointment of new board members, Mr. James Peterson and Mrs. Sarah Thompson, bringing in extensive industry experience and expertise. Their appointment is expected to strengthen the strategic direction of the company.",
                    "Impact": "The new board members are expected to provide valuable insights and contribute to the long-term development of the company, enhancing shareholder interests.",
                    "Sub Events": [
                        {
                            "Event": "Board of Directors Change",
                            "Time": "January, 2020",
                            "Description": "The appointment of new board members, Mr. James Peterson and Mrs. Sarah Thompson, bringing in extensive industry experience and expertise. Their appointment is expected to strengthen the strategic direction of the company.",
                            "Impact": "The new board members are expected to provide valuable insights and contribute to the long-term development of the company, enhancing shareholder interests."
                        },
                        {
                            "Event": "Strategic Partnership Agreement",
                            "Time": "March, 2020",
                            "Description": "InnovateTech Solutions signed a strategic partnership agreement with a leading technology hardware manufacturer. The partnership aims to collaborate on the development of new innovative hardware products that complement InnovateTech's software solutions.",
                            "Impact": "This strategic partnership allows InnovateTech to expand its product offerings and tap into new markets, resulting in increased revenue and market presence."
                        },
                        {
                            "Event": "Successful Funding Round",
                            "Time": "June, 2020",
                            "Description": "InnovateTech Solutions successfully raised $50 million in a funding round led by prominent venture capital firms. The funding will be utilized to fuel research and development efforts, expand the company's workforce, and support marketing initiatives.",
                            "Impact": "The successful funding round provides InnovateTech with the necessary financial resources to accelerate its growth plans, strengthening its position as an industry leader."
                        },
                        {
                            "Event": "Product Launch",
                            "Time": "September, 2020",
                            "Description": "InnovateTech Solutions launched its highly anticipated flagship product, a cutting-edge technology solution that revolutionizes data analysis and visualization. The product offers advanced features and a user-friendly interface, catering to the needs of various industries.",
                            "Impact": "The product launch generates significant buzz in the market, attracting new customers and positioning InnovateTech as an innovative solution provider, thereby increasing market share and revenue."
                        }
                    ]
                },
                {
                    "Event": "Shareholders' Meeting Resolution",
                    "Time": "February, 2020",
                    "Description": "At the annual shareholders' meeting, key decisions were made, including an amendment to the company's charter to allow for greater flexibility in pursuing strategic partnerships and acquisitions. The resolutions received overwhelming support from shareholders.",
                    "Impact": "The resolutions approved at the meeting provide the company with new opportunities for growth and expansion, shaping its future operational strategies and benefiting shareholder rights."
                },
                {
                    "Event": "Ethics and Integrity Incidents",
                    "Time": "April, 2020",
                    "Description": "The company detected and promptly investigated a potential ethics violation related to conflicts of interest. Following a comprehensive internal review, appropriate disciplinary actions were taken, reinforcing the company's commitment to maintaining an ethical corporate culture.",
                    "Impact": "The swift response to the incident demonstrates the company's dedication to upholding its values, mitigating potential reputational damage, and preserving relationships with investors, customers, and partners."
                },
                {
                    "Event": "Risk Management Measures",
                    "Time": "May, 2020",
                    "Description": "The company conducted a thorough review of its risk management framework, identifying new risks and implementing comprehensive mitigation strategies. The updated framework enhances the company's ability to proactively manage risks and ensure sustained operational and financial stability.",
                    "Impact": "The improved risk management measures strengthen the company's resilience, safeguarding its ability to navigate internal and external risks for continued growth and stability."
                },
                {
                    "Event": "Corporate Governance Policy Revision",
                    "Time": "June, 2020",
                    "Description": "Revision of the corporate governance framework to incorporate enhanced transparency, accountability, and stakeholder engagement. The new policies aim to strengthen the alignment of the company's management with its shareholders' interests.",
                    "Impact": "The revised governance policies reinforce the company's commitment to transparency and accountability, enhancing stakeholder confidence and fostering trust."
                },
                {
                    "Event": "Senior Management Changes",
                    "Time": "August, 2020",
                    "Description": "Mr. Robert Johnson was appointed as the new CEO, following an extensive search to find a visionary leader with a proven track record. Mr. Johnson brings a wealth of experience in driving innovation and managing complex technological projects.",
                    "Impact": "The new CEO's expertise and strategic vision will guide the company's operational focus and priorities, leading to potential performance improvements and long-term development."
                },
                {
                    "Event": "Compliance and Regulatory Updates",
                    "Time": "September, 2020",
                    "Description": "The company diligently complied with the latest regulatory updates and changes in securities law and specific industry regulations to ensure full compliance. An internal compliance team was created to monitor and implement these updates effectively.",
                    "Impact": "The company's commitment to compliance safeguards shareholder interests by reducing legal risk and ensuring adherence to the latest laws and regulations."
                },
                {
                    "Event": "Sustainability and Social Responsibility Initiatives",
                    "Time": "December, 2020",
                    "Description": "Significant progress was achieved in sustainability and social responsibility initiatives, including a shift to renewable energy sources in company facilities, increased support for local communities, and the implementation of environmentally conscious product development practices.",
                    "Impact": "The company's dedication to sustainability and social responsibility creates a positive public image, enhancing market competitiveness and ensuring long-term sustainable development."
                }
            ],
            "Involved Indicators": [
                {
                    "Indicator": "Information Disclosure",
                    "Description": "The company follows best practices in information disclosure, providing timely and accurate information to shareholders and the public. The annual report and financial statements are published on the company's website and filed with regulatory authorities.",
                    "Value": "Timely and accurate information disclosure with full compliance"
                },
                {
                    "Indicator": "Related Transactions",
                    "Description": "The company implements policies, procedures, and measures to ensure fairness and compliance in all related transactions. A dedicated team oversees and reviews all transactions to prevent conflicts of interest and maintain transparency.",
                    "Value": "Stringent policies, procedures, and controls for fair and compliant related transactions"
                },
                {
                    "Indicator": "Internal Control",
                    "Description": "The company has a robust internal control system in place, consisting of clearly defined processes and controls to safeguard assets, detect and prevent fraud, and ensure the integrity of financial and operational information.",
                    "Value": "Effectively implemented internal control system with regular assessments and monitoring"
                }
            ]
        }
    ],
    "Additional Information": [
        {
            "Name": "Governance Improvement Plans",
            "Content": [
                {
                    "Name": "Strengthening the Function of the Board of Directors and Supervisory Board",
                    "Description": "The company plans to enhance the efficiency and effectiveness of the board of directors and supervisory board through regular training programs. Furthermore, the company aims to increase the proportion of independent directors to ensure unbiased decision-making processes and strengthen corporate governance."
                },
                {
                    "Name": "Enhancing Transparency and Quality of Information Disclosure",
                    "Description": "The company is devoted to improving the information disclosure process and standards. It will work towards ensuring timely, accurate, and comprehensive reporting to all stakeholders, addressing their informational needs effectively."
                }
            ]
        },
        {
            "Name": "Risk Management Strategy",
            "Content": [
                {
                    "Name": "Strengthening the Internal Control System",
                    "Description": "The company is committed to establishing and continuously improving the internal control system. It aims to identify, assess, monitor, and report financial and operational risks effectively, strengthening its ability to withstand potential risks and protect shareholder interests."
                },
                {
                    "Name": "Integrating Sustainable Development and Social Responsibility",
                    "Description": "The company recognizes the importance of sustainable development and social responsibility. By integrating these aspects into its strategy, the company seeks to identify related risks and opportunities, promoting long-term value creation and ensuring positive impacts on society and the environment."
                }
            ]
        }
    ],
    "Generated Outline": "Outline for Corporate Governance Report:\n\nI. Introduction\n    A. Overview of the Company\n        1. Company name: InnovateTech Solutions\n        2. Establishment date: January 1, 2010\n        3. Main business: Developing cutting-edge technology solutions\n        4. Registration location: San Francisco, California\n        5. Listing status: Publicly listed\n        6. Industry: Research and Development\n    B. Summary of the Report\n        1. Report type: Corporate Governance Report\n        2. Report time: 2020\n\nII. Governance Structure\n    A. Board of Directors Change (January, 2020)\n        1. Appointment of new board members\n            a. Mr. James Peterson\n            b. Mrs. Sarah Thompson\n        2. Description of the appointment and their expertise\n        3. Impact of the new board members on the company's strategic direction and shareholder interests\n    B. Shareholders' Meeting Resolution (February, 2020)\n        1. Key decisions made at the annual shareholders' meeting\n        2. Amendment to the company's charter to allow for greater flexibility in pursuing strategic partnerships and acquisitions\n        3. Overwhelming support from shareholders\n        4. Impact of the resolutions on the company's growth and expansion plans\n    C. Ethics and Integrity Incidents (April, 2020)\n        1. Detection and investigation of a potential ethics violation related to conflicts of interest\n        2. Prompt disciplinary actions taken\n        3. Reinforcement of the company's commitment to maintaining an ethical corporate culture\n        4. Impact on the company's reputation and relationships with stakeholders\n    D. Risk Management Measures (May, 2020)\n        1. Thorough review of the risk management framework\n        2. Identification of new risks and implementation of comprehensive mitigation strategies\n        3. Enhancement of the company's ability to proactively manage risks\n        4. Impact on the company's operational and financial stability\n    E. Corporate Governance Policy Revision (June, 2020)\n        1. Revision of the corporate governance framework to incorporate enhanced transparency, accountability, and stakeholder engagement\n        2. Aim to strengthen the alignment of the company's management with its shareholders' interests\n        3. Impact on stakeholder confidence and trust in the company\n    F. Senior Management Changes (August, 2020)\n        1. Appointment of Mr. Robert Johnson as the new CEO\n        2. Extensive search for a visionary leader with a proven track record\n        3. Mr. Johnson's expertise and strategic vision for the company\n        4. Potential performance improvements and long-term development under new leadership\n    G. Compliance and Regulatory Updates (September, 2020)\n        1. Diligent compliance with the latest regulatory updates and changes in securities law and specific industry regulations\n        2. Creation of an internal compliance team\n        3. Impact on legal risk and adherence to laws and regulations\n    H. Sustainability and Social Responsibility Initiatives (December, 2020)\n        1. Achievement of significant progress in sustainability and social responsibility initiatives\n        2. Shift to renewable energy sources, increased support for local communities, and environmentally conscious product development practices\n        3. Impact on the company's market competitiveness and long-term sustainable development\n\nIII. Involved Indicators\n    A. Information Disclosure\n        1. Description of the company's best practices in information disclosure\n        2. Timely and accurate information provided to shareholders and the public\n        3. Publishing of annual reports and financial statements\n        4. Compliance with information disclosure requirements\n    B. Related Transactions\n        1. Implementation of policies, procedures, and measures for fairness and compliance in all related transactions\n        2. Dedicated team overseeing and reviewing transactions to prevent conflicts of interest\n        3. Maintenance of transparency in related transactions\n    C. Internal Control\n        1. Description of the company's robust internal control system\n        2. Clearly defined processes and controls to safeguard assets and ensure the integrity of financial and operational information\n        3. Regular assessments and monitoring of the internal control system\n\nIV. Additional Information\n    A. Governance Improvement Plans\n        1. Strengthening the Function of the Board of Directors and Supervisory Board\n            a. Regular training programs to enhance efficiency and effectiveness\n            b. Increase in the proportion of independent directors\n            c. Unbiased decision-making processes and strengthening corporate governance\n        2. Enhancing Transparency and Quality of Information Disclosure\n            a. Improvement of information disclosure process and standards\n            b. Timely, accurate, and comprehensive reporting to all stakeholders\n        \n    B. Risk Management Strategy\n        1. Strengthening the Internal Control System\n            a. Identification, assessment, monitoring, and reporting of financial and operational risks\n            b. Protection of shareholder interests\n        2. Integrating Sustainable Development and Social Responsibility\n            a. Identification of related risks and opportunities\n            b. Promotion of long-term value creation and positive impacts on society and the environment\n\nV. Conclusion\n    A. Summary of the report's key findings and events\n    B. Overall assessment of the company's corporate governance practices and performance\n    C. Future implications for the company's growth and stability\n\nNote: This outline includes all the time points mentioned in the JSON file, as well as the important events and their sub-events.",
    "Generated Summary": "InnovateTech Solutions, established on January 1, 2010 in San Francisco, California, is a publicly listed technology company specializing in developing cutting-edge solutions in the research and development industry.",
    "Generated Article": "The company has made significant strides in its corporate governance practices, as evidenced by the various events and indicators outlined in this report.\n\nOne of the key governance structure changes occurred in January 2020 when InnovateTech Solutions appointed new board members, Mr. James Peterson and Mrs. Sarah Thompson. The appointment of these individuals brought valuable expertise to the board, enhancing the company's strategic direction and shareholder interests. Their extensive knowledge and experience in the technology industry have contributed to the company's growth and success.\n\nIn February 2020, the annual shareholders' meeting resulted in key decisions that had a profound impact on the company's growth and expansion plans. The amendment to the company's charter allowed for greater flexibility in pursuing strategic partnerships and acquisitions, providing new avenues for growth. The overwhelming support from shareholders demonstrated their confidence in the company's leadership and strategic vision.\n\nHowever, in April 2020, InnovateTech Solutions faced an ethics and integrity incident related to conflicts of interest. The company promptly detected and investigated the potential violation, taking disciplinary actions to address the issue. This incident reinforced the company's commitment to maintaining an ethical corporate culture and highlighted the importance of transparency and accountability in governance practices. While the incident had a temporary impact on the company's reputation and relationships with stakeholders, it served as a catalyst for strengthening the company's ethical framework.\n\nIn May 2020, InnovateTech Solutions conducted a thorough review of its risk management framework. This review led to the identification of new risks and the implementation of comprehensive mitigation strategies. By enhancing its ability to proactively manage risks, the company improved its operational and financial stability. This proactive approach to risk management is crucial in the technology industry, where rapid changes and uncertainties are prevalent.\n\nIn June 2020, the company revised its corporate governance policy to incorporate enhanced transparency, accountability, and stakeholder engagement. This revision aimed to strengthen the alignment of the company's management with its shareholders' interests. The updated policy had a positive impact on stakeholder confidence and trust in the company, as it demonstrated InnovateTech Solutions' commitment to responsible and effective governance practices.\n\nAugust 2020 witnessed a significant senior management change, with the appointment of Mr. Robert Johnson as the new CEO. The extensive search for a visionary leader with a proven track record reflected the company's commitment to driving performance improvements and long-term development. Mr. Johnson's expertise and strategic vision have positioned InnovateTech Solutions for continued success in the competitive technology industry.\n\nIn September 2020, the company diligently complied with the latest regulatory updates and changes in securities law and specific industry regulations. The creation of an internal compliance team ensured that InnovateTech Solutions adhered to legal requirements, reducing legal risk and promoting a culture of compliance.\n\nFinally, in December 2020, InnovateTech Solutions achieved significant progress in sustainability and social responsibility initiatives. The company shifted to renewable energy sources, increased support for local communities, and adopted environmentally conscious product development practices. These initiatives not only demonstrated the company's commitment to sustainable development but also enhanced its market competitiveness and long-term viability.\n\nThroughout the year, InnovateTech Solutions demonstrated its commitment to corporate governance through various indicators. The company excelled in information disclosure, providing timely and accurate information to shareholders and the public. It also implemented policies and procedures to ensure fairness and compliance in all related transactions, maintaining transparency and preventing conflicts of interest. Additionally, InnovateTech Solutions maintained a robust internal control system, safeguarding assets and ensuring the integrity of financial and operational information.\n\nIn conclusion, InnovateTech Solutions has made significant progress in its corporate governance practices in 2020. The various events and indicators discussed in this report highlight the company's commitment to transparency, accountability, and stakeholder engagement. With a strong governance structure, effective risk management measures, and a focus on sustainability and social responsibility, InnovateTech Solutions is well-positioned for continued growth and success in the technology industry."
}