{
    "Report Type": "Corporate Financial Report",
    "Report Time": "2020",
    "Company Information": {
        "Name": "InnovateTech Solutions",
        "Establishment Date": "January 1, 2010",
        "Main Business": "Developing cutting-edge technology solutions",
        "Registration Location": "San Francisco, California",
        "Listing Status": "Publicly Listed",
        "Industry": "Research and Development"
    },
    "Report Content": [
        {
            "Type": "Financial Information",
            "Significant Events": [
                {
                    "Event": "Research Breakthrough",
                    "Time": "February, 2020",
                    "Description": "The company achieved a major research breakthrough in the field of artificial intelligence, positioning itself as an industry leader.",
                    "Impact": "Increased market reputation, potential for attracting new clients and investment.",
                    "Sub Events": [
                        {
                            "Event": "Expansion of Research and Development Team",
                            "Time": "January, 2020",
                            "Description": "InnovateTech Solutions expanded its research and development team by hiring top-tier AI researchers and engineers, in anticipation of upcoming breakthroughs in the field of artificial intelligence.",
                            "Impact": "Enhanced research capabilities, increased expertise in AI development."
                        },
                        {
                            "Event": "Strategic Partnership with Tech Giant",
                            "Time": "March, 2020",
                            "Description": "InnovateTech Solutions formed a strategic partnership with a leading technology giant, enabling access to cutting-edge technology resources and research collaboration opportunities.",
                            "Impact": "Access to advanced technology, increased credibility through partnership."
                        },
                        {
                            "Event": "Patent Filing for Breakthrough Innovation",
                            "Time": "April, 2020",
                            "Description": "InnovateTech Solutions filed a patent for its research breakthrough in artificial intelligence, securing intellectual property rights and competitive advantage in the market.",
                            "Impact": "Protection of innovation, potential for licensing and generating revenue from intellectual property."
                        },
                        {
                            "Event": "Investor Funding Round",
                            "Time": "May, 2020",
                            "Description": "InnovateTech Solutions successfully raised a significant amount of funds from investors to support further research and development of its groundbreaking AI technology.",
                            "Impact": "Increased financial resources for expansion and development, potential partnerships with investors."
                        },
                        {
                            "Event": "Industry Recognition and Awards",
                            "Time": "June, 2020",
                            "Description": "InnovateTech Solutions received prestigious industry recognition and awards for its research breakthrough, solidifying its reputation as a leading player in the field of artificial intelligence.",
                            "Impact": "Enhanced market reputation, increased visibility, attracting new clients and investment."
                        }
                    ]
                },
                {
                    "Event": "Large-scale Financing",
                    "Time": "March, 2020",
                    "Description": "The company conducted a large-scale financing activity, raising $50 million of funds.",
                    "Impact": "Strengthened the company's financial strength, supported expansion and development."
                },
                {
                    "Event": "Asset Restructuring",
                    "Time": "April, 2020",
                    "Description": "The company underwent an asset restructuring, optimizing its business structure.",
                    "Impact": "Improved operational efficiency, increased company value."
                },
                {
                    "Event": "Debt Restructuring",
                    "Time": "May, 2020",
                    "Description": "To optimize capital structure, the company underwent debt restructuring, reducing liabilities by $20 million.",
                    "Impact": "Improved the company's financial condition, reduced financial costs."
                },
                {
                    "Event": "Product Launch",
                    "Time": "July, 2020",
                    "Description": "The company successfully launched its flagship product, TechGenius, receiving positive market feedback.",
                    "Impact": "Increased revenue streams, potential for future sales growth."
                },
                {
                    "Event": "Major Asset Acquisition",
                    "Time": "August, 2020",
                    "Description": "The company completed the asset acquisition of TechSoft Inc., with a total value of $100 million.",
                    "Impact": "Expanded the company's business scope, enhanced market competitiveness."
                },
                {
                    "Event": "Major Investment",
                    "Time": "September, 2020",
                    "Description": "The company invested in Project NextGen, with an investment amount of $30 million.",
                    "Impact": "Further broadened the company's business areas, enhanced profitability."
                },
                {
                    "Event": "Strategic Partnership",
                    "Time": "October, 2020",
                    "Description": "The company entered into a strategic partnership with Global Innovations Ltd. to collaborate on future R&D projects.",
                    "Impact": "Access to new markets, shared expertise, potential for increased revenue."
                },
                {
                    "Event": "Significant Equity Acquisition",
                    "Time": "November, 2020",
                    "Description": "The company completed the acquisition of 40% equity of InnovateSoft Inc.",
                    "Impact": "Further expanded the company's market share, enhanced the company's control."
                },
                {
                    "Event": "Dividend Distribution",
                    "Time": "December, 2020",
                    "Description": "The company decided to distribute $5 million of dividends to shareholders.",
                    "Impact": "Returned to the investors, enhanced shareholder returns."
                }
            ],
            "Involved Indicators": [
                {
                    "Indicator": "Operating Income",
                    "Description": "The total amount of main business income and other business income within a certain accounting period.",
                    "Influencing Factors": [
                        "Market Demand",
                        "Changes in Product Prices"
                    ],
                    "Value": "$150 million"
                },
                {
                    "Indicator": "Net Profit",
                    "Description": "The net income of the company within a certain accounting period, i.e., total income minus total costs and taxes.",
                    "Influencing Factors": [
                        "Operating Income",
                        "Cost Control",
                        "Non-recurring Gains and Losses"
                    ],
                    "Value": "$30 million"
                },
                {
                    "Indicator": "Total Assets",
                    "Description": "The total amount of assets owned by the company at the end of the accounting period.",
                    "Influencing Factors": [
                        "Asset Acquisition",
                        "Asset Disposal",
                        "Asset Revaluation"
                    ],
                    "Value": "$500 million"
                },
                {
                    "Indicator": "Total Liabilities",
                    "Description": "The total amount of debts the company is obligated to repay at the end of the accounting period.",
                    "Influencing Factors": [
                        "New Debt Issuance",
                        "Debt Repayment",
                        "Debt Restructuring"
                    ],
                    "Value": "$200 million"
                },
                {
                    "Indicator": "Shareholder Equity",
                    "Description": "The total amount of equity belonging to shareholders at the end of the accounting period.",
                    "Influencing Factors": [
                        "Net Profit",
                        "Dividend Distribution",
                        "Capital Reserves"
                    ],
                    "Value": "$300 million"
                },
                {
                    "Indicator": "Cash Flow",
                    "Description": "The total cash inflows and outflows of the company within a certain accounting period.",
                    "Influencing Factors": [
                        "Operating Activities",
                        "Investment Activities",
                        "Financing Activities"
                    ],
                    "Value": "$50 million"
                },
                {
                    "Indicator": "Debt Ratio",
                    "Description": "The ratio of total liabilities to total assets, reflecting the company's debt level.",
                    "Influencing Factors": [
                        "Changes in Total Liabilities",
                        "Changes in Total Assets"
                    ],
                    "Value": "40%"
                },
                {
                    "Indicator": "Debt to Assets Ratio",
                    "Description": "The percentage of total liabilities to total assets, a measure of the company's financial leverage.",
                    "Influencing Factors": [
                        "Increases or decreases in assets and liabilities"
                    ],
                    "Value": "0.4"
                },
                {
                    "Indicator": "Return on Equity",
                    "Description": "Reflects the operational efficiency of shareholder equity, namely the ratio of net profit to average shareholder equity.",
                    "Influencing Factors": [
                        "Change in Net Profit",
                        "Change in Shareholder Equity"
                    ],
                    "Value": "10%"
                }
            ]
        }
    ],
    "Additional Information": [
        {
            "Name": "Future Outlook",
            "Content": [
                {
                    "Name": "Financial Strategy",
                    "Description": "The company plans to implement a financial strategy focused on optimizing cost control measures and leveraging capital operations to fund future projects and R&D initiatives."
                },
                {
                    "Name": "Investment Plans",
                    "Description": "In the upcoming years, InnovateTech Solutions intends to invest heavily in new innovative projects and research, with a focus on emerging technologies such as blockchain, artificial intelligence, and renewable energy."
                },
                {
                    "Name": "Risk Management",
                    "Description": "The company has identified several major financial risks, including market volatility, technological obsolescence, and regulatory changes. To manage these risks, InnovateTech Solutions plans to diversify its product offerings, maintain a strong research pipeline, and stay updated with relevant industry regulations and standards."
                }
            ]
        }
    ],
    "Generated Outline": "I. Introduction\n    - Report Type: Corporate Financial Report\n    - Report Time: 2020\n    - Company Information:\n        - Name: InnovateTech Solutions\n        - Establishment Date: January 1, 2010\n        - Main Business: Developing cutting-edge technology solutions\n        - Registration Location: San Francisco, California\n        - Listing Status: Publicly Listed\n        - Industry: Research and Development\n        \nII. Financial Information\n    A. Research Breakthrough (February, 2020)\n        - Description: The company achieved a major research breakthrough in the field of artificial intelligence, positioning itself as an industry leader.\n        - Impact:\n            - Increased market reputation\n            - Potential for attracting new clients and investment\n        - Sub Events:\n            1. Expansion of Research and Development Team (January, 2020)\n                - Description: InnovateTech Solutions expanded its research and development team by hiring top-tier AI researchers and engineers, in anticipation of upcoming breakthroughs in the field of artificial intelligence.\n                - Impact:\n                    - Enhanced research capabilities\n                    - Increased expertise in AI development\n            2. Strategic Partnership with Tech Giant (March, 2020)\n                - Description: InnovateTech Solutions formed a strategic partnership with a leading technology giant, enabling access to cutting-edge technology resources and research collaboration opportunities.\n                - Impact:\n                    - Access to advanced technology\n                    - Increased credibility through partnership\n            3. Patent Filing for Breakthrough Innovation (April, 2020)\n                - Description: InnovateTech Solutions filed a patent for its research breakthrough in artificial intelligence, securing intellectual property rights and competitive advantage in the market.\n                - Impact:\n                    - Protection of innovation\n                    - Potential for licensing and generating revenue from intellectual property\n            4. Investor Funding Round (May, 2020)\n                - Description: InnovateTech Solutions successfully raised a significant amount of funds from investors to support further research and development of its groundbreaking AI technology.\n                - Impact:\n                    - Increased financial resources for expansion and development\n                    - Potential partnerships with investors\n            5. Industry Recognition and Awards (June, 2020)\n                - Description: InnovateTech Solutions received prestigious industry recognition and awards for its research breakthrough, solidifying its reputation as a leading player in the field of artificial intelligence.\n                - Impact:\n                    - Enhanced market reputation\n                    - Increased visibility\n                    - Attracting new clients and investment\n\n    B. Large-scale Financing (March, 2020)\n        - Description: The company conducted a large-scale financing activity, raising $50 million of funds.\n        - Impact:\n            - Strengthened the company's financial strength\n            - Supported expansion and development\n\n    C. Asset Restructuring (April, 2020)\n        - Description: The company underwent an asset restructuring, optimizing its business structure.\n        - Impact:\n            - Improved operational efficiency\n            - Increased company value\n\n    D. Debt Restructuring (May, 2020)\n        - Description: To optimize capital structure, the company underwent debt restructuring, reducing liabilities by $20 million.\n        - Impact:\n            - Improved the company's financial condition\n            - Reduced financial costs\n\n    E. Product Launch (July, 2020)\n        - Description: The company successfully launched its flagship product, TechGenius, receiving positive market feedback.\n        - Impact:\n            - Increased revenue streams\n            - Potential for future sales growth\n\n    F. Major Asset Acquisition (August, 2020)\n        - Description: The company completed the asset acquisition of TechSoft Inc., with a total value of $100 million.\n        - Impact:\n            - Expanded the company's business scope\n            - Enhanced market competitiveness\n\n    G. Major Investment (September, 2020)\n        - Description: The company invested in Project NextGen, with an investment amount of $30 million.\n        - Impact:\n            - Further broadened the company's business areas\n            - Enhanced profitability\n\n    H. Strategic Partnership (October, 2020)\n        - Description: The company entered into a strategic partnership with Global Innovations Ltd. to collaborate on future R&D projects.\n        - Impact:\n            - Access to new markets\n            - Shared expertise\n            - Potential for increased revenue\n\n    I. Significant Equity Acquisition (November, 2020)\n        - Description: The company completed the acquisition of 40% equity of InnovateSoft Inc.\n        - Impact:\n            - Further expanded the company's market share\n            - Enhanced the company's control\n\n    J. Dividend Distribution (December, 2020)\n        - Description: The company decided to distribute $5 million of dividends to shareholders.\n        - Impact:\n            - Returned to the investors\n            - Enhanced shareholder returns\n\n    K. Involved Indicators:\n        1. Operating Income ($150 million)\n            - Description: The total amount of main business income and other business income within a certain accounting period.\n            - Influencing Factors:\n                - Market Demand\n                - Changes in Product Prices\n        2. Net Profit ($30 million)\n            - Description: The net income of the company within a certain accounting period, i.e., total income minus total costs and taxes.\n            - Influencing Factors:\n                - Operating Income\n                - Cost Control\n                - Non-recurring Gains and Losses\n        3. Total Assets ($500 million)\n            - Description: The total amount of assets owned by the company at the end of the accounting period.\n            - Influencing Factors:\n                - Asset Acquisition\n                - Asset Disposal\n                - Asset Revaluation\n        4. Total Liabilities ($200 million)\n            - Description: The total amount of debts the company is obligated to repay at the end of the accounting period.\n            - Influencing Factors:\n                - New Debt Issuance\n                - Debt Repayment\n                - Debt Restructuring\n        5. Shareholder Equity ($300 million)\n            - Description: The total amount of equity belonging to shareholders at the end of the accounting period.\n            - Influencing Factors:\n                - Net Profit\n                - Dividend Distribution\n                - Capital Reserves\n        6. Cash Flow ($50 million)\n            - Description: The total cash inflows and outflows of the company within a certain accounting period.\n            - Influencing Factors:\n                - Operating Activities\n                - Investment Activities\n                - Financing Activities\n        7. Debt Ratio (40%)\n            - Description: The ratio of total liabilities to total assets, reflecting the company's debt level.\n            - Influencing Factors:\n                - Changes in Total Liabilities\n                - Changes in Total Assets\n        8. Debt to Assets Ratio (0.4)\n            - Description: The percentage of total liabilities to total assets, a measure of the company's financial leverage.\n            - Influencing Factors:\n                - Increases or decreases in assets and liabilities\n        9. Return on Equity (10%)\n            - Description: Reflects the operational efficiency of shareholder equity, namely the ratio of net profit to average shareholder equity.\n            - Influencing Factors:\n                - Change in Net Profit\n                - Change in Shareholder Equity\n                \nIII. Additional Information\n    A. Future Outlook\n        1. Financial Strategy\n            - Description: The company plans to implement a financial strategy focused on optimizing cost control measures and leveraging capital operations to fund future projects and R&D initiatives.\n        2. Investment Plans\n            - Description: In the upcoming years, InnovateTech Solutions intends to invest heavily in new innovative projects and research, with a focus on emerging technologies such as blockchain, artificial intelligence, and renewable energy.\n        3. Risk Management\n            - Description: The company has identified several major financial risks, including market volatility, technological obsolescence, and regulatory changes. To manage these risks, InnovateTech Solutions plans to diversify its product offerings, maintain a strong research pipeline, and stay updated with relevant industry regulations and standards.",
    "Generated Summary": "InnovateTech Solutions, established on January 1, 2010 in San Francisco, California, is a publicly listed company specializing in developing cutting-edge technology solutions in the research and development industry.",
    "Generated Article": "In February 2020, InnovateTech Solutions achieved a major research breakthrough in the field of artificial intelligence, positioning itself as an industry leader. This breakthrough had a significant impact on the company, leading to increased market reputation and the potential for attracting new clients and investment. To further strengthen its research capabilities, InnovateTech Solutions expanded its research and development team in January 2020 by hiring top-tier AI researchers and engineers. This expansion enhanced the company's research capabilities and increased its expertise in AI development.\n\nIn March 2020, InnovateTech Solutions formed a strategic partnership with a leading technology giant, enabling access to cutting-edge technology resources and research collaboration opportunities. This partnership provided InnovateTech Solutions with access to advanced technology and increased its credibility through the association with a renowned industry player. In April 2020, the company filed a patent for its research breakthrough in artificial intelligence, securing intellectual property rights and gaining a competitive advantage in the market. This patent filing protected the company's innovation and opened up potential opportunities for licensing and generating revenue from its intellectual property.\n\nTo support further research and development of its groundbreaking AI technology, InnovateTech Solutions successfully raised a significant amount of funds from investors in a funding round conducted in May 2020. This infusion of financial resources provided the company with the necessary capital for expansion and development, as well as the potential for partnerships with investors. In June 2020, InnovateTech Solutions received prestigious industry recognition and awards for its research breakthrough, solidifying its reputation as a leading player in the field of artificial intelligence. This recognition enhanced the company's market reputation, increased its visibility, and attracted new clients and investment.\n\nIn March 2020, InnovateTech Solutions conducted a large-scale financing activity, raising $50 million of funds. This financing activity strengthened the company's financial strength and provided support for its expansion and development. In April 2020, the company underwent an asset restructuring, optimizing its business structure. This restructuring improved operational efficiency and increased the company's value. In May 2020, InnovateTech Solutions underwent debt restructuring, reducing its liabilities by $20 million. This debt restructuring improved the company's financial condition and reduced its financial costs.\n\nIn July 2020, InnovateTech Solutions successfully launched its flagship product, TechGenius, which received positive market feedback. This product launch increased the company's revenue streams and opened up potential for future sales growth. In August 2020, the company completed the asset acquisition of TechSoft Inc., with a total value of $100 million. This acquisition expanded InnovateTech Solutions' business scope and enhanced its market competitiveness. In September 2020, the company made a major investment of $30 million in Project NextGen, further broadening its business areas and enhancing profitability.\n\nIn October 2020, InnovateTech Solutions entered into a strategic partnership with Global Innovations Ltd. to collaborate on future R&D projects. This partnership provided access to new markets, shared expertise, and the potential for increased revenue. In November 2020, the company completed the acquisition of 40% equity of InnovateSoft Inc., further expanding its market share and enhancing its control. In December 2020, InnovateTech Solutions decided to distribute $5 million of dividends to shareholders, returning value to the investors and enhancing shareholder returns.\n\nThroughout the year 2020, InnovateTech Solutions achieved impressive financial performance. The company reported an operating income of $150 million, driven by strong market demand and changes in product prices. Net profit reached $30 million, reflecting the company's effective cost control measures, non-recurring gains and losses, and overall operational efficiency. InnovateTech Solutions' total assets stood at $500 million, influenced by asset acquisitions, disposals, and revaluations. The company successfully reduced its total liabilities to $200 million through debt restructuring, improving its financial condition and reducing financial costs. Shareholder equity reached $300 million, driven by net profit, dividend distribution, and capital reserves. The company generated a cash flow of $50 million, resulting from its operating activities, investment activities, and financing activities.\n\nIn terms of financial ratios, InnovateTech Solutions maintained a debt ratio of 40%, reflecting a balanced level of debt compared to its total assets. The company's debt to assets ratio stood at 0.4, indicating a moderate level of financial leverage. Return on equity reached 10%, highlighting the company's efficient utilization of shareholder equity to generate profits.\n\nLooking ahead, InnovateTech Solutions plans to implement a financial strategy focused on optimizing cost control measures and leveraging capital operations to fund future projects and R&D initiatives. The company intends to invest heavily in new innovative projects and research, with a particular focus on emerging technologies such as blockchain, artificial intelligence, and renewable energy. To manage financial risks, InnovateTech Solutions will diversify its product offerings, maintain a strong research pipeline, and stay updated with relevant industry regulations and standards.\n\nIn conclusion, InnovateTech Solutions has demonstrated its ability to achieve significant milestones and financial success in 2020. The company's research breakthrough in artificial intelligence, strategic partnerships, financing activities, asset and debt restructuring, product launch, asset acquisition, investments, and equity acquisition have all contributed to its growth and market position. With a strong financial foundation and a focus on future innovation, InnovateTech Solutions is well-positioned to continue its success in the research and development industry."
}