{
    "报告类型": "公司环境与社会责任报告",
    "报告时间": "2021年度",
    "公司信息": {
        "名称": "拓远科技有限公司",
        "成立日期": "2005年3月",
        "主营业务": "拓远科技专注于智能手机和电子产品的研发、生产和销售",
        "注册地": "中国上海",
        "上市情况": "公司于2010年在上海证券交易所上市",
        "行业": "制造"
    },
    "报告内容": [
        {
            "类型": "环境责任",
            "重要事件": [
                {
                    "事件": "绿色产品开发",
                    "时间": "2021年1月",
                    "描述": "公司开发的环保型产品，减少对环境的影响。",
                    "影响": "提升了产品的市场竞争力和品牌形象，同时减少了环境影响。",
                    "子事件": [
                        {
                            "事件": "研发新技术",
                            "时间": "2021年1月-2021年3月",
                            "描述": "拓远科技在报告年度内进行了一项新技术的研发工作。该新技术能够在智能手机和电子产品中降低能耗，提高能源利用效率。",
                            "影响": "研发新技术有助于公司提高产品的竞争力，并减少能源消耗，进而降低生产成本，提高利润率。"
                        },
                        {
                            "事件": "设立绿色产品部门",
                            "时间": "2021年4月",
                            "描述": "拓远科技为推动绿色产品开发，决定设立一个专门的绿色产品部门。该部门将负责引领绿色产品的研发、设计和生产。",
                            "影响": "设立绿色产品部门有助于公司在环保方面的形象建设，并提升公司在绿色产品市场的竞争力。"
                        },
                        {
                            "事件": "制定绿色产品开发计划",
                            "时间": "2021年5月",
                            "描述": "绿色产品部门制定了一份详细的绿色产品开发计划。该计划包括了新产品的设计、研发进度和生产投入等方面的内容。",
                            "影响": "制定绿色产品开发计划能够提高研发和生产过程的效率，同时确保绿色产品按时投入市场，增加公司的收入来源。"
                        },
                        {
                            "事件": "绿色产品生产投入",
                            "时间": "2021年6月",
                            "描述": "根据绿色产品开发计划，拓远科技开始将资源投入到绿色产品的生产中。",
                            "影响": "绿色产品生产投入有望提升公司的产能和销售额，进一步巩固公司在市场的领先地位。"
                        }
                    ]
                },
                {
                    "事件": "节能减排项目实施",
                    "时间": "2021年8月",
                    "描述": "公司投资实施的节能减排项目，旨在减少能源消耗和温室气体排放。",
                    "影响": "直接减少了公司的能源消耗和碳足迹，提高了能效和环境绩效。"
                },
                {
                    "事件": "防止污染设施的建设",
                    "时间": "2021年9月",
                    "描述": "公司建立新的污染防治设施，如废水处理系统和排放控制设备，以减少环境污染。",
                    "影响": "显著降低了公司的环境污染水平，增强了合规性和社会责任感。"
                },
                {
                    "事件": "投资于碳抵消项目",
                    "时间": "2021年10月",
                    "描述": "公司通过投资林业项目或可再生能源项目来抵消其碳排放，努力实现碳中和目标。",
                    "影响": "通过碳抵消证书，公司能够向利益相关者展示其对环境的承诺和责任。"
                },
                {
                    "事件": "采用环境管理系统",
                    "时间": "2021年11月",
                    "描述": "公司实施环境管理系统（EMS），以提高环境绩效，减少废物产生，并确保合规。",
                    "影响": "增强了公司的环境管理能力和持续改进，提升了合规性和市场认可度。"
                }
            ],
            "涉及的指标": [
                {
                    "指标": "二氧化碳排放量",
                    "描述": "公司在生产过程中产生的二氧化碳总量。",
                    "影响因素": [
                        "生产规模的变化",
                        "节能技术的应用"
                    ],
                    "值": "112,500吨"
                },
                {
                    "指标": "能源消耗",
                    "描述": "公司在运营过程中消耗的能源总量。",
                    "影响因素": [
                        "生产效率的提高",
                        "能源管理措施的实施"
                    ],
                    "值": "280,000吨标准煤"
                }
            ]
        },
        {
            "类型": "社会责任",
            "重要事件": [
                {
                    "事件": "员工职业成长和人才发展计划",
                    "时间": "2021年3月",
                    "描述": "公司提供各类培训和发展项目，支持员工职业成长，包括在线课程、工作坊、导师计划等。",
                    "影响": "提高了员工的专业技能和工作满意度，促进了人才的留存和发展。"
                },
                {
                    "事件": "员工健康与安全计划",
                    "时间": "2021年4月",
                    "描述": "公司实施的旨在提升员工健康与安全的措施。",
                    "影响": "显著改善了工作环境，减少了工伤事故，提高了员工的健康与安全水平。"
                },
                {
                    "事件": "参与慈善活动",
                    "时间": "2021年6月",
                    "描述": "公司参与或资助慈善活动和慈善机构，以支持教育、健康、减贫等领域。",
                    "影响": "提高了公司的社会形象和品牌认知，加强了与社区的联系和支持。"
                },
                {
                    "事件": "社区支持和发展项目",
                    "时间": "2021年8月",
                    "描述": "公司投资于当地社区，支持教育、健康和社会发展项目。",
                    "影响": "加深了公司与社区的联系，促进了社区的整体福祉和发展。"
                },
                {
                    "事件": "参与公共服务项目",
                    "时间": "2021年11月",
                    "描述": "公司投资或参与公共服务项目，如城市绿化、公共卫生改善项目，以提升社区生活质量。",
                    "影响": "促进了社区的可持续发展，增强了公众对公司的积极感知。"
                }
            ],
            "涉及的指标": [
                {
                    "指标": "员工满意度",
                    "描述": "通过调查得到的员工对公司环境和政策满意度的度量。",
                    "影响因素": [
                        "工作环境的改善",
                        "员工福利政策的调整"
                    ],
                    "值": "85%"
                },
                {
                    "指标": "社区投资额",
                    "描述": "公司在社区发展项目上的投资总额。",
                    "影响因素": [
                        "公司的财务状况",
                        "社会责任战略的变化"
                    ],
                    "值": "500,000元"
                }
            ]
        }
    ],
    "额外信息": [
        {
            "名称": "未来展望",
            "内容": [
                {
                    "名称": "环境保护计划",
                    "描述": "采取一系列措施减少其运营对环境的影响。"
                },
                {
                    "名称": "社会责任战略",
                    "描述": "在业务实践中积极履行社会责任，包括促进社区发展、改善员工福利、提供公平就业机会和参与公益活动。"
                },
                {
                    "名称": "可持续发展目标",
                    "描述": "通过整合可持续性原则到业务模型和决策过程中，致力于实现联合国可持续发展目标（SDGs）。"
                }
            ]
        }
    ],
    "生成大纲": "报告大纲：\nI. 公司信息\n- 公司名称：拓远科技有限公司\n- 成立日期：2005年3月\n- 主营业务：拓远科技专注于智能手机和电子产品的研发、生产和销售\n- 注册地：中国上海\n- 上市情况：公司于2010年在上海证券交易所上市\n- 行业：制造\n\nII. 环境责任\nA. 重要事件\n1. 绿色产品开发：\n   - 时间：2021年1月\n   - 描述：公司开发的环保型产品，减少对环境的影响。\n   - 影响：提升了产品的市场竞争力和品牌形象，同时减少了环境影响。\n   - 子事件：\n     - 研发新技术：2021年1月-2021年3月，降低能耗，提高能源利用效率。\n     - 设立绿色产品部门：2021年4月，研发、设计和生产绿色产品。\n     - 制定绿色产品开发计划：2021年5月，提高研发和生产过程的效率。\n     - 绿色产品生产投入：2021年6月，提升公司的产能和销售额。\n2. 节能减排项目实施：\n   - 时间：2021年8月\n   - 描述：公司投资实施的节能减排项目，减少能源消耗和温室气体排放。\n   - 影响：直接减少了公司的能源消耗和碳足迹，提高了能效和环境绩效。\n3. 防止污染设施的建设：\n   - 时间：2021年9月\n   - 描述：公司建立新的污染防治设施，如废水处理系统和排放控制设备，减少环境污染。\n   - 影响：降低了公司的环境污染水平，增强了合规性和社会责任感。\n4. 投资于碳抵消项目：\n   - 时间：2021年10月\n   - 描述：公司通过投资林业项目或可再生能源项目来抵消其碳排放，实现碳中和目标。\n   - 影响：向利益相关者展示其对环境的承诺和责任。\n5. 采用环境管理系统：\n   - 时间：2021年11月\n   - 描述：公司实施环境管理系统（EMS），提高环境绩效，减少废物产生，并确保合规。\n   - 影响：增强了公司的环境管理能力和持续改进，提升了合规性和市场认可度。\n\nB. 涉及的指标\n1. 二氧化碳排放量：\n   - 描述：公司在生产过程中产生的二氧化碳总量。\n   - 影响因素：生产规模的变化，节能技术的应用\n   - 值：112,500吨\n2. 能源消耗：\n   - 描述：公司在运营过程中消耗的能源总量。\n   - 影响因素：生产效率的提高，能源管理措施的实施\n   - 值：280,000吨标准煤\n\nIII. 社会责任\nA. 重要事件\n1. 员工职业成长和人才发展计划：\n   - 时间：2021年3月\n   - 描述：公司提供各类培训和发展项目，支持员工职业成长。\n   - 影响：提高了员工的专业技能和工作满意度，促进了人才的留存和发展。\n2. 员工健康与安全计划：\n   - 时间：2021年4月\n   - 描述：公司实施的旨在提升员工健康与安全的措施。\n   - 影响：改善了工作环境，减少了工伤事故，提高了员工的健康与安全水平。\n3. 参与慈善活动：\n   - 时间：2021年6月\n   - 描述：公司参与或资助慈善活动和慈善机构，支持教育、健康、减贫等领域。\n   - 影响：提高了公司的社会形象和品牌认知，加强了与社区的联系和支持。\n4. 社区支持和发展项目：\n   - 时间：2021年8月\n   - 描述：公司投资于当地社区，支持教育、健康和社会发展项目。\n   - 影响：加深了公司与社区的联系，促进了社区的整体福祉和发展。\n5. 参与公共服务项目：\n   - 时间：2021年11月\n   - 描述：公司投资或参与公共服务项目，如城市绿化、公共卫生改善项目。\n   - 影响：促进了社区的可持续发展，增强了公众对公司的积极感知。\n\nB. 涉及的指标\n1. 员工满意度：\n   - 描述：通过调查得到的员工对公司环境和政策满意度的度量。\n   - 影响因素：工作环境的改善，员工福利政策的调整\n   - 值：85%\n2. 社区投资额：\n   - 描述：公司在社区发展项目上的投资总额。\n   - 影响因素：公司的财务状况，社会责任战略的变化\n   - 值：500,000元\n\nIV. 未来展望\n- 环境保护计划：采取一系列措施减少其运营对环境的影响。\n- 社会责任战略：在业务实践中积极履行社会责任，包括促进社区发展、改善员工福利、提供公平就业机会和参与公益活动。\n- 可持续发展目标：通过整合可持续性原则到业务模型和决策过程中，致力于实现联合国可持续发展目标（SDGs）。",
    "生成总结": "拓远科技有限公司是一家2005年在中国上海成立的制造公司，主营业务为智能手机和电子产品的研发、生产和销售，于2010年在上海证券交易所上市。",
    "生成文章": "为了履行环境责任，拓远科技采取了一系列重要事件来减少对环境的影响。首先，公司于2021年1月开发了绿色产品，以减少对环境的影响。这一举措不仅提升了产品的市场竞争力和品牌形象，还减少了公司的环境影响。在绿色产品开发过程中，公司研发了新技术，降低了能耗并提高了能源利用效率。随后，公司设立了绿色产品部门，并制定了绿色产品开发计划，以提高研发和生产过程的效率。在2021年6月，公司投入了大量资源来提升绿色产品的生产能力和销售额。\n\n另外，公司于2021年8月实施了节能减排项目，通过投资实施一系列措施来减少能源消耗和温室气体排放。这一举措直接减少了公司的能源消耗和碳足迹，提高了能效和环境绩效。\n\n为了防止环境污染，公司于2021年9月建立了新的污染防治设施，如废水处理系统和排放控制设备。这些设施的建设降低了公司的环境污染水平，增强了公司的合规性和社会责任感。\n\n此外，公司于2021年10月投资于碳抵消项目，通过投资林业项目或可再生能源项目来抵消其碳排放，实现碳中和目标。这一举措向利益相关者展示了公司对环境的承诺和责任。\n\n为了提高环境管理能力和持续改进，公司于2021年11月实施了环境管理系统（EMS）。该系统有助于提高公司的环境绩效，减少废物产生，并确保合规。通过采用环境管理系统，公司增强了其环境管理能力和市场认可度。\n\n在这些环境责任事件中，公司涉及的指标包括二氧化碳排放量和能源消耗。公司在生产过程中产生的二氧化碳排放量为112,500吨，而能源消耗为280,000吨标准煤。这些指标受到生产规模的变化、节能技术的应用、生产效率的提高和能源管理措施的实施等因素的影响。\n\n除了环境责任，拓远科技也积极履行社会责任。公司于2021年3月推出了员工职业成长和人才发展计划，通过提供各类培训和发展项目来支持员工的职业成长。这一举措提高了员工的专业技能和工作满意度，促进了人才的留存和发展。\n\n为了提升员工的健康与安全水平，公司于2021年4月实施了员工健康与安全计划。通过改善工作环境和实施相关措施，公司减少了工伤事故，提高了员工的健康与安全水平。\n\n在社区方面，公司于2021年6月参与或资助了慈善活动和慈善机构，支持教育、健康、减贫等领域。这些举措提高了公司的社会形象和品牌认知，加强了与社区的联系和支持。\n\n此外，公司于2021年8月投资于当地社区，支持教育、健康和社会发展项目。这些投资加深了公司与社区的联系，促进了社区的整体福祉和发展。\n\n为了促进社区的可持续发展，公司于2021年11月投资或参与公共服务项目，如城市绿化和公共卫生改善项目。这些举措促进了社区的可持续发展，增强了公众对公司的积极感知。\n\n在社会责任方面，公司涉及的指标包括员工满意度和社区投资额。根据调查，员工对公司环境和政策的满意度达到了85%。而公司在社区发展项目上的投资总额为500,000元。\n\n未来展望方面，拓远科技将继续采取一系列措施来减少其运营对环境的影响。公司将继续实施环境保护计划，通过减少能源消耗、优化生产过程和推广可持续技术来降低碳排放和环境影响。\n\n同时，公司将继续履行社会责任，包括促进社区发展、改善员工福利、提供公平就业机会和参与公益活动。公司将整合可持续性原则到业务模型和决策过程中，致力于实现联合国可持续发展目标（SDGs）。\n\n综上所述，拓远科技有限公司在环境责任和社会责任方面采取了一系列重要事件，通过绿色产品开发、节能减排项目实施、防止污染设施的建设、投资于碳抵消项目和采用环境管理系统等措施，积极履行其环境和社会责任。这些举措不仅提升了公司的市场竞争力和品牌形象，还增强了公司与利益相关者的联系和支持。未来，公司将继续努力减少对环境的影响，履行社会责任，并致力于实现可持续发展目标。"
}