{
    "Report Type": "Corporate Financial Report",
    "Report Time": "2021",
    "Company Information": {
        "Name": "InnovateTech Solutions",
        "Establishment Date": "March 15, 2010",
        "Main Business": "Providing innovative software solutions for enterprises",
        "Registration Location": "Silicon Valley, California, USA",
        "Listing Status": "Listed on NASDAQ",
        "Industry": "IT"
    },
    "Report Content": [
        {
            "Type": "Financial Information",
            "Significant Events": [
                {
                    "Event": "Major Investment",
                    "Time": "January, 2021",
                    "Description": "The company invested $10 million in Project X, a groundbreaking AI-driven analytics platform.",
                    "Impact": "Further broadened the company's business areas, enhanced profitability.",
                    "Sub Events": [
                        {
                            "Event": "Project X Development",
                            "Time": "January, 2021",
                            "Description": "InnovateTech Solutions began development of Project X, an innovative AI-driven analytics platform.",
                            "Impact": "Laid the foundation for the future success of Project X and potential revenue streams."
                        },
                        {
                            "Event": "Strategic Partnership with Industry Leader",
                            "Time": "February, 2021",
                            "Description": "InnovateTech Solutions formed a strategic partnership with a leading player in the data analytics industry, leveraging their expertise and resources.",
                            "Impact": "This partnership provided access to a wider customer base and enhanced the company's credibility and market position."
                        },
                        {
                            "Event": "Expansion of R&D Team",
                            "Time": "March, 2021",
                            "Description": "InnovateTech Solutions hired additional skilled professionals to strengthen the Research and Development team specifically dedicated to Project X.",
                            "Impact": "Increased capacity for faster development and improved product quality."
                        },
                        {
                            "Event": "Product Testing and Iteration",
                            "Time": "April - June, 2021",
                            "Description": "Extensive testing and iteration of Project X's functionalities and user experience to ensure a robust and user-friendly product.",
                            "Impact": "Achieved a high-quality product that meets customer expectations and increases market competitiveness."
                        },
                        {
                            "Event": "Strategic Marketing Campaign",
                            "Time": "July - August, 2021",
                            "Description": "Launched a comprehensive marketing campaign to create awareness and generate interest in Project X among targeted industries.",
                            "Impact": "Increased visibility, generated leads, and potential customers for Project X."
                        },
                        {
                            "Event": "Product Launch",
                            "Time": "September, 2021",
                            "Description": "InnovateTech Solutions officially launched Project X to the market, making it available for purchase and implementation.",
                            "Impact": "Commenced revenue generation from the sale of Project X licenses and associated services."
                        }
                    ]
                },
                {
                    "Event": "Dividend Distribution",
                    "Time": "February, 2021",
                    "Description": "The company decided to distribute $1.5 million as dividends to shareholders.",
                    "Impact": "Returned to the investors, enhanced shareholder returns."
                },
                {
                    "Event": "Asset Restructuring",
                    "Time": "March, 2021",
                    "Description": "The company underwent an asset restructuring, optimizing its business structure and consolidating resources in key growth areas.",
                    "Impact": "Improved operational efficiency, increased company value."
                },
                {
                    "Event": "Debt Restructuring",
                    "Time": "June, 2021",
                    "Description": "To optimize capital structure, the company underwent debt restructuring, reducing liabilities by $5 million.",
                    "Impact": "Improved the company's financial condition, reduced financial costs."
                },
                {
                    "Event": "Significant Equity Acquisition",
                    "Time": "September, 2021",
                    "Description": "The company completed the acquisition of 30% equity of Data Analytics Corp.",
                    "Impact": "Further expanded the company's market share, enhanced the company's control."
                },
                {
                    "Event": "Major Asset Acquisition",
                    "Time": "October, 2021",
                    "Description": "The company completed the asset acquisition of Tech Solutions Ltd., with a total value of $8 million.",
                    "Impact": "Expanded the company's business scope, enhanced market competitiveness."
                },
                {
                    "Event": "Large-scale Financing",
                    "Time": "November, 2021",
                    "Description": "The company conducted a large-scale financing activity, raising $20 million through a successful IPO.",
                    "Impact": "Strengthened the company's financial strength, supported expansion and development."
                },
                {
                    "Event": "Major Partnership",
                    "Time": "December, 2021",
                    "Description": "In December, InnovateTech Solutions entered into a strategic partnership with GlobalTech Corporation, aiming to jointly develop advanced cloud-based solutions.",
                    "Impact": "Expanded market reach, increased revenue potential."
                }
            ],
            "Involved Indicators": [
                {
                    "Indicator": "Operating Income",
                    "Description": "The total amount of main business income and other business income within a certain accounting period.",
                    "Influencing Factors": [
                        "Market Demand",
                        "Changes in Product Prices"
                    ],
                    "Value": "Please Fill In"
                },
                {
                    "Indicator": "Net Profit",
                    "Description": "The net income of the company within a certain accounting period, i.e., total income minus total costs and taxes.",
                    "Influencing Factors": [
                        "Operating Income",
                        "Cost Control",
                        "Non-recurring Gains and Losses"
                    ],
                    "Value": "Please Fill In"
                },
                {
                    "Indicator": "Total Assets",
                    "Description": "The total amount of assets owned by the company at the end of the accounting period.",
                    "Influencing Factors": [
                        "Asset Acquisition",
                        "Asset Disposal",
                        "Asset Revaluation"
                    ],
                    "Value": "Please Fill In"
                },
                {
                    "Indicator": "Total Liabilities",
                    "Description": "The total amount of debts the company is obligated to repay at the end of the accounting period.",
                    "Influencing Factors": [
                        "New Debt Issuance",
                        "Debt Repayment",
                        "Debt Restructuring"
                    ],
                    "Value": "Please Fill In"
                },
                {
                    "Indicator": "Shareholder Equity",
                    "Description": "The total amount of equity belonging to shareholders at the end of the accounting period.",
                    "Influencing Factors": [
                        "Net Profit",
                        "Dividend Distribution",
                        "Capital Reserves"
                    ],
                    "Value": "Please Fill In"
                },
                {
                    "Indicator": "Cash Flow",
                    "Description": "The total cash inflows and outflows of the company within a certain accounting period.",
                    "Influencing Factors": [
                        "Operating Activities",
                        "Investment Activities",
                        "Financing Activities"
                    ],
                    "Value": "Please Fill In"
                },
                {
                    "Indicator": "Debt Ratio",
                    "Description": "The ratio of total liabilities to total assets, reflecting the company's debt level.",
                    "Influencing Factors": [
                        "Changes in Total Liabilities",
                        "Changes in Total Assets"
                    ],
                    "Value": "Please Fill In"
                },
                {
                    "Indicator": "Debt to Assets Ratio",
                    "Description": "The percentage of total liabilities to total assets, a measure of the company's financial leverage.",
                    "Influencing Factors": [
                        "Increases or decreases in assets and liabilities"
                    ],
                    "Value": "Please Fill In"
                },
                {
                    "Indicator": "Return on Equity",
                    "Description": "Reflects the operational efficiency of shareholder equity, namely the ratio of net profit to average shareholder equity.",
                    "Influencing Factors": [
                        "Change in Net Profit",
                        "Change in Shareholder Equity"
                    ],
                    "Value": "Please Fill In"
                }
            ]
        }
    ],
    "Additional Information": [
        {
            "Name": "Future Outlook",
            "Content": [
                {
                    "Name": "Financial Strategy",
                    "Description": "The company plans to implement a comprehensive cost control strategy to improve profit margins. Additionally, it aims to optimize capital operations to enhance financial stability and support future growth."
                },
                {
                    "Name": "Investment Plans",
                    "Description": "InnovateTech Solutions is committed to investing in cutting-edge technologies and research and development efforts to stay at the forefront of the industry. It plans to invest in AI-driven solutions, cloud computing advancements, and explore strategic partnerships for mutual growth."
                },
                {
                    "Name": "Risk Management",
                    "Description": "The company has identified potential risks such as intense competition, technological disruptions, and economic uncertainties. To address these risks, InnovateTech Solutions will focus on diversifying its product portfolio, conducting regular risk assessments, and implementing effective risk mitigation strategies."
                }
            ]
        }
    ],
    "Generated Outline": "I. Introduction\n    A. Company Information\n        1. Name: InnovateTech Solutions\n        2. Establishment Date: March 15, 2010\n        3. Main Business: Providing innovative software solutions for enterprises\n        4. Registration Location: Silicon Valley, California, USA\n        5. Listing Status: Listed on NASDAQ\n        6. Industry: IT\n\nII. Financial Information\n    A. Major Investment (January, 2021)\n        1. Description: The company invested $10 million in Project X, a groundbreaking AI-driven analytics platform.\n        2. Impact: Further broadened the company's business areas, enhanced profitability.\n        3. Sub Events:\n            - Project X Development (January, 2021)\n                - Description: InnovateTech Solutions began development of Project X, an innovative AI-driven analytics platform.\n                - Impact: Laid the foundation for the future success of Project X and potential revenue streams.\n            - Strategic Partnership with Industry Leader (February, 2021)\n                - Description: InnovateTech Solutions formed a strategic partnership with a leading player in the data analytics industry, leveraging their expertise and resources.\n                - Impact: This partnership provided access to a wider customer base and enhanced the company's credibility and market position.\n            - Expansion of R&D Team (March, 2021)\n                - Description: InnovateTech Solutions hired additional skilled professionals to strengthen the Research and Development team specifically dedicated to Project X.\n                - Impact: Increased capacity for faster development and improved product quality.\n            - Product Testing and Iteration (April - June, 2021)\n                - Description: Extensive testing and iteration of Project X's functionalities and user experience to ensure a robust and user-friendly product.\n                - Impact: Achieved a high-quality product that meets customer expectations and increases market competitiveness.\n            - Strategic Marketing Campaign (July - August, 2021)\n                - Description: Launched a comprehensive marketing campaign to create awareness and generate interest in Project X among targeted industries.\n                - Impact: Increased visibility, generated leads, and potential customers for Project X.\n            - Product Launch (September, 2021)\n                - Description: InnovateTech Solutions officially launched Project X to the market, making it available for purchase and implementation.\n                - Impact: Commenced revenue generation from the sale of Project X licenses and associated services.\n                \n    B. Dividend Distribution (February, 2021)\n        1. Description: The company decided to distribute $1.5 million as dividends to shareholders.\n        2. Impact: Returned to the investors, enhanced shareholder returns.\n        \n    C. Asset Restructuring (March, 2021)\n        1. Description: The company underwent an asset restructuring, optimizing its business structure and consolidating resources in key growth areas.\n        2. Impact: Improved operational efficiency, increased company value.\n        \n    D. Debt Restructuring (June, 2021)\n        1. Description: To optimize capital structure, the company underwent debt restructuring, reducing liabilities by $5 million.\n        2. Impact: Improved the company's financial condition, reduced financial costs.\n        \n    E. Significant Equity Acquisition (September, 2021)\n        1. Description: The company completed the acquisition of 30% equity of Data Analytics Corp.\n        2. Impact: Further expanded the company's market share, enhanced the company's control.\n        \n    F. Major Asset Acquisition (October, 2021)\n        1. Description: The company completed the asset acquisition of Tech Solutions Ltd., with a total value of $8 million.\n        2. Impact: Expanded the company's business scope, enhanced market competitiveness.\n        \n    G. Large-scale Financing (November, 2021)\n        1. Description: The company conducted a large-scale financing activity, raising $20 million through a successful IPO.\n        2. Impact: Strengthened the company's financial strength, supported expansion and development.\n        \n    H. Major Partnership (December, 2021)\n        1. Description: In December, InnovateTech Solutions entered into a strategic partnership with GlobalTech Corporation, aiming to jointly develop advanced cloud-based solutions.\n        2. Impact: Expanded market reach, increased revenue potential.\n        \n    I. Involved Indicators\n        1. Operating Income\n            - Description: The total amount of main business income and other business income within a certain accounting period.\n            - Influencing Factors: Market Demand, Changes in Product Prices\n            - Value: Please Fill In\n        \n        2. Net Profit\n            - Description: The net income of the company within a certain accounting period, i.e., total income minus total costs and taxes.\n            - Influencing Factors: Operating Income, Cost Control, Non-recurring Gains and Losses\n            - Value: Please Fill In\n        \n        3. Total Assets\n            - Description: The total amount of assets owned by the company at the end of the accounting period.\n            - Influencing Factors: Asset Acquisition, Asset Disposal, Asset Revaluation\n            - Value: Please Fill In\n        \n        4. Total Liabilities\n            - Description: The total amount of debts the company is obligated to repay at the end of the accounting period.\n            - Influencing Factors: New Debt Issuance, Debt Repayment, Debt Restructuring\n            - Value: Please Fill In\n        \n        5. Shareholder Equity\n            - Description: The total amount of equity belonging to shareholders at the end of the accounting period.\n            - Influencing Factors: Net Profit, Dividend Distribution, Capital Reserves\n            - Value: Please Fill In\n        \n        6. Cash Flow\n            - Description: The total cash inflows and outflows of the company within a certain accounting period.\n            - Influencing Factors: Operating Activities, Investment Activities, Financing Activities\n            - Value: Please Fill In\n        \n        7. Debt Ratio\n            - Description: The ratio of total liabilities to total assets, reflecting the company's debt level.\n            - Influencing Factors: Changes in Total Liabilities, Changes in Total Assets\n            - Value: Please Fill In\n        \n        8. Debt to Assets Ratio\n            - Description: The percentage of total liabilities to total assets, a measure of the company's financial leverage.\n            - Influencing Factors: Increases or decreases in assets and liabilities\n            - Value: Please Fill In\n        \n        9. Return on Equity\n            - Description: Reflects the operational efficiency of shareholder equity, namely the ratio of net profit to average shareholder equity.\n            - Influencing Factors: Change in Net Profit, Change in Shareholder Equity\n            - Value: Please Fill In\n\nIII. Future Outlook\n    A. Financial Strategy\n        - Description: The company plans to implement a comprehensive cost control strategy to improve profit margins. Additionally, it aims to optimize capital operations to enhance financial stability and support future growth.\n        \n    B. Investment Plans\n        - Description: InnovateTech Solutions is committed to investing in cutting-edge technologies and research and development efforts to stay at the forefront of the industry. It plans to invest in AI-driven solutions, cloud computing advancements, and explore strategic partnerships for mutual growth.\n        \n    C. Risk Management\n        - Description: The company has identified potential risks such as intense competition, technological disruptions, and economic uncertainties. To address these risks, InnovateTech Solutions will focus on diversifying its product portfolio, conducting regular risk assessments, and implementing effective risk mitigation strategies.",
    "Generated Summary": "InnovateTech Solutions, established on March 15, 2010, is an IT company based in Silicon Valley, California, USA, specializing in providing innovative software solutions for enterprises. The company is listed on NASDAQ.",
    "Generated Article": "In January 2021, InnovateTech Solutions made a major investment of $10 million in Project X, an AI-driven analytics platform. This investment had a significant impact on the company, as it further broadened its business areas and enhanced profitability. The development of Project X laid the foundation for its future success and potential revenue streams. Additionally, InnovateTech Solutions formed a strategic partnership with a leading player in the data analytics industry in February 2021. This partnership provided access to a wider customer base and enhanced the company's credibility and market position. To support the development of Project X, InnovateTech Solutions expanded its R&D team in March 2021, hiring additional skilled professionals. This move increased the company's capacity for faster development and improved product quality. From April to June 2021, extensive testing and iteration of Project X's functionalities and user experience were conducted, resulting in a high-quality product that meets customer expectations and increases market competitiveness. To create awareness and generate interest in Project X, a strategic marketing campaign was launched in July to August 2021. This campaign increased visibility, generated leads, and potential customers for Project X. Finally, in September 2021, InnovateTech Solutions officially launched Project X to the market, commencing revenue generation from the sale of Project X licenses and associated services.\n\nIn February 2021, the company decided to distribute $1.5 million as dividends to shareholders, enhancing shareholder returns. In March 2021, InnovateTech Solutions underwent an asset restructuring to optimize its business structure and consolidate resources in key growth areas. This restructuring improved operational efficiency and increased the company's value. In June 2021, the company underwent debt restructuring, reducing liabilities by $5 million. This move improved the company's financial condition and reduced financial costs. In September 2021, InnovateTech Solutions completed the acquisition of 30% equity of Data Analytics Corp, further expanding its market share and enhancing control. Additionally, in October 2021, the company completed the asset acquisition of Tech Solutions Ltd., with a total value of $8 million. This acquisition expanded the company's business scope and enhanced market competitiveness. In November 2021, InnovateTech Solutions conducted a large-scale financing activity, raising $20 million through a successful IPO. This strengthened the company's financial strength and supported expansion and development. In December 2021, the company entered into a strategic partnership with GlobalTech Corporation to jointly develop advanced cloud-based solutions. This partnership expanded market reach and increased revenue potential.\n\nNow let's delve into the specific indicators that are relevant to InnovateTech Solutions. The operating income of the company is a crucial indicator that reflects the total amount of main business income and other business income within a certain accounting period. It is influenced by market demand and changes in product prices. The net profit, on the other hand, represents the net income of the company within a certain accounting period, calculated by subtracting total costs and taxes from total income. The net profit is influenced by the operating income, cost control, and non-recurring gains and losses. The total assets of the company reflect the total amount of assets owned by the company at the end of the accounting period. This indicator is influenced by asset acquisition, asset disposal, and asset revaluation. On the other hand, the total liabilities represent the total amount of debts the company is obligated to repay at the end of the accounting period. It is influenced by new debt issuance, debt repayment, and debt restructuring. The shareholder equity is the total amount of equity belonging to shareholders at the end of the accounting period and is influenced by the net profit, dividend distribution, and capital reserves. The cash flow represents the total cash inflows and outflows of the company within a certain accounting period. It is influenced by operating activities, investment activities, and financing activities. The debt ratio reflects the ratio of total liabilities to total assets and indicates the company's debt level. It is influenced by changes in total liabilities and total assets. The debt to assets ratio, on the other hand, represents the percentage of total liabilities to total assets and is a measure of the company's financial leverage. It is influenced by increases or decreases in assets and liabilities. Finally, the return on equity reflects the operational efficiency of shareholder equity and is calculated by dividing the net profit by the average shareholder equity. It is influenced by changes in net profit and changes in shareholder equity.\n\nLooking into the future outlook of InnovateTech Solutions, the company plans to implement a comprehensive cost control strategy to improve profit margins. This strategy aims to optimize expenses and increase efficiency. Additionally, the company is committed to investing in cutting-edge technologies and research and development efforts to stay at the forefront of the industry. It plans to invest in AI-driven solutions and cloud computing advancements. Moreover, InnovateTech Solutions will explore strategic partnerships for mutual growth. In terms of risk management, the company has identified potential risks such as intense competition, technological disruptions, and economic uncertainties. To address these risks, InnovateTech Solutions will focus on diversifying its product portfolio, conducting regular risk assessments, and implementing effective risk mitigation strategies. By proactively managing risks and investing in innovation, InnovateTech Solutions aims to maintain its market position and drive future growth."
}