{
    "报告类型": "公司治理报告",
    "报告时间": "2019年度",
    "公司信息": {
        "名称": "盛达能源有限公司",
        "成立日期": "2005年3月15日",
        "主营业务": "盛达能源是一家专注于开发与销售可再生能源产品的公司，主要经营太阳能发电、风能发电等业务。",
        "注册地": "中国上海",
        "上市情况": "盛达能源于2015年在上海证券交易所成功上市，股票代码为601228。",
        "行业": "能源"
    },
    "报告内容": [
        {
            "类型": "治理结构",
            "重要事件": [
                {
                    "事件": "财务危机",
                    "时间": "2019年1月",
                    "描述": "公司面临财务危机，由于资金链断裂、高额债务和市场竞争加剧导致公司陷入困境。",
                    "影响": "公司股票价格下跌，公司形象受损，债权人提起诉讼追索债务。",
                    "正面事件": false
                },
                {
                    "事件": "董事会变更",
                    "时间": "2019年3月",
                    "描述": "董事会成员的任命或辞职，对公司战略方向的影响。",
                    "影响": "可能导致公司战略调整，影响公司长期发展方向和股东利益。"
                },
                {
                    "事件": "高级管理层变动",
                    "时间": "2019年4月",
                    "描述": "公司高级管理层的变动，包括CEO或其他关键职位的更换，对公司运营重点和优先事项的影响。",
                    "影响": "可能导致公司运营重点和战略优先事项的调整，影响短期内的业绩和长期发展。"
                },
                {
                    "事件": "可持续性与社会责任倡议",
                    "时间": "2019年6月",
                    "描述": "公司在可持续性、环境保护、社会责任和企业公民方面的重大进展。",
                    "影响": "提升公司公众形象和市场竞争力，促进长期可持续发展。"
                },
                {
                    "事件": "风险管理举措",
                    "时间": "2019年7月",
                    "描述": "公司风险管理框架的更新，包括新风险的识别和缓解策略的实施。",
                    "影响": "提高公司对内外部风险的应对能力，保障公司持续运营和稳定发展。"
                },
                {
                    "事件": "道德与诚信事件",
                    "时间": "2019年8月",
                    "描述": "重大的道德或诚信违规事件，如欺诈、腐败或利益冲突案例，以及公司采取的应对措施。",
                    "影响": "可能损害公司声誉和品牌价值，影响公司与投资者、客户和合作伙伴的关系。"
                },
                {
                    "事件": "投资计划",
                    "时间": "2019年9月",
                    "描述": "公司制定了新的投资计划，包括扩大太阳能和风能发电项目的生产规模，进军新兴市场。",
                    "影响": "提升公司的市场份额和盈利能力，推动公司发展到新的领域和市场。",
                    "正面事件": true
                },
                {
                    "事件": "公司治理政策修订",
                    "时间": "2019年10月",
                    "描述": "公司治理框架或政策的修订，以增强透明度、问责制或利益相关者参与。",
                    "影响": "增强公司治理透明度和问责制，提升利益相关者信心。"
                },
                {
                    "事件": "合规与监管更新",
                    "时间": "2019年11月",
                    "描述": "适应影响公司治理实践的新规定或合规标准的更新，包括证券法、公司法或特定行业规定的变化。",
                    "影响": "确保公司遵守最新法律法规，减少法律风险，保护公司和股东利益。"
                },
                {
                    "事件": "股东大会决议",
                    "时间": "2019年12月",
                    "描述": "在年度或特别股东大会上作出的关键决策，包括公司章程的变更、重大公司行动和股东投票结果。",
                    "影响": "直接影响公司治理结构、未来经营策略和股东权益。"
                }
            ],
            "涉及的指标": [
                {
                    "指标": "信息披露",
                    "描述": "公司信息披露的原则、方式以及执行情况。",
                    "值": "信息披露透明度高，及时向投资者披露重要公司信息和财务数据，遵守相关法规要求。"
                },
                {
                    "指标": "关联交易",
                    "描述": "关联交易的政策、流程及其公正性、合规性的保证措施。",
                    "值": "公司建立完善的关联交易政策和内部审批流程，确保关联交易公正合规，最大程度保障股东权益。"
                },
                {
                    "指标": "内部控制",
                    "描述": "公司内部控制的架构、实施情况以及效果评估。",
                    "值": "公司采用科学合理的内部控制措施，通过定期内部审计、风险评估和流程优化，提高内部控制的有效性。"
                }
            ]
        }
    ],
    "额外信息": [
        {
            "名称": "治理改进计划",
            "内容": [
                {
                    "名称": "加强董事会和监事会功能",
                    "描述": "提高董事会和监事会在公司治理中的效率和效果，包括定期的培训、增加独立董事比例、优化决策过程。"
                },
                {
                    "名称": "提升透明度和信息披露质量",
                    "描述": "改进信息披露流程和标准，确保及时、准确、全面地向所有利益相关者报告公司情况。"
                }
            ]
        },
        {
            "名称": "风险管理策略",
            "内容": [
                {
                    "名称": "内部控制系统强化",
                    "描述": "建立和完善内部控制系统，识别、评估、监控和报告财务和运营风险，提高公司抵御风险的能力。"
                },
                {
                    "名称": "可持续发展和社会责任整合",
                    "描述": "将可持续发展和社会责任纳入公司战略，识别相关风险和机会，促进长期价值创造。"
                }
            ]
        }
    ],
    "生成大纲": "公司治理报告大纲：\n\nI. 治理结构\n   A. 财务危机 (2019年1月)\n      - 描述：公司面临财务危机，资金链断裂、高额债务和市场竞争加剧导致公司陷入困境。\n      - 影响：公司股票价格下跌，公司形象受损，债权人提起诉讼追索债务。\n   B. 董事会变更 (2019年3月)\n      - 描述：董事会成员变动，对公司战略方向的影响。\n      - 影响：可能导致公司战略调整，影响公司长期发展方向和股东利益。\n   C. 高级管理层变动 (2019年4月)\n      - 描述：公司高层管理层变动，包括CEO或其他关键职位的更换，对公司运营重点和优先事项的影响。\n      - 影响：可能导致公司运营重点和战略优先事项的调整，影响短期业绩和长期发展。\n   D. 可持续性与社会责任倡议 (2019年6月)\n      - 描述：公司在可持续性、环境保护、社会责任和企业公民方面的重大进展。\n      - 影响：提升公司公众形象和市场竞争力，促进长期可持续发展。\n   E. 风险管理举措 (2019年7月)\n      - 描述：公司风险管理框架的更新，包括新风险的识别和缓解策略的实施。\n      - 影响：提高公司对内外部风险的应对能力，保障公司持续运营和稳定发展。\n   F. 道德与诚信事件 (2019年8月)\n      - 描述：重大的道德或诚信违规事件，如欺诈、腐败或利益冲突案例，以及公司采取的应对措施。\n      - 影响：可能损害公司声誉和品牌价值，影响公司与投资者、客户和合作伙伴的关系。\n   G. 投资计划 (2019年9月)\n      - 描述：公司制定了新的投资计划，包括扩大太阳能和风能发电项目的生产规模，进军新兴市场。\n      - 影响：提升公司的市场份额和盈利能力，推动公司发展到新的领域和市场。\n   H. 公司治理政策修订 (2019年10月)\n      - 描述：公司治理框架或政策的修订，以增强透明度、问责制或利益相关者参与。\n      - 影响：增强公司治理透明度和问责制，提升利益相关者信心。\n   I. 合规与监管更新 (2019年11月)\n      - 描述：适应影响公司治理实践的新规定或合规标准的更新，包括证券法、公司法或特定行业规定的变化。\n      - 影响：确保公司遵守最新法律法规，减少法律风险，保护公司和股东利益。\n   J. 股东大会决议 (2019年12月)\n      - 描述：在年度或特别股东大会上作出的关键决策，包括公司章程的变更、重大公司行动和股东投票结果。\n      - 影响：直接影响公司治理结构、未来经营策略和股东权益。\n\nII. 涉及的指标\n   A. 信息披露\n      - 描述：公司信息披露的原则、方式以及执行情况。\n      - 值：信息披露透明度高，及时向投资者披露重要公司信息和财务数据，遵守相关法规要求。\n   B. 关联交易\n      - 描述：关联交易的政策、流程及其公正性、合规性的保证措施。\n      - 值：公司建立完善的关联交易政策和内部审批流程，确保关联交易公正合规，最大程度保障股东权益。\n   C. 内部控制\n      - 描述：公司内部控制的架构、实施情况以及效果评估。\n      - 值：公司采用科学合理的内部控制措施，通过定期内部审计、风险评估和流程优化，提高内部控制的有效性。\n\nIII. 额外信息\n   A. 治理改进计划\n      1. 加强董事会和监事会功能\n         - 描述：提高董事会和监事会在公司治理中的效率和效果，包括定期的培训、增加独立董事比例、优化决策过程。\n      2. 提升透明度和信息披露质量\n         - 描述：改进信息披露流程和标准，确保及时、准确、全面地向所有利益相关者报告公司情况。\n   B. 风险管理策略\n      1. 内部控制系统强化\n         - 描述：建立和完善内部控制系统，识别、评估、监控和报告财务和运营风险，提高公司抵御风险的能力。\n      2. 可持续发展和社会责任整合\n         - 描述：将可持续发展和社会责任纳入公司战略，识别相关风险和机会，促进长期价值创造。",
    "生成总结": "盛达能源是一家于2005年成立的中国上海注册的能源公司，专注于开发与销售可再生能源产品，并在2015年成功上市，股票代码为601228。",
    "生成文章": "在2019年1月，盛达能源面临了一场严重的财务危机。由于资金链断裂、高额债务和市场竞争加剧，公司陷入了困境。这一事件对公司产生了深远的影响。首先，公司股票价格下跌，导致投资者信心受到严重打击，公司形象受损。其次，债权人对公司提起诉讼追索债务，进一步加剧了公司的财务困境。这一事件对公司治理结构产生了重大影响，迫使公司采取措施来应对危机。\n\n为了应对财务危机，盛达能源在2019年3月进行了董事会变更。这一变动对公司的战略方向产生了影响。新的董事会成员可能带来新的思路和决策，可能导致公司战略调整，进而影响公司的长期发展方向和股东利益。\n\n随后，在2019年4月，盛达能源发生了高级管理层的变动。这包括CEO或其他关键职位的更换，对公司的运营重点和优先事项产生了影响。新的高层管理层可能会带来新的管理风格和战略重点，可能导致公司运营重点和战略优先事项的调整，进而影响短期业绩和长期发展。\n\n然而，盛达能源在2019年6月取得了一些重要的进展，特别是在可持续性、环境保护、社会责任和企业公民方面。公司在这些领域取得了重大进展，提升了公司的公众形象和市场竞争力，促进了公司的长期可持续发展。\n\n在2019年7月，盛达能源更新了其风险管理举措。公司更新了风险管理框架，包括识别新风险和实施缓解策略。这一举措提高了公司对内外部风险的应对能力，保障了公司的持续运营和稳定发展。\n\n然而，在2019年8月，盛达能源发生了一起重大的道德与诚信事件。公司涉及欺诈、腐败或利益冲突等违规行为，并采取了相应的应对措施。这一事件可能损害了公司的声誉和品牌价值，影响了公司与投资者、客户和合作伙伴的关系。\n\n在2019年9月，盛达能源制定了新的投资计划。公司计划扩大太阳能和风能发电项目的生产规模，并进军新兴市场。这一投资计划有望提升公司的市场份额和盈利能力，推动公司发展到新的领域和市场。\n\n在2019年10月，盛达能源修订了公司治理政策。公司修订了公司治理框架或政策，以增强透明度、问责制或利益相关者参与。这一举措增强了公司治理透明度和问责制，提升了利益相关者的信心。\n\n在2019年11月，盛达能源适应了新的合规和监管要求。公司更新了公司治理实践，确保公司遵守最新的法律法规，减少法律风险，保护公司和股东利益。\n\n最后，在2019年12月的股东大会上，盛达能源作出了关键决策。这些决策直接影响了公司的治理结构、未来经营策略和股东权益。\n\n综上所述，盛达能源在2019年经历了一系列重要的治理事件。这些事件对公司的治理结构、战略方向和股东利益产生了深远影响。公司在应对财务危机、董事会变更、高级管理层变动、可持续性与社会责任倡议、风险管理举措、道德与诚信事件、投资计划、公司治理政策修订、合规与监管更新和股东大会决议等方面采取了一系列措施。这些措施有助于提升公司的治理透明度、风险管理能力和长期可持续发展。然而，公司仍然面临着一些挑战，需要进一步加强公司治理、风险管理和可持续发展策略。"
}