{
    "报告类型": "公司财务报告",
    "报告时间": "2019年度",
    "公司信息": {
        "名称": "爱康医疗集团",
        "成立日期": "2005年3月",
        "主营业务": "爱康医疗集团是一家综合性医疗服务供应商，提供体检、医疗影像、检验等多项医疗服务。",
        "注册地": "北京市",
        "上市情况": "在香港交易所上市",
        "行业": "医疗"
    },
    "报告内容": [
        {
            "类型": "财务信息",
            "重要事件": [
                {
                    "事件": "重大股权收购",
                    "时间": "2019年1月",
                    "描述": "爱康医疗集团完成了对雅仕维尔医疗集团的股权收购，获得了48%的股权。",
                    "影响": "进一步扩大了爱康医疗集团的市场份额，提升了公司的控制力。"
                },
                {
                    "事件": "重大投资",
                    "时间": "2019年2月",
                    "描述": "爱康医疗集团投资了华瑞生物医药有限公司，投资金额为2亿元人民币。",
                    "影响": "进一步拓宽了公司的业务领域，提升了公司的盈利能力。"
                },
                {
                    "事件": "重大资产收购",
                    "时间": "2019年6月",
                    "描述": "爱康医疗集团完成了对安康药房连锁有限公司的资产收购，总价值1.5亿元人民币。",
                    "影响": "扩大公司业务范围，增强市场竞争力。"
                },
                {
                    "事件": "债务重组",
                    "时间": "2019年8月",
                    "描述": "为优化资本结构，爱康医疗集团进行了债务重组，减少了5亿元人民币负债。",
                    "影响": "改善了公司的财务状况，降低了财务成本。"
                },
                {
                    "事件": "分发股利",
                    "时间": "2019年9月",
                    "描述": "爱康医疗集团决定向股东分发1亿元人民币股利。",
                    "影响": "回报给股东们的投资，提升了股东的收益。"
                },
                {
                    "事件": "大规模融资",
                    "时间": "2019年10月",
                    "描述": "爱康医疗集团进行了一次大规模的融资活动，募集了10亿元人民币资金。",
                    "影响": "加强了公司的资金实力，支持了公司的扩张和发展。"
                },
                {
                    "事件": "资产重组",
                    "时间": "2019年11月",
                    "描述": "爱康医疗集团进行了一次资产重组，优化了公司的业务结构。",
                    "影响": "提高了公司的运营效率，增加了公司的价值。"
                }
            ],
            "涉及的指标": [
                {
                    "指标": "营业收入",
                    "描述": "公司在一定会计期间内的主营业务收入和其他业务收入总额。",
                    "影响因素": [
                        "市场需求",
                        "产品价格变化"
                    ],
                    "值": "20亿元人民币"
                },
                {
                    "指标": "净利润",
                    "描述": "公司在一定会计期间的净收入，即总收入减去总成本和所得税费用后的金额。",
                    "影响因素": [
                        "营业收入",
                        "成本控制",
                        "非经常性损益"
                    ],
                    "值": "2亿元人民币"
                },
                {
                    "指标": "总资产",
                    "描述": "会计期末，公司所拥有的资产总额。",
                    "影响因素": [
                        "资产收购",
                        "资产处置",
                        "资产重估"
                    ],
                    "值": "30亿元人民币"
                },
                {
                    "指标": "总负债",
                    "描述": "会计期末，公司所承担并需要偿还的债务总额。",
                    "影响因素": [
                        "新债发行",
                        "债务偿还",
                        "债务重组"
                    ],
                    "值": "10亿元人民币"
                },
                {
                    "指标": "股东权益",
                    "描述": "会计期末，归属于股东的权益总额。",
                    "影响因素": [
                        "净利润",
                        "股利发放",
                        "资本公积"
                    ],
                    "值": "20亿元人民币"
                },
                {
                    "指标": "现金流量",
                    "描述": "公司在一定会计期间内的现金流入和流出总和。",
                    "影响因素": [
                        "经营活动",
                        "投资活动",
                        "筹资活动"
                    ],
                    "值": "3亿元人民币"
                },
                {
                    "指标": "负债比率",
                    "描述": "公司总负债与总资产的比率，反映公司的债务水平。",
                    "影响因素": [
                        "总负债的变化",
                        "总资产的变化"
                    ],
                    "值": "33.33%"
                },
                {
                    "指标": "资产负债率",
                    "描述": "公司总负债占总资产的百分比，衡量公司财务杠杆的一个指标。",
                    "影响因素": [
                        "资产和负债的增减变化"
                    ],
                    "值": "33.33%"
                },
                {
                    "指标": "净资产收益率",
                    "描述": "反映公司股东权益的经营效益，即净利润与平均股东权益的比率。",
                    "影响因素": [
                        "净利润的变化",
                        "股东权益的变化"
                    ],
                    "值": "10%"
                }
            ]
        }
    ],
    "额外信息": [
        {
            "名称": "未来展望",
            "内容": [
                {
                    "名称": "财务策略",
                    "描述": "爱康医疗集团将继续加强成本控制，提高资本运作效率，以稳定和增加收益。"
                },
                {
                    "名称": "投资计划",
                    "描述": "爱康医疗集团计划增加在医疗技术领域的研发投入，开拓更多高端医疗项目。"
                },
                {
                    "名称": "风险管理",
                    "描述": "爱康医疗集团将持续关注医疗行业政策变化、竞争压力和产品质量安全等风险，并制定相应的应对策略。"
                }
            ]
        }
    ],
    "生成大纲": "公司财务报告大纲：\n\n一、**公司基本信息**\n- 报告类型：公司财务报告\n- 报告时间：2019年度\n\n二、**财务信息**\n1. **重要事件**\n    - 重大股权收购(2019年1月)\n      - 描述：爱康医疗集团完成了对雅仕维尔医疗集团的股权收购，获得了48%的股权。\n      - 影响：进一步扩大了爱康医疗集团的市场份额，提升了公司的控制力。\n      \n    - 重大投资(2019年2月)\n      - 描述：爱康医疗集团投资了华瑞生物医药有限公司，投资金额为2亿元人民币。\n      - 影响：进一步拓宽了公司的业务领域，提升了公司的盈利能力。\n      \n    - 重大资产收购(2019年6月)\n      - 描述：爱康医疗集团完成了对安康药房连锁有限公司的资产收购，总价值1.5亿元人民币。\n      - 影响：扩大公司业务范围，增强市场竞争力。\n      \n    - 债务重组(2019年8月)\n      - 描述：为优化资本结构，爱康医疗集团进行了债务重组，减少了5亿元人民币负债。\n      - 影响：改善了公司的财务状况，降低了财务成本。\n      \n    - 分发股利(2019年9月)\n      - 描述：爱康医疗集团决定向股东分发1亿元人民币股利。\n      - 影响：回报给股东们的投资，提升了股东的收益。\n      \n    - 大规模融资(2019年10月)\n      - 描述：爱康医疗集团进行了一次大规模的融资活动，募集了10亿元人民币资金。\n      - 影响：加强了公司的资金实力，支持了公司的扩张和发展。\n      \n    - 资产重组(2019年11月)\n      - 描述：爱康医疗集团进行了一次资产重组，优化了公司的业务结构。\n      - 影响：提高了公司的运营效率，增加了公司的价值。\n\n2. **涉及的指标**\n    - 营业收入\n      - 描述：公司在一定会计期间内的主营业务收入和其他业务收入总额。值为20亿元人民币。\n      - 影响因素：市场需求、产品价格变化。\n      \n    - 净利润\n      - 描述：公司在一定会计期间的净收入，即总收入减去总成本和所得税费用后的金额。值为2亿元人民币。\n      - 影响因素：营业收入、成本控制、非经常性损益。\n      \n    - 总资产\n      - 描述：会计期末，公司所拥有的资产总额。值为30亿元人民币。\n      - 影响因素：资产收购、资产处置、资产重估。\n      \n    - 总负债\n      - 描述：会计期末，公司所承担并需要偿还的债务总额。值为10亿元人民币。\n      - 影响因素：新债发行、债务偿还、债务重组。\n      \n    - 股东权益\n      - 描述：会计期末，归属于股东的权益总额。值为20亿元人民币。\n      - 影响因素：净利润、股利发放、资本公积。\n      \n    - 现金流量\n      - 描述：公司在一定会计期间内的现金流入和流出总和。值为3亿元人民币。\n      - 影响因素：经营活动、投资活动、筹资活动。\n      \n    - 负债比率\n      - 描述：公司总负债与总资产的比率，反映公司的债务水平。值为33.33%。\n      - 影响因素：总负债的变化、总资产的变化。\n      \n    - 资产负债率\n      - 描述：公司总负债占总资产的百分比，衡量公司财务杠杆的一个指标。值为33.33%。\n      - 影响因素：资产和负债的增减变化。\n      \n    - 净资产收益率\n      - 描述：反映公司股东权益的经营效益，即净利润与平均股东权益的比率。值为10%。\n      - 影响因素：净利润的变化、股东权益的变化。\n\n三、**额外信息**\n- 未来展望\n  - 财务策略：爱康医疗集团将继续加强成本控制，提高资本运作效率，以稳定和增加收益。\n  - 投资计划：爱康医疗集团计划增加在医疗技术领域的研发投入，开拓更多高端医疗项目。\n  - 风险管理：爱康医疗集团将持续关注医疗行业政策变化、竞争压力和产品质量安全等风险，并制定相应的应对策略。",
    "生成总结": "爱康医疗集团是一家在2005年3月成立的医疗服务供应商，在北京市注册，并在香港交易所上市，主营业务涵盖体检、医疗影像、检验等多项医疗服务。",
    "生成文章": "2019年度是爱康医疗集团发展的重要一年。在重大事件方面，首先，爱康医疗集团于2019年1月完成了对雅仕维尔医疗集团的股权收购，获得了48%的股权。这一收购进一步扩大了爱康医疗集团的市场份额，提升了公司的控制力。随后，在2019年2月，爱康医疗集团投资了华瑞生物医药有限公司，投资金额为2亿元人民币。这一投资进一步拓宽了公司的业务领域，提升了公司的盈利能力。在2019年6月，爱康医疗集团完成了对安康药房连锁有限公司的资产收购，总价值1.5亿元人民币。这一资产收购扩大了公司的业务范围，增强了公司的市场竞争力。在2019年8月，为优化资本结构，爱康医疗集团进行了债务重组，减少了5亿元人民币负债。这一债务重组改善了公司的财务状况，降低了财务成本。在2019年9月，爱康医疗集团决定向股东分发1亿元人民币股利，回报给股东们的投资，提升了股东的收益。在2019年10月，爱康医疗集团进行了一次大规模的融资活动，募集了10亿元人民币资金。这一融资活动加强了公司的资金实力，支持了公司的扩张和发展。最后，在2019年11月，爱康医疗集团进行了一次资产重组，优化了公司的业务结构，提高了公司的运营效率，增加了公司的价值。\n\n在财务信息方面，爱康医疗集团在2019年度取得了以下指标。首先，公司的营业收入为20亿元人民币。营业收入受市场需求和产品价格变化的影响。其次，公司的净利润为2亿元人民币。净利润受营业收入、成本控制和非经常性损益的影响。第三，公司的总资产为30亿元人民币。总资产受资产收购、资产处置和资产重估的影响。第四，公司的总负债为10亿元人民币。总负债受新债发行、债务偿还和债务重组的影响。第五，公司的股东权益为20亿元人民币。股东权益受净利润、股利发放和资本公积的影响。第六，公司的现金流量为3亿元人民币。现金流量受经营活动、投资活动和筹资活动的影响。第七，公司的负债比率为33.33%。负债比率反映了公司的债务水平，受总负债的变化和总资产的变化的影响。最后，公司的资产负债率为33.33%。资产负债率衡量了公司财务杠杆的一个指标，受资产和负债的增减变化的影响。此外，公司的净资产收益率为10%，反映了公司股东权益的经营效益，受净利润的变化和股东权益的变化的影响。\n\n综上所述，2019年度是爱康医疗集团取得重要进展的一年。通过重大事件的推动，公司进一步扩大了市场份额，拓宽了业务领域，增强了市场竞争力。同时，公司的财务指标也取得了良好的表现，营业收入、净利润、总资产、总负债、股东权益、现金流量、负债比率、资产负债率和净资产收益率均呈现出积极的变化。未来，爱康医疗集团将继续加强成本控制，提高资本运作效率，以稳定和增加收益。公司计划增加在医疗技术领域的研发投入，开拓更多高端医疗项目。同时，公司将持续关注医疗行业政策变化、竞争压力和产品质量安全等风险，并制定相应的应对策略。"
}