{
    "报告类型": "公司治理报告",
    "报告时间": "2019年度",
    "公司信息": {
        "名称": "文化传媒有限公司",
        "成立日期": "2005年3月15日",
        "主营业务": "提供文化传媒服务，包括影视制作、音乐发行、艺人经纪等",
        "注册地": "上海市",
        "上市情况": "未上市",
        "行业": "文化"
    },
    "报告内容": [
        {
            "类型": "治理结构",
            "重要事件": [
                {
                    "事件": "道德与诚信事件",
                    "时间": "2019年1月",
                    "描述": "重大的道德或诚信违规事件，如欺诈、腐败或利益冲突案例，以及公司采取的应对措施。",
                    "影响": "可能损害公司声誉和品牌价值，影响公司与投资者、客户和合作伙伴的关系。",
                    "子事件": [
                        {
                            "事件": "高管财务失信行为",
                            "时间": "2019年1月",
                            "描述": "公司高管在财务报表中故意篡改数据，夸大公司业绩，违反了财务准则和道德规范。",
                            "影响": "可能导致投资者对公司财务报表的不信任，损害公司声誉和股价，并可能引发监管部门的调查和处罚。"
                        },
                        {
                            "事件": "内部审计发现",
                            "时间": "2019年2月",
                            "描述": "公司内部审计部门在对财务报表进行审查时发现了高管财务失信行为。",
                            "影响": "公司决定立即展开调查，并采取相应的行动来纠正财务违规行为，以避免进一步的法律和道德责任。"
                        },
                        {
                            "事件": "财务报表重新审计",
                            "时间": "2019年3月",
                            "描述": "公司决定聘请独立的第三方审计机构重新审计财务报表，以确认公司的财务状况和业绩。",
                            "影响": "此举旨在恢复投资者的信任，确保公司财务报表的准确性和可靠性，并为后续的法律和监管程序做准备。"
                        },
                        {
                            "事件": "内部制度修订",
                            "时间": "2019年5月",
                            "描述": "公司对内部财务管理制度进行全面修订，并加强了财务诚信和准则的培训与监督。",
                            "影响": "这一举措旨在防止类似事件再次发生，并提升公司内部风控和合规管理水平，以保护公司和投资者利益。"
                        }
                    ]
                },
                {
                    "事件": "合规与监管更新",
                    "时间": "2019年2月",
                    "描述": "适应影响公司治理实践的新规定或合规标准的更新，包括证券法、公司法或特定行业规定的变化。",
                    "影响": "确保公司遵守最新法律法规，减少法律风险，保护公司和股东利益。"
                },
                {
                    "事件": "风险管理举措",
                    "时间": "2019年4月",
                    "描述": "公司风险管理框架的更新，包括新风险的识别和缓解策略的实施。",
                    "影响": "提高公司对内外部风险的应对能力，保障公司持续运营和稳定发展。"
                },
                {
                    "事件": "董事会变更",
                    "时间": "2019年5月",
                    "描述": "董事会成员的任命或辞职，对公司战略方向的影响。",
                    "影响": "可能导致公司战略调整，影响公司长期发展方向和股东利益。"
                },
                {
                    "事件": "高级管理层变动",
                    "时间": "2019年8月",
                    "描述": "公司高级管理层的变动，包括CEO或其他关键职位的更换，对公司运营重点和优先事项的影响。",
                    "影响": "可能导致公司运营重点和战略优先事项的调整，影响短期内的业绩和长期发展。"
                },
                {
                    "事件": "股东大会决议",
                    "时间": "2019年10月",
                    "描述": "在年度或特别股东大会上作出的关键决策，包括公司章程的变更、重大公司行动和股东投票结果。",
                    "影响": "直接影响公司治理结构、未来经营策略和股东权益。"
                },
                {
                    "事件": "公司治理政策修订",
                    "时间": "2019年11月",
                    "描述": "公司治理框架或政策的修订，以增强透明度、问责制或利益相关者参与。",
                    "影响": "增强公司治理透明度和问责制，提升利益相关者信心。"
                },
                {
                    "事件": "高级管理层变动",
                    "时间": "2019年11月",
                    "描述": "公司高级管理层的变动，包括CTO或其他关键职位的更换，对技术发展和创新能力的影响。",
                    "影响": "可能导致公司技术发展和创新能力的调整，影响产品研发和市场竞争力。"
                },
                {
                    "事件": "可持续性与社会责任倡议",
                    "时间": "2019年12月",
                    "描述": "公司在可持续性、环境保护、社会责任和企业公民方面的重大进展。",
                    "影响": "提升公司公众形象和市场竞争力，促进长期可持续发展。"
                }
            ],
            "涉及的指标": [
                {
                    "指标": "信息披露",
                    "描述": "公司信息披露的原则、方式以及执行情况。",
                    "值": "信息披露遵循证监会的相关规定，及时披露公司财务状况、业绩情况和重大事件，并且保持高度透明度。"
                },
                {
                    "指标": "关联交易",
                    "描述": "关联交易的政策、流程及其公正性、合规性的保证措施。",
                    "值": "关联交易采取公平、公正、公开的原则，经过董事会审批，遵循公司法和证监会的要求，确保利益相关者的利益得到保护。"
                },
                {
                    "指标": "内部控制",
                    "描述": "公司内部控制的架构、实施情况以及效果评估。",
                    "值": "公司建立了完善的内部控制制度，包括风险识别、评估和控制措施的设计与实施，定期进行内部控制效果评估，确保财务和运营风险得到有效管理。"
                }
            ]
        }
    ],
    "额外信息": [
        {
            "名称": "治理改进计划",
            "内容": [
                {
                    "名称": "加强董事会和监事会功能",
                    "描述": "提高董事会和监事会在公司治理中的效率和效果，包括定期的培训、增加独立董事比例、优化决策过程。"
                },
                {
                    "名称": "提升透明度和信息披露质量",
                    "描述": "改进信息披露流程和标准，确保及时、准确、全面地向所有利益相关者报告公司情况。"
                }
            ]
        },
        {
            "名称": "风险管理策略",
            "内容": [
                {
                    "名称": "内部控制系统强化",
                    "描述": "建立和完善内部控制系统，识别、评估、监控和报告财务和运营风险，提高公司抵御风险的能力。"
                },
                {
                    "名称": "可持续发展和社会责任整合",
                    "描述": "将可持续发展和社会责任纳入公司战略，识别相关风险和机会，促进长期价值创造。"
                }
            ]
        }
    ],
    "生成大纲": "公司治理报告大纲：\n\n一、治理结构\n   1. 道德与诚信事件\n      - 时间：2019年1月\n      - 描述：公司发生重大的道德或诚信违规事件，如欺诈、腐败或利益冲突案例，并采取了应对措施。\n      - 影响：可能损害公司声誉和品牌价值，影响公司与投资者、客户和合作伙伴的关系。\n         - 高管财务失信行为\n            - 时间：2019年1月\n            - 描述：公司高管在财务报表中故意篡改数据，夸大公司业绩，违反了财务准则和道德规范。\n            - 影响：可能导致投资者对公司财务报表的不信任，损害公司声誉和股价，并可能引发监管部门的调查和处罚。\n         - 内部审计发现\n            - 时间：2019年2月\n            - 描述：公司内部审计部门在对财务报表进行审查时发现了高管财务失信行为。\n            - 影响：公司决定立即展开调查，并采取相应的行动来纠正财务违规行为，以避免进一步的法律和道德责任。\n         - 财务报表重新审计\n            - 时间：2019年3月\n            - 描述：公司决定聘请独立的第三方审计机构重新审计财务报表，以确认公司的财务状况和业绩。\n            - 影响：此举旨在恢复投资者的信任，确保公司财务报表的准确性和可靠性，并为后续的法律和监管程序做准备。\n         - 内部制度修订\n            - 时间：2019年5月\n            - 描述：公司对内部财务管理制度进行全面修订，并加强了财务诚信和准则的培训与监督。\n            - 影响：这一举措旨在防止类似事件再次发生，并提升公司内部风控和合规管理水平，以保护公司和投资者利益。\n   2. 合规与监管更新\n      - 时间：2019年2月\n      - 描述：公司适应新规定或合规标准的更新，包括证券法、公司法或特定行业规定的变化。\n      - 影响：确保公司遵守最新法律法规，减少法律风险，保护公司和股东利益。\n   3. 风险管理举措\n      - 时间：2019年4月\n      - 描述：公司更新了风险管理框架，包括新风险的识别和缓解策略的实施。\n      - 影响：提高公司对内外部风险的应对能力，保障公司持续运营和稳定发展。\n   4. 董事会变更\n      - 时间：2019年5月\n      - 描述：公司董事会成员的任命或辞职，对公司战略方向的影响。\n      - 影响：可能导致公司战略调整，影响公司长期发展方向和股东利益。\n   5. 高级管理层变动\n      - 时间：2019年8月\n      - 描述：公司高级管理层的变动，包括CEO或其他关键职位的更换，对公司运营重点和优先事项的影响。\n      - 影响：可能导致公司运营重点和战略优先事项的调整，影响短期内的业绩和长期发展。\n   6. 股东大会决议\n      - 时间：2019年10月\n      - 描述：公司在股东大会上作出的关键决策，包括公司章程的变更、重大公司行动和股东投票结果。\n      - 影响：直接影响公司治理结构、未来经营策略和股东权益。\n   7. 公司治理政策修订\n      - 时间：2019年11月\n      - 描述：公司治理框架或政策的修订，以增强透明度、问责制或利益相关者参与。\n      - 影响：增强公司治理透明度和问责制，提升利益相关者信心。\n   8. 高级管理层变动\n      - 时间：2019年11月\n      - 描述：公司高级管理层的变动，包括CTO或其他关键职位的更换，对技术发展和创新能力的影响。\n      - 影响：可能导致公司技术发展和创新能力的调整，影响产品研发和市场竞争力。\n   9. 可持续性与社会责任倡议\n      - 时间：2019年12月\n      - 描述：公司在可持续性、环境保护、社会责任和企业公民方面的重大进展。\n      - 影响：提升公司公众形象和市场竞争力，促进长期可持续发展。\n\n二、涉及的指标\n   1. 信息披露\n      - 描述：公司信息披露的原则、方式以及执行情况。\n      - 值：信息披露遵循证监会的相关规定，及时披露公司财务状况、业绩情况和重大事件，并且保持高度透明度。\n   2. 关联交易\n      - 描述：关联交易的政策、流程及其公正性、合规性的保证措施。\n      - 值：关联交易采取公平、公正、公开的原则，经过董事会审批，遵循公司法和证监会的要求，确保利益相关者的利益得到保护。\n   3. 内部控制\n      - 描述：公司内部控制的架构、实施情况以及效果评估。\n      - 值：公司建立了完善的内部控制制度，包括风险识别、评估和控制措施的设计与实施，定期进行内部控制效果评估，确保财务和运营风险得到有效管理。\n\n三、额外信息\n   1. 治理改进计划\n      - 加强董事会和监事会功能\n         - 描述：提高董事会和监事会在公司治理中的效率和效果，包括定期的培训、增加独立董事比例、优化决策过程。\n      - 提升透明度和信息披露质量\n         - 描述：改进信息披露流程和标准，确保及时、准确、全面地向所有利益相关者报告公司情况。\n   2. 风险管理策略\n      - 内部控制系统强化\n         - 描述：建立和完善内部控制系统，识别、评估、监控和报告财务和运营风险，提高公司抵御风险的能力。\n      - 可持续发展和社会责任整合\n         - 描述：将可持续发展和社会责任纳入公司战略，识别相关风险和机会，促进长期价值创造。",
    "生成总结": "文化传媒有限公司成立于2005年3月15日，注册地位于上海市，主营业务包括影视制作、音乐发行和艺人经纪，属于文化行业且目前未上市。",
    "生成文章": "在公司治理结构方面，文化传媒有限公司在2019年1月发生了一起道德与诚信事件。该事件涉及高管财务失信行为，其中公司高管故意篡改财务报表，夸大公司业绩，违反了财务准则和道德规范。这一事件可能导致投资者对公司财务报表的不信任，损害公司声誉和股价，并可能引发监管部门的调查和处罚。公司内部审计部门在2019年2月发现了这一问题，并决定立即展开调查，并采取相应的行动来纠正财务违规行为，以避免进一步的法律和道德责任。为了恢复投资者的信任，公司决定在2019年3月聘请独立的第三方审计机构重新审计财务报表，以确认公司的财务状况和业绩。此举旨在确保公司财务报表的准确性和可靠性，并为后续的法律和监管程序做准备。此外，公司还在2019年5月对内部财务管理制度进行了全面修订，并加强了财务诚信和准则的培训与监督。这一举措旨在防止类似事件再次发生，并提升公司内部风控和合规管理水平，以保护公司和投资者利益。\n\n在合规与监管更新方面，文化传媒有限公司在2019年2月适应了新的法规和合规标准的更新，包括证券法、公司法或特定行业规定的变化。这一举措旨在确保公司遵守最新的法律法规，减少法律风险，保护公司和股东利益。\n\n在风险管理举措方面，文化传媒有限公司在2019年4月更新了风险管理框架，包括新风险的识别和缓解策略的实施。这一举措旨在提高公司对内外部风险的应对能力，保障公司持续运营和稳定发展。\n\n在董事会变更方面，文化传媒有限公司在2019年5月发生了董事会成员的任命或辞职。这一变更可能导致公司战略调整，影响公司长期发展方向和股东利益。\n\n在高级管理层变动方面，文化传媒有限公司在2019年8月发生了高级管理层的变动，包括CEO或其他关键职位的更换。这一变动可能导致公司运营重点和战略优先事项的调整，影响短期内的业绩和长期发展。\n\n在股东大会决议方面，文化传媒有限公司在2019年10月作出了关键决策，包括公司章程的变更、重大公司行动和股东投票结果。这些决议直接影响公司治理结构、未来经营策略和股东权益。\n\n在公司治理政策修订方面，文化传媒有限公司在2019年11月修订了公司治理框架或政策，以增强透明度、问责制或利益相关者参与。这一举措旨在增强公司治理透明度和问责制，提升利益相关者信心。\n\n在高级管理层变动方面，文化传媒有限公司在2019年11月发生了高级管理层的变动，包括CTO或其他关键职位的更换。这一变动可能导致公司技术发展和创新能力的调整，影响产品研发和市场竞争力。\n\n在可持续性与社会责任倡议方面，文化传媒有限公司在2019年12月取得了重大进展。公司在可持续性、环境保护、社会责任和企业公民方面取得了重大进展。这些举措有助于提升公司公众形象和市场竞争力，促进长期可持续发展。\n\n在信息披露方面，文化传媒有限公司遵循证监会的相关规定，及时披露公司财务状况、业绩情况和重大事件，并且保持高度透明度。\n\n在关联交易方面，文化传媒有限公司采取公平、公正、公开的原则，经过董事会审批，遵循公司法和证监会的要求，确保关联交易的公正性和合规性，以保护利益相关者的利益。\n\n在内部控制方面，文化传媒有限公司建立了完善的内部控制制度，包括风险识别、评估和控制措施的设计与实施。公司定期进行内部控制效果评估，确保财务和运营风险得到有效管理。\n\n为了加强董事会和监事会的功能，文化传媒有限公司提高了董事会和监事会在公司治理中的效率和效果。公司定期进行培训，增加独立董事比例，并优化决策过程。这一举措旨在提高公司治理水平，确保公司决策的科学性和合理性。\n\n为了提升透明度和信息披露质量，文化传媒有限公司改进了信息披露流程和标准。公司确保及时、准确、全面地向所有利益相关者报告公司情况，增强公司治理透明度和问责制。\n\n为了强化内部控制系统，文化传媒有限公司建立和完善了内部控制系统。公司识别、评估、监控和报告财务和运营风险，提高公司抵御风险的能力。\n\n为了将可持续发展和社会责任纳入公司战略，文化传媒有限公司识别相关风险和机会，促进长期价值创造。公司将可持续发展和社会责任整合到业务决策和运营中，推动公司可持续发展。\n\n综上所述，文化传媒有限公司在2019年在公司治理结构、合规与监管更新、风险管理举措、董事会变更、高级管理层变动、股东大会决议、公司治理政策修订、可持续性与社会责任倡议等方面采取了一系列措施。这些措施旨在提高公司治理水平、减少法律风险、保护利益相关者的权益，并促进公司的可持续发展。"
}