{
    "报告类型": "公司环境与社会责任报告",
    "报告时间": "2019年度",
    "公司信息": {
        "名称": "文化传媒有限公司",
        "成立日期": "2005年3月15日",
        "主营业务": "提供文化传媒服务，包括影视制作、音乐发行、艺人经纪等",
        "注册地": "上海市",
        "上市情况": "未上市",
        "行业": "文化"
    },
    "报告内容": [
        {
            "类型": "环境责任",
            "重要事件": [
                {
                    "事件": "节能减排项目实施",
                    "时间": "2019年3月",
                    "描述": "公司在上海总部投资实施了节能减排项目，采用高效能源设备和技术，减少能源消耗和温室气体排放量。",
                    "影响": "该项目的实施直接减少了公司的能源消耗和碳足迹，提高了能效和环境绩效。",
                    "子事件": [
                        {
                            "事件": "能源消耗评估",
                            "时间": "2019年1月",
                            "描述": "公司委托专业咨询机构对能源消耗情况进行评估，包括电力、燃气、水等方面的详细数据分析。",
                            "影响": "评估结果为节能减排项目的实施提供了可靠的数据基础，帮助确定目标和方案。"
                        },
                        {
                            "事件": "节能减排方案制定",
                            "时间": "2019年2月",
                            "描述": "基于能源消耗评估的结果，公司针对各个方面制定了全面的节能减排方案，包括改善设备能效、优化能源利用等。",
                            "影响": "该方案为后续的节能减排项目实施提供了具体的行动指南和措施。"
                        },
                        {
                            "事件": "设备采购和改造",
                            "时间": "2019年2月至3月",
                            "描述": "公司购买了一批高效能源设备并对部分现有设备进行了改造，以提高能效和降低能源消耗。",
                            "影响": "设备采购和改造直接为节能减排项目的实施提供了必要的物质基础，为后续的节能工作奠定了基础。"
                        }
                    ]
                },
                {
                    "事件": "绿色产品开发",
                    "时间": "2019年8月",
                    "描述": "公司成功开发了一款名为“绿影”的环保型影视制作设备。该设备能够减少能源消耗和废弃物排放，降低对环境的影响。",
                    "影响": "公司通过绿影设备的推广，提升了产品的市场竞争力和品牌形象，同时减少了对环境的负面影响。"
                },
                {
                    "事件": "防止污染设施的建设",
                    "时间": "2019年9月",
                    "描述": "为了更好地履行企业社会责任，公司在各分支机构加大了环保投入，建立了先进的废水处理系统和排放控制设备，有效减少了环境污染。",
                    "影响": "该措施显著降低了公司的环境污染水平，同时增强了合规性和社会责任感。"
                },
                {
                    "事件": "投资于碳抵消项目",
                    "时间": "2019年10月",
                    "描述": "公司通过投资林业项目和太阳能发电项目等可再生能源项目来抵消其碳排放，致力于实现碳中和目标。",
                    "影响": "通过碳抵消证书，公司能够向利益相关者展示其对环境的承诺和责任，并为可持续发展做出积极贡献。"
                },
                {
                    "事件": "采用环境管理系统",
                    "时间": "2019年11月",
                    "描述": "公司于2019年成功实施了国际标准ISO 14001环境管理体系，以提高环境绩效，减少废物产生并确保合规。",
                    "影响": "这一举措增强了公司的环境管理能力和持续改进，提升了合规性和市场认可度。"
                },
                {
                    "事件": "碳排放减少",
                    "时间": "2019年12月",
                    "描述": "公司通过采取节能措施和使用清洁能源，成功减少了碳排放量。",
                    "影响": "降低了企业的环境影响，同时提升了企业形象和市场竞争力。"
                }
            ],
            "涉及的指标": [
                {
                    "指标": "二氧化碳排放量",
                    "描述": "公司在生产过程中产生的二氧化碳总量。",
                    "影响因素": [
                        "生产规模的变化",
                        "节能技术的应用"
                    ],
                    "值": "100万吨"
                },
                {
                    "指标": "能源消耗",
                    "描述": "公司在运营过程中消耗的能源总量。",
                    "影响因素": [
                        "生产效率的提高",
                        "能源管理措施的实施"
                    ],
                    "值": "50万吨标准煤"
                }
            ]
        },
        {
            "类型": "社会责任",
            "重要事件": [
                {
                    "事件": "员工健康与安全计划",
                    "时间": "2019年4月",
                    "描述": "公司实施了一系列旨在提升员工健康与安全的措施，包括定期健康体检、职业卫生培训等。",
                    "影响": "这些措施显著改善了工作环境，减少了工伤事故发生率，提高了员工的健康与安全水平。"
                },
                {
                    "事件": "社区支持和发展项目",
                    "时间": "2019年5月",
                    "描述": "公司加大对当地社区的投资，支持教育、健康和社会发展项目，为社区居民提供更多福利。",
                    "影响": "公司通过这些项目加深了与社区的联系，促进了社区的整体福祉和可持续发展。"
                },
                {
                    "事件": "企业社会责任年度评估",
                    "时间": "2019年6月",
                    "描述": "公司委托专业机构对其社会责任履行情况进行评估，以了解与改善其社会影响和可持续发展状况。",
                    "影响": "评估结果为公司提供了管理建议和改进方向，帮助公司提升社会责任履行水平和企业形象。"
                },
                {
                    "事件": "员工职业成长和人才发展计划",
                    "时间": "2019年7月",
                    "描述": "公司为员工提供多种培训和发展项目，如在线课程、工作坊、导师计划等，帮助员工实现个人职业成长。",
                    "影响": "该计划提高了员工的专业技能和工作满意度，促进了人才的留存和发展。"
                },
                {
                    "事件": "参与慈善活动",
                    "时间": "2019年9月",
                    "描述": "公司积极参与和资助各类慈善活动和慈善机构，支持教育、健康、减贫等社会公益事业。",
                    "影响": "公司通过慈善行动提高了社会形象和品牌认知，加强了与社区的联系和支持。"
                },
                {
                    "事件": "参与公共服务项目",
                    "时间": "2019年12月",
                    "描述": "公司积极投资或参与公共服务项目，如城市绿化、公共卫生改善项目等，为社区居民提供更好的生活环境和服务。",
                    "影响": "促进了社区的可持续发展，增加了公众对公司的积极认可和信任。"
                }
            ],
            "涉及的指标": [
                {
                    "指标": "员工满意度",
                    "描述": "通过定期调查得到的员工对公司工作环境、福利待遇等方面满意度的度量。",
                    "影响因素": [
                        "工作环境的改善",
                        "员工福利政策的调整"
                    ],
                    "值": "80%"
                },
                {
                    "指标": "社区投资额",
                    "描述": "公司在社区发展项目上的投资总额。",
                    "影响因素": [
                        "公司的财务状况",
                        "社会责任战略的变化"
                    ],
                    "值": "1000万元人民币"
                }
            ]
        }
    ],
    "额外信息": [
        {
            "名称": "未来展望",
            "内容": [
                {
                    "名称": "环境保护计划",
                    "描述": "为进一步减少环境影响，公司计划采用更多的清洁能源，并在制造过程中优化能源利用和废物处理。",
                    "时间范围": "2020年-2022年"
                },
                {
                    "名称": "社会责任战略",
                    "描述": "公司将继续积极履行社会责任，加强与社区、员工和其他利益相关者的合作，致力于打造可持续发展的企业。",
                    "时间范围": "2020年-2025年"
                },
                {
                    "名称": "可持续发展目标",
                    "描述": "公司将进一步整合可持续性原则，将联合国可持续发展目标纳入战略规划和业务决策中，实现经济、社会和环境的可持续发展。",
                    "时间范围": "2020年-2030年"
                }
            ]
        }
    ],
    "生成大纲": "公司环境与社会责任报告大纲\n\n一、公司环境责任\n   A. 节能减排项目实施\n      1. 能源消耗评估(2019年1月)\n         - 描述: 公司委托专业咨询机构对能源消耗情况进行评估，包括电力、燃气、水等方面的详细数据分析。\n         - 影响: 评估结果为节能减排项目的实施提供了可靠的数据基础，帮助确定目标和方案。\n      2. 节能减排方案制定(2019年2月)\n         - 描述: 基于能源消耗评估的结果，公司针对各个方面制定了全面的节能减排方案，包括改善设备能效、优化能源利用等。\n         - 影响: 该方案为后续的节能减排项目实施提供了具体的行动指南和措施。\n      3. 设备采购和改造(2019年2月至3月)\n         - 描述: 公司购买了一批高效能源设备并对部分现有设备进行了改造，以提高能效和降低能源消耗。\n         - 影响: 设备采购和改造直接为节能减排项目的实施提供了必要的物质基础，为后续的节能工作奠定了基础。\n   B. 绿色产品开发(2019年8月)\n      - 描述: 公司成功开发了一款名为\"绿影\"的环保型影视制作设备。该设备能够减少能源消耗和废弃物排放，降低对环境的影响。\n      - 影响: 公司通过绿影设备的推广，提升了产品的市场竞争力和品牌形象，同时减少了对环境的负面影响。\n   C. 防止污染设施的建设(2019年9月)\n      - 描述: 为了更好地履行企业社会责任，公司在各分支机构加大了环保投入，建立了先进的废水处理系统和排放控制设备，有效减少了环境污染。\n      - 影响: 该措施显著降低了公司的环境污染水平，同时增强了合规性和社会责任感。\n   D. 投资于碳抵消项目(2019年10月)\n      - 描述: 公司通过投资林业项目和太阳能发电项目等可再生能源项目来抵消其碳排放，致力于实现碳中和目标。\n      - 影响: 通过碳抵消证书，公司能够向利益相关者展示其对环境的承诺和责任，并为可持续发展做出积极贡献。\n   E. 采用环境管理系统(2019年11月)\n      - 描述: 公司于2019年成功实施了国际标准ISO 14001环境管理体系，以提高环境绩效，减少废物产生并确保合规。\n      - 影响: 这一举措增强了公司的环境管理能力和持续改进，提升了合规性和市场认可度。\n   F. 碳排放减少(2019年12月)\n      - 描述: 公司通过采取节能措施和使用清洁能源，成功减少了碳排放量。\n      - 影响: 降低了企业的环境影响，同时提升了企业形象和市场竞争力。\n\n   相关指标:\n    - 二氧化碳排放量: 100万吨\n    - 能源消耗: 50万吨标准煤\n\n二、公司社会责任\n   A. 员工健康与安全计划(2019年4月)\n      - 描述: 公司实施了一系列旨在提升员工健康与安全的措施，包括定期健康体检、职业卫生培训等。\n      - 影响: 这些措施显著改善了工作环境，减少了工伤事故发生率，提高了员工的健康与安全水平。\n   B. 社区支持和发展项目(2019年5月)\n      - 描述: 公司加大对当地社区的投资，支持教育、健康和社会发展项目，为社区居民提供更多福利。\n      - 影响: 公司通过这些项目加深了与社区的联系，促进了社区的整体福祉和可持续发展。\n   C. 企业社会责任年度评估(2019年6月)\n      - 描述: 公司委托专业机构对其社会责任履行情况进行评估，以了解与改善其社会影响和可持续发展状况。\n      - 影响: 评估结果为公司提供了管理建议和改进方向，帮助公司提升社会责任履行水平和企业形象。\n   D. 员工职业成长和人才发展计划(2019年7月)\n      - 描述: 公司为员工提供多种培训和发展项目，如在线课程、工作坊、导师计划等，帮助员工实现个人职业成长。\n      - 影响: 该计划提高了员工的专业技能和工作满意度，促进了人才的留存和发展。\n   E. 参与慈善活动(2019年9月)\n      - 描述: 公司积极参与和资助各类慈善活动和慈善机构，支持教育、健康、减贫等社会公益事业。\n      - 影响: 公司通过慈善行动提高了社会形象和品牌认知，加强了与社区的联系和支持。\n   F. 参与公共服务项目(2019年12月)\n      - 描述: 公司积极投资或参与公共服务项目，如城市绿化、公共卫生改善项目等，为社区居民提供更好的生活环境和服务。\n      - 影响: 促进了社区的可持续发展，增加了公众对公司的积极认可和信任。\n\n   相关指标:\n    - 员工满意度: 80%\n    - 社区投资额: 1000万元人民币\n\n三、未来展望\n   A. 环境保护计划(2020年-2022年)\n      - 描述: 为进一步减少环境影响，公司计划采用更多的清洁能源，并在制造过程中优化能源利用和废物处理。\n   B. 社会责任战略(2020年-2025年)\n      - 描述: 公司将继续积极履行社会责任，加强与社区、员工和其他利益相关者的合作，致力于打造可持续发展的企业。\n   C. 可持续发展目标(2020年-2030年)\n      - 描述: 公司将进一步整合可持续性原则，将联合国可持续发展目标纳入战略规划和业务决策中，实现经济、社会和环境的可持续发展。\n\n以上为公司环境与社会责任报告大纲的主要内容。报告将详细介绍公司在环境责任和社会责任方面的重要事件和指标，展示了公司对环境保护和可持续发展的承诺和行动。通过实施节能减排项目、开发绿色产品、防止污染设施建设等措施，公司取得了可观的成绩，并推动了环境效益的提升。同时，公司积极履行社会责任，包括关注员工健康与安全、支持社区发展、参与慈善活动等。未来展望中，公司将进一步加大环境保护力度，制定更具体的社会责任战略，并将可持续发展目标纳入其战略规划和业务决策中，以实现经济、社会和环境的可持续发展。",
    "生成总结": "文化传媒有限公司是一家成立于2005年的上海文化行业公司，主营业务包括影视制作、音乐发行和艺人经纪等服务。",
    "生成文章": "公司一直致力于环境保护和社会责任的履行，通过一系列的节能减排项目和绿色产品开发，公司取得了显著的成绩。\n\n首先，在节能减排项目实施方面，公司于2019年1月委托专业咨询机构对能源消耗情况进行评估。评估结果为节能减排项目的实施提供了可靠的数据基础，帮助确定了目标和方案。随后，公司于2019年2月制定了全面的节能减排方案，包括改善设备能效和优化能源利用等。这些方案为后续的节能减排项目实施提供了具体的行动指南和措施。为了实施这些方案，公司于2019年2月至3月购买了一批高效能源设备并对部分现有设备进行了改造，以提高能效和降低能源消耗。这些设备采购和改造直接为节能减排项目的实施提供了必要的物质基础，为后续的节能工作奠定了基础。通过这些措施，公司成功减少了碳排放量，降低了企业的环境影响。\n\n此外，公司还在2019年8月成功开发了一款名为\"绿影\"的环保型影视制作设备。这款设备能够减少能源消耗和废弃物排放，降低对环境的影响。通过绿影设备的推广，公司提升了产品的市场竞争力和品牌形象，同时减少了对环境的负面影响。\n\n为了更好地履行企业社会责任，公司于2019年9月在各分支机构加大了环保投入，建立了先进的废水处理系统和排放控制设备，有效减少了环境污染。这一措施显著降低了公司的环境污染水平，同时增强了合规性和社会责任感。\n\n此外，公司于2019年10月通过投资林业项目和太阳能发电项目等可再生能源项目来抵消其碳排放，致力于实现碳中和目标。通过碳抵消证书，公司能够向利益相关者展示其对环境的承诺和责任，并为可持续发展做出积极贡献。\n\n为了提高环境管理能力和持续改进，公司于2019年11月成功实施了国际标准ISO 14001环境管理体系。这一举措增强了公司的环境管理能力和持续改进，提升了合规性和市场认可度。\n\n在社会责任方面，公司于2019年4月实施了一系列旨在提升员工健康与安全的措施，包括定期健康体检和职业卫生培训等。这些措施显著改善了工作环境，减少了工伤事故发生率，提高了员工的健康与安全水平。\n\n为了支持社区的发展，公司于2019年5月加大了对当地社区的投资，支持教育、健康和社会发展项目，为社区居民提供更多福利。通过这些项目，公司加深了与社区的联系，促进了社区的整体福祉和可持续发展。\n\n为了提升社会责任履行水平和企业形象，公司于2019年6月委托专业机构对其社会责任履行情况进行评估。评估结果为公司提供了管理建议和改进方向，帮助公司提升社会责任履行水平和企业形象。\n\n为了促进员工的职业成长和人才发展，公司于2019年7月为员工提供了多种培训和发展项目，如在线课程、工作坊和导师计划等。这些计划提高了员工的专业技能和工作满意度，促进了人才的留存和发展。\n\n为了加强与社区的联系和支持，公司于2019年9月积极参与和资助各类慈善活动和慈善机构，支持教育、健康、减贫等社会公益事业。通过慈善行动，公司提高了社会形象和品牌认知，加强了与社区的联系和支持。\n\n为了提供更好的生活环境和服务，公司于2019年12月积极投资或参与公共服务项目，如城市绿化、公共卫生改善项目等。这些项目促进了社区的可持续发展，增加了公众对公司的积极认可和信任。\n\n未来展望方面，公司计划在2020年至2022年采用更多的清洁能源，并在制造过程中优化能源利用和废物处理，进一步减少环境影响。同时，公司将继续积极履行社会责任，加强与社区、员工和其他利益相关者的合作，致力于打造可持续发展的企业。公司还计划将联合国可持续发展目标纳入战略规划和业务决策中，实现经济、社会和环境的可持续发展。\n\n综上所述，文化传媒有限公司在环境责任和社会责任方面取得了显著的成绩。通过一系列的节能减排项目和绿色产品开发，公司成功降低了碳排放量和能源消耗，减少了环境污染。同时，公司积极履行社会责任，关注员工健康与安全，支持社区发展，并参与慈善活动和公共服务项目。未来，公司将继续加大环境保护力度，制定更具体的社会责任战略，并将可持续发展目标纳入其战略规划和业务决策中，以实现经济、社会和环境的可持续发展。"
}