{
    "courtAndProcuratorate": {
        "court": "Quarryville, Yorktown, Court",
        "procuratorate": "Quarryville, Yorktown, Procuratorate"
    },
    "chiefJudge": "J. Phillips",
    "judge": "G. Campbell",
    "clerk": "R. Gutierrez",
    "defendant": {
        "name": "J. Thompson",
        "gender": "male",
        "birthdate": "24th, August, 1988",
        "residence": "47, Charleston street, Yorktown",
        "ethnicity": "Caucasian",
        "occupation": "Finance Manager at Yorktown Municipal Office"
    },
    "defenseLawyer": {
        "name": "B. Lewis",
        "lawFirm": "Lewis & Associates"
    },
    "caseProcess": [
        {
            "event": "Case Filing and Investigation",
            "date": "15th, March, 2023"
        },
        {
            "event": "Detention Measures Taken",
            "date": "20th, March, 2023"
        },
        {
            "event": "Criminal Detention",
            "date": "25th, March, 2023"
        },
        {
            "event": "Arrest",
            "date": "30th, March, 2023"
        }
    ],
    "criminalFacts": [
        {
            "crimeName": "Crime of Embezzlement",
            "details": [
                {
                    "timePeriod": "January 2023 - February 2023",
                    "behavior": "During this period, J. Thompson transferred $50,000 from the Yorktown Municipal Office's disaster relief fund into a personal bank account held at Yorktown Federal Bank.",
                    "evidence": "Bank statements showing the transfers, witness testimony from municipal office employees, and email correspondence between J. Thompson and bank officials."
                },
                {
                    "timePeriod": "February 2023 - March 2023",
                    "behavior": "J. Thompson authorized payments totaling $30,000 to a fictitious vendor, diverting funds intended for emergency rescue operations into a private business owned by an associate.",
                    "evidence": "Invoices from the fictitious vendor, security footage showing Thompson authorizing payments, and confession from the associate."
                },
                {
                    "timePeriod": "March 2023",
                    "behavior": "On multiple occasions, J. Thompson used his position to withdraw an additional $20,000 from the flood control budget, which was again diverted for personal use.",
                    "evidence": "Audit reports showing discrepancies, statement from the accounting department head, and physical evidence of unauthorized access to budget accounts."
                }
            ]
        }
    ],
    "legalProcedure": {
        "judgmentDate": "10th, October, 2023",
        "judgmentResult": [
            {
                "crimeName": "Crime of Embezzlement",
                "sentence": "J. Thompson is sentenced to a fixed-term imprisonment of ten years and is ordered to pay restitution of the embezzled $100,000.",
                "sentencingConsiderations": "Given the defendant's embezzlement of a large amount of public funds intended for disaster relief, the court deemed this as severe embezzlement, justifying a ten-year sentence. Probation is not applicable due to the serious nature of the crime."
            }
        ]
    },
    "Generated Article": "---\n**IN THE QUARRYVILLE, YORKTOWN, COURT**\n\n**SITTING AT QUARRYVILLE, YORKTOWN,**\n\n**THE PEOPLE OF THE STATE OF YORKTOWN,**\n\n**v.**\n\n**JAMES THOMPSON, Defendant.**\n\n**CRIMINAL JUDGMENT**\n\n---\n\n**I. Court and Prosecutor Information**\n\n**Court**: Quarryville, Yorktown, Court\\\n**Procuratorate**: Quarryville, Yorktown, Procuratorate\\\n**Chief Judge**: J. Phillips\\\n**Judge**: G. Campbell\\\n**Court Clerk**: R. Gutierrez\n\n---\n\n**II. Defendant and Defense Lawyer Information**\n\n**Defendant**: James Thompson\\\n**Gender**: Male\\\n**Date of Birth**: 24th August, 1988\\\n**Residence**: 47 Charleston Street, Yorktown\\\n**Ethnicity**: Caucasian\\\n**Occupation**: Finance Manager at Yorktown Municipal Office\n\n**Defense Lawyer**: B. Lewis\\\n**Law Firm**: Lewis & Associates\n\n---\n\n**III. Case Procedures**\n\n1. **Case Filing and Investigation: March 15, 2023**\\\nOn March 15, 2023, the Quarryville, Yorktown, Procuratorate formally filed and initiated an investigation into allegations of embezzlement against the defendant, James Thompson. This initiation followed the awareness of significant financial discrepancies within the Yorktown Municipal Office's accounts, specifically linking to disaster relief funds and flood control budgets.\n\n2. **Detention Measures Taken: March 20, 2023**\\\nSubsequent to initial investigations, considering the gravity of the allegations and likelihood of evidence tampering, detention measures were enforced on James Thompson on March 20, 2023. \n\n3. **Criminal Detention: March 25, 2023**\\\nFormal criminal detention was executed on March 25, 2023, as further incriminating evidence emerged, necessitating preventive detention under statutory provisions.\n\n4. **Arrest: March 30, 2023**\\\nOn March 30, 2023, after due procedure and confirmation of sufficient grounds, an arrest warrant was issued and executed against James Thompson for the crime of embezzlement.\n\n---\n\n**IV. Case Statement**\n\nThis case pertains to the defendant, James Thompson, who, during his tenure as the Finance Manager at Yorktown Municipal Office, allegedly committed multiple acts of embezzlement. The charges have been meticulously corroborated through extensive investigation and present irrefutable evidence to this court. The necessity of detailing each step is paramount to establishing the profound breach of trust and cavalier misconduct demonstrated by the defendant.\n\nThroughout the period between January 2023 and March 2023, Thompson abused his position, systematically diverting public funds for personal gain. The embezzlement spanned three distinct phases, each marked by calculated financial maneuvering and fraudulent authorizations.\n\n**January 2023 - February 2023: Misappropriation of Disaster Relief Fund**\n\nDuring this period, evidence collected includes bank statements, witness testimonies, and email correspondences that elucidate how Thompson orchestrated the transfer of $50,000 from the Yorktown Municipal Office's disaster relief fund to his personal account at Yorktown Federal Bank. This act of misappropriation was carried out through a series of unauthorized electronic transfers, meticulously camouflaged within legitimate transactions to evade detection. Witnesses from the municipal office, notably subordinate employees who were cognizant of the fund operations, provided testimonies damningly consistent in their narratives concerning Thompson's surreptitious activities.\n\n**February 2023 - March 2023: Fraudulent Vendor Payments**\n\nEvidence reveals that during this interval, Thompson fabricated invoices and authorized payments amounting to $30,000 to a non-existent entity feigned as a vendor. This vendor allegedly supplied emergency rescue equipment, but in reality, the funds were channeled into a private entity co-owned by Thompson's associate. Investigative records brought to light security camera footage capturing Thompson's activities within the office, emphasizing the falsified legitimacies on official documents. Thompson's associate, when apprehended, confessed to the conspiracy, further substantiating the charges against Thompson.\n\n**March 2023: Personal Exploitation of Flood Control Budget**\n\nThe series culminated in March 2023, when Thompson misappropriated an additional $20,000 earmarked for the flood control budget. Audit reports indicating stark discrepancies raised red flags, which the accounting department head corroborated through a formal statement. Instances of unauthorized access and withdrawals were documented, providing physical evidence that sealed the comprehension of Thompsonâ€™s fraudulent exploits. The repetitive exploitation underscores a recurrent modality strictly indicative of his intent for personal enrichment at the public expense.\n\n---\n\n**V. Charge**\n\nThis court charges James Thompson with the Crime of Embezzlement under Article 384. The court considers the depth and breadth of his trespasses within the public office, defining his actions within a composite of egregious financial malfeasance and unremitting breaches of public trust.\n\n---\n\n**VI. Evidence Description**\n\nThe following evidence collectively establishes a concrete foundation for the prosecution's case against the defendant, James Thompson:\n\n1. **Bank Statements**: Detailed statements from Yorktown Federal Bank identifying unauthorized transfers amounting to $50,000 into Thompson's personal account during January and February 2023.\n\n2. **Witness Testimonies**: Comprehensive depositions from municipal office employees who testified to observing irregularities in the disaster relief fund's handling, directly implicating Thompson.\n\n3. **Email Correspondence**: Retrievable exchanges between Thompson and bank officials demonstrating premeditated discussions related to the improper transfers, with implicated intent for personal gain.\n\n4. **Invoices from Fictitious Vendor**: Forensic analysis of invoices purporting the purchase of emergency rescue equipment from a nonexistent vendor, into which $30,000 was funneled.\n\n5. **Security Footage**: Time-stamped security footage capturing Thompson's authorization of the fraudulent payments, corroborating the invoicing irregularities with visual evidence.\n\n6. **Associate's Confession**: The associate's voluntary confession under sworn testimony, detailing how the embezzled funds were integrated into a private business co-owned covertly with Thompson.\n\n7. **Audit Reports**: Comprehensive audit statements from the Yorktown Municipal Office highlighting significant shortages in the flood control budget, imputing $20,000 diverted for personal expenditure.\n\n8. **Accounting Department Headâ€™s Statement**: An authoritative statement from the head of the accounting department elucidating unauthorized access episodes to budget accounts directly linking to Thompsonâ€™s intervention.\n\n9. **Physical Evidence**: Secure documentation pinpointing unauthorized access logs, withdrawal records, and other pertinent transactional evidence manifesting Thompsonâ€™s embezzlement acts.\n\n---\n\n**VII. Sentencing Considerations**\n\nWhen considering the appropriate sanction for James Thompson, this court meticulously balanced several aggravating and mitigating factors:\n\n1. **Severity of the Crime**: Thompson's actions exhibited a deliberate defalcation of public funds specifically purposed for disaster relief and flood control measures. The magnitude of the crime, compounded by its public welfare implications, categorically demands a stringent penalty.\n\n2. **Breach of Public Trust**: As a Finance Manager entrusted with city funds, Thompson's breach of fiduciary duties constitutes an egregious betrayal of institutional trust and public confidence, meriting severe retribution.\n\n3. **Pattern of Conduct**: The premeditated and recurrent nature of the embezzlement, spanning over months, highlights a systematic and calculated exploitation, underscoring the intransigence of the defendant.\n\n4. **Evidence of Rehabilitation Potential**: The court took into consideration Thompson's confession during the trial, which showcased an acknowledgment of guilt. However, the gravity and calculated nature of his actions suggest limited potential for rehabilitation within a mere probative term.\n\n5. **Financial Restitution Capability**: Considering Thompson's financial status and the embezzled sum, restitution is paramount. A mandate to repay the embezzled amount of $100,000 is integral to the judgment.\n\nIn view of these considerations, the court resolves that probation is inapplicable and that a fixed-term imprisonment suitably reflects the punitive and deterrent objectives of the justice system.\n\n---\n\n**VIII. Judgment Result**\n\nTherefore, having thoroughly weighed the evidentiary records, testimonies, and legal arguments presented, this court hereby adjudges:\n\n**James Thompson is guilty of the Crime of Embezzlement under Article 384**. The court sentences James Thompson to a fixed-term imprisonment of ten years. Furthermore, he is ordered to pay restitution amounting to the embezzled $100,000 to the Yorktown Municipal Office, ensuring the financial rectification of the public deficits incurred by his conduct.\n\n---\n\n**IX. Appeal Rights Explanation**\n\nThe defendant, James Thompson, is hereby informed of his right to file an appeal against this judgment. Under statutory provisions, Thompson may initiate an appeal to a higher judicial authority within a prescribed period of thirty (30) days from the date of this verdict. The formal appeal process necessitates submission in conformity with procedural court regulations.\n\n**This Court's presiding judges extend this judgment on the 10th day of October, 2023.**\n\n---\n\n**J. Phillips, Chief Judge**\n\n**G. Campbell, Judge**\n\n**R. Gutierrez, Court Clerk**\n\n---\n\nEnd of Document\n\nReference Article is belowï¼š\nArticle 384\nState personnel who take advantage of their position to embezzle public funds for personal use, engage in illegal activities, or embezzle public funds in large amounts for profit-making activities, or embezzle large amounts of public funds for more than three months without returning them, commit the crime of embezzlement, and shall be sentenced to fixed-term imprisonment of not more than five years or criminal detention; if the circumstances are serious, they shall be sentenced to fixed-term imprisonment of more than five years. If the embezzled amount is huge and not returned, they shall be sentenced to fixed-term imprisonment of more than ten years or life imprisonment.\nEmbezzlement of funds for disaster relief, emergency rescue, flood control, preferential treatment, poverty alleviation, immigration, or relief for personal use shall be punished more severely.",
    "qa_fact_based": [
        {
            "question type": "Factual Question",
            "question": "According to the court judgment of Quarryville, Yorktown, Court, who was the defendant?",
            "answer": "James Thompson.",
            "ref": [
                "**JAMES THOMPSON, Defendant.",
                "**Defendant**: James Thompson\\"
            ]
        },
        {
            "question type": "Factual Question",
            "question": "According to the court judgment of Quarryville, Yorktown, Court, what was the crime committed by J. Thompson?",
            "answer": "Crime of Embezzlement.",
            "ref": [
                "This court charges James Thompson with the Crime of Embezzlement under Article 384.",
                "**James Thompson is guilty of the Crime of Embezzlement under Article 384**."
            ]
        },
        {
            "question type": "Factual Question",
            "question": "According to the court judgment of Quarryville, Yorktown, Court, what was the judgment date?",
            "answer": "10th, October, 2023.",
            "ref": [
                "**This Court's presiding judges extend this judgment on the 10th day of October, 2023.**"
            ]
        }
    ],
    "qa_multi_hop": [
        {
            "question type": "Multi-hop Reasoning Question",
            "question": "According to the judgment of Quarryville, Yorktown, Court, how many embezzlement crimes did J. Thompson commit in total?",
            "answer": "According to the judgment, J. Thompson committed a total of three embezzlement crimes: transferring $50,000 from the disaster relief fund, authorizing $30,000 to a fictitious vendor, and withdrawing $20,000 from the flood control budget.",
            "ref": [
                "This case pertains to the defendant, James Thompson, who, during his tenure as the Finance Manager at Yorktown Municipal Office, allegedly committed multiple acts of embezzlement.",
                "Throughout the period between January 2023 and March 2023, Thompson abused his position, systematically diverting public funds for personal gain.",
                "The embezzlement spanned three distinct phases, each marked by calculated financial maneuvering and fraudulent authorizations.",
                "**January 2023 - February 2023: Misappropriation of Disaster Relief Fund**",
                "During this period, evidence collected includes bank statements, witness testimonies, and email correspondences that elucidate how Thompson orchestrated the transfer of $50,000 from the Yorktown Municipal Office's disaster relief fund to his personal account at Yorktown Federal Bank.",
                "This act of misappropriation was carried out through a series of unauthorized electronic transfers, meticulously camouflaged within legitimate transactions to evade detection.",
                "**February 2023 - March 2023: Fraudulent Vendor Payments**",
                "Evidence reveals that during this interval, Thompson fabricated invoices and authorized payments amounting to $30,000 to a non-existent entity feigned as a vendor.",
                "This vendor allegedly supplied emergency rescue equipment, but in reality, the funds were channeled into a private entity co-owned by Thompson's associate.",
                "Investigative records brought to light security camera footage capturing Thompson's activities within the office, emphasizing the falsified legitimacies on official documents.",
                "Thompson's associate, when apprehended, confessed to the conspiracy, further substantiating the charges against Thompson.",
                "**March 2023: Personal Exploitation of Flood Control Budget**",
                "The series culminated in March 2023, when Thompson misappropriated an additional $20,000 earmarked for the flood control budget.",
                "Audit reports indicating stark discrepancies raised red flags, which the accounting department head corroborated through a formal statement.",
                "Instances of unauthorized access and withdrawals were documented, providing physical evidence that sealed the comprehension of Thompsonâ€™s fraudulent exploits.",
                "The repetitive exploitation underscores a recurrent modality strictly indicative of his intent for personal enrichment at the public expense."
            ]
        },
        {
            "question type": "Multi-hop Reasoning Question",
            "question": "According to the judgment of Quarryville, Yorktown, Court, what is the total amount embezzled by J. Thompson in all his crimes?",
            "answer": "According to the judgment, J. Thompson embezzled a total of $100,000: $50,000 from the disaster relief fund, $30,000 to a fictitious vendor, and $20,000 from the flood control budget.",
            "ref": [
                "This case pertains to the defendant, James Thompson, who, during his tenure as the Finance Manager at Yorktown Municipal Office, allegedly committed multiple acts of embezzlement.",
                "Throughout the period between January 2023 and March 2023, Thompson abused his position, systematically diverting public funds for personal gain.",
                "The embezzlement spanned three distinct phases, each marked by calculated financial maneuvering and fraudulent authorizations.",
                "**January 2023 - February 2023: Misappropriation of Disaster Relief Fund**",
                "During this period, evidence collected includes bank statements, witness testimonies, and email correspondences that elucidate how Thompson orchestrated the transfer of $50,000 from the Yorktown Municipal Office's disaster relief fund to his personal account at Yorktown Federal Bank.",
                "This act of misappropriation was carried out through a series of unauthorized electronic transfers, meticulously camouflaged within legitimate transactions to evade detection.",
                "**February 2023 - March 2023: Fraudulent Vendor Payments**",
                "Evidence reveals that during this interval, Thompson fabricated invoices and authorized payments amounting to $30,000 to a non-existent entity feigned as a vendor.",
                "This vendor allegedly supplied emergency rescue equipment, but in reality, the funds were channeled into a private entity co-owned by Thompson's associate.",
                "Investigative records brought to light security camera footage capturing Thompson's activities within the office, emphasizing the falsified legitimacies on official documents.",
                "Thompson's associate, when apprehended, confessed to the conspiracy, further substantiating the charges against Thompson.",
                "**March 2023: Personal Exploitation of Flood Control Budget**",
                "The series culminated in March 2023, when Thompson misappropriated an additional $20,000 earmarked for the flood control budget.",
                "Audit reports indicating stark discrepancies raised red flags, which the accounting department head corroborated through a formal statement.",
                "Instances of unauthorized access and withdrawals were documented, providing physical evidence that sealed the comprehension of Thompsonâ€™s fraudulent exploits.",
                "The repetitive exploitation underscores a recurrent modality strictly indicative of his intent for personal enrichment at the public expense.",
                "A mandate to repay the embezzled amount of $100,000 is integral to the judgment.",
                "Furthermore, he is ordered to pay restitution amounting to the embezzled $100,000 to the Yorktown Municipal Office, ensuring the financial rectification of the public deficits incurred by his conduct."
            ]
        },
        {
            "question type": "Multi-hop Reasoning Question",
            "question": "According to the judgment of Quarryville, Yorktown, Court, how many pieces of evidence were presented against J. Thompson?",
            "answer": "According to the judgment, there were nine pieces of evidence presented against J. Thompson: bank statements, witness testimony, email correspondence, invoices, security footage, confession, audit reports, statement from the accounting department head, and physical evidence of unauthorized access to budget accounts.",
            "ref": [
                "The following evidence collectively establishes a concrete foundation for the prosecution's case against the defendant, James Thompson:",
                "1. **Bank Statements**: Detailed statements from Yorktown Federal Bank identifying unauthorized transfers amounting to $50,000 into Thompson's personal account during January and February 2023.",
                "2. **Witness Testimonies**: Comprehensive depositions from municipal office employees who testified to observing irregularities in the disaster relief fund's handling, directly implicating Thompson.",
                "3. **Email Correspondence**: Retrievable exchanges between Thompson and bank officials demonstrating premeditated discussions related to the improper transfers, with implicated intent for personal gain.",
                "4. **Invoices from Fictitious Vendor**: Forensic analysis of invoices purporting the purchase of emergency rescue equipment from a nonexistent vendor, into which $30,000 was funneled.",
                "5. **Security Footage**: Time-stamped security footage capturing Thompson's authorization of the fraudulent payments, corroborating the invoicing irregularities with visual evidence.",
                "6. **Associate's Confession**: The associate's voluntary confession under sworn testimony, detailing how the embezzled funds were integrated into a private business co-owned covertly with Thompson.",
                "7. **Audit Reports**: Comprehensive audit statements from the Yorktown Municipal Office highlighting significant shortages in the flood control budget, imputing $20,000 diverted for personal expenditure.",
                "8. **Accounting Department Headâ€™s Statement**: An authoritative statement from the head of the accounting department elucidating unauthorized access episodes to budget accounts directly linking to Thompsonâ€™s intervention.",
                "9. **Physical Evidence**: Secure documentation pinpointing unauthorized access logs, withdrawal records, and other pertinent transactional evidence manifesting Thompsonâ€™s embezzlement acts."
            ]
        }
    ],
    "qa_summary": [
        {
            "question type": "Summarization Question",
            "question": "According to the judgment of Quarryville, Yorktown, Court, summarize the facts of J. Thompson's crimes.",
            "answer": "J. Thompson committed the crime of embezzlement by transferring $50,000 from the Yorktown Municipal Office's disaster relief fund into a personal bank account between January 2023 and February 2023. Between February 2023 and March 2023, he authorized payments totaling $30,000 to a fictitious vendor, diverting funds intended for emergency rescue operations into a private business owned by an associate. In March 2023, he used his position to withdraw an additional $20,000 from the flood control budget for personal use.",
            "ref": [
                "This case pertains to the defendant, James Thompson, who, during his tenure as the Finance Manager at Yorktown Municipal Office, allegedly committed multiple acts of embezzlement.",
                "Throughout the period between January 2023 and March 2023, Thompson abused his position, systematically diverting public funds for personal gain.",
                "The embezzlement spanned three distinct phases, each marked by calculated financial maneuvering and fraudulent authorizations.",
                "**January 2023 - February 2023: Misappropriation of Disaster Relief Fund**",
                "During this period, evidence collected includes bank statements, witness testimonies, and email correspondences that elucidate how Thompson orchestrated the transfer of $50,000 from the Yorktown Municipal Office's disaster relief fund to his personal account at Yorktown Federal Bank.",
                "This act of misappropriation was carried out through a series of unauthorized electronic transfers, meticulously camouflaged within legitimate transactions to evade detection.",
                "Witnesses from the municipal office, notably subordinate employees who were cognizant of the fund operations, provided testimonies damningly consistent in their narratives concerning Thompson's surreptitious activities.",
                "**February 2023 - March 2023: Fraudulent Vendor Payments**",
                "Evidence reveals that during this interval, Thompson fabricated invoices and authorized payments amounting to $30,000 to a non-existent entity feigned as a vendor.",
                "This vendor allegedly supplied emergency rescue equipment, but in reality, the funds were channeled into a private entity co-owned by Thompson's associate.",
                "Investigative records brought to light security camera footage capturing Thompson's activities within the office, emphasizing the falsified legitimacies on official documents.",
                "Thompson's associate, when apprehended, confessed to the conspiracy, further substantiating the charges against Thompson.",
                "**March 2023: Personal Exploitation of Flood Control Budget**",
                "The series culminated in March 2023, when Thompson misappropriated an additional $20,000 earmarked for the flood control budget.",
                "Audit reports indicating stark discrepancies raised red flags, which the accounting department head corroborated through a formal statement.",
                "Instances of unauthorized access and withdrawals were documented, providing physical evidence that sealed the comprehension of Thompsonâ€™s fraudulent exploits.",
                "The repetitive exploitation underscores a recurrent modality strictly indicative of his intent for personal enrichment at the public expense."
            ]
        },
        {
            "question type": "Summarization Question",
            "question": "According to the judgment of Quarryville, Yorktown, Court, summarize the evidence of J. Thompson's crimes.",
            "answer": "The evidence includes bank statements showing the transfers, witness testimony from municipal office employees, email correspondence between J. Thompson and bank officials, invoices from the fictitious vendor, security footage showing Thompson authorizing payments, a confession from the associate, audit reports showing discrepancies, a statement from the accounting department head, and physical evidence of unauthorized access to budget accounts.",
            "ref": [
                "The following evidence collectively establishes a concrete foundation for the prosecution's case against the defendant, James Thompson:",
                "1. **Bank Statements**: Detailed statements from Yorktown Federal Bank identifying unauthorized transfers amounting to $50,000 into Thompson's personal account during January and February 2023.",
                "2. **Witness Testimonies**: Comprehensive depositions from municipal office employees who testified to observing irregularities in the disaster relief fund's handling, directly implicating Thompson.",
                "3. **Email Correspondence**: Retrievable exchanges between Thompson and bank officials demonstrating premeditated discussions related to the improper transfers, with implicated intent for personal gain.",
                "4. **Invoices from Fictitious Vendor**: Forensic analysis of invoices purporting the purchase of emergency rescue equipment from a nonexistent vendor, into which $30,000 was funneled.",
                "5. **Security Footage**: Time-stamped security footage capturing Thompson's authorization of the fraudulent payments, corroborating the invoicing irregularities with visual evidence.",
                "6. **Associate's Confession**: The associate's voluntary confession under sworn testimony, detailing how the embezzled funds were integrated into a private business co-owned covertly with Thompson.",
                "7. **Audit Reports**: Comprehensive audit statements from the Yorktown Municipal Office highlighting significant shortages in the flood control budget, imputing $20,000 diverted for personal expenditure.",
                "8. **Accounting Department Headâ€™s Statement**: An authoritative statement from the head of the accounting department elucidating unauthorized access episodes to budget accounts directly linking to Thompsonâ€™s intervention.",
                "9. **Physical Evidence**: Secure documentation pinpointing unauthorized access logs, withdrawal records, and other pertinent transactional evidence manifesting Thompsonâ€™s embezzlement acts."
            ]
        },
        {
            "question type": "Summarization Question",
            "question": "According to the judgment of Quarryville, Yorktown, Court, summarize the case process of J. Thompson.",
            "answer": "The case process began with the filing and investigation on 15th March 2023, followed by detention measures taken on 20th March 2023. J. Thompson was criminally detained on 25th March 2023 and subsequently arrested on 30th March 2023.",
            "ref": [
                "Case Procedures**",
                "1. **Case Filing and Investigation: March 15, 2023**\\",
                "On March 15, 2023, the Quarryville, Yorktown, Procuratorate formally filed and initiated an investigation into allegations of embezzlement against the defendant, James Thompson.",
                "This initiation followed the awareness of significant financial discrepancies within the Yorktown Municipal Office's accounts, specifically linking to disaster relief funds and flood control budgets.",
                "2. **Detention Measures Taken: March 20, 2023**\\",
                "Subsequent to initial investigations, considering the gravity of the allegations and likelihood of evidence tampering, detention measures were enforced on James Thompson on March 20, 2023.",
                "3. **Criminal Detention: March 25, 2023**\\",
                "Formal criminal detention was executed on March 25, 2023, as further incriminating evidence emerged, necessitating preventive detention under statutory provisions.",
                "4. **Arrest: March 30, 2023**\\",
                "On March 30, 2023, after due procedure and confirmation of sufficient grounds, an arrest warrant was issued and executed against James Thompson for the crime of embezzlement."
            ]
        },
        {
            "question type": "Summarization Question",
            "question": "According to the judgment of Quarryville, Yorktown, Court, summarize the judgment result for J. Thompson.",
            "answer": "J. Thompson was found guilty of the crime of embezzlement and sentenced to a fixed-term imprisonment of ten years. He was also ordered to pay restitution of the embezzled $100,000. The court deemed the embezzlement of a large amount of public funds intended for disaster relief as severe, justifying the ten-year sentence. Probation was not applicable due to the serious nature of the crime.",
            "ref": [
                "Charge**",
                "This court charges James Thompson with the Crime of Embezzlement under Article 384.",
                "The court considers the depth and breadth of his trespasses within the public office, defining his actions within a composite of egregious financial malfeasance and unremitting breaches of public trust.",
                "Therefore, having thoroughly weighed the evidentiary records, testimonies, and legal arguments presented, this court hereby adjudges:",
                "**James Thompson is guilty of the Crime of Embezzlement under Article 384**.",
                "The court sentences James Thompson to a fixed-term imprisonment of ten years.",
                "Furthermore, he is ordered to pay restitution amounting to the embezzled $100,000 to the Yorktown Municipal Office, ensuring the financial rectification of the public deficits incurred by his conduct."
            ]
        }
    ]
}