{
    "报告类型": "公司财务报告",
    "报告时间": "2021年度",
    "公司信息": {
        "名称": "农业发展有限公司",
        "成立日期": "2001年5月",
        "主营业务": "农作物种植和农产品销售",
        "注册地": "农业大省云南",
        "上市情况": "未上市",
        "行业": "农业"
    },
    "报告内容": [
        {
            "类型": "财务信息",
            "重要事件": [
                {
                    "事件": "重大股权收购",
                    "时间": "2021年1月",
                    "描述": "公司完成了对云南农业有限公司60%的股权收购，获得了公司的控制权。",
                    "影响": "进一步扩大了公司的市场份额，提升了公司的控制力。",
                    "子事件": [
                        {
                            "事件": "云南农业有限公司收购决策",
                            "时间": "2020年11月",
                            "描述": "农业发展有限公司高层管理人员进行了对云南农业有限公司的尽职调查和评估，确定了收购的可行性。",
                            "影响": "为重大股权收购决策打下了基础，为后续谈判提供了依据。"
                        },
                        {
                            "事件": "谈判开始",
                            "时间": "2020年12月",
                            "描述": "农业发展有限公司与云南农业有限公司开始了股权收购的谈判，并商定了收购的具体条件和价格。",
                            "影响": "为后续收购提供了明确的目标和框架，准备了收购的法律和财务文件。"
                        },
                        {
                            "事件": "股权交割",
                            "时间": "2021年1月",
                            "描述": "农业发展有限公司与云南农业有限公司正式签署了股权转让协议，并进行了资金结算，完成了股权收购。",
                            "影响": "取得了云南农业有限公司的控制权，进一步扩大了公司的市场份额和影响力。"
                        }
                    ]
                },
                {
                    "事件": "重大投资",
                    "时间": "2021年3月",
                    "描述": "公司投资了昆明农业科技园项目，投资金额为5000万元。",
                    "影响": "进一步拓宽了公司的业务领域，提升了公司的盈利能力。"
                },
                {
                    "事件": "大规模融资",
                    "时间": "2021年6月",
                    "描述": "公司进行了一次大规模的融资活动，募集了8000万元资金。",
                    "影响": "加强了公司的资金实力，支持了公司的扩张和发展。"
                },
                {
                    "事件": "债务重组",
                    "时间": "2021年7月",
                    "描述": "为优化资本结构，公司进行了债务重组，减少了2000万元负债。",
                    "影响": "改善了公司的财务状况，降低了财务成本。"
                },
                {
                    "事件": "资产重组",
                    "时间": "2021年8月",
                    "描述": "公司进行了一次资产重组，优化了农产品种植和销售的业务结构。",
                    "影响": "提高了公司的运营效率，增加了公司的价值。"
                },
                {
                    "事件": "分发股利",
                    "时间": "2021年10月",
                    "描述": "公司决定向股东分发1000万元股利。",
                    "影响": "回报给股东们的投资，提升了股东的收益。"
                },
                {
                    "事件": "重大资产收购",
                    "时间": "2021年12月",
                    "描述": "公司完成了对云南农机制造有限公司的资产收购，总价值5000万元。",
                    "影响": "扩大公司的业务范围，增强市场竞争力。"
                }
            ],
            "涉及的指标": [
                {
                    "指标": "营业收入",
                    "描述": "公司在一定会计期间内的主营业务收入和其他业务收入总额。",
                    "影响因素": [
                        "市场需求的增长",
                        "农产品价格的波动"
                    ],
                    "值": "30000万元"
                },
                {
                    "指标": "净利润",
                    "描述": "公司在一定会计期间的净收入，即总收入减去总成本和所得税费用后的金额。",
                    "影响因素": [
                        "营业收入的增长",
                        "成本控制的效果",
                        "非经常性损益的影响"
                    ],
                    "值": "5000万元"
                },
                {
                    "指标": "总资产",
                    "描述": "会计期末，公司所拥有的资产总额。",
                    "影响因素": [
                        "资产收购和投资的增加",
                        "资产处置和减值准备的减少",
                        "资产重估的影响"
                    ],
                    "值": "50000万元"
                },
                {
                    "指标": "总负债",
                    "描述": "会计期末，公司所承担并需要偿还的债务总额。",
                    "影响因素": [
                        "新债发行的增加",
                        "债务偿还的减少",
                        "债务重组的影响"
                    ],
                    "值": "15000万元"
                },
                {
                    "指标": "股东权益",
                    "描述": "会计期末，归属于股东的权益总额。",
                    "影响因素": [
                        "净利润的增加",
                        "股利发放的减少",
                        "资本公积的影响"
                    ],
                    "值": "35000万元"
                },
                {
                    "指标": "现金流量",
                    "描述": "公司在一定会计期间内的现金流入和流出总和。",
                    "影响因素": [
                        "经营活动的现金流量",
                        "投资活动的现金流量",
                        "筹资活动的现金流量"
                    ],
                    "值": "10000万元"
                },
                {
                    "指标": "负债比率",
                    "描述": "公司总负债与总资产的比率，反映公司的债务水平。",
                    "影响因素": [
                        "总负债的变化",
                        "总资产的变化"
                    ],
                    "值": "30%"
                },
                {
                    "指标": "资产负债率",
                    "描述": "公司总负债占总资产的百分比，衡量公司财务杠杆的一个指标。",
                    "影响因素": [
                        "资产和负债的增减变化"
                    ],
                    "值": "30%"
                },
                {
                    "指标": "净资产收益率",
                    "描述": "反映公司股东权益的经营效益，即净利润与平均股东权益的比率。",
                    "影响因素": [
                        "净利润的变化",
                        "股东权益的变化"
                    ],
                    "值": "15%"
                }
            ]
        }
    ],
    "额外信息": [
        {
            "名称": "未来展望",
            "内容": [
                {
                    "名称": "财务策略",
                    "描述": "公司未来计划实施的财务策略，包括加强成本控制，提高资本利用效率，并通过市场开拓和产品创新等措施提升盈利能力。"
                },
                {
                    "名称": "投资计划",
                    "描述": "公司愿意加大对农业科技的投入，加强与科研机构的合作，推动现代农业技术的应用，提高农产品的产量和质量。"
                },
                {
                    "名称": "风险管理",
                    "描述": "公司将加强对市场风险、价格风险以及自然灾害等风险的监测和防范，建立风险应对机制，保障公司的可持续发展。"
                }
            ]
        }
    ],
    "生成大纲": "公司财务报告大纲\n\n报告时间：2021年度\n\n报告内容：\n一、财务信息\n   重要事件：\n   1. 重大股权收购\n      - 时间：2021年1月\n      - 描述：公司完成了对云南农业有限公司60%的股权收购，获得了公司的控制权。\n      - 影响：进一步扩大了公司的市场份额，提升了公司的控制力。\n      - 子事件：\n        - 云南农业有限公司收购决策\n          - 时间：2020年11月\n          - 描述：农业发展有限公司高层管理人员进行了对云南农业有限公司的尽职调查和评估，确定了收购的可行性。\n          - 影响：为重大股权收购决策打下了基础，为后续谈判提供了依据。\n        - 谈判开始\n          - 时间：2020年12月\n          - 描述：农业发展有限公司与云南农业有限公司开始了股权收购的谈判，并商定了收购的具体条件和价格。\n          - 影响：为后续收购提供了明确的目标和框架，准备了收购的法律和财务文件。\n        - 股权交割\n          - 时间：2021年1月\n          - 描述：农业发展有限公司与云南农业有限公司正式签署了股权转让协议，并进行了资金结算，完成了股权收购。\n          - 影响：取得了云南农业有限公司的控制权，进一步扩大了公司的市场份额和影响力。\n\n   2. 重大投资\n      - 时间：2021年3月\n      - 描述：公司投资了昆明农业科技园项目，投资金额为5000万元。\n      - 影响：进一步拓宽了公司的业务领域，提升了公司的盈利能力。\n\n   3. 大规模融资\n      - 时间：2021年6月\n      - 描述：公司进行了一次大规模的融资活动，募集了8000万元资金。\n      - 影响：加强了公司的资金实力，支持了公司的扩张和发展。\n\n   4. 债务重组\n      - 时间：2021年7月\n      - 描述：为优化资本结构，公司进行了债务重组，减少了2000万元负债。\n      - 影响：改善了公司的财务状况，降低了财务成本。\n\n   5. 资产重组\n      - 时间：2021年8月\n      - 描述：公司进行了一次资产重组，优化了农产品种植和销售的业务结构。\n      - 影响：提高了公司的运营效率，增加了公司的价值。\n\n   6. 分发股利\n      - 时间：2021年10月\n      - 描述：公司决定向股东分发1000万元股利。\n      - 影响：回报给股东们的投资，提升了股东的收益。\n\n   7. 重大资产收购\n      - 时间：2021年12月\n      - 描述：公司完成了对云南农机制造有限公司的资产收购，总价值5000万元。\n      - 影响：扩大公司的业务范围，增强市场竞争力。\n\n   涉及的指标：\n   1. 营业收入\n      - 描述：公司在一定会计期间内的主营业务收入和其他业务收入总额。\n      - 影响因素：市场需求的增长，农产品价格的波动\n      - 值：30000万元\n\n   2. 净利润\n      - 描述：公司在一定会计期间的净收入，即总收入减去总成本和所得税费用后的金额。\n      - 影响因素：营业收入的增长，成本控制的效果，非经常性损益的影响\n      - 值：5000万元\n\n   3. 总资产\n      - 描述：会计期末，公司所拥有的资产总额。\n      - 影响因素：资产收购和投资的增加，资产处置和减值准备的减少，资产重估的影响\n      - 值：50000万元\n\n   4. 总负债\n      - 描述：会计期末，公司所承担并需要偿还的债务总额。\n      - 影响因素：新债发行的增加，债务偿还的减少，债务重组的影响\n      - 值：15000万元\n\n   5. 股东权益\n      - 描述：会计期末，归属于股东的权益总额。\n      - 影响因素：净利润的增加，股利发放的减少，资本公积的影响\n      - 值：35000万元\n\n   6. 现金流量\n      - 描述：公司在一定会计期间内的现金流入和流出总和。\n      - 影响因素：经营活动的现金流量，投资活动的现金流量，筹资活动的现金流量\n      - 值：10000万元\n\n   7. 负债比率\n      - 描述：公司总负债与总资产的比率，反映公司的债务水平。\n      - 影响因素：总负债的变化，总资产的变化\n      - 值：30%\n\n   8. 资产负债率\n      - 描述：公司总负债占总资产的百分比，衡量公司财务杠杆的一个指标。\n      - 影响因素：资产和负债的增减变化\n      - 值：30%\n\n   9. 净资产收益率\n      - 描述：反映公司股东权益的经营效益，即净利润与平均股东权益的比率。\n      - 影响因素：净利润的变化，股东权益的变化\n      - 值：15%\n\n二、额外信息\n   1. 未来展望\n      - 财务策略：加强成本控制，提高资本利用效率，并通过市场开拓和产品创新等措施提升盈利能力。\n      - 投资计划：加大对农业科技的投入，加强与科研机构的合作，推动现代农业技术的应用，提高农产品的产量和质量。\n      - 风险管理：加强对市场风险、价格风险以及自然灾害等风险的监测和防范，建立风险应对机制，保障公司的可持续发展。",
    "生成总结": "农业发展有限公司是一家成立于2001年5月，主要从事农作物种植和农产品销售的农业公司，注册地位于农业大省云南，目前尚未上市。",
    "生成文章": "2021年度是农业发展有限公司发展历程中的重要一年。公司在这一年内进行了多项重大事件，进一步扩大了市场份额，提升了公司的控制力。首先，在2021年1月，公司完成了对云南农业有限公司60%的股权收购，获得了公司的控制权。这次收购是在2020年11月进行了对云南农业有限公司的尽职调查和评估后决定的，为收购决策打下了基础。随后，在2020年12月，公司与云南农业有限公司开始了股权收购的谈判，并商定了收购的具体条件和价格。最终，在2021年1月，公司与云南农业有限公司正式签署了股权转让协议，并进行了资金结算，完成了股权收购。这次收购使得公司进一步扩大了市场份额和影响力。\n\n除了股权收购，公司还进行了其他重大投资。在2021年3月，公司投资了昆明农业科技园项目，投资金额为5000万元。这项投资进一步拓宽了公司的业务领域，提升了公司的盈利能力。\n\n为了支持公司的扩张和发展，公司在2021年6月进行了一次大规模的融资活动，募集了8000万元资金。这次融资活动加强了公司的资金实力，为公司的发展提供了充足的资金支持。\n\n为了优化资本结构，公司在2021年7月进行了债务重组，减少了2000万元负债。这次债务重组改善了公司的财务状况，降低了财务成本。\n\n在2021年8月，公司进行了一次资产重组，优化了农产品种植和销售的业务结构。这次资产重组提高了公司的运营效率，增加了公司的价值。\n\n为回报给股东们的投资，公司决定在2021年10月向股东分发1000万元股利。这次股利分发提升了股东的收益。\n\n最后，在2021年12月，公司完成了对云南农机制造有限公司的资产收购，总价值5000万元。这次资产收购扩大了公司的业务范围，增强了公司的市场竞争力。\n\n在这些重大事件的影响下，公司的财务指标也发生了相应的变化。在2021年度，公司的营业收入达到了30000万元，这主要受益于市场需求的增长和农产品价格的波动。同时，公司的净利润达到了5000万元，这得益于营业收入的增长、成本控制的效果以及非经常性损益的影响。\n\n公司的总资产达到了50000万元，这主要受益于资产收购和投资的增加，以及资产处置和减值准备的减少。与此同时，公司的总负债为15000万元，这受到新债发行的增加和债务偿还的减少的影响。\n\n股东权益达到了35000万元，这主要受益于净利润的增加，股利发放的减少以及资本公积的影响。\n\n公司的现金流量达到了10000万元，这主要受益于经营活动的现金流量、投资活动的现金流量以及筹资活动的现金流量。\n\n负债比率为30%，这反映了公司的债务水平。资产负债率也为30%，这衡量了公司的财务杠杆。\n\n净资产收益率为15%，这反映了公司股东权益的经营效益，即净利润与平均股东权益的比率。\n\n展望未来，农业发展有限公司将加强成本控制，提高资本利用效率，并通过市场开拓和产品创新等措施提升盈利能力。公司还计划加大对农业科技的投入，加强与科研机构的合作，推动现代农业技术的应用，提高农产品的产量和质量。同时，公司将加强对市场风险、价格风险以及自然灾害等风险的监测和防范，建立风险应对机制，保障公司的可持续发展。\n\n综上所述，2021年度是农业发展有限公司发展历程中的重要一年。通过一系列重大事件的推动，公司进一步扩大了市场份额，提升了控制力，并取得了良好的财务表现。展望未来，公司将继续努力，实现更大的发展。"
}