{
    "报告类型": "公司治理报告",
    "报告时间": "2018年度",
    "公司信息": {
        "名称": "政府部门有限公司",
        "成立日期": "1995年6月",
        "主营业务": "政府承接的各类项目的管理和运营",
        "注册地": "中国北京市",
        "上市情况": "未上市",
        "行业": "政府"
    },
    "报告内容": [
        {
            "类型": "治理结构",
            "重要事件": [
                {
                    "事件": "股东大会决议",
                    "时间": "2018年1月",
                    "描述": "公司在年度或特别股东大会上作出了重要决策，包括公司章程的变更、重大公司行动和股东投票结果。",
                    "影响": "股东大会决议直接影响公司治理结构、未来经营策略和股东权益。",
                    "子事件": [
                        {
                            "事件": "董事会讨论公司章程变更",
                            "时间": "2018年1月",
                            "描述": "董事会在股东大会前召开会议，讨论公司章程的变更事项，包括增加新的治理规定和股东权益保护措施。",
                            "影响": "公司章程的变更将直接影响公司的治理结构和股东权益，提供更加健全和可持续的治理框架。"
                        },
                        {
                            "事件": "股东提出关于重大公司行动的提案",
                            "时间": "2018年1月",
                            "描述": "在股东大会上，某一或多个股东提出了关于重大公司行动的提案，如进行战略投资、公司合并等。",
                            "影响": "股东提案将直接影响公司未来的经营策略和发展方向，对公司的战略决策产生重要影响。"
                        },
                        {
                            "事件": "股东对公司章程变更进行投票",
                            "时间": "2018年1月",
                            "描述": "在股东大会上，股东对公司章程的变更提案进行投票表决。",
                            "影响": "投票结果将直接决定公司章程的变更是否获得通过，对公司治理结构和股东权益产生重要影响。"
                        },
                        {
                            "事件": "股东对重大公司行动提案进行投票",
                            "时间": "2018年1月",
                            "描述": "在股东大会上，股东对关于重大公司行动的提案进行投票表决。",
                            "影响": "投票结果将直接决定公司是否执行该重大公司行动，对公司的战略决策和发展方向产生重要影响。"
                        }
                    ]
                },
                {
                    "事件": "董事会变更",
                    "时间": "2018年3月",
                    "描述": "公司董事会经过调整，新成员的加入和原成员的离职，对公司战略方向产生了影响。",
                    "影响": "董事会变更可能导致公司战略调整，对公司长期发展方向和股东利益产生影响。"
                },
                {
                    "事件": "合规与监管更新",
                    "时间": "2018年4月",
                    "描述": "公司根据新规定或合规标准的变化，对治理实践进行了更新。",
                    "影响": "合规与监管更新确保公司遵守最新法律法规，降低法律风险，保护公司和股东权益。"
                },
                {
                    "事件": "道德与诚信事件",
                    "时间": "2018年5月",
                    "描述": "公司发生了重大的道德或诚信违规事件，包括欺诈、腐败或利益冲突案例，并采取了相应的应对措施。",
                    "影响": "道德与诚信事件可能损害公司声誉和品牌价值，对公司与投资者、客户和合作伙伴的关系产生影响。"
                },
                {
                    "事件": "高级管理层变动",
                    "时间": "2018年7月",
                    "描述": "公司高级管理层发生了变动，包括CEO或其他关键职位的更换，对公司运营重点和优先事项产生了影响。",
                    "影响": "高级管理层变动可能导致公司运营重点和战略优先事项的调整，对短期业绩和长期发展产生影响。"
                },
                {
                    "事件": "可持续性与社会责任倡议",
                    "时间": "2018年8月",
                    "描述": "公司在可持续性、环境保护、社会责任和企业公民方面取得了重大进展。",
                    "影响": "可持续性与社会责任倡议提升了公司公众形象和市场竞争力，促进了长期可持续发展。"
                },
                {
                    "事件": "公司收购子公司",
                    "时间": "2018年9月",
                    "描述": "公司成功收购了一家子公司，增强了公司的市场份额和竞争力。",
                    "影响": "公司收购子公司进一步增强了公司市场份额和竞争力，为公司未来的业务扩张奠定了基础。"
                },
                {
                    "事件": "公司治理政策修订",
                    "时间": "2018年10月",
                    "描述": "公司对治理框架进行了修订，增强透明度、问责制和利益相关者参与程度。",
                    "影响": "公司治理政策修订将提升公司治理透明度和问责制，增强利益相关者的信心。"
                },
                {
                    "事件": "风险管理举措",
                    "时间": "2018年11月",
                    "描述": "公司更新了风险管理框架，包括识别新风险和实施缓解策略。",
                    "影响": "风险管理举措提高了公司应对内外部风险的能力，保障了公司持续运营和稳定发展。"
                },
                {
                    "事件": "子公司IPO",
                    "时间": "2018年12月",
                    "描述": "公司旗下的一家子公司成功上市，并获得了良好的市场反响和投资者关注。",
                    "影响": "子公司IPO为公司带来了资本市场的认可，增加了投资者信心，为公司整体业务带来了机遇。"
                }
            ],
            "涉及的指标": [
                {
                    "指标": "信息披露",
                    "描述": "公司遵守信息披露的原则、方式，并有效执行。",
                    "值": "信息披露符合证券法、公司法以及监管机构的要求，包括及时披露财报、年度报告等重要信息。"
                },
                {
                    "指标": "关联交易",
                    "描述": "公司建立了关联交易的流程及其公正性和合规性保证措施。",
                    "值": "公司关联交易均遵循公开、公正、合规的原则，确保利益平衡和资金安全。"
                },
                {
                    "指标": "内部控制",
                    "描述": "公司建立了完善的内部控制架构，有效实施，并进行了效果评估。",
                    "值": "公司内部控制有效运行，风险评估及时、准确，并进行了定期的自查和外部审计。"
                }
            ]
        }
    ],
    "额外信息": [
        {
            "名称": "治理改进计划",
            "内容": [
                {
                    "名称": "加强董事会和监事会功能",
                    "描述": "公司计划通过定期的培训、增加独立董事比例和优化决策过程，提高董事会和监事会在公司治理中的效率和效果。"
                },
                {
                    "名称": "提升透明度和信息披露质量",
                    "描述": "公司计划改进信息披露流程和标准，确保及时、准确、全面地向所有利益相关者报告公司的情况。"
                }
            ]
        },
        {
            "名称": "风险管理策略",
            "内容": [
                {
                    "名称": "内部控制系统强化",
                    "描述": "公司计划进一步建立和完善内部控制系统，加强财务和运营风险的识别、评估、监控和报告，提高抵御风险的能力。"
                },
                {
                    "名称": "可持续发展和社会责任整合",
                    "描述": "公司将可持续发展和社会责任纳入战略考量，识别相关风险和机会，促进长期价值创造。"
                }
            ]
        }
    ],
    "生成大纲": "公司治理报告大纲\n\n报告时间：2018年度\n\n一、 治理结构\n   1. 股东大会决议\n       a. 董事会讨论公司章程变更 (2018年1月)\n           - 描述：董事会在股东大会前召开会议，讨论公司章程的变更事项。\n           - 影响：公司章程的变更将直接影响公司的治理结构和股东权益。\n       b. 股东提出关于重大公司行动的提案 (2018年1月)\n           - 描述：某一或多个股东在股东大会上提出关于重大公司行动的提案。\n           - 影响：股东提案将直接影响公司未来的经营策略和发展方向。\n       c. 股东对公司章程变更进行投票 (2018年1月)\n           - 描述：股东大会上对公司章程的变更提案进行投票表决。\n           - 影响：投票结果将直接决定公司章程的变更是否获得通过。\n       d. 股东对重大公司行动提案进行投票 (2018年1月)\n           - 描述：股东大会上对关于重大公司行动的提案进行投票表决。\n           - 影响：投票结果将直接决定公司是否执行该重大公司行动。\n   2. 董事会变更 (2018年3月)\n       - 描述：公司董事会经过调整，新成员的加入和原成员的离职。\n       - 影响：董事会变更可能导致公司战略调整，对公司长期发展方向和股东利益产生影响。\n   3. 合规与监管更新 (2018年4月)\n       - 描述：公司根据新规定或合规标准的变化，对治理实践进行了更新。\n       - 影响：合规与监管更新确保公司遵守最新法律法规，降低法律风险，保护公司和股东权益。\n   4. 道德与诚信事件 (2018年5月)\n       - 描述：公司发生了重大的道德或诚信违规事件，并采取了相应的应对措施。\n       - 影响：道德与诚信事件可能损害公司声誉和品牌价值，对公司与投资者、客户和合作伙伴的关系产生影响。\n   5. 高级管理层变动 (2018年7月)\n       - 描述：公司高级管理层发生了变动，对公司运营重点和优先事项产生影响。\n       - 影响：高级管理层变动可能导致公司运营重点和战略优先事项的调整，对短期业绩和长期发展产生影响。\n   6. 可持续性与社会责任倡议 (2018年8月)\n       - 描述：公司在可持续性、环境保护、社会责任和企业公民方面取得了重大进展。\n       - 影响：可持续性与社会责任倡议提升了公司公众形象和市场竞争力，促进了长期可持续发展。\n   7. 公司收购子公司 (2018年9月)\n       - 描述：公司成功收购了一家子公司，增强了公司的市场份额和竞争力。\n       - 影响：公司收购子公司进一步增强了公司市场份额和竞争力，为公司未来的业务扩张奠定了基础。\n   8. 公司治理政策修订 (2018年10月)\n       - 描述：公司对治理框架进行了修订，增强透明度、问责制和利益相关者参与程度。\n       - 影响：公司治理政策修订将提升公司治理透明度和问责制，增强利益相关者的信心。\n   9. 风险管理举措 (2018年11月)\n       - 描述：公司更新了风险管理框架，包括识别新风险和实施缓解策略。\n       - 影响：风险管理举措提高了公司应对内外部风险的能力，保障了公司持续运营和稳定发展。\n   10. 子公司IPO (2018年12月)\n       - 描述：公司旗下的一家子公司成功上市，并获得了良好的市场反响和投资者关注。\n       - 影响：子公司IPO为公司带来了资本市场的认可，增加了投资者信心，为公司整体业务带来了机遇。\n\n二、 涉及的指标\n   1. 信息披露\n       - 描述：公司遵守信息披露的原则、方式，并有效执行。\n       - 值：信息披露符合证券法、公司法以及监管机构的要求，包括及时披露财报、年度报告等重要信息。\n   2. 关联交易\n       - 描述：公司建立了关联交易的流程及其公正性和合规性保证措施。\n       - 值：公司关联交易均遵循公开、公正、合规的原则，确保利益平衡和资金安全。\n   3. 内部控制\n       - 描述：公司建立了完善的内部控制架构，有效实施，并进行了效果评估。\n       - 值：公司内部控制有效运行，风险评估及时、准确，并进行了定期的自查和外部审计。\n\n额外信息：\n1. 治理改进计划\n    - 加强董事会和监事会功能\n        - 描述：通过培训、增加独立董事比例和优化决策过程，提高董事会和监事会在公司治理中的效率和效果。\n    - 提升透明度和信息披露质量\n        - 描述：改进信息披露流程和标准，确保及时、准确、全面地向所有利益相关者报告公司的情况。\n\n2. 风险管理策略\n    - 内部控制系统强化\n        - 描述：进一步建立和完善内部控制系统，加强财务和运营风险的识别、评估、监控和报告，提高抵御风险的能力。\n    - 可持续发展和社会责任整合\n        - 描述：将可持续发展和社会责任纳入战略考量，识别相关风险和机会，促进长期价值创造。",
    "生成总结": "政府部门有限公司是一家成立于1995年6月的中国北京市注册的公司，主要经营政府承接的各类项目的管理和运营。该公司未上市，属于政府行业。",
    "生成文章": "2018年度，政府部门有限公司在公司治理方面发生了一系列重要事件，对公司的治理结构和股东权益产生了影响。首先，在股东大会上，董事会讨论了公司章程的变更事项。这一变更将直接影响公司的治理结构和股东权益。随后，股东提出了关于重大公司行动的提案，并在股东大会上进行了投票表决。这些投票结果将直接决定公司章程的变更是否获得通过，以及公司是否执行该重大公司行动。\n\n在2018年3月，政府部门有限公司进行了董事会变更，新成员的加入和原成员的离职。这一变更可能导致公司战略调整，对公司长期发展方向和股东利益产生影响。随后，在2018年4月，公司根据新规定或合规标准的变化，对治理实践进行了更新。这些合规与监管更新确保公司遵守最新法律法规，降低法律风险，保护公司和股东权益。\n\n然而，在2018年5月，政府部门有限公司发生了重大的道德或诚信违规事件，并采取了相应的应对措施。这一事件可能损害公司声誉和品牌价值，对公司与投资者、客户和合作伙伴的关系产生影响。为了应对这一事件，公司采取了相应的措施，以恢复公众对公司的信任。\n\n在2018年7月，公司高级管理层发生了变动，对公司运营重点和优先事项产生了影响。这一变动可能导致公司运营重点和战略优先事项的调整，对短期业绩和长期发展产生影响。然而，在2018年8月，政府部门有限公司在可持续性、环境保护、社会责任和企业公民方面取得了重大进展。这些可持续性与社会责任倡议提升了公司公众形象和市场竞争力，促进了长期可持续发展。\n\n在2018年9月，政府部门有限公司成功收购了一家子公司，增强了公司的市场份额和竞争力。这一收购进一步增强了公司市场份额和竞争力，为公司未来的业务扩张奠定了基础。随后，在2018年10月，公司对治理框架进行了修订，增强了透明度、问责制和利益相关者参与程度。这一治理政策修订将提升公司治理透明度和问责制，增强利益相关者的信心。\n\n在2018年11月，政府部门有限公司更新了风险管理框架，包括识别新风险和实施缓解策略。这些风险管理举措提高了公司应对内外部风险的能力，保障了公司持续运营和稳定发展。最后，在2018年12月，公司旗下的一家子公司成功上市，并获得了良好的市场反响和投资者关注。这一子公司IPO为公司带来了资本市场的认可，增加了投资者信心，为公司整体业务扩张带来了机遇。\n\n在涉及的指标方面，政府部门有限公司注重信息披露，确保信息披露符合证券法、公司法以及监管机构的要求。公司建立了关联交易的流程，并确保其公正性和合规性。此外，公司建立了完善的内部控制架构，并进行了效果评估。这些指标的改善和落实，有助于公司提高治理效率和风险控制能力。\n\n为了进一步改进公司治理，政府部门有限公司制定了治理改进计划。该计划包括加强董事会和监事会功能，提升透明度和信息披露质量。这些措施将提高公司治理效率和透明度，增强利益相关者的信心。\n\n为了应对风险，政府部门有限公司制定了风险管理策略。公司将进一步强化内部控制系统，加强财务和运营风险的识别、评估、监控和报告。同时，公司将将可持续发展和社会责任纳入战略考量，识别相关风险和机会，促进长期价值创造。\n\n综上所述，政府部门有限公司在2018年度在公司治理方面取得了一系列重要进展。公司通过治理改进计划和风险管理策略，不断提升治理效率和风险控制能力。这些举措有助于公司保护股东权益，提高公司的市场竞争力，实现长期可持续发展。"
}