{
    "报告类型": "公司财务报告",
    "报告时间": "2018年度",
    "公司信息": {
        "名称": "政府部门有限公司",
        "成立日期": "1995年6月",
        "主营业务": "政府承接的各类项目的管理和运营",
        "注册地": "中国北京市",
        "上市情况": "未上市",
        "行业": "政府"
    },
    "报告内容": [
        {
            "类型": "财务信息",
            "重要事件": [
                {
                    "事件": "重大资产收购",
                    "时间": "2018年2月",
                    "描述": "政府部门有限公司完成了对阳光电力公司的资产收购，总价值2000万元。",
                    "影响": "扩大公司业务范围，增强市场竞争力。",
                    "子事件": [
                        {
                            "事件": "确定资产收购计划",
                            "时间": "2017年11月",
                            "描述": "政府部门有限公司确定了对阳光电力公司进行资产收购的计划，以扩大公司业务范围。",
                            "影响": "推动公司向新的市场领域发展，增加市场份额。"
                        },
                        {
                            "事件": "资产评估和谈判",
                            "时间": "2017年12月至2018年1月",
                            "描述": "政府部门有限公司对阳光电力公司进行了详细的资产评估，并进行了收购谈判和协议讨论。",
                            "影响": "确定了收购的具体条件和价格，并取得了阳光电力公司的同意。"
                        },
                        {
                            "事件": "资金筹措",
                            "时间": "2018年1月",
                            "描述": "政府部门有限公司组织了相关部门，筹措了2000万元用于资产收购的资金。",
                            "影响": "确保了完成资产收购所需的资金来源，为收购做好准备。"
                        },
                        {
                            "事件": "完成资产交割",
                            "时间": "2018年2月",
                            "描述": "政府部门有限公司正式完成了对阳光电力公司的资产收购，包括过户手续和付款。",
                            "影响": "公司获得了阳光电力公司的所有权和相关资产，扩大了公司的业务范围和市场份额。"
                        }
                    ]
                },
                {
                    "事件": "负面事件",
                    "时间": "2018年3月",
                    "描述": "政府部门有限公司面临多起合同纠纷，争议金额达1000万元，将对公司的财务状况和声誉带来负面影响。",
                    "影响": "可能导致公司遭受经济损失，并面临法律纠纷。"
                },
                {
                    "事件": "重大股权收购",
                    "时间": "2018年3月",
                    "描述": "政府部门有限公司完成了对能源公司的股权收购，获得了60%的股权。",
                    "影响": "进一步扩大了公司的市场份额，提升了公司的控制力。"
                },
                {
                    "事件": "重大投资",
                    "时间": "2018年5月",
                    "描述": "政府部门有限公司投资了高速铁路项目，投资金额为5亿元。",
                    "影响": "进一步拓宽了公司的业务领域，提升了公司的盈利能力。"
                },
                {
                    "事件": "债务重组",
                    "时间": "2018年8月",
                    "描述": "政府部门有限公司进行了债务重组，减少了1亿元负债。",
                    "影响": "改善了公司的财务状况，降低了财务成本。"
                },
                {
                    "事件": "大规模融资",
                    "时间": "2018年10月",
                    "描述": "政府部门有限公司进行了一次大规模的融资活动，募集了10亿元资金。",
                    "影响": "加强了公司的资金实力，支持了公司的扩张和发展。"
                },
                {
                    "事件": "分发股利",
                    "时间": "2018年11月",
                    "描述": "政府部门有限公司决定向股东分发2亿元股利。",
                    "影响": "回报给股东们的投资，提升了股东的收益。"
                },
                {
                    "事件": "资产重组",
                    "时间": "2018年12月",
                    "描述": "政府部门有限公司进行了一次资产重组，优化了公司的业务结构。",
                    "影响": "提高了公司的运营效率，增加了公司的价值。"
                }
            ],
            "涉及的指标": [
                {
                    "指标": "营业收入",
                    "描述": "公司在一定会计期间内的主营业务收入和其他业务收入总额。",
                    "影响因素": [
                        "市场需求",
                        "政府项目经营"
                    ],
                    "值": "10000万元"
                },
                {
                    "指标": "净利润",
                    "描述": "公司在一定会计期间的净收入，即总收入减去总成本和所得税费用后的金额。",
                    "影响因素": [
                        "营业收入",
                        "合同纠纷处理"
                    ],
                    "值": "500万元"
                },
                {
                    "指标": "总资产",
                    "描述": "会计期末，公司所拥有的资产总额。",
                    "影响因素": [
                        "资产收购",
                        "资产处置"
                    ],
                    "值": "80000万元"
                },
                {
                    "指标": "总负债",
                    "描述": "会计期末，公司所承担并需要偿还的债务总额。",
                    "影响因素": [
                        "新债发行",
                        "债务偿还",
                        "债务重组"
                    ],
                    "值": "60000万元"
                },
                {
                    "指标": "股东权益",
                    "描述": "会计期末，归属于股东的权益总额。",
                    "影响因素": [
                        "净利润",
                        "股利发放"
                    ],
                    "值": "20000万元"
                },
                {
                    "指标": "现金流量",
                    "描述": "公司在一定会计期间内的现金流入和流出总和。",
                    "影响因素": [
                        "政府拨款",
                        "投资回报"
                    ],
                    "值": "20000万元"
                },
                {
                    "指标": "负债比率",
                    "描述": "公司总负债与总资产的比率，反映公司的债务水平。",
                    "影响因素": [
                        "总负债的变化",
                        "总资产的变化"
                    ],
                    "值": "75%"
                },
                {
                    "指标": "资产负债率",
                    "描述": "公司总负债占总资产的百分比，衡量公司财务杠杆的一个指标。",
                    "影响因素": [
                        "资产和负债的增减变化"
                    ],
                    "值": "75%"
                },
                {
                    "指标": "净资产收益率",
                    "描述": "反映公司股东权益的经营效益，即净利润与平均股东权益的比率。",
                    "影响因素": [
                        "净利润的变化",
                        "股东权益的变化"
                    ],
                    "值": "5%"
                }
            ]
        }
    ],
    "额外信息": [
        {
            "名称": "未来展望",
            "内容": [
                {
                    "名称": "财务策略",
                    "描述": "政府部门有限公司未来计划实施的财务策略，包括加强成本控制、优化资本运营等，以提高财务效益和盈利能力。"
                },
                {
                    "名称": "投资计划",
                    "描述": "政府部门有限公司面向未来的投资计划包括加大对基础设施建设的投资，以及发展新兴产业的投入，以推动公司业务的可持续增长。"
                },
                {
                    "名称": "风险管理",
                    "描述": "政府部门有限公司识别了市场风险、政策风险、经营风险等主要财务风险，并制定了相应的风险管理策略，以保障公司财务安全和稳定发展。"
                }
            ]
        }
    ],
    "生成大纲": "报告大纲：\n\n报告类型：公司财务报告\n报告时间：2018年度\n\n一、财务信息\n1. 重要事件\n   a. 重大资产收购\n      - 时间：2018年2月\n      - 描述：政府部门有限公司完成了对阳光电力公司的资产收购，总价值2000万元。\n      - 影响：扩大公司业务范围，增强市场竞争力。\n      - 子事件：\n        - 确定资产收购计划\n          - 时间：2017年11月\n          - 描述：政府部门有限公司确定了对阳光电力公司进行资产收购的计划，以扩大公司业务范围。\n          - 影响：推动公司向新的市场领域发展，增加市场份额。\n        - 资产评估和谈判\n          - 时间：2017年12月至2018年1月\n          - 描述：政府部门有限公司对阳光电力公司进行了详细的资产评估，并进行了收购谈判和协议讨论。\n          - 影响：确定了收购的具体条件和价格，并取得了阳光电力公司的同意。\n        - 资金筹措\n          - 时间：2018年1月\n          - 描述：政府部门有限公司组织了相关部门，筹措了2000万元用于资产收购的资金。\n          - 影响：确保了完成资产收购所需的资金来源，为收购做好准备。\n        - 完成资产交割\n          - 时间：2018年2月\n          - 描述：政府部门有限公司正式完成了对阳光电力公司的资产收购，包括过户手续和付款。\n          - 影响：公司获得了阳光电力公司的所有权和相关资产，扩大了公司的业务范围和市场份额。\n   b. 负面事件\n      - 时间：2018年3月\n      - 描述：政府部门有限公司面临多起合同纠纷，争议金额达1000万元，将对公司的财务状况和声誉带来负面影响。\n      - 影响：可能导致公司遭受经济损失，并面临法律纠纷。\n   c. 重大股权收购\n      - 时间：2018年3月\n      - 描述：政府部门有限公司完成了对能源公司的股权收购，获得了60%的股权。\n      - 影响：进一步扩大了公司的市场份额，提升了公司的控制力。\n   d. 重大投资\n      - 时间：2018年5月\n      - 描述：政府部门有限公司投资了高速铁路项目，投资金额为5亿元。\n      - 影响：进一步拓宽了公司的业务领域，提升了公司的盈利能力。\n   e. 债务重组\n      - 时间：2018年8月\n      - 描述：政府部门有限公司进行了债务重组，减少了1亿元负债。\n      - 影响：改善了公司的财务状况，降低了财务成本。\n   f. 大规模融资\n      - 时间：2018年10月\n      - 描述：政府部门有限公司进行了一次大规模的融资活动，募集了10亿元资金。\n      - 影响：加强了公司的资金实力，支持了公司的扩张和发展。\n   g. 分发股利\n      - 时间：2018年11月\n      - 描述：政府部门有限公司决定向股东分发2亿元股利。\n      - 影响：回报给股东们的投资，提升了股东的收益。\n   h. 资产重组\n      - 时间：2018年12月\n      - 描述：政府部门有限公司进行了一次资产重组，优化了公司的业务结构。\n      - 影响：提高了公司的运营效率，增加了公司的价值。\n\n2. 涉及的指标\n   a. 营业收入\n      - 描述：公司在一定会计期间内的主营业务收入和其他业务收入总额。\n      - 影响因素：市场需求、政府项目经营\n      - 值：10000万元\n   b. 净利润\n      - 描述：公司在一定会计期间的净收入，即总收入减去总成本和所得税费用后的金额。\n      - 影响因素：营业收入、合同纠纷处理\n      - 值：500万元\n   c. 总资产\n      - 描述：会计期末，公司所拥有的资产总额。\n      - 影响因素：资产收购、资产处置\n      - 值：80000万元\n   d. 总负债\n      - 描述：会计期末，公司所承担并需要偿还的债务总额。\n      - 影响因素：新债发行、债务偿还、债务重组\n      - 值：60000万元\n   e. 股东权益\n      - 描述：会计期末，归属于股东的权益总额。\n      - 影响因素：净利润、股利发放\n      - 值：20000万元\n   f. 现金流量\n      - 描述：公司在一定会计期间内的现金流入和流出总和。\n      - 影响因素：政府拨款、投资回报\n      - 值：20000万元\n   g. 负债比率\n      - 描述：公司总负债与总资产的比率，反映公司的债务水平。\n      - 影响因素：总负债的变化、总资产的变化\n      - 值：75%\n   h. 资产负债率\n      - 描述：公司总负债占总资产的百分比，衡量公司财务杠杆的一个指标。\n      - 影响因素：资产和负债的增减变化\n      - 值：75%\n   i. 净资产收益率\n      - 描述：反映公司股东权益的经营效益，即净利润与平均股东权益的比率。\n      - 影响因素：净利润的变化、股东权益的变化\n      - 值：5%\n\n二、额外信息\n1. 未来展望\n   a. 财务策略\n      - 描述：政府部门有限公司未来计划实施的财务策略，包括加强成本控制、优化资本运营等，以提高财务效益和盈利能力。\n   b. 投资计划\n      - 描述：政府部门有限公司面向未来的投资计划包括加大对基础设施建设的投资，以及发展新兴产业的投入，以推动公司业务的可持续增长。\n   c. 风险管理\n      - 描述：政府部门有限公司识别了市场风险、政策风险、经营风险等主要财务风险，并制定了相应的风险管理策略，以保障公司财务安全和稳定发展。",
    "生成总结": "政府部门有限公司是一家成立于1995年6月的政府承接各类项目的管理和运营公司，注册地在中国北京市，尚未上市。",
    "生成文章": "在2018年度的财务报告中，政府部门有限公司展示了其在过去一年中的重要事件和财务信息。首先，公司进行了一项重大资产收购，于2018年2月完成。这次资产收购涉及到阳光电力公司，总价值达到2000万元。这一收购事件的影响是扩大了公司的业务范围，增强了公司在市场上的竞争力。\n\n在资产收购事件中，有几个子事件值得关注。首先，在2017年11月，政府部门有限公司确定了对阳光电力公司进行资产收购的计划，以扩大公司的业务范围。这一决策推动了公司向新的市场领域发展，增加了市场份额。接下来，在2017年12月至2018年1月期间，公司对阳光电力公司进行了详细的资产评估，并进行了收购谈判和协议讨论。通过这一过程，公司确定了收购的具体条件和价格，并取得了阳光电力公司的同意。为了筹措资金用于资产收购，公司在2018年1月组织了相关部门，成功筹措了2000万元。最终，在2018年2月，政府部门有限公司正式完成了对阳光电力公司的资产收购，包括过户手续和付款。这一收购使得公司获得了阳光电力公司的所有权和相关资产，进一步扩大了公司的业务范围和市场份额。\n\n然而，公司也面临了一些负面事件。在2018年3月，政府部门有限公司面临多起合同纠纷，争议金额达到1000万元，这将对公司的财务状况和声誉带来负面影响。这些合同纠纷可能导致公司遭受经济损失，并面临法律纠纷。\n\n除了资产收购和合同纠纷，政府部门有限公司还进行了其他重要的财务活动。在2018年3月，公司完成了对能源公司的股权收购，获得了60%的股权。这一股权收购进一步扩大了公司的市场份额，提升了公司的控制力。在2018年5月，公司投资了高速铁路项目，投资金额为5亿元。这一投资进一步拓宽了公司的业务领域，提升了公司的盈利能力。在2018年8月，政府部门有限公司进行了债务重组，减少了1亿元的负债。这一债务重组改善了公司的财务状况，降低了财务成本。在2018年10月，公司进行了一次大规模的融资活动，募集了10亿元资金。这一融资活动加强了公司的资金实力，支持了公司的扩张和发展。在2018年11月，政府部门有限公司决定向股东分发2亿元股利，回报给股东们的投资，提升了股东的收益。最后，在2018年12月，公司进行了一次资产重组，优化了公司的业务结构。这一资产重组提高了公司的运营效率，增加了公司的价值。\n\n以上重要事件对公司的财务指标产生了影响。营业收入在2018年度达到了10000万元，这主要受到市场需求和政府项目经营的影响。净利润为500万元，这受到营业收入和合同纠纷处理的影响。总资产达到了80000万元，这主要受到资产收购和资产处置的影响。总负债为60000万元，这受到新债发行、债务偿还和债务重组的影响。股东权益为20000万元，这受到净利润和股利发放的影响。现金流量为20000万元，这受到政府拨款和投资回报的影响。负债比率为75%，反映了公司的债务水平，这受到总负债的变化和总资产的变化的影响。资产负债率也为75%，衡量了公司的财务杠杆，这受到资产和负债的增减变化的影响。净资产收益率为5%，反映了公司股东权益的经营效益，这受到净利润的变化和股东权益的变化的影响。\n\n展望未来，政府部门有限公司计划实施一系列财务策略，包括加强成本控制、优化资本运营等，以提高财务效益和盈利能力。公司还计划加大对基础设施建设的投资，并发展新兴产业，以推动公司业务的可持续增长。同时，公司也识别了市场风险、政策风险、经营风险等主要财务风险，并制定了相应的风险管理策略，以保障公司财务安全和稳定发展。\n\n综上所述，政府部门有限公司在2018年度取得了一系列重要的财务成果和事件。通过资产收购、股权收购、投资和债务重组等活动，公司扩大了业务范围，提升了市场竞争力，并取得了一定的财务成果。然而，公司也面临了合同纠纷等负面事件的挑战。在未来，公司将继续实施财务策略，加大投资力度，并进行风险管理，以推动公司的可持续增长和稳定发展。"
}