{
    "报告类型": "公司财务报告",
    "报告时间": "2017年度",
    "公司信息": {
        "名称": "绿源环保有限公司",
        "成立日期": "2005年6月",
        "主营业务": "绿色能源的研发、生产和销售",
        "注册地": "北京市",
        "上市情况": "未上市",
        "行业": "环保"
    },
    "报告内容": [
        {
            "类型": "财务信息",
            "重要事件": [
                {
                    "事件": "资产重组",
                    "时间": "2017年2月",
                    "描述": "公司进行了一次资产重组，将旧工厂进行了升级改造，并新建了绿色能源科技园。",
                    "影响": "提高了公司的生产效率和产品质量，增加了公司的价值。",
                    "子事件": [
                        {
                            "事件": "完成资产重组计划",
                            "时间": "2017年2月",
                            "描述": "公司决策团队完成了资产重组计划的制定，并得到股东的确认和支持。",
                            "影响": "为后续的升级改造和新建绿色能源科技园提供了决策依据，并增强了公司的经营能力和竞争力。"
                        },
                        {
                            "事件": "确定旧工厂升级改造方案",
                            "时间": "2017年3月",
                            "描述": "工程团队制定了旧工厂升级改造的具体方案，包括设备更新、生产线调整和工艺改进等措施。",
                            "影响": "为资产重组的顺利进行提供了有力支撑，提高了生产效率和产品质量。"
                        },
                        {
                            "事件": "启动新建绿色能源科技园项目",
                            "时间": "2017年4月",
                            "描述": "公司董事会正式启动了新建绿色能源科技园项目，并成立了专门的项目组进行规划和设计。",
                            "影响": "为公司未来发展打下了坚实基础，提升了公司的市场竞争力。"
                        },
                        {
                            "事件": "与相关部门协商土地手续",
                            "时间": "2017年5月",
                            "描述": "公司与地方政府相关部门开始协商土地使用权和手续的问题，以确保新建绿色能源科技园项目的顺利进行。",
                            "影响": "为公司获取土地使用权和建设绿色能源科技园提供了必要的准备工作，增加了公司的资产价值。"
                        },
                        {
                            "事件": "完成工程建设招标",
                            "时间": "2017年7月",
                            "描述": "公司完成了对新建绿色能源科技园工程建设的招标工作，并与中标方签订了合同。",
                            "影响": "为项目的实施和工程建设提供了有力支持，确保了新建绿色能源科技园项目的顺利进行。"
                        },
                        {
                            "事件": "开始新建绿色能源科技园施工",
                            "时间": "2017年8月",
                            "描述": "新建绿色能源科技园项目正式开始施工，各项工程按计划有序进行。",
                            "影响": "为提高公司的产能和产品质量，增加了公司的市场份额和收入，提升了公司的市场形象。"
                        }
                    ]
                },
                {
                    "事件": "大规模融资",
                    "时间": "2017年3月",
                    "描述": "公司进行了一次大规模的融资活动，成功募集了5亿元资金。",
                    "影响": "加强了公司的资金实力，支持了公司的扩张和发展。"
                },
                {
                    "事件": "重大投资",
                    "时间": "2017年5月",
                    "描述": "公司投资了D项目，投资金额为2亿元。",
                    "影响": "进一步拓宽了公司的业务领域，提高了公司的盈利能力。"
                },
                {
                    "事件": "债务重组",
                    "时间": "2017年6月",
                    "描述": "为优化公司的资本结构，公司进行了债务重组，减少了1亿元负债。",
                    "影响": "改善了公司的财务状况，降低了财务成本。"
                },
                {
                    "事件": "分发股利",
                    "时间": "2017年7月",
                    "描述": "公司决定向股东分发1亿元股利。",
                    "影响": "回报给股东们的投资，提升了股东的收益。"
                },
                {
                    "事件": "重大股权收购",
                    "时间": "2017年8月",
                    "描述": "公司完成了对绿能科技股份有限公司的股权收购，获得了45%的股权。",
                    "影响": "进一步扩大了公司的市场份额，提升了公司的控制力。"
                },
                {
                    "事件": "重大资产收购",
                    "时间": "2017年10月",
                    "描述": "公司完成了对清新环保公司的资产收购，总价值3.5亿元。",
                    "影响": "扩大公司业务范围，增强市场竞争力。"
                },
                {
                    "事件": "股权融资",
                    "时间": "2017年12月",
                    "描述": "公司进行了一次股权融资，成功募集了2亿元资金。",
                    "影响": "增加了公司的资金实力，提供了扩张和创新的资金支持。"
                }
            ],
            "涉及的指标": [
                {
                    "指标": "营业收入",
                    "描述": "公司在一定会计期间内的主营业务收入和其他业务收入总额。",
                    "影响因素": [
                        "市场需求",
                        "产品价格变化"
                    ],
                    "值": "10亿元"
                },
                {
                    "指标": "净利润",
                    "描述": "公司在一定会计期间的净收入，即总收入减去总成本和所得税费用后的金额。",
                    "影响因素": [
                        "营业收入",
                        "成本控制",
                        "非经常性损益"
                    ],
                    "值": "2亿元"
                },
                {
                    "指标": "总资产",
                    "描述": "会计期末，公司所拥有的资产总额。",
                    "影响因素": [
                        "资产收购",
                        "资产处置",
                        "资产重估"
                    ],
                    "值": "20亿元"
                },
                {
                    "指标": "总负债",
                    "描述": "会计期末，公司所承担并需要偿还的债务总额。",
                    "影响因素": [
                        "新债发行",
                        "债务偿还",
                        "债务重组"
                    ],
                    "值": "10亿元"
                },
                {
                    "指标": "股东权益",
                    "描述": "会计期末，归属于股东的权益总额。",
                    "影响因素": [
                        "净利润",
                        "股利发放",
                        "资本公积"
                    ],
                    "值": "10亿元"
                },
                {
                    "指标": "现金流量",
                    "描述": "公司在一定会计期间内的现金流入和流出总和。",
                    "影响因素": [
                        "经营活动",
                        "投资活动",
                        "筹资活动"
                    ],
                    "值": "4亿元"
                },
                {
                    "指标": "负债比率",
                    "描述": "公司总负债与总资产的比率，反映公司的债务水平。",
                    "影响因素": [
                        "总负债的变化",
                        "总资产的变化"
                    ],
                    "值": "50%"
                },
                {
                    "指标": "资产负债率",
                    "描述": "公司总负债占总资产的百分比，衡量公司财务杠杆的一个指标。",
                    "影响因素": [
                        "资产和负债的增减变化"
                    ],
                    "值": "50%"
                },
                {
                    "指标": "净资产收益率",
                    "描述": "反映公司股东权益的经营效益，即净利润与平均股东权益的比率。",
                    "影响因素": [
                        "净利润的变化",
                        "股东权益的变化"
                    ],
                    "值": "20%"
                }
            ]
        }
    ],
    "额外信息": [
        {
            "名称": "未来展望",
            "内容": [
                {
                    "名称": "财务策略",
                    "描述": "公司未来计划实施的财务策略，包括进一步提高生产效率、降低成本和提升产品竞争力等。"
                },
                {
                    "名称": "投资计划",
                    "描述": "公司面向未来的投资计划包括新能源研发、绿色项目建设和市场拓展等，预计投资金额为10亿元。"
                },
                {
                    "名称": "风险管理",
                    "描述": "公司识别的主要财务风险包括市场需求下降、原材料价格波动和政策环境不稳定等，公司将通过风险防范和灵活的资金管理来应对这些风险。"
                }
            ]
        }
    ],
    "生成大纲": "公司财务报告大纲\n\n一、财务信息\n   1. 资产重组\n      a. 完成资产重组计划\n         - 时间：2017年2月\n         - 描述：完成了资产重组计划的制定，并得到股东的确认和支持。\n         - 影响：为后续的升级改造和新建绿色能源科技园提供了决策依据，并增强了公司的经营能力和竞争力。\n      b. 确定旧工厂升级改造方案\n         - 时间：2017年3月\n         - 描述：制定了旧工厂升级改造的具体方案，包括设备更新、生产线调整和工艺改进等措施。\n         - 影响：为资产重组的顺利进行提供了有力支撑，提高了生产效率和产品质量。\n      c. 启动新建绿色能源科技园项目\n         - 时间：2017年4月\n         - 描述：正式启动了新建绿色能源科技园项目，并成立了专门的项目组进行规划和设计。\n         - 影响：为公司未来发展打下了坚实基础，提升了公司的市场竞争力。\n      d. 与相关部门协商土地手续\n         - 时间：2017年5月\n         - 描述：开始协商土地使用权和手续的问题，以确保新建绿色能源科技园项目的顺利进行。\n         - 影响：为公司获取土地使用权和建设绿色能源科技园提供了必要的准备工作，增加了公司的资产价值。\n      e. 完成工程建设招标\n         - 时间：2017年7月\n         - 描述：完成了对新建绿色能源科技园工程建设的招标工作，并与中标方签订了合同。\n         - 影响：为项目的实施和工程建设提供了有力支持，确保了新建绿色能源科技园项目的顺利进行。\n      f. 开始新建绿色能源科技园施工\n         - 时间：2017年8月\n         - 描述：正式开始施工，各项工程按计划有序进行。\n         - 影响：提高了公司的产能和产品质量，增加了公司的市场份额和收入，提升了公司的市场形象。\n\n   2. 大规模融资\n      - 时间：2017年3月\n      - 描述：成功募集了5亿元资金。\n      - 影响：加强了公司的资金实力，支持了公司的扩张和发展。\n\n   3. 重大投资\n      - 时间：2017年5月\n      - 描述：公司投资了D项目，投资金额为2亿元。\n      - 影响：进一步拓宽了公司的业务领域，提高了公司的盈利能力。\n\n   4. 债务重组\n      - 时间：2017年6月\n      - 描述：为优化公司的资本结构，公司进行了债务重组，减少了1亿元负债。\n      - 影响：改善了公司的财务状况，降低了财务成本。\n\n   5. 分发股利\n      - 时间：2017年7月\n      - 描述：公司决定向股东分发1亿元股利。\n      - 影响：回报给股东们的投资，提升了股东的收益。\n\n   6. 重大股权收购\n      - 时间：2017年8月\n      - 描述：公司完成了对绿能科技股份有限公司的股权收购，获得了45%的股权。\n      - 影响：进一步扩大了公司的市场份额，提升了公司的控制力。\n\n   7. 重大资产收购\n      - 时间：2017年10月\n      - 描述：公司完成了对清新环保公司的资产收购，总价值3.5亿元。\n      - 影响：扩大公司业务范围，增强市场竞争力。\n\n   8. 股权融资\n      - 时间：2017年12月\n      - 描述：公司进行了一次股权融资，成功募集了2亿元资金。\n      - 影响：增加了公司的资金实力，提供了扩张和创新的资金支持。\n\n二、涉及的指标\n   1. 营业收入\n      - 描述：10亿元\n      - 影响因素：市场需求、产品价格变化\n   \n   2. 净利润\n      - 描述：2亿元\n      - 影响因素：营业收入、成本控制、非经常性损益\n  \n   3. 总资产\n      - 描述：20亿元\n      - 影响因素：资产收购、资产处置、资产重估\n\n   4. 总负债\n      - 描述：10亿元\n      - 影响因素：新债发行、债务偿还、债务重组\n\n   5. 股东权益\n      - 描述：10亿元\n      - 影响因素：净利润、股利发放、资本公积\n\n   6. 现金流量\n      - 描述：4亿元\n      - 影响因素：经营活动、投资活动、筹资活动\n\n   7. 负债比率\n      - 描述：50%\n      - 影响因素：总负债的变化、总资产的变化\n\n   8. 资产负债率\n      - 描述：50%\n      - 影响因素：资产和负债的增减变化\n\n   9. 净资产收益率\n      - 描述：20%\n      - 影响因素：净利润的变化、股东权益的变化\n\n额外信息：\n   - 未来展望\n      - 财务策略：进一步提高生产效率、降低成本和提升产品竞争力等。\n      - 投资计划：新能源研发、绿色项目建设和市场拓展等，预计投资金额为10亿元。\n      - 风险管理：主要财务风险包括市场需求下降、原材料价格波动和政策环境不稳定等，公司将通过风险防范和灵活的资金管理来应对这些风险。",
    "生成总结": "绿源环保有限公司是一家成立于2005年6月的环保企业，主要从事绿色能源的研发、生产和销售业务，注册地位于北京市，目前尚未上市。",
    "生成文章": "2017年是绿源环保有限公司发展的关键一年。在财务信息方面，公司完成了一系列重要的资产重组和投资活动，为公司的未来发展奠定了坚实基础。\n\n首先，公司在2017年2月完成了资产重组计划的制定，并得到股东的确认和支持。这一举措为后续的升级改造和新建绿色能源科技园提供了决策依据，并增强了公司的经营能力和竞争力。随后，在2017年3月，公司确定了旧工厂升级改造方案，包括设备更新、生产线调整和工艺改进等措施。这一举措进一步提高了生产效率和产品质量，为资产重组的顺利进行提供了有力支撑。\n\n在资金方面，公司于2017年3月成功募集了5亿元资金，大规模融资进一步加强了公司的资金实力，支持了公司的扩张和发展。此外，公司还进行了债务重组，于2017年6月减少了1亿元负债，改善了公司的财务状况，降低了财务成本。\n\n在投资方面，公司于2017年5月投资了D项目，投资金额为2亿元。这一举措进一步拓宽了公司的业务领域，提高了公司的盈利能力。此外，公司还完成了对绿能科技股份有限公司的股权收购，获得了45%的股权，并于2017年10月完成了对清新环保公司的资产收购，总价值3.5亿元。这些重大投资进一步扩大了公司的市场份额，增强了公司的控制力，提升了公司的市场竞争力。\n\n在财务指标方面，绿源环保有限公司在2017年取得了可观的业绩。营业收入达到了10亿元，这主要得益于市场需求的增加和产品价格的稳定。净利润达到了2亿元，这得益于营业收入的增加、成本的控制以及非经常性损益的减少。总资产达到了20亿元，这主要得益于资产收购、资产处置和资产重估。总负债为10亿元，这主要受到新债发行、债务偿还和债务重组的影响。股东权益为10亿元，这主要受到净利润的增加、股利发放和资本公积的影响。现金流量为4亿元，这主要受到经营活动、投资活动和筹资活动的影响。负债比率为50%，这主要受到总负债的变化和总资产的变化的影响。资产负债率为50%，这主要受到资产和负债的增减变化的影响。净资产收益率为20%，这主要受到净利润的变化和股东权益的变化的影响。\n\n未来展望方面，绿源环保有限公司将进一步提高生产效率、降低成本和提升产品竞争力等财务策略。同时，公司计划进行新能源研发、绿色项目建设和市场拓展等投资计划，预计投资金额为10亿元。在风险管理方面，公司将重点关注市场需求下降、原材料价格波动和政策环境不稳定等主要财务风险，并通过风险防范和灵活的资金管理来应对这些风险。\n\n综上所述，绿源环保有限公司在2017年取得了显著的发展成果。通过资产重组、大规模融资、重大投资和债务重组等一系列举措，公司进一步增强了经营能力和竞争力。财务指标方面，公司的营业收入、净利润、总资产、总负债、股东权益、现金流量、负债比率、资产负债率和净资产收益率等指标均取得了较好的表现。未来展望方面，公司将继续致力于提高生产效率、降低成本和提升产品竞争力，同时注重风险管理，以保持稳定的发展态势。"
}