{
    "Report Type": "Corporate Financial Report",
    "Report Time": "2018",
    "Company Information": {
        "Name": "MediaCorp",
        "Establishment Date": "January 1, 2000",
        "Main Business": "Media production and distribution",
        "Registration Location": "New York, United States",
        "Listing Status": "Publicly listed on NYSE",
        "Industry": "Media"
    },
    "Report Content": [
        {
            "Type": "Financial Information",
            "Significant Events": [
                {
                    "Event": "Major Asset Acquisition",
                    "Time": "April, 2018",
                    "Description": "MediaCorp completed the asset acquisition of Big Pictures, a renowned film production company, with a total value of $100 million.",
                    "Impact": "Expanded MediaCorp's business scope, enhanced market competitiveness.",
                    "Sub Events": [
                        {
                            "Event": "Appointment of New CEO",
                            "Time": "January, 2018",
                            "Description": "MediaCorp appointed a new CEO to lead the company in its strategic expansion plans and enhance its overall performance.",
                            "Impact": "New CEO's leadership and expertise prepared the company for major acquisitions and growth."
                        },
                        {
                            "Event": "Strategic Market Analysis",
                            "Time": "February, 2018",
                            "Description": "MediaCorp conducted an in-depth market analysis to identify potential investment opportunities and assess market trends.",
                            "Impact": "Identified Big Pictures as a strategic acquisition target with significant growth prospects."
                        },
                        {
                            "Event": "Due Diligence Process Initiated",
                            "Time": "March, 2018",
                            "Description": "MediaCorp commenced the due diligence process to evaluate the financial, legal, and operational aspects of the potential acquisition of Big Pictures.",
                            "Impact": "Ensured a thorough assessment of the target company's value and mitigated risks associated with the acquisition."
                        }
                    ]
                },
                {
                    "Event": "Major Investment",
                    "Time": "May, 2018",
                    "Description": "MediaCorp invested $50 million in Project Vision, a cutting-edge virtual reality technology startup.",
                    "Impact": "Further broadened MediaCorp's business areas, enhanced profitability."
                },
                {
                    "Event": "Significant Equity Acquisition",
                    "Time": "June, 2018",
                    "Description": "MediaCorp completed the acquisition of 30% equity of Digital Media Solutions.",
                    "Impact": "Further expanded MediaCorp's market share, enhanced the company's control."
                },
                {
                    "Event": "Debt Restructuring",
                    "Time": "July, 2018",
                    "Description": "To optimize the capital structure, MediaCorp underwent debt restructuring, reducing liabilities by $20 million.",
                    "Impact": "Improved MediaCorp's financial condition, reduced financial costs."
                },
                {
                    "Event": "Dividend Distribution",
                    "Time": "September, 2018",
                    "Description": "MediaCorp decided to distribute $10 million of dividends to shareholders.",
                    "Impact": "Returned to the investors, enhanced shareholder returns."
                },
                {
                    "Event": "Large-scale Financing",
                    "Time": "October, 2018",
                    "Description": "MediaCorp conducted a large-scale financing activity, raising $150 million of funds.",
                    "Impact": "Strengthened MediaCorp's financial strength, supported expansion and development."
                },
                {
                    "Event": "Asset Restructuring",
                    "Time": "December, 2018",
                    "Description": "MediaCorp underwent an asset restructuring, consolidating and optimizing its media production and distribution businesses.",
                    "Impact": "Improved operational efficiency, increased company value."
                }
            ],
            "Involved Indicators": [
                {
                    "Indicator": "Operating Income",
                    "Description": "The total amount of main business income and other business income within a certain accounting period.",
                    "Influencing Factors": [
                        "Market Demand",
                        "Changes in Product Prices"
                    ],
                    "Value": "$800 million"
                },
                {
                    "Indicator": "Net Profit",
                    "Description": "The net income of the company within a certain accounting period, i.e., total income minus total costs and taxes.",
                    "Influencing Factors": [
                        "Operating Income",
                        "Cost Control",
                        "Non-recurring Gains and Losses"
                    ],
                    "Value": "$150 million"
                },
                {
                    "Indicator": "Total Assets",
                    "Description": "The total amount of assets owned by the company at the end of the accounting period.",
                    "Influencing Factors": [
                        "Asset Acquisition",
                        "Asset Disposal",
                        "Asset Revaluation"
                    ],
                    "Value": "$2 billion"
                },
                {
                    "Indicator": "Total Liabilities",
                    "Description": "The total amount of debts the company is obligated to repay at the end of the accounting period.",
                    "Influencing Factors": [
                        "New Debt Issuance",
                        "Debt Repayment",
                        "Debt Restructuring"
                    ],
                    "Value": "$500 million"
                },
                {
                    "Indicator": "Shareholder Equity",
                    "Description": "The total amount of equity belonging to shareholders at the end of the accounting period.",
                    "Influencing Factors": [
                        "Net Profit",
                        "Dividend Distribution",
                        "Capital Reserves"
                    ],
                    "Value": "$1.5 billion"
                },
                {
                    "Indicator": "Cash Flow",
                    "Description": "The total cash inflows and outflows of the company within a certain accounting period.",
                    "Influencing Factors": [
                        "Operating Activities",
                        "Investment Activities",
                        "Financing Activities"
                    ],
                    "Value": "$300 million"
                },
                {
                    "Indicator": "Debt Ratio",
                    "Description": "The ratio of total liabilities to total assets, reflecting the company's debt level.",
                    "Influencing Factors": [
                        "Changes in Total Liabilities",
                        "Changes in Total Assets"
                    ],
                    "Value": "25%"
                },
                {
                    "Indicator": "Debt to Assets Ratio",
                    "Description": "The percentage of total liabilities to total assets, a measure of the company's financial leverage.",
                    "Influencing Factors": [
                        "Increases or decreases in assets and liabilities"
                    ],
                    "Value": "0.25"
                },
                {
                    "Indicator": "Return on Equity",
                    "Description": "Reflects the operational efficiency of shareholder equity, namely the ratio of net profit to average shareholder equity.",
                    "Influencing Factors": [
                        "Change in Net Profit",
                        "Change in Shareholder Equity"
                    ],
                    "Value": "10%"
                }
            ]
        }
    ],
    "Additional Information": [
        {
            "Name": "Future Outlook",
            "Content": [
                {
                    "Name": "Financial Strategy",
                    "Description": "MediaCorp plans to implement a cost control strategy to optimize operational efficiency and maintain profitability. Additionally, the company aims to explore new capital operations to support future growth."
                },
                {
                    "Name": "Investment Plans",
                    "Description": "MediaCorp intends to invest heavily in content production and distribution platforms to strengthen its position in the media industry. The company also plans to allocate resources for research and development initiatives."
                },
                {
                    "Name": "Risk Management",
                    "Description": "MediaCorp has identified potential financial risks such as changes in market demand and increasing competition. The company plans to implement risk diversification strategies, invest in talent acquisition, and enhance marketing efforts to mitigate these risks."
                }
            ]
        }
    ],
    "Generated Outline": "I. Introduction\nA. Report Type: Corporate Financial Report\nB. Report Time: 2018\nC. Company Information\n   1. Name: MediaCorp\n   2. Establishment Date: January 1, 2000\n   3. Main Business: Media production and distribution\n   4. Registration Location: New York, United States\n   5. Listing Status: Publicly listed on NYSE\n   6. Industry: Media\n\nII. Financial Information\nA. Major Asset Acquisition (April, 2018)\n   1. Description: MediaCorp completed the asset acquisition of Big Pictures, a renowned film production company, with a total value of $100 million.\n   2. Impact: Expanded MediaCorp's business scope, enhanced market competitiveness.\n   3. Sub Events\n      a. Appointment of New CEO (January, 2018)\n         - Description: MediaCorp appointed a new CEO to lead the company in its strategic expansion plans and enhance its overall performance.\n         - Impact: New CEO's leadership and expertise prepared the company for major acquisitions and growth.\n      b. Strategic Market Analysis (February, 2018)\n         - Description: MediaCorp conducted an in-depth market analysis to identify potential investment opportunities and assess market trends.\n         - Impact: Identified Big Pictures as a strategic acquisition target with significant growth prospects.\n      c. Due Diligence Process Initiated (March, 2018)\n         - Description: MediaCorp commenced the due diligence process to evaluate the financial, legal, and operational aspects of the potential acquisition of Big Pictures.\n         - Impact: Ensured a thorough assessment of the target company's value and mitigated risks associated with the acquisition.\nB. Major Investment (May, 2018)\n   1. Description: MediaCorp invested $50 million in Project Vision, a cutting-edge virtual reality technology startup.\n   2. Impact: Further broadened MediaCorp's business areas, enhanced profitability.\nC. Significant Equity Acquisition (June, 2018)\n   1. Description: MediaCorp completed the acquisition of 30% equity of Digital Media Solutions.\n   2. Impact: Further expanded MediaCorp's market share, enhanced the company's control.\nD. Debt Restructuring (July, 2018)\n   1. Description: To optimize the capital structure, MediaCorp underwent debt restructuring, reducing liabilities by $20 million.\n   2. Impact: Improved MediaCorp's financial condition, reduced financial costs.\nE. Dividend Distribution (September, 2018)\n   1. Description: MediaCorp decided to distribute $10 million of dividends to shareholders.\n   2. Impact: Returned to the investors, enhanced shareholder returns.\nF. Large-scale Financing (October, 2018)\n   1. Description: MediaCorp conducted a large-scale financing activity, raising $150 million of funds.\n   2. Impact: Strengthened MediaCorp's financial strength, supported expansion and development.\nG. Asset Restructuring (December, 2018)\n   1. Description: MediaCorp underwent an asset restructuring, consolidating and optimizing its media production and distribution businesses.\n   2. Impact: Improved operational efficiency, increased company value.\n\nIII. Involved Indicators\nA. Operating Income ($800 million)\n   1. Description: The total amount of main business income and other business income within a certain accounting period.\n   2. Influencing Factors: Market Demand, Changes in Product Prices\nB. Net Profit ($150 million)\n   1. Description: The net income of the company within a certain accounting period, i.e., total income minus total costs and taxes.\n   2. Influencing Factors: Operating Income, Cost Control, Non-recurring Gains and Losses\nC. Total Assets ($2 billion)\n   1. Description: The total amount of assets owned by the company at the end of the accounting period.\n   2. Influencing Factors: Asset Acquisition, Asset Disposal, Asset Revaluation\nD. Total Liabilities ($500 million)\n   1. Description: The total amount of debts the company is obligated to repay at the end of the accounting period.\n   2. Influencing Factors: New Debt Issuance, Debt Repayment, Debt Restructuring\nE. Shareholder Equity ($1.5 billion)\n   1. Description: The total amount of equity belonging to shareholders at the end of the accounting period.\n   2. Influencing Factors: Net Profit, Dividend Distribution, Capital Reserves\nF. Cash Flow ($300 million)\n   1. Description: The total cash inflows and outflows of the company within a certain accounting period.\n   2. Influencing Factors: Operating Activities, Investment Activities, Financing Activities\nG. Debt Ratio (25%)\n   1. Description: The ratio of total liabilities to total assets, reflecting the company's debt level.\n   2. Influencing Factors: Changes in Total Liabilities, Changes in Total Assets\nH. Debt to Assets Ratio (0.25)\n   1. Description: The percentage of total liabilities to total assets, a measure of the company's financial leverage.\n   2. Influencing Factors: Increases or decreases in assets and liabilities\nI. Return on Equity (10%)\n   1. Description: Reflects the operational efficiency of shareholder equity, namely the ratio of net profit to average shareholder equity.\n   2. Influencing Factors: Change in Net Profit, Change in Shareholder Equity\n\nIV. Additional Information\nA. Future Outlook\n   1. Financial Strategy\n      - Description: MediaCorp plans to implement a cost control strategy to optimize operational efficiency and maintain profitability. Additionally, the company aims to explore new capital operations to support future growth.\n   2. Investment Plans\n      - Description: MediaCorp intends to invest heavily in content production and distribution platforms to strengthen its position in the media industry. The company also plans to allocate resources for research and development initiatives.\n   3. Risk Management\n      - Description: MediaCorp has identified potential financial risks such as changes in market demand and increasing competition. The company plans to implement risk diversification strategies, invest in talent acquisition, and enhance marketing efforts to mitigate these risks.",
    "Generated Summary": "MediaCorp, established on January 1, 2000, is a publicly listed media company on the NYSE, headquartered in New York, United States, specializing in media production and distribution.",
    "Generated Article": "In 2018, MediaCorp made significant strides in expanding its business and enhancing its market competitiveness. One of the major highlights was the acquisition of Big Pictures, a renowned film production company, in April. This asset acquisition, valued at $100 million, allowed MediaCorp to broaden its business scope and tap into the lucrative film industry. The decision to acquire Big Pictures was preceded by a series of strategic events, including the appointment of a new CEO in January. The new CEO brought in fresh leadership and expertise, setting the stage for major acquisitions and growth. In February, MediaCorp conducted a strategic market analysis, which identified Big Pictures as a strategic acquisition target with significant growth prospects. This analysis paved the way for the due diligence process initiated in March, ensuring a thorough assessment of the target company's value and mitigating risks associated with the acquisition. \n\nThe impact of the Big Pictures acquisition was reflected in MediaCorp's financial indicators. The operating income for the year reached $800 million, indicating the success of the company's main business and other income streams. This increase in operating income can be attributed to the expansion of MediaCorp's business scope through the acquisition. Additionally, the net profit for the year stood at $150 million, showcasing the company's ability to effectively control costs and generate substantial returns. The acquisition of Big Pictures also had a positive impact on MediaCorp's total assets, which reached $2 billion by the end of the year. This increase in assets can be attributed to the inclusion of Big Pictures' assets in MediaCorp's portfolio. \n\nIn May, MediaCorp made a major investment of $50 million in Project Vision, a cutting-edge virtual reality technology startup. This investment further diversified MediaCorp's business areas and contributed to enhanced profitability. Additionally, in June, MediaCorp completed the acquisition of 30% equity of Digital Media Solutions, further expanding its market share and enhancing the company's control. \n\nTo optimize its capital structure, MediaCorp underwent debt restructuring in July, reducing its liabilities by $20 million. This move improved MediaCorp's financial condition and reduced financial costs. Furthermore, in September, MediaCorp decided to distribute $10 million of dividends to shareholders, enhancing shareholder returns and demonstrating the company's commitment to rewarding its investors. \n\nIn October, MediaCorp conducted a large-scale financing activity, raising $150 million of funds. This strengthened the company's financial strength and provided support for its expansion and development plans. Finally, in December, MediaCorp underwent an asset restructuring, consolidating and optimizing its media production and distribution businesses. This restructuring improved operational efficiency and increased the company's overall value. \n\nThroughout the year, MediaCorp's financial indicators demonstrated the company's solid performance. The debt ratio stood at 25%, indicating a healthy level of debt compared to total assets. The debt to assets ratio was 0.25, highlighting the company's prudent financial leverage. The return on equity was 10%, reflecting the operational efficiency of shareholder equity. \n\nLooking ahead, MediaCorp has outlined its future outlook and strategic plans. The company intends to implement a cost control strategy to optimize operational efficiency and maintain profitability. Additionally, MediaCorp plans to invest heavily in content production and distribution platforms to strengthen its position in the media industry. The company also aims to allocate resources for research and development initiatives. To mitigate potential financial risks, such as changes in market demand and increasing competition, MediaCorp plans to implement risk diversification strategies, invest in talent acquisition, and enhance marketing efforts. \n\nIn conclusion, MediaCorp's corporate financial report for 2018 highlights the company's successful asset acquisition, major investments, equity acquisition, debt restructuring, dividend distribution, large-scale financing, and asset restructuring. These events, along with the company's solid financial performance, position MediaCorp for continued growth and success in the media industry."
}