{
    "courtAndProcuratorate": {
        "court": "Cedarwood, Brighton, Court",
        "procuratorate": "Cedarwood, Brighton, Procuratorate"
    },
    "chiefJudge": "Y. Carter",
    "judge": "K. Watson",
    "clerk": "W. Hall",
    "defendant": {
        "name": "I. Hill",
        "gender": "female",
        "birthdate": "28th, June, 1969",
        "residence": "5, Tiverton street, Brighton",
        "ethnicity": "Caucasian",
        "occupation": "Retail assistant"
    },
    "defenseLawyer": {
        "name": "K. Nelson",
        "lawFirm": "Nelson & Associates Law Firm"
    },
    "caseProcess": [
        {
            "event": "Case Filing and Investigation",
            "date": "1st February 2022",
            "description": "The Cedarwood, Brighton, Procuratorate received a formal complaint from a local business owner regarding multiple thefts that had occurred over the past month. An investigation was promptly initiated."
        },
        {
            "event": "Detention Measures Taken",
            "date": "10th February 2022",
            "description": "Upon gathering credible evidence, the Cedarwood, Brighton, Police Department took preventive detention measures to ensure the defendant, I. Hill, did not flee the area or tamper with evidence."
        },
        {
            "event": "Criminal Detention",
            "date": "12th February 2022",
            "description": "I. Hill was formally detained by the police following the completion of the initial investigation, which provided substantial proof of her involvement in the theft crimes."
        },
        {
            "event": "Arrest",
            "date": "15th February 2022",
            "description": "An arrest warrant was issued, and I. Hill was officially arrested based on the findings of the ongoing investigation and concrete evidence of her criminal activities."
        }
    ],
    "criminalFacts": [
        {
            "crimeName": "Crime of Theft",
            "details": [
                {
                    "timePeriod": "15th January 2022",
                    "behavior": "I. Hill stole a gold necklace valued at approximately £2,000 from a high-end jewelry shop.",
                    "evidence": "Surveillance footage captured the act, and the stolen necklace was later found in the defendant's residence."
                },
                {
                    "timePeriod": "20th January 2022",
                    "behavior": "I. Hill took several electronic gadgets, including a brand new Apple iPhone and a Samsung tablet, from a local electronics store. The total value of the stolen goods was approximately £1,500.",
                    "evidence": "Store inventory checks and CCTV footage confirmed her involvement, and receipts for the exact models were found in her possession."
                },
                {
                    "timePeriod": "24th January 2022",
                    "behavior": "I. Hill shoplifted various high-value cosmetics and skincare products summing up to £800 from a prominent beauty shop.",
                    "evidence": "The theft was reported by store employees who recognized her from previous incidents, and the stolen items were located in her personal belongings."
                },
                {
                    "timePeriod": "29th January 2022",
                    "behavior": "I. Hill executed a theft at a supermarket, taking groceries and alcohol worth £450.",
                    "evidence": "Her actions were recorded on the supermarket's security cameras, and the stolen products were retrieved from her car trunk."
                }
            ]
        }
    ],
    "legalProcedure": {
        "judgmentDate": "14th March 2022",
        "judgmentResult": [
            {
                "crimeName": "Crime of Theft",
                "sentence": "The defendant, I. Hill, is sentenced to three years of fixed-term imprisonment and a fine of £5,000. Furthermore, given the recurrent nature of her thefts, she is ineligible for probation.",
                "sentencingConsiderations": "The court considered the cumulative value of the stolen goods, the multiple occurrences of the thefts, and the defendant's premeditated actions. Article 264 was applied given the particularly high value of the stolen goods and the seriousness of the offenses."
            }
        ]
    },
    "Generated Article": "---\n\n**THE CEDARWOOD, BRIGHTON, COURT**\n\n**Judgment Dated: 14th March 2022**\n\n---\n\n**BEFORE:**\n\nChief Judge: Y. Carter  \nJudge: K. Watson  \nCourt Clerk: W. Hall\n\n---\n\n**COURT AND PROSECUTOR INFORMATION**\n\nThis case was brought before the Cedarwood, Brighton, Court, under the jurisdiction of the Cedarwood, Brighton, Procuratorate.\n\n---\n\n**DEFENDANT AND DEFENSE LAWYER INFORMATION**\n\n**Defendant:** I. Hill  \nDate of Birth: 28th June 1969  \nGender: Female  \nResidence: 5, Tiverton Street, Brighton  \nEthnicity: Caucasian  \nOccupation: Retail Assistant  \n\n**Defense Lawyer:** K. Nelson  \nLaw Firm: Nelson & Associates Law Firm  \n\n---\n\n**CASE PROCEDURES**\n\n**Case Filing and Investigation:**  \nOn the 1st of February 2022, the Cedarwood, Brighton, Procuratorate received a formal complaint from a local business owner regarding a series of thefts that had taken place over the past month. The complaint detailed multiple incidents where valuable items were stolen from various commercial establishments within the Cedarwood, Brighton, vicinity. Following standard procedures, the Procuratorate promptly initiated an investigation to ascertain the validity of these claims and identify the perpetrator(s).\n\n**Detention Measures Taken:**  \nBy the 10th of February 2022, credible evidence had been gathered by the Cedarwood, Brighton, Police Department. To prevent the defendant, I. Hill, from fleeing the jurisdiction or tampering with the evidence, preventive detention measures were taken. I. Hill was informed of the suspension of her rights to move and was confined to her residence under close surveillance.\n\n**Criminal Detention:**  \nOn the 12th of February 2022, with the completion of the initial investigative procedures, sufficient proof was obtained to substantiate the allegation against I. Hill. Consequently, she was formally detained by the police. This detention marked the beginning of her direct involvement with the judicial process as substantial evidence of her involvement in the series of thefts was on record.\n\n**Arrest:**  \nSubsequent to formal detention, on the 15th of February 2022, an arrest warrant was issued by this court. The issuance of the warrant was predicated on the continuous investigation which yielded concrete evidence demonstrating her participation in a series of thefts. I. Hill was then officially apprehended by law enforcement officers and taken into police custody to face judicial procedures.\n\n---\n\n**CASE STATEMENT**\n\nThe case at hand pertains to the Crime of Theft committed by the defendant, Ms. I. Hill. The criminal activities occurred over a span of approximately two weeks and involved multiple commercial establishments within Cedarwood, Brighton. The timeline and details of the thefts are outlined as follows:\n\n**Incident on 15th January 2022:**  \nOn this date, I. Hill entered a high-end jewelry shop located in central Brighton. She was observed browsing through various displays, showing particular interest in an array of exquisite gold necklaces. Surveillance footage documented her actions within the store. Utilizing a momentary distraction when the attendant was preoccupied, she deftly removed a gold necklace valued at approximately £2,000 from its display case. The subsequent security review confirmed the theft, and the stolen item was later found in her residence during a search.\n\n**Incident on 20th January 2022:**  \nI. Hill visited a local electronics store on this day. The store inventory revealed the disappearance of several high-value electronic gadgets, including a brand new Apple iPhone and a Samsung tablet. The total value of the stolen merchandise was appraised at approximately £1,500. CCTV footage corroborated her presence in the store at the time of the theft. Confiscation of her possessions yielded receipts for purchases of similar gadgets, further implicating her in the theft.\n\n**Incident on 24th January 2022:**  \nDuring this episode, I. Hill targeted a prominent beauty shop known for its extensive selection of high-end cosmetics and skincare products. Eyewitness accounts from store employees indicated that she appeared familiar to them, likely from earlier visits. On examining the store's stock, an array of high-value cosmetics amounting to £800 was found missing. Her subsequent apprehension revealed that these items were concealed within her personal belongings.\n\n**Incident on 29th January 2022:**  \nFinally, on this date, I. Hill executed a theft at a local supermarket. Her actions were recorded by the supermarket's security cameras as she nonchalantly wheeled a cart filled with groceries and alcohol worth £450 out of the premises without making any payments. Upon being detained, a search of her car trunk recovered the stolen products.\n\nIn cumulative consideration, Ms. Hill’s actions constituted a deliberate and ongoing pattern of criminal behavior, targeting high-value items from various commercial entities within the Brighton area.\n\n---\n\n**CHARGE**\n\nThe Cedarwood, Brighton, Procuratorate charged Ms. I. Hill with the Crime of Theft under Article 264.\n\n---\n\n**EVIDENCE DESCRIPTION**\n\n**Incident on 15th January 2022:**  \n1. **Surveillance Footage:** The video evidence from the jewelry shop's security cameras clearly depicted the theft of the gold necklace by I. Hill.\n2. **Recovered Necklace:** The stolen necklace was confiscated from Ms. Hill's residence during the police search.\n3. **Witness Statements:** Statements from the shop attendants and other customers corroborated her presence and actions within the store.\n\n**Incident on 20th January 2022:**  \n1. **CCTV Footage:** The footage showed Ms. Hill within the electronics store engaging with the display of electronic gadgets.\n2. **Inventory Check:** Discrepancies in the store's inventory confirming the theft of the mentioned items.\n3. **Receipts and Confiscated Items:** Receipts found in her possession for the same models of the stolen gadgets further cemented her involvement.\n\n**Incident on 24th January 2022:**  \n1. **Employee Testimonies:** Employee testimonies reporting her suspicious behavior and consistent appearance over multiple days.\n2. **Recovered Items:** High-value cosmetics and skincare products found among her personal belongings.\n3. **Store Records:** Store records showing the details of stock discrepancies on the given date of the theft.\n\n**Incident on 29th January 2022:**  \n1. **Security Camera Recordings:** Recordings capturing her leaving the supermarket with the cart of unpaid items.\n2. **Recovered Groceries and Alcohol:** The exact items described were recovered from the trunk of her car.\n3. **Supermarket Staff Statements:** Statements confirming her non-payment and suspicious actions on the premises.\n\n---\n\n**SENTENCING CONSIDERATIONS**\n\nIn determining the appropriate sentence for Ms. I. Hill, this court has taken into consideration the following:\n\n**Cumulative Value of Stolen Goods:**  \nThe total value of the stolen items, amounting to approximately £4,750, was significant and consistent with the thresholds for severe sentencing under Article 264.\n\n**Multiple Occurrences:**  \nMs. Hill’s repeated incidents of theft over a brief period underscored a pattern of deliberate and premeditated criminal behavior, warranting stringent punitive measures.\n\n**Premeditated Actions:**  \nThe nature of the thefts demonstrated clear premeditation, as evidenced by her calculated distractions and careful targeting of high-value goods.\n\n**Defendant’s Confession and Attitude:**  \nDuring the trial proceedings, Ms. Hill eventually confessed to her crimes, albeit initially attempting to minimize the severity of her actions by claiming financial distress and coercion by external parties. Her plea lacked substantial corroboration. The court acknowledges her confession but notes it came late in the proceedings and appeared more strategic than remorseful.\n\n---\n\n**JUDGMENT RESULT**\n\nBased on the evidence presented, the charges under Article 264, and the above considerations, this court renders the following judgment:\n\n**Crime of Theft:**  \nThe defendant, Ms. I. Hill, is sentenced to a fixed-term imprisonment of three years and ordered to pay a fine of £5,000. Furthermore, given the recurrent nature of her thefts and their significant impact on local businesses, Ms. Hill is ineligible for probation.\n\n---\n\n**APPEAL RIGHTS EXPLANATION**\n\nMs. I. Hill is hereby informed of her right to appeal this judgment. Under the legal provisions pertaining to criminal procedure, she has the right to file an appeal within ten days from the date this judgment was issued. The appeal should be directed to the Cedarwood, Brighton, Higher People's Court, through this court or the judicial authority where she is currently detained.\n\nShould she choose to exercise this right, a detailed petition outlining the grounds for the appeal should be submitted within the specified period. The petition may include any legal basis she considers pertinent, along with any supporting evidence or witness statements that might have been overlooked or newly discovered.\n\nIn the event of an appeal, it is incumbent upon this court to ensure that all relevant documents and records custodially held are promptly transferred to the appellate court for a thorough review. Ms. Hill is encouraged to seek comprehensive legal counsel to navigate the complexities of the appellate process effectively.\n\n---\n\n**COURT SEAL**\n\nW. Hall  \nCourt Clerk  \nCedarwood, Brighton, Court \n\n---\n\nReference Article is below：\nArticle 264\nThose who steal public or private property, in large amounts, or commit theft multiple times, theft into a residence, theft with a weapon, or pickpocketing, shall be sentenced to fixed-term imprisonment of not more than three years, criminal detention, or control, and shall also be fined or solely fined; if the amount is huge or there are other serious circumstances, they shall be sentenced to fixed-term imprisonment of more than three years but not more than ten years, and shall also be fined; if the amount is particularly huge or there are other particularly serious circumstances, they shall be sentenced to fixed-term imprisonment of more than ten years or life imprisonment, and shall also be fined or have their property confiscated.",
    "qa_fact_based": [
        {
            "question type": "Factual Question",
            "question": "According to the court judgment of Cedarwood, Brighton, Court, who was the defendant?",
            "answer": "I. Hill.",
            "ref": [
                "**Defendant:** I. Hill"
            ]
        },
        {
            "question type": "Factual Question",
            "question": "According to the court judgment of Cedarwood, Brighton, Court, who was the chief judge?",
            "answer": "Y. Carter.",
            "ref": [
                "Chief Judge: Y. Carter"
            ]
        },
        {
            "question type": "Factual Question",
            "question": "According to the court judgment of Cedarwood, Brighton, Court, which law firm did the defense lawyer K. Nelson belong to?",
            "answer": "Nelson & Associates Law Firm.",
            "ref": [
                "Law Firm: Nelson & Associates Law Firm"
            ]
        },
        {
            "question type": "Factual Question",
            "question": "According to the court judgment of Cedarwood, Brighton, Court, what was the ethnicity of the defendant I. Hill?",
            "answer": "Caucasian.",
            "ref": [
                "Ethnicity: Caucasian"
            ]
        }
    ],
    "qa_multi_hop": [
        {
            "question type": "Multi-hop Reasoning Question",
            "question": "According to the judgment of Cedarwood, Brighton, Court, how many theft crimes did I. Hill commit in total?",
            "answer": "According to the judgment, I. Hill committed a total of four theft crimes: stealing a gold necklace, electronic gadgets, cosmetics, and groceries and alcohol each once.",
            "ref": [
                "**Incident on 15th January 2022:**",
                "Utilizing a momentary distraction when the attendant was preoccupied, she deftly removed a gold necklace valued at approximately £2,000 from its display case.",
                "I. Hill visited a local electronics store on this day.",
                "The total value of the stolen merchandise was appraised at approximately £1,500.",
                "During this episode, I. Hill targeted a prominent beauty shop known for its extensive selection of high-end cosmetics and skincare products.",
                "On examining the store's stock, an array of high-value cosmetics amounting to £800 was found missing.",
                "Finally, on this date, I. Hill executed a theft at a local supermarket.",
                "Her actions were recorded by the supermarket's security cameras as she nonchalantly wheeled a cart filled with groceries and alcohol worth £450 out of the premises without making any payments."
            ]
        },
        {
            "question type": "Multi-hop Reasoning Question",
            "question": "According to the judgment of Cedarwood, Brighton, Court, what is the total amount of the stolen items in all of I. Hill's crimes?",
            "answer": "On January 15, 2022, I. Hill stole a gold necklace valued at approximately £2,000, on January 20, 2022, she stole electronic gadgets worth approximately £1,500, on January 24, 2022, she shoplifted cosmetics worth £800, and on January 29, 2022, she stole groceries and alcohol worth £450. The total amount is 2,000 + 1,500 + 800 + 450 = £4,750.",
            "ref": [
                "Utilizing a momentary distraction when the attendant was preoccupied, she deftly removed a gold necklace valued at approximately £2,000 from its display case.",
                "The total value of the stolen merchandise was appraised at approximately £1,500.",
                "On examining the store's stock, an array of high-value cosmetics amounting to £800 was found missing.",
                "Her actions were recorded by the supermarket's security cameras as she nonchalantly wheeled a cart filled with groceries and alcohol worth £450 out of the premises without making any payments.",
                "The total value of the stolen items, amounting to approximately £4,750, was significant and consistent with the thresholds for severe sentencing under Article 264."
            ]
        },
        {
            "question type": "Multi-hop Reasoning Question",
            "question": "According to the judgment of Cedarwood, Brighton, Court, how many pieces of evidence were used to prove I. Hill's involvement in the theft crimes?",
            "answer": "According to the judgment, there were twelve pieces of evidence used to prove I. Hill's involvement: surveillance footage, recovered necklace, and witness statements for the gold necklace theft; CCTV footage, inventory check, and receipts for the electronic gadgets theft; employee testimonies, recovered items, and store records for the cosmetics theft; and security camera recordings, recovered groceries and alcohol, and supermarket staff statements for the groceries and alcohol theft.",
            "ref": [
                "1. **Surveillance Footage:** The video evidence from the jewelry shop's security cameras clearly depicted the theft of the gold necklace by I. Hill.",
                "2. **Recovered Necklace:** The stolen necklace was confiscated from Ms. Hill's residence during the police search.",
                "3. **Witness Statements:** Statements from the shop attendants and other customers corroborated her presence and actions within the store.",
                "1. **CCTV Footage:** The footage showed Ms. Hill within the electronics store engaging with the display of electronic gadgets.",
                "2. **Inventory Check:** Discrepancies in the store's inventory confirming the theft of the mentioned items.",
                "3. **Receipts and Confiscated Items:** Receipts found in her possession for the same models of the stolen gadgets further cemented her involvement.",
                "1. **Employee Testimonies:** Employee testimonies reporting her suspicious behavior and consistent appearance over multiple days.",
                "2. **Recovered Items:** High-value cosmetics and skincare products found among her personal belongings.",
                "3. **Store Records:** Store records showing the details of stock discrepancies on the given date of the theft.",
                "1. **Security Camera Recordings:** Recordings capturing her leaving the supermarket with the cart of unpaid items.",
                "2. **Recovered Groceries and Alcohol:** The exact items described were recovered from the trunk of her car.",
                "3. **Supermarket Staff Statements:** Statements confirming her non-payment and suspicious actions on the premises."
            ]
        }
    ],
    "qa_summary": [
        {
            "question type": "Summarization Question",
            "question": "According to the judgment of Cedarwood, Brighton, Court, summarize the facts of I. Hill's crimes.",
            "answer": "I. Hill committed multiple thefts in January 2022. On 15th January, she stole a gold necklace valued at approximately £2,000 from a high-end jewelry shop. On 20th January, she took several electronic gadgets, including a brand new Apple iPhone and a Samsung tablet, from a local electronics store, with a total value of approximately £1,500. On 24th January, she shoplifted various high-value cosmetics and skincare products summing up to £800 from a prominent beauty shop. On 29th January, she executed a theft at a supermarket, taking groceries and alcohol worth £450.",
            "ref": [
                "**Incident on 15th January 2022:**",
                "On this date, I. Hill entered a high-end jewelry shop located in central Brighton.",
                "She was observed browsing through various displays, showing particular interest in an array of exquisite gold necklaces.",
                "Surveillance footage documented her actions within the store.",
                "Utilizing a momentary distraction when the attendant was preoccupied, she deftly removed a gold necklace valued at approximately £2,000 from its display case.",
                "The subsequent security review confirmed the theft, and the stolen item was later found in her residence during a search.",
                "**Incident on 20th January 2022:**",
                "I. Hill visited a local electronics store on this day.",
                "The store inventory revealed the disappearance of several high-value electronic gadgets, including a brand new Apple iPhone and a Samsung tablet.",
                "The total value of the stolen merchandise was appraised at approximately £1,500.",
                "CCTV footage corroborated her presence in the store at the time of the theft.",
                "Confiscation of her possessions yielded receipts for purchases of similar gadgets, further implicating her in the theft.",
                "**Incident on 24th January 2022:**",
                "During this episode, I. Hill targeted a prominent beauty shop known for its extensive selection of high-end cosmetics and skincare products.",
                "Eyewitness accounts from store employees indicated that she appeared familiar to them, likely from earlier visits.",
                "On examining the store's stock, an array of high-value cosmetics amounting to £800 was found missing.",
                "Her subsequent apprehension revealed that these items were concealed within her personal belongings.",
                "**Incident on 29th January 2022:**",
                "Finally, on this date, I. Hill executed a theft at a local supermarket.",
                "Her actions were recorded by the supermarket's security cameras as she nonchalantly wheeled a cart filled with groceries and alcohol worth £450 out of the premises without making any payments.",
                "Upon being detained, a search of her car trunk recovered the stolen products."
            ]
        },
        {
            "question type": "Summarization Question",
            "question": "According to the judgment of Cedarwood, Brighton, Court, summarize the evidence of I. Hill's crimes.",
            "answer": "The evidence of I. Hill's crimes includes surveillance footage capturing the theft of the gold necklace, store inventory checks and CCTV footage confirming the theft of electronic gadgets, store employee reports and the recovery of stolen cosmetics and skincare products, and security camera recordings from the supermarket along with the retrieval of stolen groceries and alcohol from her car trunk.",
            "ref": [
                "1. **Surveillance Footage:** The video evidence from the jewelry shop's security cameras clearly depicted the theft of the gold necklace by I. Hill.",
                "2. **Recovered Necklace:** The stolen necklace was confiscated from Ms. Hill's residence during the police search.",
                "3. **Witness Statements:** Statements from the shop attendants and other customers corroborated her presence and actions within the store.",
                "1. **CCTV Footage:** The footage showed Ms. Hill within the electronics store engaging with the display of electronic gadgets.",
                "2. **Inventory Check:** Discrepancies in the store's inventory confirming the theft of the mentioned items.",
                "3. **Receipts and Confiscated Items:** Receipts found in her possession for the same models of the stolen gadgets further cemented her involvement.",
                "1. **Employee Testimonies:** Employee testimonies reporting her suspicious behavior and consistent appearance over multiple days.",
                "2. **Recovered Items:** High-value cosmetics and skincare products found among her personal belongings.",
                "3. **Store Records:** Store records showing the details of stock discrepancies on the given date of the theft.",
                "1. **Security Camera Recordings:** Recordings capturing her leaving the supermarket with the cart of unpaid items.",
                "2. **Recovered Groceries and Alcohol:** The exact items described were recovered from the trunk of her car.",
                "3. **Supermarket Staff Statements:** Statements confirming her non-payment and suspicious actions on the premises."
            ]
        },
        {
            "question type": "Summarization Question",
            "question": "According to the judgment of Cedarwood, Brighton, Court, summarize the case process of I. Hill's crimes.",
            "answer": "The case process began on 1st February 2022 when the Cedarwood, Brighton, Procuratorate received a formal complaint from a local business owner regarding multiple thefts. An investigation was promptly initiated. On 10th February 2022, the Cedarwood, Brighton, Police Department took preventive detention measures to ensure I. Hill did not flee or tamper with evidence. On 12th February 2022, I. Hill was formally detained by the police following the completion of the initial investigation. On 15th February 2022, an arrest warrant was issued, and I. Hill was officially arrested based on the findings of the ongoing investigation.",
            "ref": [
                "On the 1st of February 2022, the Cedarwood, Brighton, Procuratorate received a formal complaint from a local business owner regarding a series of thefts that had taken place over the past month.",
                "The complaint detailed multiple incidents where valuable items were stolen from various commercial establishments within the Cedarwood, Brighton, vicinity.",
                "Following standard procedures, the Procuratorate promptly initiated an investigation to ascertain the validity of these claims and identify the perpetrator(s).",
                "By the 10th of February 2022, credible evidence had been gathered by the Cedarwood, Brighton, Police Department.",
                "To prevent the defendant, I. Hill, from fleeing the jurisdiction or tampering with the evidence, preventive detention measures were taken.",
                "I. Hill was informed of the suspension of her rights to move and was confined to her residence under close surveillance.",
                "On the 12th of February 2022, with the completion of the initial investigative procedures, sufficient proof was obtained to substantiate the allegation against I. Hill.",
                "Consequently, she was formally detained by the police.",
                "This detention marked the beginning of her direct involvement with the judicial process as substantial evidence of her involvement in the series of thefts was on record.",
                "Subsequent to formal detention, on the 15th of February 2022, an arrest warrant was issued by this court.",
                "The issuance of the warrant was predicated on the continuous investigation which yielded concrete evidence demonstrating her participation in a series of thefts.",
                "I. Hill was then officially apprehended by law enforcement officers and taken into police custody to face judicial procedures."
            ]
        },
        {
            "question type": "Summarization Question",
            "question": "According to the judgment of Cedarwood, Brighton, Court, summarize the judgment result for I. Hill.",
            "answer": "The judgment result for I. Hill, dated 14th March 2022, is that she is sentenced to three years of fixed-term imprisonment and a fine of £5,000. Given the recurrent nature of her thefts, she is ineligible for probation.",
            "ref": [
                "Based on the evidence presented, the charges under Article 264, and the above considerations, this court renders the following judgment:",
                "**Crime of Theft:**",
                "The defendant, Ms. I. Hill, is sentenced to a fixed-term imprisonment of three years and ordered to pay a fine of £5,000.",
                "Furthermore, given the recurrent nature of her thefts and their significant impact on local businesses, Ms. Hill is ineligible for probation."
            ]
        }
    ]
}