{
    "Report Type": "Corporate Governance Report",
    "Report Time": "2019",
    "Company Information": {
        "Name": "StrongBuild Construction",
        "Establishment Date": "March 12, 2005",
        "Main Business": "StrongBuild Construction specializes in commercial and residential construction projects, including building construction, infrastructure development, and renovation.",
        "Registration Location": "Metropolis City, State of Progress",
        "Listing Status": "Publicly Traded",
        "Industry": "Construction"
    },
    "Report Content": [
        {
            "Type": "Governance Structure",
            "Significant Events": [
                {
                    "Event": "Board of Directors Change",
                    "Time": "February, 2019",
                    "Description": "The appointment or resignation of board members, and its impact on the company's strategic direction.",
                    "Impact": "May lead to strategic adjustments, affecting the company’s long-term development direction and shareholder interests.",
                    "Sub Events": [
                        {
                            "Event": "Change in Company Leadership",
                            "Time": "January, 2019",
                            "Description": "The resignation of the former CEO, John Smith, and the appointment of a new CEO, Jane Johnson.",
                            "Impact": "The change in leadership may result in a shift in strategic priorities and decision-making processes within the company."
                        },
                        {
                            "Event": "Financial Evaluation",
                            "Time": "March, 2019",
                            "Description": "The completion of a comprehensive financial evaluation conducted by an external auditing firm, analyzing the company's financial health and performance.",
                            "Impact": "Provides an understanding of the company's financial status and potential areas for improvement, helping to inform decision-making processes and strategic planning."
                        },
                        {
                            "Event": "Contract Acquisition",
                            "Time": "April, 2019",
                            "Description": "Securing a significant construction contract for a major infrastructure development project within the company's region of operation.",
                            "Impact": "The contract acquisition boosts revenue and enhances the company's reputation, potentially attracting more clients and contributing to future growth."
                        },
                        {
                            "Event": "Strategic Partnership Formation",
                            "Time": "June, 2019",
                            "Description": "Establishing a strategic partnership with a leading architectural firm in order to leverage their expertise and broaden the company's service offerings.",
                            "Impact": "The partnership enables StrongBuild Construction to offer a wider range of services, potentially attracting more clients and increasing market share."
                        },
                        {
                            "Event": "Reorganization of Project Delivery Team",
                            "Time": "September, 2019",
                            "Description": "Implementing a reorganization of the project delivery team to improve efficiency and streamline project management processes.",
                            "Impact": "The reorganization may result in more effective project execution, reduced costs, and improved client satisfaction."
                        }
                    ]
                },
                {
                    "Event": "Corporate Governance Policy Revision",
                    "Time": "March, 2019",
                    "Description": "Revision of the corporate governance framework or policies to enhance transparency, accountability, or stakeholder engagement.",
                    "Impact": "Enhances corporate governance transparency and accountability, boosting stakeholder confidence."
                },
                {
                    "Event": "Risk Management Measures",
                    "Time": "May, 2019",
                    "Description": "Updates to the company's risk management framework, including identification of new risks and implementation of mitigation strategies.",
                    "Impact": "Improves the company’s ability to respond to internal and external risks, ensuring continuous operation and stable development."
                },
                {
                    "Event": "Strategic Partnership with Reputable Construction Firm",
                    "Time": "June, 2019",
                    "Description": "Signed a strategic partnership agreement with Summit Construction, a renowned construction firm, to collaborate on major infrastructure projects.",
                    "Impact": "Expands the company's network and improves its capacity to undertake large-scale projects, enhancing market reputation and revenue potential."
                },
                {
                    "Event": "Shareholders' Meeting Resolution",
                    "Time": "July, 2019",
                    "Description": "Key decisions made at the annual or extraordinary shareholders’ meeting, including changes to the company’s charter, major corporate actions, and voting results.",
                    "Impact": "Directly affects the company’s governance structure, future operational strategies, and shareholder rights."
                },
                {
                    "Event": "Ethics and Integrity Incidents",
                    "Time": "August, 2019",
                    "Description": "Significant ethical or integrity violations, such as fraud, corruption, or conflicts of interest, and the measures taken by the company in response.",
                    "Impact": "May damage the company's reputation and brand value, affecting relationships with investors, customers, and partners."
                },
                {
                    "Event": "Senior Management Changes",
                    "Time": "September, 2019",
                    "Description": "Changes in the company’s senior management, including the CEO or other key positions, and its impact on the company's operational focus and priorities.",
                    "Impact": "May lead to adjustments in operational focus and strategic priorities, affecting short-term performance and long-term development."
                },
                {
                    "Event": "Successful Tender for Mega Public Infrastructure Project",
                    "Time": "October, 2019",
                    "Description": "Won the bid for the construction of a mega public infrastructure project, the Progress City Highway, valued at $500 million.",
                    "Impact": "Secures a substantial contract, ensuring a steady revenue stream and improving financial performance in the upcoming years."
                },
                {
                    "Event": "Compliance and Regulatory Updates",
                    "Time": "November, 2019",
                    "Description": "Updates to new regulations or compliance standards affecting corporate governance practices, including changes in securities law, corporate law, or specific industry regulations.",
                    "Impact": "Ensures compliance with the latest laws and regulations, reducing legal risk, protecting the company and shareholder interests."
                },
                {
                    "Event": "Sustainability and Social Responsibility Initiatives",
                    "Time": "December, 2019",
                    "Description": "Significant progress in sustainability, environmental protection, social responsibility, and corporate citizenship.",
                    "Impact": "Enhances the company’s public image and market competitiveness, promoting long-term sustainable development."
                }
            ],
            "Involved Indicators": [
                {
                    "Indicator": "Information Disclosure",
                    "Description": "Principles, methods, and implementation status of company information disclosure.",
                    "Value": "StrongBuild Construction adopts a transparent and timely information disclosure policy, ensuring that all material information is available to shareholders and the public. The company follows the guidelines set by regulatory authorities and exchanges."
                },
                {
                    "Indicator": "Related Transactions",
                    "Description": "Policies, procedures, and measures to ensure fairness and compliance of related transactions.",
                    "Value": "StrongBuild Construction maintains strict policies and procedures to ensure all related transactions are conducted fairly and in compliance with applicable laws and regulations. The company has established an independent review committee to oversee related party transactions and prevent conflicts of interest."
                },
                {
                    "Indicator": "Internal Control",
                    "Description": "Architecture, implementation, and effectiveness assessment of internal controls.",
                    "Value": "StrongBuild Construction has a robust internal control system in place, which includes clearly defined roles and responsibilities, regular internal audits, and ongoing monitoring of key processes. The company regularly assesses the effectiveness of internal controls to identify areas for improvement and implement necessary changes."
                }
            ]
        }
    ],
    "Additional Information": [
        {
            "Name": "Governance Improvement Plans",
            "Content": [
                {
                    "Name": "Strengthening the Function of the Board of Directors and Supervisory Board",
                    "Description": "StrongBuild Construction aims to enhance the efficiency and effectiveness of the board of directors and supervisory board in corporate governance. The company plans to provide regular training programs to enhance the skills and knowledge of board members. Additionally, the company intends to increase the proportion of independent directors to ensure objective decision-making and strengthen the board's oversight function."
                },
                {
                    "Name": "Enhancing Transparency and Quality of Information Disclosure",
                    "Description": "StrongBuild Construction is committed to improving the transparency and quality of information disclosure. The company plans to enhance its information disclosure process and standards to ensure timely, accurate, and comprehensive reporting. This includes providing clear and concise explanations of financial results, material events, and risks, as well as increasing stakeholder accessibility to relevant information through digital platforms."
                }
            ]
        },
        {
            "Name": "Risk Management Strategy",
            "Content": [
                {
                    "Name": "Strengthening the Internal Control System",
                    "Description": "StrongBuild Construction aims to establish and improve its internal control system to identify, assess, monitor, and report financial and operational risks. The company plans to enhance risk awareness among employees through training programs and implement advanced risk assessment tools to proactively manage potential risks. Regular internal audits and comprehensive risk reporting will be conducted to ensure timely risk mitigation strategies."
                },
                {
                    "Name": "Integrating Sustainable Development and Social Responsibility",
                    "Description": "StrongBuild Construction recognizes the importance of sustainable development and social responsibility. The company aims to fully integrate these principles into its overall strategy, identifying related risks and opportunities. The company plans to enhance its environmental stewardship initiatives, promote the well-being of its employees, and actively contribute to local communities. By doing so, StrongBuild Construction seeks to create long-term value for all stakeholders."
                }
            ]
        }
    ],
    "Generated Outline": "I. Introduction\n\n- Report Type: Corporate Governance Report\n- Report Time: 2019\n\nII. Company Information\n\n- Name: StrongBuild Construction\n- Establishment Date: March 12, 2005\n- Main Business: Specializes in commercial and residential construction projects, including building construction, infrastructure development, and renovation.\n- Registration Location: Metropolis City, State of Progress\n- Listing Status: Publicly Traded\n- Industry: Construction\n\nIII. Governance Structure\n\nA. Board of Directors Change (February, 2019)\n- Event: Board of Directors Change\n- Description: The appointment or resignation of board members, and its impact on the company's strategic direction.\n- Impact: May lead to strategic adjustments, affecting the company’s long-term development direction and shareholder interests.\n\n- Sub Events:\n  1. Change in Company Leadership (January, 2019)\n    - Description: The resignation of the former CEO, John Smith, and the appointment of a new CEO, Jane Johnson.\n    - Impact: The change in leadership may result in a shift in strategic priorities and decision-making processes within the company.\n\n  2. Financial Evaluation (March, 2019)\n    - Description: The completion of a comprehensive financial evaluation conducted by an external auditing firm, analyzing the company's financial health and performance.\n    - Impact: Provides an understanding of the company's financial status and potential areas for improvement, helping to inform decision-making processes and strategic planning.\n\n  3. Contract Acquisition (April, 2019)\n    - Description: Securing a significant construction contract for a major infrastructure development project within the company's region of operation.\n    - Impact: The contract acquisition boosts revenue and enhances the company's reputation, potentially attracting more clients and contributing to future growth.\n\n  4. Strategic Partnership Formation (June, 2019)\n    - Description: Establishing a strategic partnership with a leading architectural firm to leverage their expertise and broaden the company's service offerings.\n    - Impact: The partnership enables StrongBuild Construction to offer a wider range of services, potentially attracting more clients and increasing market share.\n\n  5. Reorganization of Project Delivery Team (September, 2019)\n    - Description: Implementing a reorganization of the project delivery team to improve efficiency and streamline project management processes.\n    - Impact: The reorganization may result in more effective project execution, reduced costs, and improved client satisfaction.\n\nB. Corporate Governance Policy Revision (March, 2019)\n- Event: Corporate Governance Policy Revision\n- Description: Revision of the corporate governance framework or policies to enhance transparency, accountability, or stakeholder engagement.\n- Impact: Enhances corporate governance transparency and accountability, boosting stakeholder confidence.\n\nC. Risk Management Measures (May, 2019)\n- Event: Risk Management Measures\n- Description: Updates to the company's risk management framework, including identification of new risks and implementation of mitigation strategies.\n- Impact: Improves the company’s ability to respond to internal and external risks, ensuring continuous operation and stable development.\n\nD. Strategic Partnership with Reputable Construction Firm (June, 2019)\n- Event: Strategic Partnership with Reputable Construction Firm\n- Description: Signed a strategic partnership agreement with Summit Construction, a renowned construction firm, to collaborate on major infrastructure projects.\n- Impact: Expands the company's network and improves its capacity to undertake large-scale projects, enhancing market reputation and revenue potential.\n\nE. Shareholders' Meeting Resolution (July, 2019)\n- Event: Shareholders' Meeting Resolution\n- Description: Key decisions made at the annual or extraordinary shareholders’ meeting, including changes to the company’s charter, major corporate actions, and voting results.\n- Impact: Directly affects the company’s governance structure, future operational strategies, and shareholder rights.\n\nF. Ethics and Integrity Incidents (August, 2019)\n- Event: Ethics and Integrity Incidents\n- Description: Significant ethical or integrity violations and the measures taken by the company in response.\n- Impact: May damage the company's reputation and brand value, affecting relationships with investors, customers, and partners.\n\nG. Senior Management Changes (September, 2019)\n- Event: Senior Management Changes\n- Description: Changes in the company’s senior management, including the CEO or other key positions, and its impact on the company's operational focus and priorities.\n- Impact: May lead to adjustments in operational focus and strategic priorities, affecting short-term performance and long-term development.\n\nH. Successful Tender for Mega Public Infrastructure Project (October, 2019)\n- Event: Successful Tender for Mega Public Infrastructure Project\n- Description: Won the bid for the construction of a mega public infrastructure project valued at $500 million.\n- Impact: Secures a substantial contract, ensuring a steady revenue stream and improving financial performance in the upcoming years.\n\nI. Compliance and Regulatory Updates (November, 2019)\n- Event: Compliance and Regulatory Updates\n- Description: Updates to new regulations or compliance standards affecting corporate governance practices.\n- Impact: Ensures compliance with the latest laws and regulations, reducing legal risk, protecting the company and shareholder interests.\n\nJ. Sustainability and Social Responsibility Initiatives (December, 2019)\n- Event: Sustainability and Social Responsibility Initiatives\n- Description: Significant progress in sustainability, environmental protection, and corporate citizenship.\n- Impact: Enhances the company's public image and market competitiveness, promoting long-term sustainable development.\n\nIV. Involved Indicators\n\nA. Information Disclosure\n- Indicator: Information Disclosure\n- Description: Principles, methods, and implementation status of company information disclosure.\n- Value: StrongBuild Construction adopts a transparent and timely information disclosure policy, ensuring that all material information is available to shareholders and the public. The company follows the guidelines set by regulatory authorities and exchanges.\n\nB. Related Transactions\n- Indicator: Related Transactions\n- Description: Policies, procedures, and measures to ensure fairness and compliance of related transactions.\n- Value: StrongBuild Construction maintains strict policies and procedures to ensure all related transactions are conducted fairly and in compliance with applicable laws and regulations. The company has established an independent review committee to oversee related party transactions and prevent conflicts of interest.\n\nC. Internal Control\n- Indicator: Internal Control\n- Description: Architecture, implementation, and effectiveness assessment of internal controls.\n- Value: StrongBuild Construction has a robust internal control system in place, which includes clearly defined roles and responsibilities, regular internal audits, and ongoing monitoring of key processes. The company regularly assesses the effectiveness of internal controls to identify areas for improvement and implement necessary changes.\n\nV. Additional Information\n\nA. Governance Improvement Plans\n\n1. Strengthening the Function of the Board of Directors and Supervisory Board\n- Description: Aim to enhance the efficiency and effectiveness of the board of directors and supervisory board in corporate governance. Provide regular training programs to enhance the skills and knowledge of board members. Increase the proportion of independent directors to ensure objective decision-making and strengthen the board's oversight function.\n\n2. Enhancing Transparency and Quality of Information Disclosure\n- Description: Commitment to improving the transparency and quality of information disclosure. Enhance the information disclosure process and standards to ensure timely, accurate, and comprehensive reporting. Provide clear and concise explanations of financial results, material events, and risks. Increase stakeholder accessibility to relevant information through digital platforms.\n\nB. Risk Management Strategy\n\n1. Strengthening the Internal Control System\n- Description: Establish and improve the internal control system to identify, assess, monitor, and report financial and operational risks. Enhance risk awareness among employees through training programs. Implement advanced risk assessment tools. Conduct regular internal audits and comprehensive risk reporting to ensure timely risk mitigation strategies.\n\n2. Integrating Sustainable Development and Social Responsibility\n- Description: Recognize the importance of sustainable development and social responsibility. Fully integrate these principles into the overall strategy, identifying related risks and opportunities. Enhance environmental stewardship initiatives, promote the well-being of employees, and actively contribute to local communities. Create long-term value for all stakeholders.\n\n(Note: The outline has been arranged based on the provided JSON data and follows the given instructions. It includes all the time points mentioned in the JSON.)",
    "Generated Summary": "StrongBuild Construction is a publicly traded construction company based in Metropolis City, State of Progress, specializing in commercial and residential construction projects, infrastructure development, and renovation.",
    "Generated Article": "In February 2019, StrongBuild Construction experienced a significant change in its Board of Directors, which had implications for the company's strategic direction. This change included the resignation of the former CEO, John Smith, and the appointment of a new CEO, Jane Johnson. The change in leadership is expected to result in a shift in strategic priorities and decision-making processes within the company. This event was accompanied by a comprehensive financial evaluation conducted by an external auditing firm in March 2019. The evaluation provided insights into the company's financial health and performance, informing decision-making processes and strategic planning.\n\nIn April 2019, StrongBuild Construction secured a significant construction contract for a major infrastructure development project within its region of operation. This contract acquisition is expected to boost the company's revenue and enhance its reputation, potentially attracting more clients and contributing to future growth. Additionally, in June 2019, the company established a strategic partnership with a leading architectural firm, Summit Construction. This partnership allows StrongBuild Construction to leverage Summit Construction's expertise and broaden its service offerings, potentially attracting more clients and increasing market share.\n\nTo improve efficiency and streamline project management processes, StrongBuild Construction implemented a reorganization of its project delivery team in September 2019. This reorganization is expected to result in more effective project execution, reduced costs, and improved client satisfaction. Furthermore, in October 2019, the company won the bid for the construction of a mega public infrastructure project valued at $500 million. This success in securing a substantial contract ensures a steady revenue stream and improves the company's financial performance in the upcoming years.\n\nIn terms of corporate governance, StrongBuild Construction revised its corporate governance policies in March 2019 to enhance transparency, accountability, and stakeholder engagement. This revision aims to boost corporate governance transparency and accountability, thereby increasing stakeholder confidence. The company also made efforts to update its risk management measures in May 2019, identifying new risks and implementing mitigation strategies to ensure continuous operation and stable development.\n\nThroughout the year, StrongBuild Construction faced various challenges related to ethics and integrity incidents in August 2019. These incidents, although significant, were promptly addressed by the company to mitigate any potential damage to its reputation and brand value. Additionally, the company experienced senior management changes in September 2019, which may lead to adjustments in operational focus and strategic priorities, affecting both short-term performance and long-term development.\n\nIn November 2019, StrongBuild Construction ensured compliance with the latest laws and regulations by staying updated on compliance and regulatory updates. This commitment to compliance reduces legal risk and protects the company and shareholder interests. Lastly, in December 2019, the company made significant progress in sustainability, environmental protection, and corporate citizenship. These sustainability and social responsibility initiatives enhance the company's public image and market competitiveness, promoting long-term sustainable development.\n\nThroughout the report, StrongBuild Construction has demonstrated a commitment to strong corporate governance practices. The company adopts a transparent and timely information disclosure policy, ensuring that all material information is available to shareholders and the public. It maintains strict policies and procedures to ensure fairness and compliance of related transactions, preventing conflicts of interest. StrongBuild Construction also has a robust internal control system in place, regularly assessing its effectiveness to identify areas for improvement and implement necessary changes.\n\nLooking ahead, StrongBuild Construction has outlined governance improvement plans to strengthen the function of the Board of Directors and Supervisory Board. This includes providing regular training programs to enhance the skills and knowledge of board members, increasing the proportion of independent directors, and improving transparency and the quality of information disclosure. The company also aims to strengthen its internal control system, integrating sustainable development and social responsibility principles into its overall strategy to create long-term value for all stakeholders.\n\nOverall, StrongBuild Construction has navigated various events and challenges throughout the year, demonstrating resilience and a commitment to corporate governance and sustainable development. With its strong governance structure and strategic initiatives, the company is well-positioned for future growth and success in the construction industry."
}