{
    "Report Type": "Corporate Financial Report",
    "Report Time": "2019",
    "Company Information": {
        "Name": "StrongBuild Construction",
        "Establishment Date": "March 12, 2005",
        "Main Business": "StrongBuild Construction specializes in commercial and residential construction projects, including building construction, infrastructure development, and renovation.",
        "Registration Location": "Metropolis City, State of Progress",
        "Listing Status": "Publicly Traded",
        "Industry": "Construction"
    },
    "Report Content": [
        {
            "Type": "Financial Information",
            "Significant Events": [
                {
                    "Event": "Debt Restructuring",
                    "Time": "January, 2019",
                    "Description": "To optimize capital structure, the company underwent debt restructuring, reducing liabilities by $25 million.",
                    "Impact": "Improved the company's financial condition, reduced financial costs.",
                    "Sub Events": [
                        {
                            "Event": "Financial Audit",
                            "Time": "February, 2019",
                            "Description": "StrongBuild Construction conducted a thorough financial audit, scrutinizing its financial records and statements to ensure accuracy and compliance with regulatory requirements.",
                            "Impact": "Provided a comprehensive understanding of the company's financial health and identified areas for improvement."
                        },
                        {
                            "Event": "Cost Optimization Program",
                            "Time": "March, 2019",
                            "Description": "In an effort to improve profitability, StrongBuild Construction implemented a cost optimization program. This involved identifying and eliminating unnecessary expenses, streamlining operations, and renegotiating contracts with suppliers to secure more favorable terms.",
                            "Impact": "Reduced operating costs and improved profit margins, contributing to the overall financial condition of the company."
                        },
                        {
                            "Event": "Project Portfolio Analysis",
                            "Time": "April, 2019",
                            "Description": "StrongBuild Construction conducted a detailed analysis of its project portfolio, evaluating the profitability, risks, and potential benefits of each project. This assessment allowed the company to prioritize projects that aligned with its strategic objectives and had the highest potential for generating revenue.",
                            "Impact": "Enhanced project selection process, maximizing profitability and minimizing potential losses."
                        },
                        {
                            "Event": "Negotiation with Lenders",
                            "Time": "May, 2019",
                            "Description": "StrongBuild Construction engaged in negotiations with its lenders to restructure existing loans and obtain more favorable repayment terms. This included extensions on loan maturities, lower interest rates, and revised payment schedules to alleviate financial pressure.",
                            "Impact": "Reduced financial burden, improved cash flow, and enhanced the company's ability to meet its financial obligations."
                        },
                        {
                            "Event": "Asset Disposal",
                            "Time": "June, 2019",
                            "Description": "As part of its debt reduction strategy, StrongBuild Construction implemented an asset disposal plan. The company sold non-performing or surplus assets to generate cash flow and decrease outstanding liabilities.",
                            "Impact": "Reduced debt, improved liquidity, and strengthened the company's financial position."
                        },
                        {
                            "Event": "Contract Renegotiation",
                            "Time": "July, 2019",
                            "Description": "StrongBuild Construction conducted a comprehensive review of its existing contracts with clients and suppliers. The company identified opportunities for better terms, negotiated revised agreements, and sought to secure more favorable pricing and payment conditions.",
                            "Impact": "Improved profitability, reduced costs, and enhanced overall financial performance."
                        },
                        {
                            "Event": "Financial Forecasting and Planning",
                            "Time": "August, 2019",
                            "Description": "StrongBuild Construction undertook detailed financial forecasting and planning to project future cash flows, identify potential risks, and develop action plans to mitigate those risks. This process involved scenario analysis, sensitivity testing, and strategic decision-making to optimize financial performance.",
                            "Impact": "Enabled informed decision making, enhanced financial stability, and supported long-term strategic goals."
                        }
                    ]
                },
                {
                    "Event": "Significant Equity Acquisition",
                    "Time": "February, 2019",
                    "Description": "The company completed the acquisition of 45% equity of Stellar Building Solutions.",
                    "Impact": "Further expanded the company's market share, enhanced the company's control."
                },
                {
                    "Event": "Dividend Distribution",
                    "Time": "March, 2019",
                    "Description": "The company decided to distribute $10 million of dividends to shareholders.",
                    "Impact": "Returned to the investors, enhanced shareholder returns."
                },
                {
                    "Event": "Asset Restructuring",
                    "Time": "June, 2019",
                    "Description": "The company underwent an asset restructuring, optimizing its business structure.",
                    "Impact": "Improved operational efficiency, increased company value."
                },
                {
                    "Event": "Contract Dispute",
                    "Time": "July, 2019",
                    "Description": "The company faced a contract dispute with one of its major clients, resulting in a potential loss of $5 million.",
                    "Impact": "Affected short-term profitability and cash flow."
                },
                {
                    "Event": "Major Investment",
                    "Time": "August, 2019",
                    "Description": "The company invested in the construction of Green View Mall, with an investment amount of $100 million.",
                    "Impact": "Further broadened the company's business areas, enhanced profitability."
                },
                {
                    "Event": "Major Asset Acquisition",
                    "Time": "September, 2019",
                    "Description": "The company completed the asset acquisition of Elite Construction Firm, with a total value of $50 million.",
                    "Impact": "Expanded the company's business scope, enhanced market competitiveness."
                },
                {
                    "Event": "Large-scale Financing",
                    "Time": "October, 2019",
                    "Description": "The company conducted a large-scale financing activity, raising $200 million of funds.",
                    "Impact": "Strengthened the company's financial strength, supported expansion and development."
                }
            ],
            "Involved Indicators": [
                {
                    "Indicator": "Operating Income",
                    "Description": "The total amount of main business income and other business income within a certain accounting period.",
                    "Influencing Factors": [
                        "Market Demand",
                        "Changes in Product Prices"
                    ],
                    "Value": "$500 million"
                },
                {
                    "Indicator": "Net Profit",
                    "Description": "The net income of the company within a certain accounting period, i.e., total income minus total costs and taxes.",
                    "Influencing Factors": [
                        "Operating Income",
                        "Cost Control",
                        "Non-recurring Gains and Losses"
                    ],
                    "Value": "$30 million"
                },
                {
                    "Indicator": "Total Assets",
                    "Description": "The total amount of assets owned by the company at the end of the accounting period.",
                    "Influencing Factors": [
                        "Asset Acquisition",
                        "Asset Disposal",
                        "Asset Revaluation"
                    ],
                    "Value": "$750 million"
                },
                {
                    "Indicator": "Total Liabilities",
                    "Description": "The total amount of debts the company is obligated to repay at the end of the accounting period.",
                    "Influencing Factors": [
                        "New Debt Issuance",
                        "Debt Repayment",
                        "Debt Restructuring"
                    ],
                    "Value": "$350 million"
                },
                {
                    "Indicator": "Shareholder Equity",
                    "Description": "The total amount of equity belonging to shareholders at the end of the accounting period.",
                    "Influencing Factors": [
                        "Net Profit",
                        "Dividend Distribution",
                        "Capital Reserves"
                    ],
                    "Value": "$400 million"
                },
                {
                    "Indicator": "Cash Flow",
                    "Description": "The total cash inflows and outflows of the company within a certain accounting period.",
                    "Influencing Factors": [
                        "Operating Activities",
                        "Investment Activities",
                        "Financing Activities"
                    ],
                    "Value": "$20 million"
                },
                {
                    "Indicator": "Debt Ratio",
                    "Description": "The ratio of total liabilities to total assets, reflecting the company's debt level.",
                    "Influencing Factors": [
                        "Changes in Total Liabilities",
                        "Changes in Total Assets"
                    ],
                    "Value": "46.7%"
                },
                {
                    "Indicator": "Debt to Assets Ratio",
                    "Description": "The percentage of total liabilities to total assets, a measure of the company's financial leverage.",
                    "Influencing Factors": [
                        "Increases or decreases in assets and liabilities"
                    ],
                    "Value": "50%"
                },
                {
                    "Indicator": "Return on Equity",
                    "Description": "Reflects the operational efficiency of shareholder equity, namely the ratio of net profit to average shareholder equity.",
                    "Influencing Factors": [
                        "Change in Net Profit",
                        "Change in Shareholder Equity"
                    ],
                    "Value": "7.5%"
                }
            ]
        }
    ],
    "Additional Information": [
        {
            "Name": "Future Outlook",
            "Content": [
                {
                    "Name": "Financial Strategy",
                    "Description": "StrongBuild Construction plans to implement a comprehensive cost control program to optimize operational efficiency and reduce expenses. The company also aims to explore new capital operations to further strengthen its financial position and support future growth."
                },
                {
                    "Name": "Investment Plans",
                    "Description": "StrongBuild Construction has planned strategic investments in innovative technologies for construction, expanding its capabilities in sustainable and eco-friendly construction methods. Additionally, the company intends to invest in research and development to drive innovation in the industry."
                },
                {
                    "Name": "Risk Management",
                    "Description": "StrongBuild Construction has identified major financial risks such as market volatility, regulatory changes, and project delivery delays. The company plans to mitigate these risks through proactive risk assessment, diversified project portfolio, and maintaining strong relationships with key stakeholders."
                }
            ]
        }
    ],
    "Generated Outline": "Outline for Corporate Financial Report - StrongBuild Construction (2019)\n\nI. Introduction\n    A. Company Information\n        1. Name: StrongBuild Construction\n        2. Establishment Date: March 12, 2005\n        3. Main Business: Specializes in commercial and residential construction projects\n        4. Registration Location: Metropolis City, State of Progress\n        5. Listing Status: Publicly Traded\n        6. Industry: Construction\n    \nII. Financial Information\n    A. Debt Restructuring (January, 2019)\n        1. Description: Debt restructuring to optimize capital structure, reducing liabilities by $25 million\n        2. Impact: Improved financial condition, reduced financial costs\n        3. Sub Events:\n            a. Financial Audit (February, 2019)\n                - Description: Thorough financial audit to ensure accuracy and compliance\n                - Impact: Comprehensive understanding of financial health and areas for improvement\n            b. Cost Optimization Program (March, 2019)\n                - Description: Implemented program to reduce expenses and streamline operations\n                - Impact: Reduced operating costs and improved profit margins\n            c. Project Portfolio Analysis (April, 2019)\n                - Description: Detailed analysis of project portfolio to prioritize profitable projects\n                - Impact: Enhanced project selection process, maximized profitability\n            d. Negotiation with Lenders (May, 2019)\n                - Description: Restructured loans for favorable repayment terms\n                - Impact: Reduced financial burden, improved cash flow\n            e. Asset Disposal (June, 2019)\n                - Description: Sold non-performing or surplus assets to reduce debt\n                - Impact: Improved liquidity and financial position\n            f. Contract Renegotiation (July, 2019)\n                - Description: Reviewed and renegotiated contracts for better terms\n                - Impact: Improved profitability and reduced costs\n            g. Financial Forecasting and Planning (August, 2019)\n                - Description: Undertook detailed financial planning and risk mitigation\n                - Impact: Informed decision making and long-term strategic goals\n    \n    B. Significant Equity Acquisition (February, 2019)\n        1. Description: Acquired 45% equity of Stellar Building Solutions\n        2. Impact: Expanded market share, enhanced control\n    \n    C. Dividend Distribution (March, 2019)\n        1. Description: Distributed $10 million of dividends to shareholders\n        2. Impact: Enhanced shareholder returns\n    \n    D. Asset Restructuring (June, 2019)\n        1. Description: Optimized business structure through asset restructuring\n        2. Impact: Improved operational efficiency, increased company value\n    \n    E. Contract Dispute (July, 2019)\n        1. Description: Faced contract dispute with a major client, potentially impacting profitability by $5 million.\n        2. Impact: Affected short-term profitability and cash flow\n    \n    F. Major Investment (August, 2019)\n        1. Description: Invested $100 million in construction of Green View Mall\n        2. Impact: Broadened business areas, enhanced profitability\n    \n    G. Major Asset Acquisition (September, 2019)\n        1. Description: Acquired assets of Elite Construction Firm worth $50 million\n        2. Impact: Expanded business scope, enhanced market competitiveness\n    \n    H. Large-scale Financing (October, 2019)\n        1. Description: Raised $200 million through large-scale financing activity\n        2. Impact: Strengthened financial strength, supported expansion and development\n    \nIII. Indicators Analysis\n    A. Operating Income ($500 million)\n        1. Description: Total amount of main business income within the accounting period\n        2. Influencing Factors: Market demand, changes in product prices\n    \n    B. Net Profit ($30 million)\n        1. Description: Net income of the company within the accounting period\n        2. Influencing Factors: Operating income, cost control, non-recurring gains and losses\n    \n    C. Total Assets ($750 million)\n        1. Description: Total amount of assets owned by the company at the end of the accounting period\n        2. Influencing Factors: Asset acquisition, asset disposal, asset revaluation\n    \n    D. Total Liabilities ($350 million)\n        1. Description: Total amount of debts the company is obligated to repay\n        2. Influencing Factors: New debt issuance, debt repayment, debt restructuring\n    \n    E. Shareholder Equity ($400 million)\n        1. Description: Total amount of equity belonging to shareholders\n        2. Influencing Factors: Net profit, dividend distribution, capital reserves\n    \n    F. Cash Flow ($20 million)\n        1. Description: Total cash inflows and outflows within the accounting period\n        2. Influencing Factors: Operating activities, investment activities, financing activities\n    \n    G. Debt Ratio (46.7%)\n        1. Description: Ratio of total liabilities to total assets\n        2. Influencing Factors: Changes in total liabilities, changes in total assets\n    \n    H. Debt to Assets Ratio (50%)\n        1. Description: Percentage of total liabilities to total assets\n        2. Influencing Factors: Increases or decreases in assets and liabilities\n    \n    I. Return on Equity (7.5%)\n        1. Description: Reflects operational efficiency of shareholder equity\n        2. Influencing Factors: Change in net profit, change in shareholder equity\n    \nIV. Additional Information\n    A. Future Outlook\n        1. Financial Strategy: Cost control program, new capital operations\n        2. Investment Plans: Innovative technologies, research and development\n        3. Risk Management: Proactive risk assessment, diversified portfolio, strong stakeholder relationships\n    \nV. Conclusion\n\nNote: This outline follows the mentioned key points in the JSON, including the involvement of events and indicators with their respective time points.",
    "Generated Summary": "StrongBuild Construction is a publicly traded construction company specializing in commercial and residential construction, including building construction, infrastructure development, and renovation, with its establishment date on March 12, 2005, in Metropolis City, State of Progress.",
    "Generated Article": "In 2019, StrongBuild Construction underwent several significant events that impacted its financial performance and overall business operations. One of the key events was the debt restructuring that took place in January. This restructuring aimed to optimize the company's capital structure and resulted in a reduction of liabilities by $25 million. The impact of this event was twofold. Firstly, it improved the company's financial condition by reducing its financial costs. Secondly, it provided StrongBuild Construction with a comprehensive understanding of its financial health and areas for improvement through a thorough financial audit conducted in February.\n\nThe cost optimization program implemented in March further contributed to the company's improved financial performance. By reducing expenses and streamlining operations, StrongBuild Construction was able to lower its operating costs and improve its profit margins. This program was followed by a project portfolio analysis in April, which allowed the company to prioritize profitable projects and maximize profitability.\n\nIn May, StrongBuild Construction engaged in negotiations with lenders to restructure its loans for more favorable repayment terms. This resulted in a reduced financial burden and improved cash flow for the company. Additionally, in June, the company sold non-performing or surplus assets as part of its asset disposal strategy, which further improved its liquidity and financial position.\n\nAnother important event that occurred in July was a contract dispute with a major client, potentially impacting the company's profitability by $5 million. This dispute had a short-term effect on the company's profitability and cash flow. However, in the same month, StrongBuild Construction also reviewed and renegotiated contracts, leading to improved profitability and reduced costs.\n\nIn August, the company undertook detailed financial forecasting and planning. This allowed StrongBuild Construction to make informed decisions and set long-term strategic goals. The following month, the company invested $100 million in the construction of Green View Mall, which broadened its business areas and enhanced profitability.\n\nSeptember saw StrongBuild Construction acquire the assets of Elite Construction Firm worth $50 million. This acquisition expanded the company's business scope and enhanced its market competitiveness. In October, the company raised $200 million through large-scale financing activities, strengthening its financial strength and supporting further expansion and development.\n\nAnalyzing the financial indicators of StrongBuild Construction, it is evident that the company has achieved impressive results. The operating income for the year reached $500 million, driven by market demand and changes in product prices. The net profit amounted to $30 million, reflecting the company's ability to control costs and generate non-recurring gains and losses.\n\nStrongBuild Construction's total assets stood at $750 million, influenced by asset acquisitions, disposals, and revaluations. The company's total liabilities amounted to $350 million, reflecting new debt issuances, debt repayments, and the successful debt restructuring efforts. Shareholder equity reached $400 million, driven by net profit, dividend distribution, and capital reserves.\n\nThe company's cash flow for the year was $20 million, resulting from its operating activities, investment activities, and financing activities. The debt ratio stood at 46.7%, indicating a healthy balance between total liabilities and total assets. The debt to assets ratio was 50%, reflecting the company's ability to manage its debt and assets effectively.\n\nFinally, the return on equity for StrongBuild Construction was 7.5%, indicating the company's operational efficiency in utilizing shareholder equity. This was influenced by changes in net profit and shareholder equity.\n\nLooking ahead, StrongBuild Construction has outlined a financial strategy focused on cost control programs and new capital operations. The company also plans to invest in innovative technologies and research and development to stay competitive in the industry. Additionally, proactive risk assessment, a diversified portfolio, and strong stakeholder relationships will be key elements of the company's risk management approach.\n\nIn conclusion, StrongBuild Construction's 2019 financial report highlights the company's successful debt restructuring, cost optimization programs, and strategic investments. These initiatives have contributed to improved financial performance, enhanced market competitiveness, and strengthened the company's overall financial position. With a focus on future growth and risk management, StrongBuild Construction is well-positioned to continue its success in the construction industry."
}