{
    "住院病历": {
        "基本信息": {
            "姓名": "苏某某",
            "性别": "男",
            "年龄": "63岁",
            "民族": "汉族",
            "婚姻状况": "已婚",
            "职业": "退休职工",
            "住址": "丝路市翠湖街77号",
            "入院时间": "8月9日",
            "记录时间": "8月9日",
            "病史陈述者": "本人",
            "医院名称": "丝路市人民医院"
        },
        "主诉": "面容改变、手指变粗、饭量增多持续2年，加重1个月",
        "现病史": {
            "发病情况": "患者2年前无明显诱因发现面容逐渐改变，具体表现为额头变大，下颌突出、鼻大唇厚、手指变粗，同时自觉饭量增多。未予重视，1个月前症状加重，伴有全身乏力，头痛。",
            "主要症状特点": "主要表现为面容改变（额头变大，下颌突出、鼻大唇厚）、手指变粗，饭量增多。症状逐渐加重，1个月前加重伴全身乏力、头痛。",
            "伴随症状": "伴有全身乏力、头痛。无发热、无呼吸困难，无胸痛。",
            "诊疗经过及结果": "外院门诊行头颅MRI检查，提示垂体增粗。来我院进一步诊治。",
            "一般情况变化": "精神状态欠佳，睡眠欠佳，食欲良好，大便正常，小便正常，体重无明显变化。"
        },
        "既往史": {
            "一般健康状况": "一贯健康",
            "疾病史": "否认高血压、糖尿病、冠心病等慢性病史",
            "传染病史": "否认肝炎、结核等传染病史",
            "预防接种史": "按时接种疫苗",
            "手术外伤史": "否认外伤史，否认手术史",
            "输血史": "否认输血史",
            "过敏史": "无药物、食物过敏史"
        },
        "个人史": {
            "出生地": "丝路市",
            "居留地": "丝路市",
            "生活习惯": "无烟酒嗜好",
            "职业及工作条件": "退休职工，生活规律",
            "接触史": "否认工业毒物、粉尘、放射性物质等接触史",
            "冶游史": "无冶游史"
        },
        "婚育史及家族史": {
            "婚育史": {
                "婚姻状况": "已婚",
                "结婚年龄": "30岁",
                "配偶健康状况": "良好",
                "子女情况": "有一子一女，健康"
            },
            "家族史": "父母及兄弟姐妹无类似疾病及遗传倾向"
        },
        "体格检查": {
            "一般情况": {
                "体温": "36.8℃",
                "脉搏": "78次/分",
                "呼吸": "18次/分",
                "血压": "118/78mmHg"
            },
            "系统检查": {
                "皮肤": "皮肤粗糙，色素沉着",
                "粘膜": "无异状",
                "淋巴结": "未触及肿大淋巴结",
                "头部及器官": "面容改变，额头变大，下颌突出，鼻大唇厚",
                "颈部": "无显著异常",
                "胸部": "胸廓对称，双肺呼吸音清，心律齐",
                "腹部": "腹软，无压痛，肝脾不大",
                "直肠肛门": "未查",
                "外生殖器": "正常",
                "脊柱": "无压痛及畸形",
                "四肢": "手指变粗，肌力、肌张力正常",
                "神经系统": "神志清，言语流利，感觉运动正常，双侧病理征阴性"
            }
        },
        "专科检查": "垂体增粗，面容特殊，手指粗大",
        "辅助检查": "头颅MRI：垂体增粗。",
        "初步诊断": "生长激素腺瘤（GH腺瘤）",
        "诊断依据": "1. 病史：面容改变、手指变粗、饭量增多持续2年，加重1个月，全身乏力，头痛。2. 体格检查：面容改变，手指变粗，皮肤粗糙，色素沉着。3. 影像学检查：头颅MRI提示垂体增粗。",
        "鉴别诊断": "1. 畸形性骨炎：骨吸收及新骨形成过程中的骨组织代谢异常，常见的骨骼畸形特点不同。2. 骨性狮面症：外貌改变主要以面部骨骼增生为主，其他系统症状较少。3. 异位生长激素释放因子综合征：恶性肿瘤附带的内分泌改变，通过相关内分泌水平检测可区别。",
        "入院记录": {
            "医师签名": "张某某"
        },
        "入院后病程记录": {
            "首次病程记录": "入院后行详细病史采集及体格检查，初步诊断为生长激素腺瘤（GH腺瘤）。下一步计划行生化检查确认诊断，并制定治疗计划。",
            "日常病程记录": "患者一般情况稳定，主诉症状较前无明显变化。",
            "上级医师查房记录": "张某某主任：患者生长激素腺瘤，症状符合，需进一步做生化和内分泌检查。",
            "疑难病例讨论记录": "无",
            "交（接）班记录": "病情交接清楚，患者一般情况稳定",
            "转科记录": "无",
            "阶段小结": "患者自入院以来，一般情况稳定，主诉症状基本无变化，初步诊断明确，正待进一步检查。",
            "抢救记录": "无",
            "有创诊疗操作记录": "无",
            "会诊记录": "无",
            "出院记录": "无",
            "病重（病危）患者护理记录": "无"
        },
        "医嘱": {
            "长期医嘱单": "常规监测生命体征，低盐低脂饮食",
            "临时医嘱单": "生化、内分泌检查"
        },
        "辅助检查报告单": "头颅MRI：垂体增粗。",
        "体温单": "体温：36.8℃，脉搏：78次/分，呼吸：18次/分，血压：118/78mmHg",
        "输血治疗知情同意书": "无",
        "特殊检查同意书": "无",
        "病危（重）通知书": "无"
    },
    "病种": {
        "良性、原位及动态未定肿瘤": {
            "名称": "生长激素腺瘤（GH腺瘤）",
            "症状": "分泌生长激素过多。未成年病人可发生生长过速，甚至发育成巨人。成人以后为肢端肥大的表现。如面容改变，额头变大， 下颌突出、鼻大唇厚、手指变粗、穿鞋戴帽觉紧，有的病人并有饭量增多，毛发皮肤粗糙，色素沉着，手指麻木等。重者感全身乏力，头痛关节痛，性功能减退，闭经不育，甚至并发糖尿病。",
            "鉴别诊断": "畸形性骨炎、骨性狮面症、异位生长激素释放因子综合征。"
        }
    },
    "生成文章": "丝路市人民医院\n住院病历\n患者姓名: 苏某某\n性别: 男\n年龄: 63岁\n民族: 汉族\n婚姻状况: 已婚\n职业: 退休职工\n住址: 丝路市翠湖街77号\n入院时间: 8月9日\n记录时间: 8月9日\n病史陈述者: 本人\n医院名称: 丝路市人民医院\n\n主诉: 面容改变、手指变粗、饭量增多持续2年，加重1个月\n\n现病史:\n患者2年前无明显诱因发现面容逐渐改变，具体表现为额头变大，下颌突出、鼻大唇厚、手指变粗，同时自觉饭量增多。未予重视，1个月前症状加重，伴有全身乏力，头痛。\n主要症状特点: 主要表现为面容改变（额头变大，下颌突出、鼻大唇厚）、手指变粗，饭量增多。症状逐渐加重，1个月前加重伴全身乏力、头痛。\n伴随症状: 伴有全身乏力、头痛。无发热、无呼吸困难，无胸痛。\n诊疗经过及结果: 外院门诊行头颅MRI检查，提示垂体增粗。来我院进一步诊治。\n一般情况变化: 精神状态欠佳，睡眠欠佳，食欲良好，大便正常，小便正常，体重无明显变化。\n\n既往史:\n一般健康状况: 一贯健康\n疾病史: 否认高血压、糖尿病、冠心病等慢性病史\n传染病史: 否认肝炎、结核等传染病史\n预防接种史: 按时接种疫苗\n手术外伤史: 否认外伤史，否认手术史\n输血史: 否认输血史\n过敏史: 无药物、食物过敏史\n\n个人史:\n出生地: 丝路市\n居留地: 丝路市\n生活习惯: 无烟酒嗜好\n职业及工作条件: 退休职工，生活规律\n接触史: 否认工业毒物、粉尘、放射性物质等接触史\n冶游史: 无冶游史\n\n婚育史及家族史:\n婚育史:\n - 婚姻状况: 已婚\n - 结婚年龄: 30岁\n - 配偶健康状况: 良好\n - 子女情况: 有一子一女，健康\n家族史: 父母及兄弟姐妹无类似疾病及遗传倾向\n\n体格检查:\n一般情况:\n体温: 36.8℃\n脉搏: 78次/分\n呼吸: 18次/分\n血压: 118/78mmHg\n\n系统检查:\n皮肤: 皮肤粗糙，色素沉着\n粘膜: 无异状\n淋巴结: 未触及肿大淋巴结\n头部及器官: 面容改变，额头变大，下颌突出，鼻大唇厚\n颈部: 无显著异常\n胸部: 胸廓对称，双肺呼吸音清，心律齐\n腹部: 腹软，无压痛，肝脾不大\n直肠肛门: 未查\n外生殖器: 正常\n脊柱: 无压痛及畸形\n四肢: 手指变粗，肌力、肌张力正常\n神经系统: 神志清，言语流利，感觉运动正常，双侧病理征阴性\n\n专科检查: 垂体增粗，面容特殊，手指粗大\n\n辅助检查: 头颅MRI：垂体增粗。\n\n初步诊断: 生长激素腺瘤（GH腺瘤）\n\n诊断依据:\n1. 病史：面容改变、手指变粗、饭量增多持续2年，加重1个月，全身乏力，头痛。\n2. 体格检查：面容改变，手指变粗，皮肤粗糙，色素沉着。\n3. 影像学检查：头颅MRI提示垂体增粗。\n\n鉴别诊断:\n1. 畸形性骨炎：骨吸收及新骨形成过程中的骨组织代谢异常，常见的骨骼畸形特点不同。\n2. 骨性狮面症：外貌改变主要以面部骨骼增生为主，其他系统症状较少。\n3. 异位生长激素释放因子综合征：恶性肿瘤附带的内分泌改变，通过相关内分泌水平检测可区别。\n\n入院记录:\n医师签名: 张某某\n\n入院后病程记录:\n- 首次病程记录: 入院后行详细病史采集及体格检查，初步诊断为生长激素腺瘤（GH腺瘤）。下一步计划行生化检查确认诊断，并制定治疗计划。\n- 日常病程记录: 患者一般情况稳定，主诉症状较前无明显变化。\n- 上级医师查房记录: 张某某主任：患者生长激素腺瘤，症状符合，需进一步做生化和内分泌检查。\n- 疑难病例讨论记录: 无\n- 交（接）班记录: 病情交接清楚，患者一般情况稳定\n- 转科记录: 无\n- 阶段小结: 患者自入院以来，一般情况稳定，主诉症状基本无变化，初步诊断明确，正待进一步检查。\n- 抢救记录: 无\n- 有创诊疗操作记录: 无\n- 会诊记录: 无\n- 出院记录: 无\n- 病重（病危）患者护理记录: 无\n\n医嘱:\n- 长期医嘱单: 常规监测生命体征，低盐低脂饮食\n- 临时医嘱单: 生化、内分泌检查\n\n辅助检查报告单: 头颅MRI：垂体增粗。\n\n体温单: 体温：36.8℃，脉搏：78次/分，呼吸：18次/分，血压：118/78mmHg\n\n输血治疗知情同意书: 无\n\n特殊检查同意书: 无\n\n病危（重）通知书: 无\n\n病种: 良性、原位及动态未定肿瘤\n- 子宫肌瘤:\n  - 症状: 子宫出血、腹部肿块、阴道溢液、压迫症状\n  - 鉴别诊断: 子宫腺肌瘤、卵巢肿瘤、子宫肉瘤、子宫内膜癌、子宫颈癌、盆腔炎性包块、子宫畸形、妊娠子宫。\n- 生长激素腺瘤（GH腺瘤）:\n  - 症状: 分泌生长激素过多。未成年病人可发生生长过速，甚至发育成巨人。成人以后为肢端肥大的表现。如面容改变，额头变大， 下颌突出、鼻大唇厚、手指变粗、穿鞋戴帽觉紧，有的病人并有饭量增多，毛发皮肤粗糙，色素沉着，手指麻木等。重者感全身乏力，头痛关节痛，性功能减退，闭经不育，甚至并发糖尿病。\n  - 鉴别诊断: 畸形性骨炎、骨性狮面症、异位生长激素释放因子综合征。\n\n以上为本次撰写的住院病历，请查收。",
    "qa_fact_based": [
        {
            "问题类型": "事实性问题",
            "问题": "根据丝路市人民医院的住院病历，苏某某的入院时间是什么时候？",
            "答案": "8月9日",
            "ref": [
                "入院时间: 8月9日"
            ]
        },
        {
            "问题类型": "事实性问题",
            "问题": "根据丝路市人民医院的住院病历，苏某某的病史陈述者是谁？",
            "答案": "本人",
            "ref": [
                "病史陈述者: 本人"
            ]
        },
        {
            "问题类型": "事实性问题",
            "问题": "根据丝路市人民医院的住院病历，苏某某的主诉是什么？",
            "答案": "面容改变、手指变粗、饭量增多持续2年，加重1个月",
            "ref": [
                "主诉: 面容改变、手指变粗、饭量增多持续2年，加重1个月"
            ]
        },
        {
            "问题类型": "事实性问题",
            "问题": "根据丝路市人民医院的住院病历，苏某某的初步诊断结果是什么？",
            "答案": "生长激素腺瘤（GH腺瘤）",
            "ref": [
                "初步诊断: 生长激素腺瘤（GH腺瘤）",
                "- 首次病程记录: 入院后行详细病史采集及体格检查，初步诊断为生长激素腺瘤（GH腺瘤）。"
            ]
        }
    ],
    "qa_multi_hop": [
        {
            "问题类型": "多跳推理问题",
            "问题": "根据丝路市人民医院的住院病历，苏某某的诊断依据有几项？",
            "答案": "根据病历，苏某某的诊断依据有3项，分别为病史、体格检查和影像学检查。",
            "ref": [
                "诊断依据:",
                "1. 病史：面容改变、手指变粗、饭量增多持续2年，加重1个月，全身乏力，头痛。",
                "2. 体格检查：面容改变，手指变粗，皮肤粗糙，色素沉着。",
                "3. 影像学检查：头颅MRI提示垂体增粗。"
            ]
        }
    ],
    "qa_summary": [
        {
            "问题类型": "总结性问题",
            "问题": "根据丝路市人民医院的住院病历，总结苏某某的病史。",
            "答案": "苏某某2年前无明显诱因发现面容逐渐改变，具体表现为额头变大，下颌突出、鼻大唇厚、手指变粗，同时自觉饭量增多。未予重视，1个月前症状加重，伴有全身乏力，头痛。外院门诊行头颅MRI检查，提示垂体增粗。来我院进一步诊治。",
            "ref": [
                "患者2年前无明显诱因发现面容逐渐改变，具体表现为额头变大，下颌突出、鼻大唇厚、手指变粗，同时自觉饭量增多。",
                "未予重视，1个月前症状加重，伴有全身乏力，头痛。",
                "诊疗经过及结果: 外院门诊行头颅MRI检查，提示垂体增粗。",
                "来我院进一步诊治。"
            ]
        },
        {
            "问题类型": "总结性问题",
            "问题": "根据丝路市人民医院的住院病历，总结苏某某的诊断情况。",
            "答案": "苏某某的初步诊断为生长激素腺瘤（GH腺瘤），诊断依据为病史、体格检查和影像学检查。病史中，苏某某面容改变、手指变粗、饭量增多持续2年，加重1个月，全身乏力，头痛。体格检查中，面容改变，手指变粗，皮肤粗糙，色素沉着。影像学检查中，头颅MRI提示垂体增粗。",
            "ref": [
                "初步诊断: 生长激素腺瘤（GH腺瘤）",
                "1. 病史：面容改变、手指变粗、饭量增多持续2年，加重1个月，全身乏力，头痛。",
                "2. 体格检查：面容改变，手指变粗，皮肤粗糙，色素沉着。",
                "3. 影像学检查：头颅MRI提示垂体增粗。"
            ]
        },
        {
            "问题类型": "总结性问题",
            "问题": "根据丝路市人民医院的住院病历，总结苏某某的治疗方案。",
            "答案": "苏某某的治疗方案尚未明确，目前医嘱为常规监测生命体征，低盐低脂饮食，以及进行生化、内分泌检查。",
            "ref": [
                "下一步计划行生化检查确认诊断，并制定治疗计划。",
                "医嘱:",
                "- 临时医嘱单: 生化、内分泌检查"
            ]
        }
    ]
}