{
    "Report Type": "Corporate Financial Report",
    "Report Time": "2021",
    "Company Information": {
        "Name": "Acme Government Solutions",
        "Establishment Date": "June 1, 2001",
        "Main Business": "Providing comprehensive government services and solutions",
        "Registration Location": "Washington, D.C.",
        "Listing Status": "Not applicable",
        "Industry": "Government"
    },
    "Report Content": [
        {
            "Type": "Financial Information",
            "Significant Events": [
                {
                    "Event": "Dividend Distribution",
                    "Time": "January, 2021",
                    "Description": "The company decided to distribute $5 million of dividends to shareholders.",
                    "Impact": "Returned to the investors, enhanced shareholder returns.",
                    "Sub Events": [
                        {
                            "Event": "Acquisition of a government contract",
                            "Time": "March, 2021",
                            "Description": "Acme Government Solutions successfully won a major government contract worth $100 million, expanding its service portfolio and increasing revenue potential.",
                            "Impact": "Increased revenue and business opportunities."
                        },
                        {
                            "Event": "Expansion into new geographic markets",
                            "Time": "April, 2021",
                            "Description": "Acme Government Solutions announced plans to establish regional offices in three new states, expanding its presence and market reach.",
                            "Impact": "Increased market share and potential customer base."
                        },
                        {
                            "Event": "Strategic partnership agreement",
                            "Time": "May, 2021",
                            "Description": "Acme Government Solutions forged a strategic partnership with a leading technology firm to jointly develop innovative solutions for government agencies.",
                            "Impact": "Access to advanced technology and expertise, competitive advantage in the market."
                        },
                        {
                            "Event": "Successful completion of a high-profile project",
                            "Time": "June, 2021",
                            "Description": "Acme Government Solutions successfully delivered a complex and high-profile project for a government client, showcasing its capabilities and establishing a reputation for excellence.",
                            "Impact": "Enhanced brand reputation and credibility in the industry."
                        }
                    ]
                },
                {
                    "Event": "Major Asset Acquisition",
                    "Time": "February, 2021",
                    "Description": "The company completed the asset acquisition of Nationwide Security Services, with a total value of $20 million.",
                    "Impact": "Expanded the company's business scope, enhanced market competitiveness."
                },
                {
                    "Event": "Large-scale Financing",
                    "Time": "March, 2021",
                    "Description": "The company conducted a large-scale financing activity, raising $50 million of funds.",
                    "Impact": "Strengthened the company's financial strength, supported expansion and development."
                },
                {
                    "Event": "Significant Equity Acquisition",
                    "Time": "May, 2021",
                    "Description": "The company completed the acquisition of 51% equity of Government IT Solutions.",
                    "Impact": "Further expanded the company's market share, enhanced the company's control."
                },
                {
                    "Event": "Major Investment",
                    "Time": "June, 2021",
                    "Description": "The company invested in Modernizing Public Infrastructure project, with an investment amount of $30 million.",
                    "Impact": "Further broadened the company's business areas, enhanced profitability."
                },
                {
                    "Event": "Debt Restructuring",
                    "Time": "August, 2021",
                    "Description": "To optimize capital structure, the company underwent debt restructuring, reducing liabilities by $15 million.",
                    "Impact": "Improved the company's financial condition, reduced financial costs."
                },
                {
                    "Event": "Asset Restructuring",
                    "Time": "September, 2021",
                    "Description": "The company underwent an asset restructuring, optimizing its business structure.",
                    "Impact": "Improved operational efficiency, increased company value."
                }
            ],
            "Involved Indicators": [
                {
                    "Indicator": "Operating Income",
                    "Description": "The total amount of main business income and other business income within a certain accounting period.",
                    "Influencing Factors": [
                        "Market Demand",
                        "Changes in Product Prices"
                    ],
                    "Value": "$100 million"
                },
                {
                    "Indicator": "Net Profit",
                    "Description": "The net income of the company within a certain accounting period, i.e., total income minus total costs and taxes.",
                    "Influencing Factors": [
                        "Operating Income",
                        "Cost Control",
                        "Non-recurring Gains and Losses"
                    ],
                    "Value": "$20 million"
                },
                {
                    "Indicator": "Total Assets",
                    "Description": "The total amount of assets owned by the company at the end of the accounting period.",
                    "Influencing Factors": [
                        "Asset Acquisition",
                        "Asset Disposal",
                        "Asset Revaluation"
                    ],
                    "Value": "$500 million"
                },
                {
                    "Indicator": "Total Liabilities",
                    "Description": "The total amount of debts the company is obligated to repay at the end of the accounting period.",
                    "Influencing Factors": [
                        "New Debt Issuance",
                        "Debt Repayment",
                        "Debt Restructuring"
                    ],
                    "Value": "$200 million"
                },
                {
                    "Indicator": "Shareholder Equity",
                    "Description": "The total amount of equity belonging to shareholders at the end of the accounting period.",
                    "Influencing Factors": [
                        "Net Profit",
                        "Dividend Distribution",
                        "Capital Reserves"
                    ],
                    "Value": "$300 million"
                },
                {
                    "Indicator": "Cash Flow",
                    "Description": "The total cash inflows and outflows of the company within a certain accounting period.",
                    "Influencing Factors": [
                        "Operating Activities",
                        "Investment Activities",
                        "Financing Activities"
                    ],
                    "Value": "$50 million"
                },
                {
                    "Indicator": "Debt Ratio",
                    "Description": "The ratio of total liabilities to total assets, reflecting the company's debt level.",
                    "Influencing Factors": [
                        "Changes in Total Liabilities",
                        "Changes in Total Assets"
                    ],
                    "Value": "0.4"
                },
                {
                    "Indicator": "Debt to Assets Ratio",
                    "Description": "The percentage of total liabilities to total assets, a measure of the company's financial leverage.",
                    "Influencing Factors": [
                        "Increases or decreases in assets and liabilities"
                    ],
                    "Value": "40%"
                },
                {
                    "Indicator": "Return on Equity",
                    "Description": "Reflects the operational efficiency of shareholder equity, namely the ratio of net profit to average shareholder equity.",
                    "Influencing Factors": [
                        "Change in Net Profit",
                        "Change in Shareholder Equity"
                    ],
                    "Value": "6.67%"
                }
            ]
        }
    ],
    "Additional Information": [
        {
            "Name": "Future Outlook",
            "Content": [
                {
                    "Name": "Financial Strategy",
                    "Description": "The company plans to implement various cost control measures to improve profitability. Additionally, it aims to optimize capital operations to ensure efficient utilization of resources."
                },
                {
                    "Name": "Investment Plans",
                    "Description": "Acme Government Solutions plans to invest heavily in research and development to introduce innovative solutions for public services. It also plans to expand its presence in emerging markets by exploring strategic partnerships."
                },
                {
                    "Name": "Risk Management",
                    "Description": "The major financial risks identified by the company include changes in government policies, economic downturns, and cybersecurity threats. Acme Government Solutions has implemented robust risk management strategies to mitigate these risks and ensure business continuity."
                }
            ]
        }
    ],
    "Generated Outline": "I. Introduction\n    A. Company Information\n        1. Name: Acme Government Solutions\n        2. Establishment Date: June 1, 2001\n        3. Main Business: Providing comprehensive government services and solutions\n        4. Registration Location: Washington, D.C.\n        5. Listing Status: Not applicable\n        6. Industry: Government\n\nII. Financial Information\n    A. Significant Events\n        1. Dividend Distribution (January, 2021)\n            - Description: The company decided to distribute $5 million of dividends to shareholders.\n            - Impact: Returned to the investors, enhanced shareholder returns.\n            - Sub Events:\n                - Acquisition of a government contract (March, 2021)\n                    - Description: Acme Government Solutions successfully won a major government contract worth $100 million, expanding its service portfolio and increasing revenue potential.\n                    - Impact: Increased revenue and business opportunities.\n                - Expansion into new geographic markets (April, 2021)\n                    - Description: Acme Government Solutions announced plans to establish regional offices in three new states, expanding its presence and market reach.\n                    - Impact: Increased market share and potential customer base.\n                - Strategic partnership agreement (May, 2021)\n                    - Description: Acme Government Solutions forged a strategic partnership with a leading technology firm to jointly develop innovative solutions for government agencies.\n                    - Impact: Access to advanced technology and expertise, competitive advantage in the market.\n                - Successful completion of a high-profile project (June, 2021)\n                    - Description: Acme Government Solutions successfully delivered a complex and high-profile project for a government client, showcasing its capabilities and establishing a reputation for excellence.\n                    - Impact: Enhanced brand reputation and credibility in the industry.\n                \n        2. Major Asset Acquisition (February, 2021)\n            - Description: The company completed the asset acquisition of Nationwide Security Services, with a total value of $20 million.\n            - Impact: Expanded the company's business scope, enhanced market competitiveness.\n            \n        3. Large-scale Financing (March, 2021)\n            - Description: The company conducted a large-scale financing activity, raising $50 million of funds.\n            - Impact: Strengthened the company's financial strength, supported expansion and development.\n            \n        4. Significant Equity Acquisition (May, 2021)\n            - Description: The company completed the acquisition of 51% equity of Government IT Solutions.\n            - Impact: Further expanded the company's market share, enhanced the company's control.\n            \n        5. Major Investment (June, 2021)\n            - Description: The company invested in Modernizing Public Infrastructure project, with an investment amount of $30 million.\n            - Impact: Further broadened the company's business areas, enhanced profitability.\n            \n        6. Debt Restructuring (August, 2021)\n            - Description: To optimize capital structure, the company underwent debt restructuring, reducing liabilities by $15 million.\n            - Impact: Improved the company's financial condition, reduced financial costs.\n            \n        7. Asset Restructuring (September, 2021)\n            - Description: The company underwent an asset restructuring, optimizing its business structure.\n            - Impact: Improved operational efficiency, increased company value.\n            \n    B. Involved Indicators\n        1. Operating Income ($100 million)\n            - Description: The total amount of main business income and other business income within a certain accounting period.\n            - Influencing Factors:\n                - Market Demand\n                - Changes in Product Prices\n                \n        2. Net Profit ($20 million)\n            - Description: The net income of the company within a certain accounting period, i.e., total income minus total costs and taxes.\n            - Influencing Factors:\n                - Operating Income\n                - Cost Control\n                - Non-recurring Gains and Losses\n                \n        3. Total Assets ($500 million)\n            - Description: The total amount of assets owned by the company at the end of the accounting period.\n            - Influencing Factors:\n                - Asset Acquisition\n                - Asset Disposal\n                - Asset Revaluation\n                \n        4. Total Liabilities ($200 million)\n            - Description: The total amount of debts the company is obligated to repay at the end of the accounting period.\n            - Influencing Factors:\n                - New Debt Issuance\n                - Debt Repayment\n                - Debt Restructuring\n                \n        5. Shareholder Equity ($300 million)\n            - Description: The total amount of equity belonging to shareholders at the end of the accounting period.\n            - Influencing Factors:\n                - Net Profit\n                - Dividend Distribution\n                - Capital Reserves\n                \n        6. Cash Flow ($50 million)\n            - Description: The total cash inflows and outflows of the company within a certain accounting period.\n            - Influencing Factors:\n                - Operating Activities\n                - Investment Activities\n                - Financing Activities\n                \n        7. Debt Ratio (0.4)\n            - Description: The ratio of total liabilities to total assets, reflecting the company's debt level.\n            - Influencing Factors:\n                - Changes in Total Liabilities\n                - Changes in Total Assets\n                \n        8. Debt to Assets Ratio (40%)\n            - Description: The percentage of total liabilities to total assets, a measure of the company's financial leverage.\n            - Influencing Factors:\n                - Increases or decreases in assets and liabilities\n                \n        9. Return on Equity (6.67%)\n            - Description: Reflects the operational efficiency of shareholder equity, namely the ratio of net profit to average shareholder equity.\n            - Influencing Factors:\n                - Change in Net Profit\n                - Change in Shareholder Equity\n\nIII. Additional Information\n    A. Future Outlook\n        1. Financial Strategy\n            - Description: The company plans to implement various cost control measures to improve profitability. Additionally, it aims to optimize capital operations to ensure efficient utilization of resources.\n            \n        2. Investment Plans\n            - Description: Acme Government Solutions plans to invest heavily in research and development to introduce innovative solutions for public services. It also plans to expand its presence in emerging markets by exploring strategic partnerships.\n            \n        3. Risk Management\n            - Description: The major financial risks identified by the company include changes in government policies, economic downturns, and cybersecurity threats. Acme Government Solutions has implemented robust risk management strategies to mitigate these risks and ensure business continuity.",
    "Generated Summary": "Acme Government Solutions is a government industry company established on June 1, 2001 in Washington, D.C., specializing in providing comprehensive government services and solutions.",
    "Generated Article": "In January 2021, Acme Government Solutions made a significant decision to distribute $5 million of dividends to its shareholders. This move not only enhanced shareholder returns but also showcased the company's commitment to rewarding its investors. This dividend distribution was a result of the company's successful acquisition of a major government contract worth $100 million in March 2021. This acquisition expanded Acme Government Solutions' service portfolio and increased its revenue potential. Furthermore, in April 2021, the company announced plans to establish regional offices in three new states, thereby expanding its presence and market reach. This strategic move allowed Acme Government Solutions to tap into new geographic markets, increasing its market share and potential customer base.\n\nIn May 2021, Acme Government Solutions forged a strategic partnership with a leading technology firm. This partnership aimed to jointly develop innovative solutions for government agencies, providing Acme Government Solutions with access to advanced technology and expertise. This strategic collaboration also gave the company a competitive advantage in the market. Additionally, in June 2021, Acme Government Solutions successfully completed a high-profile project for a government client, showcasing its capabilities and establishing a reputation for excellence. This successful project delivery further enhanced the company's brand reputation and credibility in the industry.\n\nIn February 2021, Acme Government Solutions completed the asset acquisition of Nationwide Security Services, with a total value of $20 million. This acquisition expanded the company's business scope and enhanced its market competitiveness. To support its expansion and development, the company conducted a large-scale financing activity in March 2021, raising $50 million of funds. This significant financial boost strengthened Acme Government Solutions' financial strength and provided the necessary resources for its growth plans.\n\nIn May 2021, the company further expanded its market share by completing the acquisition of 51% equity of Government IT Solutions. This acquisition not only increased Acme Government Solutions' control but also broadened its business areas, enhancing its profitability. Moreover, in June 2021, the company invested $30 million in the Modernizing Public Infrastructure project. This strategic investment allowed Acme Government Solutions to diversify its business areas and further capitalize on emerging opportunities.\n\nTo optimize its capital structure, Acme Government Solutions underwent debt restructuring in August 2021, reducing its liabilities by $15 million. This move improved the company's financial condition and reduced its financial costs. In September 2021, the company underwent an asset restructuring, optimizing its business structure. This restructuring initiative aimed to improve operational efficiency and increase the company's overall value.\n\nThese significant events have had a direct impact on Acme Government Solutions' financial indicators. The company's operating income reached $100 million, driven by increased market demand and changes in product prices. This strong operating income contributed to a net profit of $20 million, reflecting effective cost control measures and non-recurring gains and losses. Acme Government Solutions' total assets stood at $500 million, primarily influenced by asset acquisitions, disposals, and revaluations. The company's total liabilities amounted to $200 million, influenced by new debt issuances, debt repayments, and debt restructuring activities.\n\nShareholder equity, on the other hand, reached $300 million, driven by the company's net profit, dividend distributions, and capital reserves. Acme Government Solutions' cash flow amounted to $50 million, reflecting the company's efficient management of operating, investment, and financing activities. The company's debt ratio stood at 0.4, indicating a moderate level of debt, while the debt to assets ratio was 40%, highlighting the company's financial leverage. Finally, the return on equity was 6.67%, reflecting the operational efficiency of shareholder equity.\n\nLooking ahead, Acme Government Solutions has outlined its future outlook. The company plans to implement various cost control measures to improve profitability and optimize capital operations to ensure efficient resource utilization. Additionally, Acme Government Solutions intends to invest heavily in research and development to introduce innovative solutions for public services. The company also aims to expand its presence in emerging markets through strategic partnerships. To mitigate financial risks, Acme Government Solutions has implemented robust risk management strategies, considering factors such as changes in government policies, economic downturns, and cybersecurity threats. These strategies ensure the company's business continuity and long-term success in the government industry."
}