{
    "Hospitalization Record": {
        "Basic Information": {
            "Name": "J. Rodriguez",
            "Gender": "female",
            "Age": "7",
            "Ethnicity": "Hispanic",
            "Marital Status": "Single",
            "Occupation": "Student",
            "Address": "52, Brighton street, Granville",
            "Admission Time": "26th, February",
            "Record Time": "26th, February",
            "Historian": "Mother: Maria Rodriguez",
            "Hospital Name": "Granville General Hospital"
        },
        "Chief Complaint": "Local redness, swelling, heat, and pain on the right forearm for 3 days.",
        "Present Illness": {
            "Onset": "3 days ago, at home, suddenly noticed by mother",
            "Main Symptoms": "Localized redness, swelling, heat, and pain on the right forearm. The symptoms have progressively worsened over the last 3 days.",
            "Accompanying Symptoms": "No fever, no systemic symptoms",
            "Diagnosis and Treatment History": "Seen by a local physician, prescribed topical antibiotic ointment with no significant relief",
            "General Condition Changes": "Mental state normal, no changes in sleep, appetite good, normal urination and defecation, no weight change"
        },
        "Past History": {
            "General Health Condition": "Good",
            "Disease History": "None",
            "Infectious Disease History": "None",
            "Immunization History": "Up-to-date with vaccination schedule",
            "Surgery and Trauma History": "None",
            "Blood Transfusion History": "None",
            "Allergy History": "No known allergies"
        },
        "Personal History": {
            "Birthplace": "Granville",
            "Residence": "Granville",
            "Living Habits": "Regular attendance at school, balanced diet",
            "Occupation and Working Conditions": "Student, no exposure to industrial toxins or hazardous working conditions",
            "Exposure History": "No exposure to industrial toxins, dust, radioactive substances",
            "Travel History": "No significant travel history"
        },
        "Marital and Family History": {
            "Marital History": {
                "Marital Status": "Single",
                "Marriage Age": "",
                "Spouse's Health Condition": "",
                "Children's Condition": ""
            },
            "Menstrual History": {
                "Menarche Age": "",
                "Menstruation Duration": "",
                "Menstruation Interval": "",
                "Last Menstruation": "",
                "Menstrual Volume": "",
                "Dysmenorrhea": ""
            },
            "Family History": "Father (healthy), Mother (healthy), no siblings, no known family history of skin infections or genetic disorders"
        },
        "Physical Examination": {
            "General Condition": {
                "Temperature": "37°C",
                "Pulse": "90 bpm",
                "Respiration": "20 breaths/min",
                "Blood Pressure": "100/60 mmHg"
            },
            "Systematic Examination": {
                "Skin": "Erythema, heat, swelling, and tenderness over the right forearm, approximately 2 cm diameter",
                "Mucous Membranes": "Normal",
                "Lymph Nodes": "Non-palpable",
                "Head and Organs": "Normal",
                "Neck": "Supple, no masses",
                "Chest": "No abnormalities in thorax, lungs clear, heart sounds normal, no murmurs",
                "Abdomen": "Soft, non-tender, no hepatosplenomegaly",
                "Rectum and Anus": "Not examined",
                "External Genitalia": "Normal",
                "Spine": "Normal",
                "Limbs": "Normal mobility, aside from affected right forearm",
                "Nervous System": "Intact, no focal neurological deficits"
            }
        },
        "Specialist Examination": "Dermatology consultation advised",
        "Auxiliary Examination": "Complete Blood Count (CBC) showed mild leukocytosis, no other significant findings",
        "Preliminary Diagnosis": "Furuncle of the right forearm",
        "Diagnostic Basis": "Based on clinical presentation, presence of localized infection, erythema, and tenderness, supported by CBC findings",
        "Differential Diagnosis": "Carbuncle (no multiple purulent plugs seen), Folliculitis (lacks purulent plugs), Infected sebaceous cyst (more deeply located), Acne with mild infection (presenting differently)",
        "Admission Records": {
            "Physician's Signature": "Dr. William Hughes"
        },
        "Post-Admission Course Records": {
            "First Course Record": "Furuncle diagnosed based on clinical presentation. Plan: Topical and systemic antibiotics, warm compresses, and pain management. Monitor progress over the next 24 hours.",
            "Daily Course Records": "Day 1: Slight reduction in swelling, patient reports less pain. Continue current plan.",
            "Senior Physician Rounds Records": "Day 2: Reviewed by Dr. Smith. Noted mild improvement, continue current therapy, plan for reassessment in 24 hours.",
            "Difficult Case Discussion Records": "",
            "Handover Records": "Patient improving, continue with current management, reassess in rounds tomorrow.",
            "Transfer Records": "",
            "Stage Summary": "Not applicable, early in treatment phase",
            "Emergency Records": "None",
            "Invasive Procedure Records": "None",
            "Consultation Records": "Dermatology consult on Day 2, confirmed furuncle diagnosis",
            "Discharge Records": "",
            "Critically Ill Patient Care Records": ""
        },
        "Medical Orders": {
            "Long-term Orders": "Topical antibiotics (Mupirocin ointment) applied to affected area twice daily; Oral antibiotics (Cephalexin 250 mg) three times daily for 7 days",
            "Temporary Orders": "Warm compresses applied to the affected area for 15 minutes, four times daily; Acetaminophen 10 mg/kg for pain as needed"
        },
        "Auxiliary Examination Reports": "Complete Blood Count (CBC): mild leukocytosis",
        "Temperature Chart": "37°C, Pulse: 90 bpm, Respiration: 20 breaths/min, BP: 100/60 mmHg on admission",
        "Blood Transfusion Consent": "Not applicable",
        "Special Examination Consent": "",
        "Critical Condition Notice": ""
    },
    "DiseaseType": {
        "Diseases of the Skin and Subcutaneous Tissue": {
            "Name": "Furuncle",
            "Symptoms": "Superficial skin infection by fire poison, local redness, swelling, heat, and pain, acute suppuration",
            "Differential Diagnosis": "Carbuncle (with multiple honeycomb-like purulent plugs on the surface), folliculitis (similar to a furuncle but without purulent plugs), infected sebaceous cyst, acne with mild infection"
        }
    },
    "Generated Article": "Hospitalization Record:\n  \nBasic Information:\nName: J. Rodriguez\nGender: female\nAge: 7\nEthnicity: Hispanic\nMarital Status: Single\nOccupation: Student\nAddress: 52, Brighton street, Granville\nAdmission Time: 26th, February\nRecord Time: 26th, February\nHistorian: Mother: Maria Rodriguez\nHospital Name: Granville General Hospital\n\nChief Complaint: Local redness, swelling, heat, and pain on the right forearm for 3 days.\n\nPresent Illness:\nOnset: 3 days ago, at home, suddenly noticed by mother\nMain Symptoms: Localized redness, swelling, heat, and pain on the right forearm. The symptoms have progressively worsened over the last 3 days.\nAccompanying Symptoms: No fever, no systemic symptoms\nDiagnosis and Treatment History: Seen by a local physician, prescribed topical antibiotic ointment with no significant relief\nGeneral Condition Changes: Mental state normal, no changes in sleep, appetite good, normal urination and defecation, no weight change\n\nPast History:\nGeneral Health Condition: Good\nDisease History: None\nInfectious Disease History: None\nImmunization History: Up-to-date with vaccination schedule\nSurgery and Trauma History: None\nBlood Transfusion History: None\nAllergy History: No known allergies\n\nPersonal History:\nBirthplace: Granville\nResidence: Granville\nLiving Habits: Regular attendance at school, balanced diet\nOccupation and Working Conditions: Student, no exposure to industrial toxins or hazardous working conditions\nExposure History: No exposure to industrial toxins, dust, radioactive substances\nTravel History: No significant travel history\n\nMarital and Family History:\nMarital History:\nMarital Status: Single\nMarriage Age: \nSpouse's Health Condition: \nChildren's Condition: \nMenstrual History:\nMenarche Age: \nMenstruation Duration: \nMenstruation Interval: \nLast Menstruation: \nMenstrual Volume: \nDysmenorrhea: \nFamily History: Father (healthy), Mother (healthy), no siblings, no known family history of skin infections or genetic disorders\n\nPhysical Examination:\nGeneral Condition:\nTemperature: 37°C\nPulse: 90 bpm\nRespiration: 20 breaths/min\nBlood Pressure: 100/60 mmHg\n\nSystematic Examination:\nSkin: Erythema, heat, swelling, and tenderness over the right forearm, approximately 2 cm in diameter\nMucous Membranes: Normal\nLymph Nodes: Non-palpable\nHead and Organs: Normal\nNeck: Supple, no masses\nChest: No abnormalities in thorax, lungs clear, heart sounds normal, no murmurs\nAbdomen: Soft, non-tender, no hepatosplenomegaly\nRectum and Anus: Not examined\nExternal Genitalia: Normal\nSpine: Normal\nLimbs: Normal mobility, aside from affected right forearm\nNervous System: Intact, no focal neurological deficits\n\nSpecialist Examination: Dermatology consultation advised\n\nAuxiliary Examination: Complete Blood Count (CBC) showed mild leukocytosis, no other significant findings\n\nPreliminary Diagnosis: Furuncle of the right forearm\n\nDiagnostic Basis: Based on clinical presentation, presence of localized infection, erythema, and tenderness, supported by CBC findings\n\nDifferential Diagnosis: Carbuncle (no multiple purulent plugs seen), Folliculitis (lacks purulent plugs), Infected sebaceous cyst (more deeply located), Acne with mild infection (presenting differently)\n\nAdmission Records:\nPhysician's Signature: Dr. William Hughes\n\nPost-Admission Course Records:\nFirst Course Record: Furuncle diagnosed based on the clinical presentation. Plan: Topical and systemic antibiotics, warm compresses, and pain management. Monitor progress over the next 24 hours.\nDaily Course Records: Day 1: Slight reduction in swelling, patient reports less pain. Continue current plan.\nSenior Physician Rounds Records: Day 2: Reviewed by Dr. Smith. Noted mild improvement, continue current therapy, plan for reassessment in 24 hours.\nDifficult Case Discussion Records: \nHandover Records: Patient improving, continue with current management, reassess in rounds tomorrow.\nTransfer Records: \nStage Summary: Not applicable, early in treatment phase\nEmergency Records: None\nInvasive Procedure Records: None\nConsultation Records: Dermatology consult on Day 2, confirmed furuncle diagnosis\nDischarge Records: \nCritically Ill Patient Care Records:\n\nMedical Orders:\nLong-term Orders: Topical antibiotics (Mupirocin ointment) applied to affected area twice daily; Oral antibiotics (Cephalexin 250 mg) three times daily for 7 days\nTemporary Orders: Warm compresses applied to the affected area for 15 minutes, four times daily; Acetaminophen 10 mg/kg for pain as needed\n\nAuxiliary Examination Reports: Complete Blood Count (CBC): mild leukocytosis\n\nTemperature Chart: 37°C, Pulse: 90 bpm, Respiration: 20 breaths/min, BP: 100/60 mmHg on admission\n\nBlood Transfusion Consent: Not applicable\n\nSpecial Examination Consent:\n\nCritical Condition Notice:\n",
    "qa_fact_based": [
        {
            "question type": "Factual Question",
            "question": "According to the hospitalization records of Granville General Hospital, what is J. Rodriguez's initial diagnosis?",
            "answer": "Furuncle of the right forearm.",
            "ref": [
                "Preliminary Diagnosis: Furuncle of the right forearm",
                "First Course Record: Furuncle diagnosed based on the clinical presentation."
            ]
        },
        {
            "question type": "Factual Question",
            "question": "According to the hospitalization records of Granville General Hospital, what is J. Rodriguez's age?",
            "answer": "7 years old.",
            "ref": [
                "Age: 7"
            ]
        },
        {
            "question type": "Factual Question",
            "question": "According to the hospitalization records of Granville General Hospital, what is the patient's chief complaint?",
            "answer": "Local redness, swelling, heat, and pain on the right forearm for 3 days.",
            "ref": [
                "Chief Complaint: Local redness, swelling, heat, and pain on the right forearm for 3 days."
            ]
        },
        {
            "question type": "Factual Question",
            "question": "According to the hospitalization records of Granville General Hospital, who is the historian for J. Rodriguez?",
            "answer": "Mother: Maria Rodriguez.",
            "ref": [
                "Historian: Mother: Maria Rodriguez"
            ]
        }
    ],
    "qa_multi_hop": [
        {
            "question type": "Multi-hop Reasoning Question",
            "question": "According to the hospitalization records of Granville General Hospital, how many diagnostic bases were used to diagnose J. Rodriguez's condition?",
            "answer": "According to the records, three diagnostic bases were used to diagnose J. Rodriguez's condition: clinical presentation, presence of localized infection, and CBC findings.",
            "ref": [
                "Diagnostic Basis: Based on clinical presentation, presence of localized infection, erythema, and tenderness, supported by CBC findings"
            ]
        },
        {
            "question type": "Multi-hop Reasoning Question",
            "question": "According to the hospitalization records of Granville General Hospital, how many auxiliary examinations did J. Rodriguez undergo?",
            "answer": "According to the records, J. Rodriguez underwent one auxiliary examination, which was a Complete Blood Count (CBC) that showed mild leukocytosis.",
            "ref": [
                "Auxiliary Examination: Complete Blood Count (CBC) showed mild leukocytosis, no other significant findings",
                "Auxiliary Examination Reports: Complete Blood Count (CBC): mild leukocytosis"
            ]
        }
    ],
    "qa_summary": [
        {
            "question type": "Summarization Question",
            "question": "According to the hospitalization records of Granville General Hospital, summarize the present illness of J. Rodriguez.",
            "answer": "The present illness of J. Rodriguez began 3 days ago at home, suddenly noticed by her mother. The main symptoms are localized redness, swelling, heat, and pain on the right forearm, which have progressively worsened over the last 3 days. There are no accompanying symptoms such as fever or systemic symptoms. She was seen by a local physician and prescribed topical antibiotic ointment with no significant relief. Her general condition remains normal with a good mental state, normal sleep, good appetite, normal urination and defecation, and no weight change.",
            "ref": [
                "Present Illness:",
                "Onset: 3 days ago, at home, suddenly noticed by mother",
                "Main Symptoms: Localized redness, swelling, heat, and pain on the right forearm.",
                "The symptoms have progressively worsened over the last 3 days.",
                "Accompanying Symptoms: No fever, no systemic symptoms",
                "Diagnosis and Treatment History: Seen by a local physician, prescribed topical antibiotic ointment with no significant relief",
                "General Condition Changes: Mental state normal, no changes in sleep, appetite good, normal urination and defecation, no weight change"
            ]
        },
        {
            "question type": "Summarization Question",
            "question": "According to the hospitalization records of Granville General Hospital, summarize the past medical history of J. Rodriguez.",
            "answer": "J. Rodriguez has a good general health condition with no history of diseases, infectious diseases, surgeries, trauma, or blood transfusions. She is up-to-date with her vaccination schedule and has no known allergies.",
            "ref": [
                "Past History:",
                "General Health Condition: Good",
                "Disease History: None",
                "Infectious Disease History: None",
                "Immunization History: Up-to-date with vaccination schedule",
                "Surgery and Trauma History: None",
                "Blood Transfusion History: None",
                "Allergy History: No known allergies"
            ]
        },
        {
            "question type": "Summarization Question",
            "question": "According to the hospitalization records of Granville General Hospital, summarize the physical examination findings of J. Rodriguez.",
            "answer": "The physical examination of J. Rodriguez revealed a temperature of 37°C, pulse of 90 bpm, respiration of 20 breaths/min, and blood pressure of 100/60 mmHg. Systematic examination showed erythema, heat, swelling, and tenderness over the right forearm (approximately 2 cm in diameter). Other findings were normal, including mucous membranes, lymph nodes, head and organs, neck, chest, abdomen, external genitalia, spine, and limbs (except the affected right forearm). The nervous system was intact with no focal neurological deficits.",
            "ref": [
                "Physical Examination:",
                "General Condition:",
                "Temperature: 37°C",
                "Pulse: 90 bpm",
                "Respiration: 20 breaths/min",
                "Blood Pressure: 100/60 mmHg",
                "Systematic Examination:",
                "Skin: Erythema, heat, swelling, and tenderness over the right forearm, approximately 2 cm in diameter",
                "Mucous Membranes: Normal",
                "Lymph Nodes: Non-palpable",
                "Head and Organs: Normal",
                "Neck: Supple, no masses",
                "Chest: No abnormalities in thorax, lungs clear, heart sounds normal, no murmurs",
                "Abdomen: Soft, non-tender, no hepatosplenomegaly",
                "External Genitalia: Normal",
                "Spine: Normal",
                "Limbs: Normal mobility, aside from affected right forearm",
                "Nervous System: Intact, no focal neurological deficits"
            ]
        }
    ]
}