{
    "Report Type": "Corporate Governance Report",
    "Report Time": "2019",
    "Company Information": {
        "Name": "Artistic Creations Inc.",
        "Establishment Date": "March 15, 2005",
        "Main Business": "Art gallery and exhibitions",
        "Registration Location": "New York, United States",
        "Listing Status": "Publicly traded on NYSE",
        "Industry": "Culture"
    },
    "Report Content": [
        {
            "Type": "Governance Structure",
            "Significant Events": [
                {
                    "Event": "Compliance and Regulatory Updates",
                    "Time": "January, 2019",
                    "Description": "Updates to new regulations or compliance standards affecting corporate governance practices, including changes in securities law, corporate law, or specific industry regulations.",
                    "Impact": "Ensures compliance with the latest laws and regulations, reducing legal risk, protecting the company and shareholder interests.",
                    "Sub Events": [
                        {
                            "Event": "Compliance and Regulatory Updates",
                            "Time": "January, 2019",
                            "Description": "Updates to new regulations or compliance standards affecting corporate governance practices, including changes in securities law, corporate law, or specific industry regulations.",
                            "Impact": "Ensures compliance with the latest laws and regulations, reducing legal risk, protecting the company and shareholder interests."
                        },
                        {
                            "Event": "Internal Audit Enhancement",
                            "Time": "February, 2019",
                            "Description": "Artistic Creations Inc. undertook an internal audit enhancement initiative to strengthen its internal control system and improve financial reporting accuracy.",
                            "Impact": "Enhanced internal controls promote transparency and provide assurance to shareholders and investors about the accuracy of financial information."
                        },
                        {
                            "Event": "Appointment of External Auditor",
                            "Time": "March, 2019",
                            "Description": "Artistic Creations Inc. appointed a reputable external auditor to conduct an independent audit and financial review of the company's operations and financial statements.",
                            "Impact": "Increases credibility and transparency of the company's financial reporting, instilling confidence in stakeholders."
                        },
                        {
                            "Event": "Revision of Corporate Governance Bylaws",
                            "Time": "April, 2019",
                            "Description": "Artistic Creations Inc. undertook a comprehensive review of its corporate governance bylaws to align them with the latest industry best practices and regulatory requirements.",
                            "Impact": "Strengthens corporate governance practices, ensuring the company operates with integrity and in compliance with applicable laws and regulations."
                        },
                        {
                            "Event": "Board of Directors' Training Program",
                            "Time": "June, 2019",
                            "Description": "A board of directors' training program was conducted for Artistic Creations Inc.'s directors, focusing on their roles, responsibilities, and the latest developments in corporate governance.",
                            "Impact": "Enhances the directors' understanding of corporate governance standards and best practices, enabling them to make informed decisions in the best interest of the company and its shareholders."
                        },
                        {
                            "Event": "Establishment of Whistleblower Hotline",
                            "Time": "August, 2019",
                            "Description": "Artistic Creations Inc. established a whistleblower hotline to provide a confidential and secure channel for employees and stakeholders to report any suspected fraudulent activities or misconduct.",
                            "Impact": "Promotes a culture of accountability and transparency, discouraging unethical behavior and ensuring prompt identification and mitigation of any potential issues."
                        }
                    ]
                },
                {
                    "Event": "Senior Management Changes",
                    "Time": "March, 2019",
                    "Description": "Changes in the company’s senior management, including the CEO or other key positions, and its impact on the company's operational focus and priorities.",
                    "Impact": "May lead to adjustments in operational focus and strategic priorities, affecting short-term performance and long-term development."
                },
                {
                    "Event": "Corporate Governance Policy Revision",
                    "Time": "April, 2019",
                    "Description": "Revision of the corporate governance framework or policies to enhance transparency, accountability, or stakeholder engagement.",
                    "Impact": "Enhances corporate governance transparency and accountability, boosting stakeholder confidence."
                },
                {
                    "Event": "Ethics and Integrity Incidents",
                    "Time": "May, 2019",
                    "Description": "Significant ethical or integrity violations, such as fraud, corruption, or conflicts of interest, and the measures taken by the company in response.",
                    "Impact": "May damage the company's reputation and brand value, affecting relationships with investors, customers, and partners."
                },
                {
                    "Event": "Sustainability and Social Responsibility Initiatives",
                    "Time": "June, 2019",
                    "Description": "Significant progress in sustainability, environmental protection, social responsibility, and corporate citizenship.",
                    "Impact": "Enhances the company’s public image and market competitiveness, promoting long-term sustainable development."
                },
                {
                    "Event": "Shareholders' Meeting Resolution",
                    "Time": "July, 2019",
                    "Description": "Key decisions made at the annual or extraordinary shareholders’ meeting, including changes to the company’s charter, major corporate actions, and voting results.",
                    "Impact": "Directly affects the company’s governance structure, future operational strategies, and shareholder rights."
                },
                {
                    "Event": "Acquisition of Rare Art Collection",
                    "Time": "August, 2019",
                    "Description": "Artistic Creations Inc. successfully acquired a rare and highly valuable art collection featuring works from renowned artists.",
                    "Impact": "Strengthens the company's collection and artist roster, attracting more art enthusiasts and raising the company's prestige in the industry."
                },
                {
                    "Event": "Risk Management Measures",
                    "Time": "September, 2019",
                    "Description": "Updates to the company's risk management framework, including identification of new risks and implementation of mitigation strategies.",
                    "Impact": "Improves the company’s ability to respond to internal and external risks, ensuring continuous operation and stable development."
                },
                {
                    "Event": "Board of Directors Change",
                    "Time": "October, 2019",
                    "Description": "The appointment or resignation of board members, and its impact on the company's strategic direction.",
                    "Impact": "May lead to strategic adjustments, affecting the company’s long-term development direction and shareholder interests."
                },
                {
                    "Event": "Expansion of International Partnerships",
                    "Time": "November, 2019",
                    "Description": "Artistic Creations Inc. formed strategic partnerships with prominent international art galleries in order to expand its global reach and influence.",
                    "Impact": "Opens up new markets for the company, potentially increasing revenue and attracting a broader customer base from different countries."
                }
            ],
            "Involved Indicators": [
                {
                    "Indicator": "Information Disclosure",
                    "Description": "Principles, methods, and implementation status of company information disclosure.",
                    "Value": "Artistic Creations Inc. has a robust information disclosure system compliant with SEC regulations, ensuring timely and accurate dissemination of financial information, major announcements, and pertinent details."
                },
                {
                    "Indicator": "Related Transactions",
                    "Description": "Policies, procedures, and measures to ensure fairness and compliance of related transactions.",
                    "Value": "Artistic Creations Inc. strictly follows a comprehensive set of policies and procedures to ensure fairness and transparency in all related transactions. The company maintains thorough documentation and conducts regular internal audits to demonstrate compliance."
                },
                {
                    "Indicator": "Internal Control",
                    "Description": "Architecture, implementation, and effectiveness assessment of internal controls.",
                    "Value": "Artistic Creations Inc. has a sound internal control system in place, covering all significant aspects of its operations. The system is regularly reviewed and assessed to ensure its effectiveness in preventing and detecting irregularities, fraud, and other risks."
                }
            ]
        }
    ],
    "Additional Information": [
        {
            "Name": "Governance Improvement Plans",
            "Content": [
                {
                    "Name": "Strengthening the Function of the Board of Directors and Supervisory Board",
                    "Description": "Artistic Creations Inc. plans to enhance the efficiency and effectiveness of the board of directors and supervisory board. This includes providing regular training to board members, increasing the proportion of independent directors, and optimizing decision-making processes to better align with the company's long-term vision and goals."
                },
                {
                    "Name": "Enhancing Transparency and Quality of Information Disclosure",
                    "Description": "Artistic Creations Inc. recognizes the importance of transparent and high-quality information disclosure. As part of its improvement plans, the company aims to refine its information disclosure process and standards. This will ensure that all stakeholders receive timely, accurate, and comprehensive information, ultimately fostering greater trust and confidence in the company."
                }
            ]
        },
        {
            "Name": "Risk Management Strategy",
            "Content": [
                {
                    "Name": "Strengthening the Internal Control System",
                    "Description": "Artistic Creations Inc. is committed to establishing and improving its internal control system to identify, assess, monitor, and report financial and operational risks. By enhancing the company's ability to withstand risks, the strengthened internal control system will safeguard the interests of shareholders and other stakeholders."
                },
                {
                    "Name": "Integrating Sustainable Development and Social Responsibility",
                    "Description": "Artistic Creations Inc. recognizes the significance of sustainable development and social responsibility. The company intends to integrate these principles into its overall strategy, identify related risks and opportunities, and actively engage in initiatives that promote long-term value creation. By doing so, Artistic Creations Inc. seeks to reinforce its commitment to responsible corporate citizenship."
                }
            ]
        }
    ],
    "Generated Outline": "I. Introduction\n    A. Report Type: Corporate Governance Report\n    B. Report Time: 2019\n    C. Company Information:\n        1. Name: Artistic Creations Inc. [Establishment Date: March 15, 2005]\n        2. Main Business: Art gallery and exhibitions\n        3. Registration Location: New York, United States\n        4. Listing Status: Publicly traded on NYSE\n        5. Industry: Culture\n\nII. Governance Structure\n    A. Compliance and Regulatory Updates\n        1. Event: Compliance and Regulatory Updates (January, 2019)\n            a. Description: Updates to new regulations or compliance standards affecting corporate governance practices, including changes in securities law, corporate law, or specific industry regulations.\n            b. Impact: Ensures compliance with the latest laws and regulations, reducing legal risk, protecting the company and shareholder interests.\n        2. Event: Internal Audit Enhancement (February, 2019)\n            a. Description: Artistic Creations Inc. undertook an internal audit enhancement initiative to strengthen its internal control system and improve financial reporting accuracy.\n            b. Impact: Enhanced internal controls promote transparency and provide assurance to shareholders and investors about the accuracy of financial information.\n        3. Event: Appointment of External Auditor (March, 2019)\n            a. Description: Artistic Creations Inc. appointed a reputable external auditor to conduct an independent audit and financial review of the company's operations and financial statements.\n            b. Impact: Increases credibility and transparency of the company's financial reporting, instilling confidence in stakeholders.\n        4. Event: Revision of Corporate Governance Bylaws (April, 2019)\n            a. Description: Artistic Creations Inc. undertook a comprehensive review of its corporate governance bylaws to align them with the latest industry best practices and regulatory requirements.\n            b. Impact: Strengthens corporate governance practices, ensuring the company operates with integrity and in compliance with applicable laws and regulations.\n        5. Event: Board of Directors' Training Program (June, 2019)\n            a. Description: A board of directors' training program was conducted for Artistic Creations Inc.'s directors, focusing on their roles, responsibilities, and the latest developments in corporate governance.\n            b. Impact: Enhances the directors' understanding of corporate governance standards and best practices, enabling them to make informed decisions in the best interest of the company and its shareholders.\n        6. Event: Establishment of Whistleblower Hotline (August, 2019)\n            a. Description: Artistic Creations Inc. established a whistleblower hotline to provide a confidential and secure channel for employees and stakeholders to report any suspected fraudulent activities or misconduct.\n            b. Impact: Promotes a culture of accountability and transparency, discouraging unethical behavior and ensuring prompt identification and mitigation of any potential issues.\n    B. Senior Management Changes\n        1. Event: Senior Management Changes (March, 2019)\n            a. Description: Changes in the company’s senior management, including the CEO or other key positions, and its impact on the company's operational focus and priorities.\n            b. Impact: May lead to adjustments in operational focus and strategic priorities, affecting short-term performance and long-term development.\n    C. Corporate Governance Policy Revision\n        1. Event: Corporate Governance Policy Revision (April, 2019)\n            a. Description: Revision of the corporate governance framework or policies to enhance transparency, accountability, or stakeholder engagement.\n            b. Impact: Enhances corporate governance transparency and accountability, boosting stakeholder confidence.\n    D. Ethics and Integrity Incidents\n        1. Event: Ethics and Integrity Incidents (May, 2019)\n            a. Description: Significant ethical or integrity violations, such as fraud, corruption, or conflicts of interest, and the measures taken by the company in response.\n            b. Impact: May damage the company's reputation and brand value, affecting relationships with investors, customers, and partners.\n    E. Sustainability and Social Responsibility Initiatives\n        1. Event: Sustainability and Social Responsibility Initiatives (June, 2019)\n            a. Description: Significant progress in sustainability, environmental protection, social responsibility, and corporate citizenship.\n            b. Impact: Enhances the company’s public image and market competitiveness, promoting long-term sustainable development.\n    F. Shareholders' Meeting Resolution\n        1. Event: Shareholders' Meeting Resolution (July, 2019)\n            a. Description: Key decisions made at the annual or extraordinary shareholders’ meeting, including changes to the company’s charter, major corporate actions, and voting results.\n            b. Impact: Directly affects the company’s governance structure, future operational strategies, and shareholder rights.\n    G. Acquisition of Rare Art Collection\n        1. Event: Acquisition of Rare Art Collection (August, 2019)\n            a. Description: Artistic Creations Inc. successfully acquired a rare and highly valuable art collection featuring works from renowned artists.\n            b. Impact: Strengthens the company's collection and artist roster, attracting more art enthusiasts and raising the company's prestige in the industry.\n    H. Risk Management Measures\n        1. Event: Risk Management Measures (September, 2019)\n            a. Description: Updates to the company's risk management framework, including identification of new risks and implementation of mitigation strategies.\n            b. Impact: Improves the company’s ability to respond to internal and external risks, ensuring continuous operation and stable development.\n    I. Board of Directors Change\n        1. Event: Board of Directors Change (October, 2019)\n            a. Description: The appointment or resignation of board members, and its impact on the company's strategic direction.\n            b. Impact: May lead to strategic adjustments, affecting the company’s long-term development direction and shareholder interests.\n    J. Expansion of International Partnerships\n        1. Event: Expansion of International Partnerships (November, 2019)\n            a. Description: Artistic Creations Inc. formed strategic partnerships with prominent international art galleries in order to expand its global reach and influence.\n            b. Impact: Opens up new markets for the company, potentially increasing revenue and attracting a broader customer base from different countries.\n\nIII. Involved Indicators\n    A. Information Disclosure\n        1. Indicator: Information Disclosure (Artistic Creations Inc. has a robust information disclosure system compliant with SEC regulations, ensuring timely and accurate dissemination of financial information, major announcements, and pertinent details.)\n    B. Related Transactions\n        1. Indicator: Related Transactions (Artistic Creations Inc. strictly follows a comprehensive set of policies and procedures to ensure fairness and transparency in all related transactions. The company maintains thorough documentation and conducts regular internal audits to demonstrate compliance.)\n    C. Internal Control\n        1. Indicator: Internal Control (Artistic Creations Inc. has a sound internal control system in place, covering all significant aspects of its operations. The system is regularly reviewed and assessed to ensure its effectiveness in preventing and detecting irregularities, fraud, and other risks.)\n\nIV. Additional Information\n    A. Governance Improvement Plans\n        1. Strengthening the Function of the Board of Directors and Supervisory Board\n            a. Description: Artistic Creations Inc. plans to enhance the efficiency and effectiveness of the board of directors and supervisory board. This includes providing regular training to board members, increasing the proportion of independent directors, and optimizing decision-making processes to better align with the company's long-term vision and goals.\n        2. Enhancing Transparency and Quality of Information Disclosure\n            a. Description: Artistic Creations Inc. recognizes the importance of transparent and high-quality information disclosure. As part of its improvement plans, the company aims to refine its information disclosure process and standards. This will ensure that all stakeholders receive timely, accurate, and comprehensive information, ultimately fostering greater trust and confidence in the company.\n    B. Risk Management Strategy\n        1. Strengthening the Internal Control System\n            a. Description: Artistic Creations Inc. is committed to establishing and improving its internal control system to identify, assess, monitor, and report financial and operational risks. By enhancing the company's ability to withstand risks, the strengthened internal control system will safeguard the interests of shareholders and other stakeholders.\n        2. Integrating Sustainable Development and Social Responsibility\n            a. Description: Artistic Creations Inc. recognizes the significance of sustainable development and social responsibility. The company intends to integrate these principles into its overall strategy, identify related risks and opportunities, and actively engage in initiatives that promote long-term value creation. By doing so, Artistic Creations Inc. seeks to reinforce its commitment to responsible corporate citizenship.",
    "Generated Summary": "Artistic Creations Inc., established on March 15, 2005, is a publicly traded art gallery and exhibition company based in New York, United States, specializing in the culture industry.",
    "Generated Article": "In 2019, Artistic Creations Inc. demonstrated a strong commitment to corporate governance and implemented various initiatives to enhance its governance structure. The company proactively addressed compliance and regulatory updates, ensuring adherence to the latest laws and regulations in the industry. In January 2019, Artistic Creations Inc. implemented updates to new regulations and compliance standards, reducing legal risk and protecting the interests of the company and its shareholders. This event had a positive impact on the indicator of information disclosure, as the company's robust information disclosure system ensured timely and accurate dissemination of financial information and major announcements.\n\nFurthermore, in February 2019, Artistic Creations Inc. undertook an internal audit enhancement initiative to strengthen its internal control system and improve financial reporting accuracy. This initiative had a significant impact on the indicator of internal control, as enhanced internal controls promote transparency and provide assurance to shareholders and investors about the accuracy of financial information.\n\nIn March 2019, the company appointed a reputable external auditor to conduct an independent audit and financial review of its operations and financial statements. This event had a positive impact on the indicator of related transactions, as Artistic Creations Inc. strictly followed comprehensive policies and procedures to ensure fairness and transparency in all related transactions.\n\nTo further strengthen its corporate governance practices, Artistic Creations Inc. undertook a comprehensive review of its corporate governance bylaws in April 2019. This event had a positive impact on the indicator of internal control, as it ensured the company operated with integrity and in compliance with applicable laws and regulations.\n\nIn June 2019, a board of directors' training program was conducted for Artistic Creations Inc.'s directors, enhancing their understanding of corporate governance standards and best practices. This event had a positive impact on the indicator of internal control, as well-informed directors were able to make informed decisions in the best interest of the company and its shareholders.\n\nIn August 2019, Artistic Creations Inc. established a whistleblower hotline, providing a confidential and secure channel for employees and stakeholders to report any suspected fraudulent activities or misconduct. This event had a positive impact on the indicator of internal control, as it promoted a culture of accountability and transparency, discouraging unethical behavior and ensuring prompt identification and mitigation of potential issues.\n\nThroughout the year, Artistic Creations Inc. demonstrated its commitment to sustainability and social responsibility. In June 2019, the company made significant progress in sustainability, environmental protection, social responsibility, and corporate citizenship. This event had a positive impact on the indicator of internal control, as it enhanced the company's public image and market competitiveness, promoting long-term sustainable development.\n\nIn July 2019, key decisions were made at the annual shareholders' meeting, directly affecting the company's governance structure, future operational strategies, and shareholder rights. This event had a significant impact on the indicator of related transactions, as it showcased the company's commitment to transparency and stakeholder engagement.\n\nIn August 2019, Artistic Creations Inc. successfully acquired a rare and highly valuable art collection, strengthening its collection and artist roster. This event had a positive impact on the indicator of information disclosure, as it attracted more art enthusiasts and raised the company's prestige in the industry.\n\nIn September 2019, the company updated its risk management measures, improving its ability to respond to internal and external risks. This event had a positive impact on the indicator of internal control, as it ensured the company's continuous operation and stable development.\n\nIn October 2019, there was a change in the board of directors, which had an impact on the company's strategic direction. This event had a significant impact on the indicator of related transactions, as it may lead to strategic adjustments affecting the company's long-term development direction and shareholder interests.\n\nIn November 2019, Artistic Creations Inc. expanded its international partnerships, forming strategic alliances with prominent international art galleries. This event had a positive impact on the indicator of information disclosure, as it opened up new markets for the company, potentially increasing revenue and attracting a broader customer base from different countries.\n\nOverall, Artistic Creations Inc. demonstrated a strong commitment to corporate governance in 2019. The company implemented various initiatives to enhance its governance structure, addressing compliance and regulatory updates, strengthening internal controls, and promoting transparency and accountability. These efforts had a positive impact on the company's indicators of information disclosure, related transactions, and internal control. By prioritizing sustainability and social responsibility, Artistic Creations Inc. also enhanced its public image and market competitiveness, positioning itself for long-term success in the art gallery and exhibition industry."
}