{
    "courtAndProcuratorate": {
        "court": "Norwood, Unionville, Court",
        "procuratorate": "Norwood, Unionville, Procuratorate"
    },
    "chiefJudge": "T. Robinson",
    "judge": "N. Cook",
    "clerk": "O. Murphy",
    "defendant": {
        "name": "C. Taylor",
        "gender": "female",
        "birthdate": "19th, October, 1960",
        "residence": "71, Yorkshire street, Unionville",
        "ethnicity": "Caucasian",
        "occupation": "Retail Shop Owner"
    },
    "defenseLawyer": {
        "name": "P. Clark",
        "lawFirm": "Unionville Legal Associates"
    },
    "caseProcess": [
        {
            "event": "Case Filing and Investigation",
            "date": "15th August 2022",
            "description": "An investigation was initiated by the Norwood, Unionville Procuratorate following a series of complaints from brand owners regarding counterfeit goods being sold at a retail shop owned by the defendant, C. Taylor."
        },
        {
            "event": "Detention Measures Taken",
            "date": "20th September 2022",
            "description": "Detention measures were authorized by the court against C. Taylor after substantial evidence was collected implicating her in the sale of counterfeit branded goods."
        },
        {
            "event": "Criminal Detention",
            "date": "23rd September 2022",
            "description": "C. Taylor was formally placed under criminal detention as per the arrest warrant issued by the Norwood, Unionville Court."
        },
        {
            "event": "Arrest",
            "date": "1st October 2022",
            "description": "An arrest order was executed by the Norwood police, officially arresting C. Taylor for the crime of selling counterfeit registered trademark goods."
        }
    ],
    "criminalFacts": [
        {
            "crimeName": "Crime of Selling Counterfeit Registered Trademark Goods",
            "details": [
                {
                    "timePeriod": "March 2022 - August 2022",
                    "behavior": "C. Taylor knowingly sold counterfeit branded handbags under the trademarks of renowned brands such as Louis Vuitton, Chanel, and Gucci at her retail shop located at 25 Baker Street, Unionville.",
                    "evidence": "Physical evidence consisting of over 200 counterfeit handbags found during a police raid, financial records indicating transactions worth $45,000 linked to the sale of these counterfeit goods, and testimony from multiple witnesses who confirmed purchasing said counterfeit items."
                },
                {
                    "timePeriod": "April 2022",
                    "behavior": "C. Taylor acquired a shipment of counterfeit Nike shoes from an unverified supplier and displayed them for sale in her shop.",
                    "evidence": "Invoices and delivery receipts reflecting the acquisition of 150 pairs of shoes for $12,000, as well as physical evidence of the counterfeit shoes seized from her shop."
                },
                {
                    "timePeriod": "June 2022",
                    "behavior": "C. Taylor promoted a special sale event on social media advertising discounted prices on various luxury brands' goods, which were later discovered to be counterfeit.",
                    "evidence": "Screenshots from social media platforms of promotional posts, testimonies from customers who purchased these counterfeit items, and the financial trail reflecting a total of $20,000 in sales during the promotional event."
                },
                {
                    "timePeriod": "July 2022",
                    "behavior": "C. Taylor attempted to cover up her crimes by disposing of counterfeit goods at a nearby dumping ground following rumors of investigation.",
                    "evidence": "Witness statements from local residents who saw C. Taylor disposing multiple branded bags, and forensic reports matching the discarded items to her inventory."
                }
            ]
        }
    ],
    "legalProcedure": {
        "judgmentDate": "10th January 2023",
        "judgmentResult": [
            {
                "crimeName": "Crime of Selling Counterfeit Registered Trademark Goods",
                "sentence": "C. Taylor was sentenced to four years of fixed-term imprisonment and fined $100,000 for illicit gains.",
                "sentencingConsiderations": "The sentencing considered the large scale of the counterfeit goods sold, significant monetary gains, and attempts to obstruct justice by disposing of evidence."
            }
        ]
    },
    "Generated Article": "# Criminal Judgment\n\n### Norwood, Unionville Court\n\nIn the presence of:\n\n- **Chief Judge**: T. Robinson\n- **Judge**: N. Cook\n- **Court Clerk**: O. Murphy\n  \n### Norwood, Unionville Procuratorate\n\n## Defendant and Defense Lawyer Information:\n- **Defendant Name**: C. Taylor\n- **Gender**: Female\n- **Date of Birth**: 19th October 1960\n- **Residence**: 71, Yorkshire Street, Unionville\n- **Ethnicity**: Caucasian\n- **Occupation**: Retail Shop Owner\n\n- **Defense Lawyer**: P. Clark\n- **Law Firm**: Unionville Legal Associates\n\n---\n\n## Case Procedures:\n\n### Case Filing and Investigation:\nOn the 15th of August 2022, the Norwood, Unionville Procuratorate initiated an in-depth investigation based on a series of complaints submitted by prominent brand owners concerning the sale of counterfeit goods purportedly linked to the retail shop owned by the defendant, C. Taylor. The brands implicated included prestigious names such as Louis Vuitton, Chanel, Gucci, and Nike. The investigation spanned several weeks, culminating in the accumulation of substantial evidence, which precipitated further legal actions.\n\n### Detention Measures Taken:\nOn 20th September 2022, following the thorough investigation, the court authorized detention measures against C. Taylor in light of the overwhelming evidence implicating her in the unauthorized sale of counterfeit branded merchandise. This measure was deemed necessary to prevent the possible tampering or destruction of evidence and to ensure the defendant's availability for subsequent legal proceedings.\n\n### Criminal Detention:\nThree days subsequent to the detention measures, on the 23rd of September 2022, C. Taylor was formally placed under criminal detention per the arrest warrant issued by the Norwood, Unionville Court. The defendant was informed of the charges against her and her rights were duly communicated.\n\n### Arrest:\nThe definitive step was taken on 1st October 2022 when an arrest order was executed by the Norwood police. C. Taylor was officially taken into custody on charges of selling counterfeit registered trademark goods. The defendant was transported to the local detention facility where she awaited further judicial proceedings.\n\n---\n\n## Case Statement:\nC. Taylor, born on 19th October 1960, currently residing at 71 Yorkshire Street, Unionville, and employed as a retail shop owner, is accused of the crime of selling counterfeit registered trademark goods, contrary to Article No. 214. The specifics of this case are built on incontrovertible evidence amassed through relentless investigative efforts conducted by the Norwood, Unionville Procuratorate.\n\nThe defendant's retail establishment, situated at 25 Baker Street, Unionville, became a subject of scrutiny following complaints lodged by well-known brand owners. These complaints alleged that illicit activities were being conducted under the guise of legitimate retail transactions. Specifically, the defendant was reportedly selling counterfeit branded goods—handbags, shoes, and other items masquerading as luxury products—thereby tarnishing the reputation of the affected brands and misleading unsuspecting consumers.\n\nAn extensive covert operation was launched to corroborate these claims. Undercover agents, posing as customers, visited the defendant's shop over several months, purchasing items believed to be counterfeit. These items, along with detailed transaction records, testimonies from witness-victims, and other physical evidence, played a critical role in the eventual arrest and prosecution of C. Taylor.\n\n### Initial Discovery:\nThe investigation revealed that from March 2022 to August 2022, C. Taylor was actively engaged in the sale of counterfeit handbags bearing the logos of well-known luxury brands such as Louis Vuitton, Chanel, and Gucci. These counterfeit goods were discovered during a police raid, which uncovered over 200 fake handbags in the defendant’s inventory. Financial records indicated that transactions linked to these counterfeit items amounted to $45,000, further establishing a pattern of deliberate misconduct.\n\nIn early April 2022, C. Taylor expanded her counterfeit product line by acquiring a shipment of counterfeit Nike shoes from an unverified supplier. The invoices and delivery receipts documented the procurement of 150 pairs of these counterfeit shoes for $12,000. The seized counterfeit items served as key evidence in demonstrating the defendant's ongoing illicit activities.\n\n### Promotional Sale and Disposal Attempts:\nIn June 2022, C. Taylor attempted to maximize her gains by organizing a special sale event that was promoted heavily on social media. She advertised discounted prices on luxury branded goods, which, as later discovered, were counterfeit. Screenshots from various social media platforms captured her promotional posts, while testimonies from customers who purchased inadequately priced luxury items and the financial trail—a total of $20,000 in sales during the promotional event—provided compelling evidence of her culpability.\n\nBy July 2022, amidst circulating rumors of an impending investigation, C. Taylor made attempts to dispose of counterfeit goods. These acts were observed by local residents who saw the defendant disposing of branded bags at a nearby dumping ground. Forensic reports subsequently matched these discarded items to be part of her inventory, underscoring her consciousness of guilt and attempts to obstruct justice.\n\n---\n\n## Charge:\nThe primary charge against C. Taylor is the crime of Selling Counterfeit Registered Trademark Goods, as stipulated under Article No. 214. This charge stems from a series of deliberate acts carried out by C. Taylor, involving the acquisition, sale, and promotion of counterfeit luxury goods, resulting in significant illicit financial gains and reputational damage to the affected brands.\n\n---\n\n## Evidence Description:\nA comprehensive examination of the amassed evidence offers an unequivocal portrayal of the defendant's infractions. The evidence includes:\n\n### Physical Evidence:\nThe police raid on the defendant's shop yielded over 200 counterfeit handbags, which were painstakingly cataloged and analyzed. Each item was found to bear trademarks deceptively similar to those of authentic brands like Louis Vuitton, Chanel, and Gucci. Experts in trademark infringement validated these items as counterfeit, providing authoritative testimonies that solidified the nature and extent of the defendant's violations.\n\n### Financial Records:\nDetailed financial records revealed transactions amounting to $45,000 linked to the sale of counterfeit handbags. An in-depth financial audit traced these transactions, highlighting a systematic approach employed by C. Taylor to mislead consumers and profit from the sale of counterfeit goods.\n\n### Testimonies:\nMultiple witnesses voluntarily provided testimonies corroborating the illicit sale of counterfeit items. These individuals, having purchased items from the defendant’s shop under the assumption of authenticity, provided statements that unequivocally established the defendant’s deceptive practices.\n\n### Promotional Material:\nScreenshots of social media posts advertising C. Taylor’s special sale event showcased heavily discounted luxury goods, which further investigation revealed to be counterfeit. These promotional materials served not only to demonstrate the defendant’s intent to deceive but also to attract a larger volume of customers, thereby amplifying the extent of her unlawful activities.\n\n### Invoices and Receipts:\nInvoices and delivery receipts for 150 pairs of counterfeit Nike shoes, acquired in April 2022, documented the procurement and subsequent display of these items for sale in the defendant's shop. The purchase value of $12,000 for these counterfeit shoes was duly recorded, substantiating the financial aspect of the illicit trade.\n\n### Forensic Reports:\nForensic analysis of discarded counterfeit items matched them to the defendant's inventory. This evidence, coupled with witness statements from local residents, confirmed C. Taylor’s attempt to cover up her crimes by disposing of counterfeit goods at a nearby dumping ground.\n\n---\n\n## Sentencing Considerations:\nIn determining an appropriate sentence for C. Taylor, this court took into account several critical factors:\n\n### Scale of Counterfeit Goods:\nThe sheer volume of counterfeit items discovered – over 200 handbags and 150 pairs of shoes – indicates a large-scale operation aimed at profiting from intellectual property theft. This large-scale infringement resulted in significant financial gains for the defendant and considerable losses for the affected brands.\n\n### Financial Gains:\nThe financial records revealed transactions worth $45,000 linked to the sale of counterfeit handbags and an additional $12,000 related to the counterfeit Nike shoes. The defendant’s overall illicit financial gains further emphasized the severity of her transgressions.\n\n### Attempts to Obstruct Justice:\nThe fact that C. Taylor attempted to dispose of counterfeit goods upon hearing rumors of an investigation illustrated a clear intent to obstruct justice. Her actions in this regard were calculated and premeditated, aimed at evading the consequences of her illicit activities.\n\n### Impact on Brand Reputation:\nThe sale of counterfeit goods not only defrauds consumers but also damages the reputation of the affected brands. The prestigious nature of the brands involved meant that the sale of imitation goods could have long-lasting negative implications for their market standing and customer trust.\n\n---\n\n## Judgment Result:\nIn view of the overwhelming evidence, the severity of the offense, and the considerations detailed above, this court finds C. Taylor guilty of the crime of Selling Counterfeit Registered Trademark Goods under Article No. 214. The defendant is hereby sentenced to four years of fixed-term imprisonment and fined $100,000 for illicit gains.\n\nThe sentence reflects the need for a stringent response to deter similar offenses and to uphold the integrity of intellectual property laws that safeguard both consumers and legitimate businesses.\n\n---\n\n## Appeal Rights Explanation:\nC. Taylor is hereby informed of her right to appeal this judgment. Should the defendant wish to challenge this verdict, an appeal must be instituted within ten days from the date this judgment is delivered. The appeal should be submitted to the Norwood, Unionville Court or the appropriate appellate court as per established procedures. The defendant remains entitled to legal representation throughout the appeals process and is urged to consult with her defense lawyer, P. Clark, of Unionville Legal Associates, to discuss the potential grounds and implications of an appeal.\n\n---\n\nThis judgment is delivered and executed on this 10th day of January 2023, by the Norwood, Unionville Court, with the presence and consent of the Chief Judge T. Robinson, Judge N. Cook, and Court Clerk O. Murphy. This document serves as the formal and official record of the court’s decision in the case against C. Taylor pertaining to the crime of Selling Counterfeit Registered Trademark Goods.\n\nReference Article is below：\nArticle 214\nSelling goods that are known to be counterfeit registered trademarks, if the illegal gains are relatively large or there are other serious circumstances, shall be sentenced to fixed-term imprisonment of not more than three years, and shall also be fined or solely fined; if the illegal gains are huge or there are other particularly serious circumstances, they shall be sentenced to fixed-term imprisonment of more than three years but not more than ten years, and shall also be fined.",
    "qa_fact_based": [
        {
            "question type": "Factual Question",
            "question": "According to the court judgment of Norwood, Unionville, Court, who was the defendant?",
            "answer": "C. Taylor",
            "ref": [
                "- **Defendant Name**: C. Taylor"
            ]
        },
        {
            "question type": "Factual Question",
            "question": "According to the court judgment of Norwood, Unionville, Court, what was the judgment date?",
            "answer": "10th January 2023",
            "ref": [
                "This judgment is delivered and executed on this 10th day of January 2023, by the Norwood, Unionville Court, with the presence and consent of the Chief Judge T. Robinson, Judge N. Cook, and Court Clerk O. Murphy."
            ]
        },
        {
            "question type": "Factual Question",
            "question": "According to the court judgment of Norwood, Unionville, Court, who was the chief judge?",
            "answer": "T. Robinson",
            "ref": [
                "- **Chief Judge**: T. Robinson",
                "This judgment is delivered and executed on this 10th day of January 2023, by the Norwood, Unionville Court, with the presence and consent of the Chief Judge T. Robinson, Judge N. Cook, and Court Clerk O. Murphy."
            ]
        },
        {
            "question type": "Factual Question",
            "question": "According to the court judgment of Norwood, Unionville, Court, what was the value of the shipment of counterfeit Nike shoes acquired by C. Taylor?",
            "answer": "$12,000",
            "ref": [
                "In early April 2022, C. Taylor expanded her counterfeit product line by acquiring a shipment of counterfeit Nike shoes from an unverified supplier.",
                "The invoices and delivery receipts documented the procurement of 150 pairs of these counterfeit shoes for $12,000.",
                "Invoices and delivery receipts for 150 pairs of counterfeit Nike shoes, acquired in April 2022, documented the procurement and subsequent display of these items for sale in the defendant's shop.",
                "The purchase value of $12,000 for these counterfeit shoes was duly recorded, substantiating the financial aspect of the illicit trade.",
                "The financial records revealed transactions worth $45,000 linked to the sale of counterfeit handbags and an additional $12,000 related to the counterfeit Nike shoes."
            ]
        }
    ],
    "qa_multi_hop": [
        {
            "question type": "Multi-hop Reasoning Question",
            "question": "According to the judgment of Norwood, Unionville, Court, how many distinct criminal activities did C. Taylor engage in?",
            "answer": "According to the judgment, C. Taylor engaged in four distinct criminal activities: selling counterfeit handbags, selling counterfeit shoes, promoting counterfeit goods on social media, and disposing of counterfeit goods.",
            "ref": [
                "The investigation revealed that from March 2022 to August 2022, C. Taylor was actively engaged in the sale of counterfeit handbags bearing the logos of well-known luxury brands such as Louis Vuitton, Chanel, and Gucci.",
                "In early April 2022, C. Taylor expanded her counterfeit product line by acquiring a shipment of counterfeit Nike shoes from an unverified supplier.",
                "In June 2022, C. Taylor attempted to maximize her gains by organizing a special sale event that was promoted heavily on social media.",
                "By July 2022, amidst circulating rumors of an impending investigation, C. Taylor made attempts to dispose of counterfeit goods."
            ]
        },
        {
            "question type": "Multi-hop Reasoning Question",
            "question": "According to the judgment of Norwood, Unionville, Court, how many pieces of evidence were presented against C. Taylor?",
            "answer": "According to the judgment, there were six pieces of evidence presented against C. Taylor: physical evidence of handbags, financial records, testimonies, invoices and delivery receipts, screenshots from social media, and forensic reports.",
            "ref": [
                "The police raid on the defendant's shop yielded over 200 counterfeit handbags, which were painstakingly cataloged and analyzed.",
                "Detailed financial records revealed transactions amounting to $45,000 linked to the sale of counterfeit handbags.",
                "Multiple witnesses voluntarily provided testimonies corroborating the illicit sale of counterfeit items.",
                "Invoices and delivery receipts for 150 pairs of counterfeit Nike shoes, acquired in April 2022, documented the procurement and subsequent display of these items for sale in the defendant's shop.",
                "Screenshots of social media posts advertising C. Taylor’s special sale event showcased heavily discounted luxury goods, which further investigation revealed to be counterfeit.",
                "Forensic analysis of discarded counterfeit items matched them to the defendant's inventory."
            ]
        }
    ],
    "qa_summary": [
        {
            "question type": "Summarization Question",
            "question": "According to the judgment of Norwood, Unionville Court, summarize the facts of C. Taylor's crimes.",
            "answer": "C. Taylor committed the crime of selling counterfeit registered trademark goods. From March 2022 to August 2022, she sold counterfeit branded handbags under trademarks such as Louis Vuitton, Chanel, and Gucci at her retail shop. In April 2022, she acquired and sold counterfeit Nike shoes. In June 2022, she promoted a special sale event on social media for discounted luxury brand goods, which were counterfeit. In July 2022, she attempted to cover up her crimes by disposing of counterfeit goods at a nearby dumping ground.",
            "ref": [
                "C. Taylor, born on 19th October 1960, currently residing at 71 Yorkshire Street, Unionville, and employed as a retail shop owner, is accused of the crime of selling counterfeit registered trademark goods, contrary to Article No. 214.",
                "The defendant's retail establishment, situated at 25 Baker Street, Unionville, became a subject of scrutiny following complaints lodged by well-known brand owners.",
                "These complaints alleged that illicit activities were being conducted under the guise of legitimate retail transactions.",
                "Specifically, the defendant was reportedly selling counterfeit branded goods—handbags, shoes, and other items masquerading as luxury products—thereby tarnishing the reputation of the affected brands and misleading unsuspecting consumers.",
                "### Initial Discovery:",
                "The investigation revealed that from March 2022 to August 2022, C. Taylor was actively engaged in the sale of counterfeit handbags bearing the logos of well-known luxury brands such as Louis Vuitton, Chanel, and Gucci.",
                "In early April 2022, C. Taylor expanded her counterfeit product line by acquiring a shipment of counterfeit Nike shoes from an unverified supplier.",
                "### Promotional Sale and Disposal Attempts:",
                "In June 2022, C. Taylor attempted to maximize her gains by organizing a special sale event that was promoted heavily on social media.",
                "She advertised discounted prices on luxury branded goods, which, as later discovered, were counterfeit.",
                "By July 2022, amidst circulating rumors of an impending investigation, C. Taylor made attempts to dispose of counterfeit goods.",
                "These acts were observed by local residents who saw the defendant disposing of branded bags at a nearby dumping ground."
            ]
        },
        {
            "question type": "Summarization Question",
            "question": "According to the judgment of Norwood, Unionville Court, summarize the evidence of C. Taylor's crimes.",
            "answer": "The evidence against C. Taylor includes physical evidence of over 200 counterfeit handbags, financial records of transactions worth $45,000, witness testimonies, invoices and delivery receipts for 150 pairs of counterfeit Nike shoes, screenshots of social media promotional posts, and forensic reports matching discarded counterfeit items to her inventory.",
            "ref": [
                "These counterfeit goods were discovered during a police raid, which uncovered over 200 fake handbags in the defendant’s inventory.",
                "Financial records indicated that transactions linked to these counterfeit items amounted to $45,000, further establishing a pattern of deliberate misconduct.",
                "The invoices and delivery receipts documented the procurement of 150 pairs of these counterfeit shoes for $12,000.",
                "The seized counterfeit items served as key evidence in demonstrating the defendant's ongoing illicit activities.",
                "The evidence includes:",
                "The police raid on the defendant's shop yielded over 200 counterfeit handbags, which were painstakingly cataloged and analyzed.",
                "Each item was found to bear trademarks deceptively similar to those of authentic brands like Louis Vuitton, Chanel, and Gucci.",
                "Experts in trademark infringement validated these items as counterfeit, providing authoritative testimonies that solidified the nature and extent of the defendant's violations.",
                "Detailed financial records revealed transactions amounting to $45,000 linked to the sale of counterfeit handbags.",
                "An in-depth financial audit traced these transactions, highlighting a systematic approach employed by C. Taylor to mislead consumers and profit from the sale of counterfeit goods.",
                "Multiple witnesses voluntarily provided testimonies corroborating the illicit sale of counterfeit items.",
                "These individuals, having purchased items from the defendant’s shop under the assumption of authenticity, provided statements that unequivocally established the defendant’s deceptive practices.",
                "Screenshots of social media posts advertising C. Taylor’s special sale event showcased heavily discounted luxury goods, which further investigation revealed to be counterfeit.",
                "These promotional materials served not only to demonstrate the defendant’s intent to deceive but also to attract a larger volume of customers, thereby amplifying the extent of her unlawful activities.",
                "Invoices and delivery receipts for 150 pairs of counterfeit Nike shoes, acquired in April 2022, documented the procurement and subsequent display of these items for sale in the defendant's shop.",
                "The purchase value of $12,000 for these counterfeit shoes was duly recorded, substantiating the financial aspect of the illicit trade.",
                "Forensic analysis of discarded counterfeit items matched them to the defendant's inventory.",
                "This evidence, coupled with witness statements from local residents, confirmed C. Taylor’s attempt to cover up her crimes by disposing of counterfeit goods at a nearby dumping ground."
            ]
        },
        {
            "question type": "Summarization Question",
            "question": "According to the judgment of Norwood, Unionville Court, summarize the case process of C. Taylor.",
            "answer": "The case process began with an investigation initiated on 15th August 2022 by the Norwood, Unionville Procuratorate following complaints from brand owners. Detention measures were authorized on 20th September 2022 after substantial evidence was collected. C. Taylor was placed under criminal detention on 23rd September 2022, and an arrest order was executed on 1st October 2022 by the Norwood police.",
            "ref": [
                "On the 15th of August 2022, the Norwood, Unionville Procuratorate initiated an in-depth investigation based on a series of complaints submitted by prominent brand owners concerning the sale of counterfeit goods purportedly linked to the retail shop owned by the defendant, C. Taylor.",
                "The brands implicated included prestigious names such as Louis Vuitton, Chanel, Gucci, and Nike.",
                "The investigation spanned several weeks, culminating in the accumulation of substantial evidence, which precipitated further legal actions.",
                "On 20th September 2022, following the thorough investigation, the court authorized detention measures against C. Taylor in light of the overwhelming evidence implicating her in the unauthorized sale of counterfeit branded merchandise.",
                "This measure was deemed necessary to prevent the possible tampering or destruction of evidence and to ensure the defendant's availability for subsequent legal proceedings.",
                "Three days subsequent to the detention measures, on the 23rd of September 2022, C. Taylor was formally placed under criminal detention per the arrest warrant issued by the Norwood, Unionville Court.",
                "The defendant was informed of the charges against her and her rights were duly communicated.",
                "The definitive step was taken on 1st October 2022 when an arrest order was executed by the Norwood police.",
                "C. Taylor was officially taken into custody on charges of selling counterfeit registered trademark goods."
            ]
        },
        {
            "question type": "Summarization Question",
            "question": "According to the judgment of Norwood, Unionville Court, summarize the judgment result for C. Taylor.",
            "answer": "C. Taylor was sentenced to four years of fixed-term imprisonment and fined $100,000 for illicit gains.",
            "ref": [
                "In view of the overwhelming evidence, the severity of the offense, and the considerations detailed above, this court finds C. Taylor guilty of the crime of Selling Counterfeit Registered Trademark Goods under Article No. 214.",
                "The defendant is hereby sentenced to four years of fixed-term imprisonment and fined $100,000 for illicit gains."
            ]
        }
    ]
}