{
    "Report Type": "Corporate Governance Report",
    "Report Time": "2018",
    "Company Information": {
        "Name": "Capital Finance Group",
        "Establishment Date": "March 15, 1995",
        "Main Business": "Providing financial services including investment banking, asset management, and wealth management",
        "Registration Location": "New York, United States",
        "Listing Status": "Publicly traded on the New York Stock Exchange",
        "Industry": "Finance"
    },
    "Report Content": [
        {
            "Type": "Governance Structure",
            "Significant Events": [
                {
                    "Event": "Shareholders' Meeting Resolution",
                    "Time": "February, 2018",
                    "Description": "During the annual shareholders’ meeting, key decisions were made to strengthen the company's charter, including the appointment of an independent auditor. Additionally, major corporate actions such as expanding the company's asset management portfolio and issuing new shares were approved.",
                    "Impact": "These decisions directly affect the company's governance structure, future operational strategies, and shareholder rights.",
                    "Sub Events": [
                        {
                            "Event": "Appointment of Independent Auditor",
                            "Time": "February, 2018",
                            "Description": "As part of the shareholders' meeting resolution, the decision was made to appoint an independent auditor for Capital Finance Group. The auditor will be responsible for ensuring the accuracy and reliability of the company's financial statements.",
                            "Impact": "This appointment enhances transparency and strengthens the credibility of the company's financial reporting."
                        },
                        {
                            "Event": "Expansion of Asset Management Portfolio",
                            "Time": "February, 2018",
                            "Description": "Following the shareholders' meeting resolution, Capital Finance Group decided to expand its asset management portfolio. This strategic move aims to diversify the company's revenue streams and capitalize on potential growth opportunities in the market.",
                            "Impact": "The expansion of the asset management portfolio is expected to contribute to the company's financial performance and strengthen its position in the finance industry."
                        },
                        {
                            "Event": "Approval of New Share Issuance",
                            "Time": "February, 2018",
                            "Description": "As part of the shareholders' meeting resolution, Capital Finance Group gained approval to issue new shares. This allows the company to raise additional capital for various purposes, such as financing expansion initiatives or funding acquisitions.",
                            "Impact": "The issuance of new shares provides the company with increased financial flexibility and potential for future growth and development."
                        }
                    ]
                },
                {
                    "Event": "Ethics and Integrity Incidents",
                    "Time": "March, 2018",
                    "Description": "In an unfortunate incident, a former employee was found guilty of fraud and corruption. Capital Finance Group immediately responded by terminating the employee, cooperating with law enforcement agencies, and implementing stricter internal controls to prevent future occurrences.",
                    "Impact": "While such incidents tarnish the company's reputation and brand value, Capital Finance Group's prompt action demonstrates its commitment to maintaining ethical standards and rebuilding trust with investors, customers, and partners."
                },
                {
                    "Event": "Senior Management Changes",
                    "Time": "April, 2018",
                    "Description": "Mrs. Julia Thompson, an experienced industry leader, has joined the company as the new CEO. Her appointment brings fresh perspectives and insights to the company's operational focus and priorities. Mrs. Thompson is committed to driving innovation and expanding the company's presence in emerging markets.",
                    "Impact": "Mrs. Thompson's leadership may lead to adjustments in operational focus and strategic priorities, impacting both short-term performance and long-term development."
                },
                {
                    "Event": "Risk Management Measures",
                    "Time": "June, 2018",
                    "Description": "The company has implemented an updated risk management framework, including the identification of new risks associated with emerging technologies and financial markets. Mitigation strategies have been put in place to address these risks, ensuring the company's continuous operation and stable development.",
                    "Impact": "The improved risk management framework enhances the company's ability to respond to internal and external risks, preserving financial stability and enabling sustainable growth."
                },
                {
                    "Event": "Corporate Governance Policy Revision",
                    "Time": "August, 2018",
                    "Description": "Revision of the corporate governance framework and policies to include greater transparency, accountability, and stakeholder engagement. The new policies establish clear guidelines for decision-making and aim to align the company's operations with best practices.",
                    "Impact": "The revised corporate governance framework enhances transparency, accountability, and stakeholder confidence, fostering a positive business environment."
                },
                {
                    "Event": "Board of Directors Change",
                    "Time": "September, 2018",
                    "Description": "Mr. John Anderson appointed as a new board member, bringing extensive expertise in international finance. His appointment will strengthen the company's strategic direction and decision-making processes.",
                    "Impact": "The addition of Mr. Anderson to the board of directors may lead to strategic adjustments, promoting the company’s long-term development direction and enhancing shareholder interests."
                },
                {
                    "Event": "Sustainability and Social Responsibility Initiatives",
                    "Time": "October, 2018",
                    "Description": "Capital Finance Group has made significant progress in sustainability, environmental protection, and social responsibility initiatives. This includes promoting responsible investment practices, reducing the company's carbon footprint, and actively supporting local community development projects.",
                    "Impact": "These initiatives enhance the company’s public image and market competitiveness, engendering long-term stakeholder trust and fostering sustainable development."
                },
                {
                    "Event": "Compliance and Regulatory Updates",
                    "Time": "December, 2018",
                    "Description": "In response to updated securities regulations, the company has reevaluated its compliance practices, ensuring adherence to the latest laws. Additionally, specific industry regulations have been incorporated into the corporate governance framework.",
                    "Impact": "Aligning with the latest laws and regulations reduces legal risk, protects the company, and safeguards shareholder interests."
                }
            ],
            "Involved Indicators": [
                {
                    "Indicator": "Information Disclosure",
                    "Description": "The company follows a transparent information disclosure process, including regular reporting, proactively sharing updates, and maintaining an open line of communication with stakeholders.",
                    "Value": "Capital Finance Group provides detailed financial reports, including balance sheets, P&L statements, and cash flow statements, ensuring comprehensive and accurate information disclosure."
                },
                {
                    "Indicator": "Related Transactions",
                    "Description": "To ensure fairness and compliance in related transactions, the company has implemented rigorous policies, procedures, and measures. These guidelines are regularly reviewed and audited by an external independent auditor.",
                    "Value": "Capital Finance Group maintains a strong focus on eliminating conflicts of interest and ensuring fair treatment in all related transactions, enhancing trust among shareholders and stakeholders."
                },
                {
                    "Indicator": "Internal Control",
                    "Description": "Capital Finance Group has established a robust internal control system that governs the company's activities. This includes clearly documented policies and procedures, regular internal audits, and an independent internal control department responsible for monitoring and ensuring compliance.",
                    "Value": "The internal control measures effectively safeguard the company's assets, prevent potential fraud, and maintain the integrity of financial reporting."
                }
            ]
        }
    ],
    "Additional Information": [
        {
            "Name": "Governance Improvement Plans",
            "Content": [
                {
                    "Name": "Strengthening the Function of the Board of Directors and Supervisory Board",
                    "Description": "Capital Finance Group is committed to enhancing the efficiency and effectiveness of the board of directors and supervisory board. As part of this initiative, the company will provide regular training to board members, increase the proportion of independent directors, and optimize decision-making processes to better serve shareholders and stakeholders."
                },
                {
                    "Name": "Enhancing Transparency and Quality of Information Disclosure",
                    "Description": "To further improve transparency and the quality of information disclosed to stakeholders, Capital Finance Group will enhance its information disclosure process and standards. The company aims to ensure timely, accurate, and comprehensive reporting, providing stakeholders with a clear understanding of the company's operations and financial performance."
                }
            ]
        },
        {
            "Name": "Risk Management Strategy",
            "Content": [
                {
                    "Name": "Strengthening the Internal Control System",
                    "Description": "Capital Finance Group is dedicated to establishing and enhancing its internal control system. This includes identifying, assessing, monitoring, and reporting on financial and operational risks. By strengthening the internal control system, the company aims to improve risk mitigation and enhance its ability to withstand potential risks."
                },
                {
                    "Name": "Integrating Sustainable Development and Social Responsibility",
                    "Description": "Capital Finance Group recognizes the importance of sustainable development and social responsibility. As part of its risk management strategy, the company will integrate sustainable development practices into its operations. By identifying related risks and opportunities, the company aims to promote long-term value creation while ensuring responsible and ethical practices."
                }
            ]
        }
    ],
    "Generated Outline": "I. Introduction\n    A. Background Information\n        1. Company Name: Capital Finance Group\n        2. Establishment Date: March 15, 1995\n        3. Main Business: Providing financial services including investment banking, asset management, and wealth management\n        4. Registration Location: New York, United States\n        5. Listing Status: Publicly traded on the New York Stock Exchange\n        6. Industry: Finance\n    B. Report Type: Corporate Governance Report\n    C. Report Time: 2018\n\nII. Governance Structure\n    A. Shareholders' Meeting Resolution (February, 2018)\n        1. Description: Key decisions made during annual shareholders' meeting to strengthen company's charter, including appointment of independent auditor.\n        2. Impact: Affects company's governance structure, future operational strategies, and shareholder rights.\n        3. Appointment of Independent Auditor (February, 2018)\n            - Description: Decision made to appoint independent auditor for Capital Finance Group.\n            - Impact: Enhances transparency and strengthens credibility of company's financial reporting.\n        4. Expansion of Asset Management Portfolio (February, 2018)\n            - Description: Company decides to expand its asset management portfolio.\n            - Impact: Expected to contribute to company's financial performance and strengthen its position in the finance industry.\n        5. Approval of New Share Issuance (February, 2018)\n            - Description: Company gains approval to issue new shares.\n            - Impact: Provides company with increased financial flexibility and potential for future growth and development.\n    B. Ethics and Integrity Incidents (March, 2018)\n        1. Description: Former employee found guilty of fraud and corruption.\n        2. Impact: Tarnishes company's reputation and brand value, but actions taken demonstrate commitment to maintaining ethical standards and rebuilding trust.\n    C. Senior Management Changes (April, 2018)\n        1. Description: Mrs. Julia Thompson appointed as new CEO.\n        2. Impact: Leadership change may lead to adjustments in operational focus and strategic priorities.\n    D. Risk Management Measures (June, 2018)\n        1. Description: Company implements updated risk management framework.\n        2. Impact: Improved framework enhances ability to respond to internal and external risks, preserving financial stability and enabling sustainable growth.\n    E. Corporate Governance Policy Revision (August, 2018)\n        1. Description: Revision of corporate governance framework and policies to include greater transparency, accountability, and stakeholder engagement.\n        2. Impact: Enhances transparency, accountability, and stakeholder confidence, fostering a positive business environment.\n    F. Board of Directors Change (September, 2018)\n        1. Description: Mr. John Anderson appointed as new board member.\n        2. Impact: Addition of Mr. Anderson may lead to strategic adjustments, promoting company’s long-term development direction and enhancing shareholder interests.\n    G. Sustainability and Social Responsibility Initiatives (October, 2018)\n        1. Description: Company makes significant progress in sustainability, environmental protection, and social responsibility initiatives.\n        2. Impact: Enhances public image and market competitiveness, engendering long-term stakeholder trust and fostering sustainable development.\n    H. Compliance and Regulatory Updates (December, 2018)\n        1. Description: Company reevaluates compliance practices to adhere to updated securities regulations and industry-specific regulations.\n        2. Impact: Aligning with latest laws and regulations reduces legal risk, protects company, and safeguards shareholder interests.\n\nIII. Involved Indicators\n    A. Information Disclosure\n        1. Description: Company follows transparent information disclosure process, including regular reporting, proactive updates, and open communication with stakeholders.\n        2. Value: Detailed financial reports provided, ensuring comprehensive and accurate information disclosure.\n    B. Related Transactions\n        1. Description: Company has rigorous policies, procedures, and measures to ensure fairness and compliance in related transactions.\n        2. Value: Focus on eliminating conflicts of interest and ensuring fair treatment, enhancing trust among shareholders and stakeholders.\n    C. Internal Control\n        1. Description: Company has established robust internal control system governing its activities.\n        2. Value: Internal control measures effectively safeguard assets, prevent fraud, and maintain integrity of financial reporting.\n\nIV. Additional Information\n    A. Governance Improvement Plans\n        1. Strengthening the Function of the Board of Directors and Supervisory Board\n            - Description: Company committed to enhancing efficiency and effectiveness of board of directors and supervisory board.\n        2. Enhancing Transparency and Quality of Information Disclosure\n            - Description: Company aims to improve transparency and quality of information disclosed to stakeholders.\n    B. Risk Management Strategy\n        1. Strengthening the Internal Control System\n            - Description: Company dedicates itself to establishing and enhancing internal control system.\n        2. Integrating Sustainable Development and Social Responsibility\n            - Description: Company integrates sustainable development practices into operations as part of risk management strategy.\n\nNote: All events and indicators are mentioned with their respective time points as per the given JSON.",
    "Generated Summary": "Capital Finance Group, established on March 15, 1995 in New York, is a publicly traded finance company offering a wide range of financial services including investment banking, asset management, and wealth management.",
    "Generated Article": "In February 2018, the company held its annual shareholders' meeting, during which several key decisions were made to strengthen the company's governance structure and enhance shareholder rights. One of the significant resolutions was the appointment of an independent auditor, which aimed to enhance transparency and strengthen the credibility of the company's financial reporting. This decision reflects the company's commitment to maintaining high standards of corporate governance.\n\nAnother important decision made during the shareholders' meeting was the expansion of the company's asset management portfolio. This strategic move is expected to contribute to the company's financial performance and strengthen its position in the finance industry. By diversifying its portfolio, Capital Finance Group aims to capture new opportunities and generate sustainable growth.\n\nIn the same month, the company also gained approval to issue new shares, providing it with increased financial flexibility and potential for future growth and development. This decision aligns with the company's long-term strategy of expanding its operations and seizing market opportunities.\n\nHowever, in March 2018, the company faced an ethics and integrity incident when a former employee was found guilty of fraud and corruption. This incident tarnished the company's reputation and brand value. Nevertheless, the actions taken by the company in response to this incident demonstrate its commitment to maintaining ethical standards and rebuilding trust with stakeholders.\n\nIn April 2018, Mrs. Julia Thompson was appointed as the new CEO of Capital Finance Group. This senior management change may lead to adjustments in operational focus and strategic priorities, as new leadership often brings fresh perspectives and ideas.\n\nTo strengthen its risk management capabilities, the company implemented an updated risk management framework in June 2018. This framework aims to enhance the company's ability to respond to internal and external risks, preserving financial stability and enabling sustainable growth.\n\nIn August 2018, Capital Finance Group revised its corporate governance policy to include greater transparency, accountability, and stakeholder engagement. This revision reflects the company's commitment to enhancing its corporate governance practices and fostering a positive business environment.\n\nIn September 2018, the company appointed Mr. John Anderson as a new board member. This addition to the board of directors may lead to strategic adjustments, promoting the company's long-term development direction and enhancing shareholder interests.\n\nIn October 2018, Capital Finance Group made significant progress in sustainability, environmental protection, and social responsibility initiatives. These efforts not only enhance the company's public image and market competitiveness but also engender long-term stakeholder trust and foster sustainable development.\n\nIn December 2018, the company reevaluated its compliance practices to adhere to updated securities regulations and industry-specific regulations. By aligning with the latest laws and regulations, Capital Finance Group reduces legal risk, protects the company, and safeguards shareholder interests.\n\nThroughout the report, several indicators were involved to assess the company's corporate governance. Capital Finance Group follows a transparent information disclosure process, providing detailed financial reports and ensuring comprehensive and accurate information disclosure. This commitment to information transparency enhances stakeholder trust and confidence.\n\nThe company also has rigorous policies, procedures, and measures in place to ensure fairness and compliance in related transactions. By focusing on eliminating conflicts of interest and ensuring fair treatment, Capital Finance Group enhances trust among shareholders and stakeholders.\n\nFurthermore, the company has established a robust internal control system to govern its activities. This internal control system effectively safeguards assets, prevents fraud, and maintains the integrity of financial reporting.\n\nLooking ahead, Capital Finance Group has outlined governance improvement plans, including strengthening the function of the board of directors and supervisory board, as well as enhancing transparency and the quality of information disclosure. These plans reflect the company's commitment to continuous improvement in its corporate governance practices.\n\nIn terms of risk management, the company aims to strengthen its internal control system and integrate sustainable development practices into its operations. By dedicating itself to establishing and enhancing the internal control system, Capital Finance Group aims to mitigate risks and ensure the long-term sustainability of its business.\n\nIn conclusion, Capital Finance Group has demonstrated a commitment to strong corporate governance practices through various initiatives and decisions. Despite facing challenges such as an ethics and integrity incident, the company has taken proactive measures to address these issues and rebuild trust with stakeholders. With a focus on transparency, fairness, and risk management, Capital Finance Group aims to maintain its position as a reputable and trusted financial services provider."
}