{
    "Report Type": "Corporate Financial Report",
    "Report Time": "2020",
    "Company Information": {
        "Name": "EduCorp",
        "Establishment Date": "March 1, 2005",
        "Main Business": "EduCorp provides educational services through online platforms and physical learning centers.",
        "Registration Location": "City of Education, Country A",
        "Listing Status": "Publicly Listed",
        "Industry": "Education"
    },
    "Report Content": [
        {
            "Type": "Financial Information",
            "Significant Events": [
                {
                    "Event": "Asset Restructuring",
                    "Time": "January, 2020",
                    "Description": "EduCorp underwent an asset restructuring, optimizing its business structure by divesting from underperforming businesses and focusing on its core educational services.",
                    "Impact": "The asset restructuring improved the operational efficiency of EduCorp, leading to an increase in company value.",
                    "Sub Events": [
                        {
                            "Event": "Acquisition of Online Learning Platform",
                            "Time": "February, 2020",
                            "Description": "EduCorp acquired an online learning platform that specializes in providing virtual classrooms and interactive educational content. This acquisition allowed EduCorp to enhance its online presence, expand its customer base, and offer a more comprehensive range of educational services.",
                            "Impact": "The acquisition of the online learning platform strengthened EduCorp's position in the online education market and increased its revenue streams."
                        },
                        {
                            "Event": "Partnership with Local Schools",
                            "Time": "March, 2020",
                            "Description": "EduCorp formed strategic partnerships with several local schools to integrate its educational programs and services into their curriculum. This partnership facilitated the expansion of EduCorp's physical learning centers and helped establish a strong presence in the local education community.",
                            "Impact": "The partnership with local schools increased the visibility of EduCorp's brand and attracted more students to its physical learning centers, resulting in higher enrollment numbers."
                        },
                        {
                            "Event": "Development of AI-Powered Learning Analytics",
                            "Time": "April, 2020",
                            "Description": "EduCorp invested in the development of an AI-powered learning analytics system that analyzes students' performance data to provide personalized recommendations and feedback. This system allowed EduCorp to offer a more tailored learning experience and improve educational outcomes for its students.",
                            "Impact": "The development of the AI-powered learning analytics system enhanced the quality of EduCorp's educational services and increased student satisfaction and retention rates."
                        },
                        {
                            "Event": "Expansion into International Markets",
                            "Time": "August, 2020",
                            "Description": "EduCorp expanded its operations into international markets by establishing partnerships with educational institutions in different countries. This expansion allowed EduCorp to tap into new customer segments, diversify its revenue sources, and gain a global presence in the education industry.",
                            "Impact": "The international expansion increased EduCorp's market reach and revenue, contributing to its overall growth and financial performance."
                        }
                    ]
                },
                {
                    "Event": "Major Investment",
                    "Time": "February, 2020",
                    "Description": "EduCorp invested $10 million in Project SmartLearn, an innovative online learning platform that offers personalized education solutions.",
                    "Impact": "This major investment in Project SmartLearn further broadened EduCorp's business areas and enhanced its profitability."
                },
                {
                    "Event": "Debt Restructuring",
                    "Time": "March, 2020",
                    "Description": "To optimize its capital structure, EduCorp underwent debt restructuring, reducing its liabilities by $5 million through debt renegotiations and repayment strategies.",
                    "Impact": "The debt restructuring improved EduCorp's financial condition, reduced its financial costs, and increased its liquidity."
                },
                {
                    "Event": "Significant Equity Acquisition",
                    "Time": "April, 2020",
                    "Description": "EduCorp completed the acquisition of 40% equity of Alpha Schools, a renowned K-12 institution in the region.",
                    "Impact": "This significant equity acquisition further expanded EduCorp's market share and enhanced its control in the education industry."
                },
                {
                    "Event": "Large-scale Financing",
                    "Time": "May, 2020",
                    "Description": "EduCorp conducted a large-scale financing activity, raising $50 million from a consortium of private investors and institutional lenders.",
                    "Impact": "The large-scale financing strengthened EduCorp's financial strength, supported its expansion and development plans, and fueled its growth ambitions."
                },
                {
                    "Event": "Major Asset Acquisition",
                    "Time": "September, 2020",
                    "Description": "EduCorp completed the asset acquisition of Global Education Solutions, a leading provider of professional development programs for educators, with a total value of $20 million.",
                    "Impact": "This major asset acquisition expanded EduCorp's business scope, enhancing its market competitiveness and enabling the provision of comprehensive educational services."
                },
                {
                    "Event": "Dividend Distribution",
                    "Time": "December, 2020",
                    "Description": "EduCorp decided to distribute $4 million of dividends to its shareholders, reflecting its strong financial performance and commitment to enhancing shareholder returns.",
                    "Impact": "The dividend distribution rewarded investors and further enhanced shareholder returns."
                }
            ],
            "Involved Indicators": [
                {
                    "Indicator": "Operating Income",
                    "Description": "The total amount of main business income and other business income within a certain accounting period.",
                    "Influencing Factors": [
                        "Market Demand",
                        "Changes in Product Prices"
                    ],
                    "Value": "$150 million"
                },
                {
                    "Indicator": "Net Profit",
                    "Description": "The net income of the company within a certain accounting period, i.e., total income minus total costs and taxes.",
                    "Influencing Factors": [
                        "Operating Income",
                        "Cost Control",
                        "Non-recurring Gains and Losses"
                    ],
                    "Value": "$25 million"
                },
                {
                    "Indicator": "Total Assets",
                    "Description": "The total amount of assets owned by the company at the end of the accounting period.",
                    "Influencing Factors": [
                        "Asset Acquisition",
                        "Asset Disposal",
                        "Asset Revaluation"
                    ],
                    "Value": "$500 million"
                },
                {
                    "Indicator": "Total Liabilities",
                    "Description": "The total amount of debts the company is obligated to repay at the end of the accounting period.",
                    "Influencing Factors": [
                        "New Debt Issuance",
                        "Debt Repayment",
                        "Debt Restructuring"
                    ],
                    "Value": "$200 million"
                },
                {
                    "Indicator": "Shareholder Equity",
                    "Description": "The total amount of equity belonging to shareholders at the end of the accounting period.",
                    "Influencing Factors": [
                        "Net Profit",
                        "Dividend Distribution",
                        "Capital Reserves"
                    ],
                    "Value": "$300 million"
                },
                {
                    "Indicator": "Cash Flow",
                    "Description": "The total cash inflows and outflows of the company within a certain accounting period.",
                    "Influencing Factors": [
                        "Operating Activities",
                        "Investment Activities",
                        "Financing Activities"
                    ],
                    "Value": "$50 million"
                },
                {
                    "Indicator": "Debt Ratio",
                    "Description": "The ratio of total liabilities to total assets, reflecting the company's debt level.",
                    "Influencing Factors": [
                        "Changes in Total Liabilities",
                        "Changes in Total Assets"
                    ],
                    "Value": "40%"
                },
                {
                    "Indicator": "Debt to Assets Ratio",
                    "Description": "The percentage of total liabilities to total assets, a measure of the company's financial leverage.",
                    "Influencing Factors": [
                        "Increases or decreases in assets and liabilities"
                    ],
                    "Value": "0.4"
                },
                {
                    "Indicator": "Return on Equity",
                    "Description": "Reflects the operational efficiency of shareholder equity, namely the ratio of net profit to average shareholder equity.",
                    "Influencing Factors": [
                        "Change in Net Profit",
                        "Change in Shareholder Equity"
                    ],
                    "Value": "8%"
                }
            ]
        }
    ],
    "Additional Information": [
        {
            "Name": "Future Outlook",
            "Content": [
                {
                    "Name": "Financial Strategy",
                    "Description": "EduCorp plans to implement a comprehensive financial strategy, focusing on cost control initiatives to improve profitability while maximizing capital operations to fund future investments."
                },
                {
                    "Name": "Investment Plans",
                    "Description": "EduCorp's investment plans include expanding its online learning platform, developing new courses for vocational education, and investing in research and development to enhance its technological capabilities."
                },
                {
                    "Name": "Risk Management",
                    "Description": "EduCorp has identified major financial risks such as changes in government policies, market competition, and economic uncertainties. To manage these risks, the company will maintain a diversified portfolio, maintain strong relationships with key stakeholders, and implement risk mitigation strategies."
                }
            ]
        }
    ],
    "Generated Outline": "I. Introduction\n    A. Company Information\n        [Establishment Date](March 1, 2005)\n        [Main Business](EduCorp provides educational services through online platforms and physical learning centers.)\n        [Registration Location](City of Education, Country A)\n        [Listing Status](Publicly Listed)\n        [Industry](Education)\n        \nII. Financial Information\n    A. Asset Restructuring (January, 2020)\n        1. Description: EduCorp underwent an asset restructuring, optimizing its business structure by divesting from underperforming businesses and focusing on core educational services.\n        2. Impact: The asset restructuring improved the operational efficiency of EduCorp, leading to an increase in company value.\n        3. Acquisition of Online Learning Platform (February, 2020)\n            - Description: EduCorp acquired an online learning platform specialized in providing virtual classrooms and interactive educational content. This acquisition allowed EduCorp to enhance its online presence, expand its customer base, and offer a more comprehensive range of educational services.\n            - Impact: The acquisition strengthened EduCorp's position in the online education market and increased its revenue streams.\n        4. Partnership with Local Schools (March, 2020)\n            - Description: EduCorp formed strategic partnerships with several local schools to integrate its educational programs and services into their curriculum. This partnership facilitated the expansion of EduCorp's physical learning centers and helped establish a strong presence in the local education community.\n            - Impact: The partnership with local schools increased the visibility of EduCorp's brand and attracted more students to its physical learning centers, resulting in higher enrollment numbers.\n        5. Development of AI-Powered Learning Analytics (April, 2020)\n            - Description: EduCorp invested in the development of an AI-powered learning analytics system that analyzes students' performance data to provide personalized recommendations and feedback. This system allowed EduCorp to offer a more tailored learning experience and improve educational outcomes for its students.\n            - Impact: The development of the AI-powered learning analytics system enhanced the quality of EduCorp's educational services and increased student satisfaction and retention rates.\n        6. Expansion into International Markets (August, 2020)\n            - Description: EduCorp expanded its operations into international markets by establishing partnerships with educational institutions in different countries. This expansion allowed EduCorp to tap into new customer segments, diversify its revenue sources, and gain a global presence in the education industry.\n            - Impact: The international expansion increased EduCorp's market reach and revenue, contributing to its overall growth and financial performance.\n    B. Major Investment (February, 2020)\n        - Description: EduCorp invested $10 million in Project SmartLearn, an innovative online learning platform that offers personalized education solutions.\n        - Impact: This major investment further broadened EduCorp's business areas and enhanced its profitability.\n    C. Debt Restructuring (March, 2020)\n        - Description: To optimize its capital structure, EduCorp underwent debt restructuring, reducing its liabilities by $5 million through debt renegotiations and repayment strategies.\n        - Impact: The debt restructuring improved EduCorp's financial condition, reduced its financial costs, and increased its liquidity.\n    D. Significant Equity Acquisition (April, 2020)\n        - Description: EduCorp completed the acquisition of 40% equity of Alpha Schools, a renowned K-12 institution in the region.\n        - Impact: This significant equity acquisition further expanded EduCorp's market share and enhanced its control in the education industry.\n    E. Large-scale Financing (May, 2020)\n        - Description: EduCorp conducted a large-scale financing activity, raising $50 million from a consortium of private investors and institutional lenders.\n        - Impact: The large-scale financing strengthened EduCorp's financial strength, supported its expansion and development plans, and fueled its growth ambitions.\n    F. Major Asset Acquisition (September, 2020)\n        - Description: EduCorp completed the asset acquisition of Global Education Solutions, a leading provider of professional development programs for educators, with a total value of $20 million.\n        - Impact: This major asset acquisition expanded EduCorp's business scope, enhancing its market competitiveness and enabling the provision of comprehensive educational services.\n    G. Dividend Distribution (December, 2020)\n        - Description: EduCorp decided to distribute $4 million of dividends to its shareholders, reflecting its strong financial performance and commitment to enhancing shareholder returns.\n        - Impact: The dividend distribution rewarded investors and further enhanced shareholder returns.\n   \nIII. Involved Indicators\n    A. Operating Income ($150 million)\n        1. Description: The total amount of main business income and other business income within a certain accounting period.\n        2. Influencing Factors: Market Demand, Changes in Product Prices\n    B. Net Profit ($25 million)\n        1. Description: The net income of the company within a certain accounting period, i.e., total income minus total costs and taxes.\n        2. Influencing Factors: Operating Income, Cost Control, Non-recurring Gains and Losses\n    C. Total Assets ($500 million)\n        1. Description: The total amount of assets owned by the company at the end of the accounting period.\n        2. Influencing Factors: Asset Acquisition, Asset Disposal, Asset Revaluation\n    D. Total Liabilities ($200 million)\n        1. Description: The total amount of debts the company is obligated to repay at the end of the accounting period.\n        2. Influencing Factors: New Debt Issuance, Debt Repayment, Debt Restructuring\n    E. Shareholder Equity ($300 million)\n        1. Description: The total amount of equity belonging to shareholders at the end of the accounting period.\n        2. Influencing Factors: Net Profit, Dividend Distribution, Capital Reserves\n    F. Cash Flow ($50 million)\n        1. Description: The total cash inflows and outflows of the company within a certain accounting period.\n        2. Influencing Factors: Operating Activities, Investment Activities, Financing Activities\n    G. Debt Ratio (40%)\n        1. Description: The ratio of total liabilities to total assets, reflecting the company's debt level.\n        2. Influencing Factors: Changes in Total Liabilities, Changes in Total Assets\n    H. Debt to Assets Ratio (0.4)\n        1. Description: The percentage of total liabilities to total assets, a measure of the company's financial leverage.\n        2. Influencing Factors: Increases or decreases in assets and liabilities\n    I. Return on Equity (8%)\n        1. Description: Reflects the operational efficiency of shareholder equity, namely the ratio of net profit to average shareholder equity.\n        2. Influencing Factors: Change in Net Profit, Change in Shareholder Equity\n        \nIV. Additional Information\n    A. Future Outlook\n        1. Financial Strategy\n            - Description: EduCorp plans to implement a comprehensive financial strategy, focusing on cost control initiatives to improve profitability while maximizing capital operations to fund future investments.\n        2. Investment Plans\n            - Description: EduCorp's investment plans include expanding its online learning platform, developing new courses for vocational education, and investing in research and development to enhance its technological capabilities.\n        3. Risk Management\n            - Description: EduCorp has identified major financial risks such as changes in government policies, market competition, and economic uncertainties. To manage these risks, the company will maintain a diversified portfolio, maintain strong relationships with key stakeholders, and implement risk mitigation strategies.",
    "Generated Summary": "EduCorp, established on March 1, 2005, is an education company that offers educational services through online platforms and physical learning centers, headquartered in the City of Education, Country A.",
    "Generated Article": "In January 2020, EduCorp underwent an asset restructuring, optimizing its business structure by divesting from underperforming businesses and focusing on core educational services. This strategic move had a significant impact on the company's operational efficiency and overall value. \n\nFollowing the asset restructuring, EduCorp made a key acquisition in February 2020, acquiring an online learning platform specialized in providing virtual classrooms and interactive educational content. This acquisition allowed EduCorp to enhance its online presence, expand its customer base, and offer a more comprehensive range of educational services. As a result, EduCorp strengthened its position in the online education market and experienced an increase in revenue streams.\n\nIn March 2020, EduCorp formed strategic partnerships with several local schools, integrating its educational programs and services into their curriculum. This partnership not only facilitated the expansion of EduCorp's physical learning centers but also helped establish a strong presence in the local education community. Consequently, the partnership with local schools increased the visibility of EduCorp's brand and attracted more students to its physical learning centers, leading to higher enrollment numbers.\n\nIn April 2020, EduCorp invested in the development of an AI-powered learning analytics system. This system analyzes students' performance data to provide personalized recommendations and feedback, thereby offering a more tailored learning experience and improving educational outcomes. The development of this AI-powered learning analytics system enhanced the quality of EduCorp's educational services, resulting in increased student satisfaction and higher retention rates.\n\nIn August 2020, EduCorp expanded its operations into international markets by establishing partnerships with educational institutions in different countries. This strategic move allowed EduCorp to tap into new customer segments, diversify its revenue sources, and gain a global presence in the education industry. The international expansion contributed to EduCorp's overall growth and financial performance.\n\nIn February 2020, EduCorp made a major investment of $10 million in Project SmartLearn, an innovative online learning platform that offers personalized education solutions. This investment further broadened EduCorp's business areas and enhanced its profitability.\n\nTo optimize its capital structure, EduCorp underwent debt restructuring in March 2020, reducing its liabilities by $5 million through debt renegotiations and repayment strategies. This debt restructuring improved EduCorp's financial condition, reduced its financial costs, and increased its liquidity.\n\nIn April 2020, EduCorp completed the acquisition of 40% equity of Alpha Schools, a renowned K-12 institution in the region. This significant equity acquisition further expanded EduCorp's market share and enhanced its control in the education industry.\n\nIn May 2020, EduCorp conducted a large-scale financing activity, raising $50 million from a consortium of private investors and institutional lenders. This large-scale financing strengthened EduCorp's financial strength, supported its expansion and development plans, and fueled its growth ambitions.\n\nIn September 2020, EduCorp completed the asset acquisition of Global Education Solutions, a leading provider of professional development programs for educators, with a total value of $20 million. This major asset acquisition expanded EduCorp's business scope, enhancing its market competitiveness and enabling the provision of comprehensive educational services.\n\nIn December 2020, EduCorp decided to distribute $4 million of dividends to its shareholders, reflecting its strong financial performance and commitment to enhancing shareholder returns.\n\nMoving on to the involved indicators, EduCorp's operating income reached $150 million, reflecting the total amount of main business income and other business income within a certain accounting period. This figure is influenced by market demand and changes in product prices.\n\nThe net profit of EduCorp stood at $25 million, representing the net income of the company within a certain accounting period. It is calculated by deducting total costs and taxes from total income. The net profit is influenced by operating income, cost control, and non-recurring gains and losses.\n\nEduCorp's total assets amounted to $500 million, indicating the total amount of assets owned by the company at the end of the accounting period. The value of total assets is influenced by asset acquisition, asset disposal, and asset revaluation.\n\nThe total liabilities of EduCorp were recorded at $200 million, representing the total amount of debts the company is obligated to repay at the end of the accounting period. The total liabilities are influenced by new debt issuance, debt repayment, and debt restructuring.\n\nShareholder equity, which represents the total amount of equity belonging to shareholders at the end of the accounting period, stood at $300 million for EduCorp. The shareholder equity is influenced by net profit, dividend distribution, and capital reserves.\n\nEduCorp's cash flow for the accounting period amounted to $50 million, reflecting the total cash inflows and outflows of the company. The cash flow is influenced by operating activities, investment activities, and financing activities.\n\nThe debt ratio of EduCorp is 40%, indicating the ratio of total liabilities to total assets. This ratio reflects the company's debt level and is influenced by changes in total liabilities and total assets.\n\nThe debt to assets ratio of EduCorp is 0.4, representing the percentage of total liabilities to total assets. This ratio is a measure of the company's financial leverage and is influenced by increases or decreases in assets and liabilities.\n\nThe return on equity for EduCorp is 8%, which reflects the operational efficiency of shareholder equity. It is calculated by dividing net profit by average shareholder equity. The return on equity is influenced by changes in net profit and changes in shareholder equity.\n\nLooking ahead, EduCorp plans to implement a comprehensive financial strategy, focusing on cost control initiatives to improve profitability while maximizing capital operations to fund future investments. The company's investment plans include expanding its online learning platform, developing new courses for vocational education, and investing in research and development to enhance its technological capabilities. EduCorp has also identified major financial risks such as changes in government policies, market competition, and economic uncertainties. To manage these risks, the company will maintain a diversified portfolio, strong relationships with key stakeholders, and implement risk mitigation strategies."
}