{
    "Report Type": "Corporate Governance Report",
    "Report Time": "2017",
    "Company Information": {
        "Name": "Evergreen Consumer Goods Co.",
        "Establishment Date": "June 1, 2000",
        "Main Business": "Manufacturer and distributor of personal care and household goods",
        "Registration Location": "New York, United States",
        "Listing Status": "Publicly traded on NYSE",
        "Industry": "Consumer Goods"
    },
    "Report Content": [
        {
            "Type": "Governance Structure",
            "Significant Events": [
                {
                    "Event": "Sustainability and Social Responsibility Initiatives",
                    "Time": "March, 2017",
                    "Description": "Launched a comprehensive sustainability program that reduced environmental impact by 20% through energy-efficient manufacturing processes, increased use of recycled materials, and community outreach initiatives.",
                    "Impact": "The sustainability and social responsibility initiatives enhance the company's public image and market competitiveness, promoting long-term sustainable development while contributing to a more environmentally-friendly future.",
                    "Sub Events": [
                        {
                            "Event": "Strategic partnership with a renewable energy company",
                            "Time": "April, 2017",
                            "Description": "Signed a strategic partnership agreement with a renewable energy company to implement solar panel installations on company facilities, reducing energy consumption and carbon emissions.",
                            "Impact": "This partnership allowed Evergreen Consumer Goods Co. to further reduce its environmental impact, improve energy efficiency, and enhance its reputation as a sustainable company."
                        },
                        {
                            "Event": "Launch of a corporate recycling program",
                            "Time": "June, 2017",
                            "Description": "Implemented a corporate-wide recycling program to reduce waste and promote the responsible disposal of materials used in the manufacturing process.",
                            "Impact": "The corporate recycling program demonstrated Evergreen Consumer Goods Co.'s commitment to sustainability, leading to cost savings, enhanced resource management, and improved reputation within the industry."
                        },
                        {
                            "Event": "Collaboration with local communities on environmental initiatives",
                            "Time": "August, 2017",
                            "Description": "Engaged in collaborative efforts with local communities to organize environmental initiatives, such as tree planting campaigns and waste cleanup projects.",
                            "Impact": "Through these initiatives, Evergreen Consumer Goods Co. fostered good relationships with the local communities, strengthened its brand image as an environmentally responsible company, and contributed to the well-being of the environment in which it operates."
                        },
                        {
                            "Event": "Partnership with NGO for water conservation projects",
                            "Time": "September, 2017",
                            "Description": "Established a partnership with a non-governmental organization (NGO) specializing in water conservation to develop and implement projects aimed at reducing water usage and improving water management within the company's operations.",
                            "Impact": "By partnering with the NGO, Evergreen Consumer Goods Co. actively demonstrated its dedication to sustainable water use, improved operational efficiency, and met industry best practices while positively impacting water resources in water-stressed regions."
                        }
                    ]
                },
                {
                    "Event": "Shareholders' Meeting Resolution",
                    "Time": "April, 2017",
                    "Description": "Approval of a dividend increase of 15% to reward shareholders for their continued support. The meeting also resulted in the reappointment of the company's auditor and the adoption of an amendment to the company's charter to allow for more flexibility in future financings.",
                    "Impact": "The resolution directly affects the company's governance structure, future operational strategies, and shareholder rights, ensuring enhanced shareholder value and flexibility in financial decisions."
                },
                {
                    "Event": "Compliance and Regulatory Updates",
                    "Time": "May, 2017",
                    "Description": "Compliance with new regulations, including the implementation of the General Data Protection Regulation (GDPR) and the introduction of stricter sustainability reporting standards to align with international best practices.",
                    "Impact": "The company ensures compliance with the latest laws and regulations, reducing legal risk and protecting the company and shareholder interests, while also promoting sustainable business practices."
                },
                {
                    "Event": "Risk Management Measures",
                    "Time": "July, 2017",
                    "Description": "Updated the company's risk management framework, conducting a comprehensive risk assessment that identified emerging risks related to supply chain disruptions and increased cybersecurity threats. Implemented mitigation strategies, including supplier diversification and the enhancement of cybersecurity protocols.",
                    "Impact": "The updated risk management measures improve the company's ability to respond to internal and external risks, ensuring continuous operation and stable development even in the face of potential challenges."
                },
                {
                    "Event": "Ethics and Integrity Incidents",
                    "Time": "August, 2017",
                    "Description": "Promptly addressed a minor ethics incident related to an employee violation of the internal code of conduct. The company conducted a thorough investigation, terminated the employee in question, and reinforced ethics training across all departments.",
                    "Impact": "The company's swift and transparent handling of the incident demonstrates its commitment to ethics and integrity, minimizing potential damage to the company's reputation and brand value."
                },
                {
                    "Event": "Corporate Governance Policy Revision",
                    "Time": "September, 2017",
                    "Description": "Revision of the corporate governance framework to enhance transparency, accountability, and stakeholder engagement. The revision includes the introduction of a whistleblower mechanism and the establishment of a dedicated ethics hotline.",
                    "Impact": "The revised corporate governance policy enhances transparency, accountability, and stakeholder confidence, positively influencing the company's operations and reputation."
                },
                {
                    "Event": "Senior Management Changes",
                    "Time": "October, 2017",
                    "Description": "Appointed a new Chief Financial Officer (CFO), Lisa Anderson, with a proven track record in financial management within the consumer goods industry. The new CFO will further strengthen the company's financial performance and growth strategies.",
                    "Impact": "The new senior management appointment may lead to adjustments in operational focus and strategic priorities, positively impacting both short-term performance and long-term development."
                },
                {
                    "Event": "Board of Directors Change",
                    "Time": "December, 2017",
                    "Description": "Appointment of two new independent directors, John Smith and Emily Johnson. The new board members bring extensive experience in consumer goods and will contribute to the company's strategic direction.",
                    "Impact": "The new board members will provide fresh perspectives and insights, enabling strategic adjustments that will positively impact the company's long-term development direction and shareholder interests."
                }
            ],
            "Involved Indicators": [
                {
                    "Indicator": "Information Disclosure",
                    "Description": "The company is committed to transparent information disclosure and follows the principles and methods outlined in the Information Disclosure Policy. The current implementation status is in full compliance.",
                    "Value": "Stable and transparent"
                },
                {
                    "Indicator": "Related Transactions",
                    "Description": "To maintain fairness and compliance, Evergreen Consumer Goods Co. has implemented comprehensive policies, procedures, and measures to govern related transactions. The company ensures that all transactions are conducted with integrity and in the best interest of the company and its shareholders.",
                    "Value": "Strict adherence"
                },
                {
                    "Indicator": "Internal Control",
                    "Description": "Evergreen Consumer Goods Co. has established a robust internal control system to safeguard the company's assets, ensure reliable financial reporting, and comply with relevant laws and regulations. The internal control system is regularly assessed by independent auditors to guarantee its effectiveness.",
                    "Value": "Effective and robust"
                }
            ]
        }
    ],
    "Additional Information": [
        {
            "Name": "Governance Improvement Plans",
            "Content": [
                {
                    "Name": "Strengthening the Function of the Board of Directors and Supervisory Board",
                    "Description": "Evergreen Consumer Goods Co. aims to enhance the efficiency and effectiveness of the board of directors and supervisory board in corporate governance. The company plans to provide regular training to board members, increase the proportion of independent directors, and optimize decision-making processes for more streamlined operations."
                },
                {
                    "Name": "Enhancing Transparency and Quality of Information Disclosure",
                    "Description": "Evergreen Consumer Goods Co. is committed to improving the information disclosure process and setting higher standards to ensure timely, accurate, and comprehensive reporting to all stakeholders. The company plans to leverage advanced technology to enhance communication channels and provide transparent and high-quality information."
                }
            ]
        },
        {
            "Name": "Risk Management Strategy",
            "Content": [
                {
                    "Name": "Strengthening the Internal Control System",
                    "Description": "Evergreen Consumer Goods Co. is dedicated to establishing and improving its internal control system. The company aims to identify, assess, monitor, and report financial and operational risks effectively. By strengthening the internal control system, Evergreen Consumer Goods Co. will enhance its ability to withstand risks and drive sustainable growth."
                },
                {
                    "Name": "Integrating Sustainable Development and Social Responsibility",
                    "Description": "Evergreen Consumer Goods Co. recognizes the importance of sustainable development and social responsibility. The company will incorporate these principles into its overall strategy, identifying related risks and opportunities to promote long-term value creation. By aligning the company's objectives with sustainability goals, Evergreen Consumer Goods Co. aims to achieve positive environmental and social impact."
                }
            ]
        }
    ],
    "Generated Outline": "I. Introduction\n   A. Company Information\n      1. Name: Evergreen Consumer Goods Co.\n      2. Establishment Date: June 1, 2000\n      3. Main Business: Manufacturer and distributor of personal care and household goods\n      4. Registration Location: New York, United States\n      5. Listing Status: Publicly traded on NYSE\n      6. Industry: Consumer Goods\n      \nII. Governance Structure\n   A. Significant Events\n      1. Sustainability and Social Responsibility Initiatives (March, 2017)\n         a. Description: Launched a comprehensive sustainability program that reduced environmental impact by 20% through energy-efficient manufacturing processes, increased use of recycled materials, and community outreach initiatives.\n         b. Impact: Enhances the company's public image and market competitiveness, promoting long-term sustainable development while contributing to a more environmentally-friendly future.\n         c. Sub Events\n            i. Strategic partnership with a renewable energy company (April, 2017)\n               - Description: Signed a strategic partnership agreement with a renewable energy company to implement solar panel installations on company facilities, reducing energy consumption and carbon emissions.\n               - Impact: Further reduces environmental impact, improves energy efficiency, and enhances the company's reputation as a sustainable company.\n            ii. Launch of a corporate recycling program (June, 2017)\n               - Description: Implemented a corporate-wide recycling program to reduce waste and promote the responsible disposal of materials used in the manufacturing process.\n               - Impact: Demonstrates the company's commitment to sustainability, leading to cost savings, enhanced resource management, and improved reputation within the industry.\n            iii. Collaboration with local communities on environmental initiatives (August, 2017)\n               - Description: Engaged in collaborative efforts with local communities to organize environmental initiatives, such as tree planting campaigns and waste cleanup projects.\n               - Impact: Fosters good relationships with local communities, strengthens brand image as an environmentally responsible company, and contributes to the well-being of the environment.\n            iv. Partnership with NGO for water conservation projects (September, 2017)\n               - Description: Established a partnership with a non-governmental organization (NGO) specializing in water conservation to develop and implement projects aimed at reducing water usage and improving water management.\n               - Impact: Actively demonstrates dedication to sustainable water use, improved operational efficiency, and met industry best practices while positively impacting water resources in water-stressed regions.\n      2. Shareholders' Meeting Resolution (April, 2017)\n         - Description: Approval of a dividend increase of 15% to reward shareholders' continued support. Reappointment of the company's auditor and adoption of an amendment to the company's charter for future financings.\n         - Impact: Affects the company's governance structure, future operational strategies, and shareholder rights, ensuring enhanced shareholder value and flexibility in financial decisions.\n      3. Compliance and Regulatory Updates (May, 2017)\n         - Description: Compliance with new regulations, including the implementation of the General Data Protection Regulation (GDPR) and stricter sustainability reporting standards to align with international best practices.\n         - Impact: Ensures compliance with the latest laws and regulations, reducing legal risk, protecting the company and shareholder interests, and promoting sustainable business practices.\n      4. Risk Management Measures (July, 2017)\n         - Description: Updated the company's risk management framework, conducted a comprehensive risk assessment to identify emerging risks related to supply chain disruptions and increased cybersecurity threats. Implemented mitigation strategies, including supplier diversification and enhanced cybersecurity protocols.\n         - Impact: Improves the company's ability to respond to internal and external risks, ensuring continuous operation and stable development even in the face of potential challenges.\n      5. Ethics and Integrity Incidents (August, 2017)\n         - Description: Promptly addressed a minor ethics incident related to an employee violation of the internal code of conduct. Conducted a thorough investigation, terminated the employee, and reinforced ethics training across all departments.\n         - Impact: Swift and transparent handling of the incident demonstrates the company's commitment to ethics and integrity, minimizing potential damage to the company's reputation and brand value.\n      6. Corporate Governance Policy Revision (September, 2017)\n         - Description: Revision of the corporate governance framework to enhance transparency, accountability, and stakeholder engagement. Introduction of a whistleblower mechanism and the establishment of a dedicated ethics hotline.\n         - Impact: The revised corporate governance policy enhances transparency, accountability, and stakeholder confidence, positively influencing the company's operations and reputation.\n      7. Senior Management Changes (October, 2017)\n         - Description: Appointment of a new Chief Financial Officer (CFO), Lisa Anderson, with a proven track record in financial management within the consumer goods industry. The new CFO will strengthen the company's financial performance and growth strategies.\n         - Impact: The new senior management appointment may lead to adjustments in operational focus and strategic priorities, positively impacting both short-term performance and long-term development.\n      8. Board of Directors Change (December, 2017)\n         - Description: Appointment of two new independent directors, John Smith and Emily Johnson, bringing extensive experience in the consumer goods industry. The new board members will contribute to the company's strategic direction.\n         - Impact: The new board members provide fresh perspectives and insights, enabling strategic adjustments that positively impact the company's long-term development direction and shareholder interests.\n   \nIII. Involved Indicators\n   A. Information Disclosure (Stable and transparent)\n      - Description: The company is committed to transparent information disclosure and follows the principles and methods outlined in the Information Disclosure Policy. The current implementation status is in full compliance.\n   B. Related Transactions (Strict adherence)\n      - Description: To maintain fairness and compliance, the company has implemented comprehensive policies, procedures, and measures to govern related transactions. All transactions are conducted with integrity and in the best interest of the company and its shareholders.\n   C. Internal Control (Effective and robust)\n      - Description: The company has established a robust internal control system to safeguard its assets, ensure reliable financial reporting, and comply with relevant laws and regulations. The system is regularly assessed by independent auditors to guarantee its effectiveness.\n   \nIV. Additional Information\n   A. Governance Improvement Plans\n      1. Strengthening the Function of the Board of Directors and Supervisory Board\n         - Description: Aim to enhance the efficiency and effectiveness of the board of directors and supervisory board in corporate governance. Plan to provide regular training to board members, increase the proportion of independent directors, and optimize decision-making processes for more streamlined operations.\n      2. Enhancing Transparency and Quality of Information Disclosure\n         - Description: Committed to improving the information disclosure process and setting higher standards to ensure timely, accurate, and comprehensive reporting to all stakeholders. Plan to leverage advanced technology to enhance communication channels and provide transparent and high-quality information.\n   \n   B. Risk Management Strategy\n      1. Strengthening the Internal Control System\n         - Description: Dedicated to establishing and improving a robust internal control system. Aims to identify, assess, monitor, and report financial and operational risks effectively. By strengthening the internal control system, the company will enhance its ability to withstand risks and drive sustainable growth.\n      2. Integrating Sustainable Development and Social Responsibility\n         - Description: Recognizes the importance of sustainable development and social responsibility. Will incorporate these principles into the overall strategy, identifying related risks and opportunities to promote long-term value creation. By aligning the company's objectives with sustainability goals, aims to achieve positive environmental and social impact.",
    "Generated Summary": "Evergreen Consumer Goods Co., established on June 1, 2000, is a publicly traded company on the NYSE, specializing in the manufacturing and distribution of personal care and household goods, headquartered in New York, United States.",
    "Generated Article": "Evergreen Consumer Goods Co. has demonstrated a strong commitment to sustainability and social responsibility through various significant events. In March 2017, the company launched a comprehensive sustainability program aimed at reducing its environmental impact. This program included implementing energy-efficient manufacturing processes, increasing the use of recycled materials, and engaging in community outreach initiatives. As a result, Evergreen was able to reduce its environmental impact by 20%. This initiative not only enhances the company's public image but also improves its market competitiveness, promoting long-term sustainable development while contributing to a more environmentally-friendly future.\n\nOne of the sub-events that occurred as part of the sustainability program was the strategic partnership with a renewable energy company in April 2017. Through this partnership, Evergreen implemented solar panel installations on its facilities, leading to a further reduction in energy consumption and carbon emissions. This initiative not only contributes to the company's environmental goals but also improves energy efficiency and enhances its reputation as a sustainable company.\n\nIn June 2017, Evergreen launched a corporate recycling program to reduce waste and promote responsible disposal of materials used in the manufacturing process. This program not only demonstrates the company's commitment to sustainability but also leads to cost savings, enhanced resource management, and an improved reputation within the industry.\n\nFurthermore, in August 2017, Evergreen collaborated with local communities on environmental initiatives such as tree planting campaigns and waste cleanup projects. These collaborative efforts not only foster good relationships with local communities but also strengthen the company's brand image as an environmentally responsible organization. Additionally, Evergreen established a partnership with a non-governmental organization specializing in water conservation in September 2017. This partnership aims to develop and implement projects that reduce water usage and improve water management. By actively demonstrating dedication to sustainable water use, Evergreen improves its operational efficiency and positively impacts water resources in water-stressed regions.\n\nIn April 2017, Evergreen's shareholders' meeting approved a dividend increase of 15% to reward shareholders' continued support. This resolution not only enhances shareholder value but also provides flexibility in future financial decisions. The reappointment of the company's auditor and the adoption of an amendment to the company's charter for future financings further strengthen the company's governance structure and ensure the protection of shareholder rights.\n\nTo ensure compliance with new regulations, Evergreen implemented the General Data Protection Regulation (GDPR) and stricter sustainability reporting standards in May 2017. This compliance ensures reduced legal risk, protects the company and shareholder interests, and promotes sustainable business practices.\n\nIn July 2017, Evergreen updated its risk management measures by conducting a comprehensive risk assessment. This assessment identified emerging risks related to supply chain disruptions and increased cybersecurity threats. The company implemented mitigation strategies such as supplier diversification and enhanced cybersecurity protocols to ensure continuous operation and stable development in the face of potential challenges.\n\nIn August 2017, Evergreen promptly addressed a minor ethics and integrity incident related to an employee violation of the internal code of conduct. The company conducted a thorough investigation, terminated the employee, and reinforced ethics training across all departments. This swift and transparent handling of the incident demonstrates Evergreen's commitment to ethics and integrity, minimizing potential damage to the company's reputation and brand value.\n\nIn September 2017, Evergreen revised its corporate governance policy to enhance transparency, accountability, and stakeholder engagement. The revision included the introduction of a whistleblower mechanism and the establishment of a dedicated ethics hotline. These changes enhance transparency, accountability, and stakeholder confidence, positively influencing the company's operations and reputation.\n\nIn October 2017, Evergreen appointed Lisa Anderson as the new Chief Financial Officer (CFO). With a proven track record in financial management within the consumer goods industry, Anderson's appointment is expected to strengthen the company's financial performance and growth strategies.\n\nLastly, in December 2017, Evergreen appointed two new independent directors, John Smith and Emily Johnson, to its board of directors. With extensive experience in the consumer goods industry, these new board members are expected to contribute to the company's strategic direction, positively impacting its long-term development direction and shareholder interests.\n\nEvergreen Consumer Goods Co. has demonstrated stability and transparency in its information disclosure. The company follows the principles and methods outlined in its Information Disclosure Policy, ensuring full compliance with information disclosure requirements.\n\nTo maintain fairness and compliance, Evergreen has implemented comprehensive policies, procedures, and measures governing related transactions. All transactions are conducted with integrity and in the best interest of the company and its shareholders.\n\nEvergreen has established an effective and robust internal control system to safeguard its assets, ensure reliable financial reporting, and comply with relevant laws and regulations. The system is regularly assessed by independent auditors to guarantee its effectiveness.\n\nMoving forward, Evergreen has outlined governance improvement plans to strengthen the function of its board of directors and supervisory board. These plans include regular training for board members, increasing the proportion of independent directors, and optimizing decision-making processes for more streamlined operations.\n\nAdditionally, Evergreen is committed to enhancing transparency and the quality of information disclosure. The company aims to improve the information disclosure process and set higher standards to ensure timely, accurate, and comprehensive reporting to all stakeholders. Leveraging advanced technology will be a key strategy in enhancing communication channels and providing transparent and high-quality information.\n\nIn terms of risk management, Evergreen is dedicated to strengthening its internal control system. The company aims to identify, assess, monitor, and report financial and operational risks effectively. By doing so, Evergreen will enhance its ability to withstand risks and drive sustainable growth.\n\nFurthermore, Evergreen recognizes the importance of sustainable development and social responsibility. The company plans to integrate these principles into its overall strategy, identifying related risks and opportunities to promote long-term value creation. By aligning its objectives with sustainability goals, Evergreen aims to achieve a positive environmental and social impact.\n\nIn conclusion, Evergreen Consumer Goods Co. has demonstrated a strong commitment to sustainability, social responsibility, and effective governance. Through various significant events, the company has implemented initiatives to reduce its environmental impact, enhance shareholder value, ensure compliance with regulations, manage risks, and strengthen ethics and integrity. With ongoing governance improvement plans and a focus on risk management and sustainable development, Evergreen is well-positioned for continued success in the consumer goods industry."
}