{
    "Report Type": "Corporate Governance Report",
    "Report Time": "2017",
    "Company Information": {
        "Name": "Hudson Consumer Goods Co.",
        "Establishment Date": "April 1, 2003",
        "Main Business": "Manufacturing and distribution of personal care and household products.",
        "Registration Location": "New York, United States",
        "Listing Status": "Publicly traded on the New York Stock Exchange (NYSE)",
        "Industry": "Consumer Goods"
    },
    "Report Content": [
        {
            "Type": "Governance Structure",
            "Significant Events": [
                {
                    "Event": "Sustainability and Social Responsibility Initiatives",
                    "Time": "January, 2017",
                    "Description": "Hudson Consumer Goods Co. achieved significant progress in sustainability efforts, including reducing carbon emissions by 20% through improved manufacturing processes, implementing a comprehensive recycling program, and enhancing employee wellness initiatives. The company also initiated partnerships with local communities to support education and environmental conservation.",
                    "Impact": "These sustainability and social responsibility initiatives enhance the company's public image and market competitiveness, fostering long-term sustainable development and strengthening relationships with environmentally conscious consumers.",
                    "Sub Events": [
                        {
                            "Event": "Launch of Green Manufacturing Program",
                            "Time": "March, 2017",
                            "Description": "Hudson Consumer Goods Co. launched a comprehensive Green Manufacturing Program aimed at reducing carbon emissions and minimizing the environmental impact of its manufacturing processes. The program included the implementation of energy-efficient technologies and the optimization of production methods to reduce waste and resource consumption.",
                            "Impact": "The Green Manufacturing Program contributed to the company's achievement of reducing carbon emissions by 20%. It also positioned the company as a leader in sustainable manufacturing practices, attracting environmentally conscious customers and enhancing its reputation in the market."
                        },
                        {
                            "Event": "Implementation of Recycling Program",
                            "Time": "June, 2017",
                            "Description": "Hudson Consumer Goods Co. established a company-wide recycling program to effectively manage and reduce waste. The program encompassed the recycling of packaging materials, paper products, and other recyclable materials generated during the manufacturing and distribution processes. Employees were trained on proper waste segregation and recycling procedures.",
                            "Impact": "The implementation of the recycling program contributed to reducing the company's environmental footprint and resource consumption. It also showcased the company's commitment to sustainable practices and social responsibility, aligning with the expectations of environmentally conscious consumers."
                        },
                        {
                            "Event": "Launch of Employee Wellness Program",
                            "Time": "August, 2017",
                            "Description": "Hudson Consumer Goods Co. introduced an Employee Wellness Program designed to promote the health and well-being of its employees. The program included initiatives such as providing healthy food options, offering gym memberships, organizing stress management workshops, and encouraging work-life balance.",
                            "Impact": "The Employee Wellness Program resulted in improved employee satisfaction, productivity, and overall well-being. It enhanced the company's reputation as a caring and responsible employer, attracting and retaining top talent. Furthermore, healthier and happier employees positively impacted overall organizational performance."
                        },
                        {
                            "Event": "Partnership with Local Communities",
                            "Time": "October, 2017",
                            "Description": "Hudson Consumer Goods Co. formed partnerships with local communities to support education and environmental conservation. The company sponsored educational programs focused on promoting environmental awareness and provided resources for conservation projects in collaboration with local environmental organizations.",
                            "Impact": "The partnership with local communities allowed Hudson Consumer Goods Co. to actively contribute to societal development and environmental protection. It showcased the company's commitment to be a responsible corporate citizen, further enhancing its public image and fostering stronger relationships with the communities it operates in."
                        }
                    ]
                },
                {
                    "Event": "Senior Management Changes",
                    "Time": "February, 2017",
                    "Description": "Hudson Consumer Goods Co. experienced a change in senior management as Mr. James Thompson assumed the role of CEO, bringing extensive experience in international business expansion. The new CEO's strategic vision and focus on innovation led to recalibrating operations, streamlining processes, and investing in research and development.",
                    "Impact": "With the change in senior management, the company underwent adjustments in operational focus and strategic priorities, stimulating short-term performance improvements and positioning for long-term sustainable growth."
                },
                {
                    "Event": "Risk Management Measures",
                    "Time": "March, 2017",
                    "Description": "Hudson Consumer Goods Co. updated its risk management framework to proactively identify and address emerging risks. The company implemented improved fraud detection systems, strengthened supply chain resilience, and enhanced disaster recovery plans, ensuring continuous operation and stable development.",
                    "Impact": "By improving its ability to respond to internal and external risks, the company's risk management measures safeguard the organization against potential threats, supporting long-term growth and protecting shareholder interests."
                },
                {
                    "Event": "Compliance and Regulatory Updates",
                    "Time": "April, 2017",
                    "Description": "Hudson Consumer Goods Co. proactively updated its corporate governance practices to ensure compliance with new regulations and standards, such as the Securities Exchange Act and industry-specific regulations in the consumer goods sector. This includes enhancing cybersecurity measures to protect customer data and strengthening internal controls.",
                    "Impact": "These updates ensure the company's compliance with the latest laws and regulations, reducing legal risk and safeguarding the company and shareholder interests."
                },
                {
                    "Event": "Shareholders' Meeting Resolution",
                    "Time": "August, 2017",
                    "Description": "During the annual shareholders' meeting, Hudson Consumer Goods Co. made key decisions such as approving changes to the company's charter to enable diversification into new product categories. Additionally, shareholders voted in favor of a proposed acquisition of a smaller competitor, expanding the company's market reach.",
                    "Impact": "These decisions directly affect the company's governance structure, future operational strategies, and shareholder rights, invigorating the company's growth prospects and fostering shareholder value."
                },
                {
                    "Event": "Board of Directors Change",
                    "Time": "October, 2017",
                    "Description": "The board of directors of Hudson Consumer Goods Co. appointed four new members, including Mr. John Anderson, Ms. Lisa Thompson, Mr. Robert Johnson, and Ms. Sarah Smith. This change strengthens the company's strategic direction, combining expertise in marketing, finance, operations, and human resources.",
                    "Impact": "The new board members bring fresh perspectives and skills, leading to strategic adjustments that positively impact the company's long-term development and shareholder interests."
                },
                {
                    "Event": "Corporate Governance Policy Revision",
                    "Time": "November, 2017",
                    "Description": "Hudson Consumer Goods Co. revised its corporate governance policy to further enhance transparency, accountability, and stakeholder engagement. This includes implementing stricter guidelines for board independence, conducting regular performance evaluations of directors, and enhancing risk management practices.",
                    "Impact": "The revised policy bolsters corporate governance transparency and accountability, boosting stakeholder confidence and fostering a stronger relationship with shareholders."
                },
                {
                    "Event": "Ethics and Integrity Incidents",
                    "Time": "December, 2017",
                    "Description": "Hudson Consumer Goods Co. encountered an ethics and integrity incident related to conflicts of interest within the procurement department. The company took immediate action, launching an internal investigation and implementing stricter policies and procedures to prevent future occurrences.",
                    "Impact": "Although the incident had a temporary negative impact on the company's reputation and brand value, the prompt measures taken by the company demonstrate its commitment to ethical business practices, rebuilding trust among investors, customers, and partners."
                }
            ],
            "Involved Indicators": [
                {
                    "Indicator": "Information Disclosure",
                    "Description": "Hudson Consumer Goods Co. ensures transparent information disclosure through a robust system. The company reports financial performance, market updates, and material events in accordance with regulatory requirements, providing timely and accurate information to stakeholders.",
                    "Value": "The average time taken for information disclosure is 2 working days after the occurrence of the event."
                },
                {
                    "Indicator": "Related Transactions",
                    "Description": "Hudson Consumer Goods Co. maintains strict policies, procedures, and measures to ensure fairness and compliance of related transactions. These include thorough evaluations, independent reviews, and adherence to regulatory guidelines, ensuring no conflicts of interest in related party transactions.",
                    "Value": "All related transactions are subject to an independent review committee, which approves transactions deemed fair and compliant."
                },
                {
                    "Indicator": "Internal Control",
                    "Description": "Hudson Consumer Goods Co. has a robust internal control system in place to safeguard its assets, ensure accurate financial reporting, and mitigate operational risks. The company regularly assesses the effectiveness of its internal controls through independent audits to promptly identify and rectify any deficiencies.",
                    "Value": "The independent audit of internal controls for the past year revealed no significant deficiencies or material weaknesses in Hudson Consumer Goods Co.'s internal control system."
                }
            ]
        }
    ],
    "Additional Information": [
        {
            "Name": "Governance Improvement Plans",
            "Content": [
                {
                    "Name": "Strengthening the Function of the Board of Directors and Supervisory Board",
                    "Description": "Hudson Consumer Goods Co. is committed to enhancing the functionality of the board of directors and supervisory board. This involves providing regular training programs to enhance their understanding of corporate governance best practices. The company is also focused on increasing the proportion of independent directors to ensure unbiased decision-making and optimizing the decision-making process by leveraging technology for efficient collaboration and communication among board members."
                },
                {
                    "Name": "Enhancing Transparency and Quality of Information Disclosure",
                    "Description": "Hudson Consumer Goods Co. aims to continuously enhance the transparency and quality of its information disclosure. To achieve this objective, the company is implementing advanced reporting systems to ensure timely, accurate, and comprehensive reporting of financial and non-financial information to all stakeholders. The company is also proactively engaging with shareholders and other stakeholders through various communication channels to address their concerns and provide them with transparent updates on the company's performance and strategy."
                }
            ]
        },
        {
            "Name": "Risk Management Strategy",
            "Content": [
                {
                    "Name": "Strengthening the Internal Control System",
                    "Description": "Hudson Consumer Goods Co. is committed to continuously improving its internal control system to effectively identify, assess, monitor, and report financial and operational risks. The company is investing in advanced technologies, such as intelligent data analytics, to enhance risk identification capabilities. Regular internal and external audits, along with management reviews, ensure the effectiveness of internal controls. Hudson Consumer Goods Co. also encourages an open and transparent reporting culture to promptly identify and rectify any control deficiencies."
                },
                {
                    "Name": "Integrating Sustainable Development and Social Responsibility",
                    "Description": "Hudson Consumer Goods Co. recognizes the importance of sustainable development and social responsibility in long-term value creation. The company integrates sustainable development into its strategic decision-making processes, identifying related risks and opportunities. By considering environmental, social, and governance factors, the company aims to mitigate potential risks while maximizing value creation. The company actively engages with stakeholders, including employees, customers, suppliers, and local communities, to promote social responsibility initiatives and contribute to a sustainable future."
                }
            ]
        }
    ],
    "Generated Outline": "I. Introduction\n   A. Overview of the Company\n      - Name: Hudson Consumer Goods Co.\n      - Establishment Date: April 1, 2003\n      - Main Business: Manufacturing and distribution of personal care and household products\n      - Registration Location: New York, United States\n      - Listing Status: Publicly traded on the New York Stock Exchange (NYSE)\n      - Industry: Consumer Goods\n      - Report Time: 2017\n\nII. Governance Structure\n   A. Sustainability and Social Responsibility Initiatives (January, 2017)\n      - Description: Achievements in sustainability efforts, including reducing carbon emissions, implementing recycling program, enhancing employee wellness initiatives, and partnerships with local communities\n      - Impact: Enhancing the company's public image, market competitiveness, long-term sustainable development, and strengthening relationships with environmentally conscious consumers\n      - Significant Sub-Events:\n         1. Launch of Green Manufacturing Program (March, 2017)\n            - Description: Implementation of energy-efficient technologies and waste reduction strategies leading to a reduction in carbon emissions \n            - Impact: Positioning the company as a leader in sustainable manufacturing practices\n         2. Implementation of Recycling Program (June, 2017)\n            - Description: Established a company-wide recycling program to manage and reduce waste\n            - Impact: Showcasing the company's commitment to sustainable practices and social responsibility\n         3. Launch of Employee Wellness Program (August, 2017)\n            - Description: Introduced initiatives to promote the health and well-being of employees\n            - Impact: Improved employee satisfaction, productivity, and overall well-being\n         4. Partnership with Local Communities (October, 2017)\n            - Description: Formed partnerships to support education and environmental conservation\n            - Impact: Actively contributing to societal development and environmental protection\n\n   B. Senior Management Changes (February, 2017)\n      - Description: Mr. James Thompson assumed the role of CEO, leading to adjustments in operational focus and strategic priorities\n      - Impact: Stimulating short-term performance improvements and positioning for long-term sustainable growth\n\n   C. Risk Management Measures (March, 2017)\n      - Description: Updated risk management framework by implementing fraud detection systems, strengthening supply chain resilience, and enhancing disaster recovery plans\n      - Impact: Safeguarding the organization against potential threats, supporting long-term growth, and protecting shareholder interests\n\n   D. Compliance and Regulatory Updates (April, 2017)\n      - Description: Proactively updated corporate governance practices to comply with new regulations and standards, including cybersecurity measures and internal controls\n      - Impact: Ensuring compliance, reducing legal risk, and safeguarding company and shareholder interests\n\n   E. Shareholders' Meeting Resolution (August, 2017)\n      - Description: Key decisions made during the annual shareholders' meeting, including changes to the company's charter and acquisition of a smaller competitor\n      - Impact: Influencing the company's governance structure, operational strategies, and shareholder rights, fostering growth and enhancing shareholder value\n\n   F. Board of Directors Change (October, 2017)\n      - Description: The appointment of four new members to the board of directors, bringing expertise in marketing, finance, operations, and human resources\n      - Impact: Bringing fresh perspectives and skills, leading to strategic adjustments and positively impacting long-term development and shareholder interests\n\n   G. Corporate Governance Policy Revision (November, 2017)\n      - Description: Revised corporate governance policy to enhance transparency, accountability, and stakeholder engagement\n      - Impact: Bolstering corporate governance transparency and accountability, boosting stakeholder confidence, and fostering a stronger relationship with shareholders\n\n   H. Ethics and Integrity Incidents (December, 2017)\n      - Description: Encountered an ethics and integrity incident related to conflicts of interest within the procurement department\n      - Impact: Temporary negative impact on the company's reputation and brand value, rebuilding trust among investors, customers, and partners\n\nIII. Involved Indicators\n   A. Information Disclosure\n      - Description: Transparent information disclosure through a robust system, complying with regulatory requirements\n      - Value: Average time taken for information disclosure is 2 working days after the occurrence of the event\n\n   B. Related Transactions\n      - Description: Strict policies and procedures to ensure fairness and compliance in related transactions\n      - Value: All related transactions subject to an independent review committee for approval\n\n   C. Internal Control\n      - Description: Robust internal control system to safeguard assets, ensure accurate financial reporting, and mitigate operational risks \n      - Value: Past year's independent audit revealed no significant deficiencies or material weaknesses in internal control system\n\nIV. Additional Information\n   A. Governance Improvement Plans\n      1. Strengthening the Function of the Board of Directors and Supervisory Board\n         - Description: Enhancing functionality through regular training programs, increased proportion of independent directors, and leveraging technology for efficient collaboration\n      2. Enhancing Transparency and Quality of Information Disclosure\n         - Description: Implementing advanced reporting systems, proactive engagement with stakeholders, and transparent updates on performance and strategy\n\n   B. Risk Management Strategy\n      1. Strengthening the Internal Control System\n         - Description: Continuous improvement of the internal control system through advanced technologies, regular audits, and transparent reporting culture\n      2. Integrating Sustainable Development and Social Responsibility\n         - Description: Incorporating environmental, social, and governance factors into decision-making, engaging with stakeholders, and contributing to a sustainable future\n\nNote: The report outline provided above is a rough guide and can be further expanded or modified based on the specific requirements and preferences of the report.",
    "Generated Summary": "Hudson Consumer Goods Co., founded in April 2003 in New York, is a publicly traded company on the New York Stock Exchange, specializing in the manufacturing and distribution of personal care and household products in the consumer goods industry.",
    "Generated Article": "In January 2017, Hudson Consumer Goods Co. made significant strides in sustainability and social responsibility initiatives. These efforts included reducing carbon emissions, implementing a recycling program, enhancing employee wellness initiatives, and forming partnerships with local communities. These initiatives not only improved the company's public image but also strengthened its market competitiveness and long-term sustainable development. One of the key sub-events was the launch of the Green Manufacturing Program in March 2017. By implementing energy-efficient technologies and waste reduction strategies, the company successfully reduced its carbon emissions, positioning itself as a leader in sustainable manufacturing practices. In June 2017, Hudson Consumer Goods Co. established a company-wide recycling program, showcasing its commitment to sustainable practices and social responsibility. This initiative not only helped manage and reduce waste but also contributed to the company's overall environmental impact. Additionally, in August 2017, the company introduced an Employee Wellness Program, which aimed to promote the health and well-being of its employees. This initiative resulted in improved employee satisfaction, productivity, and overall well-being. Furthermore, in October 2017, Hudson Consumer Goods Co. formed partnerships with local communities to support education and environmental conservation. These partnerships actively contributed to societal development and environmental protection. Overall, these sustainability and social responsibility initiatives had a positive impact on the company's public image, market competitiveness, long-term sustainable development, and relationships with environmentally conscious consumers."
}