{
    "Report Type": "Corporate Financial Report",
    "Report Time": "2019",
    "Company Information": {
        "Name": "Vanguard Media Group",
        "Establishment Date": "March 1, 2000",
        "Main Business": "Vanguard Media Group is a diversified media company that operates television networks, film studios, and digital media platforms. The company produces and distributes a wide range of content, including movies, TV shows, documentaries, and digital entertainment.",
        "Registration Location": "Los Angeles, California",
        "Listing Status": "Publicly Traded",
        "Industry": "Media"
    },
    "Report Content": [
        {
            "Type": "Financial Information",
            "Significant Events": [
                {
                    "Event": "Asset Restructuring",
                    "Time": "January, 2019",
                    "Description": "Vanguard Media Group underwent an asset restructuring, optimizing its business structure by divesting non-performing assets and reallocating resources to high-growth areas.",
                    "Impact": "Improved operational efficiency, increased company value.",
                    "Sub Events": [
                        {
                            "Event": "Acquisition of XYZ Studios",
                            "Time": "March, 2019",
                            "Description": "Vanguard Media Group acquired XYZ Studios, a leading film production company known for its blockbuster hits. This strategic acquisition expands Vanguard's film studio division, strengthens its intellectual property portfolio, and enhances its competitive position in the film industry.",
                            "Impact": "Increased production capabilities, access to popular film franchises, improved market presence."
                        },
                        {
                            "Event": "Partnership with Digital Channel Inc.",
                            "Time": "June, 2019",
                            "Description": "Vanguard Media Group formed a strategic partnership with Digital Channel Inc., a prominent digital media platform provider. This collaboration enables Vanguard to tap into Digital Channel Inc.'s extensive user base, expand its digital content distribution, and enhance its online advertising capabilities.",
                            "Impact": "Broader digital reach, increased revenue from online advertising, strengthened digital media presence."
                        },
                        {
                            "Event": "Launch of Vanguard Streaming Service",
                            "Time": "August, 2019",
                            "Description": "Vanguard Media Group launched its own streaming service, offering a vast library of movies, TV shows, and exclusive content. The streaming service aims to compete with established players in the industry by providing a diverse range of high-quality content, accessible across various devices.",
                            "Impact": "New revenue stream, increased customer engagement, direct consumer connection."
                        }
                    ]
                },
                {
                    "Event": "Major Investment",
                    "Time": "May, 2019",
                    "Description": "Vanguard Media Group made a major investment in the development of an original streaming series called 'Breaking Point,' with an investment amount of $50 million. The series received critical acclaim and attracted a large audience, contributing to the company's revenue growth.",
                    "Impact": "Further broadened the company's business areas, enhanced profitability."
                },
                {
                    "Event": "Dividend Distribution",
                    "Time": "July, 2019",
                    "Description": "The company decided to distribute $0.75 per share of dividends to shareholders, reflecting its commitment to sharing profits with investors.",
                    "Impact": "Returned value to the investors, enhanced shareholder returns."
                },
                {
                    "Event": "Large-scale Financing",
                    "Time": "August, 2019",
                    "Description": "Vanguard Media Group conducted a large-scale financing activity, successfully raising $100 million in debt capital. The funds will be utilized for future strategic initiatives and acquisitions.",
                    "Impact": "Strengthened the company's financial strength, supported expansion and development."
                },
                {
                    "Event": "Major Asset Acquisition",
                    "Time": "October, 2019",
                    "Description": "The company completed the asset acquisition of Silver Screen Studios, a renowned film production company, with a total value of $200 million. This acquisition expanded Vanguard Media Group's film production capabilities and enhanced its market position.",
                    "Impact": "Expanded the company's business scope, enhanced market competitiveness."
                },
                {
                    "Event": "Debt Restructuring",
                    "Time": "November, 2019",
                    "Description": "To optimize its capital structure, Vanguard Media Group underwent debt restructuring, resulting in a reduction of liabilities by $50 million. This move improved the company's financial condition by reducing financial costs.",
                    "Impact": "Improved the company's financial condition, reduced financial costs."
                },
                {
                    "Event": "Significant Equity Acquisition",
                    "Time": "December, 2019",
                    "Description": "The company completed the acquisition of 30% equity of Ambient Digital, a leading digital media platform. This strategic move enabled Vanguard Media Group to further expand its market share and enhance its control in the digital media space.",
                    "Impact": "Further expanded the company's market share, enhanced the company's control."
                }
            ],
            "Involved Indicators": [
                {
                    "Indicator": "Operating Income",
                    "Description": "The total amount of main business income and other business income within a certain accounting period.",
                    "Influencing Factors": [
                        "Market demand, especially for original content",
                        "Changes in advertising revenues"
                    ],
                    "Value": "$1.2 billion"
                },
                {
                    "Indicator": "Net Profit",
                    "Description": "The net income of the company within a certain accounting period, i.e., total income minus total costs and taxes.",
                    "Influencing Factors": [
                        "Operating income growth",
                        "Efficiency in cost control",
                        "Minimization of non-recurring losses"
                    ],
                    "Value": "$300 million"
                },
                {
                    "Indicator": "Total Assets",
                    "Description": "The total amount of assets owned by the company at the end of the accounting period.",
                    "Influencing Factors": [
                        "Acquisition of Silver Screen Studios",
                        "Appreciation in the value of investment properties",
                        "Increased cash reserves"
                    ],
                    "Value": "$2.5 billion"
                },
                {
                    "Indicator": "Total Liabilities",
                    "Description": "The total amount of debts the company is obligated to repay at the end of the accounting period.",
                    "Influencing Factors": [
                        "Debt repayment",
                        "Liability reduction through debt restructuring",
                        "Effective debt management"
                    ],
                    "Value": "$1.1 billion"
                },
                {
                    "Indicator": "Shareholder Equity",
                    "Description": "The total amount of equity belonging to shareholders at the end of the accounting period.",
                    "Influencing Factors": [
                        "Net profit growth",
                        "Dividend distribution",
                        "Accumulation of capital reserves"
                    ],
                    "Value": "$1.4 billion"
                },
                {
                    "Indicator": "Cash Flow",
                    "Description": "The total cash inflows and outflows of the company within a certain accounting period.",
                    "Influencing Factors": [
                        "Positive operating cash flow",
                        "Effective management of investment activities",
                        "Successful financing activities"
                    ],
                    "Value": "$600 million"
                },
                {
                    "Indicator": "Debt Ratio",
                    "Description": "The ratio of total liabilities to total assets, reflecting the company's debt level.",
                    "Influencing Factors": [
                        "Changes in total liabilities",
                        "Changes in total assets"
                    ],
                    "Value": "45%"
                },
                {
                    "Indicator": "Debt to Assets Ratio",
                    "Description": "The percentage of total liabilities to total assets, a measure of the company's financial leverage.",
                    "Influencing Factors": [
                        "Increases or decreases in assets and liabilities"
                    ],
                    "Value": "35%"
                },
                {
                    "Indicator": "Return on Equity",
                    "Description": "Reflects the operational efficiency of shareholder equity, namely the ratio of net profit to average shareholder equity.",
                    "Influencing Factors": [
                        "Increase in net profit",
                        "Optimization of shareholder equity"
                    ],
                    "Value": "20%"
                }
            ]
        }
    ],
    "Additional Information": [
        {
            "Name": "Future Outlook",
            "Content": [
                {
                    "Name": "Financial Strategy",
                    "Description": "Vanguard Media Group plans to implement a comprehensive financial strategy focused on driving revenue growth by producing high-quality content, expanding its digital media platforms, and exploring new markets. The company will also continue cost control efforts to optimize operational efficiency and maintain healthy profitability. Additionally, capital operations will be executed strategically to secure funding for future growth initiatives while managing risks effectively."
                },
                {
                    "Name": "Investment Plans",
                    "Description": "Vanguard Media Group aims to invest in innovative projects and technologies to stay at the forefront of the rapidly evolving media landscape. The company plans to allocate substantial funds for original content production, expansion of its digital streaming platforms, and targeted acquisitions to strengthen its market position. Investment in research and development will be a priority to drive technological advancements and enhance user experiences."
                },
                {
                    "Name": "Risk Management",
                    "Description": "Risk management is a crucial aspect of Vanguard Media Group's operations. The company continuously identifies and evaluates various financial risks, including market volatility, changes in consumer preferences, and regulatory challenges. To mitigate these risks, Vanguard Media Group maintains a diversified portfolio of content offerings, utilizes data-driven insights for decision-making, and implements rigorous compliance measures. Additionally, the company maintains proactive relationships with key stakeholders, fostering strategic partnerships to navigate potential market disruptions and leverage emerging opportunities."
                }
            ]
        }
    ],
    "Generated Outline": "I. Introduction\n   - Purpose of the report\n   - Background information about Vanguard Media Group\n   - Corporate financial report time point: 2019\n\nII. Company Information\n   - Name: Vanguard Media Group\n   - Establishment Date: March 1, 2000\n   - Main Business: Diversified media company operating television networks, film studios, and digital media platforms\n   - Registration Location: Los Angeles, California\n   - Listing Status: Publicly Traded\n   - Industry: Media\n\nIII. Financial Information\n   A. Asset Restructuring (January, 2019)\n      - Description: Asset restructuring to divest non-performing assets and allocate resources to high-growth areas\n      - Impact: Improved operational efficiency and increased company value\n      1. Acquisition of XYZ Studios (March, 2019)\n         - Description: Acquisition of XYZ Studios to expand film studio division, strengthen intellectual property portfolio, and enhance competitive position\n         - Impact: Increased production capabilities, access to popular film franchises, and improved market presence\n      2. Partnership with Digital Channel Inc. (June, 2019)\n         - Description: Strategic partnership with Digital Channel Inc. to tap into their user base, expand digital content distribution, and enhance online advertising capabilities\n         - Impact: Broader digital reach, increased revenue from online advertising, and strengthened digital media presence\n      3. Launch of Vanguard Streaming Service (August, 2019)\n         - Description: Launch of streaming service offering movies, TV shows, and exclusive content to compete with established players\n         - Impact: New revenue stream, increased customer engagement, and direct consumer connection\n         \n   B. Major Investment (May, 2019)\n      - Description: Major investment in the development of \"Breaking Point\" streaming series, contributing to revenue growth\n      - Impact: Broadened business areas and enhanced profitability\n      \n   C. Dividend Distribution (July, 2019)\n      - Description: Distribution of $0.75 per share of dividends to shareholders, reflecting profit sharing with investors\n      - Impact: Enhanced shareholder returns\n      \n   D. Large-scale Financing (August, 2019)\n      - Description: Successful raising of $100 million in debt capital for strategic initiatives and acquisitions\n      - Impact: Strengthened financial strength and supported expansion and development\n      \n   E. Major Asset Acquisition (October, 2019)\n      - Description: Completed asset acquisition of Silver Screen Studios worth $200 million to expand film production capabilities and enhance market position\n      - Impact: Expanded business scope and enhanced market competitiveness\n      \n   F. Debt Restructuring (November, 2019)\n      - Description: Debt restructuring resulting in a $50 million reduction in liabilities, improving financial condition and reducing costs\n      - Impact: Improved financial condition and reduced financial costs\n      \n   G. Significant Equity Acquisition (December, 2019)\n      - Description: Acquisition of 30% equity of Ambient Digital to expand market share and enhance control in the digital media space\n      - Impact: Expanded market share and enhanced control\n\nIV. Involved Indicators\n   A. Operating Income ($1.2 billion)\n      - Description: Total amount of main business income and other business income within a certain accounting period\n      - Influencing Factors: Market demand, especially for original content, and changes in advertising revenues\n   B. Net Profit ($300 million)\n      - Description: Net income of the company within a certain accounting period, calculated as total income minus total costs and taxes\n      - Influencing Factors: Operating income growth, efficiency in cost control, and minimization of non-recurring losses\n   C. Total Assets ($2.5 billion)\n      - Description: Total amount of assets owned by the company at the end of the accounting period\n      - Influencing Factors: Acquisition of Silver Screen Studios, appreciation in the value of investment properties, and increased cash reserves\n   D. Total Liabilities ($1.1 billion)\n      - Description: Total amount of debts the company is obligated to repay at the end of the accounting period\n      - Influencing Factors: Debt repayment, liability reduction through debt restructuring, and effective debt management\n   E. Shareholder Equity ($1.4 billion)\n      - Description: Total amount of equity belonging to shareholders at the end of the accounting period\n      - Influencing Factors: Net profit growth, dividend distribution, and accumulation of capital reserves\n   F. Cash Flow ($600 million)\n      - Description: Total cash inflows and outflows of the company within a certain accounting period\n      - Influencing Factors: Positive operating cash flow, effective management of investment activities, and successful financing activities\n   G. Debt Ratio (45%)\n      - Description: Ratio of total liabilities to total assets, reflecting the company's debt level\n      - Influencing Factors: Changes in total liabilities and changes in total assets\n   H. Debt to Assets Ratio (35%)\n      - Description: Percentage of total liabilities to total assets, a measure of the company's financial leverage\n      - Influencing Factors: Increases or decreases in assets and liabilities\n   I. Return on Equity (20%)\n      - Description: Ratio of net profit to average shareholder equity, reflecting the operational efficiency of shareholder equity\n      - Influencing Factors: Increase in net profit and optimization of shareholder equity\n\nV. Additional Information\n   A. Future Outlook\n      1. Financial Strategy\n         - Description: Comprehensive financial strategy focused on driving revenue growth, optimizing operational efficiency, and maintaining profitability\n      2. Investment Plans\n         - Description: Investment in innovative projects, technologies, original content production, digital streaming platforms, and targeted acquisitions\n      3. Risk Management\n         - Description: Identification and evaluation of financial risks, mitigation through diversified content offerings, data-driven decision-making, compliance measures, and strategic partnerships\n\nVI. Conclusion\n   - Overview of Vanguard Media Group's financial performance and significant events in 2019\n   - Emphasis on key indicators and their influencing factors\n   - Future outlook and strategic plans for revenue growth, investment, and risk management.",
    "Generated Summary": "Vanguard Media Group, established on March 1, 2000 in Los Angeles, California, is a publicly traded media company that operates television networks, film studios, and digital media platforms, producing and distributing various forms of entertainment content.",
    "Generated Article": "In 2019, Vanguard Media Group underwent significant changes and achieved notable financial milestones. The company's asset restructuring in January aimed to divest non-performing assets and allocate resources to high-growth areas, resulting in improved operational efficiency and increased company value. One of the key sub-events within this restructuring was the acquisition of XYZ Studios in March. This strategic move expanded Vanguard's film studio division, strengthened its intellectual property portfolio, and enhanced its competitive position. As a result, the company experienced increased production capabilities, gained access to popular film franchises, and improved its market presence. Another sub-event was the partnership with Digital Channel Inc. in June, which allowed Vanguard to tap into their user base, expand digital content distribution, and enhance online advertising capabilities. This partnership broadened Vanguard's digital reach, increased revenue from online advertising, and strengthened its digital media presence. In August, Vanguard launched its own streaming service, offering movies, TV shows, and exclusive content to compete with established players in the industry. This move created a new revenue stream, increased customer engagement, and established a direct connection with consumers.\n\nIn May, Vanguard made a major investment in the development of the \"Breaking Point\" streaming series, contributing to revenue growth and broadening its business areas. This investment aimed to enhance profitability and capitalize on the growing demand for original content. In July, the company distributed $0.75 per share of dividends to shareholders, reflecting its commitment to profit sharing with investors and enhancing shareholder returns. Additionally, in August, Vanguard successfully raised $100 million in debt capital for strategic initiatives and acquisitions, strengthening its financial position and supporting expansion and development.\n\nIn October, Vanguard completed the acquisition of Silver Screen Studios for $200 million, further expanding its film production capabilities and enhancing its market position. This major asset acquisition allowed the company to broaden its business scope and increase its market competitiveness. In November, Vanguard underwent debt restructuring, resulting in a $50 million reduction in liabilities. This move improved the company's financial condition and reduced financial costs. Finally, in December, Vanguard acquired 30% equity of Ambient Digital, expanding its market share and enhancing control in the digital media space.\n\nThese events had a significant impact on Vanguard Media Group's financial performance in 2019. The company's operating income reached $1.2 billion, driven by market demand for original content and changes in advertising revenues. Net profit amounted to $300 million, reflecting the company's ability to grow its operating income, efficiently control costs, and minimize non-recurring losses. Total assets stood at $2.5 billion, primarily influenced by the acquisition of Silver Screen Studios, appreciation in the value of investment properties, and increased cash reserves. Total liabilities amounted to $1.1 billion, reflecting the company's debt repayment, liability reduction through debt restructuring, and effective debt management. Shareholder equity reached $1.4 billion, driven by net profit growth, dividend distribution, and the accumulation of capital reserves. The company generated a cash flow of $600 million, resulting from positive operating cash flow, effective management of investment activities, and successful financing activities. Vanguard's debt ratio stood at 45%, indicating its debt level relative to total assets. The debt to assets ratio was 35%, reflecting the company's financial leverage. Lastly, the return on equity was 20%, indicating the operational efficiency of shareholder equity through an increase in net profit and optimization of shareholder equity.\n\nLooking ahead, Vanguard Media Group has outlined a comprehensive financial strategy focused on driving revenue growth, optimizing operational efficiency, and maintaining profitability. The company plans to invest in innovative projects, technologies, original content production, digital streaming platforms, and targeted acquisitions. Risk management will be a key aspect, with a focus on identifying and evaluating financial risks, diversifying content offerings, data-driven decision-making, compliance measures, and strategic partnerships.\n\nIn conclusion, Vanguard Media Group's financial performance in 2019 was marked by significant events and achievements. The company's asset restructuring, major investments, dividend distribution, large-scale financing, asset acquisition, debt restructuring, and equity acquisition all contributed to its growth and enhanced market position. The various financial indicators reflect Vanguard's strong performance and strategic decision-making. With a clear future outlook and strategic plans in place, Vanguard Media Group is well-positioned for continued success in the ever-evolving media industry."
}