{
    "报告类型": "公司财务报告",
    "报告时间": "2017年度",
    "公司信息": {
        "名称": "喜乐娱乐集团",
        "成立日期": "2005年9月",
        "主营业务": "喜乐娱乐集团是一家综合娱乐公司，主要经营电影制作、演艺经纪、音乐制作和演出、票务销售等业务。",
        "注册地": "美国",
        "上市情况": "喜乐娱乐集团于2010年在纳斯达克交易所上市。",
        "行业": "娱乐"
    },
    "报告内容": [
        {
            "类型": "财务信息",
            "重要事件": [
                {
                    "事件": "重大股权收购",
                    "时间": "2017年1月",
                    "描述": "公司完成了对天骄影业的股权收购，获得了70%的股权。",
                    "影响": "进一步扩大了公司的市场份额，提升了公司的控制力。"
                },
                {
                    "事件": "资产重组",
                    "时间": "2017年3月",
                    "描述": "公司进行了一次资产重组，优化了公司的业务结构。将旗下的电影制作、演艺经纪和音乐制作业务整合为新的子公司“喜乐娱乐影视集团”。",
                    "影响": "提高了公司的运营效率，增加了公司的价值。"
                },
                {
                    "事件": "重大资产收购",
                    "时间": "2017年5月",
                    "描述": "公司完成了对魅力音乐的资产收购，总价值1.2亿美元。",
                    "影响": "扩大公司业务范围，增强市场竞争力。"
                },
                {
                    "事件": "债务重组",
                    "时间": "2017年6月",
                    "描述": "为优化资本结构，公司进行了债务重组，减少了5亿美元负债。",
                    "影响": "改善了公司的财务状况，降低了财务成本。"
                },
                {
                    "事件": "重大投资",
                    "时间": "2017年8月",
                    "描述": "公司投资了D项目，投资金额为8000万美元。",
                    "影响": "进一步拓宽了公司的业务领域，提升了公司的盈利能力。"
                },
                {
                    "事件": "大规模融资",
                    "时间": "2017年9月",
                    "描述": "公司进行了一次大规模的融资活动，募集了10亿美元资金。",
                    "影响": "加强了公司的资金实力，支持了公司的扩张和发展。"
                },
                {
                    "事件": "分发股利",
                    "时间": "2017年10月",
                    "描述": "公司决定向股东分发2亿美元股利。",
                    "影响": "回报给股东们的投资，提升了股东的收益。"
                }
            ],
            "涉及的指标": [
                {
                    "指标": "营业收入",
                    "描述": "公司在一定会计期间内的主营业务收入和其他业务收入总额。",
                    "影响因素": [
                        "市场需求的变化",
                        "产品价格的调整"
                    ],
                    "值": "2亿美元"
                },
                {
                    "指标": "净利润",
                    "描述": "公司在一定会计期间的净收入，即总收入减去总成本和所得税费用后的金额。",
                    "影响因素": [
                        "营业收入的增长",
                        "成本控制的效果",
                        "非经常性损益的影响"
                    ],
                    "值": "5000万美元"
                },
                {
                    "指标": "总资产",
                    "描述": "会计期末，公司所拥有的资产总额。",
                    "影响因素": [
                        "资产收购的金额",
                        "资产处置的金额",
                        "资产重估的影响"
                    ],
                    "值": "12亿美元"
                },
                {
                    "指标": "总负债",
                    "描述": "会计期末，公司所承担并需要偿还的债务总额。",
                    "影响因素": [
                        "新债发行的金额",
                        "债务偿还的金额",
                        "债务重组的效果"
                    ],
                    "值": "8亿美元"
                },
                {
                    "指标": "股东权益",
                    "描述": "会计期末，归属于股东的权益总额。",
                    "影响因素": [
                        "净利润的变化",
                        "股利发放的金额",
                        "资本公积的影响"
                    ],
                    "值": "4亿美元"
                },
                {
                    "指标": "现金流量",
                    "描述": "公司在一定会计期间内的现金流入和流出总和。",
                    "影响因素": [
                        "经营活动的现金流量",
                        "投资活动的现金流量",
                        "筹资活动的现金流量"
                    ],
                    "值": "1.5亿美元"
                },
                {
                    "指标": "负债比率",
                    "描述": "公司总负债与总资产的比率，反映公司的债务水平。",
                    "影响因素": [
                        "总负债的变化",
                        "总资产的变化"
                    ],
                    "值": "0.67"
                },
                {
                    "指标": "资产负债率",
                    "描述": "公司总负债占总资产的百分比，衡量公司财务杠杆的一个指标。",
                    "影响因素": [
                        "资产和负债的增减变化"
                    ],
                    "值": "0.67"
                },
                {
                    "指标": "净资产收益率",
                    "描述": "反映公司股东权益的经营效益，即净利润与平均股东权益的比率。",
                    "影响因素": [
                        "净利润的变化",
                        "股东权益的变化"
                    ],
                    "值": "0.15"
                }
            ]
        }
    ],
    "额外信息": [
        {
            "名称": "未来展望",
            "内容": [
                {
                    "名称": "财务策略",
                    "描述": "公司未来计划实施的财务策略，包括进一步优化成本控制、增加市场投入、提高资源配置效率等，以提升盈利能力和降低风险。"
                },
                {
                    "名称": "投资计划",
                    "描述": "公司面向未来的投资计划，计划投资20亿美元用于新项目开发、技术研发和市场推广等领域，以拓展公司业务、提高市场竞争力。"
                },
                {
                    "名称": "风险管理",
                    "描述": "公司识别到的主要财务风险包括市场风险、竞争风险和经营风险等，公司将制定相应的应对策略，如严格控制成本，增加市场研究和风险评估，加强内部控制等。"
                }
            ]
        }
    ],
    "生成大纲": "报告大纲：\n\nI. 公司财务概况\n   A. 报告时间：2017年度\n   B. 报告类型：公司财务报告\n\nII. 重要事件\n   A. 重大股权收购 (2017年1月)\n      - 公司完成了对天骄影业的股权收购，获得了70%的股权。\n      - 进一步扩大了公司的市场份额，提升了公司的控制力。\n\n   B. 资产重组 (2017年3月)\n      - 公司进行了一次资产重组，将旗下的电影制作、演艺经纪和音乐制作业务整合为新的子公司“喜乐娱乐影视集团”。\n      - 优化了公司的业务结构，提高了公司的运营效率，增加了公司的价值。\n\n   C. 重大资产收购 (2017年5月)\n      - 公司完成了对魅力音乐的资产收购，总价值1.2亿美元。\n      - 扩大公司业务范围，增强市场竞争力。\n\n   D. 债务重组 (2017年6月)\n      - 公司进行了债务重组，减少了5亿美元负债。\n      - 改善了公司的财务状况，降低了财务成本。\n\n   E. 重大投资 (2017年8月)\n      - 公司投资了D项目，投资金额为8000万美元。\n      - 进一步拓宽了公司的业务领域，提升了公司的盈利能力。\n\n   F. 大规模融资 (2017年9月)\n      - 公司进行了一次大规模的融资活动，募集了10亿美元资金。\n      - 加强了公司的资金实力，支持了公司的扩张和发展。\n\n   G. 分发股利 (2017年10月)\n      - 公司决定向股东分发2亿美元股利。\n      - 回报给股东们的投资，提升了股东的收益。\n\nIII. 涉及的指标\n   A. 营业收入\n      - 描述：公司在一定会计期间内的主营业务收入和其他业务收入总额。\n      - 影响因素：市场需求的变化、产品价格的调整\n      - 值：2亿美元\n\n   B. 净利润\n      - 描述：公司在一定会计期间的净收入，即总收入减去总成本和所得税费用后的金额。\n      - 影响因素：营业收入的增长、成本控制的效果、非经常性损益的影响\n      - 值：5000万美元\n\n   C. 总资产\n      - 描述：会计期末，公司所拥有的资产总额。\n      - 影响因素：资产收购的金额、资产处置的金额、资产重估的影响\n      - 值：12亿美元\n\n   D. 总负债\n      - 描述：会计期末，公司所承担并需要偿还的债务总额。\n      - 影响因素：新债发行的金额、债务偿还的金额、债务重组的效果\n      - 值：8亿美元\n\n   E. 股东权益\n      - 描述：会计期末，归属于股东的权益总额。\n      - 影响因素：净利润的变化、股利发放的金额、资本公积的影响\n      - 值：4亿美元\n\n   F. 现金流量\n      - 描述：公司在一定会计期间内的现金流入和流出总和。\n      - 影响因素：经营活动的现金流量、投资活动的现金流量、筹资活动的现金流量\n      - 值：1.5亿美元\n\n   G. 负债比率\n      - 描述：公司总负债与总资产的比率，反映公司的债务水平。\n      - 影响因素：总负债的变化、总资产的变化\n      - 值：0.67\n\n   H. 资产负债率\n      - 描述：公司总负债占总资产的百分比，衡量公司财务杠杆的一个指标。\n      - 影响因素：资产和负债的增减变化\n      - 值：0.67\n\n   I. 净资产收益率\n      - 描述：反映公司股东权益的经营效益，即净利润与平均股东权益的比率。\n      - 影响因素：净利润的变化、股东权益的变化\n      - 值：0.15\n\nIV. 额外信息\n   A. 未来展望\n      1. 财务策略\n         - 描述：公司未来计划实施的财务策略，包括进一步优化成本控制、增加市场投入、提高资源配置效率等，以提升盈利能力和降低风险。\n\n      2. 投资计划\n         - 描述：公司面向未来的投资计划，计划投资20亿美元用于新项目开发、技术研发和市场推广等领域，以拓展公司业务、提高市场竞争力。\n\n      3. 风险管理\n         - 描述：公司识别到的主要财务风险包括市场风险、竞争风险和经营风险等，公司将制定相应的应对策略，如严格控制成本，增加市场研究和风险评估，加强内部控制等。",
    "生成总结": "喜乐娱乐集团是一家于2005年在美国成立的综合娱乐公司，主要经营电影制作、演艺经纪、音乐制作和演出、票务销售等业务，并于2010年在纳斯达克交易所上市。",
    "生成文章": "2017年度是喜乐娱乐集团发展的关键一年。在这一年里，公司实施了一系列重要的战略举措，进一步扩大了市场份额，提升了公司的控制力和竞争力。\n\n首先，公司于2017年1月完成了对天骄影业的股权收购，获得了70%的股权。这一重大股权收购进一步巩固了公司在电影制作领域的地位，扩大了公司的市场份额。随后，在2017年3月，公司进行了一次资产重组，将旗下的电影制作、演艺经纪和音乐制作业务整合为新的子公司“喜乐娱乐影视集团”。这一举措优化了公司的业务结构，提高了公司的运营效率，增加了公司的价值。\n\n在2017年5月，公司完成了对魅力音乐的资产收购，总价值1.2亿美元。这一重大资产收购进一步扩大了公司的业务范围，增强了公司的市场竞争力。为了改善公司的财务状况，公司于2017年6月进行了债务重组，减少了5亿美元负债。这一举措改善了公司的财务状况，降低了财务成本。\n\n在2017年8月，公司投资了D项目，投资金额为8000万美元。这一重大投资进一步拓宽了公司的业务领域，提升了公司的盈利能力。为了支持公司的扩张和发展，公司于2017年9月进行了一次大规模的融资活动，募集了10亿美元资金。这一举措加强了公司的资金实力，为公司的发展提供了强大的支持。\n\n在2017年10月，公司决定向股东分发2亿美元股利，回报给股东们的投资，提升了股东的收益。\n\n以上重要事件对公司的财务状况产生了重要影响。根据公司财务报告，2017年度的营业收入为2亿美元，净利润为5000万美元，总资产为12亿美元，总负债为8亿美元，股东权益为4亿美元，现金流量为1.5亿美元。负债比率为0.67，资产负债率为0.67，净资产收益率为0.15。\n\n营业收入的增长主要受到市场需求的变化和产品价格的调整的影响。净利润的增长除了受到营业收入的增长影响外，还受到成本控制的效果和非经常性损益的影响。总资产的变化主要受到资产收购的金额、资产处置的金额和资产重估的影响。总负债的变化主要受到新债发行的金额、债务偿还的金额和债务重组的效果的影响。股东权益的变化主要受到净利润的变化、股利发放的金额和资本公积的影响。现金流量的变化主要受到经营活动的现金流量、投资活动的现金流量和筹资活动的现金流量的影响。\n\n综合以上数据和分析，可以看出，喜乐娱乐集团在2017年度取得了良好的财务业绩。公司通过重大股权收购、资产重组、资产收购、债务重组、重大投资、大规模融资等一系列战略举措，不断扩大业务范围，提升市场竞争力，改善财务状况，为未来的发展奠定了坚实的基础。\n\n展望未来，喜乐娱乐集团将继续实施财务策略，进一步优化成本控制、增加市场投入、提高资源配置效率等，以提升盈利能力和降低风险。同时，公司将加大投资力度，计划投资20亿美元用于新项目开发、技术研发和市场推广等领域，以拓展公司业务、提高市场竞争力。在风险管理方面，公司将制定相应的应对策略，如严格控制成本，增加市场研究和风险评估，加强内部控制等，以应对市场风险、竞争风险和经营风险等挑战。\n\n综上所述，喜乐娱乐集团在2017年度取得了显著的发展成果，公司的财务状况稳步提升。未来，公司将继续实施战略举措，加大投资力度，提升盈利能力和市场竞争力，为公司的长期发展打下坚实基础。"
}