{
    "报告类型": "公司环境与社会责任报告",
    "报告时间": "2019年度",
    "公司信息": {
        "名称": "国际英语培训教育有限公司",
        "成立日期": "2005年3月12日",
        "主营业务": "提供针对学生及成年人的英语培训课程",
        "注册地": "上海市",
        "上市情况": "非上市",
        "行业": "教育"
    },
    "报告内容": [
        {
            "类型": "环境责任",
            "重要事件": [
                {
                    "事件": "绿色产品开发",
                    "时间": "2019年2月",
                    "描述": "公司开发的环保型产品，减少对环境的影响。",
                    "影响": "提升了产品的市场竞争力和品牌形象，同时减少了环境影响。",
                    "子事件": [
                        {
                            "事件": "投入研发环节",
                            "时间": "2018年5月",
                            "描述": "公司决定投入资金和人力资源开展环保型产品研发工作。",
                            "影响": "为绿色产品的开发奠定了基础，为后续的产品开发和推广提供了技术支持。"
                        },
                        {
                            "事件": "市场调研",
                            "时间": "2018年11月",
                            "描述": "公司进行市场调研，了解消费者对环保型产品的需求和接受程度。",
                            "影响": "帮助公司确定绿色产品的定位和市场推广策略，准确把握市场需求，降低推广风险。"
                        },
                        {
                            "事件": "产品设计",
                            "时间": "2019年1月",
                            "描述": "根据市场调研结果和研发成果，公司开始进行绿色产品的设计和改进。",
                            "影响": "确保产品能够满足消费者的需求，提高产品的市场竞争力和销售潜力。"
                        }
                    ]
                },
                {
                    "事件": "农场项目启动",
                    "时间": "2019年4月",
                    "描述": "公司投资兴办农业项目，提供有机食品和农业教育服务。",
                    "影响": "增加了公司的收入来源，改善了农村地区的生计，促进了可持续农业发展。"
                },
                {
                    "事件": "节能减排项目实施",
                    "时间": "2019年5月",
                    "描述": "公司投资实施的节能减排项目，旨在减少能源消耗和温室气体排放。",
                    "影响": "直接减少了公司的能源消耗和碳足迹，提高了能效和环境绩效。"
                },
                {
                    "事件": "投资于碳抵消项目",
                    "时间": "2019年8月",
                    "描述": "公司通过投资林业项目或可再生能源项目来抵消其碳排放，努力实现碳中和目标。",
                    "影响": "通过碳抵消证书，公司能够向利益相关者展示其对环境的承诺和责任。"
                },
                {
                    "事件": "防止污染设施的建设",
                    "时间": "2019年9月",
                    "描述": "公司建立新的污染防治设施，如废水处理系统和排放控制设备，以减少环境污染。",
                    "影响": "显著降低了公司的环境污染水平，增强了合规性和社会责任感。"
                },
                {
                    "事件": "采用环境管理系统",
                    "时间": "2019年10月",
                    "描述": "公司实施环境管理系统（EMS），以提高环境绩效，减少废物产生，并确保合规。",
                    "影响": "增强了公司的环境管理能力和持续改进，提升了合规性和市场认可度。"
                }
            ],
            "涉及的指标": [
                {
                    "指标": "二氧化碳排放量",
                    "描述": "公司在生产过程中产生的二氧化碳总量。",
                    "影响因素": [
                        "生产规模的变化",
                        "节能技术的应用"
                    ],
                    "值": "6000吨/年"
                },
                {
                    "指标": "能源消耗",
                    "描述": "公司在运营过程中消耗的能源总量。",
                    "影响因素": [
                        "生产效率的提高",
                        "能源管理措施的实施"
                    ],
                    "值": "250,000千瓦时"
                }
            ]
        },
        {
            "类型": "社会责任",
            "重要事件": [
                {
                    "事件": "员工健康与安全计划",
                    "时间": "2019年2月",
                    "描述": "公司实施的旨在提升员工健康与安全的措施。",
                    "影响": "显著改善了工作环境，减少了工伤事故，提高了员工的健康与安全水平。"
                },
                {
                    "事件": "参与公共服务项目",
                    "时间": "2019年3月",
                    "描述": "公司投资或参与公共服务项目，如城市绿化、公共卫生改善项目，以提升社区生活质量。",
                    "影响": "促进了社区的可持续发展，增强了公众对公司的积极感知。"
                },
                {
                    "事件": "社区支持和发展项目",
                    "时间": "2019年5月",
                    "描述": "公司投资于当地社区，支持教育、健康和社会发展项目。",
                    "影响": "加深了公司与社区的联系，促进了社区的整体福祉和发展。"
                },
                {
                    "事件": "参与慈善活动",
                    "时间": "2019年7月",
                    "描述": "公司参与或资助慈善活动和慈善机构，以支持教育、健康、减贫等领域。",
                    "影响": "提高了公司的社会形象和品牌认知，加强了与社区的联系和支持。"
                },
                {
                    "事件": "员工职业成长和人才发展计划",
                    "时间": "2019年10月",
                    "描述": "公司提供各类培训和发展项目，支持员工职业成长，包括在线课程、工作坊、导师计划等。",
                    "影响": "提高了员工的专业技能和工作满意度，促进了人才的留存和发展。"
                },
                {
                    "事件": "反腐败政策和合规措施",
                    "时间": "2019年12月",
                    "描述": "公司建立了反腐败政策和合规措施，保护业务活动的诚信和合法性。",
                    "影响": "提高了公司的声誉和商业伦理标准，减少了法律风险和负面影响。"
                }
            ],
            "涉及的指标": [
                {
                    "指标": "员工满意度",
                    "描述": "通过调查得到的员工对公司环境和政策满意度的度量。",
                    "影响因素": [
                        "工作环境的改善",
                        "员工福利政策的调整"
                    ],
                    "值": "85%"
                },
                {
                    "指标": "社区投资额",
                    "描述": "公司在社区发展项目上的投资总额。",
                    "影响因素": [
                        "公司的财务状况",
                        "社会责任战略的变化"
                    ],
                    "值": "100万人民币"
                }
            ]
        }
    ],
    "额外信息": [
        {
            "名称": "未来展望",
            "内容": [
                {
                    "名称": "环境保护计划",
                    "描述": "采取一系列措施减少其运营对环境的影响。"
                },
                {
                    "名称": "社会责任战略",
                    "描述": "在业务实践中积极履行社会责任，包括促进社区发展、改善员工福利、提供公平就业机会和参与公益活动。"
                },
                {
                    "名称": "可持续发展目标",
                    "描述": "通过整合可持续性原则到业务模型和决策过程中，致力于实现联合国可持续发展目标（SDGs）。"
                },
                {
                    "名称": "技术创新计划",
                    "描述": "加强技术研发和创新，提供更优质的教学服务和用户体验。"
                }
            ]
        }
    ],
    "生成大纲": "公司环境与社会责任报告大纲\n\n1. 公司信息\n- 公司名称: 国际英语培训教育有限公司\n- 成立日期: 2005年3月12日\n- 主营业务: 提供针对学生及成年人的英语培训课程\n- 注册地: 上海市\n- 上市情况: 非上市\n- 行业: 教育\n\n2. 环境责任\n- 重要事件:\n  - 绿色产品开发\n    - 时间: 2019年2月\n    - 描述: 公司开发的环保型产品，减少对环境的影响。\n    - 影响: 提升了产品的市场竞争力和品牌形象，同时减少了环境影响。\n    - 子事件:\n      - 投入研发环节\n        - 时间: 2018年5月\n        - 描述: 公司决定投入资金和人力资源开展环保型产品研发工作。\n        - 影响: 为绿色产品的开发奠定了基础，为后续的产品开发和推广提供了技术支持。\n      - 市场调研\n        - 时间: 2018年11月\n        - 描述: 公司进行市场调研，了解消费者对环保型产品的需求和接受程度。\n        - 影响: 帮助公司确定绿色产品的定位和市场推广策略，准确把握市场需求，降低推广风险。\n      - 产品设计\n        - 时间: 2019年1月\n        - 描述: 根据市场调研结果和研发成果，公司开始进行绿色产品的设计和改进。\n        - 影响: 确保产品能够满足消费者的需求，提高产品的市场竞争力和销售潜力。\n  - 农场项目启动\n    - 时间: 2019年4月\n    - 描述: 公司投资兴办农业项目，提供有机食品和农业教育服务。\n    - 影响: 增加了公司的收入来源，改善了农村地区的生计，促进了可持续农业发展。\n  - 节能减排项目实施\n    - 时间: 2019年5月\n    - 描述: 公司投资实施的节能减排项目，旨在减少能源消耗和温室气体排放。\n    - 影响: 直接减少了公司的能源消耗和碳足迹，提高了能效和环境绩效。\n  - 投资于碳抵消项目\n    - 时间: 2019年8月\n    - 描述: 公司通过投资林业项目或可再生能源项目来抵消其碳排放，努力实现碳中和目标。\n    - 影响: 通过碳抵消证书，公司能够向利益相关者展示其对环境的承诺和责任。\n  - 防止污染设施的建设\n    - 时间: 2019年9月\n    - 描述: 公司建立新的污染防治设施，如废水处理系统和排放控制设备，以减少环境污染。\n    - 影响: 显著降低了公司的环境污染水平，增强了合规性和社会责任感。\n  - 采用环境管理系统\n    - 时间: 2019年10月\n    - 描述: 公司实施环境管理系统（EMS），以提高环境绩效，减少废物产生，并确保合规。\n    - 影响: 增强了公司的环境管理能力和持续改进，提升了合规性和市场认可度。\n\n- 涉及的指标:\n  - 二氧化碳排放量\n    - 描述: 公司在生产过程中产生的二氧化碳总量。\n    - 影响因素: 生产规模的变化, 节能技术的应用\n    - 值: 6000吨/年\n  - 能源消耗\n    - 描述: 公司在运营过程中消耗的能源总量。\n    - 影响因素: 生产效率的提高, 能源管理措施的实施\n    - 值: 250,000千瓦时\n\n3. 社会责任\n- 重要事件:\n  - 员工健康与安全计划\n    - 时间: 2019年2月\n    - 描述: 公司实施的旨在提升员工健康与安全的措施。\n    - 影响: 显著改善了工作环境，减少了工伤事故，提高了员工的健康与安全水平。\n  - 参与公共服务项目\n    - 时间: 2019年3月\n    - 描述: 公司投资或参与公共服务项目，如城市绿化、公共卫生改善项目，以提升社区生活质量。\n    - 影响: 促进了社区的可持续发展，增强了公众对公司的积极感知。\n  - 社区支持和发展项目\n    - 时间: 2019年5月\n    - 描述: 公司投资于当地社区，支持教育、健康和社会发展项目。\n    - 影响: 加深了公司与社区的联系，促进了社区的整体福祉和发展。\n  - 参与慈善活动\n    - 时间: 2019年7月\n    - 描述: 公司参与或资助慈善活动和慈善机构，以支持教育、健康、减贫等领域。\n    - 影响: 提高了公司的社会形象和品牌认知，加强了与社区的联系和支持。\n  - 员工职业成长和人才发展计划\n    - 时间: 2019年10月\n    - 描述: 公司提供各类培训和发展项目，支持员工职业成长，包括在线课程、工作坊、导师计划等。\n    - 影响: 提高了员工的专业技能和工作满意度，促进了人才的留存和发展。\n  - 反腐败政策和合规措施\n    - 时间: 2019年12月\n    - 描述: 公司建立了反腐败政策和合规措施，保护业务活动的诚信和合法性。\n    - 影响: 提高了公司的声誉和商业伦理标准，减少了法律风险和负面影响。\n\n- 涉及的指标:\n  - 员工满意度\n    - 描述: 通过调查得到的员工对公司环境和政策满意度的度量。\n    - 影响因素: 工作环境的改善, 员工福利政策的调整\n    - 值: 85%\n  - 社区投资额\n    - 描述: 公司在社区发展项目上的投资总额。\n    - 影响因素: 公司的财务状况, 社会责任战略的变化\n    - 值: 100万人民币\n\n4. 额外信息\n- 未来展望:\n  - 环境保护计划\n    - 描述: 采取一系列措施减少其运营对环境的影响。\n  - 社会责任战略\n    - 描述: 在业务实践中积极履行社会责任，包括促进社区发展、改善员工福利、提供公平就业机会和参与公益活动。\n  - 可持续发展目标\n    - 描述: 通过整合可持续性原则到业务模型和决策过程中，致力于实现联合国可持续发展目标（SDGs）。\n  - 技术创新计划\n    - 描述: 加强技术研发和创新，提供更优质的教学服务和用户体验。\n\n生成总结: 国际英语培训教育有限公司是一家成立于2005年，总部位于上海的教育公司，主要提供英语培训课程给学生及成年人。\n\n生成文章: 公司在环境责任方面取得了显著的成就。首先，公司于2019年2月推出了绿色产品，这是一个重要的里程碑。在此之前，公司投入了大量资金和人力资源进行研发，并进行了市场调研，以了解消费者对环保型产品的需求和接受程度。根据调研结果和研发成果，公司开始进行绿色产品的设计和改进。这些努力使得公司的产品在市场上具有竞争力，同时减少了对环境的影响。\n\n另一个重要事件是公司于2019年4月启动了农场项目。通过投资兴办农业项目，公司提供有机食品和农业教育服务。这不仅增加了公司的收入来源，还改善了农村地区的生计，促进了可持续农业发展。\n\n为了减少能源消耗和温室气体排放，公司于2019年5月实施了节能减排项目。这项投资旨在通过采用节能技术和管理措施来减少能源消耗和碳足迹。这一举措直接减少了公司的能源消耗和碳排放，提高了能效和环境绩效。\n\n为了进一步强调公司对环境的承诺和责任，公司于2019年8月开始投资于碳抵消项目。通过投资林业项目或可再生能源项目来抵消其碳排放，公司努力实现碳中和目标。通过碳抵消证书，公司能够向利益相关者展示其对环境的承诺和责任。\n\n此外，公司于2019年9月建立了新的污染防治设施，如废水处理系统和排放控制设备，以减少环境污染。这一举措显著降低了公司的环境污染水平，增强了合规性和社会责任感。\n\n为了提高环境管理能力和持续改进，公司于2019年10月实施了环境管理系统（EMS）。该系统有助于提高环境绩效，减少废物产生，并确保合规。通过采用环境管理系统，公司增强了对环境的管理能力，提升了合规性和市场认可度。\n\n在社会责任方面，公司也取得了显著的成就。首先，公司于2019年2月实施了员工健康与安全计划，旨在提升员工的健康与安全水平。这一措施显著改善了工作环境，减少了工伤事故，提高了员工的满意度和工作效率。\n\n此外，公司还积极参与公共服务项目，如城市绿化和公共卫生改善项目，以提升社区生活质量。公司还投资于当地社区，支持教育、健康和社会发展项目。这些举措加深了公司与社区的联系，促进了社区的整体福祉和发展。\n\n公司还参与或资助慈善活动和慈善机构，以支持教育、健康、减贫等领域。这些慈善活动不仅提高了公司的社会形象和品牌认知，还加强了与社区的联系和支持。\n\n为了支持员工的职业成长和人才发展，公司于2019年10月推出了员工职业成长和人才发展计划。该计划提供各类培训和发展项目，包括在线课程、工作坊和导师计划等。这些举措提高了员工的专业技能和工作满意度，促进了人才的留存和发展。\n\n为了保护业务活动的诚信和合法性，公司于2019年12月建立了反腐败政策和合规措施。这一举措提高了公司的声誉和商业伦理标准，减少了法律风险和负面影响。\n\n通过对公司的环境责任和社会责任的综合分析，可以看出公司在环境保护和社会发展方面取得了显著的成就。未来，公司将继续致力于环境保护计划、社会责任战略和可持续发展目标的实施。同时，公司还将加强技术研发和创新，提供更优质的教学服务和用户体验。",
    "生成总结": "国际英语培训教育有限公司是一家成立于2005年的上海市教育公司，主要提供针对学生及成年人的英语培训课程。",
    "生成文章": "公司在环境责任方面取得了显著的成就。首先，公司于2019年2月推出了绿色产品，这是一个重要的里程碑。在此之前，公司投入了大量资金和人力资源进行研发，并进行了市场调研，以了解消费者对环保型产品的需求和接受程度。根据调研结果和研发成果，公司开始进行绿色产品的设计和改进。这些努力使得公司的产品在市场上具有竞争力，同时减少了对环境的影响。绿色产品的开发不仅提升了产品的市场竞争力和品牌形象，还减少了环境影响。\n\n另一个重要事件是公司于2019年4月启动了农场项目。通过投资兴办农业项目，公司提供有机食品和农业教育服务。这不仅增加了公司的收入来源，还改善了农村地区的生计，促进了可持续农业发展。农场项目的启动对公司的社会责任和可持续发展具有积极的影响。\n\n为了减少能源消耗和温室气体排放，公司于2019年5月实施了节能减排项目。这项投资旨在通过采用节能技术和管理措施来减少能源消耗和碳足迹。这一举措直接减少了公司的能源消耗和碳排放，提高了能效和环境绩效。节能减排项目的实施对公司的环境责任和可持续发展具有重要意义。\n\n为了进一步强调公司对环境的承诺和责任，公司于2019年8月开始投资于碳抵消项目。通过投资林业项目或可再生能源项目来抵消其碳排放，公司努力实现碳中和目标。通过碳抵消证书，公司能够向利益相关者展示其对环境的承诺和责任。碳抵消项目的投资对公司的环境责任和可持续发展具有重要意义。\n\n此外，公司于2019年9月建立了新的污染防治设施，如废水处理系统和排放控制设备，以减少环境污染。这一举措显著降低了公司的环境污染水平，增强了合规性和社会责任感。污染防治设施的建设对公司的环境责任和可持续发展具有重要意义。\n\n为了提高环境管理能力和持续改进，公司于2019年10月实施了环境管理系统（EMS）。该系统有助于提高环境绩效，减少废物产生，并确保合规。通过采用环境管理系统，公司增强了对环境的管理能力，提升了合规性和市场认可度。环境管理系统的实施对公司的环境责任和可持续发展具有重要意义。\n\n在社会责任方面，公司也取得了显著的成就。首先，公司于2019年2月实施了员工健康与安全计划，旨在提升员工的健康与安全水平。这一措施显著改善了工作环境，减少了工伤事故，提高了员工的满意度和工作效率。员工健康与安全计划的实施对公司的社会责任和员工福利具有重要意义。\n\n此外，公司还积极参与公共服务项目，如城市绿化和公共卫生改善项目，以提升社区生活质量。公司还投资于当地社区，支持教育、健康和社会发展项目。这些举措加深了公司与社区的联系，促进了社区的整体福祉和发展。公共服务项目和社区支持项目的实施对公司的社会责任和可持续发展具有重要意义。\n\n公司还参与或资助慈善活动和慈善机构，以支持教育、健康、减贫等领域。这些慈善活动不仅提高了公司的社会形象和品牌认知，还加强了与社区的联系和支持。参与慈善活动的实施对公司的社会责任和社会影响具有重要意义。\n\n为了支持员工的职业成长和人才发展，公司于2019年10月推出了员工职业成长和人才发展计划。该计划提供各类培训和发展项目，包括在线课程、工作坊和导师计划等。这些举措提高了员工的专业技能和工作满意度，促进了人才的留存和发展。员工职业成长和人才发展计划的实施对公司的社会责任和员工福利具有重要意义。\n\n为了保护业务活动的诚信和合法性，公司于2019年12月建立了反腐败政策和合规措施。这一举措提高了公司的声誉和商业伦理标准，减少了法律风险和负面影响。反腐败政策和合规措施的实施对公司的社会责任和商业道德具有重要意义。\n\n通过对公司的环境责任和社会责任的综合分析，可以看出公司在环境保护和社会发展方面取得了显著的成就。未来，公司将继续致力于环境保护计划、社会责任战略和可持续发展目标的实施。同时，公司还将加强技术研发和创新，提供更优质的教学服务和用户体验。"
}