{
    "报告类型": "公司财务报告",
    "报告时间": "2019年度",
    "公司信息": {
        "名称": "国际英语培训教育有限公司",
        "成立日期": "2005年3月12日",
        "主营业务": "提供针对学生及成年人的英语培训课程",
        "注册地": "上海市",
        "上市情况": "非上市",
        "行业": "教育"
    },
    "报告内容": [
        {
            "类型": "财务信息",
            "重要事件": [
                {
                    "事件": "重大投资",
                    "时间": "2019年2月",
                    "描述": "公司投资了全球在线英语教育平台『阳光英语』，投资金额为500万美元。",
                    "影响": "进一步拓宽了公司的业务领域，提升了公司的盈利能力。",
                    "子事件": [
                        {
                            "事件": "与阳光英语就投资事宜进行初步洽谈",
                            "时间": "2018年9月",
                            "描述": "公司与阳光英语开始初步洽谈关于公司投资的事宜，双方进行了初步的商务谈判和尽职调查。",
                            "影响": "为后续投资决策提供了基础信息和数据，为投资计划的制定提供了依据。"
                        },
                        {
                            "事件": "公司高层就投资事宜进行讨论和决策",
                            "时间": "2018年12月",
                            "描述": "公司高层对与阳光英语投资的风险和收益进行了综合评估和讨论，最终决定进行投资。",
                            "影响": "为公司投资决策提供了高层的支持和批准，决策制定者对投资计划进行了审慎考虑。"
                        },
                        {
                            "事件": "公司进行尽职调查",
                            "时间": "2019年1月",
                            "描述": "公司对阳光英语的市场前景、财务状况、竞争情况等进行了深入的尽职调查，评估了投资的风险和收益。",
                            "影响": "为投资决策提供了充分的信息和数据支持，减少了投资风险。"
                        },
                        {
                            "事件": "公司投资阳光英语",
                            "时间": "2019年2月",
                            "描述": "公司正式投资了全球在线英语教育平台『阳光英语』，投资金额为500万美元。",
                            "影响": "实现了公司对阳光英语的投资，并进一步拓宽了公司的业务领域，提升了公司的盈利能力。"
                        }
                    ]
                },
                {
                    "事件": "重大股权收购",
                    "时间": "2019年3月",
                    "描述": "公司完成了对『英仕特教育集团』的股权收购，获得了80%的股权。",
                    "影响": "进一步扩大了公司的市场份额，提升了公司的控制力。"
                },
                {
                    "事件": "大规模融资",
                    "时间": "2019年5月",
                    "描述": "公司进行了一次大规模的融资活动，募集了3000万人民币资金。",
                    "影响": "加强了公司的资金实力，支持了公司的扩张和发展。"
                },
                {
                    "事件": "资产重组",
                    "时间": "2019年6月",
                    "描述": "公司进行了一次资产重组，优化了公司的业务结构。",
                    "影响": "提高了公司的运营效率，增加了公司的价值。"
                },
                {
                    "事件": "重大资产收购",
                    "时间": "2019年7月",
                    "描述": "公司完成了对『思迪英语学校』的资产收购，总价值2000万人民币。",
                    "影响": "扩大公司业务范围，增强市场竞争力。"
                },
                {
                    "事件": "分发股利",
                    "时间": "2019年8月",
                    "描述": "公司决定向股东分发500万人民币股利。",
                    "影响": "回报给股东们的投资，提升了股东的收益。"
                },
                {
                    "事件": "债务重组",
                    "时间": "2019年9月",
                    "描述": "为优化资本结构，公司进行了债务重组，减少了500万人民币负债。",
                    "影响": "改善了公司的财务状况，降低了财务成本。"
                },
                {
                    "事件": "新课程推出",
                    "时间": "2019年10月",
                    "描述": "公司推出了全新的在线英语考试培训课程，收到了良好的市场反馈。",
                    "影响": "进一步提升了公司的市场竞争力，带来了更多的学生招生。"
                },
                {
                    "事件": "人力资源战略调整",
                    "时间": "2019年11月",
                    "描述": "公司进行了人力资源战略调整，优化了教师结构，提高了课程质量。",
                    "影响": "进一步提升了公司的教学品牌形象，提高了学生满意度和续费率。"
                },
                {
                    "事件": "合作伙伴关系拓展",
                    "时间": "2019年12月",
                    "描述": "公司与国内知名大学『某某大学』达成合作协议，合作开展英语教育项目。",
                    "影响": "进一步提升了公司在教育行业的声誉，扩大了合作伙伴网络。"
                }
            ],
            "涉及的指标": [
                {
                    "指标": "营业收入",
                    "描述": "公司在一定会计期间内的主营业务收入和其他业务收入总额。",
                    "影响因素": [
                        "市场需求",
                        "产品价格变化"
                    ],
                    "值": "1.8亿人民币"
                },
                {
                    "指标": "净利润",
                    "描述": "公司在一定会计期间的净收入，即总收入减去总成本和所得税费用后的金额。",
                    "影响因素": [
                        "营业收入",
                        "成本控制",
                        "非经常性损益"
                    ],
                    "值": "4000万人民币"
                },
                {
                    "指标": "总资产",
                    "描述": "会计期末，公司所拥有的资产总额。",
                    "影响因素": [
                        "资产收购",
                        "资产处置",
                        "资产重估"
                    ],
                    "值": "2.5亿人民币"
                },
                {
                    "指标": "总负债",
                    "描述": "会计期末，公司所承担并需要偿还的债务总额。",
                    "影响因素": [
                        "新债发行",
                        "债务偿还",
                        "债务重组"
                    ],
                    "值": "9500万人民币"
                },
                {
                    "指标": "股东权益",
                    "描述": "会计期末，归属于股东的权益总额。",
                    "影响因素": [
                        "净利润",
                        "股利发放",
                        "资本公积"
                    ],
                    "值": "1.55亿人民币"
                },
                {
                    "指标": "现金流量",
                    "描述": "公司在一定会计期间内的现金流入和流出总和。",
                    "影响因素": [
                        "经营活动",
                        "投资活动",
                        "筹资活动"
                    ],
                    "值": "1.2亿人民币"
                },
                {
                    "指标": "负债比率",
                    "描述": "公司总负债与总资产的比率，反映公司的债务水平。",
                    "影响因素": [
                        "总负债的变化",
                        "总资产的变化"
                    ],
                    "值": "0.38"
                },
                {
                    "指标": "资产负债率",
                    "描述": "公司总负债占总资产的百分比，衡量公司财务杠杆的一个指标。",
                    "影响因素": [
                        "资产和负债的增减变化"
                    ],
                    "值": "0.39"
                },
                {
                    "指标": "净资产收益率",
                    "描述": "反映公司股东权益的经营效益，即净利润与平均股东权益的比率。",
                    "影响因素": [
                        "净利润的变化",
                        "股东权益的变化"
                    ],
                    "值": "25%"
                }
            ]
        }
    ],
    "额外信息": [
        {
            "名称": "未来展望",
            "内容": [
                {
                    "名称": "财务策略",
                    "描述": "公司未来计划实施的财务策略，包括提高教学质量、精细控制成本、提升学生满意度等。"
                },
                {
                    "名称": "投资计划",
                    "描述": "公司面向未来计划加大对在线教育平台的投资，扩大合作伙伴网络，开发更多优质课程。"
                },
                {
                    "名称": "风险管理",
                    "描述": "公司识别的主要财务风险包括市场风险、教育政策变化风险等，策略包括建立风险监测机制、合规经营等。"
                }
            ]
        }
    ],
    "生成大纲": "公司财务报告大纲：\n\nI. 财务信息\n   A. 重大事件\n      1. 重大投资\n         - 2019年2月，公司投资全球在线英语教育平台『阳光英语』500万美元。\n            - 2018年9月，公司与阳光英语开始初步洽谈投资事宜，提供了后续投资决策的依据。\n            - 2018年12月，公司高层对投资事宜进行讨论和决策，出于审慎考虑，最终决定进行投资。\n            - 2019年1月，公司进行了尽职调查，为投资决策提供了充分的信息和数据支持。\n            - 2019年2月，公司正式投资阳光英语，实现了对该平台的投资，扩展了公司业务领域。\n         - 影响：进一步拓宽了公司的业务领域，提升了公司的盈利能力。\n      2. 重大股权收购\n         - 2019年3月，公司完成英仕特教育集团80%股权收购。\n         - 影响：进一步扩大了公司的市场份额，提升了公司的控制力。\n      3. 大规模融资\n         - 2019年5月，公司进行了一次募集了3000万人民币资金的大规模融资活动。\n         - 影响：加强了公司的资金实力，支持了公司的扩张和发展。\n      4. 资产重组\n         - 2019年6月，公司进行了一次资产重组，优化了公司的业务结构。\n         - 影响：提高了公司的运营效率，增加了公司的价值。\n      5. 重大资产收购\n         - 2019年7月，公司完成思迪英语学校的资产收购，总价值2000万人民币。\n         - 影响：扩大了公司业务范围，增强市场竞争力。\n      6. 分发股利\n         - 2019年8月，公司决定向股东分发500万人民币股利。\n         - 影响：回报给股东们的投资，提升了股东的收益。\n      7. 债务重组\n         - 2019年9月，公司进行了债务重组，减少了500万人民币负债。\n         - 影响：改善了公司的财务状况，降低了财务成本。\n      8. 新课程推出\n         - 2019年10月，公司推出了全新的在线英语考试培训课程，收到了良好的市场反馈。\n         - 影响：进一步提升了公司的市场竞争力，带来了更多的学生招生。\n      9. 人力资源战略调整\n         - 2019年11月，公司进行了人力资源战略调整，优化了教师结构，提高了课程质量。\n         - 影响：进一步提升了公司的教学品牌形象，提高了学生满意度和续费率。\n      10. 合作伙伴关系拓展\n         - 2019年12月，公司与某某大学达成合作协议，开展英语教育项目。\n         - 影响：进一步提升了公司在教育行业的声誉，扩大了合作伙伴网络。\n   B. 涉及的指标\n      1. 营业收入：1.8亿元人民币\n         - 市场需求和产品价格变化是主要影响因素。\n      2. 净利润：4000万元人民币\n         - 营业收入、成本控制和非经常性损益是主要影响因素。\n      3. 总资产：2.5亿元人民币\n         - 资产收购、资产处置和资产重估是主要影响因素。\n      4. 总负债：9500万元人民币\n         - 新债发行、债务偿还和债务重组是主要影响因素。\n      5. 股东权益：1.55亿元人民币\n         - 净利润、股利发放和资本公积是主要影响因素。\n      6. 现金流量：1.2亿元人民币\n         - 经营活动、投资活动和筹资活动是主要影响因素。\n      7. 负债比率：0.38\n         - 总负债的变化和总资产的变化是主要影响因素。\n      8. 资产负债率：0.39\n         - 资产和负债的增减变化是主要影响因素。\n      9. 净资产收益率：25%\n         - 净利润的变化和股东权益的变化是主要影响因素。\n\nII. 未来展望\n   A. 财务策略\n      - 提高教学质量、精细控制成本和提升学生满意度等。\n   B. 投资计划\n      - 加大对在线教育平台的投资，扩大合作伙伴网络，开发更多优质课程。\n   C. 风险管理\n      - 风险监测机制和合规经营等，以应对市场风险、教育政策变化风险等。",
    "生成总结": "国际英语培训教育有限公司是一家位于上海市的教育公司，成立于2005年3月12日，主要业务是提供针对学生及成年人的英语培训课程。",
    "生成文章": "在过去的一年里，国际英语培训教育有限公司经历了一系列重大事件，这些事件对公司的财务状况和业务发展产生了重要影响。\n\n首先，公司在2019年2月投资了全球在线英语教育平台『阳光英语』500万美元。这笔投资是在公司与阳光英语进行了长时间的洽谈和尽职调查后决定的。这次投资进一步拓宽了公司的业务领域，提升了公司的盈利能力。\n\n接下来，在2019年3月，公司完成了英仕特教育集团80%股权的收购。这一收购使公司进一步扩大了市场份额，提升了公司的控制力。\n\n为了支持公司的扩张和发展，公司在2019年5月进行了一次募集了3000万人民币资金的大规模融资活动。这次融资活动加强了公司的资金实力，为公司的未来发展提供了有力支持。\n\n为了优化公司的业务结构，公司在2019年6月进行了一次资产重组。这次资产重组提高了公司的运营效率，增加了公司的价值。\n\n在2019年7月，公司完成了思迪英语学校的资产收购，总价值2000万人民币。这一资产收购扩大了公司的业务范围，增强了公司的市场竞争力。\n\n为了回报给股东们的投资，公司在2019年8月决定向股东分发500万人民币股利。这一举措提升了股东的收益，增强了股东对公司的信心。\n\n为了改善公司的财务状况，公司在2019年9月进行了债务重组，减少了500万人民币负债。这一债务重组改善了公司的财务状况，降低了财务成本。\n\n为了进一步提升公司的市场竞争力，公司在2019年10月推出了全新的在线英语考试培训课程。这一举措受到了良好的市场反馈，带来了更多的学生招生。\n\n为了提高教学品牌形象，公司在2019年11月进行了人力资源战略调整，优化了教师结构，提高了课程质量。这一调整进一步提升了公司的教学品牌形象，提高了学生满意度和续费率。\n\n为了扩大合作伙伴网络，公司在2019年12月与某某大学达成合作协议，开展英语教育项目。这一合作进一步提升了公司在教育行业的声誉，扩大了合作伙伴网络。\n\n在这些重大事件的影响下，公司的财务指标发生了相应的变化。营业收入达到1.8亿元人民币，净利润为4000万元人民币，总资产为2.5亿元人民币，总负债为9500万元人民币，股东权益为1.55亿元人民币，现金流量为1.2亿元人民币，负债比率为0.38，资产负债率为0.39，净资产收益率为25%。\n\n这些指标的变化受到多种因素的影响。营业收入的变化主要受市场需求和产品价格变化的影响。净利润的变化受营业收入、成本控制和非经常性损益的影响。总资产的变化受资产收购、资产处置和资产重估的影响。总负债的变化受新债发行、债务偿还和债务重组的影响。股东权益的变化受净利润、股利发放和资本公积的影响。现金流量的变化受经营活动、投资活动和筹资活动的影响。负债比率的变化受总负债的变化和总资产的变化的影响。资产负债率的变化受资产和负债的增减变化的影响。净资产收益率的变化受净利润的变化和股东权益的变化的影响。\n\n展望未来，国际英语培训教育有限公司将继续提高教学质量、精细控制成本和提升学生满意度等，以实现财务策略的目标。公司还计划加大对在线教育平台的投资，扩大合作伙伴网络，开发更多优质课程。同时，公司将继续加强风险管理，建立风险监测机制和合规经营，以应对市场风险、教育政策变化风险等。\n\n综上所述，国际英语培训教育有限公司在过去一年中经历了一系列重大事件，这些事件对公司的财务状况和业务发展产生了重要影响。公司将继续努力提高教学质量，扩大市场份额，加强风险管理，以实现持续的发展和增长。"
}