{
    "Report Type": "Corporate Governance Report",
    "Report Time": "2020",
    "Company Information": {
        "Name": "Acme Financial Services",
        "Establishment Date": "October 1, 2002",
        "Main Business": "Acme Financial Services provides comprehensive financial solutions to clients, including wealth management, investment advisory, and financial planning.",
        "Registration Location": "New York, United States",
        "Listing Status": "Publicly listed on NYSE",
        "Industry": "Finance"
    },
    "Report Content": [
        {
            "Type": "Governance Structure",
            "Significant Events": [
                {
                    "Event": "Ethics and Integrity Incidents",
                    "Time": "February, 2020",
                    "Description": "In February 2020, Acme Financial Services uncovered a case of fraudulent activities within its organization. The company took immediate action by conducting an internal investigation, terminating the involved employees, and implementing stricter internal control measures. These measures were designed to ensure that such incidents do not recur and reinforce the company's commitment to maintaining the highest ethical and integrity standards. Although the incident had a temporary negative impact on the company's reputation, the prompt and transparent handling of the matter helped restore investor, customer, and partner trust.",
                    "Impact": "May damage the company's reputation and brand value, affecting relationships with investors, customers, and partners.",
                    "Sub Events": [
                        {
                            "Event": "Implementation of Stricter Internal Control Measures",
                            "Time": "March, 2020",
                            "Description": "Following the discovery of fraudulent activities within the organization in February 2020, Acme Financial Services immediately implemented stricter internal control measures. This included enhancing oversight, implementing additional checks and balances, and reinforcing the code of conduct for all employees. These measures were put in place to prevent similar incidents from happening in the future and demonstrate the company's commitment to upholding ethical standards.",
                            "Impact": "Strengthens internal control mechanisms and reduces the likelihood of future fraudulent activities, thereby safeguarding the company's reputation."
                        },
                        {
                            "Event": "Engagement of External Audit Firm",
                            "Time": "April, 2020",
                            "Description": "In order to ensure transparency and restore investor confidence, Acme Financial Services engaged a reputable external audit firm to conduct a thorough review of its financial statements and internal controls. The audit firm conducted an independent assessment to validate the accuracy and reliability of the company's financial information, ensuring compliance with applicable regulations and accounting standards.",
                            "Impact": "Enhances trust and confidence among investors and stakeholders by providing an independent verification of the company's financial statements and internal controls."
                        },
                        {
                            "Event": "Enhancement of Staff Training Programs",
                            "Time": "May, 2020",
                            "Description": "As part of Acme Financial Services' ongoing commitment to upholding the highest ethical standards, the company enhanced its staff training programs in May 2020. These programs focused on educating employees about the importance of ethics and integrity in their daily activities. Training modules were developed to address key areas such as fraud prevention, ethical decision-making, and regulatory compliance.",
                            "Impact": "Improves the knowledge and awareness of employees regarding ethics and integrity, fostering a culture of responsible behavior within the organization."
                        }
                    ]
                },
                {
                    "Event": "Corporate Governance Policy Revision",
                    "Time": "March, 2020",
                    "Description": "Acme Financial Services revised its corporate governance policies to enhance transparency, accountability, and stakeholder engagement. The updated framework reinforces the importance of responsible and ethical business practices, ensuring that the company operates in line with the highest standards of corporate governance. This revision enhances corporate governance transparency and accountability, boosting stakeholder confidence.",
                    "Impact": "Enhances corporate governance transparency and accountability, boosting stakeholder confidence."
                },
                {
                    "Event": "Board of Directors Change",
                    "Time": "April, 2020",
                    "Description": "Acme Financial Services witnessed a change in the composition of its board of directors. Three new members were appointed, including experienced professionals in the finance industry. This change is expected to bring fresh perspectives and diverse expertise to the company, leading to strategic adjustments and positively impacting the company’s long-term development direction and shareholder interests.",
                    "Impact": "May lead to strategic adjustments, affecting the company’s long-term development direction and shareholder interests."
                },
                {
                    "Event": "Shareholders' Meeting Resolution",
                    "Time": "June, 2020",
                    "Description": "At the annual shareholders' meeting, Acme Financial Services made several key decisions to strengthen its governance structure and shape its future operational strategies. These decisions included the appointment of an independent audit firm to conduct external audits, amendment of the company's charter to enhance the rights of shareholders, and approval of the remuneration package for the executive team. The resolutions directly affect the company's governance structure, future operational strategies, and shareholder rights.",
                    "Impact": "Directly affects the company’s governance structure, future operational strategies, and shareholder rights."
                },
                {
                    "Event": "Sustainability and Social Responsibility Initiatives",
                    "Time": "July, 2020",
                    "Description": "Acme Financial Services remains committed to playing an active role in sustainability, environmental protection, social responsibility, and corporate citizenship. During July 2020, the company achieved significant progress in these areas, including the launch of a renewable energy investment fund, increased focus on green financing, and employee volunteering initiatives. These efforts have enhanced the company’s public image and market competitiveness, promoting long-term sustainable development.",
                    "Impact": "Enhances the company’s public image and market competitiveness, promoting long-term sustainable development."
                },
                {
                    "Event": "Compliance and Regulatory Updates",
                    "Time": "September, 2020",
                    "Description": "Acme Financial Services diligently keeps up with changing regulations and compliance standards. In September 2020, the company underwent a comprehensive review of new securities law, corporate law, and specific industry regulations. The necessary adjustments were made to ensure compliance with the latest laws and regulations, reducing legal risk and protecting the company and shareholder interests.",
                    "Impact": "Ensures compliance with the latest laws and regulations, reducing legal risk, protecting the company and shareholder interests."
                },
                {
                    "Event": "Senior Management Changes",
                    "Time": "October, 2020",
                    "Description": "Acme Financial Services experienced a change in its senior management in October 2020. The former CEO retired after successfully leading the company for over a decade. A highly accomplished industry veteran joined as the new CEO, bringing valuable insights and a fresh perspective. This change in leadership may lead to adjustments in operational focus and strategic priorities, affecting short-term performance and long-term development.",
                    "Impact": "May lead to adjustments in operational focus and strategic priorities, affecting short-term performance and long-term development."
                },
                {
                    "Event": "Risk Management Measures",
                    "Time": "December, 2020",
                    "Description": "Acme Financial Services continually updates and strengthens its risk management framework to proactively address emerging risks. In December 2020, the company conducted a thorough assessment of potential risks and implemented new mitigation strategies. By enhancing its ability to respond to internal and external risks, the company ensures continuous operation and stable development.",
                    "Impact": "Improves the company’s ability to respond to internal and external risks, ensuring continuous operation and stable development."
                }
            ],
            "Involved Indicators": [
                {
                    "Indicator": "Information Disclosure",
                    "Description": "Acme Financial Services has a robust information disclosure process in place. The company adheres to the principles of transparency, accuracy, and fairness in its disclosure practices. It ensures timely reporting of financial information, regulatory filings, and material events to meet the information needs of investors and other stakeholders.",
                    "Value": "Acme Financial Services has a dedicated team responsible for information disclosure. The team ensures that all relevant financial information and material events are disclosed accurately and in a timely manner."
                },
                {
                    "Indicator": "Related Transactions",
                    "Description": "Acme Financial Services maintains clear policies, procedures, and measures to ensure fairness and compliance in all related transactions. The company has implemented strong internal controls to prevent conflicts of interest and unethical practices. The related transaction processes are transparent and subject to regular internal and external audits.",
                    "Value": "Acme Financial Services' related transactions are conducted with the highest level of fairness and compliance. The company has implemented stringent policies and procedures to prevent conflicts of interest and maintain ethical practices."
                },
                {
                    "Indicator": "Internal Control",
                    "Description": "Acme Financial Services has established a robust internal control system to safeguard its assets, ensure accurate financial reporting, and address operational risks. The company regularly assesses the effectiveness of its internal controls and updates them to align with changing business dynamics and emerging risks.",
                    "Value": "Acme Financial Services' internal control system is designed to safeguard the company's assets, ensure accurate financial reporting, and address operational risks. Regular assessments are conducted to identify areas for improvement and mitigate risks."
                }
            ]
        }
    ],
    "Additional Information": [
        {
            "Name": "Governance Improvement Plans",
            "Content": [
                {
                    "Name": "Strengthening the Function of the Board of Directors and Supervisory Board",
                    "Description": "Acme Financial Services aims to enhance the efficiency and effectiveness of its board of directors and supervisory board in corporate governance. This includes providing regular training to board members, increasing the proportion of independent directors, and optimizing decision-making processes to ensure the best interests of the company and its stakeholders are served."
                },
                {
                    "Name": "Enhancing Transparency and Quality of Information Disclosure",
                    "Description": "Acme Financial Services is committed to improving its information disclosure process and standards. The company seeks to ensure that all stakeholders receive timely, accurate, and comprehensive information. By enhancing transparency and the quality of information disclosure, Acme Financial Services aims to foster trust and maintain strong relationships with its stakeholders."
                }
            ]
        },
        {
            "Name": "Risk Management Strategy",
            "Content": [
                {
                    "Name": "Strengthening the Internal Control System",
                    "Description": "Acme Financial Services places great emphasis on establishing and improving its internal control system. The company aims to identify, assess, monitor, and report financial and operational risks effectively. By enhancing its internal control system, Acme Financial Services strengthens its capacity to withstand risks and ensure the long-term stability of the organization."
                },
                {
                    "Name": "Integrating Sustainable Development and Social Responsibility",
                    "Description": "Acme Financial Services is committed to integrating sustainable development and social responsibility into its business strategy. The company identifies related risks and opportunities and actively promotes long-term value creation. By integrating sustainable practices into its operations, Acme Financial Services aims to contribute to the well-being of society while creating value for its stakeholders."
                }
            ]
        }
    ],
    "Generated Outline": "I. Introduction\n   - Brief explanation of the purpose of the Corporate Governance Report\n   - Overview of Acme Financial Services, including name, establishment date, main business, registration location, listing status, and industry\n\nII. Governance Structure\n   A. Significant Events\n      1. Ethics and Integrity Incidents (February, 2020)\n         - Description of the fraudulent activities uncovered within the organization\n         - Actions taken by the company, such as conducting an internal investigation, terminating involved employees, and implementing stricter internal control measures\n         - Impact on the company's reputation and brand value\n         - Sub Events:\n            a. Implementation of Stricter Internal Control Measures (March, 2020)\n               - Details of the measures implemented to prevent future fraudulent activities\n               - Impact on internal control mechanisms and the company's reputation\n            b. Engagement of External Audit Firm (April, 2020)\n               - Explanation of engaging an external audit firm for independent verification\n               - Impact on trust and confidence among investors and stakeholders\n            c. Enhancement of Staff Training Programs (May, 2020)\n               - Information about the staff training programs aimed at promoting ethics and integrity\n               - Impact on employee knowledge and awareness of ethics and integrity\n\n      2. Corporate Governance Policy Revision (March, 2020)\n         - Description of the revision made to enhance transparency, accountability, and stakeholder engagement\n         - Impact on corporate governance transparency and accountability\n\n      3. Board of Directors Change (April, 2020)\n         - Announcement of the change in board composition and appointment of new members\n         - Expectations regarding fresh perspectives and expertise in the finance industry\n         - Impact on strategic adjustments and shareholder interests\n\n      4. Shareholders' Meeting Resolution (June, 2020)\n         - Overview of key decisions made at the annual shareholders' meeting\n         - Resolutions related to the governance structure, operational strategies, and shareholder rights\n         - Impact on the company's governance structure, operational strategies, and shareholder rights\n\n      5. Sustainability and Social Responsibility Initiatives (July, 2020)\n         - Explanation of the company's commitment to sustainability and social responsibility\n         - Highlights of the achievements made in renewable energy investment, green financing, and employee volunteering\n         - Impact on the company's public image and market competitiveness\n\n      6. Compliance and Regulatory Updates (September, 2020)\n         - Demonstration of the company's effort to comply with changing regulations and standards\n         - Overview of the comprehensive review of securities law, corporate law, and industry regulations\n         - Impact on legal risk mitigation and protection of company and shareholder interests\n\n      7. Senior Management Changes (October, 2020)\n         - Announcement of the retirement of the former CEO and appointment of a new CEO\n         - Expectations regarding adjustments in operational focus and strategic priorities\n         - Impact on short-term performance and long-term development\n\n      8. Risk Management Measures (December, 2020)\n         - Description of the company's continuous effort to update and strengthen its risk management framework\n         - Details of the assessment of potential risks and implementation of new mitigation strategies\n         - Impact on the company's ability to respond to internal and external risks\n\n   B. Involved Indicators\n      1. Information Disclosure\n         - Overview of the company's robust information disclosure process\n         - Adherence to transparency, accuracy, and fairness principles in disclosure practices\n         - Value of a dedicated team responsible for accurate and timely information disclosure\n\n      2. Related Transactions\n         - Explanation of clear policies, procedures, and measures to ensure fairness and compliance\n         - Implementation of strong internal controls to prevent conflicts of interest and unethical practices\n         - Value in conducting related transactions with fairness and compliance, subject to audits\n\n      3. Internal Control\n         - Introduction to the company's robust internal control system\n         - Safeguarding of assets, accurate financial reporting, and addressing operational risks\n         - Emphasis on regular assessments to improve internal controls and mitigate risks\n\nIII. Additional Information\n   A. Governance Improvement Plans\n      1. Strengthening the Function of the Board of Directors and Supervisory Board\n         - Objectives to enhance the efficiency and effectiveness of the board and supervisory board\n         - Measures such as regular training, increased proportion of independent directors, and optimized decision-making processes\n\n      2. Enhancing Transparency and Quality of Information Disclosure\n         - Commitment to improving information disclosure processes and standards\n         - Goal to provide timely, accurate, and comprehensive information to all stakeholders\n\n   B. Risk Management Strategy\n      1. Strengthening the Internal Control System\n         - Focus on establishing and improving the internal control system\n         - Aim to identify, assess, monitor, and report financial and operational risks effectively\n\n      2. Integrating Sustainable Development and Social Responsibility\n         - Emphasis on integrating sustainability and social responsibility into business strategy\n         - Identification of related risks and opportunities for long-term value creation\n\nIV. Conclusion\n   - Recap of the significant events and indicators related to corporate governance\n   - Mention of governance improvement plans and risk management strategy\n   - Overall assessment of the company's commitment to maintaining high standards of corporate governance and its impact on stakeholders.",
    "Generated Summary": "Acme Financial Services, established on October 1, 2002, is a publicly listed finance company based in New York, United States, offering a wide range of financial solutions, including wealth management, investment advisory, and financial planning.",
    "Generated Article": "In February 2020, Acme Financial Services experienced a significant ethics and integrity incident that had a profound impact on the company. Fraudulent activities were uncovered within the organization, leading to a tarnished reputation and a decline in brand value. To address this issue, the company took immediate action by conducting an internal investigation, terminating the employees involved, and implementing stricter internal control measures. These measures aimed to prevent future fraudulent activities and restore trust among investors and stakeholders. In March 2020, Acme Financial Services implemented stricter internal control measures, which had a positive impact on the company's internal control mechanisms and reputation.\n\nIn April 2020, the company engaged an external audit firm for independent verification, further enhancing trust and confidence among investors and stakeholders. This move demonstrated Acme Financial Services' commitment to transparency and accountability in its corporate governance practices. Additionally, in May 2020, the company enhanced its staff training programs to promote ethics and integrity. This initiative aimed to improve employee knowledge and awareness of ethical practices within the organization.\n\nIn March 2020, Acme Financial Services revised its corporate governance policy to enhance transparency, accountability, and stakeholder engagement. This revision had a positive impact on the company's corporate governance practices, ensuring that it adhered to best practices and met the expectations of its stakeholders.\n\nIn April 2020, the company announced a change in its board of directors, appointing new members. This change was expected to bring fresh perspectives and expertise in the finance industry, leading to strategic adjustments and better alignment with shareholder interests.\n\nAt the annual shareholders' meeting in June 2020, key decisions were made regarding the company's governance structure, operational strategies, and shareholder rights. These resolutions had a significant impact on shaping the company's governance practices, operational direction, and ensuring the protection of shareholder rights.\n\nAcme Financial Services demonstrated its commitment to sustainability and social responsibility in July 2020. The company invested in renewable energy, engaged in green financing, and encouraged employee volunteering. These initiatives not only contributed to the company's public image but also enhanced its market competitiveness.\n\nIn September 2020, the company proactively addressed compliance and regulatory updates by conducting a comprehensive review of securities law, corporate law, and industry regulations. This effort ensured that Acme Financial Services remained compliant with changing regulations and protected the interests of the company and its shareholders.\n\nIn October 2020, the company announced senior management changes, with the retirement of the former CEO and the appointment of a new CEO. This change was expected to bring adjustments in operational focus and strategic priorities, impacting both short-term performance and long-term development.\n\nTo strengthen its risk management framework, Acme Financial Services implemented risk management measures in December 2020. These measures included updating and strengthening the company's risk management framework, assessing potential risks, and implementing new mitigation strategies. These efforts aimed to enhance the company's ability to respond to internal and external risks effectively.\n\nThroughout these events, Acme Financial Services demonstrated a commitment to maintaining high standards of corporate governance. The company's efforts to address ethics and integrity incidents, revise corporate governance policies, engage external audit firms, and implement risk management measures showcased its dedication to transparency, accountability, and stakeholder engagement. These initiatives had a positive impact on the company's reputation, trust among investors and stakeholders, and its ability to navigate regulatory changes. Overall, Acme Financial Services' commitment to corporate governance has positioned it as a responsible and trustworthy financial institution in the industry."
}