{
    "Hospitalization Record": {
        "Basic Information": {
            "Name": "L. Rogers",
            "Gender": "female",
            "Age": "56",
            "Ethnicity": "Caucasian",
            "Marital Status": "Married",
            "Occupation": "Teacher",
            "Address": "89, Greenfield street, Knoxville",
            "Admission Time": "6th, January",
            "Record Time": "6th, January",
            "Historian": "Dr. James Nelson",
            "Hospital Name": "Knoxville General Hospital"
        },
        "Chief Complaint": "Blurry, foggy vision and decreased visual acuity for the past 3 months",
        "Present Illness": {
            "Onset": "3 months ago, at home, gradual onset, no specific prodromal symptoms identified. Possible aging-related onset.",
            "Main Symptoms": "Blurry, foggy vision affecting both eyes, progressively worsening over time. Decreased visual acuity, significant especially in low-light conditions. No known relieving factors; glare worsens the symptoms.",
            "Accompanying Symptoms": "Increased glare and halos around lights, occasional monocular double or multiple vision, difficulty seeing in bright light.",
            "Diagnosis and Treatment History": "Visited optometrist 2 months ago, diagnosed with early-stage cataract. Prescribed new glasses with minimal relief; no other treatments received prior to hospital admission.",
            "General Condition Changes": "Mental state remains stable, with some frustration due to vision impairment. No significant changes in sleep or appetite, regular urination and defecation, stable weight."
        },
        "Past History": {
            "General Health Condition": "Generally healthy, no chronic illnesses",
            "Disease History": "No history of systemic diseases or major illnesses",
            "Infectious Disease History": "No history of significant infectious diseases",
            "Immunization History": "Up-to-date with all standard vaccinations",
            "Surgery and Trauma History": "No previous surgeries or significant traumas reported",
            "Blood Transfusion History": "No history of blood transfusions",
            "Allergy History": "No known allergies"
        },
        "Personal History": {
            "Birthplace": "Knoxville",
            "Residence": "Knoxville",
            "Living Habits": "Non-smoker, occasional social drinker, balanced diet",
            "Occupation and Working Conditions": "Teacher at a local high school, generally well-lit and comfortable working conditions",
            "Exposure History": "No significant exposure to industrial toxins, dust, or radioactive substances",
            "Travel History": "No recent travel history reported"
        },
        "Marital and Family History": {
            "Marital History": {
                "Marital Status": "Married",
                "Marriage Age": "28",
                "Spouse's Health Condition": "Healthy",
                "Children's Condition": "Two children, both in good health"
            },
            "Menstrual History": {
                "Menarche Age": "13",
                "Menstruation Duration": "5 days",
                "Menstruation Interval": "28 days",
                "Last Menstruation": "Menopausal at age 50",
                "Menstrual Volume": "Normal",
                "Dysmenorrhea": "None"
            },
            "Family History": "Parents deceased, father had hypertension, mother had diabetes; siblings in good health with no similar vision issues reported."
        },
        "Physical Examination": {
            "General Condition": {
                "Temperature": "36.6Â°C",
                "Pulse": "72 bpm",
                "Respiration": "16 breaths/min",
                "Blood Pressure": "120/80 mmHg"
            },
            "Systematic Examination": {
                "Skin": "Normal, no lesions or abnormalities",
                "Mucous Membranes": "Normal",
                "Lymph Nodes": "No significant enlargement",
                "Head and Organs": "Normal, no abnormalities noted",
                "Neck": "Normal range of motion, no masses or tenderness",
                "Chest": "Normal thorax shape, clear lung sounds, normal heart sounds, no murmurs",
                "Abdomen": "Normal, no hepatosplenomegaly",
                "Rectum and Anus": "Not examined",
                "External Genitalia": "Normal for age",
                "Spine": "Normal curvature and mobility",
                "Limbs": "Normal, no deformities or abnormalities",
                "Nervous System": "Normal, no deficits or abnormalities"
            }
        },
        "Specialist Examination": "Ophthalmic examination reveals opacification of the lens in both eyes, more severe in the right eye. Visual acuity: Right eye 20/80, Left eye 20/60. Decreased contrast sensitivity and presence of glare.",
        "Auxiliary Examination": "Slit-lamp examination confirms cataract diagnosis with visible lens opacities. No evidence of retinal detachment or other ocular pathology.",
        "Preliminary Diagnosis": "Bilateral Cataract, more pronounced in the right eye",
        "Diagnostic Basis": "Gradual onset of blurry vision, decreased visual acuity, and ophthalmic examination confirming lens opacities consistent with cataracts.",
        "Differential Diagnosis": "Glaucoma ruled out due to normal intraocular pressure and absence of optic nerve damage. Age-related macular degeneration ruled out due to normal retinal appearance. Physiological lens aging considered but ruled out due to severity of visual impairment.",
        "Admission Records": {
            "Physician's Signature": "Dr. James Nelson"
        },
        "Post-Admission Course Records": {
            "First Course Record": "Patient was admitted with a primary diagnosis of bilateral cataract. Initial examination confirms the presence of significant lens opacities. Plan includes regular ophthalmologic assessments, potential consideration for cataract surgery if visual impairment significantly impacts daily activities.",
            "Daily Course Records": "Day 1: Vision remains stable, patient experiencing slight improvement with adjusted lighting conditions. Day 2: No significant changes, continues to manage glare with polarized glasses.",
            "Senior Physician Rounds Records": "Dr. Smith reviewed patient on Day 3, agrees with conservative management and consideration for future surgery.",
            "Difficult Case Discussion Records": "",
            "Handover Records": "On Day 4, patient condition remains stable, handed over to Dr. Lee for weekend coverage.",
            "Transfer Records": "",
            "Stage Summary": "End of first week: Patient remains stable, vision unchanged. Continues conservative management, no immediate need for surgical intervention.",
            "Emergency Records": "",
            "Invasive Procedure Records": "",
            "Consultation Records": "Ophthalmology consultation on Day 3, supportive of conservative management.",
            "Discharge Records": "Planned for discharge on Day 7 with follow-up at the ophthalmology clinic in 2 weeks.",
            "Critically Ill Patient Care Records": ""
        },
        "Medical Orders": {
            "Long-term Orders": "1. Regular ophthalmologic assessments. 2. Polarized glasses for glare management.",
            "Temporary Orders": "N/A"
        },
        "Auxiliary Examination Reports": "Slit-lamp and visual acuity tests confirming cataract presence and severity.",
        "Temperature Chart": "Temperature, pulse, respiration, and blood pressure within normal limits throughout hospitalization.",
        "Blood Transfusion Consent": "",
        "Special Examination Consent": "",
        "Critical Condition Notice": ""
    },
    "DiseaseType": {
        "Diseases of the Eye and Adnexa": {
            "Name": "Cataract",
            "Symptoms": "Blurry, foggy vision, decreased visual acuity, decreased contrast sensitivity, blurry vision, monocular double or multiple vision, visual field defects, glare",
            "Differential Diagnosis": "Glaucoma, age-related macular degeneration, physiological lens aging."
        }
    },
    "Generated Article": "Hospitalization Record\n\nBasic Information:\nName: L. Rogers\nGender: Female\nAge: 56\nEthnicity: Caucasian\nMarital Status: Married\nOccupation: Teacher\nAddress: 89, Greenfield street, Knoxville\nAdmission Time: 6th, January\nRecord Time: 6th, January\nHistorian: Dr. James Nelson\nHospital Name: Knoxville General Hospital\n\nChief Complaint:\nBlurry, foggy vision and decreased visual acuity for the past 3 months\n\nPresent Illness:\nOnset: 3 months ago, at home, gradual onset, no specific prodromal symptoms identified. Possible aging-related onset.\nMain Symptoms: Blurry, foggy vision affecting both eyes, progressively worsening over time. Decreased visual acuity, significant especially in low-light conditions. No known relieving factors; glare worsens the symptoms.\nAccompanying Symptoms: Increased glare and halos around lights, occasional monocular double or multiple vision, difficulty seeing in bright light.\nDiagnosis and Treatment History: Visited optometrist 2 months ago, diagnosed with early-stage cataract. Prescribed new glasses with minimal relief; no other treatments received prior to hospital admission.\nGeneral Condition Changes: Mental state remains stable, with some frustration due to vision impairment. No significant changes in sleep or appetite, regular urination and defecation, stable weight.\n\nPast History:\nGeneral Health Condition: Generally healthy, no chronic illnesses\nDisease History: No history of systemic diseases or major illnesses\nInfectious Disease History: No history of significant infectious diseases\nImmunization History: Up-to-date with all standard vaccinations\nSurgery and Trauma History: No previous surgeries or significant traumas reported\nBlood Transfusion History: No history of blood transfusions\nAllergy History: No known allergies\n\nPersonal History:\nBirthplace: Knoxville\nResidence: Knoxville\nLiving Habits: Non-smoker, occasional social drinker, balanced diet\nOccupation and Working Conditions: Teacher at a local high school, generally well-lit and comfortable working conditions\nExposure History: No significant exposure to industrial toxins, dust, or radioactive substances\nTravel History: No recent travel history reported\n\nMarital and Family History:\nMarital History:\nMarital Status: Married\nMarriage Age: 28\nSpouse's Health Condition: Healthy\nChildren's Condition: Two children, both in good health\nMenstrual History:\nMenarche Age: 13\nMenstruation Duration: 5 days\nMenstruation Interval: 28 days\nLast Menstruation: Menopausal at age 50\nMenstrual Volume: Normal\nDysmenorrhea: None\nFamily History: Parents deceased, father had hypertension, mother had diabetes; siblings in good health with no similar vision issues reported.\n\nPhysical Examination:\nGeneral Condition:\nTemperature: 36.6Â°C\nPulse: 72 bpm\nRespiration: 16 breaths/min\nBlood Pressure: 120/80 mmHg\n\nSystematic Examination:\nSkin: Normal, no lesions or abnormalities\nMucous Membranes: Normal\nLymph Nodes: No significant enlargement\nHead and Organs: Normal, no abnormalities noted\nNeck: Normal range of motion, no masses or tenderness\nChest: Normal thorax shape, clear lung sounds, normal heart sounds, no murmurs\nAbdomen: Normal, no hepatosplenomegaly\nRectum and Anus: Not examined\nExternal Genitalia: Normal for age\nSpine: Normal curvature and mobility\nLimbs: Normal, no deformities or abnormalities\nNervous System: Normal, no deficits or abnormalities\n\nSpecialist Examination:\nOphthalmic examination reveals opacification of the lens in both eyes, more severe in the right eye. Visual acuity: Right eye 20/80, Left eye 20/60. Decreased contrast sensitivity and presence of glare.\n\nAuxiliary Examination:\nSlit-lamp examination confirms cataract diagnosis with visible lens opacities. No evidence of retinal detachment or other ocular pathology.\n\nPreliminary Diagnosis:\nBilateral Cataract, more pronounced in the right eye\n\nDiagnostic Basis:\nGradual onset of blurry vision, decreased visual acuity, and ophthalmic examination confirming lens opacities consistent with cataracts.\n\nDifferential Diagnosis:\nGlaucoma ruled out due to normal intraocular pressure and absence of optic nerve damage. Age-related macular degeneration ruled out due to normal retinal appearance. Physiological lens aging considered but ruled out due to severity of visual impairment.\n\nAdmission Records:\nPhysician's Signature: Dr. James Nelson\n\nPost-Admission Course Records:\nFirst Course Record: Patient was admitted with a primary diagnosis of bilateral cataract. Initial examination confirms the presence of significant lens opacities. Plan includes regular ophthalmologic assessments, potential consideration for cataract surgery if visual impairment significantly impacts daily activities.\nDaily Course Records: \nDay 1: Vision remains stable, patient experiencing slight improvement with adjusted lighting conditions. \nDay 2: No significant changes, continues to manage glare with polarized glasses.\nSenior Physician Rounds Records: Dr. Smith reviewed patient on Day 3, agrees with conservative management and consideration for future surgery.\nDifficult Case Discussion Records: N/A\nHandover Records: On Day 4, patient condition remains stable, handed over to Dr. Lee for weekend coverage.\nTransfer Records: N/A\nStage Summary: End of first week: Patient remains stable, vision unchanged. Continues conservative management, no immediate need for surgical intervention.\nEmergency Records: N/A\nInvasive Procedure Records: N/A\nConsultation Records: Ophthalmology consultation on Day 3, supportive of conservative management.\nDischarge Records: Planned for discharge on Day 7 with follow-up at the ophthalmology clinic in 2 weeks.\nCritically Ill Patient Care Records: N/A\n\nMedical Orders:\nLong-term Orders: \n1. Regular ophthalmologic assessments.\n2. Polarized glasses for glare management.\nTemporary Orders: N/A\n\nAuxiliary Examination Reports:\nSlit-lamp and visual acuity tests confirming cataract presence and severity.\n\nTemperature Chart:\nTemperature, pulse, respiration, and blood pressure within normal limits throughout hospitalization.\n\nBlood Transfusion Consent: N/A\nSpecial Examination Consent: N/A\nCritical Condition Notice: N/A",
    "qa_fact_based": [
        {
            "question type": "Factual Question",
            "question": "According to the hospitalization records of Knoxville General Hospital, what is L. Rogers' initial diagnosis?",
            "answer": "Bilateral Cataract, more pronounced in the right eye.",
            "ref": [
                "Preliminary Diagnosis:",
                "Bilateral Cataract, more pronounced in the right eye"
            ]
        },
        {
            "question type": "Factual Question",
            "question": "According to the hospitalization records of Knoxville General Hospital, what is L. Rogers' chief complaint?",
            "answer": "Blurry, foggy vision and decreased visual acuity for the past 3 months.",
            "ref": [
                "Chief Complaint:",
                "Blurry, foggy vision and decreased visual acuity for the past 3 months"
            ]
        },
        {
            "question type": "Factual Question",
            "question": "According to the hospitalization records of Knoxville General Hospital, what is L. Rogers' age?",
            "answer": "56.",
            "ref": [
                "Age: 56"
            ]
        },
        {
            "question type": "Factual Question",
            "question": "According to the hospitalization records of Knoxville General Hospital, what is L. Rogers' occupation?",
            "answer": "Teacher.",
            "ref": [
                "Occupation: Teacher"
            ]
        }
    ],
    "qa_multi_hop": [
        {
            "question type": "Multi-hop Reasoning Question",
            "question": "According to the hospitalization records of Knoxville General Hospital, how many auxiliary examinations did L. Rogers undergo?",
            "answer": "According to the records, L. Rogers underwent 2 auxiliary examinations, namely Slit-lamp examination and visual acuity tests.",
            "ref": [
                "Auxiliary Examination:",
                "Slit-lamp examination confirms cataract diagnosis with visible lens opacities.",
                "Slit-lamp and visual acuity tests confirming cataract presence and severity."
            ]
        }
    ],
    "qa_summary": [
        {
            "question type": "Summarization Question",
            "question": "According to the hospitalization records of Knoxville General Hospital, summarize the present illness of L. Rogers.",
            "answer": "L. Rogers' present illness began 3 months ago with a gradual onset of blurry, foggy vision affecting both eyes, progressively worsening over time. She experiences decreased visual acuity, especially in low-light conditions, increased glare and halos around lights, occasional monocular double or multiple vision, and difficulty seeing in bright light. She was diagnosed with early-stage cataract by an optometrist 2 months ago and prescribed new glasses with minimal relief.",
            "ref": [
                "Present Illness:",
                "Onset: 3 months ago, at home, gradual onset, no specific prodromal symptoms identified.",
                "Possible aging-related onset.",
                "Main Symptoms: Blurry, foggy vision affecting both eyes, progressively worsening over time.",
                "Decreased visual acuity, significant especially in low-light conditions.",
                "No known relieving factors; glare worsens the symptoms.",
                "Accompanying Symptoms: Increased glare and halos around lights, occasional monocular double or multiple vision, difficulty seeing in bright light.",
                "Diagnosis and Treatment History: Visited optometrist 2 months ago, diagnosed with early-stage cataract.",
                "Prescribed new glasses with minimal relief; no other treatments received prior to hospital admission."
            ]
        },
        {
            "question type": "Summarization Question",
            "question": "According to the hospitalization records of Knoxville General Hospital, summarize the past medical history of L. Rogers.",
            "answer": "L. Rogers is generally healthy with no chronic illnesses, systemic diseases, significant infectious diseases, previous surgeries, significant traumas, or blood transfusions. She is up-to-date with all standard vaccinations and has no known allergies.",
            "ref": [
                "General Health Condition: Generally healthy, no chronic illnesses",
                "Disease History: No history of systemic diseases or major illnesses",
                "Infectious Disease History: No history of significant infectious diseases",
                "Immunization History: Up-to-date with all standard vaccinations",
                "Surgery and Trauma History: No previous surgeries or significant traumas reported",
                "Blood Transfusion History: No history of blood transfusions",
                "Allergy History: No known allergies"
            ]
        },
        {
            "question type": "Summarization Question",
            "question": "According to the hospitalization records of Knoxville General Hospital, summarize the physical examination findings of L. Rogers.",
            "answer": "L. Rogers' physical examination findings are as follows: Temperature 36.6Â°C, Pulse 72 bpm, Respiration 16 breaths/min, Blood Pressure 120/80 mmHg. Skin, mucous membranes, lymph nodes, head, neck, chest, abdomen, external genitalia, spine, limbs, and nervous system are all normal with no abnormalities noted.",
            "ref": [
                "General Condition:",
                "Temperature: 36.6Â°C",
                "Pulse: 72 bpm",
                "Respiration: 16 breaths/min",
                "Blood Pressure: 120/80 mmHg",
                "Skin: Normal, no lesions or abnormalities",
                "Mucous Membranes: Normal",
                "Lymph Nodes: No significant enlargement",
                "Head and Organs: Normal, no abnormalities noted",
                "Neck: Normal range of motion, no masses or tenderness",
                "Chest: Normal thorax shape, clear lung sounds, normal heart sounds, no murmurs",
                "Abdomen: Normal, no hepatosplenomegaly",
                "External Genitalia: Normal for age",
                "Spine: Normal curvature and mobility",
                "Limbs: Normal, no deformities or abnormalities",
                "Nervous System: Normal, no deficits or abnormalities"
            ]
        }
    ]
}