{
    "Hospitalization Record": {
        "Basic Information": {
            "Name": "Q. Gomez",
            "Gender": "female",
            "Age": "28",
            "Ethnicity": "Latina",
            "Marital Status": "single",
            "Occupation": "graphic designer",
            "Address": "40, Wilton street, Ashland",
            "Admission Time": "9th, April",
            "Record Time": "9th, April",
            "Historian": "self",
            "Hospital Name": "Ashland City Hospital"
        },
        "Chief Complaint": "Blurred vision and severe headache for 3 days",
        "Present Illness": {
            "Onset": "Three days ago at home, sudden onset with no prodromal symptoms. Possible trigger unknown.",
            "Main Symptoms": "Blurred vision in both eyes, severe headache rated 8/10, persistent for 3 days, worsened by dim light, not relieved by over-the-counter analgesics.",
            "Accompanying Symptoms": "Eye swelling, eye pain, nausea, vomiting, foggy vision, unequal pupil sizes, and decreased vision.",
            "Diagnosis and Treatment History": "Visited an urgent care center two days ago, prescribed eye drops and analgesics with no significant improvement.",
            "General Condition Changes": "Mental state anxious due to persistent symptoms; sleep normal but disturbed by pain, appetite decreased, normal urination and defecation, slight weight loss noted."
        },
        "Past History": {
            "General Health Condition": "Generally healthy",
            "Disease History": "No chronic illnesses",
            "Infectious Disease History": "None reported",
            "Immunization History": "Up-to-date",
            "Surgery and Trauma History": "Appendectomy at age 22",
            "Blood Transfusion History": "None",
            "Allergy History": "Allergic to penicillin"
        },
        "Personal History": {
            "Birthplace": "Ashland",
            "Residence": "Ashland",
            "Living Habits": "Non-smoker, occasional social alcohol use",
            "Occupation and Working Conditions": "Graphic designer, frequent screen use",
            "Exposure History": "No exposure to industrial toxins, dust, radioactive substances, etc.",
            "Travel History": "No recent travel"
        },
        "Marital and Family History": {
            "Marital History": {
                "Marital Status": "Single",
                "Marriage Age": "N/A",
                "Spouse's Health Condition": "N/A",
                "Children's Condition": "N/A"
            },
            "Menstrual History": {
                "Menarche Age": "12",
                "Menstruation Duration": "5 days",
                "Menstruation Interval": "28 days",
                "Last Menstruation": "5 days ago",
                "Menstrual Volume": "Normal",
                "Dysmenorrhea": "Mild"
            },
            "Family History": "Parents healthy, no history of eye diseases in siblings"
        },
        "Physical Examination": {
            "General Condition": {
                "Temperature": "36.8°C",
                "Pulse": "78 bpm",
                "Respiration": "16 breaths/min",
                "Blood Pressure": "120/80 mmHg"
            },
            "Systematic Examination": {
                "Skin": "Normal, no abnormalities",
                "Mucous Membranes": "Moist, no lesions",
                "Lymph Nodes": "Not palpable",
                "Head and Organs": "Normocephalic, PERRLA abnormal (unequal pupils)",
                "Neck": "Supple, no masses",
                "Chest": "Normal, lungs clear, heart sounds normal",
                "Abdomen": "Soft, non-tender, liver and spleen not palpable",
                "Rectum and Anus": "Normal",
                "External Genitalia": "Normal",
                "Spine": "Normal curvature",
                "Limbs": "No edema, full range of motion",
                "Nervous System": "Cranial nerves intact, no focal deficits"
            }
        },
        "Specialist Examination": "Ophthalmology: Elevated intraocular pressure noted, cup-to-disc ratio increased, visual field test shows peripheral vision loss.",
        "Auxiliary Examination": "Tonometry showing elevated intraocular pressure at 28 mmHg. Gonioscopy confirming closed angles. Visual field test indicating peripheral vision loss.",
        "Preliminary Diagnosis": "Acute angle-closure glaucoma",
        "Diagnostic Basis": "Based on history of sudden vision change, eye pain, elevated intraocular pressure, visual field loss, and examination findings.",
        "Differential Diagnosis": "Acute iridocyclitis and acute conjunctivitis ruled out by lack of photophobia and discharge. Acute gastroenteritis and neurological diseases ruled out by ocular findings.",
        "Admission Records": {
            "Physician's Signature": "Dr. Smith"
        },
        "Post-Admission Course Records": {
            "First Course Record": "Admitted with acute angle-closure glaucoma, started on mannitol IV and acetazolamide to lower intraocular pressure. Scheduled for emergency laser peripheral iridotomy.",
            "Daily Course Records": "Day 1 post-surgery: no complications noted, intraocular pressure decreased to 18 mmHg. Pain and vision improving. Continue monitoring and medications.",
            "Senior Physician Rounds Records": "Reviewed patient on morning rounds, stable post-op, plan to continue current management and re-evaluate in 24 hours.",
            "Difficult Case Discussion Records": "N/A",
            "Handover Records": "Patient stable, no new issues overnight. Continue with postoperative care and monitoring.",
            "Transfer Records": "N/A",
            "Stage Summary": "At the end of week 1: Patient responding well to treatment, intraocular pressure stable. Discharge planned for tomorrow with follow-up in ophthalmology clinic.",
            "Emergency Records": "N/A",
            "Invasive Procedure Records": "N/A",
            "Consultation Records": "N/A",
            "Surgery Related": {
                "Preoperative Summary": "Confirmed diagnosis of acute angle-closure glaucoma, decided on laser peripheral iridotomy.",
                "Preoperative Discussion Records": "Discussed benefits and risks of surgery, potential for persistent high intraocular pressure or need for further surgery.",
                "Anesthesia Preoperative Visit Records": "Patient evaluated and cleared for local anesthesia with sedation.",
                "Anesthesia Records": "Local anesthesia with sedation administered, patient tolerated well.",
                "Surgery Records": "Laser peripheral iridotomy performed without complications, intraocular pressure reduced post-op.",
                "Surgery Safety Checklist": "Completed, all items verified and confirmed.",
                "Surgery Instrument Count Records": "All instruments accounted for post-surgery, no discrepancies.",
                "Postoperative First Course Record": "Patient stable, intraocular pressure decreased, pain controlled, no immediate complications.",
                "Anesthesia Postoperative Visit Records": "Patient recovering well from anesthesia, normal vital signs, no adverse effects noted."
            },
            "Discharge Records": "Patient discharged on 15th April with instructions for medications and follow-up in 1 week.",
            "Critically Ill Patient Care Records": "N/A"
        },
        "Medical Orders": {
            "Long-term Orders": "Acetazolamide 250 mg PO QID",
            "Temporary Orders": "Mannitol IV PRN for elevated intraocular pressure"
        },
        "Auxiliary Examination Reports": "Tonometry, Gonioscopy, Visual Field Test",
        "Temperature Chart": "T: 36.8°C, P: 78 bpm, R: 16 bpm, BP: 120/80 mmHg",
        "Blood Transfusion Consent": "N/A",
        "Special Examination Consent": "Consent obtained for diagnostic tonometry and gonioscopy",
        "Critical Condition Notice": "N/A"
    },
    "DiseaseType": {
        "Diseases of the Eye and Adnexa": {
            "Name": "Glaucoma",
            "Symptoms": "Blurred vision, headache, eye swelling, eye pain, nausea, vomiting, foggy vision, unequal pupil sizes, decreased vision",
            "Differential Diagnosis": "Acute angle-closure glaucoma acute attack, accompanied by severe headache, nausea, vomiting, etc., may be misdiagnosed as acute gastroenteritis and neurological diseases; acute iridocyclitis, acute conjunctivitis."
        }
    },
    "Generated Article": "Hospitalization Record:\n\nBasic Information:\n- Name: Q. Gomez\n- Gender: Female\n- Age: 28\n- Ethnicity: Latina\n- Marital Status: Single\n- Occupation: Graphic Designer\n- Address: 40, Wilton Street, Ashland\n- Admission Time: 9th April\n- Record Time: 9th April\n- Historian: Self\n- Hospital Name: Ashland City Hospital\n\nChief Complaint:\n- Blurred vision and severe headache for 3 days\n\nPresent Illness:\n- Onset: Three days ago at home, sudden onset with no prodromal symptoms. Possible trigger unknown.\n- Main Symptoms: Blurred vision in both eyes, severe headache rated 8/10, persistent for 3 days, worsened by dim light, not relieved by over-the-counter analgesics.\n- Accompanying Symptoms: Eye swelling, eye pain, nausea, vomiting, foggy vision, unequal pupil sizes, and decreased vision.\n- Diagnosis and Treatment History: Visited an urgent care center two days ago, prescribed eye drops and analgesics with no significant improvement.\n- General Condition Changes: Mental state anxious due to persistent symptoms; sleep normal but disturbed by pain, appetite decreased, normal urination and defecation, slight weight loss noted.\n\nPast History:\n- General Health Condition: Generally healthy\n- Disease History: No chronic illnesses\n- Infectious Disease History: None reported\n- Immunization History: Up-to-date\n- Surgery and Trauma History: Appendectomy at age 22\n- Blood Transfusion History: None\n- Allergy History: Allergic to penicillin\n\nPersonal History:\n- Birthplace: Ashland\n- Residence: Ashland\n- Living Habits: Non-smoker, occasional social alcohol use\n- Occupation and Working Conditions: Graphic designer, frequent screen use\n- Exposure History: No exposure to industrial toxins, dust, radioactive substances, etc.\n- Travel History: No recent travel\n\nMarital and Family History:\n- Marital History:\n    - Marital Status: Single\n    - Marriage Age: N/A\n    - Spouse's Health Condition: N/A\n    - Children's Condition: N/A\n- Menstrual History:\n    - Menarche Age: 12\n    - Menstruation Duration: 5 days\n    - Menstruation Interval: 28 days\n    - Last Menstruation: 5 days ago\n    - Menstrual Volume: Normal\n    - Dysmenorrhea: Mild\n- Family History: Parents healthy, no history of eye diseases in siblings\n\nPhysical Examination:\n- General Condition:\n    - Temperature: 36.8°C\n    - Pulse: 78 bpm\n    - Respiration: 16 breaths/min\n    - Blood Pressure: 120/80 mmHg\n- Systematic Examination:\n    - Skin: Normal, no abnormalities\n    - Mucous Membranes: Moist, no lesions\n    - Lymph Nodes: Not palpable\n    - Head and Organs: Normocephalic, PERRLA abnormal (unequal pupils)\n    - Neck: Supple, no masses\n    - Chest: Normal, lungs clear, heart sounds normal\n    - Abdomen: Soft, non-tender, liver and spleen not palpable\n    - Rectum and Anus: Normal\n    - External Genitalia: Normal\n    - Spine: Normal curvature\n    - Limbs: No edema, full range of motion\n    - Nervous System: Cranial nerves intact, no focal deficits\n\nSpecialist Examination:\n- Ophthalmology: Elevated intraocular pressure noted, cup-to-disc ratio increased, visual field test shows peripheral vision loss.\n\nAuxiliary Examination:\n- Tonometry showing elevated intraocular pressure at 28 mmHg.\n- Gonioscopy confirming closed angles.\n- Visual field test indicating peripheral vision loss.\n\nPreliminary Diagnosis:\n- Acute angle-closure glaucoma\n\nDiagnostic Basis:\n- Based on history of sudden vision change, eye pain, elevated intraocular pressure, visual field loss, and examination findings.\n\nDifferential Diagnosis:\n- Acute iridocyclitis and acute conjunctivitis ruled out by lack of photophobia and discharge.\n- Acute gastroenteritis and neurological diseases ruled out by ocular findings.\n\nAdmission Records:\n- Physician's Signature: Dr. Smith\n\nPost-Admission Course Records:\n- First Course Record: Admitted with acute angle-closure glaucoma, started on mannitol IV and acetazolamide to lower intraocular pressure. Scheduled for emergency laser peripheral iridotomy.\n- Daily Course Records: Day 1 post-surgery: no complications noted, intraocular pressure decreased to 18 mmHg. Pain and vision improving. Continue monitoring and medications.\n- Senior Physician Rounds Records: Reviewed patient on morning rounds, stable post-op, plan to continue current management and re-evaluate in 24 hours.\n- Difficult Case Discussion Records: N/A\n- Handover Records: Patient stable, no new issues overnight. Continue with postoperative care and monitoring.\n- Transfer Records: N/A\n- Stage Summary: At the end of week 1: Patient responding well to treatment, intraocular pressure stable. Discharge planned for tomorrow with follow-up in ophthalmology clinic.\n- Emergency Records: N/A\n- Invasive Procedure Records: N/A\n- Consultation Records: N/A\n\nSurgery Related:\n- Preoperative Summary: Confirmed diagnosis of acute angle-closure glaucoma, decided on laser peripheral iridotomy.\n- Preoperative Discussion Records: Discussed benefits and risks of surgery, potential for persistent high intraocular pressure or need for further surgery.\n- Anesthesia Preoperative Visit Records: Patient evaluated and cleared for local anesthesia with sedation.\n- Anesthesia Records: Local anesthesia with sedation administered, patient tolerated well.\n- Surgery Records: Laser peripheral iridotomy performed without complications, intraocular pressure reduced post-op.\n- Surgery Safety Checklist: Completed, all items verified and confirmed.\n- Surgery Instrument Count Records: All instruments accounted for post-surgery, no discrepancies.\n- Postoperative First Course Record: Patient stable, intraocular pressure decreased, pain controlled, no immediate complications.\n- Anesthesia Postoperative Visit Records: Patient recovering well from anesthesia, normal vital signs, no adverse effects noted.\n\nDischarge Records:\n- Patient discharged on 15th April with instructions for medications and follow-up in 1 week.\n\nCritically Ill Patient Care Records:\n- N/A\n\nMedical Orders:\n- Long-term Orders: Acetazolamide 250 mg PO QID\n- Temporary Orders: Mannitol IV PRN for elevated intraocular pressure\n\nAuxiliary Examination Reports:\n- Tonometry, Gonioscopy, Visual Field Test\n\nTemperature Chart:\n- T: 36.8°C, P: 78 bpm, R: 16 bpm, BP: 120/80 mmHg\n\nBlood Transfusion Consent:\n- N/A\n\nSpecial Examination Consent:\n- Consent obtained for diagnostic tonometry and gonioscopy\n\nCritical Condition Notice:\n- N/A",
    "qa_fact_based": [
        {
            "question type": "Factual Question",
            "question": "According to the hospitalization records of Ashland City Hospital, what is Q. Gomez's initial diagnosis?",
            "answer": "Acute angle-closure glaucoma.",
            "ref": [
                "Preliminary Diagnosis:",
                "- Acute angle-closure glaucoma"
            ]
        },
        {
            "question type": "Factual Question",
            "question": "According to the hospitalization records of Ashland City Hospital, what is Q. Gomez's chief complaint?",
            "answer": "Blurred vision and severe headache for 3 days.",
            "ref": [
                "Chief Complaint:",
                "- Blurred vision and severe headache for 3 days"
            ]
        },
        {
            "question type": "Factual Question",
            "question": "According to the hospitalization records of Ashland City Hospital, what is Q. Gomez's age?",
            "answer": "28.",
            "ref": [
                "- Age: 28"
            ]
        },
        {
            "question type": "Factual Question",
            "question": "According to the hospitalization records of Ashland City Hospital, what is Q. Gomez's occupation?",
            "answer": "Graphic designer.",
            "ref": [
                "- Occupation: Graphic Designer",
                "- Occupation and Working Conditions: Graphic designer, frequent screen use"
            ]
        }
    ],
    "qa_multi_hop": [
        {
            "question type": "Multi-hop Reasoning Question",
            "question": "According to the hospitalization records of Ashland City Hospital, how many auxiliary examinations did Q. Gomez undergo?",
            "answer": "According to the records, Q. Gomez underwent 3 auxiliary examinations, namely Tonometry, Gonioscopy, and Visual Field Test.",
            "ref": [
                "Auxiliary Examination:",
                "- Tonometry showing elevated intraocular pressure at 28 mmHg.",
                "- Gonioscopy confirming closed angles.",
                "- Visual field test indicating peripheral vision loss.",
                "- Tonometry, Gonioscopy, Visual Field Test"
            ]
        }
    ],
    "qa_summary": [
        {
            "question type": "Summarization Question",
            "question": "According to the hospitalization records of Ashland City Hospital, summarize the present illness of Q. Gomez.",
            "answer": "Three days ago, Q. Gomez experienced a sudden onset of blurred vision in both eyes and a severe headache rated 8/10, worsened by dim light and not relieved by over-the-counter analgesics. Accompanying symptoms included eye swelling, eye pain, nausea, vomiting, foggy vision, unequal pupil sizes, and decreased vision. She visited an urgent care center two days ago and was prescribed eye drops and analgesics with no significant improvement. Her mental state is anxious due to persistent symptoms, sleep is normal but disturbed by pain, appetite is decreased, urination and defecation are normal, and slight weight loss is noted.",
            "ref": [
                "- Onset: Three days ago at home, sudden onset with no prodromal symptoms.",
                "Possible trigger unknown.",
                "- Main Symptoms: Blurred vision in both eyes, severe headache rated 8/10, persistent for 3 days, worsened by dim light, not relieved by over-the-counter analgesics.",
                "- Accompanying Symptoms: Eye swelling, eye pain, nausea, vomiting, foggy vision, unequal pupil sizes, and decreased vision.",
                "- Diagnosis and Treatment History: Visited an urgent care center two days ago, prescribed eye drops and analgesics with no significant improvement.",
                "- General Condition Changes: Mental state anxious due to persistent symptoms; sleep normal but disturbed by pain, appetite decreased, normal urination and defecation, slight weight loss noted."
            ]
        },
        {
            "question type": "Summarization Question",
            "question": "According to the hospitalization records of Ashland City Hospital, summarize the past medical history of Q. Gomez.",
            "answer": "Q. Gomez is generally healthy with no chronic illnesses or infectious diseases reported. Her immunizations are up-to-date. She had an appendectomy at age 22 and has no history of blood transfusions. She is allergic to penicillin.",
            "ref": [
                "- General Health Condition: Generally healthy",
                "- Disease History: No chronic illnesses",
                "- Infectious Disease History: None reported",
                "- Immunization History: Up-to-date",
                "- Surgery and Trauma History: Appendectomy at age 22",
                "- Blood Transfusion History: None",
                "- Allergy History: Allergic to penicillin"
            ]
        },
        {
            "question type": "Summarization Question",
            "question": "According to the hospitalization records of Ashland City Hospital, summarize the physical examination findings of Q. Gomez.",
            "answer": "Q. Gomez's general condition includes a temperature of 36.8°C, pulse of 78 bpm, respiration of 16 breaths/min, and blood pressure of 120/80 mmHg. Systematic examination findings are normal except for unequal pupils (PERRLA abnormal). Her skin, mucous membranes, lymph nodes, head, neck, chest, abdomen, rectum, anus, external genitalia, spine, and limbs are all normal. Her nervous system examination shows intact cranial nerves with no focal deficits.",
            "ref": [
                "- General Condition:",
                "- Temperature: 36.8°C",
                "- Pulse: 78 bpm",
                "- Respiration: 16 breaths/min",
                "- Blood Pressure: 120/80 mmHg",
                "- Skin: Normal, no abnormalities",
                "- Mucous Membranes: Moist, no lesions",
                "- Lymph Nodes: Not palpable",
                "- Head and Organs: Normocephalic, PERRLA abnormal (unequal pupils)",
                "- Neck: Supple, no masses",
                "- Chest: Normal, lungs clear, heart sounds normal",
                "- Abdomen: Soft, non-tender, liver and spleen not palpable",
                "- Rectum and Anus: Normal",
                "- External Genitalia: Normal",
                "- Spine: Normal curvature",
                "- Limbs: No edema, full range of motion",
                "- Nervous System: Cranial nerves intact, no focal deficits"
            ]
        }
    ]
}