{
    "报告类型": "公司财务报告",
    "报告时间": "2018年度",
    "公司信息": {
        "名称": "创新科技有限公司",
        "成立日期": "2005年1月",
        "主营业务": "研发高科技产品和解决方案",
        "注册地": "深圳市",
        "上市情况": "未上市",
        "行业": "研发"
    },
    "报告内容": [
        {
            "类型": "财务信息",
            "重要事件": [
                {
                    "事件": "债务重组",
                    "时间": "2018年3月",
                    "描述": "为优化资本结构，公司进行了债务重组，减少了2亿元负债。",
                    "影响": "改善了公司的财务状况，降低了财务成本。"
                },
                {
                    "事件": "分发股利",
                    "时间": "2018年4月",
                    "描述": "公司决定向股东分发1亿元股利。",
                    "影响": "回报给股东们的投资，提升了股东的收益。"
                },
                {
                    "事件": "重大股权收购",
                    "时间": "2018年5月",
                    "描述": "公司完成了对创新互联网科技有限公司的股权收购，获得了70%的股权。",
                    "影响": "进一步扩大了公司的市场份额，提升了公司的控制力。"
                },
                {
                    "事件": "重大资产收购",
                    "时间": "2018年6月",
                    "描述": "公司完成了对云计算技术有限公司的资产收购，总价值1.5亿元。",
                    "影响": "扩大公司业务范围，增强市场竞争力。"
                },
                {
                    "事件": "资产重组",
                    "时间": "2018年7月",
                    "描述": "公司进行了一次资产重组，优化了公司的业务结构。",
                    "影响": "提高了公司的运营效率，增加了公司的价值。"
                },
                {
                    "事件": "大规模融资",
                    "时间": "2018年8月",
                    "描述": "公司进行了一次大规模的融资活动，募集了3亿元资金。",
                    "影响": "加强了公司的资金实力，支持了公司的扩张和发展。"
                },
                {
                    "事件": "重大投资",
                    "时间": "2018年12月",
                    "描述": "公司投资了智能城市项目，投资金额为2亿元。",
                    "影响": "进一步拓宽了公司的业务领域，提升了公司的盈利能力。"
                }
            ],
            "涉及的指标": [
                {
                    "指标": "营业收入",
                    "描述": "公司在一定会计期间内的主营业务收入和其他业务收入总额。",
                    "影响因素": [
                        "市场需求",
                        "产品价格变化"
                    ],
                    "值": "8亿元"
                },
                {
                    "指标": "净利润",
                    "描述": "公司在一定会计期间的净收入，即总收入减去总成本和所得税费用后的金额。",
                    "影响因素": [
                        "营业收入",
                        "成本控制",
                        "非经常性损益"
                    ],
                    "值": "2.5亿元"
                },
                {
                    "指标": "总资产",
                    "描述": "会计期末，公司所拥有的资产总额。",
                    "影响因素": [
                        "资产收购",
                        "资产处置",
                        "资产重估"
                    ],
                    "值": "10亿元"
                },
                {
                    "指标": "总负债",
                    "描述": "会计期末，公司所承担并需要偿还的债务总额。",
                    "影响因素": [
                        "新债发行",
                        "债务偿还",
                        "债务重组"
                    ],
                    "值": "5亿元"
                },
                {
                    "指标": "股东权益",
                    "描述": "会计期末，归属于股东的权益总额。",
                    "影响因素": [
                        "净利润",
                        "股利发放",
                        "资本公积"
                    ],
                    "值": "5亿元"
                },
                {
                    "指标": "现金流量",
                    "描述": "公司在一定会计期间内的现金流入和流出总和。",
                    "影响因素": [
                        "经营活动",
                        "投资活动",
                        "筹资活动"
                    ],
                    "值": "3亿元"
                },
                {
                    "指标": "负债比率",
                    "描述": "公司总负债与总资产的比率，反映公司的债务水平。",
                    "影响因素": [
                        "总负债的变化",
                        "总资产的变化"
                    ],
                    "值": "50%"
                },
                {
                    "指标": "资产负债率",
                    "描述": "公司总负债占总资产的百分比，衡量公司财务杠杆的一个指标。",
                    "影响因素": [
                        "资产和负债的增减变化"
                    ],
                    "值": "50%"
                },
                {
                    "指标": "净资产收益率",
                    "描述": "反映公司股东权益的经营效益，即净利润与平均股东权益的比率。",
                    "影响因素": [
                        "净利润的变化",
                        "股东权益的变化"
                    ],
                    "值": "10%"
                }
            ]
        }
    ],
    "额外信息": [
        {
            "名称": "未来展望",
            "内容": [
                {
                    "名称": "财务策略",
                    "描述": "公司未来计划实施的财务策略，包括成本控制、资本运营等。"
                },
                {
                    "名称": "投资计划",
                    "描述": "公司面向未来的投资计划，如新项目投资、研发投入等。"
                },
                {
                    "名称": "风险管理",
                    "描述": "公司识别的主要财务风险以及应对这些风险的策略。"
                }
            ]
        }
    ],
    "生成大纲": "公司财务报告大纲\n\n报告时间：2018年度\n\nI. 财务信息\n重要事件：\n1. [债务重组](2018年3月)\n   描述：为优化资本结构，公司进行了债务重组，减少了2亿元负债。\n   影响：改善了公司的财务状况，降低了财务成本。\n\n2. [分发股利](2018年4月)\n   描述：公司决定向股东分发1亿元股利。\n   影响：回报给股东们的投资，提升了股东的收益。\n\n3. [重大股权收购](2018年5月)\n   描述：公司完成了对创新互联网科技有限公司的股权收购，获得了70%的股权。\n   影响：进一步扩大了公司的市场份额，提升了公司的控制力。\n\n4. [重大资产收购](2018年6月)\n   描述：公司完成了对云计算技术有限公司的资产收购，总价值1.5亿元。\n   影响：扩大公司业务范围，增强市场竞争力。\n\n5. [资产重组](2018年7月)\n   描述：公司进行了一次资产重组，优化了公司的业务结构。\n   影响：提高了公司的运营效率，增加了公司的价值。\n\n6. [大规模融资](2018年8月)\n   描述：公司进行了一次大规模的融资活动，募集了3亿元资金。\n   影响：加强了公司的资金实力，支持了公司的扩张和发展。\n\n7. [重大投资](2018年12月)\n   描述：公司投资了智能城市项目，投资金额为2亿元。\n   影响：进一步拓宽了公司的业务领域，提升了公司的盈利能力。\n\n涉及指标：\n1. 营业收入：8亿元\n   描述：公司在一定会计期间内的主营业务收入和其他业务收入总额。\n   影响因素：市场需求、产品价格变化\n\n2. 净利润：2.5亿元\n   描述：公司在一定会计期间的净收入，即总收入减去总成本和所得税费用后的金额。\n   影响因素：营业收入、成本控制、非经常性损益\n\n3. 总资产：10亿元\n   描述：会计期末，公司所拥有的资产总额。\n   影响因素：资产收购、资产处置、资产重估\n\n4. 总负债：5亿元\n   描述：会计期末，公司所承担并需要偿还的债务总额。\n   影响因素：新债发行、债务偿还、债务重组\n\n5. 股东权益：5亿元\n   描述：会计期末，归属于股东的权益总额。\n   影响因素：净利润、股利发放、资本公积\n\n6. 现金流量：3亿元\n   描述：公司在一定会计期间内的现金流入和流出总和。\n   影响因素：经营活动、投资活动、筹资活动\n\n7. 负债比率：50%\n   描述：公司总负债与总资产的比率，反映公司的债务水平。\n   影响因素：总负债的变化、总资产的变化\n\n8. 资产负债率：50%\n   描述：公司总负债占总资产的百分比，衡量公司财务杠杆的一个指标。\n   影响因素：资产和负债的增减变化\n\n9. 净资产收益率：10%\n   描述：反映公司股东权益的经营效益，即净利润与平均股东权益的比率。\n   影响因素：净利润的变化、股东权益的变化\n\nII. 额外信息\n1. 未来展望\n   a. 财务策略：公司未来计划实施的财务策略，包括成本控制、资本运营等。\n   b. 投资计划：公司面向未来的投资计划，如新项目投资、研发投入等。\n   c. 风险管理：公司识别的主要财务风险以及应对这些风险的策略。",
    "生成总结": "创新科技有限公司是一家成立于2005年1月的位于深圳市的研发公司，主营业务是研发高科技产品和解决方案。",
    "生成文章": "在2018年度，创新科技有限公司取得了显著的财务成果和重要的业务进展。首先，在2018年3月，公司进行了债务重组，成功减少了2亿元的负债。这一举措优化了公司的资本结构，降低了财务成本，进一步改善了公司的财务状况。\n\n接着，在2018年4月，公司决定向股东分发1亿元的股利。这一举措不仅回报了股东们的投资，提升了股东的收益，还展示了公司的稳健财务状况和良好的盈利能力。\n\n在2018年5月，创新科技有限公司完成了对创新互联网科技有限公司的股权收购，获得了70%的股权。这一重大股权收购进一步扩大了公司的市场份额，提升了公司的控制力，为公司未来的发展奠定了坚实的基础。\n\n在2018年6月，公司完成了对云计算技术有限公司的资产收购，总价值1.5亿元。这一重大资产收购不仅扩大了公司的业务范围，增强了公司的市场竞争力，还为公司带来了更多的商机和利润增长空间。\n\n随后，在2018年7月，创新科技有限公司进行了一次资产重组，优化了公司的业务结构。这一举措提高了公司的运营效率，增加了公司的价值，进一步巩固了公司在行业中的领先地位。\n\n在2018年8月，公司进行了一次大规模的融资活动，募集了3亿元资金。这一举措加强了公司的资金实力，为公司的扩张和发展提供了有力的支持。\n\n最后，在2018年12月，创新科技有限公司投资了智能城市项目，投资金额为2亿元。这一重大投资进一步拓宽了公司的业务领域，提升了公司的盈利能力，为公司未来的发展带来了更多的机遇。\n\n在财务指标方面，创新科技有限公司在2018年度取得了令人瞩目的成绩。营业收入达到了8亿元，这主要归因于市场需求的增加和产品价格的稳定。净利润达到了2.5亿元，这得益于公司有效的成本控制和非经常性损益的减少。总资产达到了10亿元，这主要是由于资产收购和资产重估的影响。总负债为5亿元，股东权益为5亿元，资产负债率和负债比率均为50%。这表明公司的财务状况稳健，资产和负债的平衡性良好。现金流量达到了3亿元，这主要归因于公司良好的经营活动和筹资活动。净资产收益率为10%，这反映了公司股东权益的经营效益。\n\n综上所述，创新科技有限公司在2018年度取得了显著的财务成果和重要的业务进展。公司通过债务重组、股利分发、股权收购、资产收购、资产重组、融资活动和重大投资等一系列举措，不断优化了公司的财务状况，扩大了市场份额，增强了市场竞争力。公司的财务指标表明了公司的稳健财务状况和良好的盈利能力。展望未来，创新科技有限公司将继续实施有效的财务策略，加大投资力度，同时积极应对财务风险，为公司的可持续发展打下坚实基础。"
}