{
    "Report Type": "Corporate Governance Report",
    "Report Time": "2021",
    "Company Information": {
        "Name": "HealthPro Innovations",
        "Establishment Date": "September 15, 2009",
        "Main Business": "Development and sale of innovative healthcare solutions",
        "Registration Location": "New York, United States",
        "Listing Status": "Publicly traded on the New York Stock Exchange",
        "Industry": "Healthcare"
    },
    "Report Content": [
        {
            "Type": "Governance Structure",
            "Significant Events": [
                {
                    "Event": "Compliance and Regulatory Updates",
                    "Time": "January, 2021",
                    "Description": "HealthPro Innovations takes proactive steps to comply with new regulations, including the implementation of enhanced data protection measures in accordance with the updated healthcare data privacy laws.",
                    "Impact": "Ensures compliance with evolving laws, safeguarding sensitive data, and protecting the interests of the company and its shareholders.",
                    "Sub Events": [
                        {
                            "Event": "Compliance and Regulatory Updates",
                            "Time": "January, 2021",
                            "Description": "HealthPro Innovations takes proactive steps to comply with new regulations, including the implementation of enhanced data protection measures in accordance with the updated healthcare data privacy laws.",
                            "Impact": "Ensures compliance with evolving laws, safeguarding sensitive data, and protecting the interests of the company and its shareholders."
                        },
                        {
                            "Event": "Acquisition of MedTech Solutions",
                            "Time": "March, 2021",
                            "Description": "HealthPro Innovations acquires MedTech Solutions, a leading provider of medical technology software solutions, to expand its portfolio of healthcare solutions and enhance its market position.",
                            "Impact": "Increases HealthPro Innovations' market share and product offerings, leading to potential revenue growth and improved competitiveness in the healthcare industry."
                        },
                        {
                            "Event": "Launch of AI-powered Diagnostic Device",
                            "Time": "July, 2021",
                            "Description": "HealthPro Innovations launches a state-of-the-art AI-powered diagnostic device that revolutionizes the accuracy and efficiency of medical diagnoses, attracting significant attention from healthcare providers and professionals.",
                            "Impact": "Positions HealthPro Innovations as an industry leader in diagnostic technology, potentially increasing sales and market recognition."
                        },
                        {
                            "Event": "Strategic Partnership with Global Healthcare Provider",
                            "Time": "November, 2021",
                            "Description": "HealthPro Innovations forms a strategic partnership with a renowned global healthcare provider to jointly develop and distribute innovative healthcare solutions, leveraging each other's expertise and resources.",
                            "Impact": "Broadens HealthPro Innovations' reach and distribution network, opening new market opportunities and enhancing its brand reputation."
                        }
                    ]
                },
                {
                    "Event": "Shareholders' Meeting Resolution",
                    "Time": "February, 2021",
                    "Description": "At the annual shareholders' meeting, the board proposed and obtained approval for a three-year strategic plan focusing on expanding product offerings, entering new markets, and acquiring complementary businesses. All resolutions were successfully passed.",
                    "Impact": "Shapes the company's governance structure, providing a clear direction and driving future growth opportunities."
                },
                {
                    "Event": "Corporate Governance Policy Revision",
                    "Time": "March, 2021",
                    "Description": "HealthPro Innovations revises its corporate governance policy to increase transparency, accountability, and stakeholder engagement. The policy now includes provisions for regular communication with shareholders and the formation of an independent governance committee.",
                    "Impact": "Positively influences corporate governance practices, fostering trust among stakeholders and promoting long-term sustainability."
                },
                {
                    "Event": "Board of Directors Change",
                    "Time": "April, 2021",
                    "Description": "The appointment of a new Chairman of the Board, Mr. Alex Johnson, renowned healthcare industry veteran, brings extensive experience and strategic vision to guide the company's growth.",
                    "Impact": "Elevates the company's strategic direction, leveraging Mr. Johnson's expertise to further enhance shareholder value."
                },
                {
                    "Event": "Ethics and Integrity Incidents",
                    "Time": "May, 2021",
                    "Description": "HealthPro Innovations swiftly responded to a minor ethics violation by conducting an internal investigation, terminating the employee involved, and reinforcing its robust code of ethics. The incident had no significant financial impact on the company.",
                    "Impact": "Demonstrates the companyâ€™s commitment to ethical practices, preserving its reputation and strengthening stakeholder trust."
                },
                {
                    "Event": "Risk Management Measures",
                    "Time": "June, 2021",
                    "Description": "HealthPro Innovations enhances its risk management framework by implementing updated procedures to identify emerging risks, conducting regular risk assessments, and establishing an enterprise risk management committee.",
                    "Impact": "Enhances the company's ability to navigate risks effectively, ensuring sustained operational stability and growth."
                },
                {
                    "Event": "Senior Management Changes",
                    "Time": "August, 2021",
                    "Description": "HealthPro Innovations appoints Ms. Sarah Thompson as the new Chief Financial Officer, leveraging her extensive financial management experience to drive efficient allocation of resources and optimize financial performance.",
                    "Impact": "Enhances the company's financial operations, ensuring sound financial decision-making and maximizing shareholder value."
                },
                {
                    "Event": "Sustainability and Social Responsibility Initiatives",
                    "Time": "November, 2021",
                    "Description": "HealthPro Innovations launches a comprehensive sustainability program, reducing its carbon footprint by 20% through energy-efficient manufacturing processes and optimized supply chain logistics. Additionally, the company supports local healthcare charities, providing free medical services to underserved communities.",
                    "Impact": "Positively influences the company's public image, promoting brand loyalty and attracting socially conscious investors and partners."
                }
            ],
            "Involved Indicators": [
                {
                    "Indicator": "Information Disclosure",
                    "Description": "HealthPro Innovations maintains a robust information disclosure system, ensuring timely and comprehensive reporting to shareholders and stakeholders.",
                    "Value": "Quarterly financial reports, annual reports, and quarterly conference calls provide transparent and accurate information to investors and analysts."
                },
                {
                    "Indicator": "Related Transactions",
                    "Description": "HealthPro Innovations has implemented strict policies and measures to ensure fairness and compliance in all related transactions.",
                    "Value": "An independent committee reviews and approves all related party transactions, ensuring transparency and fairness in dealings with related entities."
                },
                {
                    "Indicator": "Internal Control",
                    "Description": "HealthPro Innovations has developed a comprehensive internal control system to mitigate risks and ensure effective governance.",
                    "Value": "Regular internal audits, segregation of duties, and a robust system of checks and balances provide a strong control environment."
                }
            ]
        }
    ],
    "Additional Information": [
        {
            "Name": "Governance Improvement Plans",
            "Content": [
                {
                    "Name": "Strengthening the Function of the Board of Directors and Supervisory Board",
                    "Description": "HealthPro Innovations aims to enhance the efficiency and effectiveness of the board of directors and supervisory board through regular training programs, increased diversity, and an improved decision-making process."
                },
                {
                    "Name": "Enhancing Transparency and Quality of Information Disclosure",
                    "Description": "HealthPro Innovations is committed to improving its information disclosure process and standards by adopting best practices, ensuring timely, accurate, and comprehensive reporting to all stakeholders."
                }
            ]
        },
        {
            "Name": "Risk Management Strategy",
            "Content": [
                {
                    "Name": "Strengthening the Internal Control System",
                    "Description": "HealthPro Innovations will continue to establish and enhance its internal control system, ensuring the identification, assessment, monitoring, and reporting of financial and operational risks to minimize potential threats to the organization."
                },
                {
                    "Name": "Integrating Sustainable Development and Social Responsibility",
                    "Description": "HealthPro Innovations plans to further integrate sustainable development and social responsibility into its strategy, identifying related risks and opportunities, and incorporating them into the company's risk management framework."
                }
            ]
        }
    ],
    "Generated Outline": "I. Introduction\n   A. Background information about HealthPro Innovations\n      1. Name: HealthPro Innovations\n      2. Establishment Date: September 15, 2009\n      3. Main Business: Development and sale of innovative healthcare solutions\n      4. Registration Location: New York, United States\n      5. Listing Status: Publicly traded on the New York Stock Exchange\n      6. Industry: Healthcare\n   B. Purpose of the Corporate Governance Report\n\nII. Governance Structure\n   A. Compliance and Regulatory Updates\n      1. January, 2021\n         a. Event: HealthPro Innovations takes proactive steps to comply with new regulations, including the implementation of enhanced data protection measures in accordance with updated healthcare data privacy laws.\n         b. Impact: Ensures compliance with evolving laws, safeguarding sensitive data, and protecting the interests of the company and its shareholders.\n      2. March, 2021\n         a. Event: HealthPro Innovations acquires MedTech Solutions, a leading provider of medical technology software solutions, to expand its portfolio of healthcare solutions and enhance its market position.\n         b. Impact: Increases HealthPro Innovations' market share and product offerings, leading to potential revenue growth and improved competitiveness in the healthcare industry.\n      3. July, 2021\n         a. Event: HealthPro Innovations launches a state-of-the-art AI-powered diagnostic device that revolutionizes the accuracy and efficiency of medical diagnoses, attracting significant attention from healthcare providers and professionals.\n         b. Impact: Positions HealthPro Innovations as an industry leader in diagnostic technology, potentially increasing sales and market recognition.\n      4. November, 2021\n         a. Event: HealthPro Innovations forms a strategic partnership with a renowned global healthcare provider to jointly develop and distribute innovative healthcare solutions, leveraging each other's expertise and resources.\n         b. Impact: Broadens HealthPro Innovations' reach and distribution network, opening new market opportunities and enhancing its brand reputation.\n   B. Shareholders' Meeting Resolution\n      1. February, 2021\n         a. Event: At the annual shareholders' meeting, the board proposed and obtained approval for a three-year strategic plan focusing on expanding product offerings, entering new markets, and acquiring complementary businesses. All resolutions were successfully passed.\n         b. Impact: Shapes the company's governance structure, providing a clear direction and driving future growth opportunities.\n   C. Corporate Governance Policy Revision\n      1. March, 2021\n         a. Event: HealthPro Innovations revises its corporate governance policy to increase transparency, accountability, and stakeholder engagement. The policy now includes provisions for regular communication with shareholders and the formation of an independent governance committee.\n         b. Impact: Positively influences corporate governance practices, fostering trust among stakeholders and promoting long-term sustainability.\n   D. Board of Directors Change\n      1. April, 2021\n         a. Event: The appointment of a new Chairman of the Board, Mr. Alex Johnson, renowned healthcare industry veteran, brings extensive experience and strategic vision to guide the company's growth.\n         b. Impact: Elevates the company's strategic direction, leveraging Mr. Johnson's expertise to further enhance shareholder value.\n   E. Ethics and Integrity Incidents\n      1. May, 2021\n         a. Event: HealthPro Innovations swiftly responds to a minor ethics violation by conducting an internal investigation, terminating the employee involved, and reinforcing its robust code of ethics. The incident had no significant financial impact on the company.\n         b. Impact: Demonstrates the company's commitment to ethical practices, preserving its reputation and strengthening stakeholder trust.\n   F. Risk Management Measures\n      1. June, 2021\n         a. Event: HealthPro Innovations enhances its risk management framework by implementing updated procedures to identify emerging risks, conducting regular risk assessments, and establishing an enterprise risk management committee.\n         b. Impact: Enhances the company's ability to navigate risks effectively, ensuring sustained operational stability and growth.\n   G. Senior Management Changes\n      1. August, 2021\n         a. Event: HealthPro Innovations appoints Ms. Sarah Thompson as the new Chief Financial Officer, leveraging her extensive financial management experience to drive efficient allocation of resources and optimize financial performance.\n         b. Impact: Enhances the company's financial operations, ensuring sound financial decision-making and maximizing shareholder value.\n   H. Sustainability and Social Responsibility Initiatives\n      1. November, 2021\n         a. Event: HealthPro Innovations launches a comprehensive sustainability program, reducing its carbon footprint by 20% through energy-efficient manufacturing processes and optimized supply chain logistics. Additionally, the company supports local healthcare charities, providing free medical services to underserved communities.\n         b. Impact: Positively influences the company's public image, promoting brand loyalty and attracting socially conscious investors and partners.\n\nIII. Involved Indicators\n   A. Information Disclosure\n      1. Description: HealthPro Innovations maintains a robust information disclosure system, ensuring timely and comprehensive reporting to shareholders and stakeholders.\n      2. Value: Quarterly financial reports, annual reports, and quarterly conference calls provide transparent and accurate information to investors and analysts.\n   B. Related Transactions\n      1. Description: HealthPro Innovations has implemented strict policies and measures to ensure fairness and compliance in all related transactions.\n      2. Value: An independent committee reviews and approves all related party transactions, ensuring transparency and fairness in dealings with related entities.\n   C. Internal Control\n      1. Description: HealthPro Innovations has developed a comprehensive internal control system to mitigate risks and ensure effective governance.\n      2. Value: Regular internal audits, segregation of duties, and a robust system of checks and balances provide a strong control environment.\n\nIV. Additional Information\n   A. Governance Improvement Plans\n      1. Strengthening the Function of the Board of Directors and Supervisory Board\n         a. Description: HealthPro Innovations aims to enhance the efficiency and effectiveness of the board of directors and supervisory board through regular training programs, increased diversity, and an improved decision-making process.\n      2. Enhancing Transparency and Quality of Information Disclosure\n         a. Description: HealthPro Innovations is committed to improving its information disclosure process and standards by adopting best practices, ensuring timely, accurate, and comprehensive reporting to all stakeholders.\n   B. Risk Management Strategy\n      1. Strengthening the Internal Control System\n         a. Description: HealthPro Innovations will continue to establish and enhance its internal control system, ensuring the identification, assessment, monitoring, and reporting of financial and operational risks to minimize potential threats to the organization.\n      2. Integrating Sustainable Development and Social Responsibility\n         a. Description: HealthPro Innovations plans to further integrate sustainable development and social responsibility into its strategy, identifying related risks and opportunities, and incorporating them into the company's risk management framework.",
    "Generated Summary": "HealthPro Innovations is a publicly traded healthcare company that was established on September 15, 2009, based in New York, United States, specializing in the development and sale of innovative healthcare solutions.",
    "Generated Article": "The company has been listed on the New York Stock Exchange since its establishment, positioning itself as a key player in the healthcare industry. HealthPro Innovations operates in an industry that is constantly evolving, and as such, it has demonstrated its commitment to compliance and regulatory updates.\n\nIn January 2021, HealthPro Innovations took proactive steps to comply with new regulations, particularly in the area of data protection. The company implemented enhanced data protection measures in accordance with updated healthcare data privacy laws. This event ensures that HealthPro Innovations remains compliant with evolving laws, safeguarding sensitive data and protecting the interests of the company and its shareholders.\n\nIn March 2021, HealthPro Innovations made a strategic move to acquire MedTech Solutions, a leading provider of medical technology software solutions. This acquisition aimed to expand the company's portfolio of healthcare solutions and enhance its market position. The acquisition of MedTech Solutions not only increases HealthPro Innovations' market share but also broadens its product offerings, leading to potential revenue growth and improved competitiveness in the healthcare industry.\n\nIn July 2021, HealthPro Innovations made a significant breakthrough in the field of diagnostic technology. The company launched a state-of-the-art AI-powered diagnostic device that revolutionizes the accuracy and efficiency of medical diagnoses. This innovative product attracted significant attention from healthcare providers and professionals, positioning HealthPro Innovations as an industry leader in diagnostic technology. This event has the potential to increase sales and market recognition for the company.\n\nIn November 2021, HealthPro Innovations formed a strategic partnership with a renowned global healthcare provider. This partnership aimed to jointly develop and distribute innovative healthcare solutions, leveraging each other's expertise and resources. This collaboration not only broadens HealthPro Innovations' reach and distribution network but also opens new market opportunities and enhances its brand reputation.\n\nIn terms of corporate governance, HealthPro Innovations has demonstrated its commitment to transparency, accountability, and stakeholder engagement. In February 2021, the company proposed and obtained approval for a three-year strategic plan at the annual shareholders' meeting. This plan focuses on expanding product offerings, entering new markets, and acquiring complementary businesses. The successful passing of these resolutions shapes the company's governance structure, providing a clear direction and driving future growth opportunities.\n\nIn March 2021, HealthPro Innovations revised its corporate governance policy to increase transparency, accountability, and stakeholder engagement. The revised policy includes provisions for regular communication with shareholders and the formation of an independent governance committee. This event positively influences corporate governance practices, fostering trust among stakeholders and promoting long-term sustainability.\n\nThe appointment of Mr. Alex Johnson as the new Chairman of the Board in April 2021 brought extensive experience and strategic vision to guide the company's growth. This appointment elevates the company's strategic direction, leveraging Mr. Johnson's expertise to further enhance shareholder value.\n\nHealthPro Innovations has also demonstrated its commitment to ethics and integrity. In May 2021, the company swiftly responded to a minor ethics violation by conducting an internal investigation, terminating the employee involved, and reinforcing its robust code of ethics. This incident had no significant financial impact on the company and showcased its commitment to ethical practices, preserving its reputation and strengthening stakeholder trust.\n\nTo ensure sustained operational stability and growth, HealthPro Innovations enhanced its risk management framework in June 2021. The company implemented updated procedures to identify emerging risks, conducted regular risk assessments, and established an enterprise risk management committee. This event enhances the company's ability to navigate risks effectively, ensuring sustained operational stability and growth.\n\nIn August 2021, HealthPro Innovations appointed Ms. Sarah Thompson as the new Chief Financial Officer. Leveraging her extensive financial management experience, Ms. Thompson's appointment enhances the company's financial operations. This ensures sound financial decision-making and maximizes shareholder value.\n\nHealthPro Innovations has also embraced sustainability and social responsibility initiatives. In November 2021, the company launched a comprehensive sustainability program, reducing its carbon footprint by 20% through energy-efficient manufacturing processes and optimized supply chain logistics. Additionally, HealthPro Innovations supports local healthcare charities, providing free medical services to underserved communities. These initiatives positively influence the company's public image, promoting brand loyalty and attracting socially conscious investors and partners.\n\nHealthPro Innovations maintains a robust information disclosure system, ensuring timely and comprehensive reporting to shareholders and stakeholders. Quarterly financial reports, annual reports, and quarterly conference calls provide transparent and accurate information to investors and analysts. The company has also implemented strict policies and measures to ensure fairness and compliance in all related transactions. An independent committee reviews and approves all related party transactions, ensuring transparency and fairness in dealings with related entities. Furthermore, HealthPro Innovations has developed a comprehensive internal control system to mitigate risks and ensure effective governance. Regular internal audits, segregation of duties, and a robust system of checks and balances provide a strong control environment.\n\nLooking ahead, HealthPro Innovations has outlined several governance improvement plans. The company aims to strengthen the function of the board of directors and supervisory board through regular training programs, increased diversity, and an improved decision-making process. Additionally, HealthPro Innovations is committed to enhancing transparency and the quality of information disclosure by adopting best practices and ensuring timely, accurate, and comprehensive reporting to all stakeholders. The company also plans to strengthen its internal control system to identify, assess, monitor, and report financial and operational risks. Furthermore, HealthPro Innovations aims to integrate sustainable development and social responsibility into its strategy, identifying related risks and opportunities and incorporating them into the company's risk management framework.\n\nOverall, HealthPro Innovations has demonstrated its commitment to corporate governance, compliance, and ethical practices. The company's strategic partnerships, acquisitions, and innovative product launches have positioned it as a leader in the healthcare industry. With a strong focus on sustainability and social responsibility, HealthPro Innovations is well-positioned for future growth and success."
}