{
    "Report Type": "Corporate Financial Report",
    "Report Time": "2021",
    "Company Information": {
        "Name": "GreenTech Solutions Inc.",
        "Establishment Date": "January 1, 2008",
        "Main Business": "Design, development, and implementation of environmentally friendly technologies for waste management and pollution control.",
        "Registration Location": "San Francisco, California",
        "Listing Status": "Publicly traded on NASDAQ",
        "Industry": "Environmental Protection"
    },
    "Report Content": [
        {
            "Type": "Financial Information",
            "Significant Events": [
                {
                    "Event": "Asset Restructuring",
                    "Time": "April, 2021",
                    "Description": "The company underwent a comprehensive asset restructuring, optimizing its business structure to focus on high-growth sectors within the environmental protection industry.",
                    "Impact": "This initiative has greatly improved operational efficiency, strengthened research and development capabilities, and increased the overall value of the company.",
                    "Sub Events": [
                        {
                            "Event": "Strategic Partnerships",
                            "Time": "2021",
                            "Description": "GreenTech Solutions Inc. formed strategic partnerships with leading technology companies in the environmental protection industry. These partnerships enabled the company to access advanced technologies, expand its product offerings, and gain a competitive edge.",
                            "Impact": "The strategic partnerships provided new revenue streams, enhanced the company's market position, and facilitated the asset restructuring process."
                        },
                        {
                            "Event": "Research and Development Investment",
                            "Time": "2021",
                            "Description": "GreenTech Solutions Inc. significantly increased its investment in research and development activities. This focus on R&D allowed the company to develop cutting-edge technologies and innovative solutions for waste management and pollution control.",
                            "Impact": "The increased investment in R&D enhanced the company's product portfolio and enabled it to offer more advanced and efficient solutions, contributing to the asset restructuring success."
                        },
                        {
                            "Event": "Market Expansion",
                            "Time": "2021",
                            "Description": "GreenTech Solutions Inc. expanded its market presence beyond its current geographical areas to target emerging markets with high environmental protection demand. This expansion strategy aimed to capture untapped market opportunities and drive revenue growth.",
                            "Impact": "The market expansion efforts increased the company's customer base, revenue potential, and contributed to the decision to focus on high-growth sectors during the asset restructuring process."
                        }
                    ]
                },
                {
                    "Event": "Dividend Distribution",
                    "Time": "May, 2021",
                    "Description": "The company has decided to distribute $10 million of dividends to its shareholders, demonstrating its commitment to enhancing shareholder returns.",
                    "Impact": "This distribution provides a significant return to investors and highlights the company's strong financial performance."
                },
                {
                    "Event": "Significant Equity Acquisition",
                    "Time": "July, 2021",
                    "Description": "The company successfully completed the acquisition of 30% equity stake in BlueOcean Solutions Inc., a leading provider of ocean conservation technologies.",
                    "Impact": "This strategic acquisition has further expanded GreenTech Solutions' market share and enhanced its control over the ocean conservation sector, positioning the company as an industry leader."
                },
                {
                    "Event": "Debt Restructuring",
                    "Time": "August, 2021",
                    "Description": "In an effort to optimize its capital structure, the company underwent a debt restructuring process, successfully reducing its liabilities by $20 million.",
                    "Impact": "This debt restructuring has not only improved the company's financial condition but has also resulted in reduced financial costs, providing a more sustainable foundation for future growth."
                },
                {
                    "Event": "Major Investment",
                    "Time": "September, 2021",
                    "Description": "The company made a major investment of $50 million in Project CleanAir, a revolutionary air purification technology that has the potential to significantly reduce air pollution levels.",
                    "Impact": "By investing in Project CleanAir, GreenTech Solutions has expanded its business areas, tapping into the highly-profitable air pollution control market and bolstering its overall profitability."
                },
                {
                    "Event": "Major Asset Acquisition",
                    "Time": "November, 2021",
                    "Description": "GreenTech Solutions completed the acquisition of Liberty Energy Solutions, a prominent renewable energy company, with a total asset value of $100 million.",
                    "Impact": "This asset acquisition has significantly expanded the company's business scope, enabling GreenTech Solutions to offer comprehensive solutions for both waste management and renewable energy, further enhancing its market competitiveness."
                },
                {
                    "Event": "Large-scale Financing",
                    "Time": "December, 2021",
                    "Description": "To support its ambitious expansion plans, the company successfully conducted a large-scale financing round, raising $200 million in funds from leading institutional investors.",
                    "Impact": "This substantial financing activity has strengthened GreenTech Solutions' financial position, providing the necessary capital to fuel its continued expansion and development in the environmental protection sector."
                }
            ],
            "Involved Indicators": [
                {
                    "Indicator": "Operating Income",
                    "Description": "The total amount of main business income and other business income within a certain accounting period.",
                    "Influencing Factors": [
                        "Increasing market demand for environmental protection technologies",
                        "Positive changes in global regulations favoring environmentally friendly solutions",
                        "R&D breakthroughs leading to innovative product offerings"
                    ],
                    "Value": "$150 million"
                },
                {
                    "Indicator": "Net Profit",
                    "Description": "The net income of the company within a certain accounting period, i.e., total income minus total costs and taxes.",
                    "Influencing Factors": [
                        "Strong operating income",
                        "Effective cost control measures",
                        "Absence of major non-recurring gains and losses"
                    ],
                    "Value": "$30 million"
                },
                {
                    "Indicator": "Total Assets",
                    "Description": "The total amount of assets owned by the company at the end of the accounting period.",
                    "Influencing Factors": [
                        "Acquisition of Liberty Energy Solutions",
                        "Capital expenditures for research and development",
                        "Asset revaluation"
                    ],
                    "Value": "$500 million"
                },
                {
                    "Indicator": "Total Liabilities",
                    "Description": "The total amount of debts the company is obligated to repay at the end of the accounting period.",
                    "Influencing Factors": [
                        "Debt restructuring and repayment initiatives",
                        "Strategic financing activities",
                        "Effective management of debt levels"
                    ],
                    "Value": "$150 million"
                },
                {
                    "Indicator": "Shareholder Equity",
                    "Description": "The total amount of equity belonging to shareholders at the end of the accounting period.",
                    "Influencing Factors": [
                        "Net profit generation",
                        "Dividend distribution to shareholders",
                        "Capital reserves from previous financial periods"
                    ],
                    "Value": "$350 million"
                },
                {
                    "Indicator": "Cash Flow",
                    "Description": "The total cash inflows and outflows of the company within a certain accounting period.",
                    "Influencing Factors": [
                        "Robust operating activities generating positive cash flows",
                        "Efficient management of investment activities",
                        "Optimized financing activities balancing cash inflows and outflows"
                    ],
                    "Value": "$50 million"
                },
                {
                    "Indicator": "Debt Ratio",
                    "Description": "The ratio of total liabilities to total assets, reflecting the company's debt level.",
                    "Influencing Factors": [
                        "Proactive debt restructuring and repayment efforts",
                        "Strategic financing initiatives",
                        "Effective management of asset values"
                    ],
                    "Value": "30%"
                },
                {
                    "Indicator": "Debt to Assets Ratio",
                    "Description": "The percentage of total liabilities to total assets, a measure of the company's financial leverage.",
                    "Influencing Factors": [
                        "Maintaining a balance between asset acquisition and debt management"
                    ],
                    "Value": "25%"
                },
                {
                    "Indicator": "Return on Equity",
                    "Description": "Reflects the operational efficiency of shareholder equity, namely the ratio of net profit to average shareholder equity.",
                    "Influencing Factors": [
                        "Consistent growth in net profit",
                        "Effective utilization of shareholder equity",
                        "Optimized allocation of available resources"
                    ],
                    "Value": "10%"
                }
            ]
        }
    ],
    "Additional Information": [
        {
            "Name": "Future Outlook",
            "Content": [
                {
                    "Name": "Financial Strategy",
                    "Description": "GreenTech Solutions plans to implement a stringent cost control strategy to maintain healthy profit margins, while strategically allocating capital for research and development efforts to continuously innovate its range of environmental protection technologies."
                },
                {
                    "Name": "Investment Plans",
                    "Description": "The company's investment plans include expanding its portfolio of waste management technologies, capitalizing on opportunities in renewable energy, and exploring emerging sectors such as sustainable agriculture and carbon capture."
                },
                {
                    "Name": "Risk Management",
                    "Description": "GreenTech Solutions has identified major financial risks, such as regulatory uncertainties, fluctuations in commodity prices, and intense competition. The company will proactively manage these risks by diversifying its product offerings, establishing strategic partnerships, and closely monitoring market trends and regulatory changes."
                }
            ]
        }
    ],
    "Generated Outline": "I. Introduction\n    A. Report Type: Corporate Financial Report\n    B. Report Time: 2021\n    C. Company Information\n        1. Name: GreenTech Solutions Inc.\n        2. Establishment Date: January 1, 2008\n        3. Main Business: Design, development, and implementation of environmentally friendly technologies for waste management and pollution control.\n        4. Registration Location: San Francisco, California\n        5. Listing Status: Publicly traded on NASDAQ\n        6. Industry: Environmental Protection\n\nII. Financial Information\n    A. Asset Restructuring (April, 2021)\n        1. Description: The company underwent a comprehensive asset restructuring, optimizing its business structure to focus on high-growth sectors within the environmental protection industry.\n        2. Impact: This initiative has greatly improved operational efficiency, strengthened research and development capabilities, and increased the overall value of the company.\n        3. Strategic Partnerships (2021)\n            - Description: Formed strategic partnerships with leading technology companies in the environmental protection industry.\n            - Impact: Provided new revenue streams, enhanced market position, and facilitated the asset restructuring process.\n        4. Research and Development Investment (2021)\n            - Description: Significantly increased investment in research and development activities.\n            - Impact: Enhanced product portfolio and enabled offering more advanced and efficient solutions.\n        5. Market Expansion (2021)\n            - Description: Expanded market presence beyond current geographical areas to target emerging markets in high environmental protection demand.\n            - Impact: Increased customer base, revenue potential, and contributed to the decision to focus on high-growth sectors during the asset restructuring process.\n    B. Dividend Distribution (May, 2021)\n        1. Description: The company decided to distribute $10 million of dividends to its shareholders, demonstrating its commitment to enhancing shareholder returns.\n        2. Impact: Provided significant return to investors and highlighted strong financial performance.\n    C. Significant Equity Acquisition (July, 2021)\n        1. Description: Successfully completed acquisition of 30% equity stake in BlueOcean Solutions Inc., a leading provider of ocean conservation technologies.\n        2. Impact: Expanded market share and enhanced control over the ocean conservation sector, positioning the company as an industry leader.\n    D. Debt Restructuring (August, 2021)\n        1. Description: Underwent debt restructuring process, successfully reducing liabilities by $20 million.\n        2. Impact: Improved financial condition and reduced financial costs, providing a more sustainable foundation for future growth.\n    E. Major Investment (September, 2021)\n        1. Description: Made a major investment of $50 million in Project CleanAir, a revolutionary air purification technology.\n        2. Impact: Expanded business areas, tapped into highly-profitable air pollution control market, and bolstered overall profitability.\n    F. Major Asset Acquisition (November, 2021)\n        1. Description: Completed acquisition of Liberty Energy Solutions, a prominent renewable energy company, with a total asset value of $100 million.\n        2. Impact: Significantly expanded business scope, enabling comprehensive solutions for both waste management and renewable energy, enhancing market competitiveness.\n    G. Large-scale Financing (December, 2021)\n        1. Description: Conducted a large-scale financing round, raising $200 million in funds from leading institutional investors.\n        2. Impact: Strengthened financial position, providing necessary capital for continued expansion and development in the environmental protection sector.\n\nIII. Involved Indicators\n    A. Operating Income ($150 million)\n        1. Description: Total amount of main business income and other business income within a certain accounting period.\n        2. Influencing Factors: Increasing market demand for environmental protection technologies, positive changes in global regulations favoring environmentally friendly solutions, and R&D breakthroughs leading to innovative product offerings.\n    B. Net Profit ($30 million)\n        1. Description: Net income of the company within a certain accounting period, i.e., total income minus total costs and taxes.\n        2. Influencing Factors: Strong operating income, effective cost control measures, and absence of major non-recurring gains and losses.\n    C. Total Assets ($500 million)\n        1. Description: Total amount of assets owned by the company at the end of the accounting period.\n        2. Influencing Factors: Acquisition of Liberty Energy Solutions, capital expenditures for research and development, and asset revaluation.\n    D. Total Liabilities ($150 million)\n        1. Description: Total amount of debts the company is obligated to repay at the end of the accounting period.\n        2. Influencing Factors: Debt restructuring and repayment initiatives, strategic financing activities, and effective management of debt levels.\n    E. Shareholder Equity ($350 million)\n        1. Description: Total amount of equity belonging to shareholders at the end of the accounting period.\n        2. Influencing Factors: Net profit generation, dividend distribution to shareholders, and capital reserves from previous financial periods.\n    F. Cash Flow ($50 million)\n        1. Description: Total cash inflows and outflows of the company within a certain accounting period.\n        2. Influencing Factors: Robust operating activities generating positive cash flows, efficient management of investment activities, and optimized financing activities balancing cash inflows and outflows.\n    G. Debt Ratio (30%)\n        1. Description: Ratio of total liabilities to total assets, reflecting the company's debt level.\n        2. Influencing Factors: Proactive debt restructuring and repayment efforts, strategic financing initiatives, and effective management of asset values.\n    H. Debt to Assets Ratio (25%)\n        1. Description: Percentage of total liabilities to total assets, a measure of the company's financial leverage.\n        2. Influencing Factors: Maintaining a balance between asset acquisition and debt management.\n    I. Return on Equity (10%)\n        1. Description: Reflects the operational efficiency of shareholder equity, namely the ratio of net profit to average shareholder equity.\n        2. Influencing Factors: Consistent growth in net profit, effective utilization of shareholder equity, and optimized allocation of available resources.\n\nIV. Additional Information\n    A. Future Outlook\n        1. Financial Strategy\n            - Description: Implement stringent cost control strategy and strategically allocate capital for research and development efforts.\n        2. Investment Plans\n            - Description: Expand portfolio of waste management technologies, capitalize on opportunities in renewable energy, and explore emerging sectors such as sustainable agriculture and carbon capture.\n        3. Risk Management\n            - Description: Identify major financial risks and proactively manage them by diversifying product offerings, establishing strategic partnerships, and closely monitoring market trends and regulatory changes.",
    "Generated Summary": "GreenTech Solutions Inc., established on January 1, 2008 in San Francisco, California, is a publicly traded company on NASDAQ, specializing in the design, development, and implementation of environmentally friendly technologies for waste management and pollution control in the field of environmental protection.",
    "Generated Article": "In 2021, GreenTech Solutions Inc. underwent several significant events that have shaped its financial performance and market position. Firstly, the company embarked on a comprehensive asset restructuring in April, optimizing its business structure to focus on high-growth sectors within the environmental protection industry. This initiative has greatly improved operational efficiency, strengthened research and development capabilities, and increased the overall value of the company. As a result, GreenTech Solutions Inc. experienced a substantial increase in operating income, reaching $150 million, driven by increasing market demand for environmental protection technologies, positive changes in global regulations favoring environmentally friendly solutions, and R&D breakthroughs leading to innovative product offerings.\n\nIn addition to asset restructuring, the company formed strategic partnerships with leading technology companies in the environmental protection industry. These partnerships, established in 2021, provided new revenue streams, enhanced market position, and facilitated the asset restructuring process. The impact of these partnerships can be seen in the company's net profit, which reached $30 million. This strong financial performance can be attributed to the company's effective cost control measures and the absence of major non-recurring gains and losses.\n\nFurthermore, GreenTech Solutions Inc. significantly increased its investment in research and development activities in 2021. This investment has resulted in an enhanced product portfolio, enabling the company to offer more advanced and efficient solutions. The company's total assets reached $500 million, reflecting the acquisition of Liberty Energy Solutions, capital expenditures for research and development, and asset revaluation.\n\nTo expand its market presence, GreenTech Solutions Inc. ventured beyond its current geographical areas and targeted emerging markets in high environmental protection demand. This strategic move has led to an increased customer base, revenue potential, and contributed to the decision to focus on high-growth sectors during the asset restructuring process. The company's debt restructuring in August 2021 successfully reduced liabilities by $20 million, improving its financial condition and reducing financial costs, providing a more sustainable foundation for future growth.\n\nGreenTech Solutions Inc. made a major investment of $50 million in September 2021 in Project CleanAir, a revolutionary air purification technology. This investment has allowed the company to expand its business areas, tap into the highly-profitable air pollution control market, and bolster overall profitability. Additionally, the company completed the acquisition of Liberty Energy Solutions, a prominent renewable energy company, in November 2021. This acquisition, with a total asset value of $100 million, significantly expanded the company's business scope, enabling comprehensive solutions for both waste management and renewable energy, and enhancing market competitiveness.\n\nTo strengthen its financial position, GreenTech Solutions Inc. conducted a large-scale financing round in December 2021, raising $200 million in funds from leading institutional investors. This has provided the necessary capital for continued expansion and development in the environmental protection sector. The company's shareholder equity reached $350 million, reflecting the generation of net profit, dividend distribution to shareholders, and capital reserves from previous financial periods.\n\nIn terms of financial indicators, GreenTech Solutions Inc. achieved an operating income of $150 million, a net profit of $30 million, total assets of $500 million, total liabilities of $150 million, and a cash flow of $50 million. The company's debt ratio stands at 30%, reflecting proactive debt restructuring and repayment efforts, strategic financing initiatives, and effective management of asset values. The debt to assets ratio is 25%, indicating a balanced approach between asset acquisition and debt management. The return on equity is 10%, reflecting consistent growth in net profit, effective utilization of shareholder equity, and optimized allocation of available resources.\n\nLooking ahead, GreenTech Solutions Inc. has outlined a financial strategy that includes stringent cost control measures and strategic capital allocation for research and development efforts. The company plans to expand its portfolio of waste management technologies, capitalize on opportunities in renewable energy, and explore emerging sectors such as sustainable agriculture and carbon capture. Risk management is a key focus, with the company aiming to identify major financial risks and proactively manage them through diversifying product offerings, establishing strategic partnerships, and closely monitoring market trends and regulatory changes.\n\nIn conclusion, GreenTech Solutions Inc. has demonstrated strong financial performance and strategic initiatives in 2021, positioning itself as a leader in the environmental protection industry. Through asset restructuring, strategic partnerships, research and development investments, market expansion, and major acquisitions, the company has enhanced its operational efficiency, market position, and overall value. With a solid financial foundation and a focus on innovation and sustainability, GreenTech Solutions Inc. is well-positioned for continued growth and success in the future."
}