{
    "Hospitalization Record": {
        "Basic Information": {
            "Name": "V. Lewis",
            "Gender": "female",
            "Age": "64",
            "Ethnicity": "Caucasian",
            "Marital Status": "Widowed",
            "Occupation": "Retired Teacher",
            "Address": "94, Yorktown street, Newport",
            "Admission Time": "23th, July",
            "Record Time": "23th, July",
            "Historian": "Patient herself",
            "Hospital Name": "Newport General Hospital"
        },
        "Chief Complaint": "Fever, cough, and difficulty breathing for 5 days.",
        "Present Illness": {
            "Onset": "Onset occurred 5 days ago at home with sudden onset of high fever. No known trigger.",
            "Main Symptoms": "Persistent dry cough, moderate difficulty breathing, fever of 38.5°C. Symptoms aggravated by exertion.",
            "Accompanying Symptoms": "General malaise, mild chest pain during coughing.",
            "Diagnosis and Treatment History": "Patient visited a local clinic 3 days ago and was prescribed antibiotics with no improvement.",
            "General Condition Changes": "Decreased appetite, difficulty sleeping due to cough, normal urination and defecation, slight weight loss."
        },
        "Past History": {
            "General Health Condition": "Generally good prior to current illness.",
            "Disease History": "Hypertension for 10 years, well controlled with medication.",
            "Infectious Disease History": "No significant past infectious diseases.",
            "Immunization History": "Up-to-date with vaccinations, including influenza and pneumococcal vaccine.",
            "Surgery and Trauma History": "Appendectomy at age 30, otherwise unremarkable.",
            "Blood Transfusion History": "No history of blood transfusion.",
            "Allergy History": "Allergic to penicillin."
        },
        "Personal History": {
            "Birthplace": "Newport",
            "Residence": "Newport",
            "Living Habits": "Non-smoker, occasional social drinker.",
            "Occupation and Working Conditions": "Retired teacher, no significant occupational hazards.",
            "Exposure History": "No exposure to industrial toxins or radioactive substances.",
            "Travel History": "No recent travel history."
        },
        "Marital and Family History": {
            "Marital History": {
                "Marital Status": "Widowed",
                "Marriage Age": "22",
                "Spouse's Health Condition": "Deceased",
                "Children's Condition": "Two children, both in good health."
            },
            "Menstrual History": {
                "Menarche Age": "13",
                "Menstruation Duration": "5 days",
                "Menstruation Interval": "28 days",
                "Last Menstruation": "Age 50",
                "Menstrual Volume": "Normal",
                "Dysmenorrhea": "No"
            },
            "Family History": "Mother had diabetes, father had chronic bronchitis. No known genetic tendencies."
        },
        "Physical Examination": {
            "General Condition": {
                "Temperature": "38.5°C",
                "Pulse": "92 bpm",
                "Respiration": "24 breaths/min",
                "Blood Pressure": "130/85 mmHg"
            },
            "Systematic Examination": {
                "Skin": "No abnormalities",
                "Mucous Membranes": "Moist",
                "Lymph Nodes": "No enlargement",
                "Head and Organs": "No abnormalities",
                "Neck": "Supple, no jugular vein distention.",
                "Chest": "Dullness to percussion over right lower lobe, crackles heard on auscultation. Heart sounds normal.",
                "Abdomen": "Soft, non-tender, no organomegaly.",
                "Rectum and Anus": "Not examined.",
                "External Genitalia": "Normal for age.",
                "Spine": "No abnormalities.",
                "Limbs": "No edema or cyanosis.",
                "Nervous System": "No focal neurological deficits."
            }
        },
        "Specialist Examination": "Pulmonary auscultation revealed crackles over the right lower lobe.",
        "Auxiliary Examination": "Chest X-ray showed consolidation in the right lower lobe, elevated WBC count, CRP elevated.",
        "Preliminary Diagnosis": "Community-acquired pneumonia",
        "Diagnostic Basis": "Based on patient's history of fever, cough, difficulty breathing, physical exam findings, and chest X-ray results.",
        "Differential Diagnosis": "Tuberculosis: ruled out due to lack of chronic symptoms and relevant exposure history. Lung cancer: less likely given acute presentation and lack of weight loss. Pulmonary embolism: ruled out due to absence of risk factors and sudden onset.",
        "Admission Records": {
            "Physician's Signature": "Dr. J. Smith"
        },
        "Post-Admission Course Records": {
            "First Course Record": "Patient presented with symptoms indicative of pneumonia. Initial treatment with broad-spectrum antibiotics and supportive measures initiated.",
            "Daily Course Records": "Patient monitored daily. Fever subsided on the 2nd day, continued improvement in respiratory symptoms.",
            "Senior Physician Rounds Records": "Patient reviewed on rounds. Satisfactory progress, continue current management.",
            "Difficult Case Discussion Records": "",
            "Handover Records": "Patient handed over to night shift with stable vitals, continue current treatment.",
            "Transfer Records": "",
            "Stage Summary": "Patient showed significant improvement, afebrile for 48 hours, respiratory symptoms resolving.",
            "Emergency Records": "",
            "Invasive Procedure Records": "",
            "Consultation Records": "",
            "Discharge Records": "Patient discharged home in stable condition with oral antibiotics and follow-up in 1 week.",
            "Critically Ill Patient Care Records": ""
        },
        "Medical Orders": {
            "Long-term Orders": "1. Broad-spectrum antibiotics IV 2. Oxygen therapy 3. Monitor vital signs every 4 hours",
            "Temporary Orders": "1. Blood cultures 2. CBC 3. CRP"
        },
        "Auxiliary Examination Reports": "1. Chest X-ray: Right lower lobe consolidation. 2. CBC: Elevated WBC count. 3. CRP: Elevated.",
        "Temperature Chart": "Records indicate fever decreased progressively from 38.5°C to normal over 48 hours.",
        "Blood Transfusion Consent": "",
        "Special Examination Consent": "",
        "Critical Condition Notice": ""
    },
    "DiseaseType": {
        "Respiratory System Diseases": {
            "Name": "Pneumonia",
            "Symptoms": "Fever, cough, difficulty breathing",
            "Differential Diagnosis": "Tuberculosis, lung cancer, pulmonary embolism."
        }
    },
    "Generated Article": "Hospitalization Record\n\nBasic Information:\nName: V. Lewis\nGender: Female\nAge: 64\nEthnicity: Caucasian\nMarital Status: Widowed\nOccupation: Retired Teacher\nAddress: 94, Yorktown Street, Newport\nAdmission Time: 23rd, July\nRecord Time: 23rd, July\nHistorian: Patient herself\nHospital Name: Newport General Hospital\n\nChief Complaint: Fever, cough, and difficulty breathing for 5 days.\n\nPresent Illness:\nOnset: Onset occurred 5 days ago at home with sudden onset of high fever. No known trigger.\nMain Symptoms: Persistent dry cough, moderate difficulty breathing, fever of 38.5°C. Symptoms aggravated by exertion.\nAccompanying Symptoms: General malaise, mild chest pain during coughing.\nDiagnosis and Treatment History: Patient visited a local clinic 3 days ago and was prescribed antibiotics with no improvement.\nGeneral Condition Changes: Decreased appetite, difficulty sleeping due to cough, normal urination and defecation, slight weight loss.\n\nPast History:\nGeneral Health Condition: Generally good prior to current illness.\nDisease History: Hypertension for 10 years, well controlled with medication.\nInfectious Disease History: No significant past infectious diseases.\nImmunization History: Up-to-date with vaccinations, including influenza and pneumococcal vaccine.\nSurgery and Trauma History: Appendectomy at age 30, otherwise unremarkable.\nBlood Transfusion History: No history of blood transfusion.\nAllergy History: Allergic to penicillin.\n\nPersonal History:\nBirthplace: Newport\nResidence: Newport\nLiving Habits: Non-smoker, occasional social drinker.\nOccupation and Working Conditions: Retired teacher, no significant occupational hazards.\nExposure History: No exposure to industrial toxins or radioactive substances.\nTravel History: No recent travel history.\n\nMarital and Family History:\nMarital History:\nMarital Status: Widowed\nMarriage Age: 22\nSpouse's Health Condition: Deceased\nChildren's Condition: Two children, both in good health.\nMenstrual History:\nMenarche Age: 13\nMenstruation Duration: 5 days\nMenstruation Interval: 28 days\nLast Menstruation: Age 50\nMenstrual Volume: Normal\nDysmenorrhea: No\nFamily History: Mother had diabetes, father had chronic bronchitis. No known genetic tendencies.\n\nPhysical Examination:\nGeneral Condition:\nTemperature: 38.5°C\nPulse: 92 bpm\nRespiration: 24 breaths/min\nBlood Pressure: 130/85 mmHg\nSystematic Examination:\nSkin: No abnormalities\nMucous Membranes: Moist\nLymph Nodes: No enlargement\nHead and Organs: No abnormalities\nNeck: Supple, no jugular vein distention.\nChest: Dullness to percussion over right lower lobe, crackles heard on auscultation. Heart sounds normal.\nAbdomen: Soft, non-tender, no organomegaly.\nRectum and Anus: Not examined.\nExternal Genitalia: Normal for age.\nSpine: No abnormalities.\nLimbs: No edema or cyanosis.\nNervous System: No focal neurological deficits.\n\nSpecialist Examination: Pulmonary auscultation revealed crackles over the right lower lobe.\n\nAuxiliary Examination: Chest X-ray showed consolidation in the right lower lobe, elevated WBC count, CRP elevated.\n\nPreliminary Diagnosis: Community-acquired pneumonia\n\nDiagnostic Basis: Based on patient's history of fever, cough, difficulty breathing, physical exam findings, and chest X-ray results.\n\nDifferential Diagnosis:\nTuberculosis: Ruled out due to lack of chronic symptoms and relevant exposure history.\nLung Cancer: Less likely given acute presentation and lack of weight loss.\nPulmonary Embolism: Ruled out due to absence of risk factors and sudden onset.\n\nAdmission Records:\nPhysician's Signature: Dr. J. Smith\n\nPost-Admission Course Records:\nFirst Course Record: Patient presented with symptoms indicative of pneumonia. Initial treatment with broad-spectrum antibiotics and supportive measures initiated.\nDaily Course Records: Patient monitored daily. Fever subsided on the 2nd day, continued improvement in respiratory symptoms.\nSenior Physician Rounds Records: Patient reviewed on rounds. Satisfactory progress, continue current management.\nDifficult Case Discussion Records: \nHandover Records: Patient handed over to night shift with stable vitals, continue current treatment.\nTransfer Records: \nStage Summary: Patient showed significant improvement, afebrile for 48 hours, respiratory symptoms resolving.\nEmergency Records: \nInvasive Procedure Records: \nConsultation Records: \nDischarge Records: Patient discharged home in stable condition with oral antibiotics and follow-up in 1 week.\nCritically Ill Patient Care Records: \n\nMedical Orders:\nLong-term Orders:\n1. Broad-spectrum antibiotics IV\n2. Oxygen therapy\n3. Monitor vital signs every 4 hours\nTemporary Orders:\n1. Blood cultures\n2. CBC\n3. CRP\n\nAuxiliary Examination Reports:\n1. Chest X-ray: Right lower lobe consolidation.\n2. CBC: Elevated WBC count.\n3. CRP: Elevated.\n\nTemperature Chart: Records indicate fever decreased progressively from 38.5°C to normal over 48 hours.\n\nBlood Transfusion Consent:\nSpecial Examination Consent:\nCritical Condition Notice:\n\nDiseaseType:\nRespiratory System Diseases:\nName: Pneumonia\nSymptoms: Fever, cough, difficulty breathing\nDifferential Diagnosis: Tuberculosis, lung cancer, pulmonary embolism.",
    "qa_fact_based": [
        {
            "question type": "Factual Question",
            "question": "According to the hospitalization records of Newport General Hospital, what is V. Lewis's chief complaint?",
            "answer": "Fever, cough, and difficulty breathing for 5 days.",
            "ref": [
                "Chief Complaint: Fever, cough, and difficulty breathing for 5 days."
            ]
        },
        {
            "question type": "Factual Question",
            "question": "According to the hospitalization records of Newport General Hospital, what is the patient's general health condition prior to the current illness?",
            "answer": "Generally good.",
            "ref": [
                "General Health Condition: Generally good prior to current illness."
            ]
        },
        {
            "question type": "Factual Question",
            "question": "According to the hospitalization records of Newport General Hospital, how long has V. Lewis had hypertension?",
            "answer": "10 years.",
            "ref": [
                "Disease History: Hypertension for 10 years, well controlled with medication."
            ]
        },
        {
            "question type": "Factual Question",
            "question": "According to the hospitalization records of Newport General Hospital, what is V. Lewis allergic to?",
            "answer": "Penicillin.",
            "ref": [
                "Allergy History: Allergic to penicillin."
            ]
        }
    ],
    "qa_multi_hop": [
        {
            "question type": "Multi-hop Reasoning Question",
            "question": "According to the hospitalization records of Newport General Hospital, how many auxiliary examinations did V. Lewis undergo?",
            "answer": "According to the records, V. Lewis underwent 3 auxiliary examinations, namely Chest X-ray, CBC, and CRP.",
            "ref": [
                "Auxiliary Examination: Chest X-ray showed consolidation in the right lower lobe, elevated WBC count, CRP elevated.",
                "Auxiliary Examination Reports:",
                "1. Chest X-ray: Right lower lobe consolidation.",
                "2. CBC: Elevated WBC count.",
                "3. CRP: Elevated."
            ]
        }
    ],
    "qa_summary": [
        {
            "question type": "Summarization Question",
            "question": "According to the hospitalization records of Newport General Hospital, summarize the present illness of V. Lewis.",
            "answer": "The onset occurred 5 days ago at home with a sudden onset of high fever with no known trigger. Main symptoms include a persistent dry cough, moderate difficulty breathing, and a fever of 38.5°C, aggravated by exertion. Accompanying symptoms are general malaise and mild chest pain during coughing. She visited a local clinic 3 days ago and was prescribed antibiotics with no improvement. Her general condition changes include decreased appetite, difficulty sleeping due to cough, normal urination and defecation, and slight weight loss.",
            "ref": [
                "Present Illness:",
                "Onset: Onset occurred 5 days ago at home with sudden onset of high fever.",
                "No known trigger.",
                "Main Symptoms: Persistent dry cough, moderate difficulty breathing, fever of 38.5°C.",
                "Symptoms aggravated by exertion.",
                "Accompanying Symptoms: General malaise, mild chest pain during coughing.",
                "Diagnosis and Treatment History: Patient visited a local clinic 3 days ago and was prescribed antibiotics with no improvement.",
                "General Condition Changes: Decreased appetite, difficulty sleeping due to cough, normal urination and defecation, slight weight loss."
            ]
        },
        {
            "question type": "Summarization Question",
            "question": "According to the hospitalization records of Newport General Hospital, summarize the past medical history of V. Lewis.",
            "answer": "V. Lewis had generally good health prior to the current illness. She has a 10-year history of hypertension, well controlled with medication. She has no significant past infectious diseases and is up-to-date with vaccinations, including influenza and pneumococcal vaccine. She had an appendectomy at age 30 and has no history of blood transfusion. She is allergic to penicillin.",
            "ref": [
                "General Health Condition: Generally good prior to current illness.",
                "Disease History: Hypertension for 10 years, well controlled with medication.",
                "Infectious Disease History: No significant past infectious diseases.",
                "Immunization History: Up-to-date with vaccinations, including influenza and pneumococcal vaccine.",
                "Surgery and Trauma History: Appendectomy at age 30, otherwise unremarkable.",
                "Blood Transfusion History: No history of blood transfusion.",
                "Allergy History: Allergic to penicillin."
            ]
        },
        {
            "question type": "Summarization Question",
            "question": "According to the hospitalization records of Newport General Hospital, summarize the physical examination findings of V. Lewis.",
            "answer": "General condition: Temperature 38.5°C, pulse 92 bpm, respiration 24 breaths/min, blood pressure 130/85 mmHg. Systematic examination: Skin and mucous membranes normal, no lymph node enlargement, head and organs normal, neck supple with no jugular vein distention. Chest: Dullness to percussion over right lower lobe, crackles heard on auscultation, heart sounds normal. Abdomen: Soft, non-tender, no organomegaly. Rectum and anus not examined. External genitalia normal for age. Spine and limbs normal, no edema or cyanosis. Nervous system: No focal neurological deficits.",
            "ref": [
                "General Condition:",
                "Temperature: 38.5°C",
                "Pulse: 92 bpm",
                "Respiration: 24 breaths/min",
                "Blood Pressure: 130/85 mmHg",
                "Systematic Examination:",
                "Skin: No abnormalities",
                "Mucous Membranes: Moist",
                "Lymph Nodes: No enlargement",
                "Head and Organs: No abnormalities",
                "Neck: Supple, no jugular vein distention.",
                "Chest: Dullness to percussion over right lower lobe, crackles heard on auscultation.",
                "Heart sounds normal.",
                "Abdomen: Soft, non-tender, no organomegaly.",
                "Rectum and Anus: Not examined.",
                "External Genitalia: Normal for age.",
                "Spine: No abnormalities.",
                "Limbs: No edema or cyanosis.",
                "Nervous System: No focal neurological deficits."
            ]
        }
    ]
}