{
    "报告类型": "公司财务报告",
    "报告时间": "2021年度",
    "公司信息": {
        "名称": "医疗先锋股份有限公司",
        "成立日期": "2005年3月",
        "主营业务": "医疗器械研发、生产和销售",
        "注册地": "上海市",
        "上市情况": "在上海证券交易所上市",
        "行业": "医疗"
    },
    "报告内容": [
        {
            "类型": "财务信息",
            "重要事件": [
                {
                    "事件": "重大资产收购",
                    "时间": "2021年1月",
                    "描述": "公司完成了对X生物医疗公司的资产收购，总价值15亿元。",
                    "影响": "扩大公司生产线，提高产品研发和生产能力，增强市场竞争力。",
                    "子事件": [
                        {
                            "事件": "与X生物医疗公司达成初步合作意向",
                            "时间": "2020年6月",
                            "描述": "医疗先锋股份有限公司与X生物医疗公司初步达成合作意向，双方决定进一步洽谈资产收购事宜。",
                            "影响": "为后续资产收购奠定了基础，并开始进行资产评估和尽职调查。"
                        },
                        {
                            "事件": "确定资产收购方案",
                            "时间": "2020年10月",
                            "描述": "经过细致的尽职调查和资产评估，双方最终确定了资产收购方案，确立了收购价格和交易条款。",
                            "影响": "为资产收购的最终达成提供了明确的方向和依据。"
                        },
                        {
                            "事件": "签署资产收购协议",
                            "时间": "2020年12月",
                            "描述": "公司与X生物医疗公司正式签署了资产收购协议，明确了双方的权益和责任。",
                            "影响": "正式确立了资产收购的法律关系和责任义务。"
                        },
                        {
                            "事件": "完成资产交割手续",
                            "时间": "2021年1月",
                            "描述": "在协议约定的时间内，公司完成了与X生物医疗公司的资产交割手续，正式完成了资产收购。",
                            "影响": "公司获得了X生物医疗公司的相关资产和技术，为公司进一步扩大生产线和提高研发能力奠定了基础。"
                        }
                    ]
                },
                {
                    "事件": "分发股利",
                    "时间": "2021年2月",
                    "描述": "公司决定向股东分发6亿元股利。",
                    "影响": "回报给股东们的投资，提升了股东的收益，增强了投资者信心。"
                },
                {
                    "事件": "重大股权收购",
                    "时间": "2021年4月",
                    "描述": "公司完成了对A医药连锁公司的股权收购，获得了70%的股权。",
                    "影响": "进一步扩大了公司的市场份额，提升了公司的控制力和市场地位。"
                },
                {
                    "事件": "大规模融资",
                    "时间": "2021年8月",
                    "描述": "公司进行了一次大规模的融资活动，募集了10亿元资金。",
                    "影响": "加强了公司的资金实力，支持了公司的扩张和研发投入。"
                },
                {
                    "事件": "资产重组",
                    "时间": "2021年9月",
                    "描述": "公司进行了一次资产重组，优化了公司的业务结构，出售了非核心资产。",
                    "影响": "提高了公司的运营效率，降低了成本，增加了公司的价值。"
                },
                {
                    "事件": "重大投资",
                    "时间": "2021年10月",
                    "描述": "公司投资了D医疗科技公司，投资金额为8亿元。",
                    "影响": "进一步拓宽了公司的业务领域，提升了公司的盈利能力和技术水平。"
                },
                {
                    "事件": "债务重组",
                    "时间": "2021年11月",
                    "描述": "为优化资本结构，公司进行了债务重组，减少了5亿元负债。",
                    "影响": "改善了公司的财务状况，降低了财务风险和财务成本。"
                }
            ],
            "涉及的指标": [
                {
                    "指标": "营业收入",
                    "描述": "公司在一定会计期间内的主营业务收入和其他业务收入总额。",
                    "影响因素": [
                        "市场需求的增减变化",
                        "产品价格的变化"
                    ],
                    "值": "150亿元"
                },
                {
                    "指标": "净利润",
                    "描述": "公司在一定会计期间的净收入，即总收入减去总成本和所得税费用后的金额。",
                    "影响因素": [
                        "营业收入的增减变化",
                        "成本控制的水平",
                        "非经常性损益的发生情况"
                    ],
                    "值": "30亿元"
                },
                {
                    "指标": "总资产",
                    "描述": "会计期末，公司所拥有的资产总额。",
                    "影响因素": [
                        "资产收购和投资的增减变化",
                        "资产处置和转让的情况",
                        "资产重估的结果"
                    ],
                    "值": "500亿元"
                },
                {
                    "指标": "总负债",
                    "描述": "会计期末，公司所承担并需要偿还的债务总额。",
                    "影响因素": [
                        "新债发行和债务偿还的情况",
                        "债务重组的影响"
                    ],
                    "值": "200亿元"
                },
                {
                    "指标": "股东权益",
                    "描述": "会计期末，归属于股东的权益总额。",
                    "影响因素": [
                        "净利润的变化",
                        "股利发放情况",
                        "资本公积的变动"
                    ],
                    "值": "300亿元"
                },
                {
                    "指标": "现金流量",
                    "描述": "公司在一定会计期间内的现金流入和流出总和。",
                    "影响因素": [
                        "经营活动的现金流量",
                        "投资活动的现金流量",
                        "筹资活动的现金流量"
                    ],
                    "值": "80亿元"
                },
                {
                    "指标": "负债比率",
                    "描述": "公司总负债与总资产的比率，反映公司的债务水平。",
                    "影响因素": [
                        "总负债的增减变化",
                        "总资产的增减变化"
                    ],
                    "值": "40%"
                },
                {
                    "指标": "资产负债率",
                    "描述": "公司总负债占总资产的百分比，衡量公司财务杠杆的一个指标。",
                    "影响因素": [
                        "资产和负债的增减变化"
                    ],
                    "值": "40%"
                },
                {
                    "指标": "净资产收益率",
                    "描述": "反映公司股东权益的经营效益，即净利润与平均股东权益的比率。",
                    "影响因素": [
                        "净利润的变化",
                        "股东权益的变化"
                    ],
                    "值": "10%"
                }
            ]
        }
    ],
    "额外信息": [
        {
            "名称": "未来展望",
            "内容": [
                {
                    "名称": "财务策略",
                    "描述": "公司未来计划实施的财务策略，包括成本控制、资本运营、市场拓展等。"
                },
                {
                    "名称": "投资计划",
                    "描述": "公司面向未来的投资计划，包括新产品研发投入、生产设备更新等。"
                },
                {
                    "名称": "风险管理",
                    "描述": "公司识别的主要财务风险包括市场风险、信用风险等，将加强风险管理措施以应对这些风险。"
                }
            ]
        }
    ],
    "生成大纲": "公司财务报告大纲\n\n报告时间：2021年度\n\n一、财务信息\n   1. 重要事件\n      a. 重大资产收购\n         - 时间：2021年1月\n         - 描述：公司完成了对X生物医疗公司的资产收购，总价值15亿元。\n         - 影响：扩大公司生产线，提高产品研发和生产能力，增强市场竞争力。\n         - 子事件：\n            - 与X生物医疗公司达成初步合作意向\n               - 时间：2020年6月\n               - 描述：医疗先锋股份有限公司与X生物医疗公司初步达成合作意向，双方决定进一步洽谈资产收购事宜。\n               - 影响：为后续资产收购奠定了基础，并开始进行资产评估和尽职调查。\n            - 确定资产收购方案\n               - 时间：2020年10月\n               - 描述：经过细致的尽职调查和资产评估，双方最终确定了资产收购方案，确立了收购价格和交易条款。\n               - 影响：为资产收购的最终达成提供了明确的方向和依据。\n            - 签署资产收购协议\n               - 时间：2020年12月\n               - 描述：公司与X生物医疗公司正式签署了资产收购协议，明确了双方的权益和责任。\n               - 影响：正式确立了资产收购的法律关系和责任义务。\n            - 完成资产交割手续\n               - 时间：2021年1月\n               - 描述：在协议约定的时间内，公司完成了与X生物医疗公司的资产交割手续，正式完成了资产收购。\n               - 影响：公司获得了X生物医疗公司的相关资产和技术，为公司进一步扩大生产线和提高研发能力奠定了基础。\n      b. 分发股利\n         - 时间：2021年2月\n         - 描述：公司决定向股东分发6亿元股利。\n         - 影响：回报给股东们的投资，提升了股东的收益，增强了投资者信心。\n      c. 重大股权收购\n         - 时间：2021年4月\n         - 描述：公司完成了对A医药连锁公司的股权收购，获得了70%的股权。\n         - 影响：进一步扩大了公司的市场份额，提升了公司的控制力和市场地位。\n      d. 大规模融资\n         - 时间：2021年8月\n         - 描述：公司进行了一次大规模的融资活动，募集了10亿元资金。\n         - 影响：加强了公司的资金实力，支持了公司的扩张和研发投入。\n      e. 资产重组\n         - 时间：2021年9月\n         - 描述：公司进行了一次资产重组，优化了公司的业务结构，出售了非核心资产。\n         - 影响：提高了公司的运营效率，降低了成本，增加了公司的价值。\n      f. 重大投资\n         - 时间：2021年10月\n         - 描述：公司投资了D医疗科技公司，投资金额为8亿元。\n         - 影响：进一步拓宽了公司的业务领域，提升了公司的盈利能力和技术水平。\n      g. 债务重组\n         - 时间：2021年11月\n         - 描述：为优化资本结构，公司进行了债务重组，减少了5亿元负债。\n         - 影响：改善了公司的财务状况，降低了财务风险和财务成本。\n   2. 涉及的指标\n      a. 营业收入\n         - 描述：公司在一定会计期间内的主营业务收入和其他业务收入总额。\n         - 影响因素：市场需求的增减变化，产品价格的变化\n         - 值：150亿元\n      b. 净利润\n         - 描述：公司在一定会计期间的净收入，即总收入减去总成本和所得税费用后的金额。\n         - 影响因素：营业收入的增减变化，成本控制的水平，非经常性损益的发生情况\n         - 值：30亿元\n      c. 总资产\n         - 描述：会计期末，公司所拥有的资产总额。\n         - 影响因素：资产收购和投资的增减变化，资产处置和转让的情况，资产重估的结果\n         - 值：500亿元\n      d. 总负债\n         - 描述：会计期末，公司所承担并需要偿还的债务总额。\n         - 影响因素：新债发行和债务偿还的情况，债务重组的影响\n         - 值：200亿元\n      e. 股东权益\n         - 描述：会计期末，归属于股东的权益总额。\n         - 影响因素：净利润的变化，股利发放情况，资本公积的变动\n         - 值：300亿元\n      f. 现金流量\n         - 描述：公司在一定会计期间内的现金流入和流出总和。\n         - 影响因素：经营活动的现金流量，投资活动的现金流量，筹资活动的现金流量\n         - 值：80亿元\n      g. 负债比率\n         - 描述：公司总负债与总资产的比率，反映公司的债务水平。\n         - 影响因素：总负债的增减变化，总资产的增减变化\n         - 值：40%\n      h. 资产负债率\n         - 描述：公司总负债占总资产的百分比，衡量公司财务杠杆的一个指标。\n         - 影响因素：资产和负债的增减变化\n         - 值：40%\n      i. 净资产收益率\n         - 描述：反映公司股东权益的经营效益，即净利润与平均股东权益的比率。\n         - 影响因素：净利润的变化，股东权益的变化\n         - 值：10%\n\n二、未来展望\n   - 财务策略：公司未来计划实施的财务策略，包括成本控制、资本运营、市场拓展等。\n   - 投资计划：公司面向未来的投资计划，包括新产品研发投入、生产设备更新等。\n   - 风险管理：公司识别的主要财务风险包括市场风险、信用风险等，将加强风险管理措施以应对这些风险。",
    "生成总结": "医疗先锋股份有限公司是一家于2005年3月在上海市注册成立的医疗行业企业，主要从事医疗器械的研发、生产和销售，并在上海证券交易所上市。",
    "生成文章": "2021年度是医疗先锋股份有限公司发展历程中的重要一年。在这一年，公司实施了一系列重大事件，进一步提升了公司的市场竞争力和盈利能力。\n\n首先，公司于2021年1月完成了对X生物医疗公司的资产收购，总价值达到15亿元。这一重大资产收购事件为公司扩大生产线、提高产品研发和生产能力，增强市场竞争力奠定了基础。在资产收购过程中，公司与X生物医疗公司达成初步合作意向，并于2020年10月确定了资产收购方案，最终于2020年12月签署了资产收购协议。在2021年1月，公司完成了与X生物医疗公司的资产交割手续，正式完成了资产收购。这一事件对公司的营业收入、净利润、总资产等指标产生了积极的影响。\n\n其次，公司于2021年2月决定向股东分发6亿元股利，回报给股东们的投资，提升了股东的收益，增强了投资者信心。\n\n另外，公司于2021年4月完成了对A医药连锁公司的股权收购，获得了70%的股权。这一重大股权收购事件进一步扩大了公司的市场份额，提升了公司的控制力和市场地位。\n\n在2021年8月，公司进行了一次大规模的融资活动，募集了10亿元资金。这一举措加强了公司的资金实力，支持了公司的扩张和研发投入。\n\n为优化资本结构，公司于2021年9月进行了一次资产重组，出售了非核心资产。这一举措提高了公司的运营效率，降低了成本，增加了公司的价值。\n\n此外，公司于2021年10月投资了D医疗科技公司，投资金额为8亿元。这一重大投资进一步拓宽了公司的业务领域，提升了公司的盈利能力和技术水平。\n\n最后，在2021年11月，公司进行了债务重组，减少了5亿元负债。这一举措改善了公司的财务状况，降低了财务风险和财务成本。\n\n以上重大事件对公司的财务指标产生了显著影响。根据财务报告显示，2021年度公司的营业收入达到150亿元，净利润为30亿元，总资产为500亿元，总负债为200亿元，股东权益为300亿元。此外，公司的现金流量为80亿元，负债比率为40%，资产负债率为40%，净资产收益率为10%。\n\n通过对这些指标的分析，可以看出公司在2021年度取得了良好的财务业绩。其中，营业收入的增长主要受益于重大资产收购事件的推动，而净利润的增长则得益于成本控制的水平和非经常性损益的影响。总资产和股东权益的增加主要归因于资产收购和投资的增加，而总负债的减少则得益于债务重组的效果。此外，公司的现金流量稳定，负债比率和资产负债率保持在合理的范围内，净资产收益率也保持在较高水平。\n\n展望未来，医疗先锋股份有限公司将继续实施有效的财务策略，包括成本控制、资本运营和市场拓展等方面的工作。公司将加大对新产品研发的投入，更新生产设备，进一步提升产品质量和技术水平。同时，公司将加强风险管理措施，应对市场风险、信用风险等各类财务风险。\n\n综上所述，医疗先锋股份有限公司在2021年度取得了显著的发展成果，通过一系列重大事件的推动，公司实现了业务扩张和财务增长。展望未来，公司将继续努力，保持良好的发展势头，为股东创造更大的价值。",
    "qa_fact_based": [
        {
            "问题类型": "事实性问题",
            "问题": "医疗先锋股份有限公司的主营业务是什么？",
            "答案": "医疗器械研发、生产和销售。",
            "ref": [
                "医疗先锋股份有限公司是一家于2005年3月在上海市注册成立的医疗行业企业，主要从事医疗器械的研发、生产和销售，并在上海证券交易所上市。"
            ]
        },
        {
            "问题类型": "事实性问题",
            "问题": "医疗先锋股份有限公司在哪个证券交易所上市？",
            "答案": "上海证券交易所。",
            "ref": [
                "医疗先锋股份有限公司是一家于2005年3月在上海市注册成立的医疗行业企业，主要从事医疗器械的研发、生产和销售，并在上海证券交易所上市。"
            ]
        },
        {
            "问题类型": "事实性问题",
            "问题": "医疗先锋股份有限公司在2021年1月完成了对哪家公司的资产收购？",
            "答案": "X生物医疗公司。",
            "ref": [
                "首先，公司于2021年1月完成了对X生物医疗公司的资产收购，总价值达到15亿元。",
                "在2021年1月，公司完成了与X生物医疗公司的资产交割手续，正式完成了资产收购。"
            ]
        },
        {
            "问题类型": "事实性问题",
            "问题": "医疗先锋股份有限公司2021年度的营业收入是多少？",
            "答案": "150亿元。",
            "ref": [
                "根据财务报告显示，2021年度公司的营业收入达到150亿元，净利润为30亿元，总资产为500亿元，总负债为200亿元，股东权益为300亿元。"
            ]
        },
        {
            "问题类型": "事实性问题",
            "问题": "医疗先锋股份有限公司2021年度的净利润是多少？",
            "答案": "30亿元。",
            "ref": [
                "根据财务报告显示，2021年度公司的营业收入达到150亿元，净利润为30亿元，总资产为500亿元，总负债为200亿元，股东权益为300亿元。"
            ]
        }
    ],
    "qa_multi_hop": [
        {
            "问题类型": "多跳推理问题",
            "问题": "根据医疗先锋股份有限公司2021年的财务报告，医疗先锋股份有限公司是如何通过重大资产收购、大规模融资和重大投资来支持其未来投资计划的？",
            "答案": "医疗先锋股份有限公司2021年的财务报告中提到，首先，通过重大资产收购，公司完成了对X生物医疗公司的资产收购，扩大了生产线，提高了产品研发和生产能力；其次，通过大规模融资，公司募集了10亿元资金，增强了资金实力；最后，通过重大投资，公司投资了D医疗科技公司，进一步拓宽了业务领域，提升了盈利能力和技术水平。这些措施为公司的未来投资计划提供了坚实的基础。",
            "ref": [
                "首先，公司于2021年1月完成了对X生物医疗公司的资产收购，总价值达到15亿元。",
                "这一重大资产收购事件为公司扩大生产线、提高产品研发和生产能力，增强市场竞争力奠定了基础。",
                "在2021年1月，公司完成了与X生物医疗公司的资产交割手续，正式完成了资产收购。",
                "在2021年8月，公司进行了一次大规模的融资活动，募集了10亿元资金。",
                "这一举措加强了公司的资金实力，支持了公司的扩张和研发投入。",
                "此外，公司于2021年10月投资了D医疗科技公司，投资金额为8亿元。",
                "这一重大投资进一步拓宽了公司的业务领域，提升了公司的盈利能力和技术水平。"
            ]
        },
        {
            "问题类型": "多跳推理问题",
            "问题": "结合医疗先锋股份有限公司2021年的财务报告，医疗先锋股份有限公司如何通过重大资产收购、重大股权收购和资产重组来提升市场竞争力的？",
            "答案": "医疗先锋股份有限公司通过重大资产收购，完成了对X生物医疗公司的资产收购，扩大了生产线和研发能力；通过重大股权收购，获得了A医药连锁公司70%的股权，进一步扩大了市场份额；通过资产重组，优化了业务结构，出售了非核心资产，提高了运营效率。这些措施综合提升了公司的市场竞争力。",
            "ref": [
                "首先，公司于2021年1月完成了对X生物医疗公司的资产收购，总价值达到15亿元。",
                "这一重大资产收购事件为公司扩大生产线、提高产品研发和生产能力，增强市场竞争力奠定了基础。",
                "在2021年1月，公司完成了与X生物医疗公司的资产交割手续，正式完成了资产收购。",
                "另外，公司于2021年4月完成了对A医药连锁公司的股权收购，获得了70%的股权。",
                "这一重大股权收购事件进一步扩大了公司的市场份额，提升了公司的控制力和市场地位。",
                "为优化资本结构，公司于2021年9月进行了一次资产重组，出售了非核心资产。",
                "这一举措提高了公司的运营效率，降低了成本，增加了公司的价值。"
            ]
        },
        {
            "问题类型": "多跳推理问题",
            "问题": "根据医疗先锋股份有限公司2021年的财务报告，医疗先锋股份有限公司是如何通过债务重组、分发股利和现金流量管理来改善财务状况的？",
            "答案": "医疗先锋股份有限公司通过债务重组，减少了5亿元负债，改善了财务状况；通过分发6亿元股利，回报股东，增强了投资者信心；通过有效的现金流量管理，确保了经营活动、投资活动和筹资活动的现金流入和流出平衡，维持了公司良好的财务状况。这些措施综合改善了公司的财务状况。",
            "ref": [
                "其次，公司于2021年2月决定向股东分发6亿元股利，回报给股东们的投资，提升了股东的收益，增强了投资者信心。",
                "最后，在2021年11月，公司进行了债务重组，减少了5亿元负债。",
                "这一举措改善了公司的财务状况，降低了财务风险和财务成本。",
                "此外，公司的现金流量为80亿元，负债比率为40%，资产负债率为40%，净资产收益率为10%。"
            ]
        }
    ],
    "qa_summary": [
        {
            "问题类型": "总结性问题",
            "问题": "结合医疗先锋股份有限公司2021年的财务报告，总结其在2021年发生的财务事件。",
            "答案": "根据医疗先锋股份有限公司2021年的财务报告，2021年公司发生了多起重要的财务事件。首先，公司在1月完成了对X生物医疗公司的资产收购，总价值15亿元，扩大了生产线并提高了研发能力；2月，公司向股东分发了6亿元股利，提升了股东收益；4月，公司完成了对A医药连锁公司70%股权的收购，进一步扩大了市场份额；8月，公司进行了大规模融资，募集了10亿元资金，增强了资金实力；9月，公司进行了资产重组，优化了业务结构，出售了非核心资产；10月，公司投资了8亿元于D医疗科技公司，拓宽了业务领域；11月，公司进行了债务重组，减少了5亿元负债，改善了财务状况。这些事件综合提升了公司的财务状况和市场竞争力。",
            "ref": [
                "首先，公司于2021年1月完成了对X生物医疗公司的资产收购，总价值达到15亿元。",
                "这一重大资产收购事件为公司扩大生产线、提高产品研发和生产能力，增强市场竞争力奠定了基础。",
                "在2021年1月，公司完成了与X生物医疗公司的资产交割手续，正式完成了资产收购。",
                "其次，公司于2021年2月决定向股东分发6亿元股利，回报给股东们的投资，提升了股东的收益，增强了投资者信心。",
                "另外，公司于2021年4月完成了对A医药连锁公司的股权收购，获得了70%的股权。",
                "这一重大股权收购事件进一步扩大了公司的市场份额，提升了公司的控制力和市场地位。",
                "在2021年8月，公司进行了一次大规模的融资活动，募集了10亿元资金。",
                "这一举措加强了公司的资金实力，支持了公司的扩张和研发投入。",
                "为优化资本结构，公司于2021年9月进行了一次资产重组，出售了非核心资产。",
                "这一举措提高了公司的运营效率，降低了成本，增加了公司的价值。",
                "此外，公司于2021年10月投资了D医疗科技公司，投资金额为8亿元。",
                "这一重大投资进一步拓宽了公司的业务领域，提升了公司的盈利能力和技术水平。",
                "最后，在2021年11月，公司进行了债务重组，减少了5亿元负债。",
                "这一举措改善了公司的财务状况，降低了财务风险和财务成本。"
            ]
        },
        {
            "问题类型": "总结性问题",
            "问题": "结合医疗先锋股份有限公司2021年的财务报告，总结其主要财务指标及其影响因素。",
            "答案": "根据医疗先锋股份有限公司2021年的财务报告，主要财务指标如下：营业收入为150亿元，受市场需求和产品价格变化影响；净利润为30亿元，受营业收入、成本控制和非经常性损益影响；总资产为500亿元，受资产收购、投资和资产重估影响；总负债为200亿元，受新债发行、债务偿还和债务重组影响；股东权益为300亿元，受净利润、股利发放和资本公积变动影响；现金流量为80亿元，受经营、投资和筹资活动影响；负债比率和资产负债率均为40%，反映了公司的债务水平；净资产收益率为10%，反映了股东权益的经营效益。这些指标综合反映了公司的财务健康状况和运营效率。",
            "ref": [
                "根据财务报告显示，2021年度公司的营业收入达到150亿元，净利润为30亿元，总资产为500亿元，总负债为200亿元，股东权益为300亿元。",
                "此外，公司的现金流量为80亿元，负债比率为40%，资产负债率为40%，净资产收益率为10%。",
                "通过对这些指标的分析，可以看出公司在2021年度取得了良好的财务业绩。",
                "其中，营业收入的增长主要受益于重大资产收购事件的推动，而净利润的增长则得益于成本控制的水平和非经常性损益的影响。",
                "总资产和股东权益的增加主要归因于资产收购和投资的增加，而总负债的减少则得益于债务重组的效果。",
                "此外，公司的现金流量稳定，负债比率和资产负债率保持在合理的范围内，净资产收益率也保持在较高水平。"
            ]
        },
        {
            "问题类型": "总结性问题",
            "问题": "结合医疗先锋股份有限公司2021年的财务报告，总结其未来展望。",
            "答案": "根据医疗先锋股份有限公司2021年的财务报告，公司对未来展望充满信心。首先，公司计划继续实施成本控制策略，优化资源配置，提升运营效率；其次，公司将加大在新产品研发和生产设备更新上的投资，以保持技术领先和市场竞争力；此外，公司识别了主要的财务风险，包括市场风险和信用风险，并将加强风险管理措施以应对这些风险。总体来看，医疗先锋股份有限公司的未来发展战略明确，前景光明。",
            "ref": [
                "展望未来，医疗先锋股份有限公司将继续实施有效的财务策略，包括成本控制、资本运营和市场拓展等方面的工作。",
                "公司将加大对新产品研发的投入，更新生产设备，进一步提升产品质量和技术水平。",
                "同时，公司将加强风险管理措施，应对市场风险、信用风险等各类财务风险。",
                "展望未来，公司将继续努力，保持良好的发展势头，为股东创造更大的价值。"
            ]
        }
    ]
}