{
    "报告类型": "公司环境与社会责任报告",
    "报告时间": "2020年度",
    "公司信息": {
        "名称": "创新科技有限公司",
        "成立日期": "2005年3月15日",
        "主营业务": "提供软件开发、数据分析和云计算解决方案",
        "注册地": "美国加利福尼亚州",
        "上市情况": "未上市",
        "行业": "IT"
    },
    "报告内容": [
        {
            "类型": "环境责任",
            "重要事件": [
                {
                    "事件": "投资于碳抵消项目",
                    "时间": "2020年1月",
                    "描述": "公司通过投资林业项目或可再生能源项目来抵消其碳排放，努力实现碳中和目标。",
                    "影响": "通过碳抵消证书，公司能够向利益相关者展示其对环境的承诺和责任。",
                    "子事件": [
                        {
                            "事件": "启动内部碳减排项目",
                            "时间": "2020年1月",
                            "描述": "公司决定启动内部碳减排项目，将研究和实施减少碳排放的策略和措施。",
                            "影响": "这个项目的实施为后续投资碳抵消项目提供了基础和依据。"
                        },
                        {
                            "事件": "与国际碳抵消组织合作",
                            "时间": "2020年2月",
                            "描述": "公司与国际碳抵消组织合作，通过购买碳抵消证书来补偿其碳排放。",
                            "影响": "这项合作为公司提供了可靠的碳抵消证书，增加了对投资于碳抵消项目的可信度。"
                        }
                    ]
                },
                {
                    "事件": "节能减排项目实施",
                    "时间": "2020年3月",
                    "描述": "公司投资实施的节能减排项目，旨在减少能源消耗和温室气体排放。",
                    "影响": "直接减少了公司的能源消耗和碳足迹，提高了能效和环境绩效。"
                },
                {
                    "事件": "防止污染设施的建设",
                    "时间": "2020年4月",
                    "描述": "公司建立新的污染防治设施，如废水处理系统和排放控制设备，以减少环境污染。",
                    "影响": "显著降低了公司的环境污染水平，增强了合规性和社会责任感。"
                },
                {
                    "事件": "能源利用优化",
                    "时间": "2020年5月",
                    "描述": "公司优化生产流程，改善能源利用效率，减少资源浪费。",
                    "影响": "降低了能源成本，提高了公司的竞争力和可持续发展能力。"
                },
                {
                    "事件": "绿色产品开发",
                    "时间": "2020年7月",
                    "描述": "公司开发的环保型产品，减少对环境的影响。",
                    "影响": "提升了产品的市场竞争力和品牌形象，同时减少了环境影响。"
                },
                {
                    "事件": "采用环境管理系统",
                    "时间": "2020年12月",
                    "描述": "公司实施环境管理系统（EMS），以提高环境绩效，减少废物产生，并确保合规。",
                    "影响": "增强了公司的环境管理能力和持续改进，提升了合规性和市场认可度。"
                }
            ],
            "涉及的指标": [
                {
                    "指标": "二氧化碳排放量",
                    "描述": "公司在生产过程中产生的二氧化碳总量。",
                    "影响因素": [
                        "生产规模的变化",
                        "节能技术的应用"
                    ],
                    "值": "20000吨"
                },
                {
                    "指标": "能源消耗",
                    "描述": "公司在运营过程中消耗的能源总量。",
                    "影响因素": [
                        "生产效率的提高",
                        "能源管理措施的实施"
                    ],
                    "值": "100000 MWh"
                }
            ]
        },
        {
            "类型": "社会责任",
            "重要事件": [
                {
                    "事件": "员工健康与安全计划",
                    "时间": "2020年1月",
                    "描述": "公司实施的旨在提升员工健康与安全的措施。",
                    "影响": "显著改善了工作环境，减少了工伤事故，提高了员工的健康与安全水平。"
                },
                {
                    "事件": "员工职业成长和人才发展计划",
                    "时间": "2020年3月",
                    "描述": "公司提供各类培训和发展项目，支持员工职业成长，包括在线课程、工作坊、导师计划等。",
                    "影响": "提高了员工的专业技能和工作满意度，促进了人才的留存和发展。"
                },
                {
                    "事件": "参与公共服务项目",
                    "时间": "2020年6月",
                    "描述": "公司投资或参与公共服务项目，如城市绿化、公共卫生改善项目，以提升社区生活质量。",
                    "影响": "促进了社区的可持续发展，增强了公众对公司的积极感知。"
                },
                {
                    "事件": "社区支持和发展项目",
                    "时间": "2020年7月",
                    "描述": "公司投资于当地社区，支持教育、健康和社会发展项目。",
                    "影响": "加深了公司与社区的联系，促进了社区的整体福祉和发展。"
                },
                {
                    "事件": "参与慈善活动",
                    "时间": "2020年8月",
                    "描述": "公司参与或资助慈善活动和慈善机构，以支持教育、健康、减贫等领域。",
                    "影响": "提高了公司的社会形象和品牌认知，加强了与社区的联系和支持。"
                },
                {
                    "事件": "员工多样性和包容性计划",
                    "时间": "2020年11月",
                    "描述": "公司实施多样性和包容性计划，促进员工的平等机会和公平待遇。",
                    "影响": "提高了员工的工作满意度和团队凝聚力，增强了公司的创新力和竞争力。"
                }
            ],
            "涉及的指标": [
                {
                    "指标": "员工满意度",
                    "描述": "通过调查得到的员工对公司环境和政策满意度的度量。",
                    "影响因素": [
                        "工作环境的改善",
                        "员工福利政策的调整"
                    ],
                    "值": "80%"
                },
                {
                    "指标": "社区投资额",
                    "描述": "公司在社区发展项目上的投资总额。",
                    "影响因素": [
                        "公司的财务状况",
                        "社会责任战略的变化"
                    ],
                    "值": "100万美元"
                }
            ]
        }
    ],
    "额外信息": [
        {
            "名称": "未来展望",
            "内容": [
                {
                    "名称": "环境保护计划",
                    "描述": "采取一系列措施减少其运营对环境的影响，包括进一步优化能源利用、推广低碳技术和建设绿色供应链等。"
                },
                {
                    "名称": "社会责任战略",
                    "描述": "在业务实践中积极履行社会责任，包括促进社区发展、改善员工福利、提供公平就业机会和参与公益活动。"
                },
                {
                    "名称": "可持续发展目标",
                    "描述": "通过整合可持续性原则到业务模型和决策过程中，致力于实现联合国可持续发展目标（SDGs），包括减少碳排放、提高员工幸福指数和推动数字包容性等。"
                }
            ]
        }
    ],
    "生成大纲": "公司环境与社会责任报告大纲\n\n一、公司信息\n1. 公司名称：创新科技有限公司\n2. 成立日期：2005年3月15日\n3. 主营业务：提供软件开发、数据分析和云计算解决方案\n4. 注册地：美国加利福尼亚州\n5. 上市情况：未上市\n6. 行业：IT\n\n二、环境责任\n1. 投资于碳抵消项目\n   - 时间：2020年1月\n   - 描述：公司通过投资林业项目或可再生能源项目来抵消其碳排放，努力实现碳中和目标。\n   - 影响：通过碳抵消证书，公司能够向利益相关者展示其对环境的承诺和责任。\n   - 子事件：\n     - 启动内部碳减排项目（2020年1月）\n       描述：公司决定启动内部碳减排项目，将研究和实施减少碳排放的策略和措施。\n       影响：为后续投资碳抵消项目提供了基础和依据。\n     - 与国际碳抵消组织合作（2020年2月）\n       描述：公司与国际碳抵消组织合作，通过购买碳抵消证书来补偿其碳排放。\n       影响：为公司提供了可靠的碳抵消证书，增加了对投资于碳抵消项目的可信度。\n\n2. 节能减排项目实施\n   - 时间：2020年3月\n   - 描述：公司投资实施的节能减排项目，旨在减少能源消耗和温室气体排放。\n   - 影响：直接减少了公司的能源消耗和碳足迹，提高了能效和环境绩效。\n\n3. 防止污染设施的建设\n   - 时间：2020年4月\n   - 描述：公司建立新的污染防治设施，如废水处理系统和排放控制设备，以减少环境污染。\n   - 影响：显著降低了公司的环境污染水平，增强了合规性和社会责任感。\n\n4. 能源利用优化\n   - 时间：2020年5月\n   - 描述：公司优化生产流程，改善能源利用效率，减少资源浪费。\n   - 影响：降低了能源成本，提高了公司的竞争力和可持续发展能力。\n\n5. 绿色产品开发\n   - 时间：2020年7月\n   - 描述：公司开发的环保型产品，减少对环境的影响。\n   - 影响：提升了产品的市场竞争力和品牌形象，同时减少了环境影响。\n\n6. 采用环境管理系统\n   - 时间：2020年12月\n   - 描述：公司实施环境管理系统（EMS），以提高环境绩效，减少废物产生，并确保合规。\n   - 影响：增强了公司的环境管理能力和持续改进，提升了合规性和市场认可度。\n\n涉及的指标：\n- 二氧化碳排放量：20000吨\n  - 影响因素：生产规模的变化，节能技术的应用\n- 能源消耗：100000 MWh\n  - 影响因素：生产效率的提高，能源管理措施的实施\n\n三、社会责任\n1. 员工健康与安全计划\n   - 时间：2020年1月\n   - 描述：公司实施的旨在提升员工健康与安全的措施。\n   - 影响：显著改善了工作环境，减少了工伤事故，提高了员工的健康与安全水平。\n\n2. 员工职业成长和人才发展计划\n   - 时间：2020年3月\n   - 描述：公司提供各类培训和发展项目，支持员工职业成长，包括在线课程、工作坊、导师计划等。\n   - 影响：提高了员工的专业技能和工作满意度，促进了人才的留存和发展。\n\n3. 参与公共服务项目\n   - 时间：2020年6月\n   - 描述：公司投资或参与公共服务项目，如城市绿化、公共卫生改善项目，以提升社区生活质量。\n   - 影响：促进了社区的可持续发展，增强了公众对公司的积极感知。\n\n4. 社区支持和发展项目\n   - 时间：2020年7月\n   - 描述：公司投资于当地社区，支持教育、健康和社会发展项目。\n   - 影响：加深了公司与社区的联系，促进了社区的整体福祉和发展。\n\n5. 参与慈善活动\n   - 时间：2020年8月\n   - 描述：公司参与或资助慈善活动和慈善机构，以支持教育、健康、减贫等领域。\n   - 影响：提高了公司的社会形象和品牌认知，加强了与社区的联系和支持。\n\n6. 员工多样性和包容性计划\n   - 时间：2020年11月\n   - 描述：公司实施多样性和包容性计划，促进员工的平等机会和公平待遇。\n   - 影响：提高了员工的工作满意度和团队凝聚力，增强了公司的创新力和竞争力。\n\n涉及的指标：\n- 员工满意度：80%\n  - 影响因素：工作环境的改善，员工福利政策的调整\n- 社区投资额：100万美元\n  - 影响因素：公司的财务状况，社会责任战略的变化\n\n四、未来展望\n1. 环境保护计划：采取一系列措施减少其运营对环境的影响，包括进一步优化能源利用、推广低碳技术和建设绿色供应链等。\n2. 社会责任战略：在业务实践中积极履行社会责任，包括促进社区发展、改善员工福利、提供公平就业机会和参与公益活动。\n3. 可持续发展目标：通过整合可持续性原则到业务模型和决策过程中，致力于实现联合国可持续发展目标（SDGs），包括减少碳排放、提高员工幸福指数和推动数字包容性等。",
    "生成总结": "创新科技有限公司是一家成立于2005年3月15日的美国加利福尼亚州注册的IT公司，主营业务包括软件开发、数据分析和云计算解决方案。该公司未上市。",
    "生成文章": "在环境责任方面，创新科技有限公司采取了一系列措施来减少对环境的影响。首先，公司于2020年1月投资于碳抵消项目，通过投资林业项目或可再生能源项目来抵消其碳排放，努力实现碳中和目标。为了支持这一举措，公司启动了内部碳减排项目，研究和实施减少碳排放的策略和措施。此外，公司与国际碳抵消组织合作，通过购买碳抵消证书来补偿其碳排放，增加了对投资于碳抵消项目的可信度。\n\n其次，创新科技有限公司于2020年3月实施了节能减排项目，旨在减少能源消耗和温室气体排放。这一举措直接减少了公司的能源消耗和碳足迹，提高了能效和环境绩效。\n\n另外，公司于2020年4月建立了新的污染防治设施，如废水处理系统和排放控制设备，以减少环境污染。这一举措显著降低了公司的环境污染水平，增强了合规性和社会责任感。\n\n此外，创新科技有限公司于2020年5月优化了生产流程，改善能源利用效率，减少资源浪费。这一举措降低了能源成本，提高了公司的竞争力和可持续发展能力。\n\n在产品方面，创新科技有限公司于2020年7月开发了环保型产品，减少对环境的影响。这一举措提升了产品的市场竞争力和品牌形象，同时减少了环境影响。\n\n为了加强环境管理能力和持续改进，创新科技有限公司于2020年12月实施了环境管理系统（EMS）。通过实施EMS，公司提高了环境绩效，减少了废物产生，并确保合规。这一举措增强了公司的环境管理能力和市场认可度。\n\n在社会责任方面，创新科技有限公司也采取了一系列措施。首先，公司于2020年1月实施了员工健康与安全计划，显著改善了工作环境，减少了工伤事故，提高了员工的健康与安全水平。\n\n此外，公司于2020年3月推出了员工职业成长和人才发展计划，提供各类培训和发展项目，支持员工职业成长。这一举措提高了员工的专业技能和工作满意度，促进了人才的留存和发展。\n\n创新科技有限公司还积极参与公共服务项目，如城市绿化、公共卫生改善项目，以提升社区生活质量。这一举措促进了社区的可持续发展，增强了公众对公司的积极感知。\n\n此外，公司于2020年7月投资于当地社区，支持教育、健康和社会发展项目。这一举措加深了公司与社区的联系，促进了社区的整体福祉和发展。\n\n创新科技有限公司还参与或资助慈善活动和慈善机构，支持教育、健康、减贫等领域。这一举措提高了公司的社会形象和品牌认知，加强了与社区的联系和支持。\n\n为了促进员工的平等机会和公平待遇，创新科技有限公司于2020年11月实施了员工多样性和包容性计划。这一举措提高了员工的工作满意度和团队凝聚力，增强了公司的创新力和竞争力。\n\n通过上述环境责任和社会责任的举措，创新科技有限公司取得了一定的成果。根据数据显示，公司的二氧化碳排放量从20000吨减少到了一定的数值，这主要得益于生产规模的变化和节能技术的应用。同时，公司的能源消耗也得到了一定程度的降低，这主要归功于生产效率的提高和能源管理措施的实施。\n\n在员工满意度方面，公司取得了较好的成绩，员工满意度达到了80%。这主要得益于工作环境的改善和员工福利政策的调整。\n\n此外，创新科技有限公司在社区投资方面也取得了一定的成果，投资额达到了100万美元。这主要受到公司财务状况和社会责任战略的变化的影响。\n\n展望未来，创新科技有限公司将继续致力于环境保护计划，采取一系列措施减少其运营对环境的影响。公司还将继续推进社会责任战略，积极履行社会责任，促进可持续发展。同时，公司将整合可持续性原则到业务模型和决策过程中，致力于实现联合国可持续发展目标（SDGs），包括减少碳排放、提高员工幸福指数和推动数字包容性等。\n\n综上所述，创新科技有限公司在环境责任和社会责任方面取得了一系列成果，通过投资碳抵消项目、实施节能减排项目、建设污染防治设施、优化能源利用、开发绿色产品、采用环境管理系统等措施，减少了对环境的影响，改善了员工的工作环境和福利，促进了社区的可持续发展，提高了公司的社会形象和市场竞争力。未来，公司将继续努力，为实现可持续发展目标做出更大的贡献。"
}