{
    "courtAndProcuratorate": {
        "court": "Farmington, Vandalia, Court",
        "procuratorate": "Farmington, Vandalia, Procuratorate"
    },
    "chiefJudge": "J. Martin",
    "judge": "V. Smith",
    "clerk": "W. Brooks",
    "defendant": {
        "name": "T. Bennett",
        "gender": "female",
        "birthdate": "8th, June, 1998",
        "residence": "45, Eastwood street, Vandalia",
        "ethnicity": "Caucasian",
        "occupation": "Self-Employed Consultant"
    },
    "defenseLawyer": {
        "name": "X. Sanders",
        "lawFirm": "Sanders & Associates Law Firm"
    },
    "caseProcess": [
        {
            "event": "Case Filing and Investigation",
            "date": "1st March, 2023",
            "description": "The Vandalia Tax Bureau conducted a preliminary investigation into the tax arrears of the defendant, T. Bennett, upon suspicion of evading tax recovery for the year 2022."
        },
        {
            "event": "Detention Measures Taken",
            "date": "15th March, 2023",
            "description": "Following the initial findings, detention measures were enforced to prevent flight risk and tampering with evidence."
        },
        {
            "event": "Criminal Detention",
            "date": "20th March, 2023",
            "description": "T. Bennett was formally detained under criminal custody upon further evidence corroborating the tax evasion allegations."
        },
        {
            "event": "Arrest",
            "date": "25th March, 2023",
            "description": "Arrest warrant was issued and executed on T. Bennett after substantial evidence was reviewed by the Farmington, Vandalia, Procuratorate."
        }
    ],
    "criminalFacts": [
        {
            "crimeName": "Crime of Evading Tax Arrears Recovery",
            "details": [
                {
                    "timePeriod": "January 2022 - December 2022",
                    "behavior": "T. Bennett transferred significant assets to her brother’s company in a deliberate attempt to avoid tax recovery measures.",
                    "evidence": "Bank statements showing transfers amounting to $120,000, testimony from the brother, and emails outlining the transfer process."
                },
                {
                    "timePeriod": "March 2022 - November 2022",
                    "behavior": "The defendant falsified accounts and underreported her consultancy income to evade taxes.",
                    "evidence": "Financial audit report detailing discrepancies, written confessions from two employees, and altered balance sheets recovered from her office."
                },
                {
                    "timePeriod": "June 2022",
                    "behavior": "T. Bennett sold a high-value property located at 123 Main Street, Vandalia, without reporting the transaction to the tax authorities.",
                    "evidence": "Property sales contract, testimony from the buyer, and email communication regarding the sale."
                }
            ]
        }
    ],
    "legalProcedure": {
        "judgmentDate": "15th June, 2023",
        "judgmentResult": [
            {
                "crimeName": "Crime of Evading Tax Arrears Recovery",
                "sentence": "5 years imprisonment and a fine of $300,000.",
                "sentencingConsiderations": "The significant amount of tax owed, the premeditated nature of the evasion, and lack of remorse displayed by the defendant were considered in the sentencing."
            }
        ],
        "probation": "None"
    },
    "Generated Article": "Farmington, Vandalia, Court\nFarmington, Vandalia, Procuratorate\n\nChief Judge: J. Martin\nJudge: V. Smith\nClerk: W. Brooks\n\n**Case Number: 2023/008**\n\n---\n\n**DEFENDANT AND DEFENSE LAWYER INFORMATION**\n\n**Defendant:**  \nName: T. Bennett  \nGender: Female  \nDate of Birth: 8th June 1998  \nResidence: 45, Eastwood Street, Vandalia  \nEthnicity: Caucasian  \nOccupation: Self-Employed Consultant  \n\n**Defense Lawyer:**  \nName: X. Sanders  \nLaw Firm: Sanders & Associates Law Firm\n\n---\n\n**CASE PROCEDURES**\n\nThis court duly examined the case against the defendant, T. Bennett, in strict accordance with the procedures dictated by law. The case underwent a series of investigatory and judicial steps, which commenced as follows:\n\n**1. Case Filing and Investigation (1st March 2023):**  \nThe Vandalia Tax Bureau initiated a preliminary investigation upon suspicion that T. Bennett had engaged in activities designed to evade tax recovery efforts. The investigation revealed potential tax evasion for the fiscal year 2022.\n\n**2. Detention Measures Taken (15th March 2023):**  \nDetention measures were imposed to prevent the possibility of flight risk by the defendant and to preserve the integrity of potential evidence. This step was taken amid extraordinary circumstances that presented a real risk of evasion.\n\n**3. Criminal Detention (20th March 2023):**  \nUpon accumulating further evidence confirming suspicions of tax evasion, the defendant was formally placed in criminal detention. This measure was undertaken to secure her presence as the investigations and legal processes continued.\n\n**4. Arrest (25th March 2023):**  \nOn careful examination and review of the accumulating evidence, the Farmington, Vandalia, Procuratorate issued an arrest warrant for the defendant. The arrest warrant was promptly executed, leading to the detention of T. Bennett.\n\n---\n\n**CASE STATEMENT**\n\nThe facts of the case reveal a systematic effort by the defendant, T. Bennett, to evade tax arrears recovery measures implemented by the authorities. The allegations are comprehensively supported by substantive evidence that places the culpability squarely on the defendant.\n\nT. Bennett, a self-employed consultant, failed to fulfill her tax obligations despite enjoying a lucrative income throughout 2022. The evidence reveals a series of calculated steps to transfer assets, falsify accounts, and underreport income, thus painstakingly orchestrating an elaborate scheme to defraud the state tax authorities.\n\nFurther delving into the specifics, it is alleged that from January 2022 to December 2022, the defendant transferred substantial sums of money to her brother’s company. The transactions intended to conceal assets and impair recovery efforts by the tax authorities. Bank statements elucidate many transfers amounting to $120,000, all of which substantiated by testimony from the defendant’s brother and emails mapping the detailed transfer process.\n\nSignificant misrepresentation and falsification of accounts were also observed between March 2022 and November 2022. The defendant perpetuated an illusion of underreporting her earnings by manipulating her consultancy income records. The financial audit report delineated glaring discrepancies in her financial statements, further corroborated by written confessions from two employees in her consultancy firm. Altered balance sheets recovered during a search of the defendant's office added a conspicuous layer of evidence showcasing intentional duplicity.\n\nMoreover, in June 2022, T. Bennett executed the sale of a high-value property located at 123 Main Street, Vandalia. This transaction was illicitly kept away from the purview of tax authorities. The sale was confirmed through a legally binding property contract, testimony from the purchaser, and email exchanges about the transaction.\n\n---\n\n**CHARGE**\n\nThe defendant, T. Bennett, was formally charged with the Crime of Evading Tax Arrears Recovery, a charge codified under No. 203 of our jurisdiction's penal code. The intent of her actions, coupled with substantial monetary value involved, compounded the crime's gravity.\n\n---\n\n**EVIDENCE DESCRIPTION**\n\nThe prosecution presented an exhaustive collection of evidence, each piece instrumental in framing the charges and establishing the defendant's culpability.\n\n**1. Bank Statements and Transfer Evidence:**  \nBank statements detailing transfers amounting to $120,000 from the defendant’s accounts to her brother’s company were pivotal. These statements outlined a clear trail of financial inconsistency and manipulation aimed at asset concealment. Furthermore, the brother’s testimony shed light on these transactions, confirming their deliberate design to evade tax authorities. Email correspondences elaborated on the transfer mechanics, providing unassailable documentary proof.\n\n**2. Financial Audit Report and Employee Confessions:**  \nThe financial audit report embarked on a deep dive into the defendant’s accounts and consultancy earnings, uncovering substantial discrepancies. False entries and manipulated records were meticulously highlighted, showing deliberate income underreporting. In tandem with this, written confessions from two employees detailed their involvement under the direction of T. Bennett in falsifying the consultancy earnings. Altered balance sheets retrieved during a search of the consultancy’s offices fortified the prosecution’s case.\n\n**3. Property Sale Contract and Buyer Testimony:**  \nThe sale contract for the high-value property provided undeniable evidence of the transaction. The testimony of the buyer affirmed the purchase, and the email exchanges confirmed the non-disclosure of this transaction to tax authorities. This segment of evidence pieced together the comprehensive picture of asset concealment.\n\n---\n\n**SENTENCING CONSIDERATIONS**\n\nIn deliberating the appropriate sentence for the defendant, T. Bennett, this court considered several aggravating and mitigating factors:\n\n**Aggravating Considerations:**\n1. **Significant Financial Impact:**  \nThe high monetary value involved in the tax evasion scheme represented substantial financial deprivation for the state tax authorities. The defendant’s deliberate actions leading to the non-recovery of substantial tax arrears necessitated strict penalties to deter similar future conduct.\n\n2. **Premeditation and Deliberation:**  \nThe premeditated nature of the defendant’s actions, including sophisticated financial manipulations and intentional non-disclosure of assets, accentuated the severity of the crime. The calculated efforts and systematic planning demonstrated a flagrant disregard for legal obligations.\n\n3. **Lack of Remorse:**  \nThroughout the investigatory and judicial processes, the defendant exhibited a profound lack of remorse or acknowledgment of wrongdoing. This attitude underscored the absence of rehabilitative potential and necessitated a more severe deterrent in sentencing.\n\n**Mitigating Considerations:**\nDespite thorough efforts by the defense, no significant mitigating circumstances were established that could mitigate the overwhelming evidence of guilt and the gravity of the offense.\n\n---\n\n**JUDGMENT RESULT**\n\nUpon thorough scrutiny of the evidence presented, the aggravated nature of the crime, the defendant’s lack of remorse, and in consideration of the applicable statutes under No. 203, this court arrives at the following judgment:\n\n**Charge: Crime of Evading Tax Arrears Recovery**\n\n**Sentence:**\n- Five years of imprisonment.\n- A fine of $300,000 payable within a stipulated period following the issuance of this judgment.\n\nThe sentence represents a balanced judgment meted out to serve as a deterrent to similar infractions. The incarceration period and the imposed fine reflect the significant economic injury inflicted upon the state due to the defendant’s illegal activities.\n\nProbation: None.\n\nThis sentence underscores this court's commitment to upholding the rule of law and ensuring stringent punishment for tax evasion activities, which undermine the fiscal responsibility and economic stability of our jurisdiction.\n\n---\n\n**APPEAL RIGHTS EXPLANATION**\n\nThis court hereby informs the defendant, T. Bennett, of her legal right to appeal this judgment. Under the provisions of the applicable statutes, she is entitled to file an appeal within [specific timeframe, typically 30 days] from the date of this judgment. The appeal process will allow for a re-examination of the case and the judgment rendered herein.\n\nShould the defendant choose to exercise this right, the appeal must be submitted in writing, specifying the grounds upon which the appeal is based. The appeal may challenge both the conviction and the sentence imposed and must conform to the established procedural requirements.\n\nThe necessary forms and guidance on the appeal process are available from the court’s clerk office. The defendant may also seek further assistance and consultation with her defense lawyer to ensure the proper filing of the appeal.\n\n---\n\nCONCLUSION\n\nThis court, in fulfilling its duty to administer justice, discerned the elements of deliberate tax evasion articulated in this case. Recognizing the essential role that tax compliance plays in the socio-economic fabric, the sentencing adheres to an ethos of deterrence, retribution, and education. Let this judgment serve as an unequivocal message to deter similar infractions, promoting adherence to financial and legal obligations by all citizens.\n\nThe court is adjourned.\n\n---\n\nClerk: W. Brooks\n\nDate: 15th June 2023\n\nReference Article is below：\nArticle 203\nTaxpayers who owe taxes and take measures such as transferring or hiding property to prevent the tax authorities from recovering the owed taxes, if the amount is more than 10,000 yuan but less than 100,000 yuan, shall be sentenced to fixed-term imprisonment of not more than three years or criminal detention, and shall also be fined one to five times the owed taxes; if the amount is more than 100,000 yuan, they shall be sentenced to fixed-term imprisonment of more than three years but not more than seven years, and shall also be fined one to five times the owed taxes.",
    "qa_fact_based": [
        {
            "question type": "Factual Question",
            "question": "According to the court judgment of Farmington, Vandalia, Court, what crime did T. Bennett commit?",
            "answer": "Crime of Evading Tax Arrears Recovery.",
            "ref": [
                "The defendant, T. Bennett, was formally charged with the Crime of Evading Tax Arrears Recovery, a charge codified under No. 203 of our jurisdiction's penal code.",
                "**Charge: Crime of Evading Tax Arrears Recovery**"
            ]
        },
        {
            "question type": "Factual Question",
            "question": "According to the court judgment of Farmington, Vandalia, Court, who was the chief judge?",
            "answer": "J. Martin.",
            "ref": [
                "Chief Judge: J. Martin"
            ]
        },
        {
            "question type": "Factual Question",
            "question": "According to the court judgment of Farmington, Vandalia, Court, what was the judgment date?",
            "answer": "15th June, 2023.",
            "ref": [
                "Date: 15th June 2023"
            ]
        },
        {
            "question type": "Factual Question",
            "question": "According to the court judgment of Farmington, Vandalia, Court, what was the location of the high-value property sold by T. Bennett?",
            "answer": "123 Main Street, Vandalia.",
            "ref": [
                "Moreover, in June 2022, T. Bennett executed the sale of a high-value property located at 123 Main Street, Vandalia."
            ]
        },
        {
            "question type": "Factual Question",
            "question": "According to the court judgment of Farmington, Vandalia, Court, what was the occupation of T. Bennett?",
            "answer": "Self-Employed Consultant.",
            "ref": [
                "Occupation: Self-Employed Consultant",
                "T. Bennett, a self-employed consultant, failed to fulfill her tax obligations despite enjoying a lucrative income throughout 2022."
            ]
        }
    ],
    "qa_multi_hop": [
        {
            "question type": "Multi-hop Reasoning Question",
            "question": "According to the judgment of Farmington, Vandalia, Court, how many distinct tax evasion behaviors did T. Bennett engage in?",
            "answer": "According to the judgment, T. Bennett engaged in three distinct tax evasion behaviors: transferring assets to her brother’s company, falsifying accounts, and selling a high-value property without reporting the transaction.",
            "ref": [
                "Further delving into the specifics, it is alleged that from January 2022 to December 2022, the defendant transferred substantial sums of money to her brother’s company.",
                "Significant misrepresentation and falsification of accounts were also observed between March 2022 and November 2022.",
                "Moreover, in June 2022, T. Bennett executed the sale of a high-value property located at 123 Main Street, Vandalia."
            ]
        },
        {
            "question type": "Multi-hop Reasoning Question",
            "question": "According to the judgment of Farmington, Vandalia, Court, how many pieces of evidence were presented to support the tax evasion charges against T. Bennett?",
            "answer": "According to the judgment, a total of nine pieces of evidence were presented to support the tax evasion charges against T. Bennett: bank statements, testimony from her brother, emails outlining the transfer, a financial audit report, written confessions from two employees, altered balance sheets, a property sales contract, testimony from the buyer, and email communication regarding the sale.",
            "ref": [
                "Bank statements detailing transfers amounting to $120,000 from the defendant’s accounts to her brother’s company were pivotal.",
                "Furthermore, the brother’s testimony shed light on these transactions, confirming their deliberate design to evade tax authorities.",
                "Email correspondences elaborated on the transfer mechanics, providing unassailable documentary proof.",
                "The financial audit report embarked on a deep dive into the defendant’s accounts and consultancy earnings, uncovering substantial discrepancies.",
                "In tandem with this, written confessions from two employees detailed their involvement under the direction of T. Bennett in falsifying the consultancy earnings.",
                "Altered balance sheets retrieved during a search of the consultancy’s offices fortified the prosecution’s case.",
                "The sale contract for the high-value property provided undeniable evidence of the transaction.",
                "The testimony of the buyer affirmed the purchase, and the email exchanges confirmed the non-disclosure of this transaction to tax authorities.",
                "This segment of evidence pieced together the comprehensive picture of asset concealment."
            ]
        }
    ],
    "qa_summary": [
        {
            "question type": "Summarization Question",
            "question": "According to the judgment of Farmington, Vandalia, Court, summarize the facts of T. Bennett's crimes.",
            "answer": "T. Bennett committed the crime of evading tax arrears recovery. From January 2022 to December 2022, she transferred significant assets to her brother’s company to avoid tax recovery measures. From March 2022 to November 2022, she falsified accounts and underreported her consultancy income to evade taxes. In June 2022, she sold a high-value property located at 123 Main Street, Vandalia, without reporting the transaction to the tax authorities.",
            "ref": [
                "The facts of the case reveal a systematic effort by the defendant, T. Bennett, to evade tax arrears recovery measures implemented by the authorities.",
                "The allegations are comprehensively supported by substantive evidence that places the culpability squarely on the defendant.",
                "T. Bennett, a self-employed consultant, failed to fulfill her tax obligations despite enjoying a lucrative income throughout 2022.",
                "The evidence reveals a series of calculated steps to transfer assets, falsify accounts, and underreport income, thus painstakingly orchestrating an elaborate scheme to defraud the state tax authorities.",
                "Further delving into the specifics, it is alleged that from January 2022 to December 2022, the defendant transferred substantial sums of money to her brother’s company.",
                "The transactions intended to conceal assets and impair recovery efforts by the tax authorities.",
                "Bank statements elucidate many transfers amounting to $120,000, all of which substantiated by testimony from the defendant’s brother and emails mapping the detailed transfer process.",
                "Significant misrepresentation and falsification of accounts were also observed between March 2022 and November 2022.",
                "The defendant perpetuated an illusion of underreporting her earnings by manipulating her consultancy income records.",
                "The financial audit report delineated glaring discrepancies in her financial statements, further corroborated by written confessions from two employees in her consultancy firm.",
                "Altered balance sheets recovered during a search of the defendant's office added a conspicuous layer of evidence showcasing intentional duplicity.",
                "Moreover, in June 2022, T. Bennett executed the sale of a high-value property located at 123 Main Street, Vandalia.",
                "This transaction was illicitly kept away from the purview of tax authorities.",
                "The sale was confirmed through a legally binding property contract, testimony from the purchaser, and email exchanges about the transaction."
            ]
        },
        {
            "question type": "Summarization Question",
            "question": "According to the judgment of Farmington, Vandalia, Court, summarize the evidence of T. Bennett's crimes.",
            "answer": "The evidence includes bank statements showing transfers amounting to $120,000, testimony from T. Bennett's brother, emails outlining the transfer process, a financial audit report detailing discrepancies, written confessions from two employees, altered balance sheets recovered from her office, a property sales contract, testimony from the buyer, and email communication regarding the sale.",
            "ref": [
                "Bank statements elucidate many transfers amounting to $120,000, all of which substantiated by testimony from the defendant’s brother and emails mapping the detailed transfer process.",
                "Bank statements detailing transfers amounting to $120,000 from the defendant’s accounts to her brother’s company were pivotal.",
                "These statements outlined a clear trail of financial inconsistency and manipulation aimed at asset concealment.",
                "Furthermore, the brother’s testimony shed light on these transactions, confirming their deliberate design to evade tax authorities.",
                "Email correspondences elaborated on the transfer mechanics, providing unassailable documentary proof.",
                "The financial audit report embarked on a deep dive into the defendant’s accounts and consultancy earnings, uncovering substantial discrepancies.",
                "False entries and manipulated records were meticulously highlighted, showing deliberate income underreporting.",
                "In tandem with this, written confessions from two employees detailed their involvement under the direction of T. Bennett in falsifying the consultancy earnings.",
                "Altered balance sheets retrieved during a search of the consultancy’s offices fortified the prosecution’s case.",
                "The sale contract for the high-value property provided undeniable evidence of the transaction.",
                "The testimony of the buyer affirmed the purchase, and the email exchanges confirmed the non-disclosure of this transaction to tax authorities.",
                "This segment of evidence pieced together the comprehensive picture of asset concealment."
            ]
        },
        {
            "question type": "Summarization Question",
            "question": "According to the judgment of Farmington, Vandalia, Court, summarize the case process of T. Bennett.",
            "answer": "The case process began with the Vandalia Tax Bureau conducting a preliminary investigation into T. Bennett's tax arrears on 1st March, 2023. Detention measures were taken on 15th March, 2023, to prevent flight risk and tampering with evidence. T. Bennett was formally detained under criminal custody on 20th March, 2023, upon further evidence corroborating the tax evasion allegations. An arrest warrant was issued and executed on 25th March, 2023, after substantial evidence was reviewed by the Farmington, Vandalia, Procuratorate.",
            "ref": [
                "The Vandalia Tax Bureau initiated a preliminary investigation upon suspicion that T. Bennett had engaged in activities designed to evade tax recovery efforts.",
                "The investigation revealed potential tax evasion for the fiscal year 2022.",
                "Detention Measures Taken (15th March 2023):**",
                "Detention measures were imposed to prevent the possibility of flight risk by the defendant and to preserve the integrity of potential evidence.",
                "This step was taken amid extraordinary circumstances that presented a real risk of evasion.",
                "Upon accumulating further evidence confirming suspicions of tax evasion, the defendant was formally placed in criminal detention.",
                "This measure was undertaken to secure her presence as the investigations and legal processes continued.",
                "On careful examination and review of the accumulating evidence, the Farmington, Vandalia, Procuratorate issued an arrest warrant for the defendant.",
                "The arrest warrant was promptly executed, leading to the detention of T. Bennett."
            ]
        },
        {
            "question type": "Summarization Question",
            "question": "According to the judgment of Farmington, Vandalia, Court, summarize the judgment result for T. Bennett.",
            "answer": "T. Bennett was found guilty of the crime of evading tax arrears recovery and was sentenced to 5 years imprisonment and a fine of $300,000. The sentencing considerations included the significant amount of tax owed, the premeditated nature of the evasion, and the lack of remorse displayed by the defendant. No probation was granted.",
            "ref": [
                "The defendant, T. Bennett, was formally charged with the Crime of Evading Tax Arrears Recovery, a charge codified under No. 203 of our jurisdiction's penal code.",
                "The intent of her actions, coupled with substantial monetary value involved, compounded the crime's gravity.",
                "Upon thorough scrutiny of the evidence presented, the aggravated nature of the crime, the defendant’s lack of remorse, and in consideration of the applicable statutes under No. 203, this court arrives at the following judgment:",
                "**Charge: Crime of Evading Tax Arrears Recovery**",
                "**Sentence:**",
                "- Five years of imprisonment.",
                "- A fine of $300,000 payable within a stipulated period following the issuance of this judgment.",
                "The sentence represents a balanced judgment meted out to serve as a deterrent to similar infractions.",
                "The incarceration period and the imposed fine reflect the significant economic injury inflicted upon the state due to the defendant’s illegal activities.",
                "Probation: None.",
                "This sentence underscores this court's commitment to upholding the rule of law and ensuring stringent punishment for tax evasion activities, which undermine the fiscal responsibility and economic stability of our jurisdiction."
            ]
        }
    ]
}