{
    "报告类型": "公司环境与社会责任报告",
    "报告时间": "2017年度",
    "公司信息": {
        "名称": "金融优势有限公司",
        "成立日期": "2005年3月12日",
        "主营业务": "金融服务，包括贷款、投资咨询等",
        "注册地": "上海市",
        "上市情况": "未上市",
        "行业": "金融"
    },
    "报告内容": [
        {
            "类型": "环境责任",
            "重要事件": [
                {
                    "事件": "防止污染设施的建设",
                    "时间": "2017年1月",
                    "描述": "公司建立新的污染防治设施，如废水处理系统和排放控制设备，以减少环境污染。",
                    "影响": "显著降低了公司的环境污染水平，增强了合规性和社会责任感。",
                    "子事件": [
                        {
                            "事件": "环境评估",
                            "时间": "2016年7月-2016年12月",
                            "描述": "金融优势有限公司进行了一次全面的环境评估，评估了公司的环境影响和污染排放情况。",
                            "影响": "环境评估结果显示，公司存在较高的环境污染水平和排放问题，需要建立新的污染防治设施来改善状况。"
                        },
                        {
                            "事件": "技术研究与选型",
                            "时间": "2016年12月-2017年1月",
                            "描述": "金融优势有限公司进行了大量的技术研究和设备选型工作，以确定适合公司需求的废水处理系统和排放控制设备。",
                            "影响": "通过技术研究和选型，公司确定了最佳的污染防治设施方案，为后续建设和改善提供了基础。"
                        },
                        {
                            "事件": "污染防治设施建设",
                            "时间": "2017年1月",
                            "描述": "金融优势有限公司开始建设新的污染防治设施，包括废水处理系统和排放控制设备。",
                            "影响": "污染防治设施的建设使得公司的环境污染水平得以显著降低，达到环保要求，提升了合规性和社会责任感。"
                        }
                    ]
                },
                {
                    "事件": "采用环境管理系统",
                    "时间": "2017年5月",
                    "描述": "公司实施环境管理系统（EMS），以提高环境绩效，减少废物产生，并确保合规。",
                    "影响": "增强了公司的环境管理能力和持续改进，提升了合规性和市场认可度。"
                },
                {
                    "事件": "节能减排项目实施",
                    "时间": "2017年7月",
                    "描述": "公司投资实施的节能减排项目，旨在减少能源消耗和温室气体排放。",
                    "影响": "直接减少了公司的能源消耗和碳足迹，提高了能效和环境绩效。"
                },
                {
                    "事件": "绿色产品开发",
                    "时间": "2017年8月",
                    "描述": "公司开发的环保型产品，减少对环境的影响。",
                    "影响": "提升了产品的市场竞争力和品牌形象，同时减少了环境影响。"
                },
                {
                    "事件": "投资于碳抵消项目",
                    "时间": "2017年10月",
                    "描述": "公司通过投资林业项目或可再生能源项目来抵消其碳排放，努力实现碳中和目标。",
                    "影响": "通过碳抵消证书，公司能够向利益相关者展示其对环境的承诺和责任。"
                }
            ],
            "涉及的指标": [
                {
                    "指标": "二氧化碳排放量",
                    "描述": "公司在生产过程中产生的二氧化碳总量。",
                    "影响因素": [
                        "生产规模的变化",
                        "节能技术的应用"
                    ],
                    "值": "70000吨"
                },
                {
                    "指标": "能源消耗",
                    "描述": "公司在运营过程中消耗的能源总量。",
                    "影响因素": [
                        "生产效率的提高",
                        "能源管理措施的实施"
                    ],
                    "值": "50000吨等价标准煤"
                }
            ]
        },
        {
            "类型": "社会责任",
            "重要事件": [
                {
                    "事件": "参与慈善活动",
                    "时间": "2017年3月",
                    "描述": "公司参与或资助慈善活动和慈善机构，以支持教育、健康、减贫等领域。",
                    "影响": "提高了公司的社会形象和品牌认知，加强了与社区的联系和支持。"
                },
                {
                    "事件": "社区支持和发展项目",
                    "时间": "2017年4月",
                    "描述": "公司投资于当地社区，支持教育、健康和社会发展项目。",
                    "影响": "加深了公司与社区的联系，促进了社区的整体福祉和发展。"
                },
                {
                    "事件": "员工健康与安全计划",
                    "时间": "2017年5月",
                    "描述": "公司实施的旨在提升员工健康与安全的措施。",
                    "影响": "显著改善了工作环境，减少了工伤事故，提高了员工的健康与安全水平。"
                },
                {
                    "事件": "员工职业成长和人才发展计划",
                    "时间": "2017年6月",
                    "描述": "公司提供各类培训和发展项目，支持员工职业成长，包括在线课程、工作坊、导师计划等。",
                    "影响": "提高了员工的专业技能和工作满意度，促进了人才的留存和发展。"
                },
                {
                    "事件": "参与公共服务项目",
                    "时间": "2017年12月",
                    "描述": "公司投资或参与公共服务项目，如城市绿化、公共卫生改善项目，以提升社区生活质量。",
                    "影响": "促进了社区的可持续发展，增强了公众对公司的积极感知。"
                }
            ],
            "涉及的指标": [
                {
                    "指标": "员工满意度",
                    "描述": "通过调查得到的员工对公司环境和政策满意度的度量。",
                    "影响因素": [
                        "工作环境的改善",
                        "员工福利政策的调整"
                    ],
                    "值": "85%"
                },
                {
                    "指标": "社区投资额",
                    "描述": "公司在社区发展项目上的投资总额。",
                    "影响因素": [
                        "公司的财务状况",
                        "社会责任战略的变化"
                    ],
                    "值": "500,000美元"
                }
            ]
        }
    ],
    "额外信息": [
        {
            "名称": "未来展望",
            "内容": [
                {
                    "名称": "环境保护计划",
                    "描述": "采取一系列措施减少其运营对环境的影响。"
                },
                {
                    "名称": "社会责任战略",
                    "描述": "在业务实践中积极履行社会责任，包括促进社区发展、改善员工福利、提供公平就业机会和参与公益活动。"
                },
                {
                    "名称": "可持续发展目标",
                    "描述": "通过整合可持续性原则到业务模型和决策过程中，致力于实现联合国可持续发展目标（SDGs）。"
                }
            ]
        }
    ],
    "生成大纲": "公司环境与社会责任报告大纲\n\n1. 公司信息\n- 公司名称: 金融优势有限公司\n- 成立日期: 2005年3月12日\n- 主营业务: 金融服务，包括贷款、投资咨询等\n- 注册地: 上海市\n- 上市情况: 未上市\n- 行业: 金融\n\n2. 环境责任\n2.1 防止污染设施的建设\n- 时间: 2017年1月\n- 描述: 公司建立新的污染防治设施，如废水处理系统和排放控制设备，以减少环境污染。\n- 影响: 显著降低了公司的环境污染水平，增强了合规性和社会责任感。\n- 子事件:\n  - 环境评估 (时间: 2016年7月-2016年12月)\n  - 技术研究与选型 (时间: 2016年12月-2017年1月)\n  - 污染防治设施建设 (时间: 2017年1月)\n\n2.2 采用环境管理系统\n- 时间: 2017年5月\n- 描述: 公司实施环境管理系统（EMS），以提高环境绩效，减少废物产生，并确保合规。\n- 影响: 增强了公司的环境管理能力和持续改进，提升了合规性和市场认可度。\n\n2.3 节能减排项目实施\n- 时间: 2017年7月\n- 描述: 公司投资实施的节能减排项目，旨在减少能源消耗和温室气体排放。\n- 影响: 直接减少了公司的能源消耗和碳足迹，提高了能效和环境绩效。\n\n2.4 绿色产品开发\n- 时间: 2017年8月\n- 描述: 公司开发的环保型产品，减少对环境的影响。\n- 影响: 提升了产品的市场竞争力和品牌形象，同时减少了环境影响。\n\n2.5 投资于碳抵消项目\n- 时间: 2017年10月\n- 描述: 公司通过投资林业项目或可再生能源项目来抵消其碳排放，努力实现碳中和目标。\n- 影响: 通过碳抵消证书，公司能够向利益相关者展示其对环境的承诺和责任。\n\n3. 社会责任\n3.1 参与慈善活动\n- 时间: 2017年3月\n- 描述: 公司参与或资助慈善活动和慈善机构，以支持教育、健康、减贫等领域。\n- 影响: 提高了公司的社会形象和品牌认知，加强了与社区的联系和支持。\n\n3.2 社区支持和发展项目\n- 时间: 2017年4月\n- 描述: 公司投资于当地社区，支持教育、健康和社会发展项目。\n- 影响: 加深了公司与社区的联系，促进了社区的整体福祉和发展。\n\n3.3 员工健康与安全计划\n- 时间: 2017年5月\n- 描述: 公司实施的旨在提升员工健康与安全的措施。\n- 影响: 显著改善了工作环境，减少了工伤事故，提高了员工的健康与安全水平。\n\n3.4 员工职业成长和人才发展计划\n- 时间: 2017年6月\n- 描述: 公司提供各类培训和发展项目，支持员工职业成长，包括在线课程、工作坊、导师计划等。\n- 影响: 提高了员工的专业技能和工作满意度，促进了人才的留存和发展。\n\n3.5 参与公共服务项目\n- 时间: 2017年12月\n- 描述: 公司投资或参与公共服务项目，如城市绿化、公共卫生改善项目，以提升社区生活质量。\n- 影响: 促进了社区的可持续发展，增强了公众对公司的积极感知。\n\n4. 涉及的指标\n4.1 环境责任指标\n- 二氧化碳排放量: 70000吨\n  - 影响因素: 生产规模的变化, 节能技术的应用\n- 能源消耗: 50000吨等价标准煤\n  - 影响因素: 生产效率的提高, 能源管理措施的实施\n\n4.2 社会责任指标\n- 员工满意度: 85%\n  - 影响因素: 工作环境的改善, 员工福利政策的调整\n- 社区投资额: 500,000美元\n  - 影响因素: 公司的财务状况, 社会责任战略的变化\n\n5. 未来展望\n- 环境保护计划: 采取一系列措施减少其运营对环境的影响。\n- 社会责任战略: 在业务实践中积极履行社会责任，包括促进社区发展、改善员工福利、提供公平就业机会和参与公益活动。\n- 可持续发展目标: 通过整合可持续性原则到业务模型和决策过程中，致力于实现联合国可持续发展目标（SDGs）。\n\n以上是金融优势有限公司的公司环境与社会责任报告大纲，包括公司信息、重要事件、涉及的指标和未来展望。",
    "生成总结": "金融优势有限公司成立于2005年3月12日，位于上海市，是一家主要提供金融服务的公司，包括贷款和投资咨询等业务。",
    "生成文章": "在环境责任方面，金融优势有限公司采取了一系列措施来减少对环境的影响。首先，在2017年1月，公司建立了新的污染防治设施，包括废水处理系统和排放控制设备，以减少环境污染。这一举措显著降低了公司的环境污染水平，增强了合规性和社会责任感。在此过程中，公司进行了环境评估，并进行了技术研究和选型，最终建设了污染防治设施。\n\n另外，为了提高环境绩效并确保合规，公司在2017年5月实施了环境管理系统（EMS）。通过采用EMS，公司能够更好地管理环境问题，减少废物产生，并持续改进环境绩效。这一举措提高了公司的环境管理能力和市场认可度。\n\n为了减少能源消耗和温室气体排放，金融优势有限公司在2017年7月投资实施了节能减排项目。这些项目的实施直接减少了公司的能源消耗和碳足迹，提高了能效和环境绩效。\n\n此外，公司还致力于开发绿色产品，减少对环境的影响。在2017年8月，金融优势有限公司推出了一系列环保型产品，这些产品不仅提升了公司的市场竞争力和品牌形象，还减少了对环境的影响。\n\n为了实现碳中和目标，公司于2017年10月开始投资于碳抵消项目。通过投资林业项目或可再生能源项目，公司努力抵消其碳排放，向利益相关者展示其对环境的承诺和责任。\n\n在社会责任方面，金融优势有限公司积极参与慈善活动。在2017年3月，公司参与或资助了多个慈善活动和慈善机构，支持教育、健康、减贫等领域。这些活动提高了公司的社会形象和品牌认知，并加强了与社区的联系和支持。\n\n此外，公司还投资于当地社区，支持教育、健康和社会发展项目。这些投资加深了公司与社区的联系，促进了社区的整体福祉和发展。\n\n为了提升员工的健康与安全水平，金融优势有限公司于2017年5月实施了员工健康与安全计划。通过改善工作环境和采取相应的措施，公司显著减少了工伤事故，提高了员工的健康与安全水平。\n\n此外，公司还提供各类培训和发展项目，支持员工的职业成长。这些项目包括在线课程、工作坊和导师计划等，提高了员工的专业技能和工作满意度，促进了人才的留存和发展。\n\n金融优势有限公司还积极参与公共服务项目，如城市绿化和公共卫生改善项目。通过投资或参与这些项目，公司提升了社区的可持续发展，增强了公众对公司的积极感知。\n\n在涉及的指标方面，金融优势有限公司关注二氧化碳排放量和能源消耗。根据数据显示，公司的二氧化碳排放量为70000吨，能源消耗为50000吨等价标准煤。这些指标受到生产规模的变化、节能技术的应用以及生产效率的提高和能源管理措施的实施等因素的影响。\n\n展望未来，金融优势有限公司将继续采取一系列措施来减少其运营对环境的影响。公司将在业务实践中积极履行社会责任，包括促进社区发展、改善员工福利、提供公平就业机会和参与公益活动。同时，公司将整合可持续性原则到业务模型和决策过程中，致力于实现联合国可持续发展目标（SDGs）。\n\n通过以上的环境责任和社会责任举措，金融优势有限公司在不断提升自身的可持续发展能力的同时，也为社会和环境做出了积极的贡献。"
}