{
    "住院病历": {
        "基本信息": {
            "姓名": "葛某某",
            "性别": "女",
            "年龄": "出生9个小时",
            "民族": "汉族",
            "婚姻状况": "未婚",
            "职业": "无",
            "住址": "黄埔市梨园街98号",
            "入院时间": "12月5日",
            "记录时间": "12月5日 13:00",
            "病史陈述者": "母亲",
            "医院名称": "黄埔市妇幼保健院"
        },
        "主诉": "复苏后即出现呼吸困难、青紫，伴从口腔中流出液体或泡沫，入院12小时",
        "现病史": {
            "发病情况": "12月5日出生后即出现呼吸困难和青紫，由黄埔市梨园街98号家中被紧急送往黄埔市妇幼保健院。起病急，复苏后病情未见缓解，可能与羊水吸入有关。",
            "主要症状特点": "复苏后即刻出现呼吸困难和青紫，口腔中有液体或泡沫流出，肺部听诊有湿啰音。拒绝乳汁，呼吸困难随时间加剧。",
            "伴随症状": "除呼吸困难和青紫外，无其他明显症状。",
            "诊疗经过及结果": "入院前在家中接受简单复苏措施，效果不佳，因此被送入妇幼保健院后接受进一步治疗，包括吸氧、吸痰及抗感染治疗。",
            "一般情况变化": "精神状态尚可，但呼吸困难明显，睡眠和食欲尚未有大的变化，大小便正常，体重无明显变化。"
        },
        "既往史": {
            "一般健康状况": "出生仅9小时，无已知健康问题。",
            "疾病史": "无",
            "传染病史": "无",
            "预防接种史": "未接种",
            "手术外伤史": "无",
            "输血史": "无",
            "过敏史": "无"
        },
        "个人史": {
            "出生地": "黄埔市",
            "居留地": "黄埔市梨园街98号",
            "生活习惯": "新生儿，无特定生活习惯",
            "职业及工作条件": "新生儿，无职业",
            "接触史": "无",
            "冶游史": "无"
        },
        "婚育史及家族史": {
            "婚育史": {
                "婚姻状况": "无",
                "结婚年龄": "无",
                "配偶健康状况": "无",
                "子女情况": "无"
            },
            "月经史": {
                "初潮年龄": "无",
                "行经期天数": "无",
                "间隔天数": "无",
                "末次月经时间": "无",
                "月经量": "无",
                "痛经情况": "无"
            },
            "家族史": "父母健康状况良好，无类似疾病及遗传倾向"
        },
        "体格检查": {
            "一般情况": {
                "体温": "37℃",
                "脉搏": "150次/分",
                "呼吸": "60次/分",
                "血压": "无法测量"
            },
            "系统检查": {
                "皮肤": "轻度青紫",
                "粘膜": "湿润，轻度青紫",
                "淋巴结": "未触及异常",
                "头部及器官": "无异常",
                "颈部": "无异常",
                "胸部": "呼吸急促，肺部听诊有湿啰音，心脏无杂音",
                "腹部": "软，肝脾未触及",
                "直肠肛门": "未检查",
                "外生殖器": "女性外生殖器正常",
                "脊柱": "无异常",
                "四肢": "无畸形，肌张力正常",
                "神经系统": "无明显神经系统异常"
            }
        },
        "专科检查": "胸部X光示双肺纹理增多及模糊，局限性肺部阴影",
        "辅助检查": "血气分析示轻度低氧血症；白细胞计数升高，提示感染；胸部X光示双肺纹理增多及模糊",
        "初步诊断": "新生儿羊水吸入性肺炎",
        "诊断依据": "1. 出生后即出现呼吸困难和青紫。2. 口腔中流出液体或泡沫。3. 肺部听诊有湿啰音。4. 辅助检查如血气分析和胸部X光结果符合。",
        "鉴别诊断": "胎粪吸入性肺炎：复苏后即出现呼吸浅快（>60次/分），鼻煽、三凹征、呻吟和发绀；乳汁吸入性肺炎：哺乳后突然出现呼吸停止、青紫或呛咳，气道内有乳汁。",
        "入院记录": {
            "医师签名": "张医生"
        },
        "入院后病程记录": {
            "首次病程记录": "病情急性起病，患者复苏后依然呼吸困难及青紫，辅助检查符合新生儿羊水吸入性肺炎的诊断。计划给予吸氧、吸痰、抗感染治疗，并密切监测病情变化。",
            "日常病程记录": "12月6日：患者呼吸情况稍有好转，仍需吸氧辅助，抗感染治疗继续。12月7日：患者青紫有所缓解，但仍有呼吸困难，呼吸音稍好转。",
            "上级医师查房记录": "上级医师认为诊断准确，继续当前治疗方案，建议密切观察。",
            "疑难病例讨论记录": "",
            "交（接）班记录": "患者入院时状态危急，经初步处理后状态稳定，需继续观察治疗。",
            "转科记录": "",
            "阶段小结": "患者病情相对稳定，但仍需继续治疗和观察。",
            "抢救记录": "",
            "有创诊疗操作记录": "",
            "会诊记录": "",
            "出院记录": "暂无",
            "病重（病危）患者护理记录": ""
        },
        "医嘱": {
            "长期医嘱单": "吸氧、抗感染治疗、吸痰、定期血气分析",
            "临时医嘱单": "如呼吸困难加剧，立即通知医生"
        },
        "辅助检查报告单": "血气分析：轻度低氧血症；胸部X光：双肺纹理增多及模糊",
        "体温单": "体温：37℃，脉搏：150次/分，呼吸：60次/分，血压：无法测量",
        "输血治疗知情同意书": "",
        "特殊检查同意书": "",
        "病危（重）通知书": ""
    },
    "病种": {
        "起源于围产期的情况": {
            "名称": "新生儿羊水吸入性肺炎",
            "症状": "复苏后即出现呼吸困难、青紫，可从口腔中流出液体或泡沫，肺部听诊有湿啰音",
            "鉴别诊断": "胎粪吸入性肺炎（复苏后即出现呼吸浅快（>60次/分）、鼻煽、三凹征、呻吟和发绀）、乳汁吸入性肺炎（哺乳后突然出现呼吸停止、青紫或呛咳，气道内有乳汁吸出）"
        }
    },
    "生成文章": "病历全文如下：\n\n黄埔市妇幼保健院\n黄埔市梨园街98号\n住院病历\n\n记录时间：12月5日 13:00\n\n姓名：葛某某    性别：女    年龄：出生9个小时\n民族：汉族    婚姻状况：未婚    职业：无    住址：黄埔市梨园街98号\n\n入院时间：12月5日     病史陈述者：母亲\n\n主诉：\n复苏后即出现呼吸困难、青紫，伴从口腔中流出液体或泡沫，入院12小时。\n\n现病史：\n发病情况：\n葛某某于12月5日出生后即出现呼吸困难和青紫，由黄埔市梨园街98号家中紧急送往黄埔市妇幼保健院。病情起病急，复苏后病情未见缓解，可能与羊水吸入有关。\n\n主要症状特点：\n复苏后即刻出现呼吸困难和青紫，口腔中有液体或泡沫流出，肺部听诊有湿啰音。拒绝乳汁，呼吸困难随时间加剧。\n\n伴随症状：\n除呼吸困难和青紫外，无其他明显症状。\n\n诊疗经过及结果：\n入院前在家中接受简单复苏措施，效果不佳，因此被送入妇幼保健院后接受进一步治疗，包括吸氧、吸痰及抗感染治疗。\n\n一般情况变化：\n精神状态尚可，但呼吸困难明显，睡眠和食欲尚未有大的变化，大小便正常，体重无明显变化。\n\n既往史：\n一般健康状况：出生仅9小时，无已知健康问题。\n疾病史：无\n传染病史：无\n预防接种史：未接种\n手术外伤史：无\n输血史：无\n过敏史：无\n\n个人史：\n出生地：黄埔市\n居留地：黄埔市梨园街98号\n生活习惯：新生儿，无特定生活习惯\n职业及工作条件：新生儿，无职业\n接触史：无\n冶游史：无\n\n婚育史及家族史：\n婚育史：\n婚姻状况：无\n结婚年龄：无\n配偶健康状况：无\n子女情况：无\n\n月经史：\n初潮年龄：无\n行经期天数：无\n间隔天数：无\n末次月经时间：无\n月经量：无\n痛经情况：无\n\n家族史：\n父母健康状况良好，无类似疾病及遗传倾向\n\n体格检查：\n一般情况：\n体温：37℃\n脉搏：150次/分\n呼吸：60次/分\n血压：无法测量\n\n系统检查：\n皮肤：轻度青紫\n粘膜：湿润，轻度青紫\n淋巴结：未触及异常\n头部及器官：无异常\n颈部：无异常\n胸部：呼吸急促，肺部听诊有湿啰音，心脏无杂音\n腹部：软，肝脾未触及\n直肠肛门：未检查\n外生殖器：女性外生殖器正常\n脊柱：无异常\n四肢：无畸形，肌张力正常\n神经系统：无明显神经系统异常\n\n专科检查：\n胸部X光示双肺纹理增多及模糊，局限性肺部阴影\n\n辅助检查：\n血气分析示轻度低氧血症；白细胞计数升高，提示感染；胸部X光示双肺纹理增多及模糊\n\n初步诊断：\n新生儿羊水吸入性肺炎\n\n诊断依据：\n1. 出生后即出现呼吸困难和青紫。\n2. 口腔中流出液体或泡沫。\n3. 肺部听诊有湿啰音。\n4. 辅助检查如血气分析和胸部X光结果符合。\n\n鉴别诊断：\n胎粪吸入性肺炎：复苏后即出现呼吸浅快（>60次/分）、鼻煽、三凹征、呻吟和发绀。\n乳汁吸入性肺炎：哺乳后突然出现呼吸停止、青紫或呛咳，气道内有乳汁吸出。\n\n入院记录：\n医师签名：张医生\n\n入院后病程记录：\n首次病程记录：\n病情急性起病，患者复苏后依然呼吸困难及青紫，辅助检查符合新生儿羊水吸入性肺炎的诊断。计划给予吸氧、吸痰、抗感染治疗，并密切监测病情变化。\n\n日常病程记录：\n12月6日：患者呼吸情况稍有好转，仍需吸氧辅助，抗感染治疗继续。\n12月7日：患者青紫有所缓解，但仍有呼吸困难，呼吸音稍好转。\n\n上级医师查房记录：\n上级医师认为诊断准确，继续当前治疗方案，建议密切观察。\n\n交（接）班记录：\n患者入院时状态危急，经初步处理后状态稳定，需继续观察治疗。\n\n阶段小结：\n患者病情相对稳定，但仍需继续治疗和观察。\n\n医嘱：\n长期医嘱单：\n吸氧、抗感染治疗、吸痰、定期血气分析\n\n临时医嘱单：\n如呼吸困难加剧，立即通知医生\n\n辅助检查报告单：\n血气分析：轻度低氧血症\n胸部X光：双肺纹理增多及模糊\n\n体温单：\n体温：37℃，脉搏：150次/分，呼吸：60次/分，血压：无法测量\n\n请注意，本病历信息仅供医疗服务使用，并严格遵守医生与患者之间的保密协议。",
    "qa_fact_based": [
        {
            "问题类型": "事实性问题",
            "问题": "根据黄埔市妇幼保健院的住院病历，葛某某的入院时间是什么时候？",
            "答案": "12月5日",
            "ref": [
                "入院时间：12月5日     病史陈述者：母亲"
            ]
        },
        {
            "问题类型": "事实性问题",
            "问题": "根据黄埔市妇幼保健院的住院病历，葛某某的病史陈述者是谁？",
            "答案": "母亲",
            "ref": [
                "入院时间：12月5日     病史陈述者：母亲"
            ]
        },
        {
            "问题类型": "事实性问题",
            "问题": "根据黄埔市妇幼保健院的住院病历，葛某某的主诉是什么？",
            "答案": "复苏后即出现呼吸困难、青紫，伴从口腔中流出液体或泡沫，入院12小时。",
            "ref": [
                "复苏后即出现呼吸困难、青紫，伴从口腔中流出液体或泡沫，入院12小时。"
            ]
        },
        {
            "问题类型": "事实性问题",
            "问题": "根据黄埔市妇幼保健院的住院病历，葛某某的初步诊断结果是什么？",
            "答案": "新生儿羊水吸入性肺炎",
            "ref": [
                "新生儿羊水吸入性肺炎"
            ]
        }
    ],
    "qa_multi_hop": [
        {
            "问题类型": "多跳推理问题",
            "问题": "根据黄埔市妇幼保健院的住院病历，葛某某进行了几项辅助检查？",
            "答案": "根据病历，葛某某进行了3项辅助检查，分别为血气分析、白细胞计数和胸部X光。",
            "ref": [
                "血气分析示轻度低氧血症；白细胞计数升高，提示感染；胸部X光示双肺纹理增多及模糊",
                "胸部X光示双肺纹理增多及模糊，局限性肺部阴影",
                "血气分析：轻度低氧血症",
                "胸部X光：双肺纹理增多及模糊"
            ]
        }
    ],
    "qa_summary": [
        {
            "问题类型": "总结性问题",
            "问题": "根据黄埔市妇幼保健院的住院病历，总结葛某某的病史。",
            "答案": "葛某某出生后即出现呼吸困难和青紫，由家中被紧急送往黄埔市妇幼保健院。复苏后病情未见缓解，可能与羊水吸入有关。主要症状包括呼吸困难、青紫、口腔中有液体或泡沫流出，肺部听诊有湿啰音。入院前在家中接受简单复苏措施，效果不佳，入院后接受吸氧、吸痰及抗感染治疗。",
            "ref": [
                "葛某某于12月5日出生后即出现呼吸困难和青紫，由黄埔市梨园街98号家中紧急送往黄埔市妇幼保健院。",
                "病情起病急，复苏后病情未见缓解，可能与羊水吸入有关。",
                "复苏后即刻出现呼吸困难和青紫，口腔中有液体或泡沫流出，肺部听诊有湿啰音。",
                "入院前在家中接受简单复苏措施，效果不佳，因此被送入妇幼保健院后接受进一步治疗，包括吸氧、吸痰及抗感染治疗。"
            ]
        },
        {
            "问题类型": "总结性问题",
            "问题": "根据黄埔市妇幼保健院的住院病历，总结葛某某的诊断。",
            "答案": "葛某某的初步诊断为新生儿羊水吸入性肺炎。诊断依据包括出生后即出现呼吸困难和青紫，口腔中流出液体或泡沫，肺部听诊有湿啰音，以及辅助检查如血气分析和胸部X光结果符合。鉴别诊断包括胎粪吸入性肺炎和乳汁吸入性肺炎。",
            "ref": [
                "初步诊断：",
                "新生儿羊水吸入性肺炎",
                "1. 出生后即出现呼吸困难和青紫。",
                "2. 口腔中流出液体或泡沫。",
                "3. 肺部听诊有湿啰音。",
                "4. 辅助检查如血气分析和胸部X光结果符合。",
                "胎粪吸入性肺炎：复苏后即出现呼吸浅快（>60次/分）、鼻煽、三凹征、呻吟和发绀。",
                "乳汁吸入性肺炎：哺乳后突然出现呼吸停止、青紫或呛咳，气道内有乳汁吸出。"
            ]
        },
        {
            "问题类型": "总结性问题",
            "问题": "根据黄埔市妇幼保健院的住院病历，总结葛某某的治疗方案。",
            "答案": "葛某某的治疗方案包括吸氧、吸痰、抗感染治疗和定期血气分析。医嘱中还提到如呼吸困难加剧，需立即通知医生。",
            "ref": [
                "计划给予吸氧、吸痰、抗感染治疗，并密切监测病情变化。",
                "吸氧、抗感染治疗、吸痰、定期血气分析",
                "如呼吸困难加剧，立即通知医生"
            ]
        },
        {
            "问题类型": "总结性问题",
            "问题": "根据黄埔市妇幼保健院的住院病历，总结葛某某的体格检查结果。",
            "答案": "葛某某的体格检查结果显示体温37℃，脉搏150次/分，呼吸60次/分，血压无法测量。皮肤和粘膜轻度青紫，淋巴结未触及异常，头部及器官、颈部、腹部、直肠肛门、外生殖器、脊柱、四肢和神经系统无明显异常。胸部呼吸急促，肺部听诊有湿啰音，心脏无杂音。",
            "ref": [
                "体温：37℃",
                "脉搏：150次/分",
                "呼吸：60次/分",
                "血压：无法测量",
                "皮肤：轻度青紫",
                "粘膜：湿润，轻度青紫",
                "淋巴结：未触及异常",
                "头部及器官：无异常",
                "颈部：无异常",
                "胸部：呼吸急促，肺部听诊有湿啰音，心脏无杂音",
                "腹部：软，肝脾未触及",
                "直肠肛门：未检查",
                "外生殖器：女性外生殖器正常",
                "脊柱：无异常",
                "四肢：无畸形，肌张力正常",
                "神经系统：无明显神经系统异常"
            ]
        },
        {
            "问题类型": "总结性问题",
            "问题": "根据黄埔市妇幼保健院的住院病历，总结葛某某的辅助检查结果。",
            "答案": "葛某某的辅助检查结果包括血气分析示轻度低氧血症，白细胞计数升高提示感染，胸部X光示双肺纹理增多及模糊，局限性肺部阴影。",
            "ref": [
                "血气分析示轻度低氧血症；白细胞计数升高，提示感染；胸部X光示双肺纹理增多及模糊",
                "血气分析：轻度低氧血症",
                "胸部X光：双肺纹理增多及模糊"
            ]
        }
    ]
}