{
    "courtAndProcuratorate": {
        "court": "Upton, Georgetown, Court",
        "procuratorate": "Upton, Georgetown, Procuratorate"
    },
    "chiefJudge": "O. Nelson",
    "judge": "H. Alvarez",
    "clerk": "C. Gomez",
    "defendant": {
        "name": "F. Williams",
        "gender": "male",
        "birthdate": "6th, November, 1981",
        "residence": "72, Brighton street, Georgetown",
        "ethnicity": "African American",
        "occupation": "City Official"
    },
    "defenseLawyer": {
        "name": "D. Diaz",
        "lawFirm": "Georgetown & Associates Law Firm"
    },
    "caseProcess": [
        {
            "event": "Case Filing and Investigation",
            "date": "1st, March, 2023",
            "description": "The case was officially filed by the Upton, Georgetown, Procuratorate following complaints received about irregularities in several municipal contracts managed by F. Williams. An investigation was initiated to look into the allegations of Bending the Law for Personal Gain."
        },
        {
            "event": "Detention Measures Taken",
            "date": "15th, March, 2023",
            "description": "Following preliminary investigations, the procuratorate determined that there was sufficient evidence to warrant detention. Detention measures were accordingly implemented to prevent the potential destruction of evidence."
        },
        {
            "event": "Criminal Detention",
            "date": "20th, March, 2023",
            "description": "F. Williams was formally placed under criminal detention. Legal protocols were followed, and F. Williams was informed of his rights and the charges against him."
        },
        {
            "event": "Arrest",
            "date": "5th, April, 2023",
            "description": "An arrest warrant was issued, and F. Williams was formally arrested. The arrest was carried out by the Georgetown Police Department with no resistance from the defendant."
        }
    ],
    "criminalFacts": [
        {
            "crimeName": "Crime of Bending the Law for Personal Gain",
            "details": [
                {
                    "timePeriod": "January 2021 - December 2022",
                    "behavior": "Overseeing multiple municipal contracts, F. Williams manipulated the bidding process to ensure that contracts were awarded to companies in which he had undisclosed financial interests. He did this by arranging for inflated invoicing and accepting kickbacks from the contractors.",
                    "evidence": [
                        "Signed contracts and incriminating emails recovered from Williams's office detailing collusion between Williams and various contractors.",
                        "Bank statements showing significant deposits to Williams’ accounts coinciding with contract awards.",
                        "Testimonies from municipal employees confirming that the bidding process was bypassed under the direct orders of Williams."
                    ]
                },
                {
                    "timePeriod": "March 2022",
                    "behavior": "F. Williams used his city official position to authorize unwarranted expenditures on city budgets and transferred funds to fictitious companies controlled by his associates. He forged documents to conceal these transfers.",
                    "evidence": [
                        "Forgery analysis reports confirming that signatures on expenditure authorization forms were falsified.",
                        "Audit trails from the city’s financial system indicating transactional irregularities and transfers to fictitious companies.",
                        "Witness statements from city accountants flagging the suspicious transfers."
                    ]
                },
                {
                    "timePeriod": "June 2021",
                    "behavior": "Williams manipulated zoning laws to favor a real estate developer in exchange for a luxury apartment unit in downtown Georgetown. He withheld pertinent information from the city council and citizens affected by the zoning changes.",
                    "evidence": [
                        "Emails between Williams and the real estate developer discussing the zoning changes and the apartment unit.",
                        "Property transfer records evidencing the acquisition of the luxury apartment unit by Williams without apparent financial consideration.",
                        "Witness testimonies of city council members indicating that they were unaware of the negotiations and the resulting zoning amendments."
                    ]
                }
            ]
        }
    ],
    "legalProcedure": {
        "judgmentDate": "30th, September, 2023",
        "judgmentResult": [
            {
                "crimeName": "Crime of Bending the Law for Personal Gain",
                "sentence": "Five (5) years of fixed-term imprisonment",
                "sentencingConsiderations": "The court considered the extent of the financial losses incurred by the city, the breach of public trust, and the defendant’s cooperation during the investigation when determining the sentence."
            }
        ]
    },
    "Generated Article": "**Upton, Georgetown, Court**\n*Criminal Division*\n\n**Case Number:** 2023-C-0453\n\n**Date of Judgment:** 30th, September, 2023\n\n**Judge Presiding:** Chief Judge O. Nelson, Judge H. Alvarez\n\n**Clerk of Court:** C. Gomez\n\n---\n\n**State of Georgetown, Plaintiff**  \n**vs.**  \n**Franklin Williams, Defendant**\n\n---\n\n**Court and Prosecutor Information:**\n\n*Court:*  \nUpton, Georgetown, Court\n\n*Prosecutor:*  \nUpton, Georgetown, Procuratorate\n\n---\n\n**Defendant and Defense Lawyer Information:**\n\n*Defendant:*  \n**Name:** Franklin Williams  \n**Gender:** Male  \n**Birthdate:** 6th November 1981  \n**Residence:** 72, Brighton Street, Georgetown  \n**Ethnicity:** African American  \n**Occupation:** City Official\n\n*Defense Lawyer:*  \n**Name:** Diego Diaz  \n**Law Firm:** Georgetown & Associates Law Firm\n\n---\n\n**Case Procedures:**\n\n1. **Case Filing and Investigation (1st March, 2023):**  \n   Upon receiving numerous complaints regarding irregularities in the allocation and management of several municipal contracts overseen by Franklin Williams, the Upton, Georgetown, Procuratorate initiated an investigation. The initial probe revealed suspicious activities, prompting formal filing of the case. Evidence collection began with scrutinizing emails, financial records, and interviewing municipal employees. \n\n2. **Detention Measures Taken (15th March, 2023):**  \n   As the investigation progressed, it became evident that there was substantial risk of evidence tampering. Consequently, authorities decided that detention measures needed to be implemented to safeguard the integrity of the ongoing investigation. Franklin Williams was accordingly detained to prevent any potential destruction or alteration of critical documents or communications. He was informed of these measures and his rights at the time.\n\n3. **Criminal Detention (20th March, 2023):**  \n   On 20th March 2023, the preliminary evidence collected was deemed sufficient to escalate F. Williams’ status from mere detention to criminal detention. His involvement in manipulating municipal contracts for personal gain was substantiated through a series of corroborative testimonies and documents.\n\n4. **Arrest (5th April, 2023):**  \n   The prosecutorial evidence threshold justified the formal arrest of F. Williams. An arrest warrant was issued by this court and executed by the Georgetown Police Department without resistance. F. Williams was taken into custody, whereby he was once again informed of his rights and the specific charges being levied against him.\n\n---\n\n**Case Statement:**\n\nThis court has thoroughly examined the nuances of the case against Franklin Williams, who stood accused of the Crime of Bending the Law for Personal Gain under Article 397. The case reveals a history of sustained and calculated malfeasance that spanned nearly two years. Franklin Williams used his official position to enrich himself at the expense of public trust and city resources. The defamatory actions commenced within the early months of 2021 and persisted until the tail end of 2022, during which Williams circumvented regular municipal protocols to benefit personally and financially from several contracts and arrangements.\n\nThe first period of infractions, reported from January 2021 to December 2021, involved overseeing multiple municipal contracts. Williams manipulated the bidding process ultimately ensuring that favored contractors with undisclosed financial ties to himself were almost always the winning bidders. The examination of these contracts revealed numerous instances of inflated invoicing and under-the-table kickbacks, which formed the bedrock of his modus operandi.\n\nIn March 2022, in a separate incident yet continuing his trend of power misuse, Franklin Williams authorized city funds to be expended for fictitious companies he secretly controlled. This required forging documents to camouflage the unauthorized transfers. The analysis of financial and audit reports flagged these irregular transfers, leading to further deep dives into city accountants' testimonies. It became evident that these unauthorized expenditures represented a gross breach of fiscal duty and a significant detriment to the city's financial health.\n\nFinally, during June 2021, Williams took the illegal manipulation of his office's power a step further. He manipulated zoning laws to favor a particular real estate developer. In return, the defendant received a luxury apartment in downtown Georgetown, devoid of any monetary exchange indicative of a true arm's-length transaction. Municipal records and city council member testimonies reflect that this zoning change was conducted without requisite transparency and disclosure, flouting the mandated procedural fairness.\n\n---\n\n**Charge:**\n\nFranklin Williams is charged and stood trial for the Crime of Bending the Law for Personal Gain under Article 397. The charges encompass substantial periods of malfeasance, which involve:\n\n1. **Manipulation of Municipal Contract Bidding Process (January 2021 - December 2021):**\n   Williams ensured contract awards to companies where he held financial interests, facilitated by fraudulent invoicing and accepting kickbacks.\n\n2. **Unauthorized Budget Expenditures (March 2022):**\n   Misappropriation of city funds by transferring them to fictitious companies, accompanied by forged authorization documentation.\n\n3. **Manipulation of Zoning Laws for Personal Benefit (June 2021):**\n   Amending zoning laws under non-disclosure to favor a developer in return for a luxury apartment unit.\n\n---\n\n**Evidence Description:**\n\n1. **Contract Manipulation Evidence:**  \n   (a) **Signed Contracts and Emails:** Multiple signed contracts were recovered detailing unauthorized collusion between Williams and specific contractors. Emails found in Williams' official and personal accounts showcase direct conversations about bypassing standard bidding processes.  \n   (b) **Bank Statements:** Bank records were obtained showing substantial deposits into Williams' accounts aligned with contract awards. These inflows significantly differed from his regular income derived from his public office salary.  \n   (c) **Employee Testimonies:** Testimonies from several municipal employees were recorded. These employees recounted unorthodox orders from Williams' office bypassing traditional competitive bidding procedures, soliciting backdoor agreements, and hinting at arrangement irregularities.\n\n2. **Unauthorized Fund Transfer Evidence:**  \n   (a) **Forgery Analysis Reports:** Document experts provided reports confirming that several expenditure authorization forms bore forged signatures, clearly differentiable from the authentic signatures of involved officials.  \n   (b) **Audit Trails and Financial Irregularities:** The financial system audit retrieved transactional data, unveiling unwarranted fund transfers to several fictitious entities with no actual business operations or city-related engagements.  \n   (c) **Accountant Witness Statements:** City accountants observed and reported suspicious transactions to auditors, substantiating financial discrepancies and unauthorized diversions amounting to significant fiscal damages.\n\n3. **Zoning Law Manipulation Evidence:**  \n   (a) **Emails with Real Estate Developer:** Communications retrieved between Williams and a prominent real estate developer elucidated the clandestine understanding to modify zoning regulations favorably.  \n   (b) **Property Transfer Records:** Title deed documentation and property transaction records validated Williams' receipt of a luxury apartment without any real financial exchange, underscoring the quid pro quo basis of the arrangement.  \n   (c) **City Council Member Testimonies:** Statements were recorded from city council members expressing their lack of knowledge about the discussed zoning changes. They confirmed that the oversight and procedural transparency were bypassed, as mandated by city governance protocols.\n\n---\n\n**Sentencing Considerations:**\n\nIn determining the appropriate sentence for Franklin Williams, this court weighed several critical factors:\n\n1. **Extent of Financial Losses:** The financial impacts on the city due to misallocated contracts, unauthorized fund transfers, and manipulated zoning laws constituted a significant economic strain, amounting to hundreds of thousands of dollars in losses and resulting fiscal disruption.\n  \n2. **Breach of Public Trust:** As a city official, Williams was entrusted to serve with integrity and uphold legal and ethical standards. His blatant misuse of office subverted the public's trust in governmental functions and eroded faith in local administration.\n\n3. **Defendant's Cooperation:** Martin's willingness to cooperate during the investigation, including providing detailed confessions and facilitating evidence recovery, was acknowledged. Despite this, the gravity and multiplicity of his offenses necessitated a stringent sentence.\n\n---\n\n**Judgment Result:**\n\nBased on the thorough evaluation of the evidence and considerations outlined, Franklin Williams is found:\n\n*Guilty* of the Crime of Bending the Law for Personal Gain pursuant to Article 397.\n\nThis court hereby sentences Franklin Williams to:\n\n**Five (5) years of fixed-term imprisonment.**\n\nThis sentence reflects the severity of the crimes, the necessary deterrence to prevent similar infractions by public officials in the future, and the rehabilitative needs of the defendant.\n\n---\n\n**Appeal Rights Explanation:**\n\nFranklin Williams, you have the right to appeal this judgment and sentence to the Superior Court of Georgetown. This must be done within thirty (30) days from today’s date. You may appeal on legal grounds you deem appropriate, and if you are unable to afford legal representation, the court may appoint a lawyer to assist you in the appeal process.\n\nYou are hereby reminded that the appeal does not automatically stay your sentence unless specifically ordered by the appellate court. As you proceed to exercise your legal recourse, your detention will continue until further judicial directives are issued.\n\n---\n\n*This judgment is entered into the official court records by Clerk of Court, C. Gomez.*\n\n**Upton, Georgetown, Court**  \nDate: 30th September, 2023\n\n---\n\n**Chief Judge O. Nelson**  \n**Judge H. Alvarez**\n\n[END OF JUDGMENT]\n\nReference Article is below：\nArticle 397\nState organ personnel who abuse their power or neglect their duties, causing significant losses to public property, the state, and people's interests, shall be sentenced to fixed-term imprisonment of not more than three years or criminal detention; if the circumstances are particularly serious, they shall be sentenced to fixed-term imprisonment of more than three years but not more than seven years.",
    "qa_fact_based": [
        {
            "question type": "Factual Question",
            "question": "According to the court judgment of Upton, Georgetown, Court, what was the residence of F. Williams?",
            "answer": "72, Brighton Street, Georgetown.",
            "ref": [
                "**Residence:** 72, Brighton Street, Georgetown"
            ]
        },
        {
            "question type": "Factual Question",
            "question": "According to the court judgment of Upton, Georgetown, Court, what was the occupation of F. Williams?",
            "answer": "City Official.",
            "ref": [
                "**Occupation:** City Official"
            ]
        },
        {
            "question type": "Factual Question",
            "question": "According to the court judgment of Upton, Georgetown, Court, what was the time period during which F. Williams manipulated the bidding process?",
            "answer": "January 2021 - December 2021.",
            "ref": [
                "The first period of infractions, reported from January 2021 to December 2021, involved overseeing multiple municipal contracts.",
                "1. **Manipulation of Municipal Contract Bidding Process (January 2021 - December 2021):**"
            ]
        },
        {
            "question type": "Factual Question",
            "question": "According to the court judgment of Upton, Georgetown, Court, what was one of the behaviors F. Williams engaged in during March 2022?",
            "answer": "Authorized unwarranted expenditures on city budgets and transferred funds to fictitious companies.",
            "ref": [
                "In March 2022, in a separate incident yet continuing his trend of power misuse, Franklin Williams authorized city funds to be expended for fictitious companies he secretly controlled.",
                "2. **Unauthorized Budget Expenditures (March 2022):**"
            ]
        }
    ],
    "qa_multi_hop": [
        {
            "question type": "Multi-hop Reasoning Question",
            "question": "According to the judgment of Upton, Georgetown, Court, how many distinct criminal activities was F. Williams involved in?",
            "answer": "According to the judgment, F. Williams was involved in three distinct criminal activities: manipulating municipal contracts, authorizing unwarranted expenditures, and manipulating zoning laws.",
            "ref": [
                "The charges encompass substantial periods of malfeasance, which involve:",
                "1. **Manipulation of Municipal Contract Bidding Process (January 2021 - December 2021):**",
                "Williams ensured contract awards to companies where he held financial interests, facilitated by fraudulent invoicing and accepting kickbacks.",
                "2. **Unauthorized Budget Expenditures (March 2022):**",
                "Misappropriation of city funds by transferring them to fictitious companies, accompanied by forged authorization documentation.",
                "3. **Manipulation of Zoning Laws for Personal Benefit (June 2021):**",
                "Amending zoning laws under non-disclosure to favor a developer in return for a luxury apartment unit."
            ]
        },
        {
            "question type": "Multi-hop Reasoning Question",
            "question": "According to the judgment of Upton, Georgetown, Court, what is the total financial impact of all the crimes committed by F. Williams?",
            "answer": "The total financial impact of all the crimes committed by F. Williams includes the financial gains from manipulating municipal contracts, the unwarranted expenditures authorized and transferred to fictitious companies, and the value of the luxury apartment unit received in exchange for manipulating zoning laws. The exact total amount is not specified in the judgment, but it includes significant deposits to Williams' accounts, unwarranted city budget expenditures, and the value of the luxury apartment unit.",
            "ref": [
                "1. **Extent of Financial Losses:** The financial impacts on the city due to misallocated contracts, unauthorized fund transfers, and manipulated zoning laws constituted a significant economic strain, amounting to hundreds of thousands of dollars in losses and resulting fiscal disruption.",
                "Williams ensured contract awards to companies where he held financial interests, facilitated by fraudulent invoicing and accepting kickbacks.",
                "Misappropriation of city funds by transferring them to fictitious companies, accompanied by forged authorization documentation.",
                "Amending zoning laws under non-disclosure to favor a developer in return for a luxury apartment unit.",
                "(b) **Bank Statements:** Bank records were obtained showing substantial deposits into Williams' accounts aligned with contract awards.",
                "(b) **Audit Trails and Financial Irregularities:** The financial system audit retrieved transactional data, unveiling unwarranted fund transfers to several fictitious entities with no actual business operations or city-related engagements.",
                "(b) **Property Transfer Records:** Title deed documentation and property transaction records validated Williams' receipt of a luxury apartment without any real financial exchange, underscoring the quid pro quo basis of the arrangement."
            ]
        },
        {
            "question type": "Multi-hop Reasoning Question",
            "question": "According to the judgment of Upton, Georgetown, Court, how many pieces of evidence were presented against F. Williams for all his crimes?",
            "answer": "According to the judgment, a total of nine pieces of evidence were presented against F. Williams: three for manipulating municipal contracts (signed contracts and incriminating emails, bank statements, testimonies from municipal employees), three for authorizing unwarranted expenditures (forgery analysis reports, audit trails, witness statements from city accountants), and three for manipulating zoning laws (emails with the real estate developer, property transfer records, witness testimonies of city council members).",
            "ref": [
                "1. **Contract Manipulation Evidence:**",
                "(a) **Signed Contracts and Emails:** Multiple signed contracts were recovered detailing unauthorized collusion between Williams and specific contractors.",
                "Emails found in Williams' official and personal accounts showcase direct conversations about bypassing standard bidding processes.",
                "(b) **Bank Statements:** Bank records were obtained showing substantial deposits into Williams' accounts aligned with contract awards.",
                "These inflows significantly differed from his regular income derived from his public office salary.",
                "(c) **Employee Testimonies:** Testimonies from several municipal employees were recorded.",
                "These employees recounted unorthodox orders from Williams' office bypassing traditional competitive bidding procedures, soliciting backdoor agreements, and hinting at arrangement irregularities.",
                "2. **Unauthorized Fund Transfer Evidence:**",
                "(a) **Forgery Analysis Reports:** Document experts provided reports confirming that several expenditure authorization forms bore forged signatures, clearly differentiable from the authentic signatures of involved officials.",
                "(b) **Audit Trails and Financial Irregularities:** The financial system audit retrieved transactional data, unveiling unwarranted fund transfers to several fictitious entities with no actual business operations or city-related engagements.",
                "(c) **Accountant Witness Statements:** City accountants observed and reported suspicious transactions to auditors, substantiating financial discrepancies and unauthorized diversions amounting to significant fiscal damages.",
                "3. **Zoning Law Manipulation Evidence:**",
                "(a) **Emails with Real Estate Developer:** Communications retrieved between Williams and a prominent real estate developer elucidated the clandestine understanding to modify zoning regulations favorably.",
                "(b) **Property Transfer Records:** Title deed documentation and property transaction records validated Williams' receipt of a luxury apartment without any real financial exchange, underscoring the quid pro quo basis of the arrangement.",
                "(c) **City Council Member Testimonies:** Statements were recorded from city council members expressing their lack of knowledge about the discussed zoning changes.",
                "They confirmed that the oversight and procedural transparency were bypassed, as mandated by city governance protocols."
            ]
        }
    ],
    "qa_summary": [
        {
            "question type": "Summarization Question",
            "question": "According to the judgment of Upton, Georgetown, Court, summarize the facts of F. Williams's crimes.",
            "answer": "F. Williams committed the crime of Bending the Law for Personal Gain. From January 2021 to December 2022, he manipulated the bidding process for municipal contracts to benefit companies in which he had financial interests, arranged for inflated invoicing, and accepted kickbacks. In March 2022, he authorized unwarranted expenditures and transferred funds to fictitious companies he controlled, forging documents to conceal these transfers. In June 2021, he manipulated zoning laws to favor a real estate developer in exchange for a luxury apartment unit, withholding pertinent information from the city council and citizens.",
            "ref": [
                "This court has thoroughly examined the nuances of the case against Franklin Williams, who stood accused of the Crime of Bending the Law for Personal Gain under Article 397.",
                "The case reveals a history of sustained and calculated malfeasance that spanned nearly two years.",
                "Franklin Williams used his official position to enrich himself at the expense of public trust and city resources.",
                "The defamatory actions commenced within the early months of 2021 and persisted until the tail end of 2022, during which Williams circumvented regular municipal protocols to benefit personally and financially from several contracts and arrangements.",
                "The first period of infractions, reported from January 2021 to December 2021, involved overseeing multiple municipal contracts.",
                "Williams manipulated the bidding process ultimately ensuring that favored contractors with undisclosed financial ties to himself were almost always the winning bidders.",
                "The examination of these contracts revealed numerous instances of inflated invoicing and under-the-table kickbacks, which formed the bedrock of his modus operandi.",
                "In March 2022, in a separate incident yet continuing his trend of power misuse, Franklin Williams authorized city funds to be expended for fictitious companies he secretly controlled.",
                "This required forging documents to camouflage the unauthorized transfers.",
                "Finally, during June 2021, Williams took the illegal manipulation of his office's power a step further.",
                "He manipulated zoning laws to favor a particular real estate developer.",
                "In return, the defendant received a luxury apartment in downtown Georgetown, devoid of any monetary exchange indicative of a true arm's-length transaction.",
                "Municipal records and city council member testimonies reflect that this zoning change was conducted without requisite transparency and disclosure, flouting the mandated procedural fairness.",
                "The charges encompass substantial periods of malfeasance, which involve:",
                "1. **Manipulation of Municipal Contract Bidding Process (January 2021 - December 2021):**",
                "Williams ensured contract awards to companies where he held financial interests, facilitated by fraudulent invoicing and accepting kickbacks.",
                "2. **Unauthorized Budget Expenditures (March 2022):**",
                "Misappropriation of city funds by transferring them to fictitious companies, accompanied by forged authorization documentation.",
                "3. **Manipulation of Zoning Laws for Personal Benefit (June 2021):**"
            ]
        },
        {
            "question type": "Summarization Question",
            "question": "According to the judgment of Upton, Georgetown, Court, summarize the evidence of F. Williams's crimes.",
            "answer": "The evidence against F. Williams includes signed contracts and incriminating emails detailing collusion with contractors, bank statements showing significant deposits coinciding with contract awards, testimonies from municipal employees, forgery analysis reports, audit trails indicating transactional irregularities, witness statements from city accountants, emails discussing zoning changes and the apartment unit, property transfer records, and witness testimonies from city council members.",
            "ref": [
                "1. **Contract Manipulation Evidence:**",
                "(a) **Signed Contracts and Emails:** Multiple signed contracts were recovered detailing unauthorized collusion between Williams and specific contractors.",
                "Emails found in Williams' official and personal accounts showcase direct conversations about bypassing standard bidding processes.",
                "(b) **Bank Statements:** Bank records were obtained showing substantial deposits into Williams' accounts aligned with contract awards.",
                "These inflows significantly differed from his regular income derived from his public office salary.",
                "(c) **Employee Testimonies:** Testimonies from several municipal employees were recorded.",
                "These employees recounted unorthodox orders from Williams' office bypassing traditional competitive bidding procedures, soliciting backdoor agreements, and hinting at arrangement irregularities.",
                "2. **Unauthorized Fund Transfer Evidence:**",
                "(a) **Forgery Analysis Reports:** Document experts provided reports confirming that several expenditure authorization forms bore forged signatures, clearly differentiable from the authentic signatures of involved officials.",
                "(b) **Audit Trails and Financial Irregularities:** The financial system audit retrieved transactional data, unveiling unwarranted fund transfers to several fictitious entities with no actual business operations or city-related engagements.",
                "(c) **Accountant Witness Statements:** City accountants observed and reported suspicious transactions to auditors, substantiating financial discrepancies and unauthorized diversions amounting to significant fiscal damages.",
                "3. **Zoning Law Manipulation Evidence:**",
                "(a) **Emails with Real Estate Developer:** Communications retrieved between Williams and a prominent real estate developer elucidated the clandestine understanding to modify zoning regulations favorably.",
                "(b) **Property Transfer Records:** Title deed documentation and property transaction records validated Williams' receipt of a luxury apartment without any real financial exchange, underscoring the quid pro quo basis of the arrangement.",
                "(c) **City Council Member Testimonies:** Statements were recorded from city council members expressing their lack of knowledge about the discussed zoning changes.",
                "They confirmed that the oversight and procedural transparency were bypassed, as mandated by city governance protocols."
            ]
        },
        {
            "question type": "Summarization Question",
            "question": "According to the judgment of Upton, Georgetown, Court, summarize the case process of F. Williams.",
            "answer": "The case process began with the filing and investigation on 1st March 2023, following complaints about irregularities in municipal contracts managed by F. Williams. Detention measures were taken on 15th March 2023 to prevent evidence destruction. F. Williams was placed under criminal detention on 20th March 2023, and an arrest warrant was issued on 5th April 2023, leading to his formal arrest by the Georgetown Police Department.",
            "ref": [
                "1. **Case Filing and Investigation (1st March, 2023):**",
                "Upon receiving numerous complaints regarding irregularities in the allocation and management of several municipal contracts overseen by Franklin Williams, the Upton, Georgetown, Procuratorate initiated an investigation.",
                "The initial probe revealed suspicious activities, prompting formal filing of the case.",
                "Evidence collection began with scrutinizing emails, financial records, and interviewing municipal employees.",
                "2. **Detention Measures Taken (15th March, 2023):**",
                "As the investigation progressed, it became evident that there was substantial risk of evidence tampering.",
                "Consequently, authorities decided that detention measures needed to be implemented to safeguard the integrity of the ongoing investigation.",
                "Franklin Williams was accordingly detained to prevent any potential destruction or alteration of critical documents or communications.",
                "He was informed of these measures and his rights at the time.",
                "3. **Criminal Detention (20th March, 2023):**",
                "On 20th March 2023, the preliminary evidence collected was deemed sufficient to escalate F. Williams’ status from mere detention to criminal detention.",
                "His involvement in manipulating municipal contracts for personal gain was substantiated through a series of corroborative testimonies and documents.",
                "4. **Arrest (5th April, 2023):**",
                "The prosecutorial evidence threshold justified the formal arrest of F. Williams.",
                "An arrest warrant was issued by this court and executed by the Georgetown Police Department without resistance.",
                "F. Williams was taken into custody, whereby he was once again informed of his rights and the specific charges being levied against him."
            ]
        },
        {
            "question type": "Summarization Question",
            "question": "According to the judgment of Upton, Georgetown, Court, summarize the judgment result for F. Williams.",
            "answer": "F. Williams was found guilty of the crime of Bending the Law for Personal Gain and was sentenced to five years of fixed-term imprisonment. The court considered the extent of the financial losses incurred by the city, the breach of public trust, and the defendant’s cooperation during the investigation when determining the sentence.",
            "ref": [
                "Based on the thorough evaluation of the evidence and considerations outlined, Franklin Williams is found:",
                "*Guilty* of the Crime of Bending the Law for Personal Gain pursuant to Article 397.",
                "This court hereby sentences Franklin Williams to:",
                "**Five (5) years of fixed-term imprisonment.",
                "This sentence reflects the severity of the crimes, the necessary deterrence to prevent similar infractions by public officials in the future, and the rehabilitative needs of the defendant.",
                "In determining the appropriate sentence for Franklin Williams, this court weighed several critical factors:",
                "1. **Extent of Financial Losses:** The financial impacts on the city due to misallocated contracts, unauthorized fund transfers, and manipulated zoning laws constituted a significant economic strain, amounting to hundreds of thousands of dollars in losses and resulting fiscal disruption.",
                "2. **Breach of Public Trust:** As a city official, Williams was entrusted to serve with integrity and uphold legal and ethical standards.",
                "His blatant misuse of office subverted the public's trust in governmental functions and eroded faith in local administration.",
                "3. **Defendant's Cooperation:** Martin's willingness to cooperate during the investigation, including providing detailed confessions and facilitating evidence recovery, was acknowledged.",
                "Despite this, the gravity and multiplicity of his offenses necessitated a stringent sentence."
            ]
        }
    ]
}