{
    "报告类型": "公司财务报告",
    "报告时间": "2021年度",
    "公司信息": {
        "名称": "滨江消费品有限公司",
        "成立日期": "2005年6月",
        "主营业务": "生产和销售饮料、零食和日用品",
        "注册地": "浙江省杭州市滨江区",
        "上市情况": "未上市",
        "行业": "消费品"
    },
    "报告内容": [
        {
            "类型": "财务信息",
            "重要事件": [
                {
                    "事件": "大规模融资",
                    "时间": "2021年1月",
                    "描述": "滨江消费品有限公司进行了一次大规模的融资活动，募集了5亿元资金。",
                    "影响": "加强了公司的资金实力，支持了公司的扩张和发展。",
                    "子事件": [
                        {
                            "事件": "银行贷款申请",
                            "时间": "2020年12月",
                            "描述": "滨江消费品有限公司向多家银行提交了贷款申请，希望融资支持公司的发展计划。",
                            "影响": "为后续融资活动打下基础，准备了融资所需材料和计划。"
                        },
                        {
                            "事件": "融资方案设计",
                            "时间": "2020年12月 - 2021年1月",
                            "描述": "滨江消费品有限公司与投资机构合作，设计了一套完整的融资方案，包括资金用途、还款方式等。",
                            "影响": "确保融资计划与公司发展战略相契合，提高了融资的成功率。"
                        },
                        {
                            "事件": "融资协议达成",
                            "时间": "2021年1月",
                            "描述": "滨江消费品有限公司与一家投资机构成功达成融资协议，募集了5亿元资金。",
                            "影响": "为公司提供了大规模融资所需的资金，支持了公司的扩张和发展。"
                        }
                    ]
                },
                {
                    "事件": "财务造假丑闻",
                    "时间": "2021年5月",
                    "描述": "滨江消费品有限公司被指控财务造假，涉嫌虚增销售额和净利润。",
                    "影响": "公司信誉受损，股价暴跌，面临诉讼风险和监管调查。"
                },
                {
                    "事件": "重大股权收购",
                    "时间": "2021年7月",
                    "描述": "滨江消费品有限公司完成了对金华果汁有限公司的股权收购，获得了70%的股权。",
                    "影响": "进一步扩大了公司的市场份额，提升了公司的控制力。"
                },
                {
                    "事件": "重大资产收购",
                    "时间": "2021年8月",
                    "描述": "滨江消费品有限公司完成了对乐清食品厂的资产收购，总价值5000万元。",
                    "影响": "扩大公司业务范围，增强市场竞争力。"
                },
                {
                    "事件": "资产重组",
                    "时间": "2021年9月",
                    "描述": "滨江消费品有限公司进行了一次资产重组，优化了公司的业务结构。",
                    "影响": "提高了公司的运营效率，增加了公司的价值。"
                },
                {
                    "事件": "债务重组",
                    "时间": "2021年10月",
                    "描述": "为优化资本结构，滨江消费品有限公司进行了债务重组，减少了3亿元负债。",
                    "影响": "改善了公司的财务状况，降低了财务成本。"
                },
                {
                    "事件": "分发股利",
                    "时间": "2021年11月",
                    "描述": "滨江消费品有限公司决定向股东分发800万元股利。",
                    "影响": "回报给股东们的投资，提升了股东的收益。"
                },
                {
                    "事件": "重大投资",
                    "时间": "2021年12月",
                    "描述": "滨江消费品有限公司投资了嘉兴新能源项目，投资金额为2000万元。",
                    "影响": "进一步拓宽了公司的业务领域，提升了公司的盈利能力。"
                }
            ],
            "涉及的指标": [
                {
                    "指标": "营业收入",
                    "描述": "公司在一定会计期间内的主营业务收入和其他业务收入总额。",
                    "影响因素": [
                        "市场需求的增减变化",
                        "产品价格的调整"
                    ],
                    "值": "8000万元"
                },
                {
                    "指标": "净利润",
                    "描述": "公司在一定会计期间的净收入，即总收入减去总成本和所得税费用后的金额。",
                    "影响因素": [
                        "营业收入的增减变化",
                        "成本控制的效果",
                        "非经常性损益的影响"
                    ],
                    "值": "500万元"
                },
                {
                    "指标": "总资产",
                    "描述": "会计期末，公司所拥有的资产总额。",
                    "影响因素": [
                        "资产收购和新投资",
                        "资产处置和报废",
                        "资产重估的影响"
                    ],
                    "值": "20000万元"
                },
                {
                    "指标": "总负债",
                    "描述": "会计期末，公司所承担并需要偿还的债务总额。",
                    "影响因素": [
                        "新债发行和债务偿还",
                        "债务重组的影响"
                    ],
                    "值": "8000万元"
                },
                {
                    "指标": "股东权益",
                    "描述": "会计期末，归属于股东的权益总额。",
                    "影响因素": [
                        "净利润的增减变化",
                        "股利发放的金额",
                        "资本公积的影响"
                    ],
                    "值": "12000万元"
                },
                {
                    "指标": "现金流量",
                    "描述": "公司在一定会计期间内的现金流入和流出总和。",
                    "影响因素": [
                        "经营活动的现金流量",
                        "投资活动的现金流量",
                        "筹资活动的现金流量"
                    ],
                    "值": "1000万元"
                },
                {
                    "指标": "负债比率",
                    "描述": "公司总负债与总资产的比率，反映公司的债务水平。",
                    "影响因素": [
                        "总负债的增减变化",
                        "总资产的增减变化"
                    ],
                    "值": "40%"
                },
                {
                    "指标": "资产负债率",
                    "描述": "公司总负债占总资产的百分比，衡量公司财务杠杆的一个指标。",
                    "影响因素": [
                        "资产和负债的增减变化"
                    ],
                    "值": "40%"
                },
                {
                    "指标": "净资产收益率",
                    "描述": "反映公司股东权益的经营效益，即净利润与平均股东权益的比率。",
                    "影响因素": [
                        "净利润的增减变化",
                        "股东权益的增减变化"
                    ],
                    "值": "4%"
                }
            ]
        }
    ],
    "额外信息": [
        {
            "名称": "未来展望",
            "内容": [
                {
                    "名称": "财务策略",
                    "描述": "滨江消费品有限公司未来计划实施的财务策略，包括提高成本效益、优化资金运营、推行供应链金融等措施。"
                },
                {
                    "名称": "投资计划",
                    "描述": "滨江消费品有限公司将加大在研发、市场拓展和设备更新方面的投入，推出新品牌和产品线，进一步提升产品质量和市场竞争力。"
                },
                {
                    "名称": "风险管理",
                    "描述": "滨江消费品有限公司将加强财务风险的预警和控制，建立健全的内部审计体系，提升公司的风险识别和应对能力。"
                }
            ]
        }
    ],
    "生成大纲": "公司财务报告大纲：\n\n1. 概述\n    - 报告类型：公司财务报告\n    - 报告时间：2021年度\n\n2. 财务信息\n    - 营业收入\n        - 描述：公司在一定会计期间内的主营业务收入和其他业务收入总额。\n        - 重要因素：市场需求的增减变化、产品价格的调整\n        - 值：8000万元\n\n    - 净利润\n        - 描述：公司在一定会计期间的净收入，即总收入减去总成本和所得税费用后的金额。\n        - 重要因素：营业收入的增减变化、成本控制的效果、非经常性损益的影响\n        - 值：500万元\n\n    - 总资产\n        - 描述：会计期末，公司所拥有的资产总额。\n        - 重要因素：资产收购和新投资、资产处置和报废、资产重估的影响\n        - 值：20000万元\n\n    - 总负债\n        - 描述：会计期末，公司所承担并需要偿还的债务总额。\n        - 重要因素：新债发行和债务偿还、债务重组的影响\n        - 值：8000万元\n\n    - 股东权益\n        - 描述：会计期末，归属于股东的权益总额。\n        - 重要因素：净利润的增减变化、股利发放的金额、资本公积的影响\n        - 值：12000万元\n\n    - 现金流量\n        - 描述：公司在一定会计期间内的现金流入和流出总和。\n        - 重要因素：经营活动的现金流量、投资活动的现金流量、筹资活动的现金流量\n        - 值：1000万元\n\n    - 负债比率\n        - 描述：公司总负债与总资产的比率，反映公司的债务水平。\n        - 重要因素：总负债的增减变化、总资产的增减变化\n        - 值：40%\n\n    - 资产负债率\n        - 描述：公司总负债占总资产的百分比，衡量公司财务杠杆的一个指标。\n        - 重要因素：资产和负债的增减变化\n        - 值：40%\n\n    - 净资产收益率\n        - 描述：反映公司股东权益的经营效益，即净利润与平均股东权益的比率。\n        - 重要因素：净利润的增减变化、股东权益的增减变化\n        - 值：4%\n\n3. 重要事件\n    - 大规模融资\n        - 时间：2021年1月\n        - 描述：滨江消费品有限公司进行了一次大规模的融资活动，募集了5亿元资金。\n        - 影响：加强了公司的资金实力，支持了公司的扩张和发展。\n        - 子事件：\n            - 银行贷款申请\n                - 时间：2020年12月\n                - 描述：滨江消费品有限公司向多家银行提交了贷款申请，希望融资支持公司的发展计划。\n                - 影响：为后续融资活动打下基础，准备了融资所需材料和计划。\n            - 融资方案设计\n                - 时间：2020年12月 - 2021年1月\n                - 描述：滨江消费品有限公司与投资机构合作，设计了一套完整的融资方案，包括资金用途、还款方式等。\n                - 影响：确保融资计划与公司发展战略相契合，提高了融资的成功率。\n            - 融资协议达成\n                - 时间：2021年1月\n                - 描述：滨江消费品有限公司与一家投资机构成功达成融资协议，募集了5亿元资金。\n                - 影响：为公司提供了大规模融资所需的资金，支持了公司的扩张和发展。\n\n    - 财务造假丑闻\n        - 时间：2021年5月\n        - 描述：滨江消费品有限公司被指控财务造假，涉嫌虚增销售额和净利润。\n        - 影响：公司信誉受损，股价暴跌，面临诉讼风险和监管调查。\n\n    - 重大股权收购\n        - 时间：2021年7月\n        - 描述：滨江消费品有限公司完成了对金华果汁有限公司的股权收购，获得了70%的股权。\n        - 影响：进一步扩大了公司的市场份额，提升了公司的控制力。\n\n    - 重大资产收购\n        - 时间：2021年8月\n        - 描述：滨江消费品有限公司完成了对乐清食品厂的资产收购，总价值5000万元。\n        - 影响：扩大公司业务范围，增强市场竞争力。\n\n    - 资产重组\n        - 时间：2021年9月\n        - 描述：滨江消费品有限公司进行了一次资产重组，优化了公司的业务结构。\n        - 影响：提高了公司的运营效率，增加了公司的价值。\n\n    - 债务重组\n        - 时间：2021年10月\n        - 描述：为优化资本结构，滨江消费品有限公司进行了债务重组，减少了3亿元负债。\n        - 影响：改善了公司的财务状况，降低了财务成本。\n\n    - 分发股利\n        - 时间：2021年11月\n        - 描述：滨江消费品有限公司决定向股东分发800万元股利。\n        - 影响：回报给股东们的投资，提升了股东的收益。\n\n    - 重大投资\n        - 时间：2021年12月\n        - 描述：滨江消费品有限公司投资了嘉兴新能源项目，投资金额为2000万元。\n        - 影响：进一步拓宽了公司的业务领域，提升了公司的盈利能力。\n\n4. 额外信息\n    - 未来展望\n        - 财务策略：滨江消费品有限公司未来计划实施的财务策略，包括提高成本效益、优化资金运营、推行供应链金融等措施。\n        - 投资计划：滨江消费品有限公司将加大在研发、市场拓展和设备更新方面的投入，推出新品牌和产品线，进一步提升产品质量和市场竞争力。\n        - 风险管理：滨江消费品有限公司将加强财务风险的预警和控制，建立健全的内部审计体系，提升公司的风险识别和应对能力。",
    "生成总结": "滨江消费品有限公司是一家成立于2005年6月，位于浙江省杭州市滨江区的消费品公司，主营业务为生产和销售饮料、零食和日用品，尚未上市。",
    "生成文章": "滨江消费品有限公司的2021年度财务报告显示，公司在该会计期间实现了8000万元的营业收入。这一数字受到市场需求的增减变化和产品价格调整的影响。同时，公司在该会计期间实现了500万元的净利润，这一数字受到营业收入的增减变化、成本控制的效果以及非经常性损益的影响。\n\n截至会计期末，滨江消费品有限公司的总资产为20000万元，主要受到资产收购和新投资、资产处置和报废以及资产重估的影响。总负债为8000万元，受到新债发行和债务偿还、债务重组的影响。股东权益为12000万元，受到净利润的增减变化、股利发放的金额以及资本公积的影响。\n\n滨江消费品有限公司在该会计期间的现金流量为1000万元，这一数字受到经营活动的现金流量、投资活动的现金流量以及筹资活动的现金流量的影响。此外，公司的负债比率为40%，反映了公司的债务水平。资产负债率为40%，衡量了公司的财务杠杆。\n\n净资产收益率是衡量公司股东权益的经营效益的指标，滨江消费品有限公司的净资产收益率为4%。这一数字受到净利润的增减变化以及股东权益的增减变化的影响。\n\n在2021年的重要事件中，滨江消费品有限公司进行了一次大规模融资活动，募集了5亿元资金。这一事件加强了公司的资金实力，支持了公司的扩张和发展。在此过程中，公司先是向多家银行提交了贷款申请，为后续融资活动打下基础。随后，公司与投资机构合作，设计了一套完整的融资方案，并最终成功达成了融资协议。\n\n然而，滨江消费品有限公司也面临着财务造假丑闻的指控，涉嫌虚增销售额和净利润。这一事件导致了公司信誉的受损，股价的暴跌，并面临着诉讼风险和监管调查。\n\n此外，滨江消费品有限公司还完成了对金华果汁有限公司的重大股权收购，获得了70%的股权。这一举措进一步扩大了公司的市场份额，提升了公司的控制力。同时，公司还完成了对乐清食品厂的重大资产收购，总价值为5000万元。这一举措扩大了公司的业务范围，增强了市场竞争力。\n\n为优化公司的业务结构，滨江消费品有限公司进行了一次资产重组，提高了公司的运营效率，增加了公司的价值。此外，公司还进行了债务重组，减少了3亿元负债，改善了公司的财务状况，降低了财务成本。\n\n在2021年11月，滨江消费品有限公司决定向股东分发800万元股利，回报给股东们的投资，提升了股东的收益。同时，公司还投资了嘉兴新能源项目，投资金额为2000万元，进一步拓宽了公司的业务领域，提升了公司的盈利能力。\n\n滨江消费品有限公司未来计划实施一系列财务策略，包括提高成本效益、优化资金运营、推行供应链金融等措施。公司还将加大在研发、市场拓展和设备更新方面的投入，推出新品牌和产品线，进一步提升产品质量和市场竞争力。此外，公司还将加强财务风险的预警和控制，建立健全的内部审计体系，提升公司的风险识别和应对能力。\n\n综上所述，滨江消费品有限公司在2021年度取得了一系列重要的财务成果和事件。公司在财务指标方面取得了稳定的增长，并通过融资活动、股权收购、资产收购等方式扩大了业务规模和市场份额。然而，公司也面临着财务造假丑闻的挑战，需要加强风险管理和内部控制。未来，公司将继续实施财务策略，加大投资力度，提升竞争力，实现可持续发展。"
}