{
    "Report Type": "Corporate Governance Report",
    "Report Time": "2019",
    "Company Information": {
        "Name": "Entertainment Enterprises Inc.",
        "Establishment Date": "January 1, 2000",
        "Main Business": "Production and distribution of films, TV shows, and music",
        "Registration Location": "Los Angeles, California",
        "Listing Status": "Publicly listed on NASDAQ",
        "Industry": "Entertainment"
    },
    "Report Content": [
        {
            "Type": "Governance Structure",
            "Significant Events": [
                {
                    "Event": "Sustainability and Social Responsibility Initiatives",
                    "Time": "January, 2019",
                    "Description": "The company made significant progress in sustainability initiatives by reducing its carbon footprint, implementing recycling programs across operations, and promoting diversity and inclusion within the workforce. Additionally, the company supported various community engagement programs and philanthropic initiatives.",
                    "Impact": "The company's commitment to sustainability enhances its public image and market competitiveness, driving long-term, sustainable development.",
                    "Sub Events": [
                        {
                            "Event": "Launch of Sustainability Program",
                            "Time": "January, 2019",
                            "Description": "Entertainment Enterprises Inc. launched a comprehensive sustainability program, aiming to reduce its carbon footprint and implement various environmentally friendly practices. This included adopting renewable energy sources, optimizing energy consumption, and implementing recycling programs across its operations.",
                            "Impact": "The company's sustainability program helped reduce operating costs, improve resource efficiency, and demonstrate environmental responsibility, leading to positive public perception and enhanced brand reputation."
                        },
                        {
                            "Event": "Diversity and Inclusion Initiative",
                            "Time": "February, 2019",
                            "Description": "Entertainment Enterprises Inc. implemented a company-wide diversity and inclusion initiative, promoting equal opportunities and fostering a diverse workforce. This involved implementing hiring practices that prioritize diversity, providing training on inclusivity, and establishing employee resource groups for underrepresented communities.",
                            "Impact": "The diversity and inclusion initiative improved the company's reputation as an inclusive and diverse workplace, enhancing employee satisfaction, fostering innovation, and attracting top talent."
                        },
                        {
                            "Event": "Community Engagement Programs",
                            "Time": "March, 2019",
                            "Description": "Entertainment Enterprises Inc. actively supported various community engagement programs aimed at making a positive impact in local communities. This included partnering with local organizations, sponsoring educational initiatives, and organizing volunteering opportunities for employees.",
                            "Impact": "Engaging with the community fostered goodwill, strengthened relationships with stakeholders, and improved the company's public image by showcasing its commitment to social responsibility."
                        },
                        {
                            "Event": "Philanthropic Initiatives",
                            "Time": "April, 2019",
                            "Description": "Entertainment Enterprises Inc. initiated philanthropic efforts by providing financial support to causes aligned with its values. This involved establishing partnerships with nonprofits, supporting educational programs, and contributing to environmental conservation initiatives.",
                            "Impact": "The company's philanthropic initiatives demonstrated its commitment to giving back, enhanced its reputation as a socially responsible organization, and helped address important societal issues."
                        }
                    ]
                },
                {
                    "Event": "Board of Directors Change",
                    "Time": "February, 2019",
                    "Description": "The appointment of two new independent directors, Jennifer Adams and Michael Collins. Both directors bring extensive experience in the entertainment industry and strategic leadership expertise. This change will have a positive impact on the company's strategic direction.",
                    "Impact": "The appointment of experienced and knowledgeable directors strengthens the board's decision-making process, influencing the company's long-term development direction positively and enhancing shareholder interests."
                },
                {
                    "Event": "Shareholders' Meeting Resolution",
                    "Time": "March, 2019",
                    "Description": "At the annual shareholders' meeting, several key decisions were made. The shareholders approved an increase in authorized share capital to facilitate future fundraising efforts. They also elected Jennifer Adams and Michael Collins as new members of the board of directors. Additionally, shareholders approved a dividend payment of $1.00 per share for the fiscal year 2018.",
                    "Impact": "The shareholders' decisions directly influence the company's governance structure, future operational strategies, and the rights of shareholders."
                },
                {
                    "Event": "Ethics and Integrity Incidents",
                    "Time": "July, 2019",
                    "Description": "The company identified an internal fraud incident involving an employee in the finance department. Prompt action was taken, including the termination of the employee, implementation of stronger internal controls, and enhanced ethics training for all employees. The incident was isolated and did not impact external stakeholders.",
                    "Impact": "Addressing the integrity violation promptly prevents damage to the company's reputation and brand value, preserving positive relationships with investors, customers, and partners."
                },
                {
                    "Event": "Compliance and Regulatory Updates",
                    "Time": "August, 2019",
                    "Description": "The company proactively updated its compliance practices to adhere to the latest regulatory changes in the entertainment industry. This includes compliance with new securities laws, corporate governance regulations, and industry-specific standards. The updates strengthen legal risk management and protect the interests of the company and its shareholders.",
                    "Impact": "Ensuring compliance with evolving laws and regulations reduces legal risks, safeguarding the company's reputation, and securing investor, customer, and partner relationships."
                },
                {
                    "Event": "Corporate Governance Policy Revision",
                    "Time": "September, 2019",
                    "Description": "Updates to the corporate governance framework were made to ensure the highest level of transparency, accountability, and stakeholder engagement. The policy revision includes enhanced disclosure requirements, strengthened board governance practices, and expanded shareholder rights.",
                    "Impact": "The revised corporate governance policy significantly improves transparency and accountability, reinforcing stakeholder confidence and fostering a responsible corporate culture."
                },
                {
                    "Event": "Risk Management Measures",
                    "Time": "October, 2019",
                    "Description": "In response to emerging risks, the company strengthened risk management measures. This included the implementation of an enterprise risk management framework, regular risk assessments, and the appointment of a Chief Risk Officer. Additionally, the company expanded its cybersecurity measures to mitigate data breach risks.",
                    "Impact": "Enhancing the company's risk management capabilities improves resilience against internal and external risks, ensuring continuous operations and stable development."
                },
                {
                    "Event": "Senior Management Changes",
                    "Time": "December, 2019",
                    "Description": "The company appointed Sarah Johnson as its new Chief Executive Officer, bringing her extensive experience in the entertainment industry and proven track record of successful leadership. This change will influence the company's operational focus and priorities.",
                    "Impact": "The appointment of a new CEO may lead to adjustments in operational focus and strategic priorities, impacting short-term performance and long-term development."
                }
            ],
            "Involved Indicators": [
                {
                    "Indicator": "Information Disclosure",
                    "Description": "The company upholds principles of timely, accurate, and comprehensive information disclosure. It complies with all applicable regulations and regularly communicates with shareholders, ensuring transparency in reporting.",
                    "Value": "The company discloses financial reports semi-annually and holds quarterly earnings conference calls. The investor relations page on the corporate website provides access to all relevant information."
                },
                {
                    "Indicator": "Related Transactions",
                    "Description": "The company maintains strict policies and procedures to ensure fairness and compliance in all related transactions. It establishes internal controls to manage conflicts of interest and conducts regular audits to detect any irregularities.",
                    "Value": "All related transactions are approved by the board of directors and comply with applicable regulations. The company maintains comprehensive records and provides disclosures for related party transactions in its annual reports."
                },
                {
                    "Indicator": "Internal Control",
                    "Description": "The company has a well-defined and effectively implemented internal control framework to ensure the reliability of financial reporting and operational effectiveness. This includes segregation of duties, financial controls, and regular internal and external audits.",
                    "Value": "Please fill in"
                }
            ]
        }
    ],
    "Additional Information": [
        {
            "Name": "Governance Improvement Plans",
            "Content": [
                {
                    "Name": "Strengthening the Function of the Board of Directors and Supervisory Board",
                    "Description": "The company plans to enhance the efficiency and effectiveness of the board of directors and supervisory board by providing regular training to improve their skills and knowledge. The company will also increase the proportion of independent directors to strengthen the board's independence. Optimization of decision-making processes will be prioritized to drive strategic growth.",
                    "Value": "Please fill in"
                },
                {
                    "Name": "Enhancing Transparency and Quality of Information Disclosure",
                    "Description": "The company aims to improve its information disclosure process and standards to ensure timely, accurate, and comprehensive reporting to all stakeholders. It will enhance its communication channels, website, and investor relations program to provide transparent and accessible information. The company will also seek external assurance to validate the quality of its information disclosure.",
                    "Value": "Please fill in"
                }
            ]
        },
        {
            "Name": "Risk Management Strategy",
            "Content": [
                {
                    "Name": "Strengthening the Internal Control System",
                    "Description": "The company will establish and improve its internal control system to identify, assess, monitor, and report financial and operational risks effectively. It will focus on enhancing internal control mechanisms and employee awareness of risk management. Regular internal audits and risk assessments will be conducted to ensure comprehensive risk coverage.",
                    "Value": "Please fill in"
                },
                {
                    "Name": "Integrating Sustainable Development and Social Responsibility",
                    "Description": "The company plans to integrate sustainable development and social responsibility into its strategy by conducting regular assessments to identify related risks and opportunities. By addressing environmental and social aspects, it aims to achieve long-term value creation. The company will actively engage stakeholders to drive positive change.",
                    "Value": "Please fill in"
                }
            ]
        }
    ],
    "Generated Outline": "I. Introduction\n   A. Background information\n      1. Company name: Entertainment Enterprises Inc.\n      2. Establishment date: January 1, 2000\n      3. Main business: Production and distribution of films, TV shows, and music\n      4. Registration location: Los Angeles, California\n      5. Listing status: Publicly listed on NASDAQ\n      6. Industry: Entertainment\n   B. Purpose and scope of the report\n   \nII. Governance Structure\n   A. Significant events\n      1. Sustainability and Social Responsibility Initiatives (January, 2019)\n         a. Launch of Sustainability Program\n            - Description: Entertainment Enterprises Inc. launched a comprehensive sustainability program, aiming to reduce its carbon footprint and implement various environmentally friendly practices.\n            - Impact: The company's sustainability program helped reduce operating costs, improve resource efficiency, and demonstrate environmental responsibility, leading to positive public perception and enhanced brand reputation.\n         b. Diversity and Inclusion Initiative\n            - Description: Entertainment Enterprises Inc. implemented a company-wide diversity and inclusion initiative, promoting equal opportunities and fostering a diverse workforce.\n            - Impact: The diversity and inclusion initiative improved the company's reputation as an inclusive and diverse workplace, enhancing employee satisfaction, fostering innovation, and attracting top talent.\n         c. Community Engagement Programs\n            - Description: Entertainment Enterprises Inc. actively supported various community engagement programs aimed at making a positive impact in local communities.\n            - Impact: Engaging with the community fostered goodwill, strengthened relationships with stakeholders, and improved the company's public image by showcasing its commitment to social responsibility.\n         d. Philanthropic Initiatives\n            - Description: Entertainment Enterprises Inc. initiated philanthropic efforts by providing financial support to causes aligned with its values.\n            - Impact: The company's philanthropic initiatives demonstrated its commitment to giving back, enhanced its reputation as a socially responsible organization, and helped address important societal issues.\n      2. Board of Directors Change (February, 2019)\n         - Description: The appointment of two new independent directors, Jennifer Adams and Michael Collins.\n         - Impact: The appointment of experienced and knowledgeable directors strengthens the board's decision-making process, influencing the company's long-term development direction positively and enhancing shareholder interests.\n      3. Shareholders' Meeting Resolution (March, 2019)\n         - Description: Several key decisions made at the annual shareholders' meeting, including the approval of an increase in authorized share capital, election of new board members, and dividend payment approval.\n         - Impact: The shareholders' decisions directly influence the company's governance structure, future operational strategies, and the rights of shareholders.\n      4. Ethics and Integrity Incidents (July, 2019)\n         - Description: The company identified an internal fraud incident and took prompt action to address it.\n         - Impact: Addressing the integrity violation promptly prevents damage to the company's reputation and brand value, preserving positive relationships with investors, customers, and partners.\n      5. Compliance and Regulatory Updates (August, 2019)\n         - Description: The company proactively updated its compliance practices to adhere to the latest regulatory changes in the entertainment industry.\n         - Impact: Ensuring compliance with evolving laws and regulations reduces legal risks, safeguarding the company's reputation and securing investor, customer, and partner relationships.\n      6. Corporate Governance Policy Revision (September, 2019)\n         - Description: Updates to the corporate governance framework were made to ensure the highest level of transparency, accountability, and stakeholder engagement.\n         - Impact: The revised corporate governance policy significantly improves transparency and accountability, reinforcing stakeholder confidence and fostering a responsible corporate culture.\n      7. Risk Management Measures (October, 2019)\n         - Description: The company strengthened risk management measures in response to emerging risks.\n         - Impact: Enhancing the company's risk management capabilities improves resilience against internal and external risks, ensuring continuous operations and stable development.\n      8. Senior Management Changes (December, 2019)\n         - Description: The company appointed Sarah Johnson as its new Chief Executive Officer.\n         - Impact: The appointment of a new CEO may lead to adjustments in operational focus and strategic priorities, impacting short-term performance and long-term development.\n   B. Involved indicators\n      1. Information Disclosure\n         - Description: The company upholds principles of timely, accurate, and comprehensive information disclosure.\n         - Value: The company discloses financial reports semi-annually, holds quarterly earnings conference calls, and provides access to relevant information on its investor relations page.\n      2. Related Transactions\n         - Description: The company maintains strict policies and procedures to ensure fairness and compliance in all related transactions.\n         - Value: All related transactions are approved by the board of directors, comply with applicable regulations, and are disclosed in the annual reports.\n      3. Internal Control\n         - Description: The company has a well-defined and effectively implemented internal control framework.\n         - Value: Please fill in\n   \nIII. Additional Information\n   A. Governance Improvement Plans\n      1. Strengthening the Function of the Board of Directors and Supervisory Board\n         - Description: The company plans to enhance the efficiency and effectiveness of the board of directors and supervisory board.\n         - Value: Please fill in\n      2. Enhancing Transparency and Quality of Information Disclosure\n         - Description: The company aims to improve its information disclosure process and standards.\n         - Value: Please fill in\n   B. Risk Management Strategy\n      1. Strengthening the Internal Control System\n         - Description: The company will establish and improve its internal control system to effectively manage financial and operational risks.\n         - Value: Please fill in\n      2. Integrating Sustainable Development and Social Responsibility\n         - Description: The company plans to integrate sustainable development and social responsibility into its strategy.\n         - Value: Please fill in",
    "Generated Summary": "Entertainment Enterprises Inc., established on January 1, 2000, is a publicly listed entertainment company on NASDAQ that specializes in the production and distribution of films, TV shows, and music, with its registration location in Los Angeles, California.",
    "Generated Article": "The purpose of this report is to provide a comprehensive analysis of Entertainment Enterprises Inc.'s governance structure, significant events, and indicators related to information disclosure, related transactions, and internal control. By examining these aspects, we can gain insights into the company's governance practices and their impact on its overall performance and stakeholder relationships.\n\nIn January 2019, Entertainment Enterprises Inc. launched a comprehensive sustainability program aimed at reducing its carbon footprint and implementing environmentally friendly practices. This initiative had a significant impact on the company, resulting in reduced operating costs, improved resource efficiency, and a positive public perception of its environmental responsibility. The sustainability program also enhanced the company's brand reputation and demonstrated its commitment to addressing environmental challenges.\n\nIn the same month, Entertainment Enterprises Inc. implemented a diversity and inclusion initiative, promoting equal opportunities and fostering a diverse workforce. This initiative had a positive impact on the company's reputation as an inclusive and diverse workplace, leading to improved employee satisfaction, increased innovation, and the attraction of top talent. By embracing diversity and inclusion, Entertainment Enterprises Inc. positioned itself as a progressive and forward-thinking organization within the entertainment industry.\n\nAdditionally, Entertainment Enterprises Inc. actively supported various community engagement programs, making a positive impact in local communities. This commitment to community engagement fostered goodwill, strengthened relationships with stakeholders, and improved the company's public image. By actively engaging with the community, Entertainment Enterprises Inc. showcased its dedication to social responsibility and demonstrated its commitment to making a difference beyond its core business operations.\n\nFurthermore, Entertainment Enterprises Inc. initiated philanthropic efforts by providing financial support to causes aligned with its values. These philanthropic initiatives not only demonstrated the company's commitment to giving back but also enhanced its reputation as a socially responsible organization. By addressing important societal issues through philanthropy, Entertainment Enterprises Inc. positioned itself as a responsible corporate citizen and garnered support from various stakeholders.\n\nIn February 2019, Entertainment Enterprises Inc. appointed two new independent directors, Jennifer Adams and Michael Collins, to its board of directors. This appointment strengthened the board's decision-making process and positively influenced the company's long-term development direction. With the addition of experienced and knowledgeable directors, Entertainment Enterprises Inc. enhanced its governance structure and prioritized the interests of its shareholders.\n\nIn March 2019, several key decisions were made at the annual shareholders' meeting, including the approval of an increase in authorized share capital, the election of new board members, and the approval of dividend payments. These decisions directly impacted the company's governance structure, future operational strategies, and the rights of shareholders. By actively involving shareholders in decision-making processes, Entertainment Enterprises Inc. ensured transparency and accountability in its governance practices.\n\nIn July 2019, Entertainment Enterprises Inc. identified an internal fraud incident and took prompt action to address it. This swift response to the integrity violation prevented damage to the company's reputation and brand value, preserving positive relationships with investors, customers, and partners. By prioritizing ethics and integrity, Entertainment Enterprises Inc. demonstrated its commitment to maintaining high standards of corporate conduct.\n\nIn August 2019, Entertainment Enterprises Inc. proactively updated its compliance practices to adhere to the latest regulatory changes in the entertainment industry. This commitment to compliance ensured that the company operated within the bounds of the law, reducing legal risks and safeguarding its reputation. By staying abreast of evolving regulations, Entertainment Enterprises Inc. demonstrated its dedication to responsible and ethical business practices.\n\nIn September 2019, Entertainment Enterprises Inc. revised its corporate governance policy to ensure the highest level of transparency, accountability, and stakeholder engagement. This revision significantly improved the company's transparency and accountability, reinforcing stakeholder confidence and fostering a responsible corporate culture. By prioritizing good governance, Entertainment Enterprises Inc. positioned itself as a trustworthy and reliable organization.\n\nIn October 2019, Entertainment Enterprises Inc. strengthened its risk management measures in response to emerging risks. This proactive approach to risk management enhanced the company's resilience against internal and external risks, ensuring continuous operations and stable development. By effectively managing risks, Entertainment Enterprises Inc. safeguarded its business and protected the interests of its stakeholders.\n\nFinally, in December 2019, Entertainment Enterprises Inc. appointed Sarah Johnson as its new Chief Executive Officer. This appointment may lead to adjustments in operational focus and strategic priorities, impacting the company's short-term performance and long-term development. With a new CEO at the helm, Entertainment Enterprises Inc. has the opportunity to drive innovation, adapt to changing market dynamics, and position itself for future success.\n\nIn conclusion, Entertainment Enterprises Inc. has demonstrated a strong commitment to governance excellence through its sustainability and social responsibility initiatives, board of directors' changes, shareholders' meeting resolutions, ethics and integrity incidents, compliance and regulatory updates, corporate governance policy revision, risk management measures, and senior management changes. These events have had a significant impact on the company's performance, stakeholder relationships, and overall reputation. By prioritizing transparency, accountability, and responsible business practices, Entertainment Enterprises Inc. has positioned itself as a leader in the entertainment industry."
}