{
    "Report Type": "Corporate Financial Report",
    "Report Time": "2019",
    "Company Information": {
        "Name": "Entertainment Enterprises Inc.",
        "Establishment Date": "January 1, 2000",
        "Main Business": "Production and distribution of films, TV shows, and music",
        "Registration Location": "Los Angeles, California",
        "Listing Status": "Publicly listed on NASDAQ",
        "Industry": "Entertainment"
    },
    "Report Content": [
        {
            "Type": "Financial Information",
            "Significant Events": [
                {
                    "Event": "Major Investment",
                    "Time": "March, 2019",
                    "Description": "The company invested $50 million in the production of a blockbuster film titled 'The Great Escape', projected to generate $300 million in global box office revenue.",
                    "Impact": "Further broadened the company's business areas, enhanced profitability.",
                    "Sub Events": [
                        {
                            "Event": "Expansion of Digital Distribution Platform",
                            "Time": "January, 2019",
                            "Description": "Entertainment Enterprises Inc. announced the expansion of its digital distribution platform, adding more titles from its extensive film and TV library, and partnering with major streaming platforms for exclusive content licensing.",
                            "Impact": "Increased revenue streams and audience reach through digital channels."
                        },
                        {
                            "Event": "Acquisition of Production Studio",
                            "Time": "February, 2019",
                            "Description": "Entertainment Enterprises Inc. successfully acquired a renowned production studio specializing in high-quality visual effects and animation. The acquisition aimed to bolster internal production capabilities and strengthen the company's competitive edge.",
                            "Impact": "Streamlined production processes and improved control over creative components, allowing for higher-quality content."
                        }
                    ]
                },
                {
                    "Event": "Significant Equity Acquisition",
                    "Time": "June, 2019",
                    "Description": "The company completed the acquisition of 30% equity of Music Productions Inc., a leading record label.",
                    "Impact": "Further expanded the company's market share, enhanced the company's control."
                },
                {
                    "Event": "Debt Restructuring",
                    "Time": "July, 2019",
                    "Description": "To optimize capital structure, the company underwent debt restructuring, reducing liabilities by $20 million.",
                    "Impact": "Improved the company's financial condition, reduced financial costs."
                },
                {
                    "Event": "Large-scale Financing",
                    "Time": "August, 2019",
                    "Description": "The company conducted a large-scale financing activity, raising $100 million of funds through a bond issuance.",
                    "Impact": "Strengthened the company's financial strength, supported expansion and development."
                },
                {
                    "Event": "Asset Restructuring",
                    "Time": "October, 2019",
                    "Description": "The company underwent an asset restructuring, selling non-core assets and focusing on its core entertainment businesses.",
                    "Impact": "Improved operational efficiency, increased company value."
                },
                {
                    "Event": "Major Asset Acquisition",
                    "Time": "November, 2019",
                    "Description": "The company completed the acquisition of Dream Studios, a prominent film production company, for a total value of $200 million.",
                    "Impact": "Expanded the company's business scope, enhanced market competitiveness."
                },
                {
                    "Event": "Dividend Distribution",
                    "Time": "December, 2019",
                    "Description": "The company decided to distribute $5 million of dividends to shareholders.",
                    "Impact": "Returned to the investors, enhanced shareholder returns."
                }
            ],
            "Involved Indicators": [
                {
                    "Indicator": "Operating Income",
                    "Description": "The total amount of main business income and other business income within a certain accounting period.",
                    "Influencing Factors": [
                        "Market Demand",
                        "Changes in Product Prices"
                    ],
                    "Value": "$500 million"
                },
                {
                    "Indicator": "Net Profit",
                    "Description": "The net income of the company within a certain accounting period, i.e., total income minus total costs and taxes.",
                    "Influencing Factors": [
                        "Operating Income",
                        "Cost Control",
                        "Non-recurring Gains and Losses"
                    ],
                    "Value": "$50 million"
                },
                {
                    "Indicator": "Total Assets",
                    "Description": "The total amount of assets owned by the company at the end of the accounting period.",
                    "Influencing Factors": [
                        "Asset Acquisition",
                        "Asset Disposal",
                        "Asset Revaluation"
                    ],
                    "Value": "$1.2 billion"
                },
                {
                    "Indicator": "Total Liabilities",
                    "Description": "The total amount of debts the company is obligated to repay at the end of the accounting period.",
                    "Influencing Factors": [
                        "New Debt Issuance",
                        "Debt Repayment",
                        "Debt Restructuring"
                    ],
                    "Value": "$300 million"
                },
                {
                    "Indicator": "Shareholder Equity",
                    "Description": "The total amount of equity belonging to shareholders at the end of the accounting period.",
                    "Influencing Factors": [
                        "Net Profit",
                        "Dividend Distribution",
                        "Capital Reserves"
                    ],
                    "Value": "$900 million"
                },
                {
                    "Indicator": "Cash Flow",
                    "Description": "The total cash inflows and outflows of the company within a certain accounting period.",
                    "Influencing Factors": [
                        "Operating Activities",
                        "Investment Activities",
                        "Financing Activities"
                    ],
                    "Value": "$100 million"
                },
                {
                    "Indicator": "Debt Ratio",
                    "Description": "The ratio of total liabilities to total assets, reflecting the company's debt level.",
                    "Influencing Factors": [
                        "Changes in Total Liabilities",
                        "Changes in Total Assets"
                    ],
                    "Value": "25%"
                },
                {
                    "Indicator": "Debt to Assets Ratio",
                    "Description": "The percentage of total liabilities to total assets, a measure of the company's financial leverage.",
                    "Influencing Factors": [
                        "Increases or decreases in assets and liabilities"
                    ],
                    "Value": "25%"
                },
                {
                    "Indicator": "Return on Equity",
                    "Description": "Reflects the operational efficiency of shareholder equity, namely the ratio of net profit to average shareholder equity.",
                    "Influencing Factors": [
                        "Change in Net Profit",
                        "Change in Shareholder Equity"
                    ],
                    "Value": "12%"
                }
            ]
        }
    ],
    "Additional Information": [
        {
            "Name": "Future Outlook",
            "Content": [
                {
                    "Name": "Financial Strategy",
                    "Description": "The company plans to implement a cost control strategy to optimize operational efficiency while continuing to explore strategic capital operations to fuel growth and increase profitability."
                },
                {
                    "Name": "Investment Plans",
                    "Description": "Entertainment Enterprises Inc. aims to invest $150 million in the development of original content, build partnerships with emerging talent, and expand its presence in international markets."
                },
                {
                    "Name": "Risk Management",
                    "Description": "The major financial risks identified by the company include market volatility, technological disruptions, and shifts in consumer behavior. To manage these risks, the company will closely monitor market trends, invest in innovative technologies, and maintain a diversified portfolio of entertainment offerings."
                }
            ]
        }
    ],
    "Generated Outline": "I. Introduction\n    A. Company Information\n        1. Name: Entertainment Enterprises Inc.\n        2. Establishment Date: January 1, 2000\n        3. Main Business: Production and distribution of films, TV shows, and music\n        4. Registration Location: Los Angeles, California\n        5. Listing Status: Publicly listed on NASDAQ\n        6. Industry: Entertainment\n\nII. Financial Information\n    A. Significant Events\n        1. Major Investment (March, 2019)\n            a. Description: The company invested $50 million in the production of a blockbuster film titled \"The Great Escape\", projected to generate $300 million in global box office revenue.\n            b. Impact: Further broadened the company's business areas, enhanced profitability.\n            c. Sub Events:\n                i. Expansion of Digital Distribution Platform (January, 2019)\n                    - Description: Announcement of expanding the digital distribution platform, adding more titles from the film and TV library, and partnering with major streaming platforms for exclusive content licensing.\n                    - Impact: Increased revenue streams and audience reach through digital channels.\n                ii. Acquisition of Production Studio (February, 2019)\n                    - Description: Acquisition of a renowned production studio specializing in visual effects and animation to bolster internal production capabilities and strengthen the company's competitive edge.\n                    - Impact: Streamlined production processes and improved control over creative components, allowing for higher-quality content.\n        2. Significant Equity Acquisition (June, 2019)\n            - Description: Completion of the acquisition of 30% equity of Music Productions Inc., a leading record label.\n            - Impact: Further expanded the company's market share, enhanced the company's control.\n        3. Debt Restructuring (July, 2019)\n            - Description: Debt restructuring to optimize the capital structure and reduce liabilities by $20 million.\n            - Impact: Improved the company's financial condition, reduced financial costs.\n        4. Large-scale Financing (August, 2019)\n            - Description: Conducted a large-scale financing activity, raising $100 million of funds through a bond issuance.\n            - Impact: Strengthened the company's financial strength, supported expansion and development.\n        5. Asset Restructuring (October, 2019)\n            - Description: Asset restructuring involving the sale of non-core assets and focusing on core entertainment businesses.\n            - Impact: Improved operational efficiency, increased company value.\n        6. Major Asset Acquisition (November, 2019)\n            - Description: Completion of the acquisition of Dream Studios, a prominent film production company, for a total value of $200 million.\n            - Impact: Expanded the company's business scope, enhanced market competitiveness.\n        7. Dividend Distribution (December, 2019)\n            - Description: Decision to distribute $5 million of dividends to shareholders.\n            - Impact: Returned to the investors, enhanced shareholder returns.\n\n    B. Involved Indicators\n        1. Operating Income (Value: $500 million)\n            - Description: The total amount of main business income and other business income within a certain accounting period.\n            - Influencing Factors: Market Demand, Changes in Product Prices\n        2. Net Profit (Value: $50 million)\n            - Description: The net income of the company within a certain accounting period, i.e., total income minus total costs and taxes.\n            - Influencing Factors: Operating Income, Cost Control, Non-recurring Gains and Losses\n        3. Total Assets (Value: $1.2 billion)\n            - Description: The total amount of assets owned by the company at the end of the accounting period.\n            - Influencing Factors: Asset Acquisition, Asset Disposal, Asset Revaluation\n        4. Total Liabilities (Value: $300 million)\n            - Description: The total amount of debts the company is obligated to repay at the end of the accounting period.\n            - Influencing Factors: New Debt Issuance, Debt Repayment, Debt Restructuring\n        5. Shareholder Equity (Value: $900 million)\n            - Description: The total amount of equity belonging to shareholders at the end of the accounting period.\n            - Influencing Factors: Net Profit, Dividend Distribution, Capital Reserves\n        6. Cash Flow (Value: $100 million)\n            - Description: The total cash inflows and outflows of the company within a certain accounting period.\n            - Influencing Factors: Operating Activities, Investment Activities, Financing Activities\n        7. Debt Ratio (Value: 25%)\n            - Description: The ratio of total liabilities to total assets, reflecting the company's debt level.\n            - Influencing Factors: Changes in Total Liabilities, Changes in Total Assets\n        8. Debt to Assets Ratio (Value: 25%)\n            - Description: The percentage of total liabilities to total assets, a measure of the company's financial leverage.\n            - Influencing Factors: Increases or decreases in assets and liabilities\n        9. Return on Equity (Value: 12%)\n            - Description: Reflects the operational efficiency of shareholder equity, namely the ratio of net profit to average shareholder equity.\n            - Influencing Factors: Change in Net Profit, Change in Shareholder Equity\n\nIII. Additional Information\n    A. Future Outlook\n        1. Financial Strategy\n            - Description: The company plans to implement a cost control strategy to optimize operational efficiency while continuing to explore strategic capital operations to fuel growth and increase profitability.\n        2. Investment Plans\n            - Description: Entertainment Enterprises Inc. aims to invest $150 million in the development of original content, build partnerships with emerging talent, and expand its presence in international markets.\n        3. Risk Management\n            - Description: The major financial risks identified by the company include market volatility, technological disruptions, and shifts in consumer behavior. To manage these risks, the company will closely monitor market trends, invest in innovative technologies, and maintain a diversified portfolio of entertainment offerings.",
    "Generated Summary": "Entertainment Enterprises Inc. is an entertainment company that was established on January 1, 2000, in Los Angeles, California, and is primarily engaged in the production and distribution of films, TV shows, and music.",
    "Generated Article": "In March 2019, Entertainment Enterprises Inc. made a major investment of $50 million in the production of the blockbuster film \"The Great Escape\". This investment was projected to generate $300 million in global box office revenue. The company's decision to invest in this film further broadened its business areas and enhanced profitability. Additionally, in January 2019, the company announced the expansion of its digital distribution platform, adding more titles from its film and TV library and partnering with major streaming platforms for exclusive content licensing. This move increased revenue streams and expanded the company's audience reach through digital channels. In February 2019, Entertainment Enterprises Inc. acquired a renowned production studio specializing in visual effects and animation. This acquisition aimed to bolster the company's internal production capabilities and strengthen its competitive edge. By streamlining production processes and improving control over creative components, the company was able to deliver higher-quality content.\n\nIn June 2019, Entertainment Enterprises Inc. completed the acquisition of 30% equity of Music Productions Inc., a leading record label. This significant equity acquisition further expanded the company's market share and enhanced its control in the music industry. In July 2019, the company underwent debt restructuring, optimizing its capital structure and reducing liabilities by $20 million. This move improved the company's financial condition and reduced financial costs. In August 2019, Entertainment Enterprises Inc. conducted a large-scale financing activity, raising $100 million of funds through a bond issuance. This strengthened the company's financial strength and supported its expansion and development.\n\nIn October 2019, the company underwent asset restructuring, focusing on core entertainment businesses and selling non-core assets. This strategic move improved operational efficiency and increased the company's overall value. In November 2019, Entertainment Enterprises Inc. completed the acquisition of Dream Studios, a prominent film production company, for a total value of $200 million. This major asset acquisition expanded the company's business scope and enhanced its market competitiveness. Finally, in December 2019, the company decided to distribute $5 million of dividends to its shareholders, further enhancing shareholder returns.\n\nThese significant events had a direct impact on various financial indicators of Entertainment Enterprises Inc. The company's operating income reached $500 million, reflecting the total amount of main business income and other business income within a certain accounting period. This increase in operating income can be attributed to market demand and changes in product prices. The net profit of the company amounted to $50 million, which is the net income within a certain accounting period after deducting total costs and taxes from total income. The net profit was influenced by the operating income, cost control measures, and non-recurring gains and losses.\n\nEntertainment Enterprises Inc. reported total assets of $1.2 billion, representing the total amount of assets owned by the company at the end of the accounting period. This increase in total assets can be attributed to asset acquisitions, asset disposals, and asset revaluation. The company's total liabilities amounted to $300 million, reflecting the total amount of debts the company is obligated to repay at the end of the accounting period. The debt ratio, which is the ratio of total liabilities to total assets, stood at 25%. This indicates a moderate level of debt for the company. The debt to assets ratio, which is the percentage of total liabilities to total assets, also stood at 25%, indicating a balanced financial leverage for the company.\n\nThe shareholder equity of Entertainment Enterprises Inc. amounted to $900 million, representing the total amount of equity belonging to shareholders at the end of the accounting period. The return on equity, which reflects the operational efficiency of shareholder equity, was 12%. This ratio is calculated by dividing the net profit by the average shareholder equity. The return on equity was influenced by changes in net profit and changes in shareholder equity.\n\nIn terms of cash flow, Entertainment Enterprises Inc. reported a total cash flow of $100 million within a certain accounting period. This cash flow includes cash inflows and outflows from operating activities, investment activities, and financing activities. The company's financial strategy focuses on cost control measures to optimize operational efficiency while exploring strategic capital operations to fuel growth and increase profitability. Additionally, the company plans to invest $150 million in the development of original content, build partnerships with emerging talent, and expand its presence in international markets. To manage financial risks, Entertainment Enterprises Inc. closely monitors market trends, invests in innovative technologies, and maintains a diversified portfolio of entertainment offerings.\n\nOverall, Entertainment Enterprises Inc. has experienced significant growth and success in the entertainment industry. Through strategic investments, acquisitions, and restructuring, the company has expanded its business areas, enhanced profitability, and strengthened its market competitiveness. With a solid financial position and a focus on future growth, Entertainment Enterprises Inc. is well-positioned for continued success in the entertainment industry."
}