{
    "住院病历": {
        "基本信息": {
            "姓名": "秦某某",
            "性别": "女",
            "年龄": "13岁",
            "民族": "汉族",
            "婚姻状况": "未婚",
            "职业": "学生",
            "住址": "暮光市椰风街37号",
            "入院时间": "11月11日",
            "记录时间": "11月11日",
            "病史陈述者": "患者本人",
            "医院名称": "暮光市人民医院"
        },
        "主诉": "发热伴游走性关节炎3天",
        "现病史": {
            "发病情况": "11月8日傍晚，患者在家中突然出现发热，体温高达39°C，起病较急。无明显前驱症状及诱因。",
            "主要症状特点": "发热伴游走性关节炎，最初发生在左膝关节，后转移至右肘关节和左肩关节。局部红肿热痛，活动受限。",
            "伴随症状": "伴有心悸、乏力、多形性红斑及舞蹈症样不自主运动，以四肢为主，情绪激动时加重。",
            "诊疗经过及结果": "入院前曾在当地诊所用退烧药及抗生素治疗，退热效果欠佳，症状未见缓解。",
            "一般情况变化": "精神萎靡不振，食欲减退，入睡困难，大便正常，小便量少，体重无明显变化。"
        },
        "既往史": {
            "一般健康状况": "一向健康",
            "疾病史": "无",
            "传染病史": "无明显传染病史",
            "预防接种史": "接种齐全",
            "手术外伤史": "无",
            "输血史": "无",
            "过敏史": "无特殊药物过敏史"
        },
        "个人史": {
            "出生地": "暮光市",
            "居留地": "暮光市",
            "生活习惯": "有规律的作息时间，喜食甜食",
            "职业及工作条件": "学生，学习压力较大",
            "接触史": "无有害物质接触史",
            "冶游史": "无"
        },
        "婚育史及家族史": {
            "婚育史": {
                "婚姻状况": "未婚",
                "结婚年龄": "",
                "配偶健康状况": "",
                "子女情况": ""
            },
            "月经史": {
                "初潮年龄": "11岁",
                "行经期天数": "5天",
                "间隔天数": "28天",
                "末次月经时间": "10月25日",
                "月经量": "中等",
                "痛经情况": "轻度痛经"
            },
            "家族史": "父母及一兄一姊，均健康。家族中无类似疾病及遗传倾向。"
        },
        "体格检查": {
            "一般情况": {
                "体温": "38.5°C",
                "脉搏": "96次/分",
                "呼吸": "22次/分",
                "血压": "110/70 mmHg"
            },
            "系统检查": {
                "皮肤": "多形性红斑，特别是四肢部位",
                "粘膜": "正常",
                "淋巴结": "无肿大",
                "头部及器官": "无异常",
                "颈部": "柔软无抵抗",
                "胸部": "心脏心尖部可闻及收缩期杂音，肺部无异常",
                "腹部": "软，无压痛，肝脾未及",
                "直肠肛门": "未查",
                "外生殖器": "未查",
                "脊柱": "无畸形",
                "四肢": "左膝关节、右肘关节和左肩关节红肿，压痛明显，活动受限",
                "神经系统": "舞蹈症样不自主运动"
            }
        },
        "专科检查": "心脏听诊示左心缘2/6级收缩期杂音",
        "辅助检查": "血常规：白细胞计数增多，C反应蛋白增高。心电图：窦性心动过速、境界性心律不齐。超声心动图：心脏轻度扩大。",
        "初步诊断": "急性风湿热",
        "诊断依据": "患者有发热、游走性关节炎、心脏炎、和多形性红斑、舞蹈症等症状。病史、体格检查发现多形性红斑、心脏听诊杂音、舞蹈症状，结合血常规及心电图、超声心动图检查结果，符合急性风湿热的诊断标准。",
        "鉴别诊断": "需要鉴别链球菌感染后反应性关节炎，但本病例有心脏炎、多形性红斑及舞蹈症，不符合链球菌感染后反应性关节炎的诊断。",
        "入院记录": {
            "医师签名": "李医生"
        },
        "入院后病程记录": {
            "首次病程记录": "患者入院后血常规白细胞计数增多，C反应蛋白增高，心电图、超声心动图异常，初步诊断急性风湿热。计划立即予抗风湿治疗和抗生素治疗。监测体温、心脏听诊情况及血常规变化。",
            "日常病程记录": "每日监测体温及心脏听诊情况，症状无明显变化。",
            "上级医师查房记录": "主任医师王医生查房，意见同意目前治疗，建议继续观察血常规及心功能情况。",
            "疑难病例讨论记录": "无",
            "交（接）班记录": "无特殊变化，按常规治疗进行。",
            "转科记录": "无",
            "阶段小结": "患者入院两周，经抗风湿治疗及抗感染治疗，体温降至正常，关节炎有所缓解，但心脏杂音仍存。继续目前治疗，密切观察。",
            "抢救记录": "无",
            "有创诊疗操作记录": "无",
            "会诊记录": "心内科会诊建议继续抗风湿治疗，密切观察心功能变化。",
            "出院记录": "未出院",
            "病重（病危）患者护理记录": "无病重病危情况，常规护理"
        },
        "医嘱": {
            "长期医嘱单": "1. 口服阿司匹林 2. 继续抗生素治疗 3. 心功能监测",
            "临时医嘱单": "无"
        },
        "辅助检查报告单": "心电图、血常规、CRP测定、超声心动图",
        "体温单": "体温：38.5°C，脉搏：96次/分，呼吸：22次/分，血压：110/70 mmHg",
        "输血治疗知情同意书": "无",
        "特殊检查同意书": "无",
        "病危（重）通知书": "无"
    },
    "病种": {
        "循环系统疾病": {
            "名称": "急性风湿热",
            "症状": "发热、游走性关节炎、心脏炎、和多形性红斑、舞蹈症等",
            "鉴别诊断": "链球菌感染后反应性关节炎"
        }
    },
    "生成文章": "暮光市人民医院住院病历\n\n基本信息:\n姓名: 秦某某\n性别: 女\n年龄: 13岁\n民族: 汉族\n婚姻状况: 未婚\n职业: 学生\n住址: 暮光市椰风街37号\n入院时间: 11月11日\n记录时间: 11月11日\n病史陈述者: 患者本人\n医院名称: 暮光市人民医院\n\n主诉:\n发热伴游走性关节炎3天\n\n现病史:\n发病情况:\n11月8日傍晚，患者在家中突然出现发热，体温高达39°C，起病较急。无明显前驱症状及诱因。\n\n主要症状特点:\n发热伴游走性关节炎，最初发生在左膝关节，后转移至右肘关节和左肩关节。局部红肿热痛，活动受限。\n\n伴随症状:\n伴有心悸、乏力、多形性红斑及舞蹈症样不自主运动，以四肢为主，情绪激动时加重。\n\n诊疗经过及结果:\n入院前曾在当地诊所用退烧药及抗生素治疗，退热效果欠佳，症状未见缓解。\n\n一般情况变化:\n精神萎靡不振，食欲减退，入睡困难，大便正常，小便量少，体重无明显变化。\n\n既往史:\n一般健康状况: 一向健康\n疾病史: 无\n传染病史: 无明显传染病史\n预防接种史: 接种齐全\n手术外伤史: 无\n输血史: 无\n过敏史: 无特殊药物过敏史\n\n个人史:\n出生地: 暮光市\n居留地: 暮光市\n生活习惯: 有规律的作息时间，喜食甜食\n职业及工作条件: 学生，学习压力较大\n接触史: 无有害物质接触史\n冶游史: 无\n\n婚育史及家族史:\n婚育史:\n- 婚姻状况: 未婚\n- 结婚年龄: \n- 配偶健康状况: \n- 子女情况: \n\n月经史:\n- 初潮年龄: 11岁\n- 行经期天数: 5天\n- 间隔天数: 28天\n- 末次月经时间: 10月25日\n- 月经量: 中等\n- 痛经情况: 轻度痛经\n\n家族史: 父母及一兄一姊，均健康。家族中无类似疾病及遗传倾向。\n\n体格检查:\n一般情况:\n- 体温: 38.5°C\n- 脉搏: 96次/分\n- 呼吸: 22次/分\n- 血压: 110/70 mmHg\n\n系统检查:\n- 皮肤: 多形性红斑，特别是四肢部位\n- 粘膜: 正常\n- 淋巴结: 无肿大\n- 头部及器官: 无异常\n- 颈部: 柔软无抵抗\n- 胸部: 心脏心尖部可闻及收缩期杂音，肺部无异常\n- 腹部: 软，无压痛，肝脾未及\n- 直肠肛门: 未查\n- 外生殖器: 未查\n- 脊柱: 无畸形\n- 四肢: 左膝关节、右肘关节和左肩关节红肿，压痛明显，活动受限\n- 神经系统: 舞蹈症样不自主运动\n\n专科检查: 心脏听诊示左心缘2/6级收缩期杂音\n\n辅助检查: 血常规：白细胞计数增多，C反应蛋白增高。心电图：窦性心动过速、境界性心律不齐。超声心动图：心脏轻度扩大。\n\n初步诊断: 急性风湿热\n\n诊断依据: 患者有发热、游走性关节炎、心脏炎、和多形性红斑、舞蹈症等症状。病史、体格检查发现多形性红斑、心脏听诊杂音、舞蹈症状，结合血常规及心电图、超声心动图检查结果，符合急性风湿热的诊断标准。\n\n鉴别诊断: 需要鉴别链球菌感染后反应性关节炎，但本病例有心脏炎、多形性红斑及舞蹈症，不符合链球菌感染后反应性关节炎的诊断。\n\n入院记录: 李医生\n\n入院后病程记录:\n- 首次病程记录: 患者入院后血常规白细胞计数增多，C反应蛋白增高，心电图、超声心动图异常，初步诊断急性风湿热。计划立即予抗风湿治疗和抗生素治疗。监测体温、心脏听诊情况及血常规变化。\n- 日常病程记录: 每日监测体温及心脏听诊情况，症状无明显变化。\n- 上级医师查房记录: 主任医师王医生查房，意见同意目前治疗，建议继续观察血常规及心功能情况。\n- 疑难病例讨论记录: 无\n- 交（接）班记录: 无特殊变化，按常规治疗进行。\n- 转科记录: 无\n- 阶段小结: 患者入院两周，经抗风湿治疗及抗感染治疗，体温降至正常，关节炎有所缓解，但心脏杂音仍存。继续目前治疗，密切观察。\n- 抢救记录: 无\n- 有创诊疗操作记录: 无\n- 会诊记录: 心内科会诊建议继续抗风湿治疗，密切观察心功能变化。\n- 出院记录: 未出院\n- 病重（病危）患者护理记录: 无病重病危情况，常规护理\n\n医嘱:\n长期医嘱单:\n1. 口服阿司匹林\n2. 继续抗生素治疗\n3. 心功能监测\n\n辅助检查报告单: 心电图、血常规、CRP测定、超声心动图\n\n体温单: 体温：38.5°C，脉搏：96次/分，呼吸：22次/分，血压：110/70 mmHg\n\n输血治疗知情同意书: 无\n\n特殊检查同意书: 无\n\n病危（重）通知书: 无",
    "qa_fact_based": [
        {
            "问题类型": "事实性问题",
            "问题": "根据暮光市人民医院的住院病历，秦某某的入院时间是什么时候？",
            "答案": "11月11日",
            "ref": [
                "入院时间: 11月11日"
            ]
        },
        {
            "问题类型": "事实性问题",
            "问题": "根据暮光市人民医院的住院病历，秦某某的病史陈述者是谁？",
            "答案": "患者本人",
            "ref": [
                "病史陈述者: 患者本人"
            ]
        },
        {
            "问题类型": "事实性问题",
            "问题": "根据暮光市人民医院的住院病历，秦某某的主诉是什么？",
            "答案": "发热伴游走性关节炎3天",
            "ref": [
                "主诉:",
                "发热伴游走性关节炎3天"
            ]
        },
        {
            "问题类型": "事实性问题",
            "问题": "根据暮光市人民医院的住院病历，秦某某的初步诊断结果是什么？",
            "答案": "急性风湿热",
            "ref": [
                "初步诊断: 急性风湿热",
                "- 首次病程记录: 患者入院后血常规白细胞计数增多，C反应蛋白增高，心电图、超声心动图异常，初步诊断急性风湿热。"
            ]
        },
        {
            "问题类型": "事实性问题",
            "问题": "根据暮光市人民医院的住院病历，秦某某的体温是多少？",
            "答案": "38.5°C",
            "ref": [
                "- 体温: 38.5°C"
            ]
        }
    ],
    "qa_multi_hop": [
        {
            "问题类型": "多跳推理问题",
            "问题": "根据暮光市人民医院的住院病历，秦某某进行了几项辅助检查？",
            "答案": "根据病历，秦某某进行了4项辅助检查，分别为血常规、心电图、超声心动图和CRP测定。",
            "ref": [
                "辅助检查: 血常规：白细胞计数增多，C反应蛋白增高。",
                "心电图：窦性心动过速、境界性心律不齐。",
                "超声心动图：心脏轻度扩大。",
                "辅助检查报告单: 心电图、血常规、CRP测定、超声心动图"
            ]
        }
    ],
    "qa_summary": [
        {
            "问题类型": "总结性问题",
            "问题": "根据暮光市人民医院的住院病历，总结秦某某的病史。",
            "答案": "秦某某，女，13岁，学生，11月8日傍晚在家中突然出现发热，体温高达39°C，起病较急。发热伴游走性关节炎，最初发生在左膝关节，后转移至右肘关节和左肩关节。伴有心悸、乏力、多形性红斑及舞蹈症样不自主运动。入院前曾在当地诊所用退烧药及抗生素治疗，退热效果欠佳，症状未见缓解。精神萎靡不振，食欲减退，入睡困难。既往一向健康，无明显传染病史，接种齐全，无手术外伤史及输血史，无特殊药物过敏史。",
            "ref": [
                "姓名: 秦某某",
                "性别: 女",
                "年龄: 13岁",
                "职业: 学生",
                "11月8日傍晚，患者在家中突然出现发热，体温高达39°C，起病较急。",
                "发热伴游走性关节炎，最初发生在左膝关节，后转移至右肘关节和左肩关节。",
                "伴有心悸、乏力、多形性红斑及舞蹈症样不自主运动，以四肢为主，情绪激动时加重。",
                "入院前曾在当地诊所用退烧药及抗生素治疗，退热效果欠佳，症状未见缓解。",
                "精神萎靡不振，食欲减退，入睡困难，大便正常，小便量少，体重无明显变化。",
                "一般健康状况: 一向健康",
                "传染病史: 无明显传染病史",
                "预防接种史: 接种齐全",
                "手术外伤史: 无",
                "输血史: 无",
                "过敏史: 无特殊药物过敏史"
            ]
        },
        {
            "问题类型": "总结性问题",
            "问题": "根据暮光市人民医院的住院病历，总结秦某某的体格检查结果。",
            "答案": "秦某某入院时体温38.5°C，脉搏96次/分，呼吸22次/分，血压110/70 mmHg。皮肤多形性红斑，特别是四肢部位。心脏心尖部可闻及收缩期杂音，肺部无异常。左膝关节、右肘关节和左肩关节红肿，压痛明显，活动受限。神经系统检查发现舞蹈症样不自主运动。",
            "ref": [
                "- 体温: 38.5°C",
                "- 脉搏: 96次/分",
                "- 呼吸: 22次/分",
                "- 血压: 110/70 mmHg",
                "- 皮肤: 多形性红斑，特别是四肢部位",
                "- 胸部: 心脏心尖部可闻及收缩期杂音，肺部无异常",
                "- 四肢: 左膝关节、右肘关节和左肩关节红肿，压痛明显，活动受限",
                "- 神经系统: 舞蹈症样不自主运动"
            ]
        },
        {
            "问题类型": "总结性问题",
            "问题": "根据暮光市人民医院的住院病历，总结秦某某的诊断依据。",
            "答案": "秦某某有发热、游走性关节炎、心脏炎、多形性红斑和舞蹈症等症状。体格检查发现多形性红斑、心脏听诊杂音、舞蹈症状。血常规显示白细胞计数增多，C反应蛋白增高。心电图显示窦性心动过速、境界性心律不齐，超声心动图显示心脏轻度扩大。这些结果符合急性风湿热的诊断标准。",
            "ref": [
                "诊断依据: 患者有发热、游走性关节炎、心脏炎、和多形性红斑、舞蹈症等症状。",
                "病史、体格检查发现多形性红斑、心脏听诊杂音、舞蹈症状，结合血常规及心电图、超声心动图检查结果，符合急性风湿热的诊断标准。",
                "辅助检查: 血常规：白细胞计数增多，C反应蛋白增高。",
                "心电图：窦性心动过速、境界性心律不齐。",
                "超声心动图：心脏轻度扩大。"
            ]
        },
        {
            "问题类型": "总结性问题",
            "问题": "根据暮光市人民医院的住院病历，总结秦某某的治疗方案。",
            "答案": "秦某某的治疗方案包括抗风湿治疗和抗生素治疗，监测体温、心脏听诊情况及血常规变化。长期医嘱单包括口服阿司匹林、继续抗生素治疗和心功能监测。心内科会诊建议继续抗风湿治疗，密切观察心功能变化。",
            "ref": [
                "计划立即予抗风湿治疗和抗生素治疗。",
                "监测体温、心脏听诊情况及血常规变化。",
                "1. 口服阿司匹林",
                "2. 继续抗生素治疗",
                "3. 心功能监测",
                "- 会诊记录: 心内科会诊建议继续抗风湿治疗，密切观察心功能变化。"
            ]
        },
        {
            "问题类型": "总结性问题",
            "问题": "根据暮光市人民医院的住院病历，总结秦某某的入院后病程记录。",
            "答案": "秦某某入院后血常规白细胞计数增多，C反应蛋白增高，心电图、超声心动图异常，初步诊断为急性风湿热。计划立即予抗风湿治疗和抗生素治疗，监测体温、心脏听诊情况及血常规变化。每日监测体温及心脏听诊情况，症状无明显变化。主任医师王医生查房，意见同意目前治疗，建议继续观察血常规及心功能情况。患者入院两周后，体温降至正常，关节炎有所缓解，但心脏杂音仍存。继续目前治疗，密切观察。",
            "ref": [
                "- 首次病程记录: 患者入院后血常规白细胞计数增多，C反应蛋白增高，心电图、超声心动图异常，初步诊断急性风湿热。",
                "计划立即予抗风湿治疗和抗生素治疗。",
                "监测体温、心脏听诊情况及血常规变化。",
                "- 日常病程记录: 每日监测体温及心脏听诊情况，症状无明显变化。",
                "- 上级医师查房记录: 主任医师王医生查房，意见同意目前治疗，建议继续观察血常规及心功能情况。",
                "- 阶段小结: 患者入院两周，经抗风湿治疗及抗感染治疗，体温降至正常，关节炎有所缓解，但心脏杂音仍存。"
            ]
        }
    ]
}