{
    "报告类型": "公司环境与社会责任报告",
    "报告时间": "2021年度",
    "公司信息": {
        "名称": "环保科技有限公司",
        "成立日期": "2005年6月",
        "主营业务": "环保技术研发与应用",
        "注册地": "北京市朝阳区",
        "上市情况": "环保科技有限公司于2010年在上海证券交易所上市",
        "行业": "环保"
    },
    "报告内容": [
        {
            "类型": "环境责任",
            "重要事件": [
                {
                    "事件": "采用环境管理系统",
                    "时间": "2021年3月",
                    "描述": "公司实施环境管理系统（EMS），以提高环境绩效，减少废物产生，并确保合规。",
                    "影响": "增强了公司的环境管理能力和持续改进，提升了合规性和市场认可度。"
                },
                {
                    "事件": "植树造林计划",
                    "时间": "2021年5月",
                    "描述": "公司推出植树造林计划，积极参与森林保护和生态恢复。",
                    "影响": "通过增加森林覆盖率，改善生态环境，促进生物多样性保护和碳汇效应。"
                },
                {
                    "事件": "投资于碳抵消项目",
                    "时间": "2021年6月",
                    "描述": "公司通过投资林业项目或可再生能源项目来抵消其碳排放，努力实现碳中和目标。",
                    "影响": "通过碳抵消证书，公司能够向利益相关者展示其对环境的承诺和责任。"
                },
                {
                    "事件": "节能减排项目实施",
                    "时间": "2021年9月",
                    "描述": "公司投资实施的节能减排项目，旨在减少能源消耗和温室气体排放。",
                    "影响": "直接减少了公司的能源消耗和碳足迹，提高了能效和环境绩效。"
                },
                {
                    "事件": "绿色产品开发",
                    "时间": "2021年11月",
                    "描述": "公司开发的环保型产品，减少对环境的影响。",
                    "影响": "提升了产品的市场竞争力和品牌形象，同时减少了环境影响。"
                },
                {
                    "事件": "防止污染设施的建设",
                    "时间": "2021年12月",
                    "描述": "公司建立新的污染防治设施，如废水处理系统和排放控制设备，以减少环境污染。",
                    "影响": "显著降低了公司的环境污染水平，增强了合规性和社会责任感。"
                }
            ],
            "涉及的指标": [
                {
                    "指标": "二氧化碳排放量",
                    "描述": "公司在生产过程中产生的二氧化碳总量。",
                    "影响因素": [
                        "生产规模的变化",
                        "节能技术的应用"
                    ],
                    "值": "30000吨"
                },
                {
                    "指标": "能源消耗",
                    "描述": "公司在运营过程中消耗的能源总量。",
                    "影响因素": [
                        "生产效率的提高",
                        "能源管理措施的实施"
                    ],
                    "值": "50000吨标准煤"
                }
            ]
        },
        {
            "类型": "社会责任",
            "重要事件": [
                {
                    "事件": "员工职业成长和人才发展计划",
                    "时间": "2021年1月",
                    "描述": "公司提供各类培训和发展项目，支持员工职业成长，包括在线课程、工作坊、导师计划等。",
                    "影响": "提高了员工的专业技能和工作满意度，促进了人才的留存和发展。"
                },
                {
                    "事件": "员工健康与安全计划",
                    "时间": "2021年4月",
                    "描述": "公司实施的旨在提升员工健康与安全的措施。",
                    "影响": "显著改善了工作环境，减少了工伤事故，提高了员工的健康与安全水平。"
                },
                {
                    "事件": "参与慈善活动",
                    "时间": "2021年7月",
                    "描述": "公司参与或资助慈善活动和慈善机构，以支持教育、健康、减贫等领域。",
                    "影响": "提高了公司的社会形象和品牌认知，加强了与社区的联系和支持。"
                },
                {
                    "事件": "建立公平就业机会",
                    "时间": "2021年8月",
                    "描述": "公司致力于提供公平、平等的就业机会，消除歧视，打造多元化和包容性的工作环境。",
                    "影响": "提升了员工的工作满意度和忠诚度，塑造了公平公正的企业形象。"
                },
                {
                    "事件": "社区支持和发展项目",
                    "时间": "2021年9月",
                    "描述": "公司投资于当地社区，支持教育、健康和社会发展项目。",
                    "影响": "加深了公司与社区的联系，促进了社区的整体福祉和发展。"
                },
                {
                    "事件": "参与公共服务项目",
                    "时间": "2021年12月",
                    "描述": "公司投资或参与公共服务项目，如城市绿化、公共卫生改善项目，以提升社区生活质量。",
                    "影响": "促进了社区的可持续发展，增强了公众对公司的积极感知。"
                }
            ],
            "涉及的指标": [
                {
                    "指标": "员工满意度",
                    "描述": "通过调查得到的员工对公司环境和政策满意度的度量。",
                    "影响因素": [
                        "工作环境的改善",
                        "员工福利政策的调整"
                    ],
                    "值": "85%"
                },
                {
                    "指标": "社区投资额",
                    "描述": "公司在社区发展项目上的投资总额。",
                    "影响因素": [
                        "公司的财务状况",
                        "社会责任战略的变化"
                    ],
                    "值": "500万元"
                }
            ]
        }
    ],
    "额外信息": [
        {
            "名称": "未来展望",
            "内容": [
                {
                    "名称": "环境保护计划",
                    "描述": "采取一系列措施减少其运营对环境的影响，包括改进生产工艺、提升能效、降低废物排放等。"
                },
                {
                    "名称": "社会责任战略",
                    "描述": "在业务实践中积极履行社会责任，包括促进社区发展、改善员工福利、提供公平就业机会和参与公益活动。"
                },
                {
                    "名称": "可持续发展目标",
                    "描述": "通过整合可持续性原则到业务模型和决策过程中，致力于实现联合国可持续发展目标（SDGs），包括降低碳排放、保护生态环境和提升社会公益等。"
                }
            ]
        }
    ],
    "生成大纲": "报告大纲：\n\n一. 公司信息\n     a. 公司名称：环保科技有限公司\n     b. 成立日期：2005年6月\n     c. 主营业务：环保技术研发与应用\n     d. 注册地：北京市朝阳区\n     e. 上市情况：环保科技有限公司于2010年在上海证券交易所上市\n     f. 行业：环保\n\n二. 环境责任\n     a. 采用环境管理系统\n        - 时间点：2021年3月\n        - 描述：公司实施环境管理系统（EMS），以提高环境绩效，减少废物产生，并确保合规。\n        - 影响：增强了公司的环境管理能力和持续改进，提升了合规性和市场认可度。\n\n     b. 植树造林计划\n        - 时间点：2021年5月\n        - 描述：公司推出植树造林计划，积极参与森林保护和生态恢复。\n        - 影响：通过增加森林覆盖率，改善生态环境，促进生物多样性保护和碳汇效应。\n\n     c. 投资于碳抵消项目\n        - 时间点：2021年6月\n        - 描述：公司通过投资林业项目或可再生能源项目来抵消其碳排放，努力实现碳中和目标。\n        - 影响：通过碳抵消证书，公司能够向利益相关者展示其对环境的承诺和责任。\n\n     d. 节能减排项目实施\n        - 时间点：2021年9月\n        - 描述：公司投资实施的节能减排项目，旨在减少能源消耗和温室气体排放。\n        - 影响：直接减少了公司的能源消耗和碳足迹，提高了能效和环境绩效。\n\n     e. 绿色产品开发\n        - 时间点：2021年11月\n        - 描述：公司开发的环保型产品，减少对环境的影响。\n        - 影响：提升了产品的市场竞争力和品牌形象，同时减少了环境影响。\n\n     f. 防止污染设施的建设\n        - 时间点：2021年12月\n        - 描述：公司建立新的污染防治设施，如废水处理系统和排放控制设备，以减少环境污染。\n        - 影响：显著降低了公司的环境污染水平，增强了合规性和社会责任感。\n\n  涉及的指标：\n     a. 二氧化碳排放量\n        - 描述：公司在生产过程中产生的二氧化碳总量。\n        - 影响因素：生产规模的变化、节能技术的应用\n        - 值：30000吨\n\n     b. 能源消耗\n        - 描述：公司在运营过程中消耗的能源总量。\n        - 影响因素：生产效率的提高、能源管理措施的实施\n        - 值：50000吨标准煤\n\n三. 社会责任\n     a. 员工职业成长和人才发展计划\n        - 时间点：2021年1月\n        - 描述：公司提供各类培训和发展项目，支持员工职业成长，包括在线课程、工作坊、导师计划等。\n        - 影响：提高了员工的专业技能和工作满意度，促进了人才的留存和发展。\n\n     b. 员工健康与安全计划\n        - 时间点：2021年4月\n        - 描述：公司实施的旨在提升员工健康与安全的措施。\n        - 影响：显著改善了工作环境，减少了工伤事故，提高了员工的健康与安全水平。\n\n     c. 参与慈善活动\n        - 时间点：2021年7月\n        - 描述：公司参与或资助慈善活动和慈善机构，以支持教育、健康、减贫等领域。\n        - 影响：提高了公司的社会形象和品牌认知，加强了与社区的联系和支持。\n\n     d. 建立公平就业机会\n        - 时间点：2021年8月\n        - 描述：公司致力于提供公平、平等的就业机会，消除歧视，打造多元化和包容性的工作环境。\n        - 影响：提升了员工的工作满意度和忠诚度，塑造了公平公正的企业形象。\n\n     e. 社区支持和发展项目\n        - 时间点：2021年9月\n        - 描述：公司投资于当地社区，支持教育、健康和社会发展项目。\n        - 影响：加深了公司与社区的联系，促进了社区的整体福祉和发展。\n\n     f. 参与公共服务项目\n        - 时间点：2021年12月\n        - 描述：公司投资或参与公共服务项目，如城市绿化、公共卫生改善项目，以提升社区生活质量。\n        - 影响：促进了社区的可持续发展，增强了公众对公司的积极感知。\n\n  涉及的指标：\n     a. 员工满意度\n        - 描述：通过调查得到的员工对公司环境和政策满意度的度量。\n        - 影响因素：工作环境的改善、员工福利政策的调整\n        - 值：85%\n\n     b. 社区投资额\n        - 描述：公司在社区发展项目上的投资总额。\n        - 影响因素：公司的财务状况、社会责任战略的变化\n        - 值：500万元\n\n四. 未来展望\n   - 环境保护计划：采取一系列措施减少其运营对环境的影响，包括改进生产工艺、提升能效、降低废物排放等。\n   - 社会责任战略：在业务实践中积极履行社会责任，包括促进社区发展、改善员工福利、提供公平就业机会和参与公益活动。\n   - 可持续发展目标：通过整合可持续性原则到业务模型和决策过程中，致力于实现联合国可持续发展目标（SDGs），包括降低碳排放、保护生态环境和提升社会公益等。",
    "生成总结": "环保科技有限公司是一家成立于2005年6月的位于北京市朝阳区的环保技术研发与应用公司，于2010年在上海证券交易所上市。",
    "生成文章": "公司一直以来都致力于环境责任和社会责任的履行。在2021年3月，公司开始实施环境管理系统（EMS），以提高环境绩效，减少废物产生，并确保合规。这一举措增强了公司的环境管理能力和持续改进，提升了合规性和市场认可度。\n\n为了积极参与森林保护和生态恢复，公司于2021年5月推出了植树造林计划。通过增加森林覆盖率，改善生态环境，促进生物多样性保护和碳汇效应。\n\n为了实现碳中和目标，公司于2021年6月开始投资于碳抵消项目。通过投资林业项目或可再生能源项目来抵消其碳排放，公司向利益相关者展示了其对环境的承诺和责任。\n\n为了减少能源消耗和温室气体排放，公司于2021年9月投资实施了节能减排项目。这些项目直接减少了公司的能源消耗和碳足迹，提高了能效和环境绩效。\n\n为了减少对环境的影响，公司于2021年11月开发了一系列环保型产品。这些产品不仅提升了公司的市场竞争力和品牌形象，同时也减少了对环境的影响。\n\n为了减少环境污染，公司于2021年12月建立了新的污染防治设施，如废水处理系统和排放控制设备。这些设施的建设显著降低了公司的环境污染水平，增强了合规性和社会责任感。\n\n在指标方面，公司的二氧化碳排放量为30000吨，能源消耗为50000吨标准煤。\n\n除了环境责任，公司也积极履行社会责任。公司于2021年1月推出了员工职业成长和人才发展计划，提供各类培训和发展项目，支持员工职业成长，提高了员工的专业技能和工作满意度，促进了人才的留存和发展。\n\n为了提升员工健康与安全，公司于2021年4月实施了一系列措施。这些措施显著改善了工作环境，减少了工伤事故，提高了员工的健康与安全水平。\n\n为了支持社区发展，公司于2021年7月参与或资助了慈善活动和慈善机构。这些举措提高了公司的社会形象和品牌认知，加强了与社区的联系和支持。\n\n为了提供公平就业机会，公司于2021年8月致力于消除歧视，打造多元化和包容性的工作环境。这些举措提升了员工的工作满意度和忠诚度，塑造了公平公正的企业形象。\n\n为了促进社区的整体福祉和发展，公司于2021年9月投资于当地社区，支持教育、健康和社会发展项目。这些举措加深了公司与社区的联系，促进了社区的整体福祉和发展。\n\n为了提升社区生活质量，公司于2021年12月投资或参与公共服务项目，如城市绿化、公共卫生改善项目。这些举措促进了社区的可持续发展，增强了公众对公司的积极感知。\n\n在指标方面，公司的员工满意度为85%，社区投资额为500万元。\n\n未来展望方面，公司将继续采取一系列措施减少其运营对环境的影响，包括改进生产工艺、提升能效、降低废物排放等。同时，在业务实践中积极履行社会责任，包括促进社区发展、改善员工福利、提供公平就业机会和参与公益活动。公司还将整合可持续性原则到业务模型和决策过程中，致力于实现联合国可持续发展目标（SDGs），包括降低碳排放、保护生态环境和提升社会公益等。"
}