{
    "报告类型": "公司财务报告",
    "报告时间": "2019年度",
    "公司信息": {
        "名称": "文化传媒有限公司",
        "成立日期": "2005年3月15日",
        "主营业务": "提供文化传媒服务，包括影视制作、音乐发行、艺人经纪等",
        "注册地": "上海市",
        "上市情况": "未上市",
        "行业": "文化"
    },
    "报告内容": [
        {
            "类型": "财务信息",
            "重要事件": [
                {
                    "事件": "分发股利",
                    "时间": "2019年3月",
                    "描述": "公司决定向股东分发1000万元股利，每股派发0.5元。",
                    "影响": "回报给股东们的投资，提升了股东的收益。",
                    "子事件": [
                        {
                            "事件": "财务审计",
                            "时间": "2019年1月",
                            "描述": "公司进行了年度财务审计，审计结果显示公司财务状况良好。",
                            "影响": "审计结果让投资者对公司的财务状况产生信心，提升了公司的声誉和股东价值。"
                        },
                        {
                            "事件": "营收增长",
                            "时间": "2019年1月至2月",
                            "描述": "公司在一季度内实现了较去年同期增长10%的营收。",
                            "影响": "营收的增长表明公司业务稳健，为公司决定分发股利提供了充足的资金来源。"
                        },
                        {
                            "事件": "财务分析",
                            "时间": "2019年2月",
                            "描述": "公司财务团队根据业绩数据进行了详细的财务分析和预测。",
                            "影响": "财务分析结果为公司决定分发股利提供了数据支持，保证了分红决策的合理性。"
                        }
                    ]
                },
                {
                    "事件": "大规模融资",
                    "时间": "2019年6月",
                    "描述": "公司进行了一次大规模的融资活动，募集了3亿元资金，用于新项目投资和业务扩张。",
                    "影响": "加强了公司的资金实力，支持了公司的扩张和发展。"
                },
                {
                    "事件": "员工减少",
                    "时间": "2019年6月",
                    "描述": "公司进行结构调整，裁减了部分员工，以降低成本。",
                    "影响": "降低了人员成本，提升了运营效率。"
                },
                {
                    "事件": "债务重组",
                    "时间": "2019年8月",
                    "描述": "为优化资本结构，公司进行了债务重组，减少了2亿元负债，提高了财务杠杆比率。",
                    "影响": "改善了公司的财务状况，降低了财务成本。"
                },
                {
                    "事件": "重大投资",
                    "时间": "2019年9月",
                    "描述": "公司投资了《西游记》系列电影项目，投资金额为1亿元。",
                    "影响": "进一步拓宽了公司的业务领域，提升了公司的盈利能力。"
                },
                {
                    "事件": "重大股权收购",
                    "时间": "2019年10月",
                    "描述": "公司完成了对绿野电影有限公司的股权收购，获得了70%的股权。",
                    "影响": "进一步扩大了公司的市场份额，提升了公司的控制力。"
                },
                {
                    "事件": "资产重组",
                    "时间": "2019年11月",
                    "描述": "公司将其旗下的音乐发行业务与F唱片公司合并，优化了公司的业务结构和资源配置。",
                    "影响": "提高了公司的运营效率，增加了公司的价值。"
                },
                {
                    "事件": "重大资产收购",
                    "时间": "2019年12月",
                    "描述": "公司完成了对太阳影视有限公司的资产收购，总价值3000万元。",
                    "影响": "扩大公司业务范围，增强市场竞争力。"
                }
            ],
            "涉及的指标": [
                {
                    "指标": "营业收入",
                    "描述": "公司在一定会计期间内的主营业务收入和其他业务收入总额。",
                    "影响因素": [
                        "市场需求变化",
                        "产品价格变化"
                    ],
                    "值": "3200万元"
                },
                {
                    "指标": "净利润",
                    "描述": "公司在一定会计期间的净收入，即总收入减去总成本和所得税费用后的金额。",
                    "影响因素": [
                        "营业收入",
                        "成本控制",
                        "非经常性损益"
                    ],
                    "值": "800万元"
                },
                {
                    "指标": "总资产",
                    "描述": "会计期末，公司所拥有的资产总额。",
                    "影响因素": [
                        "资产收购",
                        "资产处置",
                        "资产重估"
                    ],
                    "值": "15000万元"
                },
                {
                    "指标": "总负债",
                    "描述": "会计期末，公司所承担并需要偿还的债务总额。",
                    "影响因素": [
                        "新债发行",
                        "债务偿还",
                        "债务重组"
                    ],
                    "值": "8000万元"
                },
                {
                    "指标": "股东权益",
                    "描述": "会计期末，归属于股东的权益总额。",
                    "影响因素": [
                        "净利润",
                        "股利发放",
                        "资本公积"
                    ],
                    "值": "7000万元"
                },
                {
                    "指标": "现金流量",
                    "描述": "公司在一定会计期间内的现金流入和流出总和。",
                    "影响因素": [
                        "经营活动",
                        "投资活动",
                        "筹资活动"
                    ],
                    "值": "2000万元"
                },
                {
                    "指标": "负债比率",
                    "描述": "公司总负债与总资产的比率，反映公司的债务水平。",
                    "影响因素": [
                        "总负债的变化",
                        "总资产的变化"
                    ],
                    "值": "53.33%"
                },
                {
                    "指标": "资产负债率",
                    "描述": "公司总负债占总资产的百分比，衡量公司财务杠杆的一个指标。",
                    "影响因素": [
                        "资产和负债的增减变化"
                    ],
                    "值": "53.33%"
                },
                {
                    "指标": "净资产收益率",
                    "描述": "反映公司股东权益的经营效益，即净利润与平均股东权益的比率。",
                    "影响因素": [
                        "净利润的变化",
                        "股东权益的变化"
                    ],
                    "值": "11.43%"
                }
            ]
        }
    ],
    "额外信息": [
        {
            "名称": "未来展望",
            "内容": [
                {
                    "名称": "财务策略",
                    "描述": "公司未来计划实施的财务策略，包括降低成本、提高资金利用效率、优化资本结构等。",
                    "具体信息": {
                        "降低成本策略": "通过精简管理层、优化业务流程等方式降低人员和运营成本。",
                        "提高资金利用效率策略": "加强资金管理、优化现金流量、有效控制投资风险等。",
                        "优化资本结构策略": "进一步减少负债，提高股东权益比例，以降低财务风险。"
                    }
                },
                {
                    "名称": "投资计划",
                    "描述": "公司面向未来的投资计划，主要集中在影视制作、音乐发行、艺人经纪等相关领域。计划投资金额预计在5000万元左右。",
                    "具体信息": {
                        "影视制作": "加大对优质电影、电视剧、网络剧等项目的投资，提升公司在影视行业的品牌和影响力。",
                        "音乐发行": "扩大音乐发行业务的规模，加强与唱片公司、艺人的合作，拓展音乐市场。",
                        "艺人经纪": "发掘和培养优秀艺人，提供全方位的经纪管理服务，打造明星团队。"
                    }
                },
                {
                    "名称": "风险管理",
                    "描述": "公司识别的主要财务风险以及应对这些风险的策略。",
                    "具体信息": {
                        "市场风险": "加强市场调研，及时掌握市场变化，及时调整经营策略。",
                        "政策风险": "密切关注相关行业政策变化，适时调整业务布局。",
                        "竞争风险": "提高核心竞争力，不断创新，加强产品和服务的差异化。",
                        "资金风险": "严格控制财务风险，优化资金运作，合理融资，避免过度依赖债务。",
                        "人才风险": "完善人才培养体系，提高员工培训和激励机制，留住核心人才。",
                        "技术风险": "加大研发投入，提升技术水平，把握技术发展趋势。"
                    }
                }
            ]
        }
    ],
    "生成大纲": "报告大纲：公司财务报告（2019年度）\n\n1. 财务信息\n   1.1 重要事件\n      1.1.1 分发股利（2019年3月）\n         - 公司决定向股东分发1000万元股利，每股派发0.5元。\n         - 影响：回报给股东们的投资，提升了股东的收益。\n         - 子事件：\n            - 财务审计（2019年1月）\n               - 公司进行了年度财务审计，审计结果显示公司财务状况良好。\n               - 影响：审计结果让投资者对公司的财务状况产生信心，提升了公司的声誉和股东价值。\n            - 营收增长（2019年1月至2月）\n               - 公司在一季度内实现了较去年同期增长10%的营收。\n               - 影响：营收的增长表明公司业务稳健，为公司决定分发股利提供了充足的资金来源。\n            - 财务分析（2019年2月）\n               - 公司财务团队根据业绩数据进行了详细的财务分析和预测。\n               - 影响：财务分析结果为公司决定分发股利提供了数据支持，保证了分红决策的合理性。\n      1.1.2 大规模融资（2019年6月）\n         - 公司进行了一次大规模的融资活动，募集了3亿元资金，用于新项目投资和业务扩张。\n         - 影响：加强了公司的资金实力，支持了公司的扩张和发展。\n      1.1.3 员工减少（2019年6月）\n         - 公司进行结构调整，裁减了部分员工，以降低成本。\n         - 影响：降低了人员成本，提升了运营效率。\n      1.1.4 债务重组（2019年8月）\n         - 为优化资本结构，公司进行了债务重组，减少了2亿元负债，提高了财务杠杆比率。\n         - 影响：改善了公司的财务状况，降低了财务成本。\n      1.1.5 重大投资（2019年9月）\n         - 公司投资了《西游记》系列电影项目，投资金额为1亿元。\n         - 影响：进一步拓宽了公司的业务领域，提升了公司的盈利能力。\n      1.1.6 重大股权收购（2019年10月）\n         - 公司完成了对绿野电影有限公司的股权收购，获得了70%的股权。\n         - 影响：进一步扩大了公司的市场份额，提升了公司的控制力。\n      1.1.7 资产重组（2019年11月）\n         - 公司将其旗下的音乐发行业务与F唱片公司合并，优化了公司的业务结构和资源配置。\n         - 影响：提高了公司的运营效率，增加了公司的价值。\n      1.1.8 重大资产收购（2019年12月）\n         - 公司完成了对太阳影视有限公司的资产收购，总价值3000万元。\n         - 影响：扩大公司业务范围，增强市场竞争力。\n\n   1.2 涉及的指标\n      1.2.1 营业收入\n         - 描述：公司在一定会计期间内的主营业务收入和其他业务收入总额。\n         - 影响因素：市场需求变化、产品价格变化。\n         - 值：3200万元\n      1.2.2 净利润\n         - 描述：公司在一定会计期间的净收入，即总收入减去总成本和所得税费用后的金额。\n         - 影响因素：营业收入、成本控制、非经常性损益。\n         - 值：800万元\n      1.2.3 总资产\n         - 描述：会计期末，公司所拥有的资产总额。\n         - 影响因素：资产收购、资产处置、资产重估。\n         - 值：15000万元\n      1.2.4 总负债\n         - 描述：会计期末，公司所承担并需要偿还的债务总额。\n         - 影响因素：新债发行、债务偿还、债务重组。\n         - 值：8000万元\n      1.2.5 股东权益\n         - 描述：会计期末，归属于股东的权益总额。\n         - 影响因素：净利润、股利发放、资本公积。\n         - 值：7000万元\n      1.2.6 现金流量\n         - 描述：公司在一定会计期间内的现金流入和流出总和。\n         - 影响因素：经营活动、投资活动、筹资活动。\n         - 值：2000万元\n      1.2.7 负债比率\n         - 描述：公司总负债与总资产的比率，反映公司的债务水平。\n         - 影响因素：总负债的变化、总资产的变化。\n         - 值：53.33%\n      1.2.8 资产负债率\n         - 描述：公司总负债占总资产的百分比，衡量公司财务杠杆的一个指标。\n         - 影响因素：资产和负债的增减变化。\n         - 值：53.33%\n      1.2.9 净资产收益率\n         - 描述：反映公司股东权益的经营效益，即净利润与平均股东权益的比率。\n         - 影响因素：净利润的变化、股东权益的变化。\n         - 值：11.43%\n\n2. 额外信息\n   2.1 未来展望\n      2.1.1 财务策略\n         - 描述：公司未来计划实施的财务策略，包括降低成本、提高资金利用效率、优化资本结构等。\n         - 具体信息：\n            - 降低成本策略：通过精简管理层、优化业务流程等方式降低人员和运营成本。\n            - 提高资金利用效率策略：加强资金管理、优化现金流量、有效控制投资风险等。\n            - 优化资本结构策略：进一步减少负债，提高股东权益比例，以降低财务风险。\n      2.1.2 投资计划\n         - 描述：公司面向未来的投资计划，主要集中在影视制作、音乐发行、艺人经纪等相关领域。计划投资金额预计在5000万元左右。\n         - 具体信息：\n            - 影视制作：加大对优质电影、电视剧、网络剧等项目的投资，提升公司在影视行业的品牌和影响力。\n            - 音乐发行：扩大音乐发行业务的规模，加强与唱片公司、艺人的合作，拓展音乐市场。\n            - 艺人经纪：发掘和培养优秀艺人，提供全方位的经纪管理服务，打造明星团队。\n      2.1.3 风险管理\n         - 描述：公司识别的主要财务风险以及应对这些风险的策略。\n         - 具体信息：\n            - 市场风险：加强市场调研，及时掌握市场变化，及时调整经营策略。\n            - 政策风险：密切关注相关行业政策变化，适时调整业务布局。\n            - 竞争风险：提高核心竞争力，不断创新，加强产品和服务的差异化。\n            - 资金风险：严格控制财务风险，优化资金运作，合理融资，避免过度依赖债务。\n            - 人才风险：完善人才培养体系，提高员工培训和激励机制，留住核心人才。\n            - 技术风险：加大研发投入，提升技术水平，把握技术发展趋势。",
    "生成总结": "文化传媒有限公司是一家于2005年成立的上海企业，主要经营文化传媒服务，包括影视制作、音乐发行、艺人经纪等业务，目前尚未上市，专注于文化行业。",
    "生成文章": "2019年度是文化传媒有限公司取得重要成就的一年。首先，在2019年3月，公司决定向股东分发1000万元股利，每股派发0.5元。这一决策是在经过2019年1月的财务审计后做出的，审计结果显示公司财务状况良好，为分发股利提供了充足的依据。此外，公司在2019年1月至2月实现了较去年同期增长10%的营收，这表明公司业务稳健，为分发股利提供了充足的资金来源。财务分析结果也为公司决定分发股利提供了数据支持，保证了分红决策的合理性。\n\n另外，2019年6月，公司进行了一次大规模的融资活动，募集了3亿元资金，用于新项目投资和业务扩张。这次融资活动加强了公司的资金实力，为公司的扩张和发展提供了有力支持。然而，为了降低成本，公司在同一月份进行了结构调整，裁减了部分员工。这一举措降低了人员成本，提升了公司的运营效率。\n\n在2019年8月，为优化资本结构，公司进行了债务重组，减少了2亿元负债，提高了财务杠杆比率。这一举措改善了公司的财务状况，降低了财务成本。同年9月，公司投资了《西游记》系列电影项目，投资金额为1亿元。这一重大投资进一步拓宽了公司的业务领域，提升了公司的盈利能力。随后，公司在10月完成了对绿野电影有限公司的股权收购，获得了70%的股权。这一收购进一步扩大了公司的市场份额，提升了公司的控制力。在11月，公司将其旗下的音乐发行业务与F唱片公司合并，优化了公司的业务结构和资源配置。这一资产重组提高了公司的运营效率，增加了公司的价值。最后，在12月，公司完成了对太阳影视有限公司的资产收购，总价值3000万元。这一资产收购扩大了公司的业务范围，增强了公司的市场竞争力。\n\n以上重要事件对公司的财务状况产生了显著影响。根据财务报告，2019年度的营业收入为3200万元，净利润为800万元，总资产为15000万元，总负债为8000万元，股东权益为7000万元，现金流量为2000万元。负债比率为53.33%，资产负债率也为53.33%。净资产收益率为11.43%。\n\n在未来展望方面，公司计划实施一系列财务策略，包括降低成本、提高资金利用效率和优化资本结构。具体而言，公司将通过精简管理层、优化业务流程等方式降低人员和运营成本。同时，公司将加强资金管理、优化现金流量、有效控制投资风险，提高资金利用效率。此外，公司还计划进一步减少负债，提高股东权益比例，以降低财务风险。\n\n公司还制定了未来的投资计划，主要集中在影视制作、音乐发行和艺人经纪等相关领域。计划投资金额预计在5000万元左右。具体而言，公司将加大对优质电影、电视剧、网络剧等项目的投资，提升公司在影视行业的品牌和影响力。同时，公司将扩大音乐发行业务的规模，加强与唱片公司、艺人的合作，拓展音乐市场。此外，公司还将发掘和培养优秀艺人，提供全方位的经纪管理服务，打造明星团队。\n\n为了应对风险，公司制定了一系列风险管理策略。公司将加强市场调研，及时掌握市场变化，及时调整经营策略，以应对市场风险。同时，公司将密切关注相关行业政策变化，适时调整业务布局，应对政策风险。此外，公司将提高核心竞争力，不断创新，加强产品和服务的差异化，以应对竞争风险。公司还将严格控制财务风险，优化资金运作，合理融资，避免过度依赖债务，以应对资金风险。此外，公司将完善人才培养体系，提高员工培训和激励机制，留住核心人才，以应对人才风险。最后，公司将加大研发投入，提升技术水平，把握技术发展趋势，以应对技术风险。\n\n综上所述，文化传媒有限公司在2019年度取得了显著的成绩，并制定了未来的发展计划和风险管理策略。公司将继续努力提升业务水平，优化财务状况，实现可持续发展。",
    "qa_fact_based": [
        {
            "问题类型": "事实性问题",
            "问题": "文化传媒有限公司成立于哪一年？",
            "答案": "2005年。",
            "ref": [
                "文化传媒有限公司是一家于2005年成立的上海企业，主要经营文化传媒服务，包括影视制作、音乐发行、艺人经纪等业务，目前尚未上市，专注于文化行业。"
            ]
        },
        {
            "问题类型": "事实性问题",
            "问题": "文化传媒有限公司在2019年3月分发了多少股利？",
            "答案": "1000万元。",
            "ref": [
                "首先，在2019年3月，公司决定向股东分发1000万元股利，每股派发0.5元。"
            ]
        },
        {
            "问题类型": "事实性问题",
            "问题": "文化传媒有限公司在2019年9月投资了哪个电影项目？",
            "答案": "《西游记》系列电影项目。",
            "ref": [
                "同年9月，公司投资了《西游记》系列电影项目，投资金额为1亿元。"
            ]
        },
        {
            "问题类型": "事实性问题",
            "问题": "文化传媒有限公司在2019年10月收购了哪家公司的股权？",
            "答案": "绿野电影有限公司。",
            "ref": [
                "随后，公司在10月完成了对绿野电影有限公司的股权收购，获得了70%的股权。"
            ]
        },
        {
            "问题类型": "事实性问题",
            "问题": "文化传媒有限公司2019年的营业收入是多少？",
            "答案": "3200万元。",
            "ref": [
                "根据财务报告，2019年度的营业收入为3200万元，净利润为800万元，总资产为15000万元，总负债为8000万元，股东权益为7000万元，现金流量为2000万元。"
            ]
        },
        {
            "问题类型": "事实性问题",
            "问题": "文化传媒有限公司2019年的净利润是多少？",
            "答案": "800万元。",
            "ref": [
                "根据财务报告，2019年度的营业收入为3200万元，净利润为800万元，总资产为15000万元，总负债为8000万元，股东权益为7000万元，现金流量为2000万元。"
            ]
        },
        {
            "问题类型": "事实性问题",
            "问题": "文化传媒有限公司2019年的总资产是多少？",
            "答案": "15000万元。",
            "ref": [
                "根据财务报告，2019年度的营业收入为3200万元，净利润为800万元，总资产为15000万元，总负债为8000万元，股东权益为7000万元，现金流量为2000万元。"
            ]
        }
    ],
    "qa_multi_hop": [
        {
            "问题类型": "多跳推理问题",
            "问题": "根据文化传媒有限公司2019年度财务报告，文化传媒有限公司是如何通过改善财务状况和提高资金利用效率来支持其未来投资计划的？",
            "答案": "文化传媒有限公司2019年度财务报告中提到，通过债务重组和资产重组，公司减少了负债，提高了财务杠杆比率，改善了财务状况；通过加强资金管理和优化现金流量，公司提高了资金利用效率。这些措施为文化传媒有限公司的未来投资计划提供了坚实的财务基础，支持了公司在影视制作、音乐发行和艺人经纪等领域的投资计划。",
            "ref": [
                "在2019年8月，为优化资本结构，公司进行了债务重组，减少了2亿元负债，提高了财务杠杆比率。",
                "这一举措改善了公司的财务状况，降低了财务成本。",
                "在11月，公司将其旗下的音乐发行业务与F唱片公司合并，优化了公司的业务结构和资源配置。",
                "这一资产重组提高了公司的运营效率，增加了公司的价值。",
                "同时，公司将加强资金管理、优化现金流量、有效控制投资风险，提高资金利用效率。",
                "此外，公司还计划进一步减少负债，提高股东权益比例，以降低财务风险。",
                "公司还制定了未来的投资计划，主要集中在影视制作、音乐发行和艺人经纪等相关领域。",
                "计划投资金额预计在5000万元左右。",
                "具体而言，公司将加大对优质电影、电视剧、网络剧等项目的投资，提升公司在影视行业的品牌和影响力。",
                "同时，公司将扩大音乐发行业务的规模，加强与唱片公司、艺人的合作，拓展音乐市场。",
                "此外，公司还将发掘和培养优秀艺人，提供全方位的经纪管理服务，打造明星团队。"
            ]
        },
        {
            "问题类型": "多跳推理问题",
            "问题": "结合文化传媒有限公司2019年度财务报告，文化传媒有限公司如何通过重大投资和资产收购来提升市场竞争力的？",
            "答案": "文化传媒有限公司通过投资《西游记》系列电影项目，进一步拓宽了公司的业务领域，提升了公司的盈利能力；通过收购绿野电影有限公司和太阳影视有限公司的股权和资产，扩大了公司的市场份额和业务范围，增强了市场竞争力。这些措施综合提升了公司的市场竞争力。",
            "ref": [
                "同年9月，公司投资了《西游记》系列电影项目，投资金额为1亿元。",
                "这一重大投资进一步拓宽了公司的业务领域，提升了公司的盈利能力。",
                "随后，公司在10月完成了对绿野电影有限公司的股权收购，获得了70%的股权。",
                "这一收购进一步扩大了公司的市场份额，提升了公司的控制力。",
                "最后，在12月，公司完成了对太阳影视有限公司的资产收购，总价值3000万元。",
                "这一资产收购扩大了公司的业务范围，增强了公司的市场竞争力。"
            ]
        },
        {
            "问题类型": "多跳推理问题",
            "问题": "根据文化传媒有限公司2019年度财务报告，文化传媒有限公司是如何通过分发股利和财务审计来提升股东价值的？",
            "答案": "文化传媒有限公司在2019年3月决定向股东分发1000万元股利，每股派发0.5元，直接回报了股东的投资，提升了股东的收益；此外，公司在2019年1月进行了年度财务审计，审计结果显示公司财务状况良好，增强了投资者对公司的信心，提升了公司的声誉和股东价值。",
            "ref": [
                "首先，在2019年3月，公司决定向股东分发1000万元股利，每股派发0.5元。",
                "这一决策是在经过2019年1月的财务审计后做出的，审计结果显示公司财务状况良好，为分发股利提供了充足的依据。",
                "此外，公司在2019年1月至2月实现了较去年同期增长10%的营收，这表明公司业务稳健，为分发股利提供了充足的资金来源。",
                "财务分析结果也为公司决定分发股利提供了数据支持，保证了分红决策的合理性。"
            ]
        },
        {
            "问题类型": "多跳推理问题",
            "问题": "结合文化传媒有限公司2019年度财务报告，文化传媒有限公司如何通过员工减少和业务重组来提升运营效率的？",
            "答案": "文化传媒有限公司在2019年6月进行了结构调整，裁减了部分员工，降低了人员成本，提升了运营效率；同时，公司在2019年11月将其旗下的音乐发行业务与F唱片公司合并，优化了公司的业务结构和资源配置，提高了公司的运营效率。",
            "ref": [
                "然而，为了降低成本，公司在同一月份进行了结构调整，裁减了部分员工。",
                "这一举措降低了人员成本，提升了公司的运营效率。",
                "在11月，公司将其旗下的音乐发行业务与F唱片公司合并，优化了公司的业务结构和资源配置。",
                "这一资产重组提高了公司的运营效率，增加了公司的价值。"
            ]
        }
    ],
    "qa_summary": [
        {
            "问题类型": "总结性问题",
            "问题": "结合文化传媒有限公司2019年的财务报告，总结其在2019年发生的财务事件。",
            "答案": "根据文化传媒有限公司2019年的财务报告，2019年公司发生了多起重要的财务事件。首先，公司在3月分发了1000万元股利，每股派发0.5元，回报了股东的投资；其次，公司在6月进行了大规模融资，募集了3亿元资金用于新项目投资和业务扩张，同时进行了结构调整，裁减了部分员工以降低成本；8月，公司进行了债务重组，减少了2亿元负债，优化了资本结构；9月，公司投资了1亿元于《西游记》系列电影项目，拓宽了业务领域；10月，公司完成了对绿野电影有限公司70%股权的收购，扩大了市场份额；11月，公司将音乐发行业务与F唱片公司合并，优化了业务结构；12月，公司完成了对太阳影视有限公司价值3000万元的资产收购，增强了市场竞争力。这些事件综合提升了公司的财务状况和市场竞争力。",
            "ref": [
                "首先，在2019年3月，公司决定向股东分发1000万元股利，每股派发0.5元。",
                "另外，2019年6月，公司进行了一次大规模的融资活动，募集了3亿元资金，用于新项目投资和业务扩张。",
                "然而，为了降低成本，公司在同一月份进行了结构调整，裁减了部分员工。",
                "在2019年8月，为优化资本结构，公司进行了债务重组，减少了2亿元负债，提高了财务杠杆比率。",
                "同年9月，公司投资了《西游记》系列电影项目，投资金额为1亿元。",
                "随后，公司在10月完成了对绿野电影有限公司的股权收购，获得了70%的股权。",
                "在11月，公司将其旗下的音乐发行业务与F唱片公司合并，优化了公司的业务结构和资源配置。",
                "最后，在12月，公司完成了对太阳影视有限公司的资产收购，总价值3000万元。"
            ]
        },
        {
            "问题类型": "总结性问题",
            "问题": "结合文化传媒有限公司2019年的财务报告，总结其主要财务指标及其影响因素。",
            "答案": "根据文化传媒有限公司2019年的财务报告，主要财务指标及其影响因素如下：营业收入为3200万元，受市场需求和产品价格变化影响；净利润为800万元，受营业收入、成本控制和非经常性损益影响；总资产为15000万元，受资产收购、处置和重估影响；总负债为8000万元，受新债发行、债务偿还和重组影响；股东权益为7000万元，受净利润、股利发放和资本公积影响；现金流量为2000万元，受经营、投资和筹资活动影响；负债比率和资产负债率均为53.33%，反映了公司的债务水平；净资产收益率为11.43%，反映了股东权益的经营效益。这些指标综合反映了公司的财务健康状况和运营效率。",
            "ref": [
                "根据财务报告，2019年度的营业收入为3200万元，净利润为800万元，总资产为15000万元，总负债为8000万元，股东权益为7000万元，现金流量为2000万元。",
                "负债比率为53.33%，资产负债率也为53.33%。",
                "净资产收益率为11.43%。"
            ]
        },
        {
            "问题类型": "总结性问题",
            "问题": "结合文化传媒有限公司2019年的财务报告，总结其未来展望。",
            "答案": "根据文化传媒有限公司2019年的财务报告，公司对未来展望充满信心。首先，公司计划实施多项财务策略，包括降低成本、提高资金利用效率和优化资本结构；其次，公司有明确的投资计划，预计在影视制作、音乐发行和艺人经纪等领域投资5000万元，以提升品牌和市场影响力；此外，公司识别了主要财务风险，并制定了应对策略，如加强市场调研、关注政策变化、提高核心竞争力、优化资金运作、完善人才培养体系和加大研发投入。总体来看，文化传媒有限公司的未来发展战略明确，前景光明。",
            "ref": [
                "在未来展望方面，公司计划实施一系列财务策略，包括降低成本、提高资金利用效率和优化资本结构。",
                "具体而言，公司将通过精简管理层、优化业务流程等方式降低人员和运营成本。",
                "同时，公司将加强资金管理、优化现金流量、有效控制投资风险，提高资金利用效率。",
                "此外，公司还计划进一步减少负债，提高股东权益比例，以降低财务风险。",
                "公司还制定了未来的投资计划，主要集中在影视制作、音乐发行和艺人经纪等相关领域。",
                "计划投资金额预计在5000万元左右。",
                "具体而言，公司将加大对优质电影、电视剧、网络剧等项目的投资，提升公司在影视行业的品牌和影响力。",
                "同时，公司将扩大音乐发行业务的规模，加强与唱片公司、艺人的合作，拓展音乐市场。",
                "此外，公司还将发掘和培养优秀艺人，提供全方位的经纪管理服务，打造明星团队。",
                "为了应对风险，公司制定了一系列风险管理策略。",
                "公司将加强市场调研，及时掌握市场变化，及时调整经营策略，以应对市场风险。",
                "同时，公司将密切关注相关行业政策变化，适时调整业务布局，应对政策风险。",
                "此外，公司将提高核心竞争力，不断创新，加强产品和服务的差异化，以应对竞争风险。",
                "公司还将严格控制财务风险，优化资金运作，合理融资，避免过度依赖债务，以应对资金风险。",
                "此外，公司将完善人才培养体系，提高员工培训和激励机制，留住核心人才，以应对人才风险。",
                "最后，公司将加大研发投入，提升技术水平，把握技术发展趋势，以应对技术风险。"
            ]
        }
    ]
}