{
    "报告类型": "公司财务报告",
    "报告时间": "2020年度",
    "公司信息": {
        "名称": "诚信消费品有限公司",
        "成立日期": "2005年6月15日",
        "主营业务": "生产和销售各类消费品，如食品、饮料、日用品等",
        "注册地": "中国北京",
        "上市情况": "在纽约证券交易所上市",
        "行业": "消费品"
    },
    "报告内容": [
        {
            "类型": "财务信息",
            "重要事件": [
                {
                    "事件": "重大投资",
                    "时间": "2020年2月",
                    "描述": "公司投资了优质房地产项目，位于北京市中心，投资金额为1.5亿元人民币。",
                    "影响": "进一步拓宽了公司的业务领域，提升了公司的盈利能力。"
                },
                {
                    "事件": "重大资产收购",
                    "时间": "2020年3月",
                    "描述": "公司完成了对华东地区最大食品制造企业，上海食品有限公司的资产收购，总价值为2亿元人民币。",
                    "影响": "扩大公司业务范围，增强市场竞争力。"
                },
                {
                    "事件": "债务重组",
                    "时间": "2020年5月",
                    "描述": "为优化资本结构，公司进行了债务重组，减少了5000万元人民币负债。",
                    "影响": "改善了公司的财务状况，降低了财务成本。"
                },
                {
                    "事件": "资产重组",
                    "时间": "2020年6月",
                    "描述": "公司进行了一次资产重组，将非核心业务剥离，优化了公司的业务结构。",
                    "影响": "提高了公司的运营效率，增加了公司的价值。"
                },
                {
                    "事件": "重大股权收购",
                    "时间": "2020年8月",
                    "描述": "公司完成了对B公司的股权收购，获得了40%的股权。",
                    "影响": "进一步扩大了公司的市场份额，提升了公司的控制力。"
                },
                {
                    "事件": "大规模融资",
                    "时间": "2020年10月",
                    "描述": "公司进行了一次大规模的融资活动，成功募集了1亿元人民币资金。",
                    "影响": "加强了公司的资金实力，支持了公司的扩张和发展。"
                },
                {
                    "事件": "分发股利",
                    "时间": "2020年12月",
                    "描述": "公司决定向股东分发5000万元人民币股利。",
                    "影响": "回报给股东们的投资，提升了股东的收益。"
                }
            ],
            "涉及的指标": [
                {
                    "指标": "营业收入",
                    "描述": "公司在一定会计期间内的主营业务收入和其他业务收入总额。",
                    "影响因素": [
                        "市场需求",
                        "产品价格变化"
                    ],
                    "值": "2亿元人民币"
                },
                {
                    "指标": "净利润",
                    "描述": "公司在一定会计期间的净收入，即总收入减去总成本和所得税费用后的金额。",
                    "影响因素": [
                        "营业收入",
                        "成本控制",
                        "非经常性损益"
                    ],
                    "值": "8000万元人民币"
                },
                {
                    "指标": "总资产",
                    "描述": "会计期末，公司所拥有的资产总额。",
                    "影响因素": [
                        "资产收购",
                        "资产处置",
                        "资产重估"
                    ],
                    "值": "4亿元人民币"
                },
                {
                    "指标": "总负债",
                    "描述": "会计期末，公司所承担并需要偿还的债务总额。",
                    "影响因素": [
                        "新债发行",
                        "债务偿还",
                        "债务重组"
                    ],
                    "值": "1.5亿元人民币"
                },
                {
                    "指标": "股东权益",
                    "描述": "会计期末，归属于股东的权益总额。",
                    "影响因素": [
                        "净利润",
                        "股利发放",
                        "资本公积"
                    ],
                    "值": "2.5亿元人民币"
                },
                {
                    "指标": "现金流量",
                    "描述": "公司在一定会计期间内的现金流入和流出总和。",
                    "影响因素": [
                        "经营活动",
                        "投资活动",
                        "筹资活动"
                    ],
                    "值": "5000万元人民币"
                },
                {
                    "指标": "负债比率",
                    "描述": "公司总负债与总资产的比率，反映公司的债务水平。",
                    "影响因素": [
                        "总负债的变化",
                        "总资产的变化"
                    ],
                    "值": "37.5%"
                },
                {
                    "指标": "资产负债率",
                    "描述": "公司总负债占总资产的百分比，衡量公司财务杠杆的一个指标。",
                    "影响因素": [
                        "资产和负债的增减变化"
                    ],
                    "值": "37.5%"
                },
                {
                    "指标": "净资产收益率",
                    "描述": "反映公司股东权益的经营效益，即净利润与平均股东权益的比率。",
                    "影响因素": [
                        "净利润的变化",
                        "股东权益的变化"
                    ],
                    "值": "10%"
                }
            ]
        }
    ],
    "额外信息": [
        {
            "名称": "未来展望",
            "内容": [
                {
                    "名称": "财务策略",
                    "描述": "公司未来计划实施的财务策略包括加强成本控制、提高资本运作效率，优化资金结构等。"
                },
                {
                    "名称": "投资计划",
                    "描述": "公司计划持续加大对研发和新项目的投资，提升产品研发能力和市场竞争力。"
                },
                {
                    "名称": "风险管理",
                    "描述": "公司将建立完善的风险管理体系，加强内部控制，降低市场风险和财务风险。"
                }
            ]
        }
    ],
    "生成大纲": "公司财务报告大纲\n\n报告时间：2020年度\n\n报告类型：公司财务报告\n\n涉及的事件和指标：\n\n1. 重要事件：\n\n- 2020年2月：重大投资(2020年2月)\n  - 描述：公司投资了位于北京市中心的优质房地产项目，投资金额为1.5亿元人民币。\n  - 影响：进一步拓宽了公司的业务领域，提升了公司的盈利能力。\n\n- 2020年3月：重大资产收购(2020年3月)\n  - 描述：公司完成了对华东地区最大食品制造企业上海食品有限公司的资产收购，总价值为2亿元人民币。\n  - 影响：扩大公司业务范围，增强市场竞争力。\n\n- 2020年5月：债务重组(2020年5月)\n  - 描述：公司进行了债务重组，减少了5000万元人民币负债，优化了资本结构。\n  - 影响：改善了公司的财务状况，降低了财务成本。\n\n- 2020年6月：资产重组(2020年6月)\n  - 描述：公司进行了一次资产重组，剥离了非核心业务，优化了业务结构。\n  - 影响：提高了公司的运营效率，增加了公司的价值。\n\n- 2020年8月：重大股权收购(2020年8月)\n  - 描述：公司完成了对B公司的股权收购，获得了40%的股权。\n  - 影响：进一步扩大了公司的市场份额，提升了公司的控制力。\n\n- 2020年10月：大规模融资(2020年10月)\n  - 描述：公司进行了一次1亿元人民币的大规模融资活动，成功募集了资金。\n  - 影响：加强了公司的资金实力，支持了公司的扩张和发展。\n\n- 2020年12月：分发股利(2020年12月)\n  - 描述：公司决定向股东分发5000万元人民币股利。\n  - 影响：回报给股东的投资，提升了股东的收益。\n\n2. 涉及的指标：\n\n- 营业收入：2亿元人民币\n  - 描述：公司在一定会计期间内的主营业务收入和其他业务收入总额。\n  - 影响因素：市场需求、产品价格变化。\n\n- 净利润：8000万元人民币\n  - 描述：公司在一定会计期间的净收入，即总收入减去总成本和所得税费用后的金额。\n  - 影响因素：营业收入、成本控制、非经常性损益。\n\n- 总资产：4亿元人民币\n  - 描述：会计期末，公司所拥有的资产总额。\n  - 影响因素：资产收购、资产处置、资产重估。\n\n- 总负债：1.5亿元人民币\n  - 描述：会计期末，公司所承担并需要偿还的债务总额。\n  - 影响因素：新债发行、债务偿还、债务重组。\n\n- 股东权益：2.5亿元人民币\n  - 描述：会计期末，归属于股东的权益总额。\n  - 影响因素：净利润、股利发放、资本公积。\n\n- 现金流量：5000万元人民币\n  - 描述：公司在一定会计期间内的现金流入和流出总和。\n  - 影响因素：经营活动、投资活动、筹资活动。\n\n- 负债比率：37.5%\n  - 描述：公司总负债与总资产的比率，反映公司的债务水平。\n  - 影响因素：总负债的变化、总资产的变化。\n\n- 资产负债率：37.5%\n  - 描述：公司总负债占总资产的百分比，衡量公司财务杠杆的一个指标。\n  - 影响因素：资产和负债的增减变化。\n\n- 净资产收益率：10%\n  - 描述：反映公司股东权益的经营效益，净利润与平均股东权益的比率。\n  - 影响因素：净利润的变化、股东权益的变化。\n\n额外信息：\n\n- 未来展望：\n  - 财务策略：加强成本控制、提高资本运作效率，优化资金结构等。\n  - 投资计划：持续加大对研发和新项目的投资，提升产品研发能力和市场竞争力。\n  - 风险管理：建立完善的风险管理体系，加强内部控制，降低市场风险和财务风险。",
    "生成总结": "诚信消费品有限公司是一家成立于2005年6月15日的中国北京注册的消费品公司，主要业务为生产和销售各类消费品，如食品、饮料、日用品等，同时在纽约证券交易所上市。",
    "生成文章": "在2020年度，诚信消费品有限公司经历了一系列重要事件，这些事件对公司的业务范围、市场竞争力和财务状况产生了重大影响。\n\n首先，在2020年2月，公司进行了一项重大投资，投资了位于北京市中心的优质房地产项目，投资金额为1.5亿元人民币。这一投资进一步拓宽了公司的业务领域，提升了公司的盈利能力。这也反映在公司的营业收入指标上，2020年度营业收入达到2亿元人民币。\n\n其次，在2020年3月，公司完成了对华东地区最大食品制造企业上海食品有限公司的资产收购，总价值为2亿元人民币。这一资产收购扩大了公司的业务范围，增强了公司的市场竞争力。这也反映在公司的净利润指标上，2020年度净利润达到8000万元人民币。\n\n接着，在2020年5月，公司进行了债务重组，减少了5000万元人民币负债，优化了资本结构。这一债务重组改善了公司的财务状况，降低了财务成本。这也反映在公司的总负债和股东权益指标上，2020年度总负债为1.5亿元人民币，股东权益为2.5亿元人民币。\n\n在2020年6月，公司进行了一次资产重组，剥离了非核心业务，优化了业务结构。这一资产重组提高了公司的运营效率，增加了公司的价值。这也反映在公司的资产负债率指标上，2020年度资产负债率为37.5%。\n\n在2020年8月，公司完成了对B公司的股权收购，获得了40%的股权。这一重大股权收购进一步扩大了公司的市场份额，提升了公司的控制力。这也反映在公司的股东权益指标上，2020年度股东权益为2.5亿元人民币。\n\n在2020年10月，公司进行了一次1亿元人民币的大规模融资活动，成功募集了资金。这一大规模融资活动加强了公司的资金实力，支持了公司的扩张和发展。这也反映在公司的现金流量指标上，2020年度现金流量为5000万元人民币。\n\n最后，在2020年12月，公司决定向股东分发5000万元人民币股利。这一股利分发回报了股东的投资，提升了股东的收益。\n\n综上所述，诚信消费品有限公司在2020年度经历了一系列重要事件，这些事件对公司的业务范围、市场竞争力和财务状况产生了积极影响。公司通过重大投资、资产收购、债务重组、资产重组、股权收购、大规模融资和股利分发等举措，进一步拓宽了业务领域，增强了市场竞争力，改善了财务状况，提高了运营效率，增加了公司的价值。未来，公司将继续加强成本控制、提高资本运作效率，优化资金结构，持续加大对研发和新项目的投资，提升产品研发能力和市场竞争力，并建立完善的风险管理体系，加强内部控制，降低市场风险和财务风险。"
}