{
    "Hospitalization Record": {
        "Basic Information": {
            "Name": "E. Parker",
            "Gender": "female",
            "Age": "50",
            "Ethnicity": "",
            "Marital Status": "",
            "Occupation": "",
            "Address": "44, Riverton Street, Cameron",
            "Admission Time": "12th, August",
            "Record Time": "",
            "Historian": "",
            "Hospital Name": "Cameron General Hospital"
        },
        "Chief Complaint": "Swelling and redness over the mastoid process, significant tenderness for 5 days.",
        "Present Illness": {
            "Onset": "Symptoms began 5 days ago with gradual onset. Patient noticed swelling and redness behind the ear, tenderness progressively increased.",
            "Main Symptoms": "Patient reports swelling, redness, and significant tenderness over the mastoid process. Swelling has progressed and tenderness has increased, with occasional purulent discharge.",
            "Accompanying Symptoms": "Mild fever, headache, and occasional dizziness. Symptoms are continuous and relieve slightly with antibiotics but have not resolved completely.",
            "Diagnosis and Treatment History": "Patient consulted a general practitioner 3 days ago, diagnosed with acute mastoiditis, prescribed oral antibiotics with temporary relief of symptoms.",
            "General Condition Changes": "Patient reports fatigue, decreased appetite, normal urination and bowel movements. No significant weight changes."
        },
        "Past History": {
            "General Health Condition": "Generally healthy",
            "Disease History": "History of otitis media in childhood",
            "Infectious Disease History": "",
            "Immunization History": "Up-to-date",
            "Surgery and Trauma History": "Appendectomy at age 30",
            "Blood Transfusion History": "None",
            "Allergy History": "Allergic to penicillin"
        },
        "Personal History": {
            "Birthplace": "Cameron",
            "Residence": "Cameron",
            "Living Habits": "Non-smoker, occasional alcohol use",
            "Occupation and Working Conditions": "Office worker",
            "Exposure History": "No known exposure to industrial toxins, dust, or radioactive substances",
            "Travel History": "No recent travel"
        },
        "Marital and Family History": {
            "Marital History": {
                "Marital Status": "Married",
                "Marriage Age": "25",
                "Spouse's Health Condition": "Healthy",
                "Children's Condition": "Two daughters, healthy"
            },
            "Menstrual History": {
                "Menarche Age": "12",
                "Menstruation Duration": "5 days",
                "Menstruation Interval": "28 days",
                "Last Menstruation": "",
                "Menstrual Volume": "Normal",
                "Dysmenorrhea": "Mild"
            },
            "Family History": "Parents deceased, mother had diabetes, father had hypertension. Siblings healthy, no genetic diseases noted."
        },
        "Physical Examination": {
            "General Condition": {
                "Temperature": "37.8Â°C",
                "Pulse": "86/min",
                "Respiration": "18/min",
                "Blood Pressure": "130/80 mmHg"
            },
            "Systematic Examination": {
                "Skin": "Redness and swelling over mastoid area",
                "Mucous Membranes": "Normal",
                "Lymph Nodes": "Non-palpable",
                "Head and Organs": "Redness and swelling over mastoid process, tenderness on palpation",
                "Neck": "No lymphadenopathy, normal range of motion",
                "Chest": "Clear lung fields, heart with regular rhythm, no murmurs",
                "Abdomen": "Soft, non-tender with no organomegaly",
                "Rectum and Anus": "Not examined",
                "External Genitalia": "Normal",
                "Spine": "Normal",
                "Limbs": "Normal",
                "Nervous System": "Intact, no focal deficits"
            }
        },
        "Specialist Examination": "Otoscopy reveals redness and swelling in the external auditory canal with purulent discharge.",
        "Auxiliary Examination": "CT scan: Cloudy air cells and opacification in the mastoid area indicating inflammation",
        "Preliminary Diagnosis": "Mastoiditis",
        "Diagnostic Basis": "Based on patient's history, physical examination, and CT scan showing characteristic signs of mastoiditis.",
        "Differential Diagnosis": "Otitis media, ear boils, mumps, temporomandibular joint disease all considered and ruled out based on symptoms and imaging.",
        "Admission Records": {
            "Physician's Signature": "Dr. Smith"
        },
        "Post-Admission Course Records": {
            "First Course Record": "Severe mastoiditis with purulent discharge. Emergency surgery indicated. Broad-spectrum IV antibiotics initiated.",
            "Daily Course Records": "Improvement noted post-surgery, reduction in swelling and tenderness. Continues with IV antibiotics. Dressing changes daily.",
            "Senior Physician Rounds Records": "Stable post-operative status, advised to continue antibiotics.",
            "Difficult Case Discussion Records": "None",
            "Handover Records": "Patient stable, continue monitoring for infection signs.",
            "Transfer Records": "None",
            "Stage Summary": "Post-surgery improvement, suitable for ward transfer.",
            "Emergency Records": "None",
            "Invasive Procedure Records": "Mastoidectomy performed with evacuation of purulent material.",
            "Consultation Records": "ENT consultation pre-surgery confirmed diagnosis.",
            "Surgery Related": {
                "Preoperative Summary": "Scheduled for mastoidectomy due to severe mastoiditis with purulence.",
                "Preoperative Discussion Records": "Mastoidectomy planned. Discussed potential complications including hearing loss, facial nerve damage.",
                "Anesthesia Preoperative Visit Records": "Assessed fit for general anesthesia.",
                "Anesthesia Records": "General anesthesia administered, monitoring continuous.",
                "Surgery Records": "Mastoidectomy performed. Purulent material evacuated, meticulous hemostasis achieved.",
                "Surgery Safety Checklist": "All surgical protocols followed, no discrepancies noted.",
                "Surgery Instrument Count Records": "Accurate count of instruments pre- and post-surgery.",
                "Postoperative First Course Record": "Patient stable post-surgery. IV antibiotics and pain management continued.",
                "Anesthesia Postoperative Visit Records": "Patient recovered well from anesthesia, vital signs stable."
            },
            "Discharge Records": "Discharge planned in 2 days if no complications arise.",
            "Critically Ill Patient Care Records": "Not applicable"
        },
        "Medical Orders": {
            "Long-term Orders": "IV antibiotics (Ceftriaxone 1g BID), Pain management (Paracetamol 500mg PRN)",
            "Temporary Orders": "CT scan of the mastoid, Daily dressing changes"
        },
        "Auxiliary Examination Reports": "CT scan report shows mastoid inflammation.",
        "Temperature Chart": "Daily monitoring of temperature, pulse, respiration, blood pressure recorded.",
        "Blood Transfusion Consent": "",
        "Special Examination Consent": "",
        "Critical Condition Notice": ""
    },
    "DiseaseType": {
        "Diseases of the Ear and Mastoid Process": {
            "Name": "Mastoiditis",
            "Symptoms": "Swelling, redness of the skin over the mastoid process, significant tenderness, redness, collapse with purulent discharge, cloudy air cells, presenting a cloudy appearance, etc.",
            "Differential Diagnosis": "Otitis media, ear boils, mumps, temporomandibular joint disease, etc."
        }
    },
    "Generated Article": "Hospitalization Record\n\nBasic Information:\nName: E. Parker\nGender: female\nAge: 50\nEthnicity: \nMarital Status: \nOccupation: \nAddress: 44, Riverton Street, Cameron\nAdmission Time: 12th, August\nRecord Time: \nHistorian: \nHospital Name: Cameron General Hospital\n\nChief Complaint:\nSwelling and redness over the mastoid process, significant tenderness for 5 days.\n\nPresent Illness:\nOnset: Symptoms began 5 days ago with gradual onset. Patient noticed swelling and redness behind the ear, tenderness progressively increased.\nMain Symptoms: Patient reports swelling, redness, and significant tenderness over the mastoid process. Swelling has progressed and tenderness has increased, with occasional purulent discharge.\nAccompanying Symptoms: Mild fever, headache, and occasional dizziness. Symptoms are continuous and relieve slightly with antibiotics but have not resolved completely.\nDiagnosis and Treatment History: Patient consulted a general practitioner 3 days ago, diagnosed with acute mastoiditis, prescribed oral antibiotics with temporary relief of symptoms.\nGeneral Condition Changes: Patient reports fatigue, decreased appetite, normal urination and bowel movements. No significant weight changes.\n\nPast History:\nGeneral Health Condition: Generally healthy\nDisease History: History of otitis media in childhood\nInfectious Disease History: \nImmunization History: Up-to-date\nSurgery and Trauma History: Appendectomy at age 30\nBlood Transfusion History: None\nAllergy History: Allergic to penicillin\n\nPersonal History:\nBirthplace: Cameron\nResidence: Cameron\nLiving Habits: Non-smoker, occasional alcohol use\nOccupation and Working Conditions: Office worker\nExposure History: No known exposure to industrial toxins, dust, or radioactive substances\nTravel History: No recent travel\n\nMarital and Family History:\nMarital History:\nMarital Status: Married\nMarriage Age: 25\nSpouse's Health Condition: Healthy\nChildren's Condition: Two daughters, healthy\nMenstrual History:\nMenarche Age: 12\nMenstruation Duration: 5 days\nMenstruation Interval: 28 days\nLast Menstruation: \nMenstrual Volume: Normal\nDysmenorrhea: Mild\nFamily History: Parents deceased, mother had diabetes, father had hypertension. Siblings healthy, no genetic diseases noted.\n\nPhysical Examination:\nGeneral Condition:\nTemperature: 37.8Â°C\nPulse: 86/min\nRespiration: 18/min\nBlood Pressure: 130/80 mmHg\nSystematic Examination:\nSkin: Redness and swelling over mastoid area\nMucous Membranes: Normal\nLymph Nodes: Non-palpable\nHead and Organs: Redness and swelling over mastoid process, tenderness on palpation\nNeck: No lymphadenopathy, normal range of motion\nChest: Clear lung fields, heart with regular rhythm, no murmurs\nAbdomen: Soft, non-tender with no organomegaly\nRectum and Anus: Not examined\nExternal Genitalia: Normal\nSpine: Normal\nLimbs: Normal\nNervous System: Intact, no focal deficits\n\nSpecialist Examination:\nOtoscopy reveals redness and swelling in the external auditory canal with purulent discharge.\n\nAuxiliary Examination:\nCT scan: Cloudy air cells and opacification in the mastoid area indicating inflammation\n\nPreliminary Diagnosis:\nMastoiditis\n\nDiagnostic Basis:\nBased on patient's history, physical examination, and CT scan showing characteristic signs of mastoiditis.\n\nDifferential Diagnosis:\nOtitis media, ear boils, mumps, temporomandibular joint disease all considered and ruled out based on symptoms and imaging.\n\nAdmission Records:\nPhysician's Signature: Dr. Smith\n\nPost-Admission Course Records:\nFirst Course Record: Severe mastoiditis with purulent discharge. Emergency surgery indicated. Broad-spectrum IV antibiotics initiated.\nDaily Course Records: Improvement noted post-surgery, reduction in swelling and tenderness. Continues with IV antibiotics. Dressing changes daily.\nSenior Physician Rounds Records: Stable post-operative status, advised to continue antibiotics.\nDifficult Case Discussion Records: None\nHandover Records: Patient stable, continue monitoring for infection signs.\nTransfer Records: None\nStage Summary: Post-surgery improvement, suitable for ward transfer.\nEmergency Records: None\nInvasive Procedure Records: Mastoidectomy performed with evacuation of purulent material.\nConsultation Records: ENT consultation pre-surgery confirmed diagnosis.\nSurgery Related:\nPreoperative Summary: Scheduled for mastoidectomy due to severe mastoiditis with purulence.\nPreoperative Discussion Records: Mastoidectomy planned. Discussed potential complications including hearing loss, facial nerve damage.\nAnesthesia Preoperative Visit Records: Assessed fit for general anesthesia.\nAnesthesia Records: General anesthesia administered, monitoring continuous.\nSurgery Records: Mastoidectomy performed. Purulent material evacuated, meticulous hemostasis achieved.\nSurgery Safety Checklist: All surgical protocols followed, no discrepancies noted.\nSurgery Instrument Count Records: Accurate count of instruments pre- and post-surgery.\nPostoperative First Course Record: Patient stable post-surgery. IV antibiotics and pain management continued.\nAnesthesia Postoperative Visit Records: Patient recovered well from anesthesia, vital signs stable.\n\nDischarge Records:\nDischarge planned in 2 days if no complications arise.\n\nCritically Ill Patient Care Records:\nNot applicable\n\nMedical Orders:\nLong-term Orders: IV antibiotics (Ceftriaxone 1g BID), Pain management (Paracetamol 500mg PRN)\nTemporary Orders: CT scan of the mastoid, Daily dressing changes\n\nAuxiliary Examination Reports:\nCT scan report shows mastoid inflammation.\n\nTemperature Chart:\nDaily monitoring of temperature, pulse, respiration, blood pressure recorded.\n\nBlood Transfusion Consent:\nNot applicable \n\nSpecial Examination Consent:\nNot applicable\n\nCritical Condition Notice:\nNot applicable\n\nDiseaseType:\nDiseases of the Ear and Mastoid Process\nName: Mastoiditis\nSymptoms: Swelling, redness of the skin over the mastoid process, significant tenderness, redness, collapse with purulent discharge, cloudy air cells, presenting a cloudy appearance, etc.\nDifferential Diagnosis: Otitis media, ear boils, mumps, temporomandibular joint disease, etc.",
    "qa_fact_based": [
        {
            "question type": "Factual Question",
            "question": "According to the hospitalization records of Cameron General Hospital, what is E. Parker's initial diagnosis?",
            "answer": "Mastoiditis.",
            "ref": [
                "Diagnosis and Treatment History: Patient consulted a general practitioner 3 days ago, diagnosed with acute mastoiditis, prescribed oral antibiotics with temporary relief of symptoms.",
                "Mastoiditis",
                "Based on patient's history, physical examination, and CT scan showing characteristic signs of mastoiditis."
            ]
        },
        {
            "question type": "Factual Question",
            "question": "According to the hospitalization records of Cameron General Hospital, what is E. Parker's chief complaint?",
            "answer": "Swelling and redness over the mastoid process, significant tenderness for 5 days.",
            "ref": [
                "Chief Complaint:",
                "Swelling and redness over the mastoid process, significant tenderness for 5 days."
            ]
        },
        {
            "question type": "Factual Question",
            "question": "According to the hospitalization records of Cameron General Hospital, what is E. Parker's age?",
            "answer": "50.",
            "ref": [
                "Age: 50"
            ]
        },
        {
            "question type": "Factual Question",
            "question": "According to the hospitalization records of Cameron General Hospital, what is E. Parker's gender?",
            "answer": "Female.",
            "ref": [
                "Gender: female"
            ]
        }
    ],
    "qa_multi_hop": [
        {
            "question type": "Multi-hop Reasoning Question",
            "question": "According to the hospitalization records of Cameron General Hospital, how many diagnostic bases were used to diagnose E. Parker's condition?",
            "answer": "According to the records, three diagnostic bases were used to diagnose E. Parker's condition: patient's history, physical examination, and CT scan.",
            "ref": [
                "Present Illness:",
                "Patient noticed swelling and redness behind the ear, tenderness progressively increased.",
                "Main Symptoms: Patient reports swelling, redness, and significant tenderness over the mastoid process.",
                "Swelling has progressed and tenderness has increased, with occasional purulent discharge.",
                "Accompanying Symptoms: Mild fever, headache, and occasional dizziness.",
                "Symptoms are continuous and relieve slightly with antibiotics but have not resolved completely.",
                "Diagnosis and Treatment History: Patient consulted a general practitioner 3 days ago, diagnosed with acute mastoiditis, prescribed oral antibiotics with temporary relief of symptoms.",
                "Physical Examination:",
                "General Condition:",
                "Temperature: 37.8Â°C",
                "Pulse: 86/min",
                "Respiration: 18/min",
                "Blood Pressure: 130/80 mmHg",
                "Systematic Examination:",
                "Skin: Redness and swelling over mastoid area",
                "Mucous Membranes: Normal",
                "Lymph Nodes: Non-palpable",
                "Head and Organs: Redness and swelling over mastoid process, tenderness on palpation",
                "Neck: No lymphadenopathy, normal range of motion",
                "Chest: Clear lung fields, heart with regular rhythm, no murmurs",
                "Abdomen: Soft, non-tender with no organomegaly",
                "Rectum and Anus: Not examined",
                "External Genitalia: Normal",
                "Spine: Normal",
                "Limbs: Normal",
                "Nervous System: Intact, no focal deficits",
                "Otoscopy reveals redness and swelling in the external auditory canal with purulent discharge.",
                "CT scan: Cloudy air cells and opacification in the mastoid area indicating inflammation",
                "Based on patient's history, physical examination, and CT scan showing characteristic signs of mastoiditis."
            ]
        },
        {
            "question type": "Multi-hop Reasoning Question",
            "question": "According to the hospitalization records of Cameron General Hospital, how many auxiliary examinations did E. Parker undergo?",
            "answer": "According to the records, E. Parker underwent 1 auxiliary examination: a CT scan.",
            "ref": [
                "Auxiliary Examination:",
                "CT scan: Cloudy air cells and opacification in the mastoid area indicating inflammation",
                "CT scan report shows mastoid inflammation."
            ]
        }
    ],
    "qa_summary": [
        {
            "question type": "Summarization Question",
            "question": "According to the hospitalization records of Cameron General Hospital, summarize the present illness of E. Parker.",
            "answer": "E. Parker's symptoms began 5 days ago with gradual onset. She noticed swelling and redness behind the ear, with progressively increasing tenderness and occasional purulent discharge. She also experienced mild fever, headache, and occasional dizziness. Symptoms slightly relieved with antibiotics but did not resolve completely.",
            "ref": [
                "Present Illness:",
                "Onset: Symptoms began 5 days ago with gradual onset.",
                "Patient noticed swelling and redness behind the ear, tenderness progressively increased.",
                "Main Symptoms: Patient reports swelling, redness, and significant tenderness over the mastoid process.",
                "Swelling has progressed and tenderness has increased, with occasional purulent discharge.",
                "Accompanying Symptoms: Mild fever, headache, and occasional dizziness.",
                "Symptoms are continuous and relieve slightly with antibiotics but have not resolved completely."
            ]
        },
        {
            "question type": "Summarization Question",
            "question": "According to the hospitalization records of Cameron General Hospital, summarize the past medical history of E. Parker.",
            "answer": "E. Parker is generally healthy with a history of otitis media in childhood. She had an appendectomy at age 30 and is allergic to penicillin. Her immunizations are up-to-date, and she has no history of blood transfusions.",
            "ref": [
                "General Health Condition: Generally healthy",
                "Disease History: History of otitis media in childhood",
                "Immunization History: Up-to-date",
                "Surgery and Trauma History: Appendectomy at age 30",
                "Blood Transfusion History: None",
                "Allergy History: Allergic to penicillin"
            ]
        },
        {
            "question type": "Summarization Question",
            "question": "According to the hospitalization records of Cameron General Hospital, summarize the physical examination findings of E. Parker.",
            "answer": "E. Parker's temperature was 37.8Â°C, pulse 86/min, respiration 18/min, and blood pressure 130/80 mmHg. She had redness and swelling over the mastoid area with tenderness on palpation. Other systems were normal, including clear lung fields, regular heart rhythm, and a soft, non-tender abdomen.",
            "ref": [
                "Temperature: 37.8Â°C",
                "Pulse: 86/min",
                "Respiration: 18/min",
                "Blood Pressure: 130/80 mmHg",
                "Skin: Redness and swelling over mastoid area",
                "Head and Organs: Redness and swelling over mastoid process, tenderness on palpation",
                "Chest: Clear lung fields, heart with regular rhythm, no murmurs",
                "Abdomen: Soft, non-tender with no organomegaly"
            ]
        }
    ]
}