{
    "Hospitalization Record": {
        "Basic Information": {
            "Name": "H. Sanchez",
            "Gender": "female",
            "Age": "29",
            "Ethnicity": "Hispanic",
            "Marital Status": "Married",
            "Occupation": "Teacher",
            "Address": "95, Farmington street, Greenfield",
            "Admission Time": "17th, October",
            "Record Time": "17th, October",
            "Historian": "Self",
            "Hospital Name": "Greenfield General Hospital"
        },
        "Chief Complaint": "Hypertension, swelling in legs, and proteinuria for 2 weeks",
        "Present Illness": {
            "Onset": "Approximately 2 weeks ago, at home, gradually with no apparent trigger",
            "Main Symptoms": "Persistent hypertension, notable leg edema, proteinuria detected upon testing; symptoms worsening over the past week despite rest",
            "Accompanying Symptoms": "Occasional headaches, dizziness predominantly when standing up",
            "Diagnosis and Treatment History": "Initial consultation with primary care physician led to diagnosis of Pregnancy-Induced Hypertension Syndrome. Prescribed medication and advised bed rest. Symptoms did not improve significantly. Referral to hospital for further management.",
            "General Condition Changes": "Mental state slightly anxious due to health concerns. Sleep disturbed by discomfort. Appetite decreased slightly. No significant changes in urination and defecation patterns. Mild weight gain attributed to edema."
        },
        "Past History": {
            "General Health Condition": "Generally healthy with no significant past illnesses",
            "Disease History": "No chronic illnesses",
            "Infectious Disease History": "No significant infectious diseases",
            "Immunization History": "Up to date with standard immunizations",
            "Surgery and Trauma History": "Appendectomy at age 15",
            "Blood Transfusion History": "No history of blood transfusion",
            "Allergy History": "No known allergies"
        },
        "Personal History": {
            "Birthplace": "Greenfield",
            "Residence": "Greenfield",
            "Living Habits": "Non-smoker, occasional social alcohol consumption",
            "Occupation and Working Conditions": "Works as a teacher, generally sedentary lifestyle",
            "Exposure History": "No known exposure to industrial toxins, dust, or radioactive substances",
            "Travel History": "No significant travel history in the past year"
        },
        "Marital and Family History": {
            "Marital History": {
                "Marital Status": "Married",
                "Marriage Age": "26",
                "Spouse's Health Condition": "Generally healthy",
                "Children's Condition": "First pregnancy"
            },
            "Menstrual History": {
                "Menarche Age": "13",
                "Menstruation Duration": "5-6 days",
                "Menstruation Interval": "28-30 days",
                "Last Menstruation": "5 months ago",
                "Menstrual Volume": "Normal",
                "Dysmenorrhea": "Mild dysmenorrhea"
            },
            "Family History": "Mother has hypertension, father healthy, no siblings"
        },
        "Physical Examination": {
            "General Condition": {
                "Temperature": "37°C (98.6°F)",
                "Pulse": "88 bpm",
                "Respiration": "18 breaths/min",
                "Blood Pressure": "150/95 mmHg"
            },
            "Systematic Examination": {
                "Skin": "No rash, pale skin",
                "Mucous Membranes": "No abnormalities",
                "Lymph Nodes": "No enlargement",
                "Head and Organs": "No abnormalities",
                "Neck": "No goiter, no jugular venous distention",
                "Chest": "Clear lung sounds, no murmurs or added heart sounds",
                "Abdomen": "Non-tender, no hepatosplenomegaly noted",
                "Rectum and Anus": "Not examined",
                "External Genitalia": "No abnormalities noted",
                "Spine": "No deformities",
                "Limbs": "Pitting edema observed in lower extremities",
                "Nervous System": "No neurological deficits observed"
            }
        },
        "Specialist Examination": "Ophthalmologic examination: No retinopathy; significant pitting edema in lower limbs",
        "Auxiliary Examination": "Urinalysis: Proteinuria 2+, Blood tests: Elevated serum creatinine, Ultrasonography: Normal fetal growth and development",
        "Preliminary Diagnosis": "Pregnancy-Induced Hypertension Syndrome",
        "Diagnostic Basis": "Based on patient's history, presence of hypertension (BP 150/95 mmHg), proteinuria, and edema in a previously normotensive patient",
        "Differential Diagnosis": "Chronic hypertension (ruled out by lack of pre-pregnancy history and normal baseline tests), preeclampsia (symptoms not severe enough nor congruent progression), chronic hypertension with superimposed preeclampsia (ruled out by onset timing and previous history)",
        "Admission Records": {
            "Physician's Signature": "Dr. A. Cooper"
        },
        "Post-Admission Course Records": {
            "First Course Record": "Patient admitted with signs of Pregnancy-Induced Hypertension Syndrome. Initial management includes bed rest, antihypertensive therapy, and monitoring fetal well-being. Differential diagnosis includes chronic hypertension and preeclampsia. Further diagnostic tests pending.",
            "Daily Course Records": "Daily assessments show consistent BP readings around 145-150/90-95 mmHg with no significant headaches or visual disturbances. Fetal movements normal, mild persistence of edema.",
            "Senior Physician Rounds Records": "Reviewed patient's ongoing symptoms and test results; current management plan reaffirmed, discussed need for close monitoring due to risk of progression to preeclampsia.",
            "Difficult Case Discussion Records": "Interdisciplinary meeting discussed patient’s risk profile and potential need for early induction of labor if symptoms worsen.",
            "Handover Records": "Next shift briefed on patient’s stable, but closely monitored condition, ongoing need for fetal heart monitoring and periodic blood tests.",
            "Transfer Records": "No transfer required, patient remains in obstetric care unit.",
            "Stage Summary": "End of week summary: Patient remains stable, BP under control, no signs of eclampsia onset, continuation of current management plan with scheduled ultrasound.",
            "Emergency Records": "No emergencies recorded during this period.",
            "Invasive Procedure Records": "No invasive procedures performed.",
            "Consultation Records": "Cardiology consulted regarding management of hypertensive state, no additional medications prescribed at this time.",
            "Surgery Related": {
                "Preoperative Summary": "Indicated for cesarean section due to non-progression of attempts at labor induction and worsening hypertension.",
                "Preoperative Discussion Records": "Discussion on choice of cesarean section, possible complications including further rise in BP, bleeding risks.",
                "Anesthesia Preoperative Visit Records": "Patient assessed for anesthesia, deemed fit for spinal anesthesia but with close monitoring due to hypertension.",
                "Anesthesia Records": "Spinal anesthesia administered without complications, patient remained stable throughout the procedure.",
                "Surgery Records": "Cesarean section performed, delivery of healthy infant, minor blood loss, patient stable.",
                "Surgery Safety Checklist": "Completed; patient identity, surgical site, and anesthesia verified pre-surgery.",
                "Surgery Instrument Count Records": "All instruments and items accounted for post-surgery.",
                "Postoperative First Course Record": "Patient transferred to recovery, stable vitals, ongoing assessment for any signs of postpartum complications.",
                "Anesthesia Postoperative Visit Records": "Patient shows good recovery post-anesthesia, all vitals stable, minimal pain."
            },
            "Discharge Records": "Planned for discharge after 4 days post-surgery with instructions on monitoring BP and follow-up in 1 week.",
            "Critically Ill Patient Care Records": "Not applicable"
        },
        "Medical Orders": {
            "Long-term Orders": "Bed rest, ongoing antihypertensive medication, daily BP monitoring, regular fetal cardiac monitoring",
            "Temporary Orders": "Immediate cesarean section due to non-progress of labor induction and maternal hypertension"
        },
        "Auxiliary Examination Reports": "Ultrasound: Normal fetal growth; lab tests: Normal liver function, elevated uric acid, proteinuria 2+",
        "Temperature Chart": "Temperature stable, BP readings consistently around 145-150/90-95 mmHg, Pulse 88 bpm, Respiration 18 breaths/min",
        "Blood Transfusion Consent": "Signed in the event of surgical necessity",
        "Special Examination Consent": "Signed for detailed fetal monitoring and blood tests",
        "Critical Condition Notice": "Not issued"
    },
    "DiseaseType": {
        "Pregnancy, Childbirth, and the Puerperium Complications": {
            "Name": "Pregnancy-Induced Hypertension Syndrome",
            "Symptoms": "Hypertension, edema, proteinuria",
            "Differential Diagnosis": "Chronic hypertension, preeclampsia, chronic hypertension with superimposed preeclampsia."
        }
    },
    "Generated Article": "Hospitalization Record:\n\nBasic Information:\nName: H. Sanchez\nGender: Female\nAge: 29\nEthnicity: Hispanic\nMarital Status: Married\nOccupation: Teacher\nAddress: 95, Farmington Street, Greenfield\nAdmission Time: 17th, October\nRecord Time: 17th, October\nHistorian: Self\nHospital Name: Greenfield General Hospital\n\nChief Complaint:\nHypertension, swelling in legs, and proteinuria for 2 weeks.\n\nPresent Illness:\nOnset: Approximately 2 weeks ago, at home, gradually with no apparent trigger.\nMain Symptoms: Persistent hypertension, notable leg edema, proteinuria detected upon testing; symptoms worsening over the past week despite rest.\nAccompanying Symptoms: Occasional headaches, dizziness predominantly when standing up.\nDiagnosis and Treatment History: Initial consultation with primary care physician led to diagnosis of Pregnancy-Induced Hypertension Syndrome. Prescribed medication and advised bed rest. Symptoms did not improve significantly. Referral to hospital for further management.\nGeneral Condition Changes: Mental state slightly anxious due to health concerns. Sleep disturbed by discomfort. Appetite decreased slightly. No significant changes in urination and defecation patterns. Mild weight gain attributed to edema.\n\nPast History:\nGeneral Health Condition: Generally healthy with no significant past illnesses.\nDisease History: No chronic illnesses.\nInfectious Disease History: No significant infectious diseases.\nImmunization History: Up to date with standard immunizations.\nSurgery and Trauma History: Appendectomy at age 15.\nBlood Transfusion History: No history of blood transfusion.\nAllergy History: No known allergies.\n\nPersonal History:\nBirthplace: Greenfield.\nResidence: Greenfield.\nLiving Habits: Non-smoker, occasional social alcohol consumption.\nOccupation and Working Conditions: Works as a teacher, generally sedentary lifestyle.\nExposure History: No known exposure to industrial toxins, dust, or radioactive substances.\nTravel History: No significant travel history in the past year.\n\nMarital and Family History:\nMarital History:\nMarital Status: Married.\nMarriage Age: 26.\nSpouse's Health Condition: Generally healthy.\nChildren's Condition: First pregnancy.\nMenstrual History:\nMenarche Age: 13.\nMenstruation Duration: 5-6 days.\nMenstruation Interval: 28-30 days.\nLast Menstruation: 5 months ago.\nMenstrual Volume: Normal.\nDysmenorrhea: Mild dysmenorrhea.\nFamily History: Mother has hypertension, father healthy, no siblings.\n\nPhysical Examination:\nGeneral Condition:\nTemperature: 37°C (98.6°F).\nPulse: 88 bpm.\nRespiration: 18 breaths/min.\nBlood Pressure: 150/95 mmHg.\n\nSystematic Examination:\nSkin: No rash, pale skin.\nMucous Membranes: No abnormalities.\nLymph Nodes: No enlargement.\nHead and Organs: No abnormalities.\nNeck: No goiter, no jugular venous distention.\nChest: Clear lung sounds, no murmurs or added heart sounds.\nAbdomen: Non-tender, no hepatosplenomegaly noted.\nRectum and Anus: Not examined.\nExternal Genitalia: No abnormalities noted.\nSpine: No deformities.\nLimbs: Pitting edema observed in lower extremities.\nNervous System: No neurological deficits observed.\n\nSpecialist Examination:\nOphthalmologic examination: No retinopathy; significant pitting edema in lower limbs.\n\nAuxiliary Examination:\nUrinalysis: Proteinuria 2+.\nBlood tests: Elevated serum creatinine.\nUltrasonography: Normal fetal growth and development.\n\nPreliminary Diagnosis:\nPregnancy-Induced Hypertension Syndrome.\n\nDiagnostic Basis:\nBased on patient's history, presence of hypertension (BP 150/95 mmHg), proteinuria, and edema in a previously normotensive patient.\n\nDifferential Diagnosis:\nChronic hypertension (ruled out by lack of pre-pregnancy history and normal baseline tests), preeclampsia (symptoms not severe enough nor congruent progression), chronic hypertension with superimposed preeclampsia (ruled out by onset timing and previous history).\n\nAdmission Records:\nPhysician's Signature: Dr. A. Cooper.\n\nPost-Admission Course Records:\nFirst Course Record: Patient admitted with signs of Pregnancy-Induced Hypertension Syndrome. Initial management includes bed rest, antihypertensive therapy, and monitoring fetal well-being. Differential diagnosis includes chronic hypertension and preeclampsia. Further diagnostic tests pending.\nDaily Course Records: Daily assessments show consistent BP readings around 145-150/90-95 mmHg with no significant headaches or visual disturbances. Fetal movements normal, mild persistence of edema.\nSenior Physician Rounds Records: Reviewed patient's ongoing symptoms and test results; current management plan reaffirmed, discussed need for close monitoring due to risk of progression to preeclampsia.\nDifficult Case Discussion Records: Interdisciplinary meeting discussed patient’s risk profile and potential need for early induction of labor if symptoms worsen.\nHandover Records: Next shift briefed on patient’s stable, but closely monitored condition, ongoing need for fetal heart monitoring and periodic blood tests.\nTransfer Records: No transfer required, patient remains in obstetric care unit.\nStage Summary: End of week summary: Patient remains stable, BP under control, no signs of eclampsia onset, continuation of current management plan with scheduled ultrasound.\nEmergency Records: No emergencies recorded during this period.\nInvasive Procedure Records: No invasive procedures performed.\nConsultation Records: Cardiology consulted regarding management of hypertensive state, no additional medications prescribed at this time.\n\nSurgery Related:\nPreoperative Summary: Indicated for cesarean section due to non-progression of attempts at labor induction and worsening hypertension.\nPreoperative Discussion Records: Discussion on choice of cesarean section, possible complications including further rise in BP, bleeding risks.\nAnesthesia Preoperative Visit Records: Patient assessed for anesthesia, deemed fit for spinal anesthesia but with close monitoring due to hypertension.\nAnesthesia Records: Spinal anesthesia administered without complications, patient remained stable throughout the procedure.\nSurgery Records: Cesarean section performed, delivery of healthy infant, minor blood loss, patient stable.\nSurgery Safety Checklist: Completed; patient identity, surgical site, and anesthesia verified pre-surgery.\nSurgery Instrument Count Records: All instruments and items accounted for post-surgery.\nPostoperative First Course Record: Patient transferred to recovery, stable vitals, ongoing assessment for any signs of postpartum complications.\nAnesthesia Postoperative Visit Records: Patient shows good recovery post-anesthesia, all vitals stable, minimal pain.\n\nDischarge Records:\nPlanned for discharge after 4 days post-surgery with instructions on monitoring BP and follow-up in 1 week.\n\nCritically Ill Patient Care Records:\nNot applicable.\n\nMedical Orders:\nLong-term Orders: Bed rest, ongoing antihypertensive medication, daily BP monitoring, regular fetal cardiac monitoring.\nTemporary Orders: Immediate cesarean section due to non-progress of labor induction and maternal hypertension.\n\nAuxiliary Examination Reports:\nUltrasound: Normal fetal growth; lab tests: Normal liver function, elevated uric acid, proteinuria 2+.\n\nTemperature Chart:\nTemperature stable, BP readings consistently around 145-150/90-95 mmHg, Pulse 88 bpm, Respiration 18 breaths/min.\n\nBlood Transfusion Consent:\nSigned in the event of surgical necessity.\n\nSpecial Examination Consent:\nSigned for detailed fetal monitoring and blood tests.\n\nCritical Condition Notice:\nNot issued.\n\nDisease Type:\nPregnancy, Childbirth, and the Puerperium Complications:\nName: Pregnancy-Induced Hypertension Syndrome.\nSymptoms: Hypertension, edema, proteinuria.\nDifferential Diagnosis: Chronic hypertension, preeclampsia, chronic hypertension with superimposed preeclampsia.",
    "qa_fact_based": [
        {
            "question type": "Factual Question",
            "question": "According to the hospitalization records of Greenfield General Hospital, what is H. Sanchez's age?",
            "answer": "29",
            "ref": [
                "Age: 29"
            ]
        },
        {
            "question type": "Factual Question",
            "question": "According to the hospitalization records of Greenfield General Hospital, what is H. Sanchez's occupation?",
            "answer": "Teacher",
            "ref": [
                "Occupation: Teacher"
            ]
        },
        {
            "question type": "Factual Question",
            "question": "According to the hospitalization records of Greenfield General Hospital, what is H. Sanchez's chief complaint?",
            "answer": "Hypertension, swelling in legs, and proteinuria for 2 weeks",
            "ref": [
                "Chief Complaint:",
                "Hypertension, swelling in legs, and proteinuria for 2 weeks."
            ]
        },
        {
            "question type": "Factual Question",
            "question": "According to the hospitalization records of Greenfield General Hospital, what is the preliminary diagnosis for H. Sanchez?",
            "answer": "Pregnancy-Induced Hypertension Syndrome",
            "ref": [
                "Preliminary Diagnosis:",
                "Pregnancy-Induced Hypertension Syndrome."
            ]
        }
    ],
    "qa_multi_hop": [],
    "qa_summary": [
        {
            "question type": "Summarization Question",
            "question": "According to the hospitalization records of Greenfield General Hospital, summarize the present illness of H. Sanchez.",
            "answer": "Approximately 2 weeks ago, H. Sanchez experienced persistent hypertension, notable leg edema, and proteinuria detected upon testing. Symptoms worsened over the past week despite rest. She also had occasional headaches and dizziness, predominantly when standing up. Initial consultation led to a diagnosis of Pregnancy-Induced Hypertension Syndrome, but symptoms did not improve significantly, leading to a hospital referral. Her mental state is slightly anxious, sleep is disturbed, appetite decreased slightly, and she has mild weight gain attributed to edema.",
            "ref": [
                "Present Illness:",
                "Onset: Approximately 2 weeks ago, at home, gradually with no apparent trigger.",
                "Main Symptoms: Persistent hypertension, notable leg edema, proteinuria detected upon testing; symptoms worsening over the past week despite rest.",
                "Accompanying Symptoms: Occasional headaches, dizziness predominantly when standing up.",
                "Diagnosis and Treatment History: Initial consultation with primary care physician led to diagnosis of Pregnancy-Induced Hypertension Syndrome.",
                "Prescribed medication and advised bed rest.",
                "Symptoms did not improve significantly.",
                "Referral to hospital for further management.",
                "General Condition Changes: Mental state slightly anxious due to health concerns.",
                "Sleep disturbed by discomfort.",
                "Appetite decreased slightly.",
                "Mild weight gain attributed to edema."
            ]
        },
        {
            "question type": "Summarization Question",
            "question": "According to the hospitalization records of Greenfield General Hospital, summarize the past medical history of H. Sanchez.",
            "answer": "H. Sanchez is generally healthy with no significant past illnesses, no chronic illnesses, no significant infectious diseases, and is up to date with standard immunizations. She had an appendectomy at age 15 and has no history of blood transfusion or known allergies.",
            "ref": [
                "General Health Condition: Generally healthy with no significant past illnesses.",
                "Disease History: No chronic illnesses.",
                "Infectious Disease History: No significant infectious diseases.",
                "Immunization History: Up to date with standard immunizations.",
                "Surgery and Trauma History: Appendectomy at age 15.",
                "Blood Transfusion History: No history of blood transfusion.",
                "Allergy History: No known allergies."
            ]
        },
        {
            "question type": "Summarization Question",
            "question": "According to the hospitalization records of Greenfield General Hospital, summarize the physical examination findings of H. Sanchez.",
            "answer": "H. Sanchez's general condition includes a temperature of 37°C (98.6°F), pulse of 88 bpm, respiration of 18 breaths/min, and blood pressure of 150/95 mmHg. Systematic examination revealed no rash, pale skin, no abnormalities in mucous membranes, no lymph node enlargement, and no abnormalities in head and organs. Her neck showed no goiter or jugular venous distention. Chest examination revealed clear lung sounds and no murmurs or added heart sounds. The abdomen was non-tender with no hepatosplenomegaly. Pitting edema was observed in the lower extremities, and no neurological deficits were noted.",
            "ref": [
                "General Condition:",
                "Temperature: 37°C (98.6°F).",
                "Pulse: 88 bpm.",
                "Respiration: 18 breaths/min.",
                "Blood Pressure: 150/95 mmHg.",
                "Skin: No rash, pale skin.",
                "Mucous Membranes: No abnormalities.",
                "Lymph Nodes: No enlargement.",
                "Head and Organs: No abnormalities.",
                "Neck: No goiter, no jugular venous distention.",
                "Chest: Clear lung sounds, no murmurs or added heart sounds.",
                "Abdomen: Non-tender, no hepatosplenomegaly noted.",
                "Limbs: Pitting edema observed in lower extremities.",
                "Nervous System: No neurological deficits observed."
            ]
        }
    ]
}