{
    "报告类型": "公司环境与社会责任报告",
    "报告时间": "2021年度",
    "公司信息": {
        "名称": "国家行政数据中心",
        "成立日期": "2003年6月",
        "主营业务": "提供政府信息化解决方案和云计算服务",
        "注册地": "北京市朝阳区",
        "上市情况": "非上市",
        "行业": "政府"
    },
    "报告内容": [
        {
            "类型": "环境责任",
            "重要事件": [
                {
                    "事件": "节能减排项目实施",
                    "时间": "2021年1月",
                    "描述": "公司投资实施的节能减排项目，在生产过程中采用先进的节能技术，旨在减少能源消耗和温室气体排放。",
                    "影响": "通过优化生产流程和采用更环保的能源，公司成功减少了能源消耗量和碳排放，提高了能效和环境绩效。"
                },
                {
                    "事件": "节能灯推广",
                    "时间": "2021年3月",
                    "描述": "公司积极推广并使用节能灯，以替代传统白炽灯和荧光灯，减少能源消耗和碳排放。",
                    "影响": "通过节能灯的推广应用，公司实现了节能减排，有效降低了能源消耗和环境负荷。"
                },
                {
                    "事件": "碳抵消项目投资",
                    "时间": "2021年7月",
                    "描述": "公司通过投资林业项目和可再生能源项目，实现碳排放的抵消，为实现碳中和目标贡献一份力量。",
                    "影响": "通过参与碳抵消项目，公司能够向利益相关者展示其对环境的承诺和责任，同时为可持续发展做出贡献。"
                },
                {
                    "事件": "污染防治设施建设",
                    "时间": "2021年8月",
                    "描述": "公司投资建设了废水处理系统和排放控制设备等先进的污染防治设施，以减少生产过程中的环境污染。",
                    "影响": "新建的污染防治设施能够有效控制废水和废气的排放，显著降低了公司的环境污染水平，增强了公司的合规性和社会责任感。"
                },
                {
                    "事件": "绿色产品开发",
                    "时间": "2021年10月",
                    "描述": "公司致力于研发和推出绿色产品，采用环保材料和可再生能源，在生产、使用和废弃阶段都减少对环境的影响。",
                    "影响": "公司的绿色产品受到市场欢迎，提升了市场竞争力和品牌形象，同时减少了环境负荷。"
                },
                {
                    "事件": "环境管理系统实施",
                    "时间": "2021年11月",
                    "描述": "公司引入并严格执行ISO 14001环境管理体系，以提高环境绩效，减少废物产生，并确保合规。",
                    "影响": "通过实施环境管理系统，公司加强了对环境管理和持续改进的能力，提升了合规性和市场认可度。"
                }
            ],
            "涉及的指标": [
                {
                    "指标": "二氧化碳排放量",
                    "描述": "公司在生产过程中产生的二氧化碳总量。",
                    "影响因素": [
                        "生产规模的变化",
                        "节能技术的应用"
                    ],
                    "值": "120,000吨"
                },
                {
                    "指标": "能源消耗",
                    "描述": "公司在运营过程中消耗的能源总量。",
                    "影响因素": [
                        "生产效率的提高",
                        "能源管理措施的实施"
                    ],
                    "值": "1,500,000吨标准煤相当"
                }
            ]
        },
        {
            "类型": "社会责任",
            "重要事件": [
                {
                    "事件": "公共服务项目投资",
                    "时间": "2021年2月",
                    "描述": "公司积极投资或参与公共服务项目，如城市绿化、公共卫生改善项目，以提升社区的生活质量和环境。",
                    "影响": "公司的公共服务项目为社区的可持续发展和改善带来了积极的影响，增强了公众对公司的积极认知和支持。"
                },
                {
                    "事件": "参与慈善活动",
                    "时间": "2021年4月",
                    "描述": "公司积极参与和资助慈善活动和慈善机构，以支持教育、健康、减贫等领域的公益事业。",
                    "影响": "通过参与慈善活动，公司提高了自身的社会形象和品牌认知，加强了与社区的联系和支持。"
                },
                {
                    "事件": "社区支持和发展项目",
                    "时间": "2021年5月",
                    "描述": "公司积极投资于当地社区，支持教育、健康和社会发展等项目，为社区的整体福祉和发展贡献力量。",
                    "影响": "公司的社区支持和发展项目加深了与社区的联系，促进了社区的整体进步和发展，树立了良好的企业形象和社会声誉。"
                },
                {
                    "事件": "社会公益项目合作",
                    "时间": "2021年6月",
                    "描述": "公司与公益机构合作，共同开展社会公益项目，如环保教育、志愿者服务等，推动社会进步和可持续发展。",
                    "影响": "通过社会公益项目的合作，公司积极参与社会事务，发挥了企业的社会责任，得到了公众的认可和赞誉。"
                },
                {
                    "事件": "员工职业成长和人才发展计划",
                    "时间": "2021年8月",
                    "描述": "公司提供丰富多样的培训和发展项目，包括在线课程、工作坊、导师计划等，支持员工的职业成长和个人发展。",
                    "影响": "公司的员工培训和发展计划有助于提升员工的专业技能和工作满意度，促进了人才的留存和发展。"
                },
                {
                    "事件": "员工健康与安全计划",
                    "时间": "2021年10月",
                    "描述": "公司实施了全面的员工健康与安全计划，包括工作环境改善、职业健康监测和应急预案等措施。",
                    "影响": "公司的员工健康与安全计划显著改善了工作环境，降低了工伤事故的风险，提高了员工的工作满意度和福祉水平。"
                }
            ],
            "涉及的指标": [
                {
                    "指标": "员工满意度",
                    "描述": "通过调查了解到的员工对公司工作环境和政策满意度的度量。",
                    "影响因素": [
                        "工作环境的改善",
                        "员工福利政策的调整"
                    ],
                    "值": "83%"
                },
                {
                    "指标": "社区投资额",
                    "描述": "公司在社区发展项目上的总投资额。",
                    "影响因素": [
                        "公司财务状况的变化",
                        "社会责任战略的调整"
                    ],
                    "值": "500万元"
                }
            ]
        }
    ],
    "额外信息": [
        {
            "名称": "未来展望",
            "内容": [
                {
                    "名称": "环境保护计划",
                    "描述": "公司将继续采取一系列措施减少其运营对环境的影响，包括进一步推进节能减排项目、加强废物管理和资源循环利用等。",
                    "时间": "2022年-2025年"
                },
                {
                    "名称": "社会责任战略",
                    "描述": "公司将在业务实践中积极履行社会责任，包括促进社区发展、改善员工福利、提供公平就业机会和参与公益活动等方面的努力。",
                    "时间": "2022年-2025年"
                },
                {
                    "名称": "可持续发展目标",
                    "描述": "公司致力于通过整合可持续性原则到业务模型和决策过程中，实现联合国可持续发展目标（SDGs），包括减少温室气体排放、促进清洁能源和可持续城市发展等。",
                    "时间": "2022年-2030年"
                }
            ]
        }
    ],
    "生成大纲": "公司环境与社会责任报告大纲：\n\n1. 公司信息\n   - 公司名称：国家行政数据中心\n   - 成立日期：2003年6月\n   - 主营业务：提供政府信息化解决方案和云计算服务\n   - 注册地：北京市朝阳区\n   - 上市情况：非上市\n   - 行业：政府\n\n2. 环境责任\n   - 节能减排项目实施(2021年1月)\n     - 公司投资实施的节能减排项目，采用先进的节能技术\n     - 影响：成功减少能源消耗量和碳排放，提高能效和环境绩效\n   - 节能灯推广(2021年3月)\n     - 公司推广并使用节能灯，减少能源消耗和碳排放\n     - 影响：实现节能减排，降低能源消耗和环境负荷\n   - 碳抵消项目投资(2021年7月)\n     - 公司通过投资林业项目和可再生能源项目，实现碳排放的抵消\n     - 影响：展示对环境的承诺和责任，为可持续发展做出贡献\n   - 污染防治设施建设(2021年8月)\n     - 公司投资建设了先进的污染防治设施，减少环境污染\n     - 影响：有效控制废水和废气排放，增强合规性和社会责任感\n   - 绿色产品开发(2021年10月)\n     - 公司研发和推出绿色产品，减少对环境的影响\n     - 影响：提升市场竞争力和品牌形象，减少环境负荷\n   - 环境管理系统实施(2021年11月)\n     - 公司引入并执行ISO 14001环境管理体系，提高环境绩效\n     - 影响：加强环境管理和持续改进能力，提升合规性和市场认可度\n\n   涉及的指标：\n   - 二氧化碳排放量(120,000吨)\n     - 影响因素：生产规模的变化，节能技术的应用\n   - 能源消耗(1,500,000吨标准煤相当)\n     - 影响因素：生产效率的提高，能源管理措施的实施\n\n3. 社会责任\n   - 公共服务项目投资(2021年2月)\n     - 公司积极投资或参与公共服务项目，提升社区的生活质量和环境\n     - 影响：对社区的可持续发展和改善有积极影响，增强公众对公司的认知和支持\n   - 参与慈善活动(2021年4月)\n     - 公司积极参与和资助慈善活动和机构，支持公益事业\n     - 影响：提升社会形象和品牌认知，加强与社区的联系和支持\n   - 社区支持和发展项目(2021年5月)\n     - 公司积极投资于当地社区，支持教育、健康和社会发展\n     - 影响：加深与社区的联系，促进社区的整体进步和发展，树立企业形象和社会声誉\n   - 社会公益项目合作(2021年6月)\n     - 公司与公益机构合作，共同开展社会公益项目\n     - 影响：积极参与社会事务，发挥企业的社会责任，得到公众的认可和赞誉\n   - 员工职业成长和人才发展计划(2021年8月)\n     - 公司提供培训和发展项目，支持员工的职业成长和个人发展\n     - 影响：提升员工的专业技能和工作满意度，促进人才的留存和发展\n   - 员工健康与安全计划(2021年10月)\n     - 公司实施全面的员工健康与安全计划，改善工作环境和应对风险\n     - 影响：改善工作环境，降低工伤事故风险，提高员工的工作满意度和福祉水平\n\n   涉及的指标：\n   - 员工满意度(83%)\n     - 影响因素：工作环境的改善，员工福利政策的调整\n   - 社区投资额(500万元)\n     - 影响因素：公司财务状况的变化，社会责任战略的调整\n\n4. 未来展望\n   - 环境保护计划(2022年-2025年)\n     - 公司将继续推进节能减排、加强废物管理和资源循环利用等措施\n   - 社会责任战略(2022年-2025年)\n     - 公司将积极履行社会责任，促进社区发展、改善员工福利和参与公益活动\n   - 可持续发展目标(2022年-2030年)\n     - 公司致力于整合可持续性原则，实现联合国可持续发展目标，如减排、清洁能源和可持续城市发展等",
    "生成总结": "国家行政数据中心是一家成立于2003年6月，总部位于北京市朝阳区的非上市公司，主营业务是提供政府信息化解决方案和云计算服务。",
    "生成文章": "在环境责任方面，国家行政数据中心积极推行节能减排项目。自2021年1月起，公司投资实施了一系列节能减排项目，采用了先进的节能技术。这些项目的实施成功减少了能源消耗量和碳排放，提高了能效和环境绩效。其中，二氧化碳排放量减少了120,000吨，能源消耗减少了1,500,000吨标准煤相当。这些成果主要归功于生产规模的变化和节能技术的应用，有效地提高了公司的环境可持续性。\n\n此外，国家行政数据中心还推广了节能灯的使用，通过使用节能灯来减少能源消耗和碳排放。这项举措的影响是实现了节能减排，降低了能源消耗和环境负荷。公司还通过投资林业项目和可再生能源项目来实现碳排放的抵消，展示了对环境的承诺和责任，为可持续发展做出了贡献。此外，公司还投资建设了先进的污染防治设施，有效控制废水和废气排放，增强了合规性和社会责任感。同时，公司还致力于研发和推出绿色产品，减少对环境的影响，提升了市场竞争力和品牌形象。\n\n为了加强环境管理和持续改进能力，国家行政数据中心引入并执行了ISO 14001环境管理体系。这一举措的影响是加强了环境管理和持续改进能力，提升了合规性和市场认可度。\n\n在社会责任方面，国家行政数据中心积极投资或参与公共服务项目，提升社区的生活质量和环境。公司还积极参与和资助慈善活动和机构，支持公益事业。此外，公司还积极投资于当地社区，支持教育、健康和社会发展。通过这些社区支持和发展项目，公司加深了与社区的联系，促进了社区的整体进步和发展，树立了企业形象和社会声誉。公司还与公益机构合作，共同开展社会公益项目，积极参与社会事务，发挥了企业的社会责任，得到了公众的认可和赞誉。\n\n为了支持员工的职业成长和个人发展，国家行政数据中心提供了培训和发展项目。这些举措的影响是提升了员工的专业技能和工作满意度，促进了人才的留存和发展。同时，公司还实施了全面的员工健康与安全计划，改善了工作环境和应对风险，降低了工伤事故风险，提高了员工的工作满意度和福祉水平。\n\n未来展望方面，国家行政数据中心将继续推进节能减排、加强废物管理和资源循环利用等措施，以实现环境保护计划。同时，公司将继续积极履行社会责任，促进社区发展、改善员工福利和参与公益活动，实施社会责任战略。此外，公司还致力于整合可持续性原则，实现联合国可持续发展目标，如减排、清洁能源和可持续城市发展等。\n\n综上所述，国家行政数据中心在环境责任和社会责任方面取得了显著成绩。通过一系列的节能减排项目和环境管理措施，公司成功减少了能源消耗量和碳排放，提高了能效和环境绩效。同时，公司积极投资或参与公共服务项目、慈善活动和社区支持项目，支持社区的发展和改善员工福利。未来，公司将继续致力于环境保护和社会责任，为可持续发展做出更大的贡献。"
}