{
    "Report Type": "Corporate Governance Report",
    "Report Time": "2019",
    "Company Information": {
        "Name": "InnovateTech, Inc.",
        "Establishment Date": "May 12, 2012",
        "Main Business": "InnovateTech, Inc. specializes in developing cutting-edge software solutions for social networking platforms.",
        "Registration Location": "San Francisco, California",
        "Listing Status": "Publicly Listed on NASDAQ",
        "Industry": "Social"
    },
    "Report Content": [
        {
            "Type": "Governance Structure",
            "Significant Events": [
                {
                    "Event": "Compliance and Regulatory Updates",
                    "Time": "January, 2019",
                    "Description": "Updates to new regulations or compliance standards affecting corporate governance practices, including changes in securities law, corporate law, or specific industry regulations.",
                    "Impact": "Ensures compliance with the latest laws and regulations, reducing legal risk, protecting the company and shareholder interests.",
                    "Sub Events": [
                        {
                            "Event": "Internal Audit of Corporate Governance Practices",
                            "Time": "February, 2019",
                            "Description": "Conducted an internal audit of corporate governance practices to identify areas of improvement and ensure adherence to internal policies and procedures.",
                            "Impact": "Enhanced transparency, accountability, and integrity in corporate governance, leading to improved decision-making processes and mitigating the risk of fraud or unethical behavior."
                        },
                        {
                            "Event": "Appointment of Chief Compliance Officer",
                            "Time": "March, 2019",
                            "Description": "Appointed a Chief Compliance Officer responsible for overseeing and enforcing compliance with regulatory requirements, internal policies, and industry standards.",
                            "Impact": "Strengthened regulatory compliance culture, minimized non-compliance risks, and instilled confidence in investors and stakeholders regarding the company's commitment to adherence to legal and ethical standards."
                        },
                        {
                            "Event": "Revision of Code of Ethics and Conduct",
                            "Time": "April, 2019",
                            "Description": "Revised the company's Code of Ethics and Conduct to align with evolving industry practices, address emerging ethical challenges, and promote responsible business conduct.",
                            "Impact": "Established clear ethical standards and guidelines, fostering a culture of integrity, and building trust among employees, shareholders, and business partners."
                        },
                        {
                            "Event": "Internal Training on Corporate Governance",
                            "Time": "May, 2019",
                            "Description": "Conducted comprehensive training sessions for employees to enhance their understanding of corporate governance principles, compliance requirements, and reporting obligations.",
                            "Impact": "Improved employees' awareness of corporate governance standards, mitigated risks associated with non-compliance, and promoted a culture of accountability and responsible decision-making throughout the organization."
                        },
                        {
                            "Event": "Enhancement of Whistleblower Policy",
                            "Time": "June, 2019",
                            "Description": "Enhanced the existing Whistleblower Policy to provide employees with a safe and confidential mechanism to report suspected fraudulent activities, unethical behavior, or violations of corporate governance policies.",
                            "Impact": "Encouraged a speak-up culture, facilitating the detection and prevention of misconduct, and safeguarding the company's reputation and assets."
                        }
                    ]
                },
                {
                    "Event": "Risk Management Measures",
                    "Time": "February, 2019",
                    "Description": "Updates to the company's risk management framework, including identification of new risks and implementation of mitigation strategies.",
                    "Impact": "Improves the company’s ability to respond to internal and external risks, ensuring continuous operation and stable development."
                },
                {
                    "Event": "Ethics and Integrity Incidents",
                    "Time": "March, 2019",
                    "Description": "Significant ethical or integrity violations, such as fraud, corruption, or conflicts of interest, and the measures taken by the company in response.",
                    "Impact": "May damage the company's reputation and brand value, affecting relationships with investors, customers, and partners."
                },
                {
                    "Event": "Sustainability and Social Responsibility Initiatives",
                    "Time": "April, 2019",
                    "Description": "Significant progress in sustainability, environmental protection, social responsibility, and corporate citizenship.",
                    "Impact": "Enhances the company’s public image and market competitiveness, promoting long-term sustainable development."
                },
                {
                    "Event": "Shareholders' Meeting Resolution",
                    "Time": "May, 2019",
                    "Description": "Key decisions made at the annual or extraordinary shareholders’ meeting, including changes to the company’s charter, major corporate actions, and voting results.",
                    "Impact": "Directly affects the company’s governance structure, future operational strategies, and shareholder rights."
                },
                {
                    "Event": "Corporate Governance Policy Revision",
                    "Time": "June, 2019",
                    "Description": "Revision of the corporate governance framework or policies to enhance transparency, accountability, or stakeholder engagement.",
                    "Impact": "Enhances corporate governance transparency and accountability, boosting stakeholder confidence."
                },
                {
                    "Event": "Strategic Partnership with Top Social Media Platform",
                    "Time": "July, 2019",
                    "Description": "Establishment of a strategic partnership with a leading social media platform, enabling access to a wider user base and increased market reach.",
                    "Impact": "Expands customer base, increases revenue opportunities, and strengthens the company's position in the social media industry."
                },
                {
                    "Event": "Board of Directors Change",
                    "Time": "August, 2019",
                    "Description": "The appointment or resignation of board members, and its impact on the company's strategic direction.",
                    "Impact": "May lead to strategic adjustments, affecting the company’s long-term development direction and shareholder interests."
                },
                {
                    "Event": "Initial Public Offering (IPO)",
                    "Time": "November, 2019",
                    "Description": "Successful completion of the company's IPO, generating funds for expansion and increasing market visibility.",
                    "Impact": "Provides capital for business growth, enhances the company's reputation as a publicly traded entity."
                },
                {
                    "Event": "Senior Management Changes",
                    "Time": "December, 2019",
                    "Description": "Changes in the company’s senior management, including the CEO or other key positions, and its impact on the company's operational focus and priorities.",
                    "Impact": "May lead to adjustments in operational focus and strategic priorities, affecting short-term performance and long-term development."
                }
            ],
            "Involved Indicators": [
                {
                    "Indicator": "Information Disclosure",
                    "Description": "Principles, methods, and implementation status of company information disclosure.",
                    "Value": "Consistently transparent and timely disclosure of financial information, corporate developments, and material events to promote investor confidence and ensure compliance with regulatory requirements."
                },
                {
                    "Indicator": "Related Transactions",
                    "Description": "Policies, procedures, and measures to ensure fairness and compliance of related transactions.",
                    "Value": "Strict adherence to fair and transparent related transaction practices, implementing policies and procedures to prevent conflicts of interest and protect shareholder value."
                },
                {
                    "Indicator": "Internal Control",
                    "Description": "Architecture, implementation, and effectiveness assessment of internal controls.",
                    "Value": "Robust and comprehensive internal control system encompassing financial, operational, and compliance controls, providing assurance on reliability, accuracy, and integrity of financial reporting."
                }
            ]
        }
    ],
    "Additional Information": [
        {
            "Name": "Governance Improvement Plans",
            "Content": [
                {
                    "Name": "Strengthening the Function of the Board of Directors and Supervisory Board",
                    "Description": "Enhancing the efficiency and effectiveness of the board of directors and supervisory board in corporate governance, including regular training, increasing the proportion of independent directors, optimizing decision-making processes."
                },
                {
                    "Name": "Enhancing Transparency and Quality of Information Disclosure",
                    "Description": "Improving the information disclosure process and standards to ensure timely, accurate, and comprehensive reporting to all stakeholders."
                },
                {
                    "Name": "Establishing an Ethics and Compliance Committee",
                    "Description": "Creation of a dedicated ethics and compliance committee to monitor and mitigate ethical and integrity risks, ensuring adherence to ethical standards and legal requirements."
                }
            ]
        },
        {
            "Name": "Risk Management Strategy",
            "Content": [
                {
                    "Name": "Strengthening the Internal Control System",
                    "Description": "Establishing and improving the internal control system to identify, assess, monitor, and report financial and operational risks, enhancing the company's ability to withstand risks."
                },
                {
                    "Name": "Integrating Sustainable Development and Social Responsibility",
                    "Description": "Incorporating sustainable development and social responsibility into the company’s strategy, identifying related risks and opportunities, promoting long-term value creation."
                },
                {
                    "Name": "Enhancing Cybersecurity Measures",
                    "Description": "Implementation of advanced cybersecurity measures to protect sensitive information and customer data, mitigating the risk of data breaches and cyber attacks."
                }
            ]
        }
    ],
    "Generated Outline": "I. Introduction\n    A. Report Type: Corporate Governance Report\n    B. Report Time: 2019\n    C. Company Information\n        1. Name: InnovateTech, Inc.\n        2. Establishment Date: May 12, 2012\n        3. Main Business: Specializes in developing cutting-edge software solutions for social networking platforms.\n        4. Registration Location: San Francisco, California\n        5. Listing Status: Publicly Listed on NASDAQ\n        6. Industry: Social\n\nII. Governance Structure\n    A. Compliance and Regulatory Updates (January, 2019)\n        1. Description: Updates to new regulations or compliance standards affecting corporate governance practices, including changes in securities law, corporate law, or specific industry regulations.\n        2. Impact: Ensures compliance with the latest laws and regulations, reducing legal risk and protecting the company and shareholder interests.\n        3. Sub Events\n            a. Internal Audit of Corporate Governance Practices (February, 2019)\n                - Description: Conducted an internal audit of corporate governance practices to identify areas of improvement and ensure adherence to internal policies and procedures.\n                - Impact: Enhanced transparency, accountability, and integrity in corporate governance, leading to improved decision-making processes and mitigating the risk of fraud or unethical behavior.\n            b. Appointment of Chief Compliance Officer (March, 2019)\n                - Description: Appointed a Chief Compliance Officer responsible for overseeing and enforcing compliance with regulatory requirements, internal policies, and industry standards.\n                - Impact: Strengthened regulatory compliance culture, minimized non-compliance risks, and instilled confidence in investors and stakeholders regarding the company's commitment to adherence to legal and ethical standards.\n            c. Revision of Code of Ethics and Conduct (April, 2019)\n                - Description: Revised the company's Code of Ethics and Conduct to align with evolving industry practices, address emerging ethical challenges, and promote responsible business conduct.\n                - Impact: Established clear ethical standards and guidelines, fostering a culture of integrity, and building trust among employees, shareholders, and business partners.\n            d. Internal Training on Corporate Governance (May, 2019)\n                - Description: Conducted comprehensive training sessions for employees to enhance their understanding of corporate governance principles, compliance requirements, and reporting obligations.\n                - Impact: Improved employees' awareness of corporate governance standards, mitigated risks associated with non-compliance, and promoted a culture of accountability and responsible decision-making throughout the organization.\n            e. Enhancement of Whistleblower Policy (June, 2019)\n                - Description: Enhanced the existing Whistleblower Policy to provide employees with a safe and confidential mechanism to report suspected fraudulent activities, unethical behavior, or violations of corporate governance policies.\n                - Impact: Encouraged a speak-up culture, facilitating the detection and prevention of misconduct, and safeguarding the company's reputation and assets.\n    B. Risk Management Measures (February, 2019)\n        1. Description: Updates to the company's risk management framework, including the identification of new risks and implementation of mitigation strategies.\n        2. Impact: Improves the company’s ability to respond to internal and external risks, ensuring continuous operation and stable development.\n    C. Ethics and Integrity Incidents (March, 2019)\n        1. Description: Significant ethical or integrity violations, such as fraud, corruption, or conflicts of interest, and the measures taken by the company in response.\n        2. Impact: May damage the company's reputation and brand value, affecting relationships with investors, customers, and partners.\n    D. Sustainability and Social Responsibility Initiatives (April, 2019)\n        1. Description: Significant progress in sustainability, environmental protection, social responsibility, and corporate citizenship.\n        2. Impact: Enhances the company’s public image and market competitiveness, promoting long-term sustainable development.\n    E. Shareholders' Meeting Resolution (May, 2019)\n        1. Description: Key decisions made at the annual or extraordinary shareholders’ meeting, including changes to the company’s charter, major corporate actions, and voting results.\n        2. Impact: Directly affects the company’s governance structure, future operational strategies, and shareholder rights.\n    F. Corporate Governance Policy Revision (June, 2019)\n        1. Description: Revision of the corporate governance framework or policies to enhance transparency, accountability, or stakeholder engagement.\n        2. Impact: Enhances corporate governance transparency and accountability, boosting stakeholder confidence.\n    G. Strategic Partnership with Top Social Media Platform (July, 2019)\n        1. Description: Establishment of a strategic partnership with a leading social media platform, enabling access to a wider user base and increased market reach.\n        2. Impact: Expands customer base, increases revenue opportunities, and strengthens the company's position in the social media industry.\n    H. Board of Directors Change (August, 2019)\n        1. Description: The appointment or resignation of board members, and its impact on the company's strategic direction.\n        2. Impact: May lead to strategic adjustments, affecting the company’s long-term development direction and shareholder interests.\n    I. Initial Public Offering (IPO) (November, 2019)\n        1. Description: Successful completion of the company's IPO, generating funds for expansion and increasing market visibility.\n        2. Impact: Provides capital for business growth, enhances the company's reputation as a publicly traded entity.\n    J. Senior Management Changes (December, 2019)\n        1. Description: Changes in the company’s senior management, including the CEO or other key positions, and its impact on the company's operational focus and priorities.\n        2. Impact: May lead to adjustments in operational focus and strategic priorities, affecting short-term performance and long-term development.\n\nIII. Involved Indicators\n    A. Information Disclosure\n        1. Description: Principles, methods, and implementation status of company information disclosure.\n        2. Value: Consistently transparent and timely disclosure of financial information, corporate developments, and material events to promote investor confidence and ensure compliance with regulatory requirements.\n    B. Related Transactions\n        1. Description: Policies, procedures, and measures to ensure fairness and compliance of related transactions.\n        2. Value: Strict adherence to fair and transparent related transaction practices, implementing policies and procedures to prevent conflicts of interest and protect shareholder value.\n    C. Internal Control\n        1. Description: Architecture, implementation, and effectiveness assessment of internal controls.\n        2. Value: Robust and comprehensive internal control system encompassing financial, operational, and compliance controls, providing assurance on the reliability, accuracy, and integrity of financial reporting.\n\nIV. Additional Information\n    A. Governance Improvement Plans\n        1. Strengthening the Function of the Board of Directors and Supervisory Board\n            - Description: Enhancing the efficiency and effectiveness of the board of directors and supervisory board in corporate governance, including regular training, increasing the proportion of independent directors, optimizing decision-making processes.\n        2. Enhancing Transparency and Quality of Information Disclosure\n            - Description: Improving the information disclosure process and standards to ensure timely, accurate, and comprehensive reporting to all stakeholders.\n        3. Establishing an Ethics and Compliance Committee\n            - Description: Creation of a dedicated ethics and compliance committee to monitor and mitigate ethical and integrity risks, ensuring adherence to ethical standards and legal requirements.\n    B. Risk Management Strategy\n        1. Strengthening the Internal Control System\n            - Description: Establishing and improving the internal control system to identify, assess, monitor, and report financial and operational risks, enhancing the company's ability to withstand risks.\n        2. Integrating Sustainable Development and Social Responsibility\n            - Description: Incorporating sustainable development and social responsibility into the company’s strategy, identifying related risks and opportunities, promoting long-term value creation.\n        3. Enhancing Cybersecurity Measures\n            - Description: Implementation of advanced cybersecurity measures to protect sensitive information and customer data, mitigating the risk of data breaches and cyber attacks.",
    "Generated Summary": "InnovateTech, Inc. is a San Francisco-based company that was established on May 12, 2012 and is publicly listed on NASDAQ, specializing in developing advanced software solutions for social networking platforms.",
    "Generated Article": "In 2019, InnovateTech, Inc. demonstrated a strong commitment to corporate governance and implemented several key initiatives to enhance transparency, compliance, and ethical practices. The company's governance structure was strengthened through various compliance and regulatory updates, starting with an internal audit of corporate governance practices conducted in February. This audit aimed to identify areas for improvement and ensure adherence to internal policies and procedures. The impact of this audit was significant, as it enhanced transparency, accountability, and integrity in corporate governance, leading to improved decision-making processes and mitigating the risk of fraud or unethical behavior.\n\nIn March, InnovateTech appointed a Chief Compliance Officer responsible for overseeing and enforcing compliance with regulatory requirements, internal policies, and industry standards. This appointment further strengthened the company's regulatory compliance culture, minimized non-compliance risks, and instilled confidence in investors and stakeholders regarding the company's commitment to adherence to legal and ethical standards.\n\nIn April, the company revised its Code of Ethics and Conduct to align with evolving industry practices, address emerging ethical challenges, and promote responsible business conduct. This revision had a positive impact on the company, as it established clear ethical standards and guidelines, fostering a culture of integrity and building trust among employees, shareholders, and business partners.\n\nTo ensure that employees were well-informed about corporate governance principles, compliance requirements, and reporting obligations, InnovateTech conducted comprehensive training sessions in May. This internal training improved employees' awareness of corporate governance standards, mitigated risks associated with non-compliance, and promoted a culture of accountability and responsible decision-making throughout the organization.\n\nIn June, the company enhanced its Whistleblower Policy to provide employees with a safe and confidential mechanism to report suspected fraudulent activities, unethical behavior, or violations of corporate governance policies. This enhancement encouraged a speak-up culture, facilitating the detection and prevention of misconduct, and safeguarding the company's reputation and assets.\n\nIn terms of risk management, InnovateTech implemented measures in February to update its risk management framework. These measures included the identification of new risks and the implementation of mitigation strategies. By continuously assessing and addressing risks, the company improved its ability to respond to internal and external challenges, ensuring continuous operation and stable development.\n\nIn addition to governance and risk management, InnovateTech demonstrated a strong commitment to sustainability and social responsibility. In April, the company made significant progress in these areas, contributing to environmental protection, social responsibility, and corporate citizenship. These initiatives enhanced the company's public image and market competitiveness, promoting long-term sustainable development.\n\nThe shareholders' meeting in May played a crucial role in shaping the company's governance structure and future operational strategies. Key decisions made at this meeting, including changes to the company's charter, major corporate actions, and voting results, directly impacted the company's governance structure and shareholder rights.\n\nIn June, InnovateTech revised its corporate governance policies to enhance transparency, accountability, and stakeholder engagement. This revision further boosted stakeholder confidence and promoted corporate governance transparency and accountability.\n\nIn July, the company established a strategic partnership with a top social media platform, enabling access to a wider user base and increased market reach. This partnership expanded InnovateTech's customer base, increased revenue opportunities, and strengthened its position in the social media industry.\n\nIn August, there was a change in the board of directors, which had an impact on the company's strategic direction. Such changes may lead to adjustments in operational focus and strategic priorities, affecting both short-term performance and long-term development.\n\nIn November, InnovateTech successfully completed its Initial Public Offering (IPO), generating funds for expansion and increasing market visibility. This IPO provided capital for business growth and enhanced the company's reputation as a publicly traded entity.\n\nFinally, in December, there were changes in the company's senior management, including the CEO or other key positions. These changes had an impact on the company's operational focus and priorities, leading to adjustments in strategic direction and potentially affecting both short-term performance and long-term development.\n\nThroughout 2019, InnovateTech demonstrated a strong commitment to corporate governance, risk management, sustainability, and social responsibility. The company's efforts to enhance transparency, compliance, and ethical practices have positioned it as a leader in the social networking software solutions industry. By continuously improving its governance structure, risk management measures, and ethical standards, InnovateTech has built a solid foundation for long-term success and stakeholder confidence."
}