{
    "Hospitalization Record": {
        "Basic Information": {
            "Name": "O. Richardson",
            "Gender": "female",
            "Age": "56",
            "Ethnicity": "Caucasian",
            "Marital Status": "Married",
            "Occupation": "Teacher",
            "Address": "95, Knoxville street, Lakeside",
            "Admission Time": "15th, February",
            "Record Time": "15th, February",
            "Historian": "Self",
            "Hospital Name": "Lakeside General Hospital"
        },
        "Chief Complaint": "Fatigue and dizziness for 2 months",
        "Present Illness": {
            "Onset": "The patient reports the onset of symptoms approximately 2 months ago. Initially experienced intermittent dizziness and fatigue, which progressively worsened.",
            "Main Symptoms": "The patient describes persistent fatigue and dizziness that have been getting progressively worse over the past 2 months. She reports pallor and occasional faintness. Symptoms are exacerbated with physical exertion and somewhat relieved with rest.",
            "Accompanying Symptoms": "In addition to fatigue and dizziness, the patient also mentions pica, specifically craving for chewing ice. She also has significant weakness.",
            "Diagnosis and Treatment History": "The patient has visited a local clinic where CBC showed decreased hemoglobin levels. Iron supplements were prescribed, with slight improvement reported.",
            "General Condition Changes": "The patient denies any significant changes in mental state, but reports a decreased appetite and a slight unintentional weight loss over the past 2 months. No changes in urination or defecation patterns."
        },
        "Past History": {
            "General Health Condition": "Generally good, with regular annual check-ups.",
            "Disease History": "No history of chronic illnesses.",
            "Infectious Disease History": "No relevant infectious disease history.",
            "Immunization History": "Up to date with routine immunizations.",
            "Surgery and Trauma History": "Appendectomy at age 23.",
            "Blood Transfusion History": "No prior history of blood transfusions.",
            "Allergy History": "No known drug allergies. Mild seasonal allergies."
        },
        "Personal History": {
            "Birthplace": "Lakeside",
            "Residence": "Lakeside",
            "Living Habits": "Non-smoker, occasional alcohol consumption. Balanced diet.",
            "Occupation and Working Conditions": "Works as a teacher in a local school.",
            "Exposure History": "No significant exposure to industrial toxins, dust, or radioactive substances.",
            "Travel History": "No recent travel history."
        },
        "Marital and Family History": {
            "Marital History": {
                "Marital Status": "Married",
                "Marriage Age": "25",
                "Spouse's Health Condition": "Good",
                "Children's Condition": "Two children, both healthy."
            },
            "Menstrual History": {
                "Menarche Age": "13",
                "Menstruation Duration": "5 days",
                "Menstruation Interval": "28 days",
                "Last Menstruation": "10th February",
                "Menstrual Volume": "Moderate",
                "Dysmenorrhea": "Occasional mild"
            },
            "Family History": "Parents are alive and have no significant health issues. Two siblings, both healthy. No known family history of anemia or similar diseases."
        },
        "Physical Examination": {
            "General Condition": {
                "Temperature": "98.6°F",
                "Pulse": "80 bpm",
                "Respiration": "16 breaths/min",
                "Blood Pressure": "110/70 mmHg"
            },
            "Systematic Examination": {
                "Skin": "Pale",
                "Mucous Membranes": "Pale",
                "Lymph Nodes": "No palpable lymphadenopathy",
                "Head and Organs": "No abnormalities noted",
                "Neck": "No jugular venous distention",
                "Chest": "Clear to auscultation bilaterally. Heart sounds normal, no murmurs.",
                "Abdomen": "Soft, non-tender. Liver and spleen not palpably enlarged.",
                "Rectum and Anus": "Not examined",
                "External Genitalia": "Normal",
                "Spine": "No deformities",
                "Limbs": "No edema. Normal range of motion.",
                "Nervous System": "Normal sensory and motor functions. Reflexes intact."
            }
        },
        "Specialist Examination": "Hemoglobin level: 9.2 g/dL, Serum iron: 20 µg/dL, Ferritin: 7 ng/mL",
        "Auxiliary Examination": "Complete Blood Count: Low hemoglobin, Low hematocrit, Microcytic, hypochromic red cells",
        "Preliminary Diagnosis": "Iron Deficiency Anemia",
        "Diagnostic Basis": "History of fatigue, dizziness, pallor, pica, lab results indicating low hemoglobin, low serum iron, and low ferritin.",
        "Differential Diagnosis": "Sideroblastic anemia: ruled out due to absence of ring sideroblasts and increased serum ferritin. Thalassemia: ruled out due to lack of family history and target cells in blood film. Transferrin deficiency: ruled out due to no relevant history or signs of severe liver disease or tumors.",
        "Admission Records": {
            "Physician's Signature": "Dr. A. Thomas"
        },
        "Post-Admission Course Records": {
            "First Course Record": "Patient admitted with severe fatigue, dizziness, and pallor. Laboratory tests confirm iron deficiency anemia. Treatment plan includes iron supplements and dietary adjustments to increase iron intake.",
            "Daily Course Records": "Day 1: Patient tolerating oral iron supplements well. No adverse reactions. Day 2: Mild improvement in symptoms, fatigue slightly reduced. Day 3: Continued stable progress. Appetite improving.",
            "Senior Physician Rounds Records": "15th February: Confirmed diagnosis and reviewed treatment plan. 17th February: Noted gradual improvement in condition and planned continuation of current treatment strategy.",
            "Difficult Case Discussion Records": "Not applicable.",
            "Handover Records": "All relevant information communicated during shift changes.",
            "Transfer Records": "Not applicable.",
            "Stage Summary": "Patient improving with current treatment plan of iron supplementation and dietary changes. Hemoglobin levels slowly increasing.",
            "Emergency Records": "Not applicable.",
            "Invasive Procedure Records": "None required.",
            "Consultation Records": "Consultation with hematologist on 16th February confirmed diagnosis and treatment plan.",
            "Surgery Related": {
                "Preoperative Summary": "Discussed surgical risks and benefits with patient. Consent obtained.",
                "Preoperative Discussion Records": "Surgical intervention not planned at this time.",
                "Anesthesia Preoperative Visit Records": "Not applicable.",
                "Anesthesia Records": "Not applicable.",
                "Surgery Records": "Not applicable.",
                "Surgery Safety Checklist": "Not applicable.",
                "Surgery Instrument Count Records": "Not applicable.",
                "Postoperative First Course Record": "Not applicable.",
                "Anesthesia Postoperative Visit Records": "Not applicable."
            },
            "Discharge Records": "Planned discharge on 22nd February if stable improvements continue.",
            "Critically Ill Patient Care Records": "Not applicable."
        },
        "Medical Orders": {
            "Long-term Orders": "Oral Iron supplements 200 mg twice daily.",
            "Temporary Orders": "Blood tests every 3 days to monitor hemoglobin and iron levels."
        },
        "Auxiliary Examination Reports": "15th February: CBC, Iron studies. 18th February: Follow-up CBC.",
        "Temperature Chart": "15th February: T 98.6°F, P 80 bpm, R 16, BP 110/70 mmHg. 16th February: T 98.4°F, P 78 bpm, R 16, BP 112/70 mmHg. 17th February: T 98.5°F, P 78 bpm, R 16, BP 110/68 mmHg.",
        "Blood Transfusion Consent": "Not required at this stage.",
        "Special Examination Consent": "Not applicable.",
        "Critical Condition Notice": "Not applicable."
    },
    "DiseaseType": {
        "Diseases of the Blood and Blood-Forming Organs": {
            "Name": "Iron Deficiency Anemia",
            "Symptoms": "Pallor (due to a lack of oxygenated hemoglobin in the skin or mucous membranes), fatigue, dizziness, weakness, pica, etc.",
            "Differential Diagnosis": "Sideroblastic anemia (manifests as microcytic anemia, but with increased serum ferritin levels, increased iron granules in bone marrow sideroblasts, increased sideroblasts, and the appearance of ring sideroblasts.), Thalassemia (with a family history. Hemolytic manifestations. A large number of target cells can be seen in the blood film.), Transferrin deficiency (autosomal recessive inheritance (congenital) or secondary to severe liver disease, tumors (acquired).)"
        }
    },
    "Generated Article": "Hospitalization Record\n\nBasic Information:\nName: O. Richardson\nGender: Female\nAge: 56\nEthnicity: Caucasian\nMarital Status: Married\nOccupation: Teacher\nAddress: 95, Knoxville Street, Lakeside\nAdmission Time: 15th February\nRecord Time: 15th February\nHistorian: Self\nHospital Name: Lakeside General Hospital\n\nChief Complaint:\nFatigue and dizziness for 2 months\n\nPresent Illness:\nOnset: The patient reports the onset of symptoms approximately 2 months ago. Initially experienced intermittent dizziness and fatigue, which progressively worsened.\nMain Symptoms: The patient describes persistent fatigue and dizziness that have been getting progressively worse over the past 2 months. She reports pallor and occasional faintness. Symptoms are exacerbated with physical exertion and somewhat relieved with rest.\nAccompanying Symptoms: In addition to fatigue and dizziness, the patient also mentions pica, specifically craving for chewing ice. She also has significant weakness.\nDiagnosis and Treatment History: The patient has visited a local clinic where CBC showed decreased hemoglobin levels. Iron supplements were prescribed, with slight improvement reported.\nGeneral Condition Changes: The patient denies any significant changes in mental state, but reports a decreased appetite and a slight unintentional weight loss over the past 2 months. No changes in urination or defecation patterns.\n\nPast History:\nGeneral Health Condition: Generally good, with regular annual check-ups.\nDisease History: No history of chronic illnesses.\nInfectious Disease History: No relevant infectious disease history.\nImmunization History: Up to date with routine immunizations.\nSurgery and Trauma History: Appendectomy at age 23.\nBlood Transfusion History: No prior history of blood transfusions.\nAllergy History: No known drug allergies. Mild seasonal allergies.\n\nPersonal History:\nBirthplace: Lakeside\nResidence: Lakeside\nLiving Habits: Non-smoker, occasional alcohol consumption. Balanced diet.\nOccupation and Working Conditions: Works as a teacher in a local school.\nExposure History: No significant exposure to industrial toxins, dust, or radioactive substances.\nTravel History: No recent travel history.\n\nMarital and Family History:\nMarital History:\nMarital Status: Married\nMarriage Age: 25\nSpouse's Health Condition: Good\nChildren's Condition: Two children, both healthy.\nMenstrual History:\nMenarche Age: 13\nMenstruation Duration: 5 days\nMenstruation Interval: 28 days\nLast Menstruation: 10th February\nMenstrual Volume: Moderate\nDysmenorrhea: Occasional mild\nFamily History: Parents are alive and have no significant health issues. Two siblings, both healthy. No known family history of anemia or similar diseases.\n\nPhysical Examination:\nGeneral Condition:\nTemperature: 98.6°F\nPulse: 80 bpm\nRespiration: 16 breaths/min\nBlood Pressure: 110/70 mmHg\nSystematic Examination:\nSkin: Pale\nMucous Membranes: Pale\nLymph Nodes: No palpable lymphadenopathy\nHead and Organs: No abnormalities noted\nNeck: No jugular venous distention\nChest: Clear to auscultation bilaterally. Heart sounds normal, no murmurs.\nAbdomen: Soft, non-tender. Liver and spleen not palpably enlarged.\nRectum and Anus: Not examined\nExternal Genitalia: Normal\nSpine: No deformities\nLimbs: No edema. Normal range of motion.\nNervous System: Normal sensory and motor functions. Reflexes intact.\n\nSpecialist Examination:\nHemoglobin level: 9.2 g/dL\nSerum iron: 20 µg/dL\nFerritin: 7 ng/mL\n\nAuxiliary Examination:\nComplete Blood Count: Low hemoglobin, Low hematocrit, Microcytic, hypochromic red cells.\n\nPreliminary Diagnosis:\nIron Deficiency Anemia\n\nDiagnostic Basis:\nHistory of fatigue, dizziness, pallor, pica, lab results indicating low hemoglobin, low serum iron, and low ferritin.\n\nDifferential Diagnosis:\nSideroblastic anemia: ruled out due to absence of ring sideroblasts and increased serum ferritin.\nThalassemia: ruled out due to lack of family history and target cells in blood film.\nTransferrin deficiency: ruled out due to no relevant history or signs of severe liver disease or tumors.\n\nAdmission Records:\nPhysician's Signature: Dr. A. Thomas\n\nPost-Admission Course Records:\nFirst Course Record: Patient admitted with severe fatigue, dizziness, and pallor. Laboratory tests confirm iron deficiency anemia. Treatment plan includes iron supplements and dietary adjustments to increase iron intake.\nDaily Course Records: Day 1: Patient tolerating oral iron supplements well. No adverse reactions. Day 2: Mild improvement in symptoms, fatigue slightly reduced. Day 3: Continued stable progress. Appetite improving.\nSenior Physician Rounds Records: 15th February: Confirmed diagnosis and reviewed treatment plan. 17th February: Noted gradual improvement in condition and planned continuation of current treatment strategy.\nDifficult Case Discussion Records: Not applicable.\nHandover Records: All relevant information communicated during shift changes.\nTransfer Records: Not applicable.\nStage Summary: Patient improving with current treatment plan of iron supplementation and dietary changes. Hemoglobin levels slowly increasing.\nEmergency Records: Not applicable.\nInvasive Procedure Records: None required.\nConsultation Records: Consultation with hematologist on 16th February confirmed diagnosis and treatment plan.\nSurgery Related:\nPreoperative Summary: Discussed surgical risks and benefits with patient. Consent obtained.\nPreoperative Discussion Records: Surgical intervention not planned at this time.\nAnesthesia Preoperative Visit Records: Not applicable.\nAnesthesia Records: Not applicable.\nSurgery Records: Not applicable.\nSurgery Safety Checklist: Not applicable.\nSurgery Instrument Count Records: Not applicable.\nPostoperative First Course Record: Not applicable.\nAnesthesia Postoperative Visit Records: Not applicable.\n\nDischarge Records:\nPlanned discharge on 22nd February if stable improvements continue.\n\nCritically Ill Patient Care Records:\nNot applicable.\n\nMedical Orders:\nLong-term Orders: Oral Iron supplements 200 mg twice daily.\nTemporary Orders: Blood tests every 3 days to monitor hemoglobin and iron levels.\n\nAuxiliary Examination Reports:\n15th February: CBC, Iron studies. 18th February: Follow-up CBC.\n\nTemperature Chart:\n15th February: T 98.6°F, P 80 bpm, R 16, BP 110/70 mmHg. 16th February: T 98.4°F, P 78 bpm, R 16, BP 112/70 mmHg. 17th February: T 98.5°F, P 78 bpm, R 16, BP 110/68 mmHg.\n\nBlood Transfusion Consent:\nNot required at this stage.\n\nSpecial Examination Consent:\nNot applicable.\n\nCritical Condition Notice:\nNot applicable.",
    "qa_fact_based": [
        {
            "question type": "Factual Question",
            "question": "According to the hospitalization records of Lakeside General Hospital, what is O. Richardson's initial diagnosis?",
            "answer": "Iron Deficiency Anemia.",
            "ref": [
                "Iron Deficiency Anemia"
            ]
        },
        {
            "question type": "Factual Question",
            "question": "According to the hospitalization records of Lakeside General Hospital, what is O. Richardson's chief complaint?",
            "answer": "Fatigue and dizziness for 2 months.",
            "ref": [
                "Chief Complaint:",
                "Fatigue and dizziness for 2 months"
            ]
        },
        {
            "question type": "Factual Question",
            "question": "According to the hospitalization records of Lakeside General Hospital, what is the prescribed long-term medication for O. Richardson?",
            "answer": "Oral Iron supplements 200 mg twice daily.",
            "ref": [
                "Long-term Orders: Oral Iron supplements 200 mg twice daily."
            ]
        },
        {
            "question type": "Factual Question",
            "question": "According to the hospitalization records of Lakeside General Hospital, what is the name of the physician who signed O. Richardson's admission records?",
            "answer": "Dr. A. Thomas.",
            "ref": [
                "Physician's Signature: Dr. A. Thomas"
            ]
        }
    ],
    "qa_multi_hop": [
        {
            "question type": "Multi-hop Reasoning Question",
            "question": "According to the hospitalization records of Lakeside General Hospital, how many diagnostic bases were used to diagnose O. Richardson's condition?",
            "answer": "According to the records, O. Richardson's diagnosis of Iron Deficiency Anemia was based on 5 diagnostic bases: history of fatigue, dizziness, pallor, pica, and lab results indicating low hemoglobin, low serum iron, and low ferritin.",
            "ref": [
                "Chief Complaint:",
                "Fatigue and dizziness for 2 months",
                "Main Symptoms: The patient describes persistent fatigue and dizziness that have been getting progressively worse over the past 2 months.",
                "Accompanying Symptoms: In addition to fatigue and dizziness, the patient also mentions pica, specifically craving for chewing ice.",
                "Hemoglobin level: 9.2 g/dL",
                "Serum iron: 20 µg/dL",
                "Ferritin: 7 ng/mL",
                "Complete Blood Count: Low hemoglobin, Low hematocrit, Microcytic, hypochromic red cells.",
                "Iron Deficiency Anemia",
                "History of fatigue, dizziness, pallor, pica, lab results indicating low hemoglobin, low serum iron, and low ferritin."
            ]
        },
        {
            "question type": "Multi-hop Reasoning Question",
            "question": "According to the hospitalization records of Lakeside General Hospital, how many auxiliary examinations did O. Richardson undergo?",
            "answer": "According to the records, O. Richardson underwent 2 auxiliary examinations: Complete Blood Count and Iron studies.",
            "ref": [
                "Auxiliary Examination:",
                "Auxiliary Examination Reports:"
            ]
        },
        {
            "question type": "Multi-hop Reasoning Question",
            "question": "According to the hospitalization records of Lakeside General Hospital, how many differential diagnoses were considered for O. Richardson?",
            "answer": "According to the records, 3 differential diagnoses were considered for O. Richardson: Sideroblastic anemia, Thalassemia, and Transferrin deficiency.",
            "ref": [
                "Differential Diagnosis:",
                "Sideroblastic anemia: ruled out due to absence of ring sideroblasts and increased serum ferritin.",
                "Thalassemia: ruled out due to lack of family history and target cells in blood film.",
                "Transferrin deficiency: ruled out due to no relevant history or signs of severe liver disease or tumors."
            ]
        }
    ],
    "qa_summary": [
        {
            "question type": "Summarization Question",
            "question": "According to the hospitalization records of Lakeside General Hospital, summarize the present illness of O. Richardson.",
            "answer": "O. Richardson's symptoms began approximately 2 months ago with intermittent dizziness and fatigue, which progressively worsened. She reports persistent fatigue, dizziness, pallor, occasional faintness, and pica (craving for chewing ice). Symptoms worsen with physical exertion and are somewhat relieved with rest. She has a decreased appetite and slight unintentional weight loss over the past 2 months. No changes in urination or defecation patterns.",
            "ref": [
                "Onset: The patient reports the onset of symptoms approximately 2 months ago.",
                "Initially experienced intermittent dizziness and fatigue, which progressively worsened.",
                "Main Symptoms: The patient describes persistent fatigue and dizziness that have been getting progressively worse over the past 2 months.",
                "She reports pallor and occasional faintness.",
                "Symptoms are exacerbated with physical exertion and somewhat relieved with rest.",
                "Accompanying Symptoms: In addition to fatigue and dizziness, the patient also mentions pica, specifically craving for chewing ice.",
                "She also has significant weakness.",
                "General Condition Changes: The patient denies any significant changes in mental state, but reports a decreased appetite and a slight unintentional weight loss over the past 2 months.",
                "No changes in urination or defecation patterns."
            ]
        },
        {
            "question type": "Summarization Question",
            "question": "According to the hospitalization records of Lakeside General Hospital, summarize the past medical history of O. Richardson.",
            "answer": "O. Richardson has generally good health with regular annual check-ups. She has no history of chronic illnesses or relevant infectious diseases. Her immunizations are up to date. She had an appendectomy at age 23 and has no prior history of blood transfusions. She has no known drug allergies but has mild seasonal allergies.",
            "ref": [
                "General Health Condition: Generally good, with regular annual check-ups.",
                "Disease History: No history of chronic illnesses.",
                "Infectious Disease History: No relevant infectious disease history.",
                "Immunization History: Up to date with routine immunizations.",
                "Surgery and Trauma History: Appendectomy at age 23.",
                "Blood Transfusion History: No prior history of blood transfusions.",
                "Allergy History: No known drug allergies.",
                "Mild seasonal allergies."
            ]
        },
        {
            "question type": "Summarization Question",
            "question": "According to the hospitalization records of Lakeside General Hospital, summarize the physical examination findings of O. Richardson.",
            "answer": "O. Richardson's general condition includes a temperature of 98.6°F, pulse of 80 bpm, respiration rate of 16 breaths/min, and blood pressure of 110/70 mmHg. Systematic examination reveals pale skin and mucous membranes, no palpable lymphadenopathy, no abnormalities in head and organs, no jugular venous distention, clear chest auscultation, normal heart sounds, a soft and non-tender abdomen with no palpable liver or spleen enlargement, normal external genitalia, no spine deformities, no limb edema, normal range of motion, and normal sensory and motor functions with intact reflexes.",
            "ref": [
                "General Condition:",
                "Temperature: 98.6°F",
                "Pulse: 80 bpm",
                "Respiration: 16 breaths/min",
                "Blood Pressure: 110/70 mmHg",
                "Skin: Pale",
                "Mucous Membranes: Pale",
                "Lymph Nodes: No palpable lymphadenopathy",
                "Head and Organs: No abnormalities noted",
                "Neck: No jugular venous distention",
                "Chest: Clear to auscultation bilaterally.",
                "Heart sounds normal, no murmurs.",
                "Abdomen: Soft, non-tender.",
                "Liver and spleen not palpably enlarged.",
                "External Genitalia: Normal",
                "Spine: No deformities",
                "Limbs: No edema.",
                "Normal range of motion.",
                "Nervous System: Normal sensory and motor functions.",
                "Reflexes intact."
            ]
        }
    ]
}