{
    "Hospitalization Record": {
        "Basic Information": {
            "Name": "J. Brooks",
            "Gender": "male",
            "Age": "59",
            "Ethnicity": "Caucasian",
            "Marital Status": "Married",
            "Occupation": "Retired",
            "Address": "46, Oakwood street, Farmington",
            "Admission Time": "23rd, November",
            "Record Time": "23rd, November",
            "Historian": "Self",
            "Hospital Name": "Farmington General Hospital"
        },
        "Chief Complaint": "Fatigue and loss of appetite for 2 weeks",
        "Present Illness": {
            "Onset": "Started 2 weeks ago at home, gradual onset, followed by fatigue and loss of appetite. No known triggers",
            "Main Symptoms": "Fatigue and loss of appetite, persistent, moderate to severe, no relieving factors noted, worsened with activity",
            "Accompanying Symptoms": "Enlarged liver and abnormal liver function tests seen on examination",
            "Diagnosis and Treatment History": "Evaluated by primary care two weeks ago, liver function tests revealed elevated AST and ALT levels. Referred to hospital for further evaluation and management.",
            "General Condition Changes": "Mental state stable, sleep patterns disturbed due to fatigue, significantly reduced appetite, normal urination and bowel movements, unintentional weight loss of 5 kg"
        },
        "Past History": {
            "General Health Condition": "Generally healthy, no significant past medical history",
            "Disease History": "No history of chronic diseases",
            "Infectious Disease History": "No known history of infectious diseases",
            "Immunization History": "Up-to-date on vaccinations",
            "Surgery and Trauma History": "Appendectomy 20 years ago, uneventful",
            "Blood Transfusion History": "No blood transfusions",
            "Allergy History": "No known allergies"
        },
        "Personal History": {
            "Birthplace": "Farmington",
            "Residence": "46, Oakwood street, Farmington",
            "Living Habits": "Nonsmoker, occasional alcohol use",
            "Occupation and Working Conditions": "Retired office worker, previously worked in an office setting",
            "Exposure History": "No significant exposure to industrial toxins, dust, or radioactive substances",
            "Travel History": "No recent travel history"
        },
        "Marital and Family History": {
            "Marital History": {
                "Marital Status": "Married",
                "Marriage Age": "Married at 25",
                "Spouse's Health Condition": "Spouse is in good health",
                "Children's Condition": "Two children, both healthy"
            },
            "Family History": "Parents deceased, father had hypertension, mother had diabetes. Siblings are healthy"
        },
        "Physical Examination": {
            "General Condition": {
                "Temperature": "37.2Â°C",
                "Pulse": "80 bpm",
                "Respiration": "18 breaths/min",
                "Blood Pressure": "120/80 mmHg"
            },
            "Systematic Examination": {
                "Skin": "No rashes or lesions",
                "Mucous Membranes": "Normal",
                "Lymph Nodes": "No enlargement",
                "Head and Organs": "Normal head and neck examination",
                "Neck": "No abnormal masses, normal thyroid",
                "Chest": "Clear lung sounds, normal heart sounds",
                "Abdomen": "Mild hepatomegaly",
                "Rectum and Anus": "Normal",
                "External Genitalia": "Normal",
                "Spine": "Normal alignment",
                "Limbs": "No edema, normal strength",
                "Nervous System": "No neurological deficits"
            }
        },
        "Specialist Examination": "Gastroenterology consultation confirmed hepatomegaly and raised liver enzymes",
        "Auxiliary Examination": "Liver function tests: AST 150 U/L, ALT 200 U/L, Bilirubin 2.5 mg/dL",
        "Preliminary Diagnosis": "Hepatitis A",
        "Diagnostic Basis": "Patient history of symptoms, physical examination indicating hepatomegaly, abnormal liver function tests",
        "Differential Diagnosis": "Hepatitis B, Hepatitis C, toxic hepatitis ruled out based on patient history and lab results",
        "Admission Records": {
            "Physician's Signature": "Dr. A. Smith"
        },
        "Post-Admission Course Records": {
            "First Course Record": "Patient admitted with symptoms suggestive of Hepatitis A. Diagnostic basis includes elevated liver enzymes, hepatomegaly, and history of fatigue and loss of appetite. Differential diagnosis includes other types of viral hepatitis and toxic hepatitis but clinical presentation and lab results point towards Hepatitis A.",
            "Daily Course Records": "Recorded as per daily patient monitoring",
            "Senior Physician Rounds Records": "Dr. B. Williams observed steady condition, continued monitoring and supportive care",
            "Difficult Case Discussion Records": "",
            "Handover Records": "Patient handover to night shift with no significant changes, continued monitoring advised",
            "Transfer Records": "",
            "Stage Summary": "Intermediate stage summary indicates persistent liver enzyme elevations, no new symptoms, continued supportive treatment",
            "Emergency Records": "",
            "Invasive Procedure Records": "",
            "Consultation Records": "Infectious disease consultation firmed up the diagnosis of Hepatitis A",
            "Surgery Related": {
                "Preoperative Summary": "Procedure planned for abdominal drainage due to hepatomegaly",
                "Preoperative Discussion Records": "Discussed approach, risks, and procedural details. Family consent obtained",
                "Anesthesia Preoperative Visit Records": "Patient evaluated as low risk for anesthesia complications",
                "Anesthesia Records": "General anesthesia used, patient tolerated well",
                "Surgery Records": "Procedure completed, no immediate complications noted",
                "Surgery Safety Checklist": "Checklist completed, all protocols followed",
                "Surgery Instrument Count Records": "All instruments accounted for after surgery",
                "Postoperative First Course Record": "Stable post-procedure, monitoring for potential complications",
                "Anesthesia Postoperative Visit Records": "Patient recovering well from anesthesia, stable vitals"
            },
            "Discharge Records": "",
            "Death Related": {
                "Death Case Discussion Records": "Final discussion concluded cause of death related to complications of severe Hepatitis A and procedure-related factors",
                "Death Records": "Patient passed away on 2nd December. Report completed by Dr. A. Smith"
            },
            "Critically Ill Patient Care Records": "Recorded as per hospital protocol for critically ill patient"
        },
        "Medical Orders": {
            "Long-term Orders": "Bed rest, IV fluids, liver function tests daily, consult Infectious Disease specialist",
            "Temporary Orders": "Administer acetaminophen for fever, antiemetics for nausea as needed"
        },
        "Auxiliary Examination Reports": "Ultrasound of liver shows hepatomegaly, no focal lesions",
        "Temperature Chart": "Regular monitoring of temperature, pulse, respiration, and blood pressure recorded",
        "Blood Transfusion Consent": "",
        "Special Examination Consent": "Consent obtained for specialized liver function tests",
        "Critical Condition Notice": "Family informed of patient's critical condition on multiple occasions"
    },
    "DiseaseType": {
        "Infectious Diseases": {
            "Name": "Hepatitis A",
            "Symptoms": "Fatigue, loss of appetite, enlarged liver, abnormal liver function",
            "Differential Diagnosis": "Other types of viral hepatitis, toxic hepatitis"
        }
    },
    "Generated Article": "Hospitalization Record\n\nBasic Information:\nName: J. Brooks\nGender: Male\nAge: 59\nEthnicity: Caucasian\nMarital Status: Married\nOccupation: Retired\nAddress: 46 Oakwood Street, Farmington\nAdmission Time: 23rd November\nRecord Time: 23rd November\nHistorian: Self\nHospital Name: Farmington General Hospital\n\nChief Complaint:\nFatigue and loss of appetite for 2 weeks.\n\nPresent Illness:\nOnset: The symptoms started 2 weeks ago at home, with a gradual onset, beginning with fatigue and loss of appetite. No known triggers were identified.\nMain Symptoms: The patient has been experiencing persistent fatigue and loss of appetite, which have been moderate to severe in intensity. There are no known relieving factors, and the symptoms worsen with activity.\nAccompanying Symptoms: Examination has revealed an enlarged liver (hepatomegaly) and abnormal liver function tests.\nDiagnosis and Treatment History: The patient was evaluated by their primary care provider two weeks ago. Liver function tests revealed elevated levels of AST and ALT. The patient was then referred to the hospital for further evaluation and management.\nGeneral Condition Changes: The patient's mental state is stable, but their sleep patterns have been disturbed due to fatigue. They have a significantly reduced appetite and have experienced unintentional weight loss of 5 kg over the past two weeks. Urination and bowel movements remain normal.\n\nPast History:\nGeneral Health Condition: Generally healthy with no significant past medical history.\nDisease History: No history of chronic diseases.\nInfectious Disease History: No known history of infectious diseases.\nImmunization History: Up-to-date on vaccinations.\nSurgery and Trauma History: Underwent an appendectomy 20 years ago without complications.\nBlood Transfusion History: No history of blood transfusions.\nAllergy History: No known allergies.\n\nPersonal History:\nBirthplace: Farmington\nResidence: 46 Oakwood Street, Farmington\nLiving Habits: Nonsmoker, occasional alcohol use.\nOccupation and Working Conditions: Retired office worker, previously employed in an office environment.\nExposure History: No significant exposure to industrial toxins, dust, or radioactive substances.\nTravel History: No recent travel history.\n\nMarital and Family History:\nMarital History:\nMarital Status: Married\nMarriage Age: Married at 25\nSpouse's Health Condition: Spouse is in good health.\nChildren's Condition: Two children, both in good health.\n\nFamily History: \nParents: Deceased; father had hypertension, and mother had diabetes. \nSiblings: Healthy.\n\nPhysical Examination:\nGeneral Condition:\nTemperature: 37.2Â°C\nPulse: 80 bpm\nRespiration: 18 breaths/min\nBlood Pressure: 120/80 mmHg\n\nSystematic Examination:\nSkin: No rashes or lesions\nMucous Membranes: Normal\nLymph Nodes: No enlargement\nHead and Organs: Normal head and neck examination\nNeck: No abnormal masses, normal thyroid\nChest: Clear lung sounds, normal heart sounds\nAbdomen: Mild hepatomegaly\nRectum and Anus: Normal\nExternal Genitalia: Normal\nSpine: Normal alignment\nLimbs: No edema, normal strength\nNervous System: No neurological deficits\n\nSpecialist Examination:\nGastroenterology consultation confirmed hepatomegaly and raised liver enzymes.\n\nAuxiliary Examination:\nLiver function tests: AST 150 U/L, ALT 200 U/L, Bilirubin 2.5 mg/dL\n\nPreliminary Diagnosis:\nHepatitis A\n\nDiagnostic Basis:\nPatient history of symptoms, physical examination indicating hepatomegaly, and abnormal liver function tests support the diagnosis of Hepatitis A.\n\nDifferential Diagnosis:\nHepatitis B, Hepatitis C, and toxic hepatitis have been ruled out based on patient history and laboratory results.\n\nAdmission Records:\nPhysician's Signature: Dr. A. Smith\n\nPost-Admission Course Records:\nFirst Course Record:\nPatient admitted with symptoms suggestive of Hepatitis A. Diagnostic basis includes elevated liver enzymes, hepatomegaly, and history of fatigue and loss of appetite. Differential diagnosis includes other types of viral hepatitis and toxic hepatitis, but clinical presentation and lab results point towards Hepatitis A.\n\nDaily Course Records:\nRecorded as per daily patient monitoring\n\nSenior Physician Rounds Records:\nDr. B. Williams observed a steady condition, with continued monitoring and supportive care.\n\nDifficult Case Discussion Records:\nNone\n\nHandover Records:\nPatient handover to night shift with no significant changes; continued monitoring advised.\n\nTransfer Records:\nNone\n\nStage Summary:\nIntermediate stage summary indicates persistent liver enzyme elevations, no new symptoms, continued supportive treatment.\n\nEmergency Records:\nNone\n\nInvasive Procedure Records:\nNone\n\nConsultation Records:\nInfectious disease consultation confirmed the diagnosis of Hepatitis A.\n\nSurgery-Related:\nPreoperative Summary: Procedure planned for abdominal drainage due to hepatomegaly.\nPreoperative Discussion Records: Discussed approach, risks, and procedural details. Family consent obtained.\nAnesthesia Preoperative Visit Records: Patient evaluated as low risk for anesthesia complications.\nAnesthesia Records: General anesthesia used; patient tolerated well.\nSurgery Records: Procedure completed with no immediate complications noted.\nSurgery Safety Checklist: Checklist completed, and all protocols followed.\nSurgery Instrument Count Records: All instruments accounted for after surgery.\nPostoperative First Course Record: Stable post-procedure, monitoring potential complications.\nAnesthesia Postoperative Visit Records: Patient recovering well from anesthesia; stable vitals.\n\nDischarge Records:\nNone\n\nDeath Related:\nDeath Case Discussion Records: Final discussion concluded the cause of death was related to complications of severe Hepatitis A and procedure-related factors.\nDeath Records: Patient passed away on 2nd December. Report completed by Dr. A. Smith.\n\nCritically Ill Patient Care Records:\nRecorded as per hospital protocol for critically ill patients.\n\nMedical Orders:\nLong-term Orders:\nBed rest, IV fluids, liver function tests daily, consult Infectious Disease specialist.\n\nTemporary Orders:\nAdminister acetaminophen for fever, antiemetics for nausea as needed.\n\nAuxiliary Examination Reports:\nUltrasound of liver shows hepatomegaly, no focal lesions.\n\nTemperature Chart:\nRegular monitoring of temperature, pulse, respiration, and blood pressure recorded.\n\nBlood Transfusion Consent:\nNone\n\nSpecial Examination Consent:\nConsent obtained for specialized liver function tests.\n\nCritical Condition Notice:\nFamily informed of patient's critical condition on multiple occasions.\n\nDisease Type:\nInfectious Diseases:\nName: Hepatitis A\nSymptoms: Fatigue, loss of appetite, enlarged liver, abnormal liver function\nDifferential Diagnosis: Other types of viral hepatitis, toxic hepatitis",
    "qa_fact_based": [
        {
            "question type": "Factual Question",
            "question": "According to the hospitalization records of Farmington General Hospital, what is J. Brooks's chief complaint?",
            "answer": "Fatigue and loss of appetite for 2 weeks.",
            "ref": [
                "Chief Complaint:",
                "Fatigue and loss of appetite for 2 weeks."
            ]
        },
        {
            "question type": "Factual Question",
            "question": "According to the hospitalization records of Farmington General Hospital, what is J. Brooks's age?",
            "answer": "59.",
            "ref": [
                "Age: 59"
            ]
        },
        {
            "question type": "Factual Question",
            "question": "According to the hospitalization records of Farmington General Hospital, what is J. Brooks's gender?",
            "answer": "Male.",
            "ref": [
                "Gender: Male"
            ]
        },
        {
            "question type": "Factual Question",
            "question": "According to the hospitalization records of Farmington General Hospital, what is J. Brooks's ethnicity?",
            "answer": "Caucasian.",
            "ref": [
                "Ethnicity: Caucasian"
            ]
        },
        {
            "question type": "Factual Question",
            "question": "According to the hospitalization records of Farmington General Hospital, what is J. Brooks's marital status?",
            "answer": "Married.",
            "ref": [
                "Marital Status: Married"
            ]
        },
        {
            "question type": "Factual Question",
            "question": "According to the hospitalization records of Farmington General Hospital, what is J. Brooks's occupation?",
            "answer": "Retired.",
            "ref": [
                "Occupation: Retired"
            ]
        }
    ],
    "qa_multi_hop": [
        {
            "question type": "Multi-hop Reasoning Question",
            "question": "According to the hospitalization records of Farmington General Hospital, how many diagnostic bases were used to diagnose J. Brooks?",
            "answer": "According to the records, three diagnostic bases were used to diagnose J. Brooks: patient history of symptoms, physical examination indicating hepatomegaly, and abnormal liver function tests.",
            "ref": [
                "Patient history of symptoms, physical examination indicating hepatomegaly, and abnormal liver function tests support the diagnosis of Hepatitis A.",
                "First Course Record:"
            ]
        },
        {
            "question type": "Multi-hop Reasoning Question",
            "question": "According to the hospitalization records of Farmington General Hospital, how many auxiliary examinations did J. Brooks undergo?",
            "answer": "According to the records, J. Brooks underwent 2 auxiliary examinations, namely liver function tests and ultrasound of the liver.",
            "ref": [
                "Liver function tests: AST 150 U/L, ALT 200 U/L, Bilirubin 2.5 mg/dL",
                "Ultrasound of liver shows hepatomegaly, no focal lesions."
            ]
        }
    ],
    "qa_summary": [
        {
            "question type": "Summarization Question",
            "question": "According to the hospitalization records of Farmington General Hospital, summarize the present illness of J. Brooks.",
            "answer": "J. Brooks' illness started 2 weeks ago at home with a gradual onset of fatigue and loss of appetite. The symptoms are persistent, moderate to severe, and worsen with activity. Examination revealed an enlarged liver and abnormal liver function tests. He was evaluated by his primary care physician two weeks ago, which showed elevated AST and ALT levels, leading to his referral to the hospital.",
            "ref": [
                "Present Illness:",
                "Onset: The symptoms started 2 weeks ago at home, with a gradual onset, beginning with fatigue and loss of appetite.",
                "No known triggers were identified.",
                "Main Symptoms: The patient has been experiencing persistent fatigue and loss of appetite, which have been moderate to severe in intensity.",
                "There are no known relieving factors, and the symptoms worsen with activity.",
                "Accompanying Symptoms: Examination has revealed an enlarged liver (hepatomegaly) and abnormal liver function tests.",
                "Diagnosis and Treatment History: The patient was evaluated by their primary care provider two weeks ago.",
                "Liver function tests revealed elevated levels of AST and ALT.",
                "The patient was then referred to the hospital for further evaluation and management."
            ]
        },
        {
            "question type": "Summarization Question",
            "question": "According to the hospitalization records of Farmington General Hospital, summarize the past medical history of J. Brooks.",
            "answer": "J. Brooks is generally healthy with no significant past medical history. He has no history of chronic or infectious diseases, is up-to-date on vaccinations, had an appendectomy 20 years ago, and has no history of blood transfusions or known allergies.",
            "ref": [
                "General Health Condition: Generally healthy with no significant past medical history.",
                "Disease History: No history of chronic diseases.",
                "Infectious Disease History: No known history of infectious diseases.",
                "Immunization History: Up-to-date on vaccinations.",
                "Surgery and Trauma History: Underwent an appendectomy 20 years ago without complications.",
                "Blood Transfusion History: No history of blood transfusions.",
                "Allergy History: No known allergies."
            ]
        },
        {
            "question type": "Summarization Question",
            "question": "According to the hospitalization records of Farmington General Hospital, summarize the physical examination findings of J. Brooks.",
            "answer": "J. Brooks' physical examination showed a temperature of 37.2Â°C, pulse of 80 bpm, respiration rate of 18 breaths/min, and blood pressure of 120/80 mmHg. Systematic examination revealed no rashes or lesions on the skin, normal mucous membranes, no lymph node enlargement, normal head and neck examination, no abnormal masses in the neck, clear lung sounds, normal heart sounds, mild hepatomegaly in the abdomen, normal rectum and anus, normal external genitalia, normal spine alignment, no edema in the limbs, and no neurological deficits.",
            "ref": [
                "Temperature: 37.2Â°C",
                "Pulse: 80 bpm",
                "Respiration: 18 breaths/min",
                "Blood Pressure: 120/80 mmHg",
                "Skin: No rashes or lesions",
                "Mucous Membranes: Normal",
                "Lymph Nodes: No enlargement",
                "Head and Organs: Normal head and neck examination",
                "Neck: No abnormal masses, normal thyroid",
                "Chest: Clear lung sounds, normal heart sounds",
                "Abdomen: Mild hepatomegaly",
                "Rectum and Anus: Normal",
                "External Genitalia: Normal",
                "Spine: Normal alignment",
                "Limbs: No edema, normal strength",
                "Nervous System: No neurological deficits"
            ]
        }
    ]
}