{
    "Report Type": "Corporate Financial Report",
    "Report Time": "2018",
    "Company Information": {
        "Name": "Green Fields Agriculture Co.",
        "Establishment Date": "March 18, 1995",
        "Main Business": "Production and distribution of organic fruits and vegetables",
        "Registration Location": "Ruralville, Agriprovince",
        "Listing Status": "Publicly Listed",
        "Industry": "Agriculture"
    },
    "Report Content": [
        {
            "Type": "Financial Information",
            "Significant Events": [
                {
                    "Event": "Debt Restructuring",
                    "Time": "February, 2018",
                    "Description": "To optimize capital structure, the company underwent debt restructuring, reducing liabilities by $10 million.",
                    "Impact": "Improved the company's financial condition, reduced financial costs.",
                    "Sub Events": [
                        {
                            "Event": "Increase in Sales Volume",
                            "Time": "January, 2018",
                            "Description": "Green Fields Agriculture Co. implemented a new sales strategy, resulting in a 20% increase in sales volume compared to the previous year.",
                            "Impact": "Generated higher revenue and improved company's financial performance."
                        },
                        {
                            "Event": "Acquisition of Farmland",
                            "Time": "March, 2018",
                            "Description": "In order to secure a stable supply of organic fruits and vegetables, Green Fields Agriculture Co. acquired 100 acres of farmland in a neighboring region.",
                            "Impact": "Enhanced the company's production capacity and reduced dependency on third-party suppliers, leading to cost savings."
                        },
                        {
                            "Event": "Implementation of Cost-cutting Measures",
                            "Time": "April, 2018",
                            "Description": "To improve profitability, Green Fields Agriculture Co. implemented cost-cutting measures across various departments, reducing operational expenses by 15%.",
                            "Impact": "Increased profitability and positively impacted the company's financial performance."
                        },
                        {
                            "Event": "Partnership with Organic Retail Chain",
                            "Time": "June, 2018",
                            "Description": "Green Fields Agriculture Co. entered into a strategic partnership with a well-established organic retail chain, resulting in an exclusive supplier agreement.",
                            "Impact": "Strengthened market presence, expanded customer reach, and positively impacted sales revenue."
                        },
                        {
                            "Event": "Introduction of New Product Line",
                            "Time": "September, 2018",
                            "Description": "Green Fields Agriculture Co. launched a new line of premium organic frozen fruits and vegetables, catering to the growing demand in the convenience food sector.",
                            "Impact": "Increased product diversification, expanded market share, and generated additional revenue streams."
                        },
                        {
                            "Event": "Implementation of ERP System",
                            "Time": "October, 2018",
                            "Description": "Green Fields Agriculture Co. invested in an enterprise resource planning (ERP) system to streamline operations, improve efficiency, and optimize resource allocation.",
                            "Impact": "Enhanced operational efficiency, reduced costs, and improved overall company performance."
                        }
                    ]
                },
                {
                    "Event": "Major Investment",
                    "Time": "March, 2018",
                    "Description": "The company invested in Project Green Harvest, with an investment amount of $50 million.",
                    "Impact": "Further broadened the company's business areas, enhanced profitability."
                },
                {
                    "Event": "Dividend Distribution",
                    "Time": "April, 2018",
                    "Description": "The company decided to distribute $5 million of dividends to shareholders.",
                    "Impact": "Returned to the investors, enhanced shareholder returns."
                },
                {
                    "Event": "Major Asset Acquisition",
                    "Time": "May, 2018",
                    "Description": "The company completed the asset acquisition of Fresh Field Farms, with a total value of $25 million.",
                    "Impact": "Expanded the company's business scope, enhanced market competitiveness."
                },
                {
                    "Event": "Asset Restructuring",
                    "Time": "June, 2018",
                    "Description": "The company underwent an asset restructuring, optimizing its business structure.",
                    "Impact": "Improved operational efficiency, increased company value."
                },
                {
                    "Event": "Severe Drought",
                    "Time": "August, 2018",
                    "Description": "Due to a severe drought in the region, crop yields were significantly reduced.",
                    "Impact": "Decreased revenues and profitability, increased production costs."
                },
                {
                    "Event": "Significant Equity Acquisition",
                    "Time": "September, 2018",
                    "Description": "The company completed the acquisition of 40% equity of Fertile Land Farms.",
                    "Impact": "Further expanded the company's market share, enhanced the company's control."
                },
                {
                    "Event": "New Market Expansion",
                    "Time": "October, 2018",
                    "Description": "The company successfully entered the international market, securing contracts with several major supermarket chains.",
                    "Impact": "Increased exports, diversified customer base, boosted revenue."
                },
                {
                    "Event": "Large-scale Financing",
                    "Time": "December, 2018",
                    "Description": "The company conducted a large-scale financing activity, raising $100 million of funds.",
                    "Impact": "Strengthened the company's financial strength, supported expansion and development."
                },
                {
                    "Event": "Labor Strike",
                    "Time": "December, 2018",
                    "Description": "A labor strike occurred at the company's main production facility, resulting in production disruption and increased costs.",
                    "Impact": "Delayed deliveries, decreased productivity, higher expenses."
                }
            ],
            "Involved Indicators": [
                {
                    "Indicator": "Operating Income",
                    "Description": "The total amount of main business income and other business income within a certain accounting period.",
                    "Influencing Factors": [
                        "Market Demand",
                        "Changes in Product Prices"
                    ],
                    "Value": "$150 million"
                },
                {
                    "Indicator": "Net Profit",
                    "Description": "The net income of the company within a certain accounting period, i.e., total income minus total costs and taxes.",
                    "Influencing Factors": [
                        "Operating Income",
                        "Cost Control",
                        "Non-recurring Gains and Losses"
                    ],
                    "Value": "$25 million"
                },
                {
                    "Indicator": "Total Assets",
                    "Description": "The total amount of assets owned by the company at the end of the accounting period.",
                    "Influencing Factors": [
                        "Asset Acquisition",
                        "Asset Disposal",
                        "Asset Revaluation"
                    ],
                    "Value": "$500 million"
                },
                {
                    "Indicator": "Total Liabilities",
                    "Description": "The total amount of debts the company is obligated to repay at the end of the accounting period.",
                    "Influencing Factors": [
                        "New Debt Issuance",
                        "Debt Repayment",
                        "Debt Restructuring"
                    ],
                    "Value": "$200 million"
                },
                {
                    "Indicator": "Shareholder Equity",
                    "Description": "The total amount of equity belonging to shareholders at the end of the accounting period.",
                    "Influencing Factors": [
                        "Net Profit",
                        "Dividend Distribution",
                        "Capital Reserves"
                    ],
                    "Value": "$300 million"
                },
                {
                    "Indicator": "Cash Flow",
                    "Description": "The total cash inflows and outflows of the company within a certain accounting period.",
                    "Influencing Factors": [
                        "Operating Activities",
                        "Investment Activities",
                        "Financing Activities"
                    ],
                    "Value": "$50 million"
                },
                {
                    "Indicator": "Debt Ratio",
                    "Description": "The ratio of total liabilities to total assets, reflecting the company's debt level.",
                    "Influencing Factors": [
                        "Changes in Total Liabilities",
                        "Changes in Total Assets"
                    ],
                    "Value": "40%"
                },
                {
                    "Indicator": "Debt to Assets Ratio",
                    "Description": "The percentage of total liabilities to total assets, a measure of the company's financial leverage.",
                    "Influencing Factors": [
                        "Increases or decreases in assets and liabilities"
                    ],
                    "Value": "0.4"
                },
                {
                    "Indicator": "Return on Equity",
                    "Description": "Reflects the operational efficiency of shareholder equity, namely the ratio of net profit to average shareholder equity.",
                    "Influencing Factors": [
                        "Change in Net Profit",
                        "Change in Shareholder Equity"
                    ],
                    "Value": "8%"
                }
            ]
        }
    ],
    "Additional Information": [
        {
            "Name": "Future Outlook",
            "Content": [
                {
                    "Name": "Financial Strategy",
                    "Description": "The company plans to implement rigorous cost control measures to increase profitability. They will also focus on optimizing capital operations to maximize shareholder returns."
                },
                {
                    "Name": "Investment Plans",
                    "Description": "Green Fields Agriculture Co. plans to invest heavily in research and development (R&D), aiming to develop new, high-yield crop varieties. They also plan to explore market expansion opportunities in emerging economies."
                },
                {
                    "Name": "Risk Management",
                    "Description": "The company has identified climate change, market volatility, and supply chain disruptions as major financial risks. They will implement risk management strategies including diversification of crop varieties, insurance coverage, and adoption of sustainable farming practices."
                }
            ]
        }
    ],
    "Generated Outline": "I. Introduction\n    A. Company Information\n        1. Company Name: Green Fields Agriculture Co.\n        2. Establishment Date: March 18, 1995\n        3. Main Business: Production and distribution of organic fruits and vegetables\n        4. Registration Location: Ruralville, Agriprovince\n        5. Listing Status: Publicly Listed\n        6. Industry: Agriculture\n    B. Report Time: 2018\n\nII. Financial Information\n    A. Debt Restructuring (February, 2018)\n        1. Description: To optimize capital structure, the company underwent debt restructuring, reducing liabilities by $10 million.\n        2. Impact: Improved the company's financial condition, reduced financial costs.\n        3. Sub Events:\n            a. Increase in Sales Volume (January, 2018)\n                - Description: Implemented a new sales strategy, resulting in a 20% increase in sales volume compared to the previous year.\n                - Impact: Generated higher revenue and improved financial performance.\n            b. Acquisition of Farmland (March, 2018)\n                - Description: Acquired 100 acres of farmland in a neighboring region to secure a stable supply of organic fruits and vegetables.\n                - Impact: Enhanced production capacity and reduced dependency on third-party suppliers, leading to cost savings.\n             c. Implementation of Cost-cutting Measures (April, 2018)\n                - Description: Implemented cost-cutting measures across various departments, reducing operational expenses by 15%.\n                - Impact: Increased profitability and positively impacted financial performance.\n            d. Partnership with Organic Retail Chain (June, 2018)\n                - Description: Entered into a strategic partnership with a well-established organic retail chain, resulting in an exclusive supplier agreement.\n                - Impact: Strengthened market presence, expanded customer reach, and positively impacted sales revenue.\n            e. Introduction of New Product Line (September, 2018)\n                - Description: Launched a new line of premium organic frozen fruits and vegetables to cater to the growing demand in the convenience food sector.\n                - Impact: Increased product diversification, expanded market share, and generated additional revenue streams.\n            f. Implementation of ERP System (October, 2018)\n                - Description: Invested in an enterprise resource planning (ERP) system to streamline operations, improve efficiency, and optimize resource allocation.\n                - Impact: Enhanced operational efficiency, reduced costs, and improved overall company performance.\n    B. Major Investment (March, 2018)\n        1. Description: Invested in Project Green Harvest, with an investment amount of $50 million.\n        2. Impact: Further broadened the company's business areas and enhanced profitability.\n    C. Dividend Distribution (April, 2018)\n        1. Description: Decided to distribute $5 million of dividends to shareholders.\n        2. Impact: Enhanced shareholder returns.\n    D. Major Asset Acquisition (May, 2018)\n        1. Description: Completed the asset acquisition of Fresh Field Farms, with a total value of $25 million.\n        2. Impact: Expanded the company's business scope and enhanced market competitiveness.\n    E. Asset Restructuring (June, 2018)\n        1. Description: Underwent asset restructuring to optimize the business structure.\n        2. Impact: Improved operational efficiency and increased company value.\n    F. Severe Drought (August, 2018)\n        1. Description: Due to a severe drought in the region, crop yields were significantly reduced.\n        2. Impact: Decreased revenues and profitability, increased production costs.\n    G. Significant Equity Acquisition (September, 2018)\n        1. Description: Completed the acquisition of 40% equity of Fertile Land Farms.\n        2. Impact: Further expanded the company's market share and enhanced control.\n    H. New Market Expansion (October, 2018)\n        1. Description: Successfully entered the international market, securing contracts with several major supermarket chains.\n        2. Impact: Increased exports, diversified customer base, and boosted revenue.\n    I. Large-scale Financing (December, 2018)\n        1. Description: Conducted a large-scale financing activity, raising $100 million of funds.\n        2. Impact: Strengthened the company's financial strength and supported expansion and development.\n    J. Labor Strike (December, 2018)\n        1. Description: A labor strike occurred at the company's main production facility, resulting in production disruption and increased costs.\n        2. Impact: Delayed deliveries, decreased productivity, and higher expenses.\n\nIII. Involved Indicators\n    A. Operating Income ($150 million)\n        - Definition: The total amount of main business income and other business income within a certain accounting period.\n        - Influencing Factors: Market Demand, Changes in Product Prices\n    B. Net Profit ($25 million)\n        - Definition: The net income of the company within a certain accounting period, calculated as total income minus total costs and taxes.\n        - Influencing Factors: Operating Income, Cost Control, Non-recurring Gains and Losses\n    C. Total Assets ($500 million)\n        - Definition: The total amount of assets owned by the company at the end of the accounting period.\n        - Influencing Factors: Asset Acquisition, Asset Disposal, Asset Revaluation\n    D. Total Liabilities ($200 million)\n        - Definition: The total amount of debts the company is obligated to repay at the end of the accounting period.\n        - Influencing Factors: New Debt Issuance, Debt Repayment, Debt Restructuring\n    E. Shareholder Equity ($300 million)\n        - Definition: The total amount of equity belonging to shareholders at the end of the accounting period.\n        - Influencing Factors: Net Profit, Dividend Distribution, Capital Reserves\n    F. Cash Flow ($50 million)\n        - Definition: The total cash inflows and outflows of the company within a certain accounting period.\n        - Influencing Factors: Operating Activities, Investment Activities, Financing Activities\n    G. Debt Ratio (40%)\n        - Definition: The ratio of total liabilities to total assets, reflecting the company's debt level.\n        - Influencing Factors: Changes in Total Liabilities, Changes in Total Assets\n    H. Debt to Assets Ratio (0.4)\n        - Definition: The percentage of total liabilities to total assets, a measure of the company's financial leverage.\n        - Influencing Factors: Increases or decreases in assets and liabilities\n    I. Return on Equity (8%)\n        - Definition: Reflects the operational efficiency of shareholder equity, calculated as the ratio of net profit to average shareholder equity.\n        - Influencing Factors: Change in Net Profit, Change in Shareholder Equity\n\nIV. Additional Information\n    A. Future Outlook\n        1. Financial Strategy\n            - Description: Implement rigorous cost control measures to increase profitability. Focus on optimizing capital operations to maximize shareholder returns.\n        2. Investment Plans\n            - Description: Invest heavily in research and development (R&D) to develop new, high-yield crop varieties. Explore market expansion opportunities in emerging economies.\n        3. Risk Management\n            - Description: Identify climate change, market volatility, and supply chain disruptions as major financial risks. Implement risk management strategies, including diversification of crop varieties, insurance coverage, and adoption of sustainable farming practices.",
    "Generated Summary": "Green Fields Agriculture Co., established on March 18, 1995, is a publicly listed company based in Ruralville, Agriprovince, specializing in the production and distribution of organic fruits and vegetables.",
    "Generated Article": "In 2018, Green Fields Agriculture Co. experienced several significant events that impacted its financial performance and overall business operations. These events, along with their sub-events and the indicators involved, provide insights into the company's growth, challenges, and future prospects.\n\nOne of the key events was the debt restructuring undertaken in February 2018. This strategic move aimed to optimize the company's capital structure and resulted in a reduction of liabilities by $10 million. The debt restructuring had a positive impact on the company's financial condition, leading to reduced financial costs. This improvement was further supported by various sub-events throughout the year.\n\nIn January 2018, Green Fields Agriculture Co. implemented a new sales strategy, which resulted in a 20% increase in sales volume compared to the previous year. This increase in sales volume positively impacted the company's revenue and overall financial performance. Additionally, in March 2018, the company acquired 100 acres of farmland in a neighboring region. This acquisition aimed to secure a stable supply of organic fruits and vegetables, reducing dependency on third-party suppliers and leading to cost savings.\n\nTo further enhance profitability, the company implemented cost-cutting measures across various departments in April 2018, resulting in a 15% reduction in operational expenses. This cost reduction positively impacted the company's profitability and overall financial performance. In June 2018, Green Fields Agriculture Co. entered into a strategic partnership with a well-established organic retail chain, which resulted in an exclusive supplier agreement. This partnership strengthened the company's market presence, expanded its customer reach, and positively impacted sales revenue.\n\nIn September 2018, the company launched a new line of premium organic frozen fruits and vegetables to cater to the growing demand in the convenience food sector. This product diversification increased market share and generated additional revenue streams. Furthermore, in October 2018, Green Fields Agriculture Co. invested in an enterprise resource planning (ERP) system to streamline operations, improve efficiency, and optimize resource allocation. The implementation of the ERP system enhanced operational efficiency, reduced costs, and improved overall company performance.\n\nWhile the company experienced several positive events, it also faced challenges throughout the year. In August 2018, a severe drought in the region significantly reduced crop yields, leading to decreased revenues and profitability. This event highlighted the vulnerability of the company's operations to external factors such as climate change. Additionally, in December 2018, a labor strike occurred at the company's main production facility, resulting in production disruption and increased costs. This labor strike negatively impacted productivity, delayed deliveries, and further increased expenses.\n\nDespite these challenges, Green Fields Agriculture Co. continued to pursue growth opportunities. In March 2018, the company made a major investment of $50 million in Project Green Harvest, which broadened its business areas and enhanced profitability. In May 2018, the company completed the asset acquisition of Fresh Field Farms, with a total value of $25 million. This acquisition expanded the company's business scope and enhanced its market competitiveness. In September 2018, Green Fields Agriculture Co. completed the acquisition of 40% equity of Fertile Land Farms, further expanding its market share and enhancing control.\n\nLooking ahead, Green Fields Agriculture Co. has outlined its future outlook and strategies. The company aims to implement rigorous cost control measures to increase profitability and optimize capital operations to maximize shareholder returns. Additionally, the company plans to invest heavily in research and development (R&D) to develop new, high-yield crop varieties and explore market expansion opportunities in emerging economies. To mitigate financial risks, the company has identified climate change, market volatility, and supply chain disruptions as major concerns and plans to implement risk management strategies such as diversification of crop varieties, insurance coverage, and adoption of sustainable farming practices.\n\nIn conclusion, Green Fields Agriculture Co. experienced a series of events in 2018 that shaped its financial performance and business operations. The company's debt restructuring, sales growth, cost-cutting measures, strategic partnerships, product diversification, and investments contributed to its overall growth and enhanced market competitiveness. However, challenges such as the severe drought and labor strike highlighted the need for risk management strategies. With a focus on cost control, R&D, and risk mitigation, Green Fields Agriculture Co. is well-positioned to navigate future opportunities and challenges in the organic fruits and vegetables industry."
}