{
    "Report Type": "Corporate Governance Report",
    "Report Time": "2021",
    "Company Information": {
        "Name": "Energex Corporation",
        "Establishment Date": "January 1, 1990",
        "Main Business": "Energex Corporation is a leading energy company specializing in the exploration, production, and distribution of oil and gas resources worldwide.",
        "Registration Location": "Houston, Texas, United States",
        "Listing Status": "Listed on the New York Stock Exchange",
        "Industry": "Energy"
    },
    "Report Content": [
        {
            "Type": "Governance Structure",
            "Significant Events": [
                {
                    "Event": "Board of Directors Change",
                    "Time": "January, 2021",
                    "Description": "Mr. James Smith, a renowned energy industry expert, joined the Board of Directors of Energex Corporation, bringing extensive knowledge and experience to guide the company's strategic direction.",
                    "Impact": "The appointment of Mr. James Smith strengthens the board's expertise and may lead to strategic adjustments that positively impact the company's long-term development and shareholder interests.",
                    "Sub Events": [
                        {
                            "Event": "Major Oil Discovery",
                            "Time": "March, 2021",
                            "Description": "Energex Corporation announced a major oil discovery in a new offshore field in the Gulf of Mexico. The discovery is estimated to hold significant reserves of high-quality crude oil, positioning the company as a key player in the region's oil production.",
                            "Impact": "The major oil discovery enhances Energex Corporation's resource base, potentially increasing its revenue and market share. It also strengthens the company's competitive position in the energy industry."
                        },
                        {
                            "Event": "Investment in Infrastructure",
                            "Time": "April, 2021",
                            "Description": "Energex Corporation secured a substantial investment from a global infrastructure fund to support the expansion and upgrade of its production and distribution infrastructure. The investment will enable the company to enhance operational efficiency, increase production capacity, and improve the reliability of its energy supply.",
                            "Impact": "The investment in infrastructure empowers Energex Corporation to optimize its operations, increase its production capabilities, and satisfy growing energy demands. It boosts the company's competitiveness and market presence while creating potential opportunities for sustained growth."
                        },
                        {
                            "Event": "Strategic Partnership with a Technology Company",
                            "Time": "May, 2021",
                            "Description": "Energex Corporation entered into a strategic partnership with a leading technology company specializing in renewable energy solutions. The partnership aims to jointly develop and commercialize innovative technologies for clean energy production, storage, and distribution, aligning with the global trend towards sustainable energy sources.",
                            "Impact": "The strategic partnership enhances Energex Corporation's access to cutting-edge technologies and expertise in renewable energy. It positions the company to capitalize on the growing demand for clean energy solutions, diversify its energy portfolio, and align with sustainability goals to attract environmentally-conscious investors."
                        },
                        {
                            "Event": "Acquisition of a Competitor",
                            "Time": "June, 2021",
                            "Description": "Energex Corporation completed the acquisition of a major competitor, expanding its market presence and consolidating its position as a leading player in the energy industry. The acquired company possesses complementary assets, including oil and gas fields, production facilities, and a distribution network.",
                            "Impact": "The acquisition strengthens Energex Corporation's market power, increases its asset base, and improves economies of scale. It enhances the company's ability to negotiate favorable contracts, optimize resource allocation, and achieve cost efficiencies, ultimately benefiting shareholders through increased value and profitability."
                        }
                    ]
                },
                {
                    "Event": "Shareholders' Meeting Resolution",
                    "Time": "April, 2021",
                    "Description": "During the annual shareholders' meeting, Energex Corporation announced a resolution to appoint a new audit firm and passed a resolution to expand the board of directors to include two additional independent directors. The shareholders also voted in favor of implementing an executive compensation policy tied to sustainable performance targets.",
                    "Impact": "The decisions made at the shareholders' meeting directly influence Energex Corporation's governance structure, future operational strategies, and shareholder rights, strengthening corporate oversight and alignment with shareholder interests."
                },
                {
                    "Event": "Compliance and Regulatory Updates",
                    "Time": "May, 2021",
                    "Description": "Energex Corporation proactively updated its corporate governance practices to align with new securities laws, corporate laws, and industry regulations. The company implemented stricter internal controls, improved whistleblower protection mechanisms, and enhanced procedures for reporting potential conflicts of interest.",
                    "Impact": "The compliance and regulatory updates ensure Energex Corporation's adherence to the latest legal requirements, mitigating legal risks and safeguarding the interests of the company and its shareholders."
                },
                {
                    "Event": "Risk Management Measures",
                    "Time": "June, 2021",
                    "Description": "Energex Corporation updated its risk management framework to incorporate emerging risks related to climate change, cybersecurity, and geopolitical uncertainties. New risk mitigation strategies, such as diversifying energy sources and investing in advanced technology for data protection, were implemented.",
                    "Impact": "The enhanced risk management measures strengthen Energex Corporation's resilience to internal and external risks, ensuring continuous operation and promoting stable and sustainable development in a rapidly evolving energy landscape."
                },
                {
                    "Event": "Ethics and Integrity Incidents",
                    "Time": "August, 2021",
                    "Description": "Energex Corporation experienced an unfortunate incident where an employee was found involved in a conflict of interest. The company undertook swift disciplinary actions, including termination of the employee, reinforcing its commitment to maintaining the highest ethical standards.",
                    "Impact": "While the incident may have temporarily impacted Energex Corporation's reputation, the prompt and decisive actions demonstrate the company's commitment to ethics and integrity, minimizing potential damage and maintaining trust with investors, customers, and partners."
                },
                {
                    "Event": "Sustainability and Social Responsibility Initiatives",
                    "Time": "September, 2021",
                    "Description": "Energex Corporation made significant strides in its sustainability and social responsibility initiatives. The company achieved a 20% reduction in greenhouse gas emissions, implemented community engagement programs to support renewable energy projects, and established a foundation to focus on education and environmental conservation.",
                    "Impact": "The sustainability and social responsibility initiatives undertaken by Energex Corporation enhance the company's public image, market competitiveness, and long-term sustainable development, fostering positive stakeholder relationships and driving value creation."
                },
                {
                    "Event": "Senior Management Changes",
                    "Time": "October, 2021",
                    "Description": "Ms. Emily Davis, an accomplished executive with a strong background in operational efficiency, assumed the role of Chief Operating Officer at Energex Corporation. With her expertise, the company aims to streamline operations, optimize processes, and drive performance improvements.",
                    "Impact": "The appointment of Ms. Emily Davis as the new Chief Operating Officer may lead to operational focus adjustments and strategic priorities, potentially impacting short-term performance and shaping Energex Corporation's long-term development trajectory."
                },
                {
                    "Event": "Corporate Governance Policy Revision",
                    "Time": "December, 2021",
                    "Description": "Energex Corporation revised its corporate governance policies to enhance transparency, accountability, and stakeholder engagement. The updates include increased disclosure requirements, improved shareholder rights, and the establishment of a board committee dedicated to sustainability.",
                    "Impact": "The revised corporate governance policies enhance transparency, accountability, and stakeholder confidence, thereby boosting investor trust and long-term sustainability."
                }
            ],
            "Involved Indicators": [
                {
                    "Indicator": "Information Disclosure",
                    "Description": "Energex Corporation follows the best practices of information disclosure, ensuring timely and accurate reporting to stakeholders. The company maintains a dedicated investor relations team responsible for dissemination of material information in compliance with applicable regulations.",
                    "Value": "Energex Corporation maintains a 100% compliance rate for timely information disclosure and has established a robust system to ensure accurate and transparent reporting."
                },
                {
                    "Indicator": "Related Transactions",
                    "Description": "Energex Corporation has implemented stringent policies, procedures, and measures to ensure fairness and compliance of related transactions. The company maintains a dedicated governance committee that reviews and approves related party transactions to prevent conflicts of interest.",
                    "Value": "Energex Corporation successfully adheres to strict policies and procedures related to related transactions, minimizing the risk of unfair practices and preserving the trust of shareholders and stakeholders."
                },
                {
                    "Indicator": "Internal Control",
                    "Description": "Energex Corporation has established a comprehensive internal control framework that covers financial and operational aspects. Regular audits are conducted to assess the effectiveness of internal controls and identify areas for improvement. The company maintains an independent internal audit department to monitor and evaluate the implementation of internal control policies.",
                    "Value": "Energex Corporation's internal control framework is robust and effective, ensuring accurate financial reporting, risk mitigation, and compliance with applicable laws and regulations."
                }
            ]
        }
    ],
    "Additional Information": [
        {
            "Name": "Governance Improvement Plans",
            "Content": [
                {
                    "Name": "Strengthening the Function of the Board of Directors and Supervisory Board",
                    "Description": "Energex Corporation is committed to enhancing the efficiency and effectiveness of the board of directors and the supervisory board. The company plans to provide regular training programs to enhance directors' abilities, increase the proportion of independent directors, and optimize the decision-making processes to drive corporate governance excellence."
                },
                {
                    "Name": "Enhancing Transparency and Quality of Information Disclosure",
                    "Description": "Energex Corporation recognizes the importance of transparent and high-quality information disclosure. The company aims to improve its information disclosure process and standards by adopting advanced digital reporting tools, ensuring timely, accurate, and comprehensive reporting to all stakeholders and fostering trust and transparency."
                }
            ]
        },
        {
            "Name": "Risk Management Strategy",
            "Content": [
                {
                    "Name": "Strengthening the Internal Control System",
                    "Description": "Energex Corporation is dedicated to establishing and continuously improving its internal control system. By conducting regular risk assessments, monitoring financial and operational risks, and implementing appropriate controls, the company aims to enhance risk identification, management, and reporting, ensuring business continuity and safeguarding shareholder value."
                },
                {
                    "Name": "Integrating Sustainable Development and Social Responsibility",
                    "Description": "Energex Corporation is committed to integrating sustainable development and social responsibility into its overall strategy. By identifying and managing sustainability-related risks and opportunities, the company seeks to create long-term value and contribute to a more sustainable and responsible energy sector."
                }
            ]
        }
    ],
    "Generated Outline": "I. Introduction\n    A. Company Information\n        1. Name: Energex Corporation\n        2. Establishment Date: January 1, 1990\n        3. Main Business: Exploration, production, and distribution of oil and gas resources worldwide\n        4. Registration Location: Houston, Texas, United States\n        5. Listing Status: Listed on the New York Stock Exchange\n        6. Industry: Energy\n    B. Report Type: Corporate Governance Report\n    C. Report Time: 2021\n\nII. Governance Structure\n    A. Board of Directors Change (January, 2021)\n        1. Event: Mr. James Smith joined the Board of Directors\n           - Description: Mr. James Smith, a renowned energy industry expert, joined the Board of Directors, bringing extensive knowledge and experience.\n           - Impact: Strengthening the board's expertise and potential strategic adjustments for long-term development and shareholder interests.\n        2. Major Oil Discovery (Sub Event - March, 2021)\n           - Description: Energex Corporation announced a major oil discovery in the Gulf of Mexico, positioning itself as a key player in the region's oil production.\n           - Impact: Enhancement of resource base, increased revenue, and improved competitive position.\n        3. Investment in Infrastructure (Sub Event - April, 2021)\n           - Description: Energex Corporation secured a substantial investment to support the expansion and upgrade of its production and distribution infrastructure.\n           - Impact: Enhanced operational efficiency, increased production capacity, improved reliability of energy supply, and potential growth opportunities.\n        4. Strategic Partnership with a Technology Company (Sub Event - May, 2021)\n           - Description: Energex Corporation entered into a strategic partnership with a leading technology company specializing in renewable energy solutions.\n           - Impact: Access to cutting-edge technologies, diversification of energy portfolio, alignment with sustainability goals, and attraction of environmentally-conscious investors.\n        5. Acquisition of a Competitor (Sub Event - June, 2021)\n           - Description: Energex Corporation completed the acquisition of a major competitor, expanding market presence and consolidating its position in the energy industry.\n           - Impact: Strengthened market power, increased asset base, improved economies of scale, and increased shareholder value and profitability.\n    B. Shareholders' Meeting Resolution (April, 2021)\n        - Description: Appointment of a new audit firm, expansion of the board to include two additional independent directors, and implementation of an executive compensation policy tied to sustainable performance targets.\n        - Impact: Influence on governance structure, operational strategies, and shareholder rights, strengthening corporate oversight and alignment with shareholder interests.\n    C. Compliance and Regulatory Updates (May, 2021)\n        - Description: Proactive update of corporate governance practices to align with new securities laws, corporate laws, and industry regulations.\n        - Impact: Adherence to legal requirements, mitigation of legal risks, and safeguarding of company and shareholder interests.\n    D. Risk Management Measures (June, 2021)\n        - Description: Updated risk management framework to incorporate emerging risks related to climate change, cybersecurity, and geopolitical uncertainties.\n        - Impact: Strengthened resilience, continuous operation, and stable development in a rapidly evolving energy landscape.\n    E. Ethics and Integrity Incidents (August, 2021)\n        - Description: Incident involving an employee's conflict of interest, followed by swift disciplinary actions.\n        - Impact: Demonstration of commitment to ethics and integrity, minimizing potential damage to reputation and maintaining trust with stakeholders.\n    F. Sustainability and Social Responsibility Initiatives (September, 2021)\n        - Description: Accomplishments in sustainability and social responsibility initiatives, including greenhouse gas emissions reduction and community engagement programs.\n        - Impact: Enhanced public image, market competitiveness, stakeholder relationships, and value creation.\n    G. Senior Management Changes (October, 2021)\n        - Description: Appointment of Ms. Emily Davis as Chief Operating Officer to drive operational focus adjustments and performance improvements.\n        - Impact: Potential short-term performance impact and influence on long-term development trajectory.\n    H. Corporate Governance Policy Revision (December, 2021)\n        - Description: Revision of corporate governance policies to enhance transparency, accountability, and stakeholder engagement.\n        - Impact: Enhanced transparency, accountability, stakeholder confidence, investor trust, and long-term sustainability.\n\nIII. Involved Indicators\n    A. Information Disclosure\n        - Description: Following best practices in information disclosure, ensuring timely and accurate reporting, and maintaining a dedicated investor relations team.\n        - Value: 100% compliance rate for timely information disclosure and establishment of a robust reporting system.\n    B. Related Transactions\n        - Description: Implementation of stringent policies, procedures, and measures to ensure fairness and compliance of related transactions, along with a dedicated governance committee.\n        - Value: Adherence to strict policies, minimizing the risk of unfair practices and preserving shareholder and stakeholder trust.\n    C. Internal Control\n        - Description: Establishment of a comprehensive internal control framework, regular audits, and an independent internal audit department.\n        - Value: Robust and effective internal control framework ensuring accurate financial reporting, risk mitigation, and compliance.\n\nIV. Additional Information\n    A. Governance Improvement Plans\n        1. Strengthening the Function of the Board of Directors and Supervisory Board\n           - Description: Regular training programs, increased proportion of independent directors, and optimized decision-making processes to drive corporate governance excellence.\n        2. Enhancing Transparency and Quality of Information Disclosure\n           - Description: Adoption of advanced digital reporting tools, ensuring timely, accurate, and comprehensive reporting to foster trust and transparency.\n    B. Risk Management Strategy\n        1. Strengthening the Internal Control System\n           - Description: Regular risk assessments, monitoring of financial and operational risks, and implementation of appropriate controls to enhance risk management and reporting.\n        2. Integrating Sustainable Development and Social Responsibility\n           - Description: Identification and management of sustainability-related risks and opportunities to create long-term value and contribute to a more sustainable energy sector.\n\nNote: This is an outline for a Corporate Governance Report based on the JSON provided. The full report can be developed by expanding and elaborating on each point.",
    "Generated Summary": "Energex Corporation, established on January 1, 1990 in Houston, Texas, United States, is a globally recognized energy company focused on the exploration, production, and distribution of oil and gas resources, with its shares listed on the New York Stock Exchange.",
    "Generated Article": "In 2021, Energex Corporation experienced several significant events that shaped its corporate governance and strategic direction. One notable event was the addition of Mr. James Smith to the Board of Directors in January. Mr. Smith, a renowned energy industry expert, brought extensive knowledge and experience to the board, strengthening its expertise and potentially leading to strategic adjustments for long-term development and shareholder interests.\n\nIn March, Energex Corporation announced a major oil discovery in the Gulf of Mexico, positioning itself as a key player in the region's oil production. This discovery had a significant impact on the company, enhancing its resource base, increasing revenue, and improving its competitive position.\n\nIn April, Energex Corporation secured a substantial investment to support the expansion and upgrade of its production and distribution infrastructure. This investment had a positive impact on the company, enhancing operational efficiency, increasing production capacity, improving the reliability of energy supply, and potentially opening up growth opportunities.\n\nIn May, Energex Corporation entered into a strategic partnership with a leading technology company specializing in renewable energy solutions. This partnership provided Energex with access to cutting-edge technologies, diversified its energy portfolio, aligned with sustainability goals, and attracted environmentally-conscious investors.\n\nAnother significant event occurred in June when Energex Corporation completed the acquisition of a major competitor. This acquisition expanded the company's market presence and consolidated its position in the energy industry. It resulted in strengthened market power, increased asset base, improved economies of scale, and increased shareholder value and profitability.\n\nIn April, during the shareholders' meeting, several resolutions were passed that had a significant impact on the company's governance structure and operational strategies. These resolutions included the appointment of a new audit firm, the expansion of the board to include two additional independent directors, and the implementation of an executive compensation policy tied to sustainable performance targets. These resolutions aimed to strengthen corporate oversight and align the company with shareholder interests.\n\nIn May, Energex Corporation proactively updated its corporate governance practices to align with new securities laws, corporate laws, and industry regulations. This proactive approach ensured adherence to legal requirements, mitigated legal risks, and safeguarded the interests of the company and its shareholders.\n\nIn June, Energex Corporation updated its risk management framework to incorporate emerging risks related to climate change, cybersecurity, and geopolitical uncertainties. This update aimed to strengthen the company's resilience, ensure continuous operation, and promote stable development in a rapidly evolving energy landscape.\n\nIn August, an incident involving an employee's conflict of interest occurred, but Energex Corporation swiftly took disciplinary actions to address the issue. This incident demonstrated the company's commitment to ethics and integrity, minimizing potential damage to its reputation and maintaining trust with stakeholders.\n\nIn September, Energex Corporation achieved significant accomplishments in sustainability and social responsibility initiatives. These initiatives included greenhouse gas emissions reduction and community engagement programs. These efforts enhanced the company's public image, market competitiveness, stakeholder relationships, and value creation.\n\nIn October, Ms. Emily Davis was appointed as the Chief Operating Officer of Energex Corporation. Her appointment aimed to drive operational focus adjustments and performance improvements, potentially impacting the company's short-term performance and influencing its long-term development trajectory.\n\nIn December, Energex Corporation revised its corporate governance policies to enhance transparency, accountability, and stakeholder engagement. This revision aimed to enhance transparency, increase accountability, boost stakeholder confidence, attract investor trust, and promote the company's long-term sustainability.\n\nThroughout the year, Energex Corporation demonstrated a commitment to corporate governance excellence. The company maintained a 100% compliance rate for timely information disclosure, established a robust reporting system, implemented stringent policies and procedures to ensure fairness and compliance in related transactions, and established a comprehensive internal control framework with regular audits and an independent internal audit department. These indicators showcased the company's dedication to transparency, accountability, accurate financial reporting, risk mitigation, and compliance.\n\nLooking ahead, Energex Corporation has outlined several governance improvement plans. These plans include strengthening the function of the Board of Directors and Supervisory Board through regular training programs, increasing the proportion of independent directors, and optimizing decision-making processes. The company also aims to enhance transparency and the quality of information disclosure by adopting advanced digital reporting tools to ensure timely, accurate, and comprehensive reporting.\n\nIn terms of risk management, Energex Corporation plans to strengthen its internal control system through regular risk assessments, monitoring of financial and operational risks, and the implementation of appropriate controls. The company also aims to integrate sustainable development and social responsibility into its risk management strategy by identifying and managing sustainability-related risks and opportunities to create long-term value and contribute to a more sustainable energy sector.\n\nOverall, Energex Corporation has demonstrated a strong commitment to corporate governance, sustainability, and social responsibility throughout 2021. The company's strategic initiatives, acquisitions, partnerships, and governance improvements have positioned it for continued success in the energy industry."
}